PageNumber,Text,ISBNs
33,"Feminist Bookstore News
Harbaugh find it, order it? No problem. very difficult time small presses are having, the
Kagawa’s relief was obvious. growth of monopolies in publishing, and now the
“Yve been looking all over for it,” she explained. growth of the hyper store.”
“ I asked aboutit at the UO Bookstore and they said it “It’s incredibly difficult to get a book published
would take seven weeks. We're talking about the without a large built-in constituency,” said Lauren
beginning of next term.” Kessler, a UO journalism professor and published author.
Joey Pettiti, an insurance agent who logs consid- But the argument doesn’t only come down to
erable road time, likes to stop in Mother Kali’s for exposure and economics. It’s a matter of ideas, sup-
books-on-tape and CDs. “I like Black women authors porters insist.
and I know they'll have a wide selection,” she said, Not only does the domination of giant chain
“And then there’s always Izzie. I'll go in and say, stores centralize decision-making about what their
‘What's your favorite book this month?’ She knows stores stock, in the end, “It means a narrowing, a
me and always has a good recommendation.” constriction of what is available for alternative
Roberta, a customer who stops in regularly for voices,” Acker added.
lesbian mysteries, observed that while larger book- Feminist and other independent bookstores cre-
stores are beginning to stock the authors she likes, ate a necessary forum for dissident voices, Kessler
they don’t tend to carry the latest titles. argues. “One of the things we take such pride in about
In recent years, Mother Kali’s has joined feminist the United States is our marketplace of ideas,” she
bookstores across the country in feeling that competi- said, “In order for that to be real — it’s not enough that
tion. This month, the store held a fund-raising benefit people are just thinking those ideas, it’s that they’re
to help with a financial crunch — not the first, and available for consumption. That’s why places that
probably not the last. take chances, like Mother Kali’s, are important. We
Harbaugh points to several historic independent don’t stop having challenging ideas. But unless it’s
bookstores in major cities that already have closed. possible to see them, hear them and feel them, it’s like
“And that’s an alarming trend,” said Joan Acker, a UO the tree falling in the forest.”
sociology professor whose books are carried at
Mother Kali’s. “The book market is very troubled Reprinted with permisson from The Register-Guard,
now,” Acker said. “The emphasis on best-sellers, the Eugene OR, Sunday November 12, 1995. O
N
IT ISBN: 1-879198-17-7
$19.95, 6""x 9"" paper, 250 pages
TK HN EO W PL OE SD ITG IVE, E ID PUEA BLS I S& H E T RRENDS, INC. A Dp ir sil t r19 i9 b6 utor: InBook/Login ROUS enye
May/June 1996
This content downloaded from
(cid:0)(cid:0)(cid:0)(cid:0)(cid:0)(cid:0)(cid:0)(cid:0)(cid:0)(cid:0)(cid:0)(cid:0)74.108.41.47 on Thu, 28 Mar 2024 00:53:40 +00:00(cid:0)(cid:0)(cid:0)(cid:0)(cid:0)(cid:0)(cid:0)(cid:0)(cid:0)(cid:0)(cid:0)(cid:0)
All use subject to https://about.jstor.org/terms",['1-879198-17-7']
34,"Feminist Bookstore News
Publisher Profile:
Sister Vision Press
How We
Did It
Visionary
publishers Silvera
and Martin get
the words out
approximately ten books and we
decided to pursue core funding from
the Canada Council, for which we
needed 17 titles by Canadian writers.
Since 1991 we have published seven
or eight books a year, and we cur-
rently have 55 titles in print.”
Challenges: According to Martin:
“We spend half the time fund-raising
and half the time working on the books.
But what continues to be the most chal-
More than ten years ago visual artist Stephanie lenging thing is getting the kind of
Martin, 47 (left), and writer Makeda Silvera, 41 (right), exposure and readership we need to have in order to
cofounders of Sister Vision Press in Toronto, started continue publishing.”
the first women-of-color publishing house in Canada. What Makes Them Proud: Concludes Martin:
Here's how: “We did something that hadn't been done before. It’s
Background: Says Silvera: “We met through the amazing. A group of women — many of whom might
Sistren Theatre Collective in Jamaica in the 1970s dur- never have been heard if we weren’t publishing them
ing the Michael Manley era. We both had a passion for — are being read, and that helps sustain our vision
literature.” Adds Martin: “If we had any concept of and helps us continue doing what we're doing. It
how difficult this would be, we probably wouldn't definitely keeps you going when you're feeling really
have done it. Makeda was trying to publish Silenced, weary, and that’s quite a wonderful thing.” Adds
oral narratives of Caribbean domestic workers in Silvera: “What sustains me is a great passion for the
Canada, which she edited. We looked at that success work. It is a very large part of my life. I could never
and saw what we had to do. With ten bucks, a name imagine giving up publishing. This has been more
and a dream, we started Sister Vision. In 1985 we put than a labor of love.”
out our first book, Speshal Rikwes, a dub poetry collec-
tion by Ahdri Zhina Mandiela. [Dub poetry is a kind Reprinted with permission from the March 1996 issue
of spoken-word reggae.] By 1990 we had published of Essence. Photo by Alvaro Goveia. O
31 May/June 1996
This content downloaded from
(cid:0)(cid:0)(cid:0)(cid:0)(cid:0)(cid:0)(cid:0)(cid:0)(cid:0)(cid:0)(cid:0)(cid:0)74.108.41.47 on Thu, 28 Mar 2024 00:53:40 +00:00(cid:0)(cid:0)(cid:0)(cid:0)(cid:0)(cid:0)(cid:0)(cid:0)(cid:0)(cid:0)(cid:0)(cid:0)
All use subject to https://about.jstor.org/terms",[]
35,"Feminist Bookstore News
WOMEN POLITICIANS
AND THE MEDIA ° Politicians
MARIA BRADEN
° Reporters
“Braden shows by living examples of
how far we have gone and how many ° Photographers
fg oa rp ms et rh e Wre h is tt ei l l H oa ur se e.” — PL reiz s s C Sa er cp re en tt ae rr y, and a ® ÅCÍIVISÉS
f Co au un cud ser of the National Women’s Political ° Soldiers
BARBARA BROOKS TOMBLIN “[Braden] documents a double standard,
More than 60,000 women served evident in the news, with stories about
in the Army Nurse Corps during women frequently mentioning their DELIA WEBSTER
WWII. These volunteers cared for appearance, their families, and their AND THE UNDER-
sick and wounded soldiers in every domestic abilities.”—Library Journal GROUND RAILROAD
theater of the war. Their stories of Illus., $14.95 paper, $29.95 cloth
hardship paint a fuller picture of RANDOLPH PAUL RUNYON
a lt loh we a f np oc re ter os i no d ua en. r n sd le iS sse t,fc u u Aar ll ni fn d rmg i cti al he niq t e -u a Ar a dyl m e c e p i rra s iay i cn o ank n PH H OO TW N OO JTI O L T UE OA R R NBN E A E D LA IST “ tA r ub ae l a y a u spt i f a eu s dxl sl ey i e o tm ew n cr pai ttt l it ie ve f n ei e .st ”ste — l ol i rn t Tg y h h . eo of m R hu ai ssn ty o Ho rn .ian
women, are highlights. DIANNE HAGAMAN Appleton, Jr., editor, Register of
Illus., $29.95 cloth the Kentucky Historical Society
c“ oB mri pll ei la ln int, g . ”m —o Dv oi un gg l a sa n d H a rv pis eu ra ,lly “Re sv ue ra rls o u t nh de e d in tt hr eig u ae ts tt imha et s
OUT OF SIGHT, Duquesne University hesitant abolitionist Delia
OUT OF MIND “A beautiful book—beautiful in its Webster.”—Edward J.
Homeless Children and Families pictures, the clarity of its exposi- Renehan, Jr., author of The
in Small-Town America tion, and the gentle boldness of a Secret Six: The True Tale of the
YVONNE M. VISSING pn hew y. ” —wa Hy a r vto ey s e Me o lt oh tr co hu , g h U n p ivh eo rt so ig tyra - of Men w W ithh Jo o h nC o Bn ros wp nired
“We are so busy that we are ex- California at Santa Barbara Illus., $29.95 cloth
hausted, showing nothing better Illus., $17.95 paper, $39.95 cloth
for us at the end of the day. 800/839-6855
. . . [Before,] we were able to help
others, and now we can't even
help ourselves.”—Judy, homeless
mother of three, quoted in the book
Illus., $16.95 paper, $39.95 cloth
May/June 1996 32 Volume 19 Number 1
This content downloaded from
(cid:0)(cid:0)(cid:0)(cid:0)(cid:0)(cid:0)(cid:0)(cid:0)(cid:0)(cid:0)(cid:0)(cid:0)74.108.41.47 on Thu, 28 Mar 2024 00:53:40 +00:00(cid:0)(cid:0)(cid:0)(cid:0)(cid:0)(cid:0)(cid:0)(cid:0)(cid:0)(cid:0)(cid:0)(cid:0)
All use subject to https://about.jstor.org/terms",[]
36,"Feminist Bookstore News
Taking Care of Business
By Dorothy Holland out the contract and send it in (it’s too easy to put it off
and forget completely). LB will issue a credit to your
There are several co-op opportunities for feminist account.
booksellers this Summer season — some that will Hint #1: A stack of books almost always sells
even work for our smaller stores. As a result of the better than one or two, so you may actually sell all ten
ABA suits against publishers (or for whatever reasons), of the Pogregin memoirs — but if they aren't moving,
many publishers are adjusting their policies for co-op waste no time in returning the excess. What the hey, it
dollars. Little, Brown, Putnam and PGW have all was worth a try, huh?
come up with programs that are extremely friendly Hint #2: It has been my experience that LB is
for small independent stores. These programs are not willing to bend a lot on this policy — like do the above
based on previous year’s purchases or on huge front- for only five books, or for a shelf talker, or an in-store
list orders. Many of us will be able to use these flyer. Try it.
programs to our advantage. Hint #3: If you do put a blurb in your newsletter, slip
in the cover of the book; it’s worth an extra $50 to LB.
Little, Brown Hint #4: Keep in mind that this co-op is over and
Little, Brown currently has one of the easiest above your normal co-op pool — but it is limited to $1,000!
systems. If you haven’t been ordering direct from LB, (And you know each Borders store will get its $1,000. I'd
now may be the time to start. If you order ten copies like to see every feminist store collect at least some.)
of any frontlist title and put it in your newsletter or
make a display, they'll give you between $50 and $100! Putnam
In my figuring, they are almost paying you to pur- Putnam also has a friendly plan, although they are
chase books. Here are the titles I think you may want more selective on the titles you can use. They allow $100
to consider using: Getting Over Getting Older by Letty co-op with purchase of ten copies of selected titles for
Cottin Pogrebin; Let's Face the Music and Die by Sandra newsletter, display or print advertising. Titles feminist
Scoppettone — a lesbian mystery; Woman's Best stores might “do” are: Firestorm by Nevada Barr; Shelter
Friend: A Celebration of Dogs and Their Women by Bar- of Each Other, the new Mary Pipher — with Reviving
bara Cohen and Louise Taylor; Waking Up, Fighting
Back by Roberta Altman; and Girls With the Grand- should do well; and Cloister Walk by Kathleen Norris (if
mother Faces by Frances Weaver. her previous titles did well for you).
Dorothy’s simplified instructions for Little, Dorothy’s simplified instructions for Putnam
Brown co-op: Place an order and ask for co-op contracts co-op: Place an order for ten copies of each title you
at the same time. When you have the bòoks, make a want to use, asking for a co-op contract as you do so.
sweet little display (and take a picture, if you can — but When you get the books, make the display or news-
it’s not necessary) and/or put a 50-word blurb in your letter blurb (Putnam really wants you to do the
newsletter. Immediately upon publication / display, fill See Co-op, page 46.
33 May/June 1996
This content downloaded from
(cid:0)(cid:0)(cid:0)(cid:0)(cid:0)(cid:0)(cid:0)(cid:0)(cid:0)(cid:0)(cid:0)(cid:0)74.108.41.47 on Thu, 28 Mar 2024 00:53:40 +00:00(cid:0)(cid:0)(cid:0)(cid:0)(cid:0)(cid:0)(cid:0)(cid:0)(cid:0)(cid:0)(cid:0)(cid:0)
All use subject to https://about.jstor.org/terms",[]
37,"I CHANGE, I CHANGE
Poems by Barbara Deming
Edited by Judith McDaniel Preface by Grace Paley
She marched to end segregation in the 50s
She went to Vietnam on a peace mission in the 60s
She joined the Seneca women’s encampment in the 70s
All the while she was writing poetry to the women who captivated and inspired her.
Compiled by Barbara shortly before her death, this volume of previously unpublished
poems provides fresh insight into the personal passions and importance of love in the life
of one of our most respected social justice activists. With an informative introduction
by Judith McDaniel.
ISBN 0-934678-72-3 $12.95 cloth
TALES FROM THE DYKE SIDE WINOSWE?PT
by Jorjet Harper by Magdalena Zschokke
The author of Lesøomania is back! More humor- A beautiful tale of women’s sailing pzs
| ous and thought-provoking columns highlighting adventures on the high seas from an |:
the lesbian cultural panorama. Astraea Lesbian Fund Emerging |
Among the objects of her lesboma- Fiction Writer's Award winner. Mara,
nia cale gsazet t his trimee: sSexe taoyrs; tcheh | Z öe oandn Ol ivi a fall rseeuk tihet ifndelpein- s
El eols besyi a until es lainzd a _r| ddesnc;e obf rsaeiliangk yfeta sytea rn c feorr weoamle n ’s: a :
monog ia m é y„ ; c oamnmdu n itthy e a n d“ S ctoamrp a sTsirone k i”n a: wËorld dominated |
episode you wish you'd seen. by rich and powerful men. Each brings a personal
Come.meet.the author at ABA, quest to her voyages, together they share their let-
_ Jorjet Harper is smart hilarious and _| ters, dreams and connection to the stars.
depraved. —Alison Bechdel | A stunning debut novel.
ISBN 0-934678-71-5 $10.95 paper ISBN 0-934678-73-1 $10.95 paper
May/June 1996 34 Volume 19 Number 1
This content downloaded from
(cid:0)(cid:0)(cid:0)(cid:0)(cid:0)(cid:0)(cid:0)(cid:0)(cid:0)(cid:0)(cid:0)(cid:0)74.108.41.47 on Thu, 28 Mar 2024 00:53:40 +00:00(cid:0)(cid:0)(cid:0)(cid:0)(cid:0)(cid:0)(cid:0)(cid:0)(cid:0)(cid:0)(cid:0)(cid:0)
All use subject to https://about.jstor.org/terms","['0-934678-72-3', '0-934678-71-5', '0-934678-73-1']"
38,"Feminist Bookstore News
Selling My
Bookstore
Part Il
By Suzanne
Two Sisters Bookshop /Menlo Park, CA
Four months have passed since I decided to sell
my bookstore. At that time I was excited about my
new plans, feeling good about my completion at Two
Sisters, and terrified of permanently entering the
abyss when I left the store. While I hadn't made a
general announcement of my plans in my newsletter,
I did begin to tell women. I gave myself lots of “proc-
essing” time this winter, expecting that by spring the
action would pick up energy as I would have done
inventory, arrived at a selling price and announced
my leaving in the newsletter.
Getting to a selling price has been intense. In the
beginning I found myself inordinately preoccupied
with proving that the store was worth buying. I have
a plethora of women interested in buying it, and many myself that nobody will want my store anyway
more worried that it will close or be radically because it doesn’t make much money, so I'd better ask
changed, and I'm worried no one will think it’s a just a small amount over liquidation value and pray I
worthy enterprise. My mouth says I want to be fair
and equitable and ask a price that won't jeopardize ing. Yak, Yak, Yak go my internal voices. As boring as
the continuing viability of the store. No sooner are they are, they are still tough on my stomach lining.
these pretty words out of my mouth than my greedy People tell me to get some outside help from
monster demands that I get everything I can. “Go for someone who will be more objective. But, I don’t
highest price possible,”she says, “the store is all you want someone more objective. I want to price my
have left of value. Yowl never have anything else loving creation all by myself without external formu-
worthwhile to trade on, so get it all now.” Then I flip las or professional opinions. So I started with our
back again to the other side of the coin reminding inventory number as of the first of the year. Next, I
35 May/June 1996
This content downloaded from
(cid:0)(cid:0)(cid:0)(cid:0)(cid:0)(cid:0)(cid:0)(cid:0)(cid:0)(cid:0)(cid:0)(cid:0)74.108.41.47 on Thu, 28 Mar 2024 00:53:40 +00:00(cid:0)(cid:0)(cid:0)(cid:0)(cid:0)(cid:0)(cid:0)(cid:0)(cid:0)(cid:0)(cid:0)(cid:0)
All use subject to https://about.jstor.org/terms",[]
39,"Feminist Bookstore News
listed all the assets like business equipment and wailing. How could I have been so righteous, rigid
furnishings. My first list was incomplete and I con- and self-defeating by not taking credit cards all these
sidered only their liquidation values in the case that years? Not only could I have made a lot more money
I can't sell the store and will have to close it. This was for myself and my employees, but I'd be able to sell
a most depressing number. Then I added this asset my store for more because I could show a stronger
liquidation value to the current inventory cost and revenue history. I always thought I was a competent
came up with a total that was so pathetic I ran sob- businesswoman, and suddenly I felt like a stupid
bing to my pillows. How could all these years of love amateur. This process was a rough one but it too
and work amount to less than what I put in it? I passed, and I decided on a price about a week before
hadn't discovered “good will” yet. I sat with my the newsletter arrived in customers’ hands. And no
disappointment for weeks before I bounced back and it wasn't either of the two highest numbers. I pulled
dovein again. I started looking for ways to inflate the Tarot cards, asked for guidance in dreams, begged
inventory and/or the assets so I could raise my sell- my bookkeeper for her opinion, and in the end I let
ing price. Then I discovered I had left out about half my gut guide me. The two higher prices made my
the assets. stomach turn with greed-guilt, so
My pricing process often I went with the middle ground. I
reminded me of craftswomen who, also put together a complete pack-
over the years, would bring in their . age of store history, financial
precious creations to sell at the store information, lease and operating
and didn’t know how to value them. information to give to serious buy-
They always looked to me to give ers. I have given that package to
them the answer. I encouraged them five women already.
to set their own value on their work, I am screening interested buy-
saying, “Pick a price and you'll ers on the phone first, to get a sense
know if it isn’t right about two steps of their character and intentions,
out the front door. If you've under- and I also give them a few facts and
valued your creation (and therefore numbers to chew on and decide
abandoned yourself) you'll get that whether they want to go forward
old familiar feeling, a pit in your in the process. If they call back, we
stomach.” So now it’s my turn to talk again and I evaluate how seri-
walk my talk and put a value on the ous they are. If they fit my buyer
biggest craft project of my life. It profile, I send them my big packet
feels like hanging a price tag around of information. My next step, for
my own neck. women who have read and
When I had narrowed my price down to three digested the packet and are still interested, is to bring
choices, I called two women who had sold a similar them together for a Q & A meeting with me and my
store across the Bay. They gave me some background bookkeeper. I'm excited about these meetings; there
on their store, and shared a formula they had used to may even be a partnership that emerges.
arrive at a selling price (two times net earnings plus I have had at least 25 calls and the newsletter is
inventory). I loved this formula because when I still arriving, so there will probably be more. I'm
applied it to Two Sisters, the number was higher than excited by all the interest and, while I’m getting fried
the highest price Id been considering. I knew at that from all the talking, these conversations help me clar-
point what formulas were used for, to justify what you ify my own intentions. Like a buyer profile. I hadn't
already decided you want. really thought about this much, guess I expected that
During this conversation I also learned that only the “right” women would be interested, but I'm
their annual revenues were $100,000 higher than finding that isn’t so. When a woman talks about
mine and it was all from credit card sales. This bit of changing the store name, I seriously question her
news spun me into another round of sobbing and business judgment and her “qualifications” go down
May/June 1996 36
This content downloaded from
(cid:0)(cid:0)(cid:0)(cid:0)(cid:0)(cid:0)(cid:0)(cid:0)(cid:0)(cid:0)(cid:0)(cid:0)74.108.41.47 on Thu, 28 Mar 2024 00:53:40 +00:00(cid:0)(cid:0)(cid:0)(cid:0)(cid:0)(cid:0)(cid:0)(cid:0)(cid:0)(cid:0)(cid:0)(cid:0)
All use subject to https://about.jstor.org/terms",[]
40,"Feminist Bookstore News
a notch in my mind. Another woman loves our back- withhold this information from her because I was
room space for putting on her own workshops but afraid it would scare her into leaving early, and I
cares nothing about retail. She already has a store in a wanted to keep her around until I was ready to
nearby suburb. I asked her why she wanted a second leave. I ended up telling her the truth and stepped
store, and she said she wanted to get the word out. I back to let her process this information in her own
asked, “What word do you want to get out,” she way and own time. Walking my talk can be tough
didn’t know. I know I'm not interested in Two Sisters sometimes.
becoming another property so an entrepreneur can So that’s the scoop. I hope to close a sale by
add a notch to her property belt. Each time I find August, stick around for some training if I'm needed,
myself clutching during a conversation, I know anbd theen he ad c ofof innto tthe i wnild bulue eyondder.. G ul p. O To
there’s a “buyer profile” issue for me to examine. Am
I being unreasonably controlling and protective of my
parochial interests or am I exercising good judgment
in order to preserve the essence of the space I have
created to serve women? How far can I stretch and Annoucements, from page 15.
open to another woman's agenda without losing the Tiptree Jr. Award Ceremony where the first Retro-
integrity of the store? What will I do if the only offer active Tiptree Award will be presented. Programs
I receive is from a woman who wants to turn the include readings, academic papers, discussions and
backroom into a music store? Now really! That’s when panels. Past guests of honor and other sci-fi profes-
the going will get rough for me. sionals attending this year include: Ursula K. Le Guin,
Laurel, my associate who has been with me for Judith Merril, Lois McMaster Bujold, Suzy McKee
three years now, is having her own growth experi- Charnas, Karen Joy Fowler, Nicola Griffith, Pat
ences these last four months. Her first reaction to Murphy, FBN’s Susanna Sturgis, Chelsea Quinn Yar-
hearing my news was fear and anger that I was bro and many others. For more information contact
disrupting her life just as it was getting comfortable. WisCon 20 at: SF3, PO Box 1624, Madison WI 53701;
She told me she wasn’t ready to leave the store and 608-233-8850, e-mail (wison.consom@cs.wisc.edu),
would stay to the end. She later realized this position Web (http://www.cs.wisc.edu/wiscon /).
was motivated out of her fear that she wouldn’t be
able to get a job elsewhere. This whole process has Ssa
opened her to considering other jobs and to looking
realistically at her skills and needs. Laurel’s even
talked with a prospective employer, so she’s begin- GLAMA, the Gay/Lesbian American Music
ning to feel the strength and empowerment that Awards, is seeking nominations for the First Annual
comes with giving herself choices. She wants to be Gay/Lesbian American Music Awards to be presented
supportive of my life change at the same time she’s on October 6th in New York City. Ten awards will be
being bounced around by it. presented including seven recording artist awards, one
I'm doing the same. I'd hate to have to train songwriter award and two special honors. Recordings
someone new if Laurel leaves early and yet I want to by self-identified gay, lesbian, or bisexual artists
be supportive of her decisions. So even though we released for sale in the U.S. between June 1, 1995 and
bounce around day to day, we have talked more
openly than ever before. It’s a reminder to me that sions will be reviewed by panels of recording artists,
open, honest discussions work much better than producers, music journalists and music industry per-
when I withhold information to try and control sonnel. A special advisory committee will determine
another person’s behavior (thinking, of course, that the recipients of the two special honors, the Michael
I'm doing them a favor). Here’s an example: When I Callen Medal of Achievement and the Outmusic
first told Laurel it was time for me to leave the store, Award. For an entry application send SASE to:
I thought it would be two years. When I realized it GLAMA, 244 Fifth Avenue #2049, New York NY 10016;
would be more like six to eight months, I wanted to 800-956-5262, e-mail at (GLAMAS@aol.com). O
37 May/June 1996
This content downloaded from
(cid:0)(cid:0)(cid:0)(cid:0)(cid:0)(cid:0)(cid:0)(cid:0)(cid:0)(cid:0)(cid:0)(cid:0)74.108.41.47 on Thu, 28 Mar 2024 00:53:40 +00:00(cid:0)(cid:0)(cid:0)(cid:0)(cid:0)(cid:0)(cid:0)(cid:0)(cid:0)(cid:0)(cid:0)(cid:0)
All use subject to https://about.jstor.org/terms",[]
