PageNumber,Text,ISBNs
70,"Feminist Bookstore News
In No Quarter ($5.99 pb, 0-88677-698-8), Tanya Wizard of Oz — into an exhilarating, gritty, altogether
Huff sends the brother and sister assassins of Fifth marvelous whole. Kim Antieau, the author of much
Quarter ($4.99 pb, 0-88677-651-1) — the latter now acclaimed short fiction, edits and publishes Daughter
unwillingly sharing her body with the body-snatcher of Nyx.
Gyhard — to the bards of Sing the Four Quarters ($4.99 Sisters in Fantasy 2 ($5.99 pb, 0-451-45503-8)
pb, 0-88677-628-7) for their help. This is one of those edited by Susan Shwartz and Martin H. Greenberg
rarities, a fantasy adventure series that is intelligent, looks like a worthy successor to SiF. Among the 15
original and memorable even after the last page is writers included are Andre Norton, Jane Yolen, Nancy
turned. Springer, Lisa Goldstein, Nancy Kress, Mercedes
C. J. Cherryh’s Invader ($5.99 pb, 0-88677-687-2), Lackey, Katharine Kerr and co-editor Shwartz. All
the sequel to Foreigner ($5.99 pb, 0-88677-637-6), is now stories are original to this volume. I'd love to see this
out in paperback. Like much of Cherryh’s work, this series become an annual!
explores relationships between human and alien Also brand new is Emily Devenportť’s, Eggheads
peoples — when the aliens have the upper hand. For ($5.99 pb, 0-451-45517-7), in which two explorers,
thòse who can't wait, Inheritor ($21.95 cl, 0-88677-689-9), both women, race against alien competitors and a
third in the series, was just released in hardcover. failing biological enhancement mechanism to decode
the glyphs left by a vanished civilization. An encour-
aBAs aging sign of the times: as one of its selling points, the
catalog copy says, “Strong female characters are very
HARPERPRISM popular.” Devenport’s previous novels are also in
print: Larissa ($4.99 pb, 0-451-45276-3) and Scorpianne
Briefly noted a couple of issues back, Killing Me ($4.99 pb, 0-451-45318-2).
Softly ($12 tp, 0-06-105328-7) edited by Gardner Much has been made of wunderkind Felicity
Dozois is well worth carrying. Subtitled “erotic tales Savage's age: her second novel, Delta City ($5.99
of unearthly love,” it’s eerie, stylish and original. Just pb, 0-451-45399-9), is just out and she’s still shy of
over half the 15 stories are by women, and what 21. It's a sequel to her acclaimed Humility Garden
women! Ursula K. Le Guin, Nancy Kress, Mary ($4.99 pb, 0-451-45398-0). Humility, deposed as
Rosenblum, Pat Cadigan, Maureen F. McHugh... (P.S. Divinarch of Salt, must fight to recover her throne
The male writers are no slouches either.) andto tip the balance in an epic struggle between
The Hedge of Mist ($22 cl, 0-06-105230-2) is the gods and humans.
sixth of Patricia Kennealy-Morrison’s Keltiad novels World Fantasy Award-winning editor Ellen
(aka “Kelts in Space”) and the conclusion of her Tales Datlow’s much-praised anthology Alien Sex ($4.99
of Arthur trilogy. pb, 0-451-45142-2) is now out in paperback. Contribu-
PENGUIN/ROC tors include Pat Murphy and Connie Willis.
AA
No question about it, Kim Antieau’s first novel,
The Jigsaw Woman ($10.95 tp, 0-451-45509-6),
belongs on your shelves. Keelie awakens in a rich
man’s lab with fragmented memories of several lives: RISING TIDE PRESS
she has been surgically pieced together from the The predictable romance doesn’t overwhelm the
bodies of three women, all of whom now live in her. fantasy tale in Karen Williams’ Nightshade ($11.99 tp,
Keelie escapes. Guided by the daunting underground 1-883061-08-3), and the novel is all the better for it.
goddess Eriskegal, she goes back in time, to the age of Artist and naturalist Alex Spherris is well-known
the Inquisition, to a hidden enclave of South American among the lesbians in her upstate New York town for
Amazons, to the fringe of antiquity before the mono- her affairs, which are many and brief. Then a bizarre
theism shackled women. The story combines accident on a rainy night brings a strange cast of
numerous myths — among them Frankenstein’s characters into her life: a witch and a wizard, both a
monster, Inanna in the underworld, Rapunzel and the century old, a talking Scottish terrier and a beautiful
67 May/June 1996
This content downloaded from
(cid:0)(cid:0)(cid:0)(cid:0)(cid:0)(cid:0)(cid:0)(cid:0)(cid:0)(cid:0)(cid:0)(cid:0)74.108.41.47 on Thu, 28 Mar 2024 00:53:40 +00:00(cid:0)(cid:0)(cid:0)(cid:0)(cid:0)(cid:0)(cid:0)(cid:0)(cid:0)(cid:0)(cid:0)(cid:0)
All use subject to https://about.jstor.org/terms","['0-88677-698-8', '0-88677-651-1', '0-451-45503-8', '0-88677-628-7', '0-88677-687-2', '0-88677-637-6', '0-451-45517-7', '0-88677-689-9', '0-451-45276-3', '0-451-45318-2', '0-06-105328-7', '0-451-45399-9', '0-451-45398-0', '0-06-105230-2', '0-451-45142-2', '0-451-45509-6', '1-883061-08-3']"
71,"Feminist Bookstore News
fairy long imprisoned in a magic bell. Well, you can 0-312-86928-3, June) is one such, and it’s easy to see
figure out who gets together with whom, but the why it caught the slush reader’s jaded eye. Protago-
outrageously dotty supporting characters, the vivid nist Reva is an assassin with the rare ability to move
descriptions of the natural world and the author’s across timelines — a talent that, uncontrolled, lost her
sense of humor lift this one out of the ordinary. her family at a young age. Accustomed to cold killing
and then evading all consequences, she startles herself
RAs by actually saving a man’s life — and by befriending
a novice smuggler whose passion for winning gets her
TOR BOOKS i an v b ivig id l ytr o du eb sl ce r. i bC eh dr i wst ai ta en r s wet os r ldth i as n dp e r agso an ina sl t s t ar u bg ag cl ke - on
As usual, Tor has an abundance of riches forth- drop of high-stakes political and commercial intrigue.
coming, three of them first novels. Unfortunately for Sometimes the complex subplots and quick-cut struc-
book buyers (though a boon for the authors — hard- ture threaten to overwhelm the “mainline” story, but
covers still get more attention from both publicity the novel impresses nonetheless.
departments and reviewers), they're all in cloth. Make In Anne Harris's The Nature of Smoke ($21.95 cl,
note, and look for the paperbacks in a year or so. 0-312-85286-X, June), a young woman escapes her
Ladylord ($23.95 cl, 0-312-85050-1) is a promising dysfunctional family and the slums of Detroit for New
debut by Sasha Miller. In this Japanese-flavored fan- York City, where ever more dangerous entanglements
tasy society, women do not occupy thrones, so the threaten her life. Editor Jim Frenkel, who also edited
dying Lord Qai names daughter Javerri his son and Ladylord, above, notes that Harris is “a wonderful
heir to Third Province. Seeking to prevent Javerri’s storyteller with a tremendous energy and creativity.”
accession, the corrupt lord of First Province sends her Frenkel’s track record is excellent, plus he’s married
on an impossible mission. She accomplishes it, of to Joan Vinge and lives in Madison, Wisconsin; in
course, with a valiant party of (male) supporters — other words, believe him!
and crucial assistance from a powerful madam, a And finally, Lisa Goldstein has a new fantasy due
courageous courtesan and First Lord’s ingenious any day now: Walking the Labyrinth ($21.95 cl,
young wife. The machinations of the women were the 0-312-86175-3, June). Molly Travers, a young woman
best part of the book for this reader! in contemporary San Francisco, explores her ancestry,
One veteran in the field is Susan Shwartz (Grail of which includes a family of 19th-century vaudeville
Hearts), whose Shards of Empire ($23.95 cl, 0-312- magicians who performed real magic. Expect from
85716-0) is set in tenth-century Byzantium. Leo Ducas, Goldstein a deft touch with the ways reality and
a young nobleman, sets out to serve his emperor and magic swirl together at the edges and characters not
his God and soon loses emperor, faith and his treach- easily forgotten.
erous family. Shwartz, a very fine writer, pays close
hat it ge hn t sio tn at i ot no t anh de c loh woi ,c e is n m ta rd iue m b py h h aner d c dh ea fr ea ac tt . e r Ss h, e of aBASDAg
romanticizes nothing, not power and not poverty and
her evocation of place and time is gloriously detailed. WARNER ASPECT
Whiteout ($23.95 cl, 0-312-85765-9) is a first A new novel from Joan Vinge, author of The Snow
novel by respected short-fiction writer Sage Walker. Queen and The Summer Queen, is cause for celebration.
Set in a near future where multinational corpora- Dreamfall ($22.95 cl, 0-446-51627-9), due in June, is
tions run the show and human perception is the sequel to Catspaw and further explores the pre-
manipulated by virtual images, this thriller posits a dicament of Cat, raised among humans who feared
great power struggle for Antarctica, the planet's last him for the telepathic powers he inherited from his
source of untainted water. mother. Here he returns to his mother’s home planet
Manuscripts that rise from the (unagented, unso- to find it under siege by human commercial interests.
licited) “slush pile” to hardcover publication are rare His outsider status and mixed loyalties will prove key
indeed. Deborah Christian's Mainline ($23.95 cl, to saving the planet's threatened ecosystem. O
May/June 1996 68
This content downloaded from
(cid:0)(cid:0)(cid:0)(cid:0)(cid:0)(cid:0)(cid:0)(cid:0)(cid:0)(cid:0)(cid:0)(cid:0)74.108.41.47 on Thu, 28 Mar 2024 00:53:40 +00:00(cid:0)(cid:0)(cid:0)(cid:0)(cid:0)(cid:0)(cid:0)(cid:0)(cid:0)(cid:0)(cid:0)(cid:0)
All use subject to https://about.jstor.org/terms","['0-312-86928-3', '0-312-85286-X', '0-312-85050-1', '0-312-86175-3', '0-312-85765-9', '0-446-51627-9']"
72,"Feminist Bookstore News
C
By Nan Cinnater Will Tell, Kate is commissioned by Ekaterina, her
Cape and Dagger /Provincetown MA marvelously enigmatic grandmother, to investigate
deaths among members of the tribal council. $21.95
' These columns, as Susanna Sturgis wrote in a cl, 0-399-14124-3, Putnam.
recent issue, are indeed like messages in bottles, trav- Carol O'Connell brings back her unique heroine,
eling through time. With any luck, when this one wild child turned NYPD sergeant Kathleen Mallory,
washes up on shore in a couple of months, I will be in Killing Critics, third in the critically acclaimed
one of the proud proprietors of a new mystery book- series. The previous two were Mallory's Oracle,
store called Cape and Dagger, adjacent to our existing already available in paper, and The Man Who Cast Two
gay and lesbian bookstore, Now Voyager. This is Shadows (which should be coming out in paper this
shameless self-promotion, but I want to share my summer). These are literate and intriguing thrillers
excitement, terror, and general insanity, especially if that take on basic questions such as how morality is
this column seems a little more scattered than usual. formed in human beings. Customers looking for more
I just caught up with the new than mind candy will be glad to discover them. $23.95
Nevada Barr, which I hope you al- c], 0-399-14168-5, June, Putnam.
ready have in stock. Firestorm, the Patricia Cornwell's Cause of Death may well be
recent hardcover from Putnam, the bread and butter of many bookstores this summer,
focuses on firefighting in Northern so order early and stock up. Dr. Kay alert: Cornwell is
California, highlighting the cour- credited in her catalogue bio as screenwriter and
age, conflicts, and environmental executive producer of the forthcoming film From
issues involved. ($21.95 cl, 0-399- Potter's Field. But who's going to play Scarpetta on the
14126-X.) Barr's latest paperback, big screen? $25.95 cl, 0-399-14146-4, July, Putnam.
Ill Wind, finds National Parks Mercedes Lambert is a tease. Not only did she
ranger Anna Pigeon at Mesa Verde, site of the Anasazi give us two sizzling heroines, attorney Whitney
cliff dwellings. Barr is tops at the literate, atmospheric, Logan and Chicana prostitute Lupe, who were obvi-
progressive/ feminist mystery, so at first I was disap- ously attracted to each other but failed to do anything
pointed that she didn’t make more of that very about it, in her debut mystery, Dogtown ($4.95 pb,
evocative setting. What we get instead is a deeper 0-14-013928-1, Penguin), she then took five years to
character study of Anna herself, which is fascinating bring us the sequel. Soultown brings the pair back in
and welcome. Barr’s series is a must-carry for virtu- a hip LA mystery. ($20.95 cl, sorry no ISBN, July,
ally all feminist bookstores, if not in hardcover, then Viking.) We can expect progressive race and class
in paper. ($5.99 pb, 0-380-72363-8, Avon.) politics, as well.
Dana Stabenow is another must-carry, and she Since Minette Walters has won top mystery
has a new hardcover in her series about Alaskan awards on both sides of the Atlantic in the last few
Aleut private investigator Kate Shugak. In Blood years, it would be a crime for this column not to take
Illustrations by Yani Batteau from The Dyke Detector, note of her new hardcover, however belatedly.
Paradigm Publishing. Released last March, The Dark Room details the
69 May/June 1996
This content downloaded from
(cid:0)(cid:0)(cid:0)(cid:0)(cid:0)(cid:0)(cid:0)(cid:0)(cid:0)(cid:0)(cid:0)(cid:0)74.108.41.47 on Thu, 28 Mar 2024 00:53:40 +00:00(cid:0)(cid:0)(cid:0)(cid:0)(cid:0)(cid:0)(cid:0)(cid:0)(cid:0)(cid:0)(cid:0)(cid:0)
All use subject to https://about.jstor.org/terms","['0-399-14124-3', '0-399-14168-5', '0-399-14146-4', '0-14-013928-1', '0-380-72363-8']"
73,"Feminist Bookstore News
recovery, at a private clinic, of an amnesia victim who mentally handicapped young man accused of killing
happens to be the daughter of a millionaire. Walters an Oregon senator. ($23.95 cl, 0-312-14364-8, July, St.
writes the darkest, creepiest psychological suspense Martin's.) Wilhelm does great courtroom drama that
in Great Britain, making Rendell and James look cozy hinges on feminist or progressive issues, and you
by comparison. If that’s your cup of Earl Gray, you probably know by now whether her fans will spring
can't do any better. $23.95 cl, 0-399-14078-6, Putnam. for the hardcovers. Wilhelm’s new paperback, A
Other Spring hardcovers of note include Full Flush of Shadows, contains five short novels featur-
Stop by Joan Smith, the new mystery featuring ing married sleuths Constance Leidl and Charlie
Loretta Lawson, England’s answer to Amanda Cross. Meiklejohn. She’s a psychologist; he’s an arson inves-
This one finds the academic sleuth alone in New York tigator. This is a less popular and less feminist series,
City, harassed by a series of threatening phone calls. although the critical quotes are great. In the cover
($21 cl, 0-449-91048-2, Fawcett.) The title alone should blurb, the Seattle Times calls these novellas “suspense-
sell Sarah Shankman’s I Still Miss My Man, But My ful gems.” ($5.99 pb, 0-449-22434-1, June, Fawcett.)
Aim Is Getting Better. Already known to feminist The Anniversary by Rachel Canon concerns the
readers for her witty Southern mysteries, Shankman assassination of the first female president of the U.S.
here introduces a new heroine, Nashville songwriter One year later (the anniversary), her best friend real-
Shelby Kay Tate. ($21 cl, 0-671-89751-9, Pocket.) izes that someone is out to kill her too. This is a first
The lesbian mystery field is becoming ever more novel by an unknown writer, but it’s a hell of a prem-
crowded and competitive, with both mainstream and ise, isn't it? ($23 cl, 0-679-43731-2, July, Random
feminist presses demanding literate writing, intelli- House.) Another woman writer fishing in John
gent plotting, and the elusive “page-turning” quality. Grisham's waters is Jean Hanff Korelitz. A Jury of Her
Randye Lordon and Jean Taylor have new entries in Peers features a female public defender in what could
series that are certainly strong on at least the first two be a wonderfully paranoid political thriller, with mys-
of those qualifications. Sister's Keeper by Randye terious abductions among New York City’s homeless
Lordon, now out in paper, is the second in a series somehow connected to “an exclusive and forbidding
about lesbian private eye Sydney Sloan. Based in New men’s club.” ($24 cl, 0-517-70051-1, Crown.)
York City (where she never does run into Lauren Ballantine is heavily promoting Buck Naked, a
Larano, either personally or professionally), Sydney first mystery by Joyce Burditt, as the next best thing to
investigates the apparent suicide of longtime family Sue Grafton. Burditt is a veteran TV writer and this
friend Zoe Freeman. ($9.95 pb, 0-312-14134-3, St. features (female) P.I. Dutch O'Brien consulting on the
Martin's.) The Last of Her Lies by Jean Taylor brings set of a thinly disguised “Matlock.” Blurbs from book-
back San Francisco P.I. Maggie Garrett. Maggie is sellers indicate that this is indeed a lot of fun. (Most
notable for her flippant humor and her strong ties to intriguing quote: “I'll never look at Saran Wrap the
the local lesbian and gay same way again.”) But can we please have a morato-
community (making it all the rium on the use of the following adjectives to describe
more puzzling that she never women private eyes: feisty, sassy, savvy, wisecracking,
runs into Emma Victor). tough-talking? Would they describe the boys this
Here she is hired to clear the way? $21 cl, sorry no ISBN, Ballantine.
o name of a woman therapist Summer entries in reliable series include House
accused of sexually abusing of Blues by Julie Smith, the latest paperback in her
a (female) client. ($10.95 pb, Edgar Award-winning series about big-boned New
1-878067-75-3, Seal.) Orleans police detective Skip Langdon. ($5.99,
The prolific Kate Wilhelm has the third hardcover 0-804-11342-4, June, Ivy.) The hardcover sequel, The
in what will apparently be an ongoing series about Kindness of Strangers, will be coming in July from
Oregon attorney Barbara Holloway. The previous two Fawcett. ($21 cl, 0-449-90937-9.) Eleanor Taylor
were Death Qualified ($6.99 pb, 0-449-22314-0, Faw- Bland continues her well-received series about a
cett) and The Best Defense ($6.99 pb, sorry no ISBN, widowed African American police detective in Keep
Fawcett). In Malice Prepense, Holloway defends a Still. ($20.95 cl, 0-312-14318-4, July, St. Martin's.)
May/June 1996 70
This content downloaded from
(cid:0)(cid:0)(cid:0)(cid:0)(cid:0)(cid:0)(cid:0)(cid:0)(cid:0)(cid:0)(cid:0)(cid:0)74.108.41.47 on Thu, 28 Mar 2024 00:53:40 +00:00(cid:0)(cid:0)(cid:0)(cid:0)(cid:0)(cid:0)(cid:0)(cid:0)(cid:0)(cid:0)(cid:0)(cid:0)
All use subject to https://about.jstor.org/terms","['0-312-14364-8', '0-399-14078-6', '0-449-91048-2', '0-449-22434-1', '0-671-89751-9', '0-679-43731-2', '0-517-70051-1', '0-312-14134-3', '1-878067-75-3', '0-804-11342-4', '0-449-90937-9', '0-449-22314-0', '0-312-14318-4']"
74,"Feminist Bookstore News
Bland has changed paperback publishers from this summer. Though funny and readable, this book
Signet to St. Martin's, who published Done Wrong never quite lives up to the feminist potential of its
in May with the fabulous tag line: “She’s a woman. premise: heroine solves her ex-husband’s murder
She's a mother. She’s pure cop.” ($4.99 pb, 0-312- with help from the other members of her mothers’
95794-7.) Rosewood Casket is the new Appalachian group. There is some irony in the fact that these
mystery by Sharyn McCrumb, described by my sales full-time moms meeting for an infants’ play group
rep as “Carson McCullers are all high-powered doctors, brokers, artists, and
meets Mary Higgins Clark.” programmers, but much more could have been
($23.95 cl, sorry no ISBN, made of it. Instead the plot takes an unexpected
Dutton.) McCrumb also has a twist at the end, making it a more interesting mys-
new paperback in her other, tery with less of a feminist point. $4.99 pb,
more comic series about anthro- 0-06-109410-2, August, Harper.
„ pologist Elizabeth MacPherson, Booksellers need mindless entertainment, too, and
If I'd Killed Him When I Met luckily Kathryn Lasky Knight and Joan Hess have new
Him.... ($6.50 pb, 0-449-14998-6, book-related paperbacks out. In Knight's Dark Swan,
Fawcett.) children’s book illustrator Calista Jacobs leaves her
Foremother Marcia Muller's new Sharon beloved Cambridge to house-sit and solve a murder in
McCone mystery, The Broken Promise Land, con- Beacon Hill, Boston. ($4.99 pb, 0-373-26204-5, World-
cerns the stalking of a (male) country-western star. wide.) In Hess’ Busy Bodies, bookstore owner Claire
($22.95 cl, 0-89296-621-1, June, Mysterious Malloy helps an environmental artist accused of mur-
Press/ Warner.) Muller’s A Wild and Lonely Place dering his wife. ($5.50 pb, 0-451-40560-9, Onyx.)
will be out in paper in August. ($6.50 pb, 0-446- Ballantine is again offering its Lesbian and Gay
60328-7, Warner.) Due to some weird publishing Mysteries display as its June promotion. This is a
synergy, Karen Kijewski’s new hardcover, Honky 36-copy floor display containing four copies each of
Tonk Kat, also concerns the stalking of a (female) nine titles: How Town and The Hidden Law by
country-western star. ($22.95 c], 0-399-14133-2, June, Michael Nava; Vital Lies, Stage Fright, and A Killing
Putnam.) Cure by Ellen Hart; I’ll Be Leaving You Always and
Veterans Martha Grimes and Ruth Rendell have My Sweet Untraceable You by Sandra Scoppettone;
new hardcovers that probably won’t generate great and Roman Blood and Catilina’s Riddle by Steven
sales. Rendell's is a collection of short stories called Saylor. The riser depicts a shadowy figure in a trench-
Blood Lines. ($23 cl, 0-517-70323-8, June, Crown.) coat with a pink triangle on the lapel. Ours was a big
Grimes departs from her popular series with a novel hit last summer; we couldn’t keep it filled. $191.64,
called Hotel Paradise, which may not even be a 0-345-40593-5, June.
mystery, although there is a death and the catalog Those of you who carry audio and have been
does mention suspense. The novel features her bemoaning the lack of lesbian and gay books on tape
trademark precocious twelve-year-old girl (which will be happy to hear about Hall Closet Book Company,
she does very well indeed), but mystery fans are the first U.S. audio book publisher to specialize in gay
creatures of habit who probably won't go for it. ($24 and lesbian titles. They debuted in March with two
cl, 0-679-44187-5, Knopf.) excellent mysteries: Hallowed
As for paperbacks, The Club by Jane Heller may Murder by Ellen Hart, read by
be overly suburban for some tastes (the setting is a Carol Jordan Stewart ($39.95,
Connecticut country club) but it looks interesting. The 6 tapes, unabridged, 1-8883-48-
heroine befriends a prominent feminist who is mur- 00-3), and Fadeout by Joseph
dered on the golf course. There’s a romantic sub-plot Hansen, read by Jim Zeiger
and it all sounds very Susan Isaacs, but harmless. ($24.95, 4 tapes, unabridged,
$4.99 pb, 1-57566-038-5, Kensington. 1-8883-48-01-1). They're distrib-
While we’re in suburbia, Mommy and the uted by BP, or call 800-895-8915,
Murder by Nancy Goldstone will be out in paper fax 206-286-0656. O
Z1 May/June 1996
This content downloaded from
(cid:0)(cid:0)(cid:0)(cid:0)(cid:0)(cid:0)(cid:0)(cid:0)(cid:0)(cid:0)(cid:0)(cid:0)74.108.41.47 on Thu, 28 Mar 2024 00:53:40 +00:00(cid:0)(cid:0)(cid:0)(cid:0)(cid:0)(cid:0)(cid:0)(cid:0)(cid:0)(cid:0)(cid:0)(cid:0)
All use subject to https://about.jstor.org/terms","['0-06-109410-2', '0-449-14998-6', '0-373-26204-5', '0-89296-621-1', '0-451-40560-9', '0-399-14133-2', '0-517-70323-8', '0-345-40593-5', '0-679-44187-5', '1-57566-038-5']"
75,"Cleis Press
BETTY AND PANSY'’S
SEVERE QUEER REVIEW OF
SAN FRANCISCO
An Irreverent, Opinionated
HA waiter ol gutsy humor and hasnt RG eu si td ae u r t ao n t st ,h e C rB ua ir sis n, g C l Au rb es a, s,
Performing Arts, and Other
A T a t YM A u hh ot eec uN hE h oo WM n r Cv y e e oaw O l y uo l f dR nO f o rWY Db v o re mee el j s M C sa f C as r m uA Lo b im e kaM e A StB l oh lO e A a $A g hF B m 1ui ant f 0viet od .t er 9nth eu a 5g ,t c n , d t ayE e i wb bo Tvd a on h ei rst tls aoh oi hP dso e p e eno de e f tdl a y op p r u r at a r pelh c v i e ae s rcim t o u sa uQ lp n ts yu a e d nfe e dt d o r r i l t la lP oiM v oo we ca ne l ainc s n lc sg .a sy
—hT uh Jmi us l? o r “ A Aan vdw rr h eit e z,e a rr t .”o uf og ru t s oy S1 ep- t5 em73 be4 r4-056-6,200pp,4 x 8 1/4
i a l a A t h f
In the Time of the
Butterflies. MORE FABS FROM CLEIS
$12.95, Trade paper,
ISBN 1-57344-017-5 FOOD FOR LIFE AND OTHER DISH
200pp, 5 1/2 x 8 1/2 A Benefit Cookbook to Help Organizations
September Providing Meals to People with AIDS
Edited by Lawrence Schimel
$14.95, Trade paper, ISBN 1-57344-061-2
150pp, 7 x 10, November
SONS OF DARKNESS
TMaleisc hofa e Ml e nR, oBwlooed aannd d I m mTohrtoamlityas Roche
$12.95, Trade paper, ISBN 1-57344-059-0,
180pp, 5 1/2 x 8 2, October
BODY ALCHEMY
Photographs
Loren Cameron
An intimate, remarkable self-portrait
T Pa ale ms of K B elo eo sd e, y Lust and Metamorphosis o a $nf 2 4a e m . 9f ee r 5m g ,ia nl e g T- t ro p- h am o dta o ele g r at ppr ha an e ps rs . ee rxual by
Tales of women werewolves—beings so ISBN 1-57344-062-0
d i $na 1r tok 2 l y .a 9 n 5ie mr ,o at l si Tc . rth ae dir e d e psi ar pes e rli ,t er a Il Sly B Ntu r n 1 -th 5e 7m 344-057-4 N10 ov0p emp, b e8 r 1/2 x 8 1/2
200pp, 5 1/2 x 8 1⁄2, October
CLE!
72 Volume 19 Number 1
This content downloaded from
(cid:0)(cid:0)(cid:0)(cid:0)(cid:0)(cid:0)(cid:0)(cid:0)(cid:0)(cid:0)(cid:0)(cid:0)74.108.41.47 on Thu, 28 Mar 2024 00:53:40 +00:00(cid:0)(cid:0)(cid:0)(cid:0)(cid:0)(cid:0)(cid:0)(cid:0)(cid:0)(cid:0)(cid:0)(cid:0)
All use subject to https://about.jstor.org/terms","['1-57344-017-5', '1-57344-061-2', '1-57344-059-0', '1-57344-062-0']"
