PageNumber,Text,ISBNs
102,"Feminist Bookstore News
Galway Kinnel, Marge Piercy, Margaret Atwood and Chesler, Esther D. Rothblum and Ellen Cole, feminists
Robert Bly pay tribute to motherhood through poetry, including bell hooks, Gloria Steinem, Teresa
essay, memoir and short fiction. $19.95 cl, 0-89789- Bernadez, Starhawk, Z Budapest, Kate Millett,
445-6. Bergin & Garvey, an imprint of Greenwood Andrea Dworkin, Shere Hite, Sandra Butler and Carol
Publishing Group, 88 Post Road West, Westport CT Gilligan write about their achievements in the fields
06880. Distributed by Ingram, B&T. of feminist therapy, feminist psychology and/or
women’s mental health, what their accomplishments
Writings by Mothers of Incest Victims by were and how their lives were consequently changed
Sandi Ashley is a collection of writings by mothers by their work. $29.95 pb, 1-56023-078-9. Harrington
of incest and sexual abuse survivors, who are also Park Press, 10 Alice Street, Binghamton NY 13904.
the wives or mothers of the perpetrators. These Distributed by BP.
women poignantly relate their wrenching shock,
hurt, betrayal, anger and guilt. The stories illustrate
a diversity of experience and emotional response
and offer hope to other women related to survivors
and abusers. $8 pb, 0-8403-7064-4. Kendall/Hunt The Power to Dream: Interviews With Women in
Publishing, 2460 Kerper Boulevard, PO Box 539, the Creative Arts by Nancy Jo Hoy begins in 1974 with
Dubuque IA 52004. Distributed by WCSAP, 100 E. an interview between the author and Anaïs Nin, and 20
5th Avenue #214, Olympia WA 98501; 360-754-7583, years later concludes with her interview of Alice
fax 360-786-8707. Walker. This book documents the challenges women
face in the individual practice of their creative art, and
illustrates the conflict between creative will and other
aspects of women’s lives. Includes interviews with E.M.
Broner, Judy Chicago, Judy Dater, Marilyn French,
Moving On: A Journey Through Sexual Assault Phoebe Helman, Barbara Hendricks, Laura Huxley,
is a personal account by Louise Phillips of her experi- Maxine Hong Kingston, Frances Moore Lappé, Meridel
ence of rape and how it affected her life. Phillips tells of Le Sueur, Bella Lewitzky, Lucy Lippard, Diane Wakoski
the assault, the aftermath and her experience with and Beatrice Wood. An incredible resource for anyone
police, doctors and counselors. She tells of the dramatic involved in the creative arts. $14 pb, 0-9641292-9-9.
sighting of the rapist two years later, his arrest and the Global City Press, The City College of New York, 138th
agonizingly drawn-out process of justice. Phillips coor- Street and Convent Avenue, New York NY 10031; 212-
dinates SCARS (Social Conscience Against Rape and 603-9857. Distributed by Consortium.
Sexual assault), a lobby and support group, and is a
member of the NSW Attorney General’s Victims’ Advi- In Praise of Tara: Songs to the Saviouress by
sory Council. $14.95 pb, 1-86351-156-3. Sally Milner Martin Willson is about Tara, a Buddhist deity who
Publishing Pty Ltd, 558 Darling Street, Rozelle NSW as bodhisattva defied tradition when she attained
Australia 2039. Distributed by Seven Hills Book omniscience in female form. This collection includes
Distributors, 49 Central Avenue, Cincinnati OH 45202; a history of the origin of the Tara Tantra, canonical
513-381-3881, fax 513-381-0753. and practice texts, and lyrical praises. ($24.95,
0-86171-109-2.) Of related interest is Enlightened
In Feminist Foremothers in Women’s Studies, Beings: Life Stories from the Ganden Oral Tradition
| Psychology, and Mental Health, edited by Phyllis by Janice D. Willis which collects tales meant to
Volume 19 Number 1 99 May/June 1996
This content downloaded from
(cid:0)(cid:0)(cid:0)(cid:0)(cid:0)(cid:0)(cid:0)(cid:0)(cid:0)(cid:0)(cid:0)(cid:0)74.108.41.47 on Thu, 28 Mar 2024 00:53:40 +00:00(cid:0)(cid:0)(cid:0)(cid:0)(cid:0)(cid:0)(cid:0)(cid:0)(cid:0)(cid:0)(cid:0)(cid:0)
All use subject to https://about.jstor.org/terms","['1-56023-078-9', '0-8403-7064-4', '0-9641292-9-9', '1-86351-156-3', '0-86171-109-2']"
103,"Feminist Bookstore News
instruct and inspire others on the path to enlighten- housework to include the caring and supportive roles
ment. ($18 pb, 0-86171-068-1.) Wisdom Publications, of women in the family. $19.95 pb, 1-873797-18-4; $45
361 Newbury Street, Boston MA 02115; 617-536- cl, -19-2, New Clarion Press. Distributed by Paul &
3358. Distributed by BP, New Leaf, National Book Company, c/o PCS Data Processing, Inc., 360 West
Network; 800-462-6420. 31st Street, New York NY 10001; 212-564-3730, fax
212-971-7200.
The Encyclopedia of Women’s History in
America by Kathryn Cullen-DuPont describes, in
Women’s Studies and Culture: A Feminist encyclopedic form, 300 years of movements, break-
nIn ist tr o d cru ic tt ii qo un e p or fo v ci ud le ts u ra e . n Tew he s ey dn itt oh re ss ,i s R o of s e mth ae r i efemi- nth or tao bu lg eh s w, o mleg ei ns l a it nio n t, h ec o Uur .St . c fa rs oe ms, i Cs osu loe ns, i a lb o to imks e s and
Buikema and Anneke Smelik, open with an explora- through contemporary American events. Too bad
tion of feminist academic practice and an overview there aren't any photos or graphics! $45 cl, 0-8160-
of the full range of feminist theory. They engage in 2625-4. Facts on File, 11 Penn Plaza, New York NY
the equality /difference debate and the postmodern 10001; 212-967-8800. Distributed by B&T, Ingram.
challenge to that debate examining the impact of
women’s studies on: linguistics, literary theory, The Endometriosis Sourcebook by Mary Lou
popular culture, history, film theory, art history, Ballweg and the Endometriosis Association is sub-
theater studies, psychoanalysis, Black studies, titled “The definitive guide to current treatment
lesbian studies and semiotics. $17.50 pb, 1-85649- options, the latest research, common myths about
312-1; $55 cl, -311-3. Zed Books, 7 Cynthia Street, the disease and coping strategies — both physical
London N1 9JF England. Distributed by Humanities and emotional.” And that about says it! Shelve it
P Ltr des . s ( A(U u. sS t. r), a l iF ae ).rnwood Books (Canada), Peribo Pty n Wex it t h t o ET nhi drd o m Si ed te r iP or ses is s’ : A Alte r n Ga uti iv des e f bor y W Wom oe mn en for
Women edited by Ruth Carol. (See Raves in Issue
‘Ladies, Please Don’t Smash These Windows: 18#6, page 123.) $14.95 pb, 0-8092-3263-4. Contem-
Women’s Writing, Feminist Consciousness and porary Books, Two Prudential Plaza #1200, Chicago
Social Change 1918-38 by Maroula Joannou is an IL 60601; 312-540-4500, fax 312-540-4657. Distrib-
accessible feminist critique of the masculine assump- uted by B&T, Ingram.
tions about literature of the twenties and thirties.
Writing from a feminist-materialist perspective, Joan-
nou analyzes novels of sensibility, domestic fictions,
lesbian writing, autobiography, speculative fiction
and anti-fascist writing by Virginia Woolf, Rebecca Women’s roles and experiences in the Spanish
West, Rosamond Lehmann, Radclyffe Hall and many Civil War (1936-1939) are examined in Defying Male
others. $19.95 pb, 1-85973-022-1. Berg Publishers, Civilization: Women in the Spanish Civil War by
13950 Park Center Road, Herndon VA 22701; 703-435- Mary Nash. Amid the crisis of war, women organized
9326. Distributed by BP, B&T, Ingram. in many ways to fight fascism, including publishing
antifascist journals and newspapers, providing serv-
The new edition of The Politics of Housework ices to help others and taking up arms. Based on
edited by Ellen Malos sums up the debate on house- research and interviews, Defying Male Civilization
work, drawing from essays, books and pamphlets by addresses the complexity of war and revolution from
figures in the women’s movement in Britain and a gender perspective, focusing both on women’s
North America. The new final chapter highlights the heroic achievements and on the limitations of change.
growing importance of the domestic labor debate for $22.50 pb, 0-912869-16-X; $32 cl, -15-1.
women in the world beyond the western industrial- The eccentric and extraordinary women in Riding
ized nations, and the widening of the definition of Astride: The Frontier in Women’s History branded
May/June 1996 100
This content downloaded from
(cid:0)(cid:0)(cid:0)(cid:0)(cid:0)(cid:0)(cid:0)(cid:0)(cid:0)(cid:0)(cid:0)(cid:0)74.108.41.47 on Thu, 28 Mar 2024 00:53:40 +00:00(cid:0)(cid:0)(cid:0)(cid:0)(cid:0)(cid:0)(cid:0)(cid:0)(cid:0)(cid:0)(cid:0)(cid:0)
All use subject to https://about.jstor.org/terms","['0-86171-068-1', '1-873797-18-4', '0-8092-3263-4', '1-85973-022-1', '0-912869-16-X']"
104,"Feminist Bookstore News
CALL -1:-800-654-5129: FOR
THE `P FLGR IM PRESS YC-ATA LOG
In Good Company for 1997
A Woman’ Journal for Spiritual Reflection
With an Introduction by
Phyllis Tickle
The Pilgrim Press
Cleveland, Ohio
Available at your local bookstore
344 pages, Spiral
$16.95—0-8298-1123-0
is
an anthology of quotations
a book of days
a personal calendar
an opportunity for reflection
a spiritual journal
a diary for women
a collection of stunning
photography
Volume 19 Number 1 101 May/June 1996
This content downloaded from
(cid:0)(cid:0)(cid:0)(cid:0)(cid:0)(cid:0)(cid:0)(cid:0)(cid:0)(cid:0)(cid:0)(cid:0)74.108.41.47 on Thu, 28 Mar 2024 00:53:40 +00:00(cid:0)(cid:0)(cid:0)(cid:0)(cid:0)(cid:0)(cid:0)(cid:0)(cid:0)(cid:0)(cid:0)(cid:0)
All use subject to https://about.jstor.org/terms",['0-8298-1123-0']
105,"Feminist Bookstore News
pb, 0-930934-98-9. Morning Glory Press, 6595 San
The Music Your Haroldo Way, Buena Park CA 90620; 714-828-1998. Dis-
tributed by Independent Publishers Group.
Customers Love Homosexuality: The Secret a Child Dare Not Tell
by Mary Ann Cantwell is a guide for parents of gay
And Service children or for parents who think their child may be gay.
Documenting the author’s realization that she, a teacher
of emotionally disturbed six-and-seven-year-olds had
That Will Make failed to understand that her son was gay, this book calls
parents to act with greater sensitivity and under-
You Smile! standingif their child is somehow different. It also offers
a message of hope for members of the gay male and
lesbian community who may have suffered greatly
within their family as they were growing up. $12 pb,
Same Day Shipping on all music 0-9649829-9-4. Rafael Press, PO Box 150462, San Rafael
orders placed by 3:00pm EST. CA 94915; 800-299-9190, fax 415-258-0207, e-mail
(RafaelPrss@aol.com). Distributed by Koen / Inland, BP,
Women’s Music e Riot Grrrls Music B&T, Alamo Square.
Gay Men’s Music e Songbooks
Celtic Music e Native American Music Daddy's Wedding written and illustrated by
Michael Willhoite is the newest in Alyson’s series of
Call Collect! Goldenrod/Horizon Distribution children’s books on gay parenting, which includes
(517) 484-1712 Fax: (517) 484-1771 Heather Has Two Mommies and Daddy's Roommate. In
Daddy’s Wedding, Nick, a ten-year-old boy, gets to be
best man when his Daddy and daddy’s roommate,
cattle, mined for gold and silver, farmed, ranched, Frank, decide to get married. The book seems too
performed in rodeos and wild west shows, worked as childish for ten-year olds, but for younger kids it
j bo au cr kn a ali ss tt rs i, d ed o rc at to hr es r a tn hd a n a t t so idr en se ay ds d l e— . B a en cd au sr eo d te h e h yo r ds ie d- n’t w to ioul nd s .b e $ f 1u 5n .. 9 5It ’ s c la , g r 1e -a 5t 5 i 5d 8ea 3 - a 3n 5d 0 -h 0as , n Jic ue n i ell ,u s t Ara l- yson
conform to the idealized vision of female these women Publications, 6922 Hollywood Boulevard #1000, Los
were either ignored or maligned by historians. This Angeles CA 90028; 213-871-1225, fax 213-467-0173.
book recognizes these women for redefining the social Distributed by Consortium, BP.
and economic roles of their gender and for initiating the
struggle, sometimes militantly, for women’s rights in
the U.S. $18.95 pb, 0-912869-18-6; $26.50 cl, -17-8. Arden
Press, PO Box 418, Denver CO 80201; 303-697-6766.
Distributed by BP. Sundays at Seven: Choice Words From A Dif-
ferent Light's Gay Writers Series edited by Rondo
In Teenage Couples: Expectations and Reality, Mieczkowski and compiled by James Carroll Pickett
Jeanne Warren Lindsay compiles the responses of her features writings by 32 gay men including Peter
survey — 3,700 apparently straight teens, 670 who live Cashorali, Michael Lassell, Paul Monette and Mark
with their partners — who talk about living together, Thompson. “[It] evokes an exciting era of writers
roles, work, sex, jealousy, partner abuse and other finding their voices, honing their art, experimenting
issues. But what about the 10% or so of teens who are like mad. Reading it made me wish I were one of
gay and dealing with these issues? Lindsay's question- them.” —Felice Picano. This is the men’s companion
naire doesn't even ask about sexual orientation. Looks piece to In A Different Light: An Anthology of
interesting, informative and diverse for straights. $14.95 Lesbian Writers, which was based on the bookstore’s
May/June 1996 102 Volume 19 Number 1
This content downloaded from
(cid:0)(cid:0)(cid:0)(cid:0)(cid:0)(cid:0)(cid:0)(cid:0)(cid:0)(cid:0)(cid:0)(cid:0)74.108.41.47 on Thu, 28 Mar 2024 00:53:40 +00:00(cid:0)(cid:0)(cid:0)(cid:0)(cid:0)(cid:0)(cid:0)(cid:0)(cid:0)(cid:0)(cid:0)(cid:0)
All use subject to https://about.jstor.org/terms","['0-930934-98-9', '0-9649829-9-4', '0-912869-18-6']"
106,"Feminist Bookstore News
meets what-appears-to-be Boy and their world is
the Net, where any persona — and any gender —
can be created. They pose as a host of different
personalities, switching identities and genders as
quickly as they create passwords. They cybersurf
A singular collection, Looking for Mr. Preston into various worlds on the Net as they fight govern-
edited by Laura Antoniou collects interviews, essays ment intervention in the last free frontier. $13.99 pb,
and personal reminiscences of John Preston — a man 1-85242-418-4. High Risk Books/Serpent’s Tail, 180
whose career spanned the industry from the early Varick Street, 10th Floor, New York NY 10014. Dis-
pages of the Advocate to various national best-seller tributed by Consortium.
lists, from pioneering gay men’s pornography to
serious fiction and community-building essay /an-
thologies. Twenty-five of Preston’s colleagues, friends
and disciples pay homage to his life and work, includ-
ing Sasha Alyson, Stan Leventhal, Joan Nestle, Felice Worthy Foes: Differently Abled Heros edited by
Picano and Carol A. Queen. $23.95 cl, 1-56333-288-4. Gary Bowen is a short collection of short sci-fi/
Richard Kasak/Masquerade Books, 801 Second Ave- fantasy /psychological horror stories about women
nue, New York NY 10017. Distributed by BP, Alamo and men with different abilities who overcome chal-
Square. lenges and succeed in spite of obstacles no human
should have to face. Although only one is written by
a woman, two of the three have a woman hero. Pretty
good. $6 pb, 1-887666-12-5. Obelesk Books, PO Box
11A18, Ellkatonm MD o 219 22 ; 4S10-q392u-364a0. rDisterib.ut ed bOy
The Stone of Laughter by Hoda Barakat, trans-
lated by Sophie Bennett, offers the contradictory history
of Beirut, a city under fire, through the life and dilem-
mas of Khalil, a gay man who tries to avoid ideological
or military affiliations as he finds himself confronted This is
with the collapse of his civil society. Unlike his friends Tt s lpoeockus uwmo.rse
at a newspaper who think falling bombs are great sto- than it feels...
ries and promotion rather than tragedy and
destruction, Khalil realizes that in a city at war, no one
can remain neutral. $12.95 pb, 1-56656-190-6; $29.95 cl,
-197-3. 40% for 5+. Interlink Publishing Group, 46
Crosby Street, Northampton MA 01060; 413-582-7054,
fax 413-582-7057. Distributed by B&T, Ingram.
Nearly Roadkill: An Infobahn Erotic Adven-
ture by Caitlin Sullivan and Kate Bornstein (Gender
Outlaw) is a novel written in cyberspace, an Infobahn “Your First Pelvic Exam”
erotic thriller without any boundaries — virtual, sex- Illustration by Debbie Palen, from The Period Book
ual, legal or otherwise. What-appears-to-be Girl (Walker and Company) See page 125, this issue.
Volume 19 Number 1 103
This content downloaded from
(cid:0)(cid:0)(cid:0)(cid:0)(cid:0)(cid:0)(cid:0)(cid:0)(cid:0)(cid:0)(cid:0)(cid:0)74.108.41.47 on Thu, 28 Mar 2024 00:53:40 +00:00(cid:0)(cid:0)(cid:0)(cid:0)(cid:0)(cid:0)(cid:0)(cid:0)(cid:0)(cid:0)(cid:0)(cid:0)
All use subject to https://about.jstor.org/terms","['1-85242-418-4', '1-56333-288-4', '1-887666-12-5', '1-56656-190-6']"
107,"THE FEMINIST ALCOTT
Stories of a Woman's Power
Edited, with an introduction,
Second Edition by Madeleine B. Stern
ROOT OF BITTERNESS The four engaging potboilers in this collection,
D ofo c u Am me en rt is c a nof W th ome eS nocial History Ae td h lci et o e td p t o 's w b ey fr e m li st it ne rr iu sa g tr gy l c e o s n l b ve eu it ct w th ie o e nM n s .a d te hl ee i n se e x eS st e r an n, d i lf luea mtu inr ae te
E Ad ni nte d B rb ay ud eN , a n Lc oy r i F D. . C Go it nt, z b eJ re ga ,n n ae n d Boydston, $40.00 cloth • $14.95 paper
Molly Ladd-Taylor CORPORATE VICTIMIZATION
T Ahi ms t eh ro ir cou ag nh ly w r oev mise ed n e 'd si t io sn o c o if a lt h e h ic sla tss oic r yte x t d rin aws on a wide OF WOMEN
variety of documents to reveal women's experiences Edited by Elizabeth Szockyj and James G. Fox
in the United States over three centuries. Focusing on the way corporations disproportionately
$45.00 cloth • $15.95 paper injure women in the labor market and as consumers,
this volume analyses issues ranging from the
NATURE’S BAN Dalkon Shield to sexual harassment on the job.
Women’s Incest Literature $47.50 cloth • $17.95 paper
Edited by Karen Jacobsen McLennan CATHOLIC GIRLHOOD
“ aA bos uim t p io nr ct ea sn tt .” a — w o Lr ok u i sa es Da en Sy al v t ohat has been published NARRATIVES
T hr isa td oi rti yo ,n a tll hy e f inor cg eso tt t e nn a r ro ar t i vs eu sp p ir ne s s te hd i s i n a n tli ht oe lr oa gr yy ET lh izae b e tC hh u Nr . c Eh va s da an ud gh t eS relf-Denial
reveal that generations of women have given This pioneering study of thirty-three girlhood
familiar and repeated voice to the incestuous memoirs by women such as Sarah Bernhardt and -
experience. Simone de Beauvoir offers keen insights into the
$45.00 cloth • $16.95 paper Church's concept of the ideal Catholic woman
and the femininity training used to instill it in
A DISGRACEFUL AFFAIR Catholic girls.
Simone de Beauvoir, Jean-Paul Sartre, $28.95 cloth
and Bianca Lamblin
In this intimate memoir, Bianca Lamblin tells the
story of her ménage ā trois with Simone de Beauvoir
and Jean-Paul Sartre, and their abandonment of
her, a Jew, at the onset of World War II.
$24.95 cloth
360 Huntington Avenue, 416CP
Boston, MA 02115
This content downloaded from
(cid:0)(cid:0)(cid:0)(cid:0)(cid:0)(cid:0)(cid:0)(cid:0)(cid:0)(cid:0)(cid:0)(cid:0)74.108.41.47 on Thu, 28 Mar 2024 00:53:40 +00:00(cid:0)(cid:0)(cid:0)(cid:0)(cid:0)(cid:0)(cid:0)(cid:0)(cid:0)(cid:0)(cid:0)(cid:0)
All use subject to https://about.jstor.org/terms",[]
108,"i
Feminist Bookstore News
re. UNIVERSITY PRESSES
ppm
=F in HRAT I A
By Mev Miller scientific discipline. ($29.95 cl, 0-8018-5141-6.) Iron
Men, Wooden Women: Gender and Seafaring in the
I noticed a trend this Spring that I think is rather | Atlantic World, 1700-1920 edited by Margaret
curious. Several women’s studies titles — history and | Creighton and Lisa Norling considers some of the
biography especially — have been written by men! The | women who made it out to sea. ($16.95 pb, short
credentials of the writers don't appear to be women’s | discount, 0-8018-5160-2.) Women’s Health: The
studies oriented; rather, they seem to be men working | Commonwealth Fund Survey edited by Marilyn Falik
in their fields who have shown an interest in the works | and Karen Scott Collins reports on the 1993 survey that
of women. Wow! (Or should I say...finally!) I debated | revealed the numerous ways women’s health is too
about how many of them to include here since I know | often neglected. ($18.95 pb, 0-8018-5354-0.)
many stores prefer to buy women-oriented material
written by women. I've included some — not all. And I if
don't think I had a formula for why I chose some and |
not others. Generally, though, I included them for their !
overall suitability in women’s stores. MIT PRESS
I recently received notice from Georgia State Though expensive, technical and specific, MIT
University Press that they have gone out of business | Press has three titles this season that will be of interest
as of June 30, 1995. to those with strong clientele interested in art and
architecture. The Architect: Reconstructing Her
COLUMBIA UNIVERSITY PRESS Practice edited by Francesca Hughes examines how
Deviant Eyes, Deviant Bodies: Sexual | theintroduction of women to the main body of archi-
Re-Orientation in Film and Video by Chris Straayer tecture might bring reconstruction of the orders that
adds to the growing list of film books from feminist | pervade architectural production and consumption.
and queer theory perspectives. Straayer looks at com- ($35 cl, 0-262-08245-4.) Inside the Invisible: An
mercial film and video from a new angle by | Elliptical Traverse of Twentieth Century Art, In, Of,
considering the number of films made by and for | and From the Feminine edited by M. Catherine de
non-traditional (feminist and queer) viewers. $17.50 | Zegher coincides with an exhibit by the same name
pb, 0-231-07979-6, June. . opening at the Institute of Contemporary Arts in
Boston. Both the book and the exhibit present a gen-
JOHNS HOPKINS UNIVERSITY PRESS dered reading of 30 “invisible” women artists of
JHU offers three highly academic titles of limited | different backgrounds and experiences. ($35 pb, 0-
interest to general readers in women’s issues. I men- 262-54081-9.) Out of Order, Out of Sight by Adrian
tion them here on the off-chance that yowll have Piper comes in two volumes — Volume I: Selected
interested customers. Cultivating Women, Cultivat- Writings in Meta-Art 1968-1992 ($35 cl, 0-262-
ing Science: Flora’s Daughters and Botany in 16155-9) and Volume II: Selected Writings in Art
England, 1760-1860 by Ann Shteir explores a brief time Criticism 1967-1992 ($35 cl, 0-262-16156-7). Adrian
when women were welcomed equal partners in a Piper is an internationally recognized conceptual artist
Volume 19 Number 1 105 May/June 1996
This content downloaded from
(cid:0)(cid:0)(cid:0)(cid:0)(cid:0)(cid:0)(cid:0)(cid:0)(cid:0)(cid:0)(cid:0)(cid:0)74.108.41.47 on Thu, 28 Mar 2024 00:53:40 +00:00(cid:0)(cid:0)(cid:0)(cid:0)(cid:0)(cid:0)(cid:0)(cid:0)(cid:0)(cid:0)(cid:0)(cid:0)
All use subject to https://about.jstor.org/terms","['0-8018-5141-6', '0-8018-5160-2', '0-8018-5354-0', '0-262-08245-4', '0-231-07979-6', '0-262-16156-7']"
