PageNumber,Text,ISBNs
74,"The Feminist Bookstore News
and Other Stories, $15 pb, -1401-0; $35 cl, -1400-2,
300pp; and a new feminist philosophy collection
edited by Alison Jagger and Susan Bordo:
CACTUS Gender/Body/Knowledge: Feminist Reconstruc-
tions of Being and Knowing, $12 pb, -1379-0; $42 c|],
THORN 1378-2, 384pp, June.
OHIO STATE UNIVERSITY PRESS
A novella by Mary Austin Books & Life. Jan Clausen is well-known for
With a foreword and afterword by Sinking/Stealing (Crossing, $8.95), a novel about
Melody Graulich lesbian parenting and child-custody, and as a poet and
121 pages, hardcover, $15.95 e ss ivsa ey i bst o. o k T h re es ve i e wea sr n ae nst d, cr oe mad mab el ne t aa rn ied s f or ne q u we on mtl ey n a ab nr da-
“Austin has combined the limpid, bone-deep
prose of her finest landscape writing with a militarism, political morality in fiction and poetry, and
complex psychological portrait of a love affair, the lesbian community first appeared in off our backs
producing what must surely rank as a new classic and other feminist periodicals. There’s something
of western American literature.” ironic about the “packaging” of this book though, and
—Pamela Herr, it may need your recommendation in order to sell:
San Francisco Review of Books Clausen is shown on the back cover with a child,
painting a political banner — not a bad illustration of
the sense of herself as a person and an activist she
WESTERN brings to her writing, but the front cover (except for
the purple type) looks like a bad generic label, $8.95
TRAILS pb, 0 - A8 l1 s4 o2 - f r0 o4 m70 - O8; h i$ o2 4 S.9 ta5 t e c : ] , J u- s0 t4 i6 f5 ia- b1, l e 2 H37 op mp i. cide: Bat-
tered Women, Self-Defense and the Law, Cynthia
A Collection of Short Stories by Gillespie, $24.95, -0466-x, 320pp, analyzes over 300
Mary Austin cases in which women killed their batterers, a situa-
Selected and annotated by tion the legal system has rarely recognized as “self-
Melody Graulich defense.” And, from last season, Art & Anger, a
307 pages, hardcover, $24.95 collection of Jane Marcus’ peppery and influential
“These short stories are timeless reading. They early essays on Virginia Woolf. (Ugh, these covers!
are a testimony to Austin’s lifelong concern with This one features a creepy Beardsley drawing.) $11.95
women. ... Austin may be the most quotable pb, 0460-0; $30 c], -0453-8, 286pp.
woman of North American letters in this
century.” PERGAMON PRESS
—Lynne Bundesen, Russian Women’s Studies, Tatyana Mamonova
Los Angeles Times If this were only “essays on sexism in Soviet culture,”
as the subtitle indicates, it would be a timely book.
Available at your local bookstore, or from M Ra um so sn iaov na n fo ot l k o ln oly r e e ,x ”p l o Sr oes v i t eh te w“m oa mtri ea nrc ’h sa l m ro oo vts e min ents,
NEVADA At Russian pornography, homophobia, sexuality, and
University of Nevada Press Soviet film and literature, she also gives a valuable
Reno, NV 89557 (702) 784-6573 Russian perspective on U.S. feminism. Activists may
be especially interested in her thoughts on anarchism
and feminism. One caution: Mamonova uses
“Russian” in the title deliberately — she writes pri-
May/June 1989 Volume 12 Number 1
This content downloaded from
(cid:0)(cid:0)(cid:0)(cid:0)(cid:0)(cid:0)(cid:0)(cid:0)(cid:0)(cid:0)(cid:0)(cid:0)70.126.145.227 on Sat, 19 Mar 2022 17:42:04 UTC(cid:0)(cid:0)(cid:0)(cid:0)(cid:0)(cid:0)(cid:0)(cid:0)(cid:0)(cid:0)(cid:0)(cid:0)(cid:0)
All use subject to https://about.jstor.org/terms",[]
75,"The Feminist Bookstore News
—
nR AAI I A
marily about ethnic Russians, not residents of the Meatless Days, Sara Suleri. This fluidly written,
Baltic, Asian, and other non-Russian parts of the meditative autobiography is organized around meta-
USSR, $14.50 pb, 0-0803-6481-0; $36 cl, -6482-9, 178pp. phors Suleri draws from the history of her family —
Taking Our Time: Feminist Perspectives on food, her sister's and mother’s deaths, her father’s
Temporality, ed. by Frieda Johles Forman & Caoran moods. The stories she tells, against a background of
Sowtow. These essays and poems on nursing sched- mundane family life and the recent political history of
ules for mothers, defining the periods in women’s her native Pakistan, effectively convey a mood of
life-cycle, defining time by one’s periods, the slippery mourning against a resolve to live in the present and
distinctions between what's past and what's present, find humor in the ordinary and of negotiating un-
etc, share a political theme: the ways in which women stable boundaries between self and family and be-
live on men’s time in patriarchal societies and the tween past and present. Readers interested in
ways in which we do, or might, name our own time. Pakistan, Islamic cultures, family dynamics, or bio-
This innovative book is tough to generalize about, but graphy will find Meatless Days especially interesting,
fun and thought-provoking to read, $14.95 pb, 6477- $17.95 cl, -77980-7, 186pp.
2; $36 cl, 6478-0, 209pp. AN
UNIVERSITY OF CHICAGO PRESS
rlif NRI
As usual, Chicago has many books that a feminist
tb ho oo auk gst ho r u ae l l m bi dug th t o nc iea r r oey r. tI w n of o u wn id llc a hs a v em e a n smy s a la l,s . sn pi en ce i, alized Robin T Lh . e S h eW etso m & a n W i llQ iau me s Vt ei eo dn er, . TE hli isz a 3b -e vt olh u m eH e sels tinger,
is intended to introduce students to the range of main-
Wage Justice: Comparable Worth and the Para- stream, middle-class thought about women during
dox of Technocratic Reform, Sara Evans (Personal the Victorian Era. Each volume includes commentar-
Politics) and Barbara Nelson. This unique, Wide-rang- ies and quotations from particularly influential or
ing study is detailed enough to be useful to women typical English and U.S. writers. Margaret Fuller and
organizing for comparable worth (equal pay for jobs Queen Victoria are two of the six thinkers chosen to
requiring similar skills and backgrounds, whether set the terms of debate in the first volume, for example.
done by women or men) and brief and clear enough In addition to presenting a short course in Victorian
for readers with more general interests in the vital studies, the authors make the point that Victorian
subject of women’s wages. Evans and Nelson combine attitudes toward women were a matter of lively de-
a careful evaluation of comparable worth in Minne- bate, not a single, well-established conservative view
sota where, they say, pay equity has made the most with a few memorable feminist detractors. Volume 1:
progress, with tough questions like its reinforcement Defining Voices $9.95, -32666-7, 158pp; Volume 2:
of hierarchy in the workplace — more preparation or Social Issues $12.95, -32667-5, 270pp; Volume 3: Lit-
more people to supervise equals more pay, even erary Issues $11.95, -32668-3, 247pp. The volumes can
though everyone's work is valuable and essential. The be ordered and sold separately. Stores with a large
authors conclude that comparable worth must remain college clientele can sell these; others might want to
part of the feminist agenda, but as a tactic, a step in the wait for a review in Women’s Review of Books.
direction of social justice, not an end in itself. $24.95 cl, Other Chicago women’s studies titles are: Sarahs
0-226-22259-4, 216pp. Choice, intellectual poetry by Eleanor Wilner that
Volume 12 Number 1 73 May/June 1989
This content downloaded from
(cid:0)(cid:0)(cid:0)(cid:0)(cid:0)(cid:0)(cid:0)(cid:0)(cid:0)(cid:0)(cid:0)(cid:0)70.126.145.227 on Sat, 19 Mar 2022 17:42:04 UTC(cid:0)(cid:0)(cid:0)(cid:0)(cid:0)(cid:0)(cid:0)(cid:0)(cid:0)(cid:0)(cid:0)(cid:0)(cid:0)
All use subject to https://about.jstor.org/terms","['0-0803-6481-0', '0-226-22259-4']"
76,"The Feminist Bookstore News
weaves sacred mythology into contemporary violence story of a poor German family’s deadly encounter
to make a life-affirming message, $9.95, -90028-2; $22, with laws, local fears and political ambitions, but does
-90027-4, 112pp; Elizabeth Barrett Browning: The not focus on women’s experience.
Origins of a New Poetry, a new feminist biography
and critical interpretation of her poems, by Dorothy UNIVERSITY OF NORTH CAROLINA
Mermin, $15.95 pb, -52039-0; $48. cl, -52038-2, 320pp, The Poems of Phillis Wheatley, ed. by Julian D.
June; The Transformation of Family Law by Mary Mason, Jr. This revised edition includes all the verses
Ann Glendon charts the unprecedented changes in known to have been written by the America’s first
heterosexual marriage, divorce and child-custody widely-published Black poet. Her poems are polished
laws since the 1960's, comparing the U.S. and four combinations of classical and Christian images and
western European countries, $29.95 c], -29969-4, were commonly written as compliments or con-
344pp, June; Feminist Theory in Practice and Process, dolences to some white “lady” or “gentleman.” Writ-
edited by Micheline Malson and others is a collection ing during the 1770's, Wheatley also chose patriotic
of articles from the women’s studies journal Signs, themes and occasionally wove in less conventional
$14.95, -50294-5; $30 cl, -50293-7, 320pp; Bearing the political messages, such as her refrain “Remember
Word by Margaret Homans shows how Mary Shelley, Christians, Negros, black as Cain, may be refin’d and
the Brontes and other 19th Century women writers join th’ angelic train” and the poem “Niobe in Distress
attempted to center their novels on female experience, for her Children Slain by Apollo,” which Alicia Os-
$13.95 pb, -35106-8, 326pp, June; Under African Sun, triker suggests may discreetly speak to slavery and
Marianne Alverson’s memoir of her two years in Bots- Wheatley’s own mother’s experience, $12.95, 0-8078-
wana as an anthropologist’s wife and her growing 4241-1; $24.95 c], -1835-6, 235pp.
understanding of her women neighbors’ lives, $11.95, Women and the Law of Property in Early Amer-
-01624-2, 233pp. Highroad to the Stake: A Tale of ica, Marylynn Salmon.Writing with a minimum of
Witchcraft by Michael Kunze is a gripping, tragic legal jargon, Salmon examines women’s legal rights in
TA E EN LA ISN TED D THE WOM eE N y A N DVIAE MAR VY O R SH EEATON
WOMAN aN ndO T LI o v eeVita d VW al : Aa
JUDITH HICKS STIEHM ITS
Edited by
a“ cT ch oi us n tv i v ofid Aa mnd e r ip cr ao nv o wca ot miv ee n N aA nN d B A NU AER N CMA YG L I SN CHNIEDEWIND DEE GARRISON
min o rt eh e t i mm eil li yt .a r .y … . Sc to ieu hld m ’n sot be There are 35 million VLo on rsg e n ce og mle ec st e ad l i vb ey i nh i s tt ho ir sy , first
sa ru s es s eve t e ns a as i ln lm „i e t s ‘n h tt t eh se i t d rso r eaf e —am ta l s uwt o a mh Bn n se o e’ s — is t l m i t m tf ya a aor y re nrm yt Fn dh y r ’s i’ p s e r d t oA a h b naa lmmt emeb s.r ”i iv ca al ’e snt t sos o bs Wtot ff rt e e i o pp e n t mw fef hgpv aa o e e mem p m n r a iyi a e e l l ix n ii r f e ne p sefs e e .m i nrn v ti oii hen ent w en i. sc c A th e Pi n m i o T l vp lode ioeh f trr r l i ei v c i sc n m e apsa ld. e i ch l t lO a ia ii nosn vn nee sa thology s s wab p u o oi i o cfo o uf rifg n g ao lr dlr e hr iaea se tg p r mr pe h u e f ,y nl aoa m c nb r f ee o o o e . rf r mv l ie b imo njh eo f ire eu sr tn r ma t tn rh , ,l a i i e al f i ns ae s h nwt. e d o A a mn ed n's
Economy Series $27.95
74
This content downloaded from
(cid:0)(cid:0)(cid:0)(cid:0)(cid:0)(cid:0)(cid:0)(cid:0)(cid:0)(cid:0)(cid:0)(cid:0)70.126.145.227 on Sat, 19 Mar 2022 17:42:04 UTC(cid:0)(cid:0)(cid:0)(cid:0)(cid:0)(cid:0)(cid:0)(cid:0)(cid:0)(cid:0)(cid:0)(cid:0)(cid:0)
All use subject to https://about.jstor.org/terms",[]
77,"The Feminist Bookstore News
ni
————
A
each colony/state, describing changes from 1750 to ingly readable survey of feminist insights into family
1830, and suggesting how closely actual custom fol- roles and family therapy covers single women and
lowed the law in each time and place. Salmon finds single-parent families as well as more traditional top-
wide variation in both law and enforcement, noting ics like mother-daughter and couple relationships. It
for example that while “in one way or another, every- is inclusive of lesbians and gay men, though they
thing women owned before marriage became their don't figure in many examples. I found its most useful
husbands’ afterwards” married women in some states
feature to be the way in which it presents examples:
went on making business transactions without ques- therapists compare how a traditional family therapist
tion, nominally as agents of their husbands. In a con- would have defined the problems with their own
clusion some historians will find controversial, she feminist approaches, $30 cl, 0-8986-2734-6, 422pp.
also argues that, in general, white women gained, Guilford books are available at 43% discount for one
rather than lost, property rights during this pe- or more copies from Publishers Marketing Services,
riod.$10.95 pb, -4244-3; $26 cl, -1687-6, 267pP. 11661 San Vicente Blvd, #206, Los Angeles, CA, 90049.
The Cold War Romance of Lillian Hellman and AN
John Melby by Robert P. Newman (male author).
Hellman fans will find that this well-written study of
her long affair with a diplomat and her experiences
during the anti-Communist inquisition of the 1950's, UNIVERSITY OF MINNESOTA PRESS
as revealed by newly available documents, fills in Feminism and Anthropology by Henrietta L.
some of the notorious gaps in her fascinating Moore sketches the evolving relationship between
memoirs, $24.95 cl, -1815-1. 490pp. feminism and anthropology from the early 1970s to
the present, outlining important debates over how to
SOUTHERN METHODIST UNIVERSITY study women cross-culturally, summarizing key re-
Windfall & Other Stories, Winifred Sanford. search, and evaluating the progress of feminist an-
Selected from the dozens of stories Sanford published thropology in reshaping the discipline as a whole —
in magazines in the 1920's, these tales of women in a remaking the “science of man” has been more than a
Great Lakes fishing port, a wealthy suburb, and the oil matter of “add (research on) women, and stir,” the
boomtowns of Texas are remarkable for their insight- author remarks. Anthropologists (I'll cast my vote
ful portrayal of the ways in which women cope with here) should find this book moderately interesting
tragedy. The author’s politics, liberal at best for the and controversial. Others may find the dry, academic
‘20's, detract from her stories, but as examples of writing hard to follow. Moore does make an important
strong women characters and realist short fiction, they contribution with her consideration of racism, but
deserve a new look, $8.95 pb, 0-8707-4268-x; $17.95 cl, we'll have to wait for another book to see anything on
-4267-1, 179pp. SMU books are distributed by Texas lesbians or homophobia. Lastly, I'm sorry the book is
7A 78& 43M . Univ. Press, Drawer C, College Station, TX, Mso a r a gh ai rs et to r i Mca el a d — , E f lse im e i n Ci ls et w sa n Pt ah rr so op no sl o g any d w oa ts h ea r s g o fa rl o m of
GUILFORD PRESS at least the 1920's on, and their impact on the discip-
line and the public should have been part of this study,
The Invisible Web: Gender Patterns in Family $15.95 pb, -1750-3; $39.50 c], -1748-1, 246pp. In Surviv-
Relationships, Marianne Walters, et al. This refresh- ing Sexual Violence, Liz Kelly, an English feminist
Volume 12 Number 1 75 May/June 1989
This content downloaded from
(cid:0)(cid:0)(cid:0)(cid:0)(cid:0)(cid:0)(cid:0)(cid:0)(cid:0)(cid:0)(cid:0)(cid:0)70.126.145.227 on Sat, 19 Mar 2022 17:42:04 UTC(cid:0)(cid:0)(cid:0)(cid:0)(cid:0)(cid:0)(cid:0)(cid:0)(cid:0)(cid:0)(cid:0)(cid:0)(cid:0)
All use subject to https://about.jstor.org/terms","['0-8986-2734-6', '0-8707-4268-x']"
78,"The Feminist Bookstore News
researcher and sixteen-year battered women’s shelter
THE FUTURE OF AN ILLUSION worker, outlines current British feminist thinking on
sexual violence and the effectiveness of shelters, sup-
F Cil om n, s tF ae nm cin ei s m P, e nan led y Psychoanalysis p go ar nt i zg ir nou gp s , a cla tw ivs, i tc ih ei sld . - p Cro ot nec st iio dn e r p ar ta ic oti nce s o a fn d r o ar c- e, class,
PA e n p leiv yo t aa nl a lf yi zg eu sr e t h i en pt rh ie m ad re yv e l mop om vee mnt e n to sf tf he am t i n hi as vt e f sil hm ap et dheory, lesbian identity and homophobia are all important in
the field. This collection encompasses avant-garde films, her excellent work, as is accessible writing, $14.95,
video, popular cinema, television, literature, and critical and -1753-8; $45 cl, -1751-1, 273pp.
cc t lu ohl tt heu ,r a l $s 1 et 3h x .9e 5uo r a y pl a p i en p r o a Ml i ew t do i iar c k s & e s o Ss oe f cn i t e i ta r yl e t spo er r ia e en ssy eo nne t a i tnt ie or nes .t e d I li ln ustrated. $29.50 of an A Il ls lo u s if or no :m F iM lmin , n Fes eo mta in it sh mis aS np dr i n Pg sy ca hr oe a: n T alh ye s i sFuture
essays on film, television, and literary criticism by
THE STREAM OF LIFE Camera Obscura and Feminism and Film Theory editor
Clarice Lispector Constance Penley, $13.95 pb, -1772-4; $29.50 cl, -1771-
Translated by Elizabeth Lowe and Earl Fitz 6, 212pp, 34 photos; and The Stream of Life by Brazil-
Foreword by Hélène Cixous ian writer Clarice Lispector, ”...a lyrical novel that
“Clarice Lispector...is the premier Latin American woman communicates the self-discovery and self-affirmation
gp T rr i emo as tee es s w tB r o wi ot k oe rr k R o e f ov fi e t wh f.i i s c tG ic oee nnn ,et r u a tr l hly y i. s . . ” r i ne gA ta el r nf dr se ee d d a naJ s d. LM lyisc rpA ie cd c aa t lm o r n, ' s o vN ee lw York o Hf m mit ms .u .. n n $9am .95e d p bfe , m -a 1l 7e 8 2p -r 1o ; t a $g 1o 9n .9is 5t , ” c ], s a -y 1s 7 8 t 1h -3e , c 1a 2t 8al po pg ..
chronicles its female protagonist's journey of self-discovery
a En md e rs ge el nf- ta ! f f Li ir tm era at ti uo rn e. s $19.95 cloth, $9.95 paper UNIVERSITY PRESS OF NEW ENGLAND
New England offers two interesting literary biog-
SURVIVING SEXUAL VIOLENCE raphies this Spring: Sarah Orne Jewett: An American
Liz Kelly Persephone by Sarah Way Sherman discusses how
Based on extensive interviews with victims of sexual this important late 19th Century novelist and short
violence—experiences ranging from subtle threats to story writer wrote from within a “female world,”
p Kp e erh llv yy a s s i avi rec t i a cp ul r lo a b ta ele st m t t a h c a en k d p s o — a wll e L r o fi f uz l i t aK s n d e m l cal ony nif s's e ts r t u a ci t tm i io vn ep s . o s tUr rlt at tia emn ga it et se l yb ,ook addresses the Jth ewou eg th t’ s I B c oa sn to't n t mell a r rf ir ao gm e tt oh e w c ra itt ea rlo g A nh no iw e Fsh iee l d sh ,andles
women use to resist, cope with, and survive the violence $15.95 pb, 0-8745-1484-3, $35 c], -1477-0, 384pp, 10
that invades their daily lives. $45.00 cloth, $14.95 paper illus.; and Vera Brittain and Winifred Holtby, a
Feminist Perspectives series Working Partnership, by Jean Kennard, “a feminist
FEMINISM AND ANTHROPOLOGY literary study” of the enduring friendship of these two
Henrietta Moore English feminist, anti-militarist and anti-racist activ-
ists and writers, showing how their partnership in-
oA an fl t t h h ao r u o mpg oh al l o e -gw dio c oam ml e i nn f as ie t l edr d o l se mts u o d da ir ee le s , oo ftf h t e e tn h p e ed re wss p oc rr ec li db ti .e vd e M i oin os r eu s u aral gl uy e s t h ta ht at f pl bu ,e n -c 1e 4d 8 2 -t 7h ;e i r $ 2 8w o cr ]k , -d 1u 4r 7i 4n -g 6 , t 2h 5e 6 p 2 p0 .'s and 30's, $12.95
feminist anthropology, with its emphasis on the construction
of differences and the relationship of gender to class, race, UNIVERSITY OF NEW MEXICO PRESS
culture, and history, has the potential to address important
theoretical issues in both feminism and anthropology. Untold Sisters: Hispanic Nuns in Their Own
$39.50 cloth, $15.95 paper Feminist Perspectives series Words, by Electa Arenal and Stacey Schlau. This il-
lustrated bilingual reader presents the work of many
University of nuns. The authors also discuss the ways in which nuns
Minnesota structured memoirs, poems and letters to make their
meanings ambiguous and acceptable to male Church
hierarchy while still satisfying themselves and each
Press Minneapolis MN 55414 other with self-expression and communication. Selec-
tions also provide glimpses of convent life, the nuns’
May/June 1989 76
This content downloaded from
(cid:0)(cid:0)(cid:0)(cid:0)(cid:0)(cid:0)(cid:0)(cid:0)(cid:0)(cid:0)(cid:0)(cid:0)70.126.145.227 on Sat, 19 M on Thu, 01 Jan 1976 12:34:56 UTC
All use subject to https://about.jstor.org/terms",['0-8745-1484-3']
79,"The Feminist Bookstore News
ls onii OI l
irm
written for an audience of fellow literary critics.
$19.95 pb, 0-8263-1106-7; $39.95, -1105-9, 464pp, 44 What’s new here for the nonspecialist are articles on
illus. Gerd Brantenberg’s Egalia's Daughters (Seal Press),
Other feminist picks: Marion Post Wolcott, intro- sexism in the work of Woody Allen and “men’s move-
duction by F. Jack Hurley includes 150 of Wolcott's ment” poet Robert Bly, and the misrepresentation of
wonderful black and white photos, taken for the Farm lesbian sexuality in literature, $12.50 pb, -6023-7;
Security Administration during the Depression and $29.95 c], -1562-2, 250pp.
afterward on her family farm in Virginia and in the New in labor theory and history are: Homework:
Middle East, India and Pakistan. Anyone familiar Historical and Contemporary Perspectives on Paid
with Depression-era photography will recognize Labor at Home, ed. by Eileen Boris and Cynthia
some of these, $19.95 pb, -1115-6; $39.95 cl, -1114-8, Daniels, showing the advantages to employers of
248pp; Georgia O'Keeffe is a catalog of work, mainly home-based production from turn-of-the-century
from private collections, designed for an exhibit in piece work to computer programming by women on
Japan, $27.50 pb, 0-9350-3727-6, 105pp, 36 color and 6 the “mommy track,” $12.95, -6054-7; $32.50 cl, -1601-7,
b&w illus.; and, We Fed Them Cactus by Fabiola 288pp; and Upheaval in the Quiet Zone: A History of
Cabeza de Baca is a memoir of a girls growing up on the Hospital Workers’ Union, Local 1199, Leon Fink
a northeastern New Mexico ranch around 1900, in the and Brian Greenberg (male authors), on a primarily
era before U.S. culture and English language came to Black and Hispanic women’s union, $9.95 pb, 6047-4;
dominate the area, $10.95, 0517-2, 200pp. $34.95 c], -1545-2, 320pp, June.
„ Other possibilities are: Women and the Ances-
UNIVERSITY OF ILLINOIS PRESS tors: Black Carib Kinship and Ritual, by Virginia
Illinois offers at least eight new titles for feminist Kerns, emphasizing the importance of older women
bookstores this Spring. You probably won't order any in Caribbean cultures, $14.95 pb, 6077-6, 288pp, 44
in quantity but remember that Illinois’ minimum is illus.; Women and Music in Cross-Cultural Perspec-
only 5 and the backlist includes three Zora Neale tive, ed. by Ellen Koskoff, $11.95 pb, -6057-1, 280pp,
Hurston titles and Lesbian Psychologies. 10 illus; and the first of a four-part feminist novel
New lit crit titles are: A Life Distilled: Gwendo- (formerly a Virago Classic, I think), Dorothy Richard-
lyn Brooks, Her Poetry and Fiction, critical essays by son's Pilgrimage, Vol. 1, $9.95 pb, -6076-8, 496pp, July.
Gayle Jones, Barbara Christian, Hortense Spillers and
others, edited by Maria K. Mootry and Gary Smith, JOHNS HOPKINS UNIVERSITY PRESS
$10.95, 0-2520-0605-2, 286pp; Engendering the Word, Hopkins recent backlist offers: Daughters and
ed. by Temma Berg, et al., essays on women’s writing Fathers, ed. by Lynda Boose and Betty Flowers, on
styles notable for their consideration of Caribbean and daughter-father relationships in U.S. and British lit-
Latin American writers and the work of U.S. women erature, $12.95 pb, 0-8018-3666-2; $39.50 cl, -3665-4,
of color, along with the customary examinations of 480pp; and in Elizabeth Barrett Browning: Selected
Emily Dickinson and H.D., $12.95 pb, -6016-4; $29.95 Poems, editor Margaret Forster, a well-known femi-
cl, -1555-x, 293pp; and Discontented Discourses: nist biographer, brings most of Browning's poems
Feminism, Textual Intervention, Psychoanalysis, ed. back into print (also note the Browning biography on
by Marleen Barr and Richard Feldstein. As the title University of Chicago’s list above), $9.95 pb, -3754-5,
hints, these articles are psychological in approach and $29.95 c], -3753-7, 224pp.
Volume 12 Number 1 May/June 1989
This content downloaded from
(cid:0)(cid:0)(cid:0)(cid:0)(cid:0)(cid:0)(cid:0)(cid:0)(cid:0)(cid:0)(cid:0)(cid:0)70.126.145.227 on Sat, 19 Mar 2022 17:42:04 UTC(cid:0)(cid:0)(cid:0)(cid:0)(cid:0)(cid:0)(cid:0)(cid:0)(cid:0)(cid:0)(cid:0)(cid:0)(cid:0)
All use subject to https://about.jstor.org/terms","['0-8263-1106-7', '0-9350-3727-6', '0-2520-0605-2', '0-8018-3666-2']"
