PageNumber,Text,ISBNs
26,"The Feminist Bookstore News
Toward a New Psychology of Women, Jean Baker Unbroken Ties, C. Becker.
Miller, $7.95 Medicine Card, J. Sams
Politics of Women’s Spirituality, Charlene Spret- If You're Afaid of the Dark, C. Edens:
nak, ed., $14.95. South of the Line, C. Ennis.
In Search of Our Mothers’ Gardens, Alice Walker, Healing the Child Within, C. Whitfield.
$8.95. Beyond the Eagle, E. Chambers.
Bread Givers, Anzia Yezierska, $7.95. Eleven Million Mile High Dancer, C. Hill.
Love Medicine & Miracles, B. Siegel.
Two Sisters In Her Day, R. M. Brown.
Menlo Park, CA Places of Interest to Women 1989, Ferrari.
Spring, 1989 The Dream Book, B. Bethards.
Reflections in the Light, S. Gawain.
Menopause Naturally, S. Greenwood. Mistress Moderately Fair, Sturtevant.
Crystal Handbook, Sullivan. Lesbian Passion, J. Loulan.
Littlest Book for the Heart, Edited
Do What You Love, the Money Will Follow. A Room of One’s Own
C Spo id re ap l e n Dd ae nn ct e , N So t a rM ho ar we k, . M. Beattie. Madison, Wisconsin
February, 1989
NEW! SPRING 1989 THE FORBIDDEN STITCH
Courage to Heal, Bass, $14.95.
edited by Lim & Tsutakawa Lesbian Ethics, Hoagland, $14.95.*
""..a breakthrough book, an Reflections in the Light, Gawain, $6.95.
ambitious work that provides a The Chalice and the Blade, Eisler, $9.95.
g s Fuo rro ar nd o c u ii snn cdt oir n o Cgd h u rc A ot si no i ian cn l e t w o R o emt vh ie ee n w . ""m y Sas nteries o u NI AIn d u H lte r C hD ia ly dr, e nB :r o Sw en cr, e t$ s4 .5 o0 f. Dysfunction, Friel,
""There's beautiful, touching writing $8.95.
here.."" Christian Science Monitor 7 For Lesbians Only, Hoagland, $16.95.*
8 Codependent No More, Beattie, $8.95.
9 Healing the Child Within, Whitfield, $8.95.
10 Lesbian Couples, Clunis, $10.95.
* Author Appearance.
FLORILEGIA WOMEN AND AGING ClaireLight
A RETROSPECTIVE OF Santa Rosa, CA
CALYX, 1976-1986 ""Don't miss any of Women and February, 1989
Aging! Sojourner
""..dense, intense, rich."" Tee ""...an awakening experience."" Belles
Corinne, Lambda Rising Book Lettres 1 Breaking Free From Compulsive Eating, G. Roth,
Report New American Library, $4.50.
A$nt2h4olo.g9y,5 25 6c plaogets,h $ 12 p paapepr,e rAn,t ho l$og2y,8 2.692 5 p ag ecs, l $o14t.9h5 2 1 t2 i o nS st ,e p s $ 6 .f 9o 5r . Adult Children, Recovery Publica-
""A book of the hT eH artE ."" LR ee I b V y LE y nAR cnH hd ,r O e SaU a nCS a E Fr rl i as nlS e cT iscO o R CI hE rS onicle 3 H se ha al win ,g H t eh ae lt hS h Cam ome m t uh nat ic a B tii on nd ss , Y $o 9u .9, 5 .John Brad-
Fiction, 144 pages, $8.95 paper, $16.95 cloth 3 Codđependent No More, M. Beattie, Harper & Row,
$8.95.
CALYX BOOKS. P.O. D Bis otr xib u t Bed Cby o r T val am la ln i s ,C o . OR 97339 (503) 753-9384 4 M $8a .9c 5.ho Sluts, Pat Califia, Alyson Publications,
May/June 1989 24
Volume 12 Number 1
This content downloaded from
(cid:0)(cid:0)(cid:0)(cid:0)(cid:0)(cid:0)(cid:0)(cid:0)(cid:0)(cid:0)(cid:0)(cid:0)70.126.145.227 on Sat, 19 Mar 2022 17:42:04 UTC(cid:0)(cid:0)(cid:0)(cid:0)(cid:0)(cid:0)(cid:0)(cid:0)(cid:0)(cid:0)(cid:0)(cid:0)(cid:0)
All use subject to https://about.jstor.org/terms",[]
27,"ΤΗο Εεπαϊηϊθι Βοοκθίουε Νευν5
ΡΟΒΟΤΗΥ ΑΙΙΘΟΝ ΓΊ ΑΠΘΟΝ ΒΕΟΗΡΕΙ. ΓΙ ΠΙΟΝΝΕ ΒΒΑΝΌ ΠῚ ΒΕΤΗ ΒΒΑΝΤ ΠΕΙ ΒΌΙΚΙΝ Π ΒΑΒΒΑΒΑ ΒΌΒΕΟΒΌ ΓΙ ΑΝΌΒΕΑ Εἰ ΕσΚ σι ΑΒΡΥ ΓΙ ΟΗΕΒΥΙ. Οι ΑΒΚΕ ΠῚ ΜΙΚΗΕΙ ΚΕ ΟΥ ΙΕΕ Π ΕΟΒΟΙΑ Οστβει!
Π ῚΟ ΒΘΑσΑΗΕΙΒ. ΘΙΌΟΙΡ Ο ΜὈΕνΟΒΙΕΒ ΑΓΊ ΙΜ Α ΒΕΙΟΣΝ Ε ΟΠΣΤ Ε Β| ΟΠΠ) Ε ἰ Ε ἰ ΕΝΕ ΘΕΒΙΥΕΕ ΑΠ ΕΠ ΙΝ ΕΝΕ ΥΘΑΜΙΕΟΑΒΌΝ ΠΠ ΗΑΤΤΙΕ ΟΟΘΕΤΤ ΠῚ ΙΑΝΙδ. ΚΕΗΥ ΠῚ ΙΟΑΝ ΠΝΌΑΌ ΠῚ ΑΌΌΒΕ ΠΟΒΌΕ ΓῚ ΙΟΠΙΤΗ ΜΟΌΑΝΙΕΙ. ΓΙ ΑΟΒΟΒΑ 1 ΕΨΙΝὅ ΑΝ]
ἜΑΝΕ νΑΌΟΗΝ Π ΑΝΝΑ ΤΙ
ΓΙ ΑΝΠΒΕΑ Εἰ ξσκΚ σι αβῶ ΟΕΕ ι Π ἨΕΙΕ
ΕιιεΥ Πε ΙΟηΑΝ ρΗΝΌεΑ Ει ΤΙ σΡΟΚΚΕΚΝΡ ΤΟ οτε νει
Π ΜΑΒΟΑΒΕΤ ΒΑΝΡΑΙΗ. ΓΙ ΒΟΤΗΑΝΝ ΒΟΒΘΟΝ ΓΊ ΜΑΒ ἐΕΟΒΕΣΤ ΓΊ ΒΑΒΒΑΒΑ ἐΜΙΤΗ ΓΊ ΕΑΝΕ ΨΑΟῊΝ ΓΙ ΑΝΝΑ Ξ ΕΕ ΨΝΆΙΤΕΒΣ ΓΙ ΗΑ ΥΟΌΝΘΒΙΟΟΌ ΓΙ ΥΨΟΝΝΕ ΖΙΡΤΕΒ ΓΙ ΒΟΒΟΤΗΥ ΑΙΠΊΞΟΝ ΓΊ ΑΠΒΟΝ
Π ΜΑΒΙΟΝ ΕΟΞΤΕΝ ΓῚ ΕΠΕΕΝ ΕΒΎΕ ΓΊ ΕΠΕΕΝ ΘΑΙΕΟΒΌ ΓΊ ΗΑΤΤΙΕ ΞΟΘΘΕΤΤ ΠῚ |ΑΝΙΣ ΚΕΙΊΥ ΠῚ ΙΟΑΝ ΠΝΌΑΌ ΓΙ ΑὔΌΒΕ ἸΟΒΡΕ ΓΊ ΙΌΡΙΤΗ ΜΟΡΑΝΙΕΙ. ΕἸ ΑΌΒΟΒΑ ΙΕΨΙΝὅ ΑΝΌ ΒΟΑΒΙΟ ΜΌΝΑΙ ΕΖ ΓΊ ΙΟΑΝΙ
ΑΙΤΕΒΣ ΓΙ θΗΑΥ ΥΟΌΝΘΒΙΟΟΌ ΓΙ ΥνΟΝΝΕ ΖΙ Ι ΒΒΔΑΙΤ ΠῚ ΒΑΒΒΑΒΑ ΒΌΒΕΟΒΟ ΓΊ ΑΝΌΒΕΑ Εἰ ΕΟΚ σι ΑΒΟΥ
ΟὮ Ἐ Β ΒΣ Ρ ἸΤ Ε Ι Ο Γ ΑΗΕ Ι Τ ΕΙΓ ΟΗΙ Ρ Ν ΥΙΕ ΤΕ ΕΗΙΘ . Ο ΤΜ Ε ΟΑ Ο Ν Όι Ν Α Ε Ν ΑΥ ΙΕΨ Β ΠΙ.Μ Κ Α ΓΕΙΝ Ὶ Α Π ΟΠ Ὶ ΘΒ Ὶ Ο Ρ ΒΑ Α ΕΜΤ Α ιΙΡ Ο ἰΑ ΕΒ ΗνΚ ιΕνΕ ΙδΒ Ι Α Γ ΥΝ ΕΕΟΊ ἱ ΕΚ ΌεΟΑ άΒ Ἰ ΙΟνΝ ΟΟ Μ Ό ΟΕΝΒΥΑ Ι βΕ Ε Ζ5Ρ ΕΤ ΒΑ Ι υΕΕΤ Τ Ο Π φΓΝ Π Ό Ι ΕΓ ι ΘΙ Θ Ι Α φ ΕΕΝ ΟΑΌ ε ΒΒ ΝΑ ΟΕ β Ψ Ιπ ΑΥ σο Μ ει .ο Ας Ι τ"" ο Ε «Ρ ζΑ οο λΤι σΒ αμΑ ι Ν . ο Ό Ό ἐ.Α Β 4Ι Α ςπ Ι Ε εΡ 7Ο Γ Ι Ι α ΑΒ φΟ 1Ο π ΚΤ Η μ ΠΑ ε α1ῚΝ Ν Με ΑίΒ .Β Ο Θ Β ΘΑΘ αΒΟ ΟΕΝ ΤΣ -Σ Γ Β 7Ι ΕΑ ΤΝΜ ΌΤΑ ΑΒ Ι Ε Π ἐ .Ε Π Ο ΗΠ Β τ Ε Β]Σ ΑΟΤ ΠΤ Ν ιΗΓ ΑΊ Ι Ε ΝΣ Β νΝ Α ΝΚΒΒ ΕΑ ΙΒ Ὶ Α Υ ἐΜ ΕΠΙ ΠΤ ΠΗ Β Π ΙῚ ΠΟ Υ ΑΙΕΑ ΝΝ Ε Ε ΗΨ ΝΑ Ό ΌΡΘ ΓΑΗΝ Η Ὶ αΓ Ί Γ Α Ι Ν τΝ ΑΑ Ό ( ΡΕΕ ΒΕ
ΘΒΟΝ ΓῚ ΜΑΒ ἐΕΩΒΕΖΤ ΓΊ ΒΑΒ ἐΜΙΤΗ ΓΙ 711, Της, ΑΝΙ ες ΥΝΑΙΤΕΗΣ ΓΙ Η νου ΒΙΟΟΌ ΓΨΎΟΝΦΙΕ ΖΙΡΤΕΒ ΓΙ ΡΟΝ ΟΝ ΓΙ ΑΙΠΞΟΝ ΒΕΓΉΡΕΙ. ΠῚ ΠΙΟΝΝΕ ΒΒΑΝΟ ΓῚ ΒεΤΗ
ἌΒΚΕΒ ΠῚ] ΟΙΝΌΥ ΡΑΤΤΟΝ ΓΙ ΘΑΝΌΒΑ ΡΟιι ΑΟΚ ΠῚ ΜΑΒΟΑΒΕΤ δ. Ἂ ΒΌΤΗΑΝΝ κοοε ε ΜΑΒ {ΕΟΒΕΞΤ ΓΙ ΒΑΒΒΑΒΑ ἐΜΙΤΗ ι ΙΕΑΝΕ ΜΑΌΟΗΝ ε ΑΝΝΑ ἰΕΕ Ασιι ΠῚ ΘΗΑΥ ΥΟΟΝΘΟΒΙΟΟΩΙ
ΓΙ ΥΨΟΝΝΕ ΖΙΡΤΕΒ ΓΙ ΔΟΒΟΤΗΥ ΑΙΘΟΝ ΓΙ ΑΗΘΟΝ ΒΕΟΗΌΕΙ. ΠῚ ΠΙΟΝΝΕ ΒΒΑΝΟΌ ΠῚ ΒΕΤΗ ΒΒΑΝΤ ΠῚ Εἰ Υ ΒΌΙΚΙΝ ΓΙ ΒΑΒΒΑΒΑ ΒΌΒΕΟΒΌ ΓΙ ΑΝΌΒΕΑ Εἰ ΕσΚ σι ΑΒΌΥ ΓΙ ΟΗΕΒΥΙ. Οι ΑΒΚΕ ΠῚ ΜΙΟΗΕιἒΕ Οἱ ΕΕ
ΕΙ ΟΕΟΒΟ ΙΑ Λ ΟσΤβΟει ! ΛΠῚ ΒαΆσηει. Τ ΘΌΙΡΟΟ ὈΕΟνΒΙΕΘΝ ΓΙ ΜΣΑΒΙ,ΟΝ. Ε.Ο ΣΤΕ Β ἜΠῚ ΕΙ ΒΕΝ ΕΘΒΥΕ ΑΠ ΕΠΙΥ ΕΝ Θ ΘΑΙΕ.ΟΒ-Ό ἸΓΙ ΗΝΑΤΤΙΕΕ ΟΖΟΘΕΤΤ Ν ΓΙ ΙΑΜΝΙ, ΚΕΑΙ Υ ΠΤ ἸΟΑΙΝΟ ΗΝΡΝΑΌ ΓΊΑ ΑὔΡΙΒΕ , (Ο ΒΡ Ε ΠοῚ ΙυΡΙΤΗ μοδανιΕι. Γ]
Ὦ ΒΑΒΒΑΒΑ ὅΜΙ ΓΣ ΘΠ δ ΦῚ ΠΏ ειι βυικιν
Ὦ ΒΑΒΒΑΒΑ ΒΌΒΕΟΒΟ ΓΊ Ισηει τ Ε σε ἱεεο] αεοβαιΑ Ασείει ΞὐΙΡΟ ΌΕν, ΕΙΙΕΝ ΘΑΙΕΟΒΌ ΓΊ ΗΑΤΤΊΕ
ΑΓΝεΌθΒ Α ν ΡτΟοΙΙςΑ Ο ΚΜ ΠΑῚ Ν ΜΗΑ Ι Εβθ΄ε ο ήεδςετ ὃ“ Ε ΑΥΝ Αφχς Λ ΉἜΣρ οΗΝς ΠΘ ΆΕνΣν,ι , ΑΝΝΚΕ ΖψΙΡΤηΕ Β Σ ΓΑΊ Ο Ὀ Ο ΒΗΟΤσΗΤΥΕ
ΝΙΠΒΟΝ ΠΠ ΑΠΞΟΝ ΒΕςΗΙ ΓΙ ΒΕΤΗ ΒΒΑΝΙ ΟΒΌ ΓΙ ΑΝΙ ΒΘΙΑ ΟΟΤΒΕΙι. ΓΙ ΒασΗει,
ΒυΙΡΟ Ὀενβιες “ΑΕ, ΓΙβι 1 ΕΔ! ΑΕ ΡΌΕΞΙΤΥ,, ιν ΟΗΕ ΤΟΝΙ, ΑΝ ΒΟΣΑΒΙΟ ΜΌΝΑΙ Εδἱ
Π ΙΟΑΝ ΝΕΖΤΙΕ ΠῚ ΕΕΘΙΕΑ ΝΕΥΜΑΝ ΓΙ ΡΑΤ ΡΑΒΚΕΒ ΠῚ ΟΙΝΌΥ ΡΑΤΤΟΝ ΠῚ ΘΑΝΌΒΑ ΡΟΙΕΑΟΚ ΠῚ ΜΑΒΩΛΆΕΤ ΒΑΝΡΑΙΕ ΓΙ ΒΟΤΗΑΝΝ ΒΟΒΘΟΝ ΓΊ ΜΑΒ ἐΕΩΒΕΞΤ ΓΊ ΒΑΒΒΑΒΑ ἐΜΙΤΗ ΓῚ ΙΕΑΝΕ νΑΌσΗΝ
ἌΝΝΑ ΤΕΕ ΨΑΙΤΕΒΘ Π] θΗΑΥ ΥΟΌΝΟΒΙΟΟΌ ΠῚ] ΥΝΟΝΝΕ ΖΙΡΤΕΒ ΠῚ ΒΟΒΟΤΗΥ ΑΙΘΟΝ ΠῚ ΑΙΠΞΟΙ δι ΠῚ ΓΙΟΝΝΕ ΒΒΑΝΟ ΠῚ ΒΕΤΗ ΒΒΑΝΤ ΠῚ ΕΙΠΥ ΒΌΙΚΙΝ ΠῚ ΒΑΒΒΑΒΑ ΒΌΒΕΟΒΌ ΓΙ ΑΝΡΒΕΑ ει ξσκί
Ε ΕἸ ΕΟΣΤΕΒ Π ΕΙ ΕΝ ΕΒΎΕ Π ΕΠΕΕΝ ΘΑΙΕΟΒΌ ΠΉΑΤΤΙΕ ΟΖΘΕΤΤ Π ΙΑΝΙΣ ΚΕΙ ΥΠ ΟΑΝ ἐ'ΝΌΑΙΙ
Ξ ΔΙΞ ΕΑΑ ΗΝΕΑΥΜΥΜΑ Ν Υ [ ΟΡΑΌΤ ΝΡΑΒΘΚΕΟΒ Β ΠῚΙ Ο ΟΙΟΝΌΌΥ ΡΑ ΤΓΤΊΟΝ [Υ] ΘνΑΟΝΌΝΒΑΝ ΡΟΕ Α ΟΖΚ Ι ΠΡῚ Τ ΜΕΑΒΒΟΑ Β ΕΓΤ ᾽ βα νΓῦαΟι Β|ΟΤΗΥ ΑΙΠΙΘΟΝ ΓΙ ΑΠΘΟΝ ΒΕΖΗΡΕΙ. Π ΠΙΟΝΝΕ
Γ ΒΙ Α ΕΝΠΟΕ Ν Π ῚΕ] Β ΎΒΕΕΤ ΗΠ ΒΕΒΠΑΕΕΝΝΤ ΘΠΑῚ Γ ΕΕΟἰ Β ΥΌ ΒΠΌῚ ΙΚ ΗΙΝΑ Τ ΤΠΙ Ε Β ΑΔΒΟΒΖΑΘΒΕΤΑΤ Β ΠΟῚΒ Ε ΙΟΑΒΝΌΙδ Π ΚῚ Ε Α ΒἹΟ Β“ Α Ο ΕΙΕΟΨΒΙΟΝΙΑ5 ΑΟΝΟΏΤβ ΕΒΙιΟ!Θ. Α ΓΒΙ Ι ΟΒ Α ΜσΗΟΕΒΙΑ. Ι ΕΖ5Ό ΙΌΠῚΟ ΙὈΟΑΕνΝΒ Ι ΕΝΣΕ Υ ΠΤῚι Ε Μ ΠΑ Β ΕΙΟΕδΝι Ε ΑΕΟΙΣΤΕΒΙ
ρΌἐυςνΗ αΝ ιςσΟομρΒτΕ ΙΕνΟ ουΟ Ω Οἴ α . Ο» [ ΠΕΤΗΟ 6 Β.Υ ΩνΟΠΙΟΑΗΝ Δ ΝΒΩΣΙΑ .« Π ΟΝ ΟΔΠὐΒΌΑΏ,Ε Ν ΟΠΒΣΩΑ Ψ ΟΗΒΟΑΙΟ, Υ18 Π(1. 4 : Ε 6ν07κτ2η ν ΛεΖ,ιδ ὂ δΟί”Ι. .- Α ς.ΒααΚ ΕκυΙ.
5 Βαίίειεά Τήνος, Ος] Ματ, νο]σαπο Ρτοσο, 410.00. 7 ΤΗε Νεν Ους Βοάϊες, Οπιθε]νες
6 Ύοι (απ΄ ΑΕ οτά ἐπε Ιπαχατγ οἱ ἃ Νεραίίνε δ Οπρσοννίηρ ἔπε Ραΐπ
ΤῬΗοητπορβσιί,δ ,Ρ. Μ4ελ1 2Πα.π9ιο5 .ἐ ς [1οπ0η Κ οΈρειτ, ο Ρτπε]πιᾶ ς ΕΘΟε αΤΗτε ϑ αἐσεοά Π οΕοΡτεεάοπι
7 Οοπταρε ο Ηεαί, Ε. Βαδε ὅς Ι.,. Γανίς, Παγρες ἂς ΕΙΟΤΙΟΝ
Κουν, 414.95. 1 Ὀααιρηΐεις οἵ Οορρες Νοπιαπ
δ Ίταση, Ποτοιηγ Αἰθοπ, ΕἸσεργαπά Βοοκκς, 98.95. 2 Ωοοά Τίπιε Βαά Τίπιες Μυπαπιγ απά Με
Ο ϑοπί] οὔ ἤπε Ι1πο, Ο. Επηἰς, Ναΐδά Ῥτοςς, 48.95. 3 9μ6 Ηδᾶ ϑοπιε Ηοιθε9
10 ΨΝΉγ ΟΑπ΄ θΠασοπ Κουνα]εκὶ Οοπιε Ποπιεῦ, 4 ΤΗε Ρἰ]]ονν
Κατεπ ΤΏοπιρξοπ ἐς [α]ΐε Απάσζε᾿εννεκί, θρίη- 5 Α Βἰτά 1π πε Ποπες
5ἰει9/ Απιἑ αιἰς, 410.95. 6 ΤΊα ἵΝοπιεπ΄9 Όεςαπιετο η
7 Βεεξ Οπεεπ
Βο]αά Ρτῖπι δ ΑΌοος Ιπίο Οςθαπ
Ἰλππίρερ, Μβπίϊορα Ὁ ΤΗε Ποιες οὔ ϑρἰπϊί5
Ματεὴ 1989 10 ΤΗε ϑίοπε Απρεϊ
ΝΟΝ ΕΙΟΤΙΟΝ Βοϊά Ρηπί
1 Ροπ΄Έ Α ἵΝοπιαπ΄9 λογά Μλππίρεα, Μβπϊΐορα
2 ΤΗε Οοπταρε ἰο Ηεα] Εεὐσυατγ 1989
3 Εαεὴ αγ ἃ Νενν Βερίηπίηρ ΕΙΟΤΙΟΝ
4 Βιεακίηρ ΑΙΙ (ης Κι] 1 Οπϊάς ἐο Οτασίοιυο [.εβὐίαπ [1νίπρ
5. Α Νενν Αρρτοαςἢ ἐο ΊΝοπιεπι ἂς ΤΗεταργ 2 Ἠοίε] ΚοπιαπίϊΚα
6 Μακίηρ Ρεαςε νηὶ Εοοά 3 Ύνοπιαπ οπ (ἢ Εάρε οἱ Τίπις 966 ρα656 91
Νοίαπης 12 ΝΏπαρες 1 25 Μαγ/]υπε 1989
This content downloaded from
(cid:0)(cid:0)(cid:0)(cid:0)(cid:0)(cid:0)(cid:0)(cid:0)(cid:0)(cid:0)(cid:0)(cid:0)70.126.145.227 on Sat, 19 Mar 2022 17:42:04 UTC(cid:0)(cid:0)(cid:0)(cid:0)(cid:0)(cid:0)(cid:0)(cid:0)(cid:0)(cid:0)(cid:0)(cid:0)(cid:0)
All use subject to https://about.jstor.org/terms",[]
28,"The Feminist Bookstore News
A N NGEN
Beacon Press reports a six figure sale for the Jewish lesbian writer Lesléa Newman, (A Letter to
paperback rights for Virginia Woolf: The Impact of Child- Harvey Milk, Good Enough to Eat, and Love Me Like You
hood Sexual Abuse on her Life and Work by Louise Mean It) has been selected to receive a $9,500 award in
DeSalvo. In an auction involving three publishers and the Poetry category of the Massachusetts Artists Fel-
a $75,000 floor, Ballantine Books eventually paid more lowship Program. She is currently working on a num-
than $140,000 for the paperback rights. This is the first ber of projects including another poetry collection, a
book to reveal the extent of Woolf's abusive upbring- children’s book, a novel, and an anthology about
ing and its lifelong effects on her work. Woolf was Jewish women and their grandmothers. She recently
sexually abused by her two half brothers from the age finished a second short story collection (Secrets) and a
of six until well into adulthood; in fact, evidence sug- non-fiction book about eating disorders.
gests that nearly every member of her immediate
family was involved in incest or physical violence or
both. But though Woolf left published and unpub-
lished work documenting these horrifying circum-
stances, Woolf's earlier biographers have portrayed AIDS: The Women, edited by Ines Rieder and
her family as tranquil and loving, and her later de- Patricia Ruppelt (Cleis Press) is the recipient of the
pression as “madness” rather than a legitimate re- Words Project for AIDS book award. Words Project for
sponse to early and sustained childhood trauma. AIDS sponsors awards for work that represents the
(Beacon Press, $22.95 cl, 0-8070-6326-6.) commitment of the American literary community “to
unleash the power of the word” in the struggle against
UK: The Women’s Tapeover Quarterly, a new femi- AIDS. Judges for the awards included Jack Miles, Los
nist tape magazine, will offer a digest of articles from Angeles Times; Gregory Kolovakos, New York Council
English language feminist publications for the blind, on the Arts; Sybil Steinberg, Publishers Weekly; Sasha
the partially-sighted and women with other reading Alyson, Alyson Publications; Ira Silverberg, Grove
disabilities. The magazine will help women find out Press; and Amy Scholder, City Lights Publishers.
what is happening with other women around the AIDS: The Women sold out its first printing in 12
world. It will highlight such issues as women outside weeks.
the western bloc, peace, anti-racist struggles, lesbian
liberation and other feminist issues. The Women’s Spinsters/Aunt Lute, after three years of being
Tapeover Quarterly has grown out of the monthly tape turned down for National Endowment for the Arts
magazine Women’s Tapeover which has published for grants (reportedly because of the strength of Spin-
the last seven years. The monthly ceased publication sters/ Aunt Lute’s lesbian titles) received NEA funds
to allow concentration on the quarterly. For more in- to publish Reclaiming Medusa and Singing Softly/Can-
formation, contact Women’s Tapeover at 66 Oakfield tando Bajito. A substantial grant from the Chicago
Road, London N4, U.K. No known U.S. distribution at Resource Center assisted with the publishing of Why
this time, except for direct subscription. Can't Sharon Kowalski Come Home. O
May/June 1989 26 Volume 12 Number 1
This content downloaded from
(cid:0)(cid:0)(cid:0)(cid:0)(cid:0)(cid:0)(cid:0)(cid:0)(cid:0)(cid:0)(cid:0)(cid:0)70.126.145.227 on Sat, 19 Mar 2022 17:42:04 UTC(cid:0)(cid:0)(cid:0)(cid:0)(cid:0)(cid:0)(cid:0)(cid:0)(cid:0)(cid:0)(cid:0)(cid:0)(cid:0)
All use subject to https://about.jstor.org/terms",['0-8070-6326-6']
29,"The Feminist Bookstore News
In Argentina and Japan! kelder, 1012 XK Amsterdam, The Netherlands.
Saga: Liberia de la Mujer, the women’s bookstore Tennessee now has a feminist bookstore. Arlene
in Argentina, just celebrated their first birthday. Samowich opened The Book Oasis in Nashville on
Owners Susana Sommer and Nené Reynoso stock April 29, 1089. The store will feature books for femi-
books in Spanish, English and Portuguese and have nists, lesbians, and gay men. She sends thanks to all of
about a thousand titles. Send them greetings and in- the helpful people who have shared their ideas and
formation at Saga, Hipolito Yrigoyen 2296 esq. Pichin- experiences and special thanks to Barbara Grier at
cha Local 2 (1089), Buenos Aires, Argentina. They're Naiad Press, Pokey Anderson at Inklings Bookstore in
open Monday through Friday from 10am to 1pm and Houston, and Carol Seajay at FBN for their encourage-
from 4pm to 8pm. Saturdays from 10am to 1pm. Tele- ment and wisdom. Send information to Arlene at 2824
phones being as expensive as they are in Argentina, Dogwood Place, Nashville TN 37204. Phone: 615-292-
Saga doesn’t have a phone, so be sure to take the hours 7100.
with you (and pass them on with the address to travel-
ing friends). The goddess of tape recorders cooperat-
ing, we'll have an interview with one of the women
who started Saga in the next issue.
Japan's new feminist bookstore, Ms. Crayon-
house, opened on International Women’s Day. The
Tf h sm ho ou u ean s l led h , e ” ahr ll , a a l l h K c ae ah si n k i dlo bd er r ceO e onc s m’h ts a ei ua bi r, ao a o n h k cta es s t n ao t tr eb te re a e c n ha fn e o dd rr u fln fi on eb r mri n a irg t ny h i s e“ t C w lr i a ma t sy h t o o v n i1a e- 3 s , years. i wts it h o w F Jni Jr . s ' st T h OP e ta hg o ee r r i sgB idio n eo ,ak l s t t p ho lr ea e n l o h cwa as a l s o w tp ooe m n e o ed p n e ’ sni n b i ana r , ts t h bo e ur te bf ur thio ln ad tt in gof
concerts, seminars, and will become the home of “Ms. didn’t sit well with local ordinances, so they've moved
O wp oe mn e n S .c h Moo s.l , ” C ra an y o a nl hte or un sea ,t i v te h e s t wud oi mes e n p ’sr o bg or oa km s t of ro er , Tt th oh ne e i rl D o rc n .a ,et w io F n t .a d a d L r a h ues do sp e r, di s as lk eFi p i r F s La t n d 3P 3 a 3gj 0u e 5m . Bp o P o hd k oo s nw t eon :r e 3,t 0h 52e -2 5 1 6s 9t 4 r - e 9We 0t 4i. l 5- .
will stock about 25,000 books and include a section for
Sue and Bev send thanks to everyone who’s sent them
ew to cm ., e n an’s d b io no dk is c a tf er o im f yo ov ue r s he aa vs. e P al e a ds ie s t rs ie bn ud t o rca t ia nlo g Js a, pan (!) mad orv e!ice, catalogs and information and are ready for
or give directions for direct ordering. Write to Keiko “Healing Crystals” in Portland Oregon has
JO ac ph ai nai ., P3 h- o8 n-1 e5 : 0K 3i -t 4a 0a 6oy -6a 4m 92a, . FM ai xn : a t 0o 3- -k 4u 0, 7 -T 95o 6k 8y .o 107, c ph anan yg . e d T h i et is r n adam dre e s st o i sB l 8u 2e 1 5E a Sr Eth 1 3D tr he a m A v eT .,r a d Pi on rg t l aC no dm O- R
More New Stores and Changes 97202.
Boekh Vrolijk is a gay and lesbian bookstore in Lynne Gleeson is the new owner of Stepping
Amsterdam. Send catalogs and information to An- Stones, the women’s bookstore in the Artifactory, a
neke Reijuders, Boekh Vrolijk, Voetboogstraat 7 Palo Alto artisans selling cooperative. Send mail to
27 May/June 1989
This content downloaded from
(cid:0)(cid:0)(cid:0)(cid:0)(cid:0)(cid:0)(cid:0)(cid:0)(cid:0)(cid:0)(cid:0)(cid:0)70.126.145.227 on Sat, 19 Mar 2022 17:42:04 UTC(cid:0)(cid:0)(cid:0)(cid:0)(cid:0)(cid:0)(cid:0)(cid:0)(cid:0)(cid:0)(cid:0)(cid:0)(cid:0)
All use subject to https://about.jstor.org/terms",[]
30,"The Feminist Bookstore News
Stepping Stones, The Artifactory, 226 Hamilton Ave., feminist bookstores in the country — with no ex-
Palo Alto CA 94301. perienced staff. During the course of the dispute,
Closings shopping in the store was very tense and customers
Each of the last three issues has announced 8 to and community members were asked to take sides in
10 new stores. In this issue we catch up with the the dispute. The post-arbitration collectives were
closings. plagued with high staff turnover, inexperience, finan-
cial problems, and a sorely divided customer base.
Bridges were never mended, many of the store's pre-
AE) vious customers never or rarely returned to shop.
Si Sales never returned to their pre-dispute levels. Two
years ago sales dwindled to the point where salaries
could no longer be paid and a volunteer collective was
the W A af shte inr g tm onu ,c h D Cd e l wib oe mra et nio ’sn , b ot oh ke s t w oro em , e hn a v a et cL oa nm -mas, cf suoo v fr e fm r icie n id eg. n t B r y e tn o t t h r ae en p d lb a e c g o e tin h tn e hri en g o s v t o oerf ckh et ah sd oi ,s l d by u oe t ra r w t or e e r c e oe ri p dnt eos r lw o nn ee wgre er
curred with Harriet Clare's experience at Dreams and titles. The store closed in April and wil, in all likeli-
dSw ifo fr icd us l t — t h r au nn n ri un ng n it nw g o o nst eo r —es ais n d a b do eu ct i d ef div e t o t im cloe ss e m thor ee h afo oo od t, ff oil re fb ua nn dk rr au ip sit nc gy , t oth o pu ag yh o t fh fe r de e b a tr se ts oo m fe e m p inla in sts and
Seventh Street store and expand both sales and office small presses. A Woman’s Place, then ICI-(Informa-
space at the Dupont Circle store. The decision in- tion Center Incorporated)-A Woman’s Place, was one
cluded a number of factors: Lammas has long since of the first feminist bookstores to open and thrive and
outgrown the Capital Hill store. The continuing was a center for feminist organizing in the Bay Area
yuppification of the area (""It’s becoming one of those for many years. Feminist bookselling continues to
neighborhoods where you can buy five kinds of flourish in the Bay Area, however, at Mama Bears
chocolate chip cookies but can't get lunch."") along Bookstore (founded and staffed by the women who
with the accompanying rent increases have put large originally started ICI-A Woman’s Place) and Old
ss op la ic de as t i no gu t w o if ll r ae lla oc wh f Lo amr min ad s e p te on d ie nn ct r e ab so eo k ts ht eo r e ns u. m C bo en r- lW eai rv ne es d T bal oe os k, s ew llh inic gh aw t a s IC Ia -l Aso Wfo ou mn ad ne ’d s Pb ly a c ew o dm ure in n g w h ito s
of books, records and gift items they stock and makes heyday. Claims and correspondence may be sent to A
expansion at the thriving Dupont Circle store possible. Woman's Place, PO Box 11004, Oakland CA 94611.
All staff positions have been retained with some cuts
in hours. Lammas was open on Seventh Street for 16
years. Send all correspondence to Lammas at the
Dupont Circle store, 1426 21st St. NW, Washington DC
20036. Phone: 202-775-8218. Stop by when you're in
DC. (Previous address was 321 Seventh St. SE, 20003.)
Womonfyre Books in Northampton, Massa-
A Woman's Place Bookstore in Oakland, Cal- chusetts has also closed. The decision to close was the
ifornia, after a long downward spiral, has finally result of a number of factors including severe staff
closed. A Woman’s Place, many will remember, ex- burnout, high (support) staff turnover, an expiring
perienced an exceedingly bitter, internal collective dis- lease, and the opening of a second feminist bookstore
pute six years ago. Lawsuits were filed, and the sides in the same town. Womonfyre’s immediate neighbor-
te rv ae tn ot ru sa l l dy e c ia dg er de e d t h at to aa l ! b oin f d i tn hg e a cr ob lli et cr ta it vio e n . m T emhe b e rar sbi- hood is gentrifying and the landlord was asking for
double the previous rent. Womonfyre’s owner reports
should leave the store, one faction immediately and that the store was doing adequately financially but
the other faction phasing out within two years, thus couldn't afford the proposed rent increase and it
leaving the store — at that time one of the six largest Continued next pag
May/June 1989 Volume 12 Number 1
This content downloaded from
(cid:0)(cid:0)(cid:0)(cid:0)(cid:0)(cid:0)(cid:0)(cid:0)(cid:0)(cid:0)(cid:0)(cid:0)70.126.145.227 on Sat, 19 Mar 2022 17:42:04 UTC(cid:0)(cid:0)(cid:0)(cid:0)(cid:0)(cid:0)(cid:0)(cid:0)(cid:0)(cid:0)(cid:0)(cid:0)(cid:0)
All use subject to https://about.jstor.org/terms",[]
