PageNumber,Text,ISBNs
45,"The Feminist Bookstore News
SAH
© P
By Mary Lowry but I'm re-reading the other alphabetical mysteries
and so far, (ʻA' and B’) they confirm my memory of
What do you say when a writer makes you sud- strong and sympathetic dealings with women.
d cee rn tl y b yu n c ao m taf lo enrt ta eb dl e ? p e rIt f’ os r mlik ere wsit ht oi ’n s g h at vh ir no gu g h a ba a dc o nn i- ght. L
Y tro au s h d o tn h' et pli ek re f o t rh me e rp e (r wf ror itm era )n c fe o rb u wt h y ato u m d igo hn t’t bw e a n at n to ©
aberration.
Sue Grafton’s latest F is For Fugitive (Henry Holt,
$17.95 cl, 0- 8050-0460-2) is the current case in point.
Grafton started out well creating women of all ages Also newly out in cloth is A Trap for Fools by
who were sharp and witty. Old women and men Amanda Cross, Dutton, $16.95 cl, 0-525-24754-8. For
weren't dismissed pro forma but contributed impor- Amanda Cross fans only. Anxious readers of Cross’
tant bits to the stories. Women’s economic and work last two titles have asked if this one really has any
problems were stated clearly and positively. But in F murder victims and yes, Virginia, there are two. Series
is For Fugitive Grafton seems to have lost her allegi- character Kate Fansler is surprisingly reluctant to act
ance to women. The final insult came when series as detective in this novel with a Columbia University
character Kinsey Milhone states she left organized look alike setting. Fansler’s uncertainty affects the
religion because the woman who taught Sunday reader, too. It would take a long, long review to cope
with the inconsistencies and ambivalent attitudes in
this one. Wait for the paper edition.
E UPCOMING IN MASS MARKET
Prey to Murder by Ann Cleeves, Fawcett, $3.50
pb, 449-14575-1, June. Set in England with a male
amateur detective, this has bird watching back-
school had bad breath. (Now I can think of a lot of ground.
reasons to get turned off organized religion and bad Night Blooming Cereus by Joan Hadley (aka
breath isn’t on the list.) The line was a throw away, Joan Hess), Ballantine, $3.95 pb, 345-34912-1, June.
sure, but added to all the other consistently unflatter- This has a new male amateur detective who is a retired
ing portraits of the women characters and the bland, florist.
he’s-not-so-bad, portrayals of the men, this book Too Close to the Edge by Sue Dunlap, Dell, $3.50
made me more than uncomfortable: I got worried that pb, 440-20356-2, July. Policewoman Jill Smith at work
maybe Grafton really dislikes women. Hope this was in Berkeley, CA. Good series.
written in a cranky period and she goes back to the Element of Doubt by Dorothy Simpson, Bantam,
Kinsey Milhone I used to like.’ F’ is for ‘forget this one’ $3.50 pb, 553-28175-5, July. British series stars Inspec-
43 May/June 1989
This content downloaded from
(cid:0)(cid:0)(cid:0)(cid:0)(cid:0)(cid:0)(cid:0)(cid:0)(cid:0)(cid:0)(cid:0)(cid:0)70.126.145.227 on Sat, 19 Mar 2022 17:42:04 UTC(cid:0)(cid:0)(cid:0)(cid:0)(cid:0)(cid:0)(cid:0)(cid:0)(cid:0)(cid:0)(cid:0)(cid:0)(cid:0)
All use subject to https://about.jstor.org/terms",['0-525-24754-8']
46,"tor Luke Thanet.
A Collector of Photographers by Deborah Valen-
tine, Bantam, $3.50 pb, 553-28045-7, July. This author
is unfamiliar to me.
A Gentleman Called by Dorothy Salisbury
Davis, Ballantine, $3.50 pb, 345-34663-7. Originally
published in 1958, this features an amateur sleuth of
the female persuasion.
Sick of Shadows by Sharyn McCrumb, Ballan-
tine, $3.50 pb, 345- 35653-5, July. Edgar winner for best
original paperback in 1988, McCrumb’s sleuth in this
reprint of the 1984 title is series’ character Elizabeth
MacPherson.
Silver Ghost by Charlotte MacLeod, Mysterious
Press, $4.50 pb, 445-408286, August. Husband and
wife team, amateurs, work in a Boston setting.
Masculine Ending by Joan Smith, Fawcett, $3.50
pb, 449-21688-8, August. Cloth edition billed this as
“feminist” but her treatment of women characters
leaves a lot to be desired. An academic amateur sleuth
PVI operating in England and Paris.
Watersplash by Patricia Wentworth, Warner,
$3.95 pb, 449-21688-8, August. Classic Miss Silver re-
print. I do have a soft spot for Miss Silver.
Body in the Volvo by K.K. Beck, Ivy, $3.50 pb,
8041-0371-2, August. Male detective, amateur, sleuth-
ing within academic setting.
Fault Lines by Teri White, Mysterious, $4.50 pb,
445-408200, August. This also has a male detective
with an L.A. setting.
Murder by Deception by D.R. Meredith, Ballan-
tine, $3.50 pb, 345-35243-2, August. Author, unknown
toi mse , feastuerest an ot heir n ma le dTetecetivxe anad s th.e n ovOel
#ROUGH | BOK DISTRIBUTORS ORDIRECT:
415-255-0404
May/June 1989 Volume 12 Number 1
This content downloaded from
(cid:0)(cid:0)(cid:0)(cid:0)(cid:0)(cid:0)(cid:0)(cid:0)(cid:0)(cid:0)(cid:0)(cid:0)70.126.145.227 on Sat, 19 Mar 2022 17:42:04 UTC(cid:0)(cid:0)(cid:0)(cid:0)(cid:0)(cid:0)(cid:0)(cid:0)(cid:0)(cid:0)(cid:0)(cid:0)(cid:0)
All use subject to https://about.jstor.org/terms",[]
47,"The Feminist Bookstore News
in Feminist
Bookstores
By Betsy Nuse promisingly and deeply rooted in Native traditions
that were sometimes strange to me. But working at
If you or any of your customers have been read- these poems yields rich rewards. Here again is com-
ing feminist magazines long enough to remember passion grown in the rich soil of female power, and
Chrysalis or Maenad, perhaps you enjoyed reading in anger at the blindness and injustice of white society.
those magazines the moving poetry of Honor Moore? The fullcolour cover and ink illustrations inside by
One of our newest feminist presses, Chicory Blue, has Native artist Jaune Quick-To-See Smith are stunning.
done Honor and her admiring readers a great service
by publishing her collected poetry in a handsome new
volume called Memoir (Chicory Blue, US$11.95 pb,
0-9619111-1-5, 40% discount for 3+ books. Dist. Inland
or Bookpeople). The books contains both old work
(""Poem in Four Movements for my Sister Marian"" that
was a Chrysalis offprint) and new work (the title poem
is a memorial for a friend and fellow recovering alco-
holic who died of AIDS). Though this is technically a
first book, it collects the work of a mature poet with a
compassionate, clear voice who writes on a variety of Alice James Books’ commitment to publishing
subjects: our fear of nuclear annihilation, love waning women’s poetry continues to bear fruit — in this case,
over a long distance, dear friends and family. a new lesbian poet! One third of Your Skin Is A
How can any booksellers seriously interested in Country by Nora Mitchell (Alice James Books, US$
the writing of Native American women 0f stock 8.95 pb, 0-914086-83-9. Dist. Baker & Taylor, Inland
poetry? Two fine new books which deserve to be on and Small Press) was inspired by time spent with her
your shelves are Savings by Linda Hogan (Chick- family in Korea. A sensational poem, “Wisteria”, in-
asaw) (Coffee House Press, US$7.95 pb, 0-918273-41-2. vokes summer childhood memories, and the erotic
Dist. Inland, Bookpeople, Small Press Distribution, “Deer at Night” is worth the price of the book. Nora’s
Consortium and Bookslinger) and Hand into Stone style is careful and controlled, and her subjects seri-
by Eizabeth Woody (Wasco-Navajo) (Contact II Publi- Ous.
cations, US$5.00 pb, 0-936556-18-8. Dist. Inland and Two new thematic poetry collections that look
Small Press). The spirits of old women and wise interesting are: Her Soul Beneath the Bone: Women’s
women imbue Linda's book with woman-centered Poetry on Breast Cancer ed. Leatrice Lifshitz (Illinois,
energy. It includes hard poems about Native people US$8.95, 0-252-06008-3) and Marriage and Relation-
struggling in harsh urban environments against ships ed. Katie Campbel|, the first of a new “series of
poverty and neglect. This is a volume to recommend poetry anthologies of broad appeal concentrating on
to readers interested in ways spiritual sensibilities can modern poets” entitled Writing Our Lives. (Camden
survive secular, white North American culture. Eliza- Press U.K., U.K.£3.95, 0-948491-40-X — in Canada
beth’s book is more difficult but no less rewarding. from Bookcentre). U.K. Women’s Press has an-
Her language is so precise, so translucent, that careless nounced the first poetry collection in their Livewire
reading will obscure it. Her imagery is also uncom- juvenile line, Torn Not Tearful (UK£2.95, 0-7043-4130-
May/June 1989
This content downloaded from
(cid:0)(cid:0)(cid:0)(cid:0)(cid:0)(cid:0)(cid:0)(cid:0)(cid:0)(cid:0)(cid:0)(cid:0)70.126.145.227 on Sat, 19 Mar 2022 17:42:04 UTC(cid:0)(cid:0)(cid:0)(cid:0)(cid:0)(cid:0)(cid:0)(cid:0)(cid:0)(cid:0)(cid:0)(cid:0)(cid:0)
All use subject to https://about.jstor.org/terms","['0-9619111-1-5', '0-914086-83-9', '0-918273-41-2', '0-936556-18-8', '0-252-06008-3', '0-948491-40-X']"
48,"The Feminist Bookstore News
anena
A WOMAN'SGUIDE TO
CO URE ANGE OAU S EIACRTAS N OFE (Y at3 A leading journalist, lawyer,
and biomedical-issues author-
ity presents ‘a comprehensive,
sensitive, feminist-slanted
probe of [this] intensely con-
troversial subject.”—Publishers
FIU a Ad
n THE DANCE OF ANGER A
mam
From the acclaimed author of BOD
the bestselling The Dance of Learning to Like Our
Anger, this “wise and compas- Looks--and Ourselves
sionate”* guide shows us how A PRACTICAL GUIDE FOR WOMEN
good relationships can thrive Rita Freedman, Ph.
and endure and difficult ones
can be healed.
Now available in Perennial
paperback, The Dance of This ‘“insightful...helpful
Anger $8.95 guide”* by the author of
*Lillian Rubin, author of Intimate Beauty Bound teaches us
Strangers how to move from body
loathing and conflict to
b to ad ny cl eo .v e a n nd s e Nlf T-a c c Pe Ap- HD SEUXERi PREn CORTGAAi NTaES sM
a e , T
*Mary Ellen Donovan, co-author S SNAVE NEW BABIE,
of Woman and Self-Esteem ; LO R | A N D R F —W $
May/June 1989 46 Volume 12 Number 1
This content downloaded from
(cid:0)(cid:0)(cid:0)(cid:0)(cid:0)(cid:0)(cid:0)(cid:0)(cid:0)(cid:0)(cid:0)(cid:0)70.126.145.227 on Sat, 19 Mar 2022 17:42:04 UTC(cid:0)(cid:0)(cid:0)(cid:0)(cid:0)(cid:0)(cid:0)(cid:0)(cid:0)(cid:0)(cid:0)(cid:0)(cid:0)
All use subject to https://about.jstor.org/terms",[]
49,"The Feminist Bookstore News
“With great insight and com-
AN _ IN UDSEEXD TO DESC fS o e o l dpS ,su s su has en m h eKa lk pae sn po ue sa c n le o o v wt e i t oho un r-ly
LOCATE IN R selves and our bodies.”
BY AND — Boston Women’s Health
Collective, authors of Our
Bodies, Ourselves
A Perennial Library
paperback $10.95
REMEMBERING THE
BONE HOUSE
“A tool for transforming ERONCS OF PACE AND SPACE
ideas into words...the | NANCY MAIRS
work is unmatched.” | AUTHOR OF FLANTEXT
—Women’s Review of
Books
“Indispensible for
anyone who writes,
teaches, or thinks The celebrated author of Plain-
—ab Hou ot u s tw onom Pen os? t” t ee mxt o tre iv oe nal as l h der e v e ero loti pc m an ed nt... in
A Perennial Library “[a] haunting, transformative
paperback $16.95 memoir.” —Sallie Bingham
“All women are in her debt?”
—Carolyn Kizer
47 May/June 1989
Volume 12 Number 1
This content downloaded from
(cid:0)(cid:0)(cid:0)(cid:0)(cid:0)(cid:0)(cid:0)(cid:0)(cid:0)(cid:0)(cid:0)(cid:0)70.126.145.227 on Sat, 19 Mar 2022 17:42:04 UTC(cid:0)(cid:0)(cid:0)(cid:0)(cid:0)(cid:0)(cid:0)(cid:0)(cid:0)(cid:0)(cid:0)(cid:0)(cid:0)
All use subject to https://about.jstor.org/terms",[]
50,"The Feminist Bookstore News
1, now from Inland). It's to be edited by Jeni Couzyn
who did the excellent Bloodaxe Book of Women’s Poetry
v and “reflects and encourages the natural optimism of
being a teenage girl.” Coming in the Fall from Sister
Vision Black Women and Women of Colour Press (P.O.
gut A Box 217 Station E, Toronto, Ontario, Canada M6H 4E2)
is an anthology of Caribbean women poets called
Creation Fire (US$12.95 pb, 0-920813-91-7) not to be
confused with their current release Blaze a Fire, a col-
lection of oral histories about Caribbean women).
Calyx has announced a long poem book by
Sharon Doubiago which weaves a journey through
identity and sexuality.” South America with exploration and imagery of the
body: South America/Mi Hija (no price set, 0- 934971-
12-9 — from Airlift, Bookpeople, Pacific Pipeline or
ISBN 0-961-74060-4 Inland). The experiences of several generations of
Paper, $3.95 Ukrainian-Canadian women are the substance of The
Available to bookstores from Inland Land of Silent Sundays by Gloria Frolick, Chrystya
Hnatiw and Lydia Palji (Williams-Wallace, C$10.95,
0-88795-071-X, — in the U.S. from Africa World and
Inland). The same company will also be publishing
P.O. Box 90 6(421 2e) P36it1t-s8b9u2r7gh, PA 15224 The Conception of Winter (C$9.95, 0-88795-067-1), by
Claire Harris, a fine Caribbean poet living and teach-
ing in the Canadian west.
Native poet Beth Cuthand’s new collection
Crossing the Lake includes her long poem “Horse
POWER Dance to Emerald Mountain” first published as a
chapbook by the same publisher (Lazara Publications,
TO THE C$8.95, 0-920999-08-5. Dist. Inland). On the east coast,
Gynergy Books (distributed by University of Toronto
| DANCERS! in Canada, Inland in the U.S.) has published The
Poems of Rita Joe, the second book by this Micmac
S W be yl o f m B eA en vc et ru t lha yl ri oz a u Kt g ai lho in n iD nf ao nr ce cp oo met i n ( gC $ l9 i. s9 t5 : , T 0 h- e9 2 0 B3 u0 s4 in-8 e5 ss- 0 ) o. f O n Sh iG niy nn ge r g byy ’s P af to rr it ch ia-
Softcover $14.95 Young (C$9.95 0-920304-79-6), whose last book based
ISBN 0-943920-44-2 on the life and writings of Jean Rhys A!!! Ever Needed...
won the B.C. Book Prize and Saffron, Rose and
t g gh r ue o id w ep t liho nw e e s. r . . o .f . s .m e l ofo b v se e em s rt ve e an m tt i o n.. . s … ,.. … d źa e.n s sc d ae ye t sa a ,s i l e p da e e mc wa sot ,a r l k y ass nht do pfor F ofla m Ae r, c ”“ a n b y i n Ct ae tr hw yo v Fen or ds e q (Cue $n 12c .e 9 5 o , f 0 -p 9o 2e 1m 88s 1 -a 0b 7o -u Xt ) . Joan
anecdotes . .. inspirational as well as instructive. White Pine Press will be publishing Eidolons by
Available through book distributors or direct: sound poet Penn Kemp (US$5.00 pb, 0-934834-20-2.
METAMORPHOUS PRESS Dist. Inland, Bookpeople, Small Press). Penn is a word
Y AMOaRPA , P.O. Box 10616 magician who does wonderful readings. If you have
AANONN , P oOrtrladnedr, s :O R1 -98702010--9036716-7771 Csu ac nc te es rs b us re yll i n Rg o a p do , e t Lr oy n d t oa np ,e s O, n w tar ri it oe , t Co a n P aden a d a Ns 6 G(525
PRESS Pr roviding Resources For 2 TN5) h f eor y co m pl aet re ein fo rm aa stio tn o a ubou nt dPen in n’s gtap !e s. O
May/June 1989 48 Volume 12 Number 1
This content downloaded from
(cid:0)(cid:0)(cid:0)(cid:0)(cid:0)(cid:0)(cid:0)(cid:0)(cid:0)(cid:0)(cid:0)(cid:0)70.126.145.227 on Sat, 19 Mar 2022 17:42:04 UTC(cid:0)(cid:0)(cid:0)(cid:0)(cid:0)(cid:0)(cid:0)(cid:0)(cid:0)(cid:0)(cid:0)(cid:0)(cid:0)
All use subject to https://about.jstor.org/terms","['0-920813-91-7', '0-961-74060-4', '0-88795-071-X', '0-88795-067-1', '0-920999-08-5', '95 0-920304-7', '0-943920-44-2', '0-934834-20-2', '10--9036716-7']"
51,"The Feminist Bookstore News
By Jane L. Troxell aristocrat who had looks, charm, intelligence, etc.; the
Lambda Rising Book Report one thing he was missing was love. Many years after
Tom's death, the narrator of the book first sees Tom’s
NEW TITLES — GENERAL INTEREST picture, and begins a tender and obsessive journey to
An irresistible first novel by Ohioan Jimmy Che- fill the void of love for this mysterious figure from the
shire, Home Boy (New American Library, $18.95 cl, past.
0-453-00664-7, July) tells the story of Frederick
Gamble, a 17-year-old resident of a Catholic institu-
tion for homeless boys. Focusing on the emerging
sexuality of adolescent boys in an environment where
the dominant values are authoritarian and anti-sex, Carrier Pigeon Distributors has received new
Cheshire creates a painfully honest hero who realizes British titles from Gay Men’s Press (London), includ-
that the exploitative and abusive atmosphere at Father ing The Novice by Timothy Ireland ($7.95 pb, 0-85449-
McFlaherty’s Home for Boys is not one which he 089-2), which chronicles the life of 23-year-old sexual
deserves. novice, Donovan Crowther. In this novel of innocence
Knights Press has rounded out its Spring list with and (subsequent) experience, the romantic and uncer-
an impressive number of titles. They include Wildroot tain hero is drawn to the big city of London in his
by Duncan Scott ($9.00 pb, 0-915175-34-7), a search for love.
humorous twist on finding love and appreciatińg the From Canada’s New Star Books comes Buddy’s:
finer things in life. Joe and the Show Queen by Larry Meditations on Desire by Stan Persky. ($16.95 c|,
Howard ($9.00 pb, 0-915175-30-4) features a gay “odd 0-919573-90-8, Bookpeople, Inland) “Buddy’s” is a
couple” of roommates — Joe is macho, the Show gay bar in Vancouver, British Columbia. It’s also the
Queen is not. Gardy and Erin by Jeff Black ($9.00 pb, starting point for this unusually frank and personal
0-915175-37-1) is a gay play on an old theme: Movie portrait of gay life and culture in the late eighties. A
star mother gives up the care of her two-year-old mixture of fiction, autobiography, and social criticism,
daughter to a gay man who then cares for the girl like Buddy's is a study of life in the shadow of AIDS .
he is “really daddy;” movie star then decides she Grove Press will soon publish three titles of gay
wants the baby back. An Italian Elegy by M. Black interest. A Visitation of Spirits by Randall Kenan
($9.00 pb, 0-915175-31-2, April) follows the friendship ($16.95 c], 0-8021-1118-1, July) touches the roots of one
and eventual passion of an American writer and an Black family’s power and reveals the terrible strength
Italian townsboy who must work out their problems it takes to break one society's traditions. Two cousins
of unequal fame and fortune and of different home- — one horrified by his own sexuality, the other a
lands neither wants to leave for good. pastor of a church he feels could have saved his cousin
Some Lovely Image by Lawrence J. Quirk (Lyle from shame — are the heirs of this tradition that is so
Stuart/Meadowland, $9.95 pb, 0-8216-20007-X, April) powerful that it endangers them.
is a supernatural romance between the living and the Also from Grove, Closer by Dennis Cooper
dead. Tom Lanning was a young 19th Century Boston ($15.95 cl, 0-8021-1093-2) is not for the weak of heart.
May/June 1989
This content downloaded from
(cid:0)(cid:0)(cid:0)(cid:0)(cid:0)(cid:0)(cid:0)(cid:0)(cid:0)(cid:0)(cid:0)(cid:0)70.126.145.227 on Sat, 19 Mar 2022 17:42:04 UTC(cid:0)(cid:0)(cid:0)(cid:0)(cid:0)(cid:0)(cid:0)(cid:0)(cid:0)(cid:0)(cid:0)(cid:0)(cid:0)
All use subject to https://about.jstor.org/terms","['0-453-00664-7', '0-915175-34-7', '0-915175-30-4', '0-919573-90-8', '0-915175-37-1', '0-915175-31-2', '0-8021-1118-1', '0-8021-1093-2']"
52,"The Feminist Bookstore News
Like his gay literary predecessors Jean Genet and Wil- words of a person living with AIDS. In Epitaphs for
liam Burroughs, Cooper assaults the senses as he en- the Living: Words and Images in the Time of AIDS
gages the mind with visions of nightmare intensity. (Southern Methodist University Press, $26.95 cl, 0-
Closer provides a portrait of men whose sexuality is 87074-289-20, postponed til June), photographer Billy
obsessive and strange. Horse Crazy by Gary Indiana Howard presents more than seventy photos of PWA’s
($16.95 cl, 0-8021-1110-6, May) is also gritty. Taking who, at Howards invitation, wrote below their im-
place in New York's Lower East Side, this provocative ages statements, or messages, about living — and
novel by artist/filmmaker/photographer/actor Indi- dying — with AIDS. Sometimes eloquent, sometimes
ana details the erotic obsession of a celebrated colum- faltering, these statements have an urgency and can-
nist for a beautiful younger man. The erratic ways of dor that cannot fail to move us. The author’s proceeds
the young man (a notorious flirt and heroin addict) from the sale of the book will go to the National AIDS
drive the writer toward the edge of insanity. Mean- Network in Washington, DC.
while, the writer's ex-lover, Paul, lies in a hospital
dying of AIDS. Survival, it turns out for all of them, is POETRY
the only game in town. Crown editor David Groff hopes to have copies
of Poets for Life: Seventy-six Poets Respond to AIDS
(Crown, $18.95 cl, 0-517-52742-7) in hand at the ABA.
This collection is wonderful. Poet Michael Klein wrote
to more than 500 prominent American poets asking
them for work they'd done on AIDS. The response was
AIDS phenomenal, and Poets for Life represents the best of
Coming in June from Harbinger House is Take that work in the rich and varied voices of the contribu-
These Broken Wings and Learn to Fly: the AIDS tors. Edited and with an introduction by Klein, Poets
Support Book for Patients, Family and Friends ($9.95 for Life includes the works of Olga Broumas, Allen
pb, 0-943173-41-8) by Steven D. Dietz and M. Jane Ginsberg, Marilyn Hacker, Joseph Hansen, June Jor-
Parker Hicks, M.D. This powerful book addresses dan, Paul Monette, Honor Moore, Felice Picano, James
both the pragmatic aspects of coping with the disease Purdy and Adrienne Rich as well as others.
and the emotional needs of the patient. While the book Judy Grahn calls Canadian Michael Lynch’s
emphasizes how critical it is for everyone to face the unique collection of poetry, These Waves of Dying
reality of AIDS, Broken Wings is, as the title implies, Friends, “moving, jarring and suddenly insightful.”
ultimately a book borne of hope for those dealing with These Waves (Contact II Publications, $5.00 pb, 0-
that reality. 936556-19-6) is an AIDS elegy which helps to exorcise
New in paperback is Notes on Living Until We a truer evil than the virus itself — indifference. In this
Say Goodbye by Lon Nungesser (St. Martin’s, $7.95 noble volume, Lynch merges past and present with
pb, 0-312-02957-8). Subtitled “A Personal Guide,” the acceptance of life and the possibility of death.
Notes provides a practical and positive approach to (Inland does not carry this title at presstime; order
living with a terminal diagnosis — an approach which from Contact II Publications, Box 451 Bowling Green,
is based on the author's own hard-won experiences. New York, New York 10004.)
Through Nungesser’s imaginative methods, a person
can turn his or her natural dread into an unexpected BIOGRAPHIES
and deeply rewarding power over the way he or she “In battle he fought with legendary valor. At
spends his life. court, dressed in silks and ribbons, he openly favored
“My mother gave me a surprise birthday party his male lovers. Despised but feared by his brother,
for my 30th birthday— later she told me that when it King Louis XIV, he was the perpetual loser in a lifelong
came time to put the candles on the cake that she sibling rivalry.” He was Brother to the Sun King:
decided against it. She thought that some of the people Philippe, Duke of Orléans. (Johns Hopkins Univer-
wouldn't want me blowing on the cake.” These are the sity Press, $24.95 cl, 0-8018-3791-X) Nancy Nichols
May/June 1989 50 Volume 12 Number 1
This content downloaded from
(cid:0)(cid:0)(cid:0)(cid:0)(cid:0)(cid:0)(cid:0)(cid:0)(cid:0)(cid:0)(cid:0)(cid:0)70.126.145.227 on Sat, 19 Mar 2022 17:42:04 UTC(cid:0)(cid:0)(cid:0)(cid:0)(cid:0)(cid:0)(cid:0)(cid:0)(cid:0)(cid:0)(cid:0)(cid:0)(cid:0)
All use subject to https://about.jstor.org/terms","['0-8021-1110-6', '0-517-52742-7', '0-943173-41-8', '0-312-02957-8', '0-8018-3791-X']"
