PageNumber,Text,ISBNs
24,"Feminist Bookstore News
translations as bi-lingual women translated what they del donne (Milano, Italy); Farida Akhter (Narigrantha
heard from the panelists (or the receivers) into addi- Prabartana Feminist Bookstore, Bangladesh); Sandi
tional languages for friends and colleagues. Torkildson (A Room of One's Own, Wisconsin); Carol
One of the highlights of the translations, for me, Seajay (Feminist Bookstore News) — and more book-
occurred when a woman on the Eastern European sellers were added at the last minute. There were so
panel rose to speak in Hungarian — which none of the many booksellers on the panel that, even as quickly as
translators understood. A woman from Barcelona of- we talked, there was only 20 minutes for discussion so
fered to translate from Hungarian to Catalan — and we scheduled a follow-up meeting the next day.
then translators were able to translate the Catalan into The panel on publishing in the Third World was,
other languages. And so the Hungarian woman's unfortunately, back to back with the one workshop on
ideas were conveyed.... bookselling, a scheduling conflict that shouldn't hap-
pen again, as many “third-world” booksellers are also
publishers and need to attend both workshops — also
because the booksellers from over-developed coun-
tries need to, and are eager to, learn how to support
“third-world” publishing.
The Heart of the Conversation
As exciting as the panels were, many of the most
exciting exchanges took place in small, informal con-
versations. A big part of the Fair for FBN is collecting
“verbal press releases,” catching up on the interna-
tional news, finding “old” friends from previous Fairs
and learning about new successes and projects all
around the world and, of course, talking with book-
sellers. Because there aren't enough panels for all the
women to talk about their work, the informal conver-
sations really are the heart of the Fair.
In one of these conversations I “found” Acca,
the Swedish women’s press. They weren’t lost, of
course, but I'd heard that they'd stopped publishing
books — but missed the more important news that
they’d switched to publishing a monthly feminist
newspaper, a format more fluid than book publish-
ing and so had only changed form, not stopped
publishing.
Kali For Women (India) is financially stable at 12
books a year. The Egyption women’s press did get off
the ground but is focused on publishing pamphlets
rather than books — as are many publishers in coun-
Bookselling tries where literacy is not common among women.
There was only one workshop on women’s book- These publishers are less visible outside their coun-
stores (subtitled: The Sale of Feminist Books in the tries than publishers that do books.
90's). Panelists included Heide Braun (Sal de Casa, An American living in Amsterdam introduced us
Valencia); Renee Albrecht (Women’s Bookstop, Can- to a Russian woman who is starting the first lesbian
ada); Donna Fernandes (Streelekha, India), Xantippe and feminist publishing company in the U.S.S.R.
Bookshop (Holland); Jimena Pizarro (Libería Lila, Chile); (Look for an interview in the next issue). She also
Nancy Vezner (Odegard Books, Minneapolis); Liberia brought copies of the first edition of a Russian
Volume 13 Number 2
This content downloaded from
(cid:0)(cid:0)(cid:0)(cid:0)(cid:0)(cid:0)(cid:0)(cid:0)(cid:0)(cid:0)(cid:0)(cid:0)70.126.145.227 on Sat, 19 Mar 2022 17:44:15 UTC(cid:0)(cid:0)(cid:0)(cid:0)(cid:0)(cid:0)(cid:0)(cid:0)(cid:0)(cid:0)(cid:0)(cid:0)(cid:0)
All use subject to https://about.jstor.org/terms",[]
25,"Feminist Bookstore News
gay/lesbian newspaper. (If you'd like a photocopy of
it, send a large SASE with two stamps.)
Mary Dorsy (A Noise from the Woodshed/
Onlywomen) stopped by FBN’s booth and told hilar-
ious stories about being the first lesbian to receive the
Rooney Prize. It seems that an Irish-American family
(owners of the Pittsburgh Steelers) decided to endow
a literary prize in Ireland which, over the years, has
been very well admistered and become quite presti-
gious. In 15 years, three of the awards have gone to
women (""Which is quite high for Ireland""), and twice
the awards have gone to books that included gay
(male) characters, though ”Of course no one would
assume that the writers were gay” but this is certainly
the first time the award has gone to a book that in-
cludes (very out and very sexual) lesbian characters
written by an “out” and proud lesbian.
Having been in Dacca in 1974, I was especially
excited to meet the women who created the
Bangladesh women’s bookstore, to hear about how
they conceptualized the store, how it fits in with other The organizers, though criticized for not bringing
work that they do. They are also activists in the more Asian and African women, were quite clear
handlooming movement in Bangladesh and their about their priorities and what was possible (as op-
organization runs a handloomed sari shop next posed to ideal) given the kind of money they could
door to the bookstore. Women nervous about enter- raise in a “first world/third world” country like
ing (or being seen entering) the feminist bookshop Spain. Their priorities were to organize the Fair and to
can enter through the sari shop. (I keep imagining 1) bring women from Spanish speaking countries
women saying, “So tell my husband you saw me since this was the first International Feminist Book
enter a sari shop! What is he going to care!"") The Fair in a Spanish speaking country; 2) to bring women
thought and care that goes into creating women’s from Mediterranean (including North African) coun-
bookshops in Bangladesh, Pakistan, and the Philip- tries; and 3) to bring women from Eastern European
pines is truly inspiring. The Bangladesh women countries who might not have been allowed to attend
sent us home with a video they'd made of their any of the previous fairs. The organizers clarity of
store. We'll have it converted to VHS by next issue purpose informed the entire Fair.
and devise a way to circulate it. There was high praise for the organizers’ party-
Many women also spoke of the informal lesbian throwing skills as well as for their organizing: The
meetings as highlights of the Fair — in part because Mediterranean Music evening was as wonderful for
they were small group meetings that facilitated con- the location as the music — out-of-doors, at night, at
versation and learning about each other’s cultures in the hundreds-of-years-old women’s bathhouse on the
addition to sharing information and skills. beach. And I, for one, will never forget dancing in the
heart of the Labyrinth Gardens with women from
Evaluations around the world the last night of the Fair.
This is one of the few Fairs where book sales were The Philippines, Australia, Puerto Rico and Am-
deemed satisfactory. Posters around the city, (we saw sterdam are all under consideration for the next Fair.
them in the subway stations) and a burst of media The women interested in having it in their countries
attention at the Fair opening brought book buyers to will go home, talk about it with their communities,
the fair. Some came for the panels, but (by design or and see what kind of fundraising they think they can
luck) had to walk through the exhibit hall to get to do. The decision will be made in the fall. O
23 August 1990
This content downloaded from
(cid:0)(cid:0)(cid:0)(cid:0)(cid:0)(cid:0)(cid:0)(cid:0)(cid:0)(cid:0)(cid:0)(cid:0)70.126.145.227 on Sat, 19 Mar 2022 17:44:15 UTC(cid:0)(cid:0)(cid:0)(cid:0)(cid:0)(cid:0)(cid:0)(cid:0)(cid:0)(cid:0)(cid:0)(cid:0)(cid:0)
All use subject to https://about.jstor.org/terms",[]
26,"Feminist Bookstore News
Progetto Mappa in Italy
This article was originally published in Leggere interested in the same material to start buying at the
donna, Bimestrale di informazione culturale, Ferrara, shop. So we began working on this project by asking
1989. It was translated for inclusion in FBN by Maureen friends in other towns to tell us about their favorite
Lister and Traudel Sattler during the IV International bookshops. Then we got in touch with the booksellers
Feminist Bookfair in Barcelona. themselves and promised them a minimum level of
sales on the feminist titles and new customers in ex-
We started working in the idea of “The Guide To change for stocking feminist publications.
Italian Bookstores” after one of our friends pointed We tried out “The Guide” with the distribution of
out how we might be able to solve one of the problems a journal about philosophy published by the women’s
facing women who want to do autonomous women’s bookshop in Milan. The women with whom we had
politics. political contacts were informed that the publication
was on sale in these stores and, afterwards, the feed-
back from the bookshops showed us that the project
In these bookshops was actually working.
[Ed. Note: The women’s bookstore, Libreria delle
the women’s publications donne, in Milan, became a wholesale distributor in
are displayed clearly order to put this plan into effect and now wholesales
feminist books, magazines and leaflets to general
and separately. bookstores throughout Italy at the standard Italian
wholesaler’s discount (20%) and publishes and circu-
Our problem is that we have very little control lates a guide to Italian bookstores that stock feminist
over the circulation of women’s work, either in dis- publications. “The Guide” currently includes 84 book-
tributing what we produce ourselves or in obtaining stores in 67 towns and cities. As wholesale distributors
the books we want as readers. Writers and publishers Libreria delle donne receive a 50% discount.]
find it hard to get to the reading public. Women who We would like to ask all [Italian] women re-
are looking for certain books often don’t know where searchers, university teachers and everybody else in-
to get them, especially if they live in small towns or terested in the circulation and visibility of women’s
the in the south of Italy. ideas and knowledge to collaborate with this project.
Our friend’s idea was simple and effective. She We suggest that women publishers who do their own
suggested that the bookshop in the small town where distribution use the bookshops in “The Guide.”
she lived order women’s books, magazines and leaf- Women publishers who work with distributors
lets that she was interested in reading. In exchange, should also try to use these bookshops for sales. In this
she agreed to persuade her friends who were also See Progetto Mappa, page 46
24
This content downloaded from
(cid:0)(cid:0)(cid:0)(cid:0)(cid:0)(cid:0)(cid:0)(cid:0)(cid:0)(cid:0)(cid:0)(cid:0)70.126.145.227 on Sat, 19 Mar 2022 17:44:15 UTC(cid:0)(cid:0)(cid:0)(cid:0)(cid:0)(cid:0)(cid:0)(cid:0)(cid:0)(cid:0)(cid:0)(cid:0)(cid:0)
All use subject to https://about.jstor.org/terms",[]
27,"Feminist Bookstore News
LAS VEGAS: All year I had been wondering what
Las Vegas had to do with the book industry. It’s not a
city one goes to for bookstores, that’s for sure. It isn't
the heart of a gutsy and innovative small press move-
ment. And, unless steak and fries is your meal of
choice, forget eating.
But the moment I hit “The Strip” it was perfectly
clear: Thousands of booksellers and publishers had
been beamed into a science fiction novella in the scene
where the hyper-spacers go for R&R on a planet de-
signed for every kind of gambling, drinking, drug-
ging, sexing, and quick-fix entertainment known to a
variety of species of “man”-kind. In the course of the
convention I thought of at least a dozen scenes in sf
novels that could have been inspired by Las Vegas .
In contrast to the ever-present clattter of slot
machines and the high density noise that is the sound
of Vegas, the convention floor seemed calm and
nearly serene by comparison. All the booths were on also welcome and should be accompa-
one floor. Traffic, except in the furthest reaches, was ed by addresses and phone numbers.
good. The Gay/Lesbian/Feminist row had the best This would also be an effective time to vali-
location yet. We were in the far-from-the doors half date the importance of having a specialty book-
of the convention floor, but were only four rows in, seller lead the specialty roundtables and to
and on the direct route to the Harper/ Collins booth. convey your opinion about whether the
Hanging in all these years to accumulate seniority roundtables should focus on the issues of spe-
points is beginning to pay off. cialty bookstores, on the needs of general book-
The energy at and around the convention was stores wiíth (feminist) sections, and/or if mixing
consistently good. Many of us were pleasantly sur- the two interest groups works.
prised that the bookselling /book buying community Suggestions should be sent in writing to
showed up and did business. Like the Anaheim con- David Riederman, Coordinator Of Educational
ventions, there was a sense that distractions, enter- Programs, c/o The American Booksellers
tainment, and other pleasures generally associated Association, 137 West 25th St., NY NY 10001, by
with traveling were (much too) minimal, and there Friday October 19. o
wasn't a lot to do except business and visit with
25 August 1990
This content downloaded from
(cid:0)(cid:0)(cid:0)(cid:0)(cid:0)(cid:0)(cid:0)(cid:0)(cid:0)(cid:0)(cid:0)(cid:0)70.126.145.227 on Sat, 19 Mar 2022 17:44:15 UTC(cid:0)(cid:0)(cid:0)(cid:0)(cid:0)(cid:0)(cid:0)(cid:0)(cid:0)(cid:0)(cid:0)(cid:0)(cid:0)
All use subject to https://about.jstor.org/terms",[]
28,"lished” publishers to beginners that was useful and Special thanks to Theresa Corrigan for organiz-
effective for the whole range of publishers attending. ing a block of rooms at the Mardi Gras Inn (Best
The feminist bookstores meeting was high-en- Western) for feminist booksellers and publishers. The
ergy, with all stores reporting that sales were good to rooms were large and comfortable, equipped with
thriving, and that this is a time of vitality and good refrigerators & various conveniences, the pool was a
health. As always, meeting before the ABA gave us a very effective meeting place in Vegas’ record setting
chance to get to know each other, to run into familiar heatwave and, thanks to the group booking and a few
faces and allies on the convention floor, make plans for errors along the way, we paid less than half the posted
dinners and meetings on various topics. Lee Boojamra room rent. Finding a block of rooms in a convenient
(Womankind) moved us efficiently through a long and affordable hotel in NYC may be a challenge, but
and detailed agenda. We actually ended at 4:30. it’s a strategy we should repeat. — Carol Seajay O
This content downloaded from
(cid:0)(cid:0)(cid:0)(cid:0)(cid:0)(cid:0)(cid:0)(cid:0)(cid:0)(cid:0)(cid:0)(cid:0)70.126.145.227 on Sat, 19 Mar 2022 17:44:15 UTC(cid:0)(cid:0)(cid:0)(cid:0)(cid:0)(cid:0)(cid:0)(cid:0)(cid:0)(cid:0)(cid:0)(cid:0)(cid:0)
All use subject to https://about.jstor.org/terms",[]
29,"Feminist Bookstore News
By Carol Seajay completed And a Deer's Ear, Eagle's Song and Bear's
Grace: Animals and Women (Cleis Press).
Thirty-eight booksellers representing 20 stores
met on June 1 in the Mardi Gras conference room the Collectively, the sales of the
Friday before the ABA convention began. Stores rep-
resented included: Amazon (Minneapolis), Book 20+ stores gathered for
Woman (Austin), Common Language (Ann Arbor), A
Different Drummer (Laguna Beach), Full Circle (Albu- the meeting exceeded
querque), Grand Books (Jackson WY), The Great five million dollars
Catsby (Sante Fe), Inklings (Houston), Lioness (Sacra-
mento), Mother Kali’s (Eugene), Page One (Pasa-
dena), Pandora Books for Open Minds (Kalamazoo), Common Language (Ann Arbor), in business for
A Room of One's Own (Madison), Smedley’s (Ithaca), exactly two weeks with new owners and a new name
Together As One (Colorado Springs), The Toronto (previously Common Destinations), was the youngest
Women’s Bookstore (Toronto), Valley Women’s Books store present. Amazon was the oldest store there, cel-
& Crafts (Fresno), Wild Iris (Claremont), Womankind ebrating 20 years this fall. Page One is 16, as is Lioness
(Huntington Station NY), and Women & Children — counting the first 6 years as the “Sacramento
First (Chicago.) Women’s Bookstore.”
Collectively, the sales of the 20+ stores gathered
Demographicly Speaking... for the meeting exceeded five million dollars.
Twelve booksellers at the meeting were attending
ABA for the first time. Half of us were over 40. Two The Agenda
booksellers came in after finishing ABA Booksellers The agenda was based on the pre-meeting survey.
School in the morning. Lee Boojamra (Womankind) chaired the meeting and
Barb Wieser (Amazon Bookstore), and Lee walked us through a record number of topics with
Boojamra and Alice Frier (SP??) (Womankind) also amazing efficiency. We covered some of them in
attended the Feminist Publishers meeting the day be- depth, touched on all of them and got out on time! The
fore as Bergamot Books and Rising Tide Books, respec- agenda included:
tively, which helps to strengthen the ties between the ° Introductions
two groups. Hopefully, next year, we will have a com- ° Staff Relations and Hiring
bined session, dinner, or reception for feminist pub- ° Health Insurance, Pensions, and Retirement
lishers and booksellers. We have a lot to talk about. ° Improving Customer Relations: How Does the
We also had editors among us — Irene Zahava Community View You?
(Smedley’s) popped in after morning meetings with ° Store policies that work
Crossing. Theresa Corrigan (Lioness) had recently ° Burn-Out: Where and How to get Help
27 August 1990
This content downloaded from
(cid:0)(cid:0)(cid:0)(cid:0)(cid:0)(cid:0)(cid:0)(cid:0)(cid:0)(cid:0)(cid:0)(cid:0)70.126.145.227 on Sat, 19 Mar 2022 17:44:15 UTC(cid:0)(cid:0)(cid:0)(cid:0)(cid:0)(cid:0)(cid:0)(cid:0)(cid:0)(cid:0)(cid:0)(cid:0)(cid:0)
All use subject to https://about.jstor.org/terms",[]
30,"Feminist Bookstore News
° Indian Spiritual Abuse — The Responsibilities of of getting insurance through business organizations.
Booksellers One bookseller’s health insurance was canceled by the
Lunch ABA-sponsored program...)
FBN check-in, feedback, and writer requests
Censorship in the Feminist Bookstore Community Staff Relations:
Advertising and Marketing: Attracting New “Our store isn't large enough for five managers.
Customers and Keeping The Old Ones. We tend to keep the fun stuff and dump the garbage
Newsletters and Mailings: Do They Pay Off? on employees and then get surprised when they get
e Recent Developments Between Lesbian and Femi- bored and go away! How do you learn to let go?!”
nist Publishers and Mainstream Presses Responses: “Just do it!” “Having a growing business
° Improving Relations Between Booksellers and forces you to give up responsibility.” “Give discrete
Publishers tasks with boundaries and build on successes.” “What’s
e Computers and Booksellers: Using Technology to the worst that will happen if something is done badly?
run your store more efficiently Will you be embarrassed? Will it kill the store?” “It’s
easier to give away responsibility if you are clear about,
Needless to say, we didn’t solve everything but, what you want to do — and don't want to do.”
as always, it was great to have the chance to talk about Hiring: “Hire the person,” per Paul Hawkins in
t t fh h re e ies n e n d e st w ,h i n ab ng o ds o k w ts oei lt lh e rr u s ne a c a inh nd t oo t f h i ere asr ct h. - t I it om t hew e a rAs B fAg or re -a et tr h s et , o nt om e x e tse et e f o a o ul ll rd i aG s l or no ww go i r n wtg h i t ha t .h B e Bu e s t i in m se us e rs e. i tH t h i tr eai kn peg es . o w p H le el i l r e y a o v upo ei od hps il re e p r y uo ob nul d e em c ra ss n t a a ngn ded t
days on the convention floor. your expectations. And be sure you do, too! Advertise
— don’t just rely on word of mouth. Be specific about
We're not friendly enough what you want. Know what kind of commitment
and it’s a nation-wide 5(t ?i m Ie n) ty ho eu iw nta en rt v i ea w n , e w as k e m wp hl ao ty e ke in t do om f a k ce o. m 2 m iy tmea er ns? t 3 th? e
problem. employee has in mind...
Hire a promising looking interviewee asa “temp”
worker, even if you have to make up a project to do it.
My favorite part, as always, was the introduction You'll know a lot more about whether or not you want
session — we went around the room, introduced to work with a woman after you've moved two sec-
ourselves and our stores, said how long the store had tions of books and re-alphabetized the fiction section
been open, our annual sales, how the store was doing, than yow'll ever learn in an interview — and she'll
and gave a bit of news about the store. (see “Book- know if she wants to work with you!
store News”). Have a probation or try-out period after which
Some of the conversations are covered elsewhere either of you can terminate with no hard feelings...
in this issue (See “Bookstore News,” “Indian Spiritual Hire people with commitment — (but don’t be
Abuse in Books and Bookselling,” and “ABA/Las confused that an employee's commitment to a store
Vegas”). Kasha Songer (Book Garden) covers some of could or should match an owner's. It’s also hard to
the things discussed in “Staff Relations” in her article find new collective members for a collectively owned
“On Being a Feminist Employer” (in the FBN Summer store. Whose commitment could possibly match that
Supplement). Comments and highlights from the of the women who've been there for years? Thisisan
other sessions follow. ongoing problem... We all understood it, but didn’t
have ready solutions.) “Hire women who are commit-
Health Insurance & Pensions ted to lesbians and/or to The Movement.”
Women and Children First (W&CF) was the only Requirements: A sense of humor!
store present with a pension plan. None of us had any The Work: Give responsibility and power.
generic, earth-shaking, affordable solutions to the Make it a great job! Give sections to employees — to
health care crisis in the U.S. Several booksellers spoke keep stocked, tidied, dusted, and to advise you on
28
This content downloaded from
(cid:0)(cid:0)(cid:0)(cid:0)(cid:0)(cid:0)(cid:0)(cid:0)(cid:0)(cid:0)(cid:0)(cid:0)70.126.145.227 on Sat, 19 Mar 2022 17:44:15 UTC(cid:0)(cid:0)(cid:0)(cid:0)(cid:0)(cid:0)(cid:0)(cid:0)(cid:0)(cid:0)(cid:0)(cid:0)(cid:0)
All use subject to https://about.jstor.org/terms",[]
