PageNumber,Text,ISBNs
70,"Feminist Bookstore News
artwork. These glimpses into Lomas Garza’s life — from the tops of their heads to the tips of their toes. The
from ages five to twelve — show the vitality of her text, intended to teach children the anatomically cor-
loving extended family and conclude with a moving rect terms for all body parts, includes vocabulary such
tribute to her mother, who encouraged her to become as penis, scrotum, vulva, clitoris, and anus, in addition to
anartistby “[laying] out the bed for our dreams of the eyes, ears, arms, legs, etc. The full-color illustrations are
future.” as explicit as the text. An easy, accurate introduction
Nightfeathers, Sundaira Morninghouse, illus. by to anatomy to share with children.
Jody Kim, Open Hand, $9.95 cl, 0-940880-27-X; $4.95 Mama, Daddy, Baby and Me, Lisa Gewing,
pb, 0-940880-28-8, 32 p. Ages 2-5. From sunup to sun- illus. by Donna Larimer, Spirit Press (1499 Masonic
down and beyond into dream time, 20 short poems Ave., San Francisco CA 94117), $12.95, 0-944296-04-
carry young listeners through a typical day in the 01, 32 p. Ages 18 mos.-3 yrs. A simple, rhyming,
life of an African-American child. Several of the first-person text tells of a toddler's responses to the
poems spin off the first lines of familiar nursery arrival of a new sibling. Detailed illustrations in full
rhymes, creatively changing subsequent lines to make color and black and white complement the story’s
them ethnically specific: “What are little boys made mood of homey security. The tone throughout 'is
of?/chocolate and cream/caramel and toffee positive and reassuring; no mention is made of sib-
/ espresso espresso/and deep rich coffee.” The poems ling rivalry, often the focus of books on this subject.
are accompanied by black and white pencil drawings Neither of the children’s genders is specified, mak-
by Kim, an artist who is particularly adept at captur- ing this story especially workable for parents of
ing the closeness between parent and child. children of either sex.
Black Heroes of the Wild West, Ruth Pelz, illus. “T” is for “Terrific”/”T” es por “terrifico”:
by Leandro Della Piana, Open Hand, $9.95 cl, 0- Mahji’s ABC/El ABC de Mahji, Mahji Hall, Open
940880-25-3; $5.95 pb, 0-940880-26- 1, 56 p. Gr. 3-5. Hand (PO Box 22048, Seattle WA 98122), $8.95 c|, 0-
Nine short biographical essays feature dramatic epi- 940880-21-0; $3.95 pb, 0-940880-22-9. Ages 3-6. A bilin-
sodes in the lives of five men and four women who left gual (English-Spanish) alphabet book written and il-
their marks on the history of the Old West. The Afri- lustrated by a 12-year-old girl shows childlike energy
can-American heroes included range from Estevan, an and exuberance. Mahji Hall has carefully selected
early explorer, to Stagecoach Mary Fields, an adven- words that begin with the same letter in both Spanish
turous pioneer notorious for her strong will and phys- and English and has included the Spanish sounds ch
ical strength. A full-page black-and-white portrait and Il as initial consonants. While the illustrations are
opens each chapter in an attractively designed book clearly the work of a child, Mahji is a gifted young
that makes this hard-to-find information accessible to artist with a sophisticated sense of composition. A
young readers. pronunciation guide to both the English and Spanish
words is appended.
Tears for Ashan, D. Marie, illus. by Norman
A Childers, Creative Press Works (PO Box 280556, Mem-
phis TN 38128), $10.95, 0-9621681- 0-6, 32 p. Gr. 3-6. A
unique and valuable perspective on slavery is pro-
vided in an understated, illustrated story set in an
unspecified region of Africa. As Kumasi approaches
manhood, he looks up to and admires a young hunter
named Ashan, whom he considers his best friend. When
the “men without color” arrive carrying “long sticks that
smoked and made a loud popping noise,” Kumasi
Bellybuttons Are Navels, Mark Schoen, illus. by watches in horror as Ashan is taken captive and
M J. Quay, Prometheus, $14.95, 0-87975-585-7, 40 p. Ages grieves when he realizes he will never see his friend
3-7. While bathing together, a preschool-aged brother again. The Afrocentric point of view offers a much-
and sister identify and name the parts of their bodies, needed balance in children’s literature on this topic.
68
This content downloaded from
(cid:0)(cid:0)(cid:0)(cid:0)(cid:0)(cid:0)(cid:0)(cid:0)(cid:0)(cid:0)(cid:0)(cid:0)70.126.145.227 on Sat, 19 Mar 2022 17:44:15 UTC(cid:0)(cid:0)(cid:0)(cid:0)(cid:0)(cid:0)(cid:0)(cid:0)(cid:0)(cid:0)(cid:0)(cid:0)(cid:0)
All use subject to https://about.jstor.org/terms","['0-940880-27-X', '0-940880-28-8', '0-940880-22-9', '0-87975-585-7']"
71,"Feminist Bookstore News
Social studies teachers will welcome this authentic, attempts of Naples’ most pompous purloiners, hope-
moving story, extended by softly colored pictures. lessly pitted against the clever, plucky heroine who
Nine-In-One Grr! Grr!, Blia Xiong, Children’s yearns for security and an honest life.
Book Press (5925 Doyle St., Suite U, Emeryville CA
94608), $12.95 lib. ed., 0- 89239-048-4. Ages 3-8. At last! =. A
A story for children from the: Hmong tradition. The
title of this delightful folk-tale comes from a song Tiger S,
makes up to help her remember the sky god’s promise
of the number of cubs she will give birth to each year.
Bird, worried that tigers will soon overrun the earth,
tricks Tiger into forgetting the lyrics — which is why
there are so few tigers in the world today. Simply and
eloquently told, this pourquoi tale from a minority
Laotian culture is boldly illustrated in a style adapted
from the multi-imaged embroidered story cloths of
the Hmong people. Its rhythmic text and appealing, Afro-Bets First Book about Africa Veronica Free-
brightly colored pictures make it a good choice for man Ellis, illus. by George Ford, Just Us Books (301
preschool story hours. Main St. Ste. 22-24, Orange NJ 07050) $13.95 lib. ed.,
Baby Rattlesnake, Te Ata, illus. by Veg 0-940975-12-2; $6.95 pb, 0-940975-03-3, 32 p. Gr. 2-5. A
Reisberg, adapted by Lynn Moroney, Children’s fictional classroom provides the setting for an excel-
Book Press, $12.95, 0-89239-049-2, 32 p. Ages 2-5. lent overview of the natural, socia], and political his-
From the repertoire of the renowned Chickasaw tory of Africa. Through dialogue and storytelling, a
storyteller comes a cautionary tale about the folly of Ghanaian visitor imparts an amazing amount of infor-
getting something before one is old enough to take mation to a group of inquisitive African-American
care of it. Baby Rattlesnake wants a rattle on his tail children. Skillfully designed pages combine full-color
like his older brother and sister have. Tired of his illustrations with captioned black-and-white and
incessant crying, the adults give in to his Wish, only color photographs to expand information in the text.
to discover that Baby cannot control his delight in Highly accessible, this unparalleled introduction in-
shaking his new toy at all the unsuspecting passer- staills p rivde abys ctapt ur ingc tohe n ricthniessn aned ndivetrsi.ty of;
bys. But Baby learns his lesson one day when he
goes too far — he shakes his rattle at the chief's Ashkii and his Grandfather, Margaret Kahn
daughter. The short sentences, onomatopoeia, and Garaway, illus. by Harry Warren, Treasure Chest Pub-
repetition will hold the attention of the youngest lications (1850 W. Grant Road, Ste. 101, PO Box 5250,
listeners as will the boldly colored, stylized Tucson AZ 85703-0250), $5.95 pb, 0-918080- 41-X, 33 p.
gouache and cut-paper illustrations that depict the Ages 5-8. Ashkii is certain that his grandfather is the
endearing Rattlesnake family. best sheepherder on the Navajo Reservation. Now
Orlanda & the Contest of Thieves, Olga Cossi, that Ashkii is six, he is old enough to accompany his
illus. by Tom Sarmo, Bookmakers Guild, $14.95, 0- grandfather to the summer sheep camp and to begin
917665-32-5, 24 p. Gr. 3-5, younger for reading aloud. to learn some of the responsibilities of herding. Contrast-
An Italian folktale recounts the story of Orlanda, a ing with Ashkii’s developing self-confidence is the
street-Wise eleven-year-old orphan, whose skills as a gnawing fear of another threshold he faces in the fall:
pickpocket are put to the test when she enters a contest beginning school. This authentic, unsentimental por-
to determine who is the best thief in Naples. The trayal of an intergenerational relationship is illustrated
competition, devised by the Lord Mayor’s wifeto rid the with full-color pastel paintings by Navajo artist Warren.
city of crime, has high stakes: all losing contestants Though the drawings are somewhat stiff, they do convey
will be banished, while the winner is promised a a strong sense of place. Overall, a worthy contribution to
position in city government. Four brief chapters, illus- the small body of literature portraying the lives of con-
trated in full color, delightfully detail the amusing temporary native American children. O
Volume 13 Number 2 69 August 1990
This content downloaded from
(cid:0)(cid:0)(cid:0)(cid:0)(cid:0)(cid:0)(cid:0)(cid:0)(cid:0)(cid:0)(cid:0)(cid:0)70.126.145.227 on Sat, 19 Mar 2022 17:44:15 UTC(cid:0)(cid:0)(cid:0)(cid:0)(cid:0)(cid:0)(cid:0)(cid:0)(cid:0)(cid:0)(cid:0)(cid:0)(cid:0)
All use subject to https://about.jstor.org/terms","['0-940975-12-2', '0-940975-03-3', '0-89239-049-2']"
72,"Feminist Bookstore News
New LIP
Formidable
Writing Pamphlets
new feminist
Ailbhe Smyth (editor) Provocative, polemical pamphlets talent from
Wildish Things: An on contemporary issues and
A Wn ot mh eo nlo ’sg y W o rf it inN gew Irish Aw lr li t $er 5s .9 5and activists. Attic
736 (pb) $15.95
Pornography: The New Terrorism
p ino e t tr hy i s a r me o sg ta t whe or ne dd e r fto ug l e t bh oe or k TC hlo ed a Pg oh l i tC ico sr c o or fa n S e d8 u41 ction Press
gentle, sweet and lyrical Trudy Hayes 949
collection.’ Spare Rib The Right to Choose: Questions
Eilís Ní Dhuibhne of Feminist Morality
The Bray House Ruth Riddick 85X
965 (pb) $11.95 Ancient Wars: Sex and Sexuality
and political allegory, a Ethna Viney 833 | ISBN Prefix: 0946211
nch ui cl ll ein arg hn oo lv oe cl a u ss te t I rin el a np do .st- iA n K a i n Nd a t O iof n a lS c a Tr r: a dT ith ie o n Woman Poet | AIl books distributed
Mary Rose Callaghan Eavan Boland 795 1| t ah nr do u Ig nh l a nB do .ok People
The Awkward Girl From Cathleen to Anorexia: I l| For a complete list
957 (pb) $11.95 The Breakdown of Irelands 1 of all our books and
bSF a eu l sn l tyn y s A h, en u n n c a c l ne ir v . t e a s Ai n n h ea ern n d gl ai f gb e ir n a gv a ,se, E Ird en laa n dL :o n Bg el te wy e e9 n9 X the First 1 E 1H H 1 ot no ab le l nk ee wpt Au tp t- it co-date
gently ironic novel. and the Third Worlds i publications, write to:
Leland Bardwell Carol Coulter 930 1 Attic Press
There We Have Been 1 44 East Essex Street
817 $7.95 FH aa ts e T oh fe SR oce id a l iF smlag i nF a l tle hn e? 1 T 99h 0e s i:| FD au xb : l i 0n 1 12 , 3 5I 3r 1el a n 67d 93754
ʻA novelist of real authority Helena Sheehan 779
- pared, allusive and
resonant.’ New Statesman
and Society Feminist
R Fait ra e K We ell ly l - Beir Fairytales
Beannacht Poems
All $6.95
in English and Irish
663 (hb) $15.95 Rapunzel's Revenge 183
Urgent, generous and Ms Muffet and Others 272
passionate, Rita Kelly is a Mad and Bad Fairies 40X
p anoe dt ho of n ec so tm y.pelling power Sweeping Beauties 71X t€
August 1990 70 Volume 13 Number 2
This content downloaded from
(cid:0)(cid:0)(cid:0)(cid:0)(cid:0)(cid:0)(cid:0)(cid:0)(cid:0)(cid:0)(cid:0)(cid:0)70.126.145.227 on Sat, 19 Mar 2022 17:44:15 UTC(cid:0)(cid:0)(cid:0)(cid:0)(cid:0)(cid:0)(cid:0)(cid:0)(cid:0)(cid:0)(cid:0)(cid:0)(cid:0)
All use subject to https://about.jstor.org/terms",[]
73,"Feminist Bookstore News
= ARTBOOKS
By Tee Corinne book is...a story of people making choices, making
change. A story of ordinary heroes whose work for
What a treat it was to attend ABA and talk with peace finds no applause, is rarely noticed, can never
booksellers and publishers. In our word-conscious be measured.” Her own activism also went through a
movements I sometimes think that no one cares about transformative experience. “I came back to the West
the visual arts, so those of you who said you like this wondering not what to do about life, but how to be in
column and find it useful were especially appreciated. it more fully.” Friendship Press, P.O. Box 37844, Cin-
Perhaps someday we'll have a visual equivalent of the cinnati, OH 45222-0844, $18.95, 0-377-00200-3 pb,
Lammies. 40%, BP and Syracuse Cultural Workers.
One exciting piece of information I picked up at A Different War: Vietnam in Art by feminist
ABA was that Northeastern University Press will critic Lucy R. Lippart is a visually and verbally elo-
begin to distribute books for the National Museum of quent statement in support of socially relevant art.
Women in the Arts starting with the gorgeous Camille Lippart gathers work by emerging and well known
Claudel. Che artists, men and women, people of differing social and
racial backgrounds. The text documents three decades
of visual responses to and commentaries on the war
and makes powerful connections between what hap-
pened in Vietnam and responses to what's happening
in Central America today. Many of the images are
reproduced in color. Real Comet Press, $18.95 pb,
0-941104-43-5. BP/IN.
Two Black Folk Artists: Clementine Hunter,
Nellie Mae Rowe is a small pamphlet with four color
reproductions and b&w photos of each artist and
biographical text about them. Hunter was born in
Making Peace: One Woman’s Journey Around 1886, started painting at the age of sixty and was still
the World, text and photography (color and b&w) by painting at the age of one hundred. She painted scenes
Jan Phillips, is a powerful, beautiful, heart wrenching of the buildings and life around her in Louisiana and
view of how luminous and diverse the human habi- the images/visions which moved her. Rowe was born
tants of this planet are. Phillips made heart connec- in 1900 and lived in the rural area on the fringes of
tions with people around the issue of global peace. Atlanta until her death at the age of eighty-two. Her
When talking with survivors of the atomic bomb: brightly colored drawings are visionary and fanciful:
“over and over, they spoke the same words — ‘We “birds, animals, events, situations, convictions that
Must Never Let This Terrible Thing Happen Again. It were important to her.” One illustrated is “Black Poo-
was that memory that kept me moving through the dle Groomed for Kissing” in which a red faced poodle
next eighteen months, through fifteen countries, puckers up its mouth in the midst of sheep, dogs, birds
through my many fearful and fragile moments. This and other animals. A figure sits in a chair in the back-
71 August 1990
This content downloaded from
(cid:0)(cid:0)(cid:0)(cid:0)(cid:0)(cid:0)(cid:0)(cid:0)(cid:0)(cid:0)(cid:0)(cid:0)70.126.145.227 on Sat, 19 Mar 2022 17:44:15 UTC(cid:0)(cid:0)(cid:0)(cid:0)(cid:0)(cid:0)(cid:0)(cid:0)(cid:0)(cid:0)(cid:0)(cid:0)(cid:0)
All use subject to https://about.jstor.org/terms","['0-377-00200-3', '0-941104-43-5']"
74,"Feminist Bookstore News
ground. The colors are wild. Neither woman seems to beautiful work, beautifully photographed and inter-
have married. Art Museum, Miami University, Patter- estingly presented. Historical photos of regents wear-
son Avenue, Oxford, OH 45056, cost to bookstores is ing the shell leis over Victorian era European clothing
$5 each, $3 each for ten or more, no ISBN. are very striking. University of Hawaii Press, $39.95
Ecstatic Antibodies: Resisting the AIDS Myth- c], 0-8248-0998-X.
ology, ed. by Sunil Gupta & Tessa Boffin is an engag- The Woven and Graphic Art of Anni Albers (b.
ing book with essays on “The Rhetoric of AIDS,” Germany, 1899) presents the work of and honors a
“Picturing Deviancy,” “Angelic Rebels: Lesbians and woman whose writings and art have been very influ-
Safer Sex” (with wonderful photographs by Tessa Bof- ential in her field. Albers studied at the legendary
fin who is co-editing the new book on lesbian photo- Bauhaus where she met and later married Joseph Al-
graphy, due out this fall from Pandora, I believe), bers. They fled the Nazis in 1933 and joined the faculty
“Dangerous liaisons: Health, disease and representa- of Black Mountain College. In 1949 they moved to
tion,” and much more. Lots of pictures, definitely New York where she was the first weaver to have a
provocative. Unwin Hyman, $17.95 pb, 1-85489-014- one-person show at the Museum of Modern Art.
X; $39.95 cl, 1-85489-005-0. Albers’ work is abstract, often geometrical and always
I have trouble believing that anyone doesn’t elegant. Smithsonian Institution Press, $19.95 pb, 0-
know about Alison Bechdel’s three volumes Dykes To 87474-977-8, $39.95 c1, 0-87474-978-6.
Watch Out For, More Dykes To Watch Out For and Designs and Factions: Politics, Religion and Ce-
New, Improved! Dykes To Watch Out For, but, on the ramics on the Hopi Third Mesa by Lydia L. Wyckoff
chance that someone has missed them, I want to rave is an exceptionally interesting study of the ways in
about these hilarious cartoon books which gently and which traditional or progressive religious beliefs af-
lovingly poke fun at the activist Women’s Movement. fect the style and decoration of some Hopi pottery,
Firebrand, Dykes... $6.95 pb, 0-932379-1 7-6; $14.95 cl, how it is used and whethèr or not it will be sold or
0-932379-18-4; More... $7.95 pb, 0932379-45-1; $16.95 traded. Wyckoff discusses differing world views and
c], 0-932379-46-X; New... $7.95 pb, 0-932379-79-6; how these effect even the placement of objects and
$16.95 cl, 0-932379-80-X. Last year’s Dykes To Watch furniture within houses. University of New Mexico
Out For Calendar was a riot and I understand there Press, $24.95 pb, 0-8263-1178-4.
will be a new one for 1991. Yeah Alison and Nancy! . Ocracoke Portrait, photographs and interviews
Pacific Basket Makers: A Living Tradition in- by Ann Sebrell Ehringhaus, is a beautifully produced
cludes wonderful color and b&w photos of baskets and book of b&w photos of a small town on the barrier
basket makers from around the Pacific basin. It details islands along the coast of North Carolina. Turning the
the important function which basketry served in the pages is very much like walking through a small town,
differing cultures, and discusses current struggles to gain getting to know the faces, a woman cleaning shrimp,
access to traditional materials and to support the training fences with shoes set out to dry, a horse turning its
of young basketmakers. I was especially interested in the head, gulls flying. “You either like Ocracoke or you
trapping baskets for eel, fish and shrimp (the latter incor- hate it, nothing in between. It’s the people and the
porates a coke can). Dist. by the University of Hawaii concern people out here have for others. You can’t put
Press, $8.95 pb, no ISBN. it into words. It’s very simple, yet it’s very beautiful.
Tififai and Quilts of Polynesia by Joyce D. Ham- Here it’s hard not to enjoy the simple things of life.” It’s
mond is an extensive study of applique piecework also hard not to enjoy this book. John F. Blair, 1406 Plaza
fabrics (bedcovers and wall hangings) from four Dr., Winston-Salem, N. C. 27103, $13.95 pb, 0-89587-061-
island groups. Contemporary and historical designs 4; $21.95 cl, 0-89587-060-6, 1-4 at 20%, 5+ at 40%.
and usage are covered as well as the complex social Other titles of interest from Blair include: Before
functioning of the tififai as a symbol of honor. Univer- Freedom, When I Just Can Remember, ed. by Belinda
sity of Hawaii Press, $16.95 pb, 0-8248-0975-0. Hurmence, is made up of narratives from the 1850's-
Ni'ihau Shell Leis by Linda Paik Moriarty is a 1930's by former slaves from South Carolina. $8.95 pb,
gem of a book about the history, making and function 0-89587-069-X. My Folks Don’t Want Me To Talk
of shell leis (necklaces) in the Hawaiian Islands. It is About Slavery, ed. by Belinda Hurmence, is a
72
This content downloaded from
(cid:0)(cid:0)(cid:0)(cid:0)(cid:0)(cid:0)(cid:0)(cid:0)(cid:0)(cid:0)(cid:0)(cid:0)70.126.145.227 on Sat, 19 Mar 2022 17:44:15 UTC(cid:0)(cid:0)(cid:0)(cid:0)(cid:0)(cid:0)(cid:0)(cid:0)(cid:0)(cid:0)(cid:0)(cid:0)(cid:0)
All use subject to https://about.jstor.org/terms","['0-8248-0998-X', '1-85489-005-0', '0-87474-978-6', '0-932379-18-4', '0-932379-46-X', '0-932379-79-6', '0-932379-80-X', '0-8263-1178-4', '0-89587-060-6', '0-8248-0975-0', '0-89587-069-X']"
75,"Feminist Bookstore News
companion volume to Before Freedom with narra- Mary Cassatt, Eva Gonzales and Berthe Morisot are
tives from North Carolina. $4.95 pb, 0-89587-039-8; included in a nicely integrated way. The Toulouse-
$14.95 cl, 0-89587-038-X. Classroom Success for the Lautrec painting of two women waltzing together is
Learning Disabled by Suzanne Stevens, $8.95 pb, reproduced with a non-judgmental text discussing the
0-89587-035-5; $15.95 cl, 0-89587-036-3. Step Care- presence of lesbians in the Paris night spots. Harmony
fully in Night Grass for which Susan Ludvigson, Books (Crown), $36 cl, 0-517-57335-0.
writing under the name Susan Bartels, won the 1974 What a pleasant surprise to get the new Daedalus
N.C. Poetry Council Award, $5.95 cl, 0-910244-76-6. catalog and find that a book which I had reviewed
| f isa v nor oa wb l y a v al ia ls at b l eis s fu oe r ( b au t r e c aso om np abla li en e ad m oab uo nu tt . Kth ate h eprice)
Kollwitz, Works in Color, ed. and intro by Tom Fecht
contains many works not elsewhere reproduced, in-
cluding some erotic images. Daedalus Books, 4601
Decatur St, Hyattsville, MD 20781 (1-800-333-5489)
$19.98 cl. (was $49.95), 50% discount, ordering #00465.
The same catalog lists the three volume autobio-
graphical set by Margaret Anderson, My Thirty Years
War, The Fiery Fountains and The Strange Necessity.
Anderson founded the pioneering literary magazine
The Little Review in 1914. She co-edited it with her
lover, Jane Heap, until the early 1920's when she left
the magazine to Jane and became involved with Geor-
gette Leblanc (vol. 2). After Georgette’s death there
was her life with Dorothy Caruso (vol. 3). Anderson
was an early publisher of Gertrude Stein, T. $S. Eliot,
Frost, Pound and Djuna Barnes and the first to publish
James Joyce in the U.S. for which the magazine was
confiscated for obscenity. This is an incredible buy. I
encourage bookstores to buy an additional set for
your lending library. Daedalus, $6.95 for the whole set
(was $27) pb, 50% discount, ordering #00648.
Other exceptional bargains from Daedalus are
Jane Freilicher: Paintings $14.95, #90523; Francoise
Gilot: An Artisť’s Journey $9.95, #90986; Portraits,
Inge Morath, $6.98, #00164; and a new book by the
Berthe Morisot by Anne Higonnet is a biography exceptionally fine British portrait photographer Jane
of one of the few women (1841-1895) prominent Bown, Men of Consequence, $5.95, #00539.
among the Impressionist painters in France. This vol- Edward D. Dudelman, the author of Jessie
ume documents Morisot’s struggle to reconcile her Willcox Smith, A Bibliography, wrote FBN that my
career with the demands of family life. It includes reference to Smith as part of a vibrant and creative
some compelling images made of Morisot by her circle of lesbians was “erroneous and misleading.”
brother-in-law, Edouard Manet and by her sister, In his ten years of research he has found “not even
Edma, who was also a painter, and several self- a hint for such a claim.” I certainly wasn’t trying to
portraits. Ed. Burlingame Books, an imprint of Harper besmirch Smith’s name. My information comes
& Row, $25 c], 0-06-016232-5. from curators in the Philadelphia area who are in
Note: Impressionist Women by Edward Lucie- touch with other researchers. More information is
S wm omith en ,i s m 0 of s t a b bo yu t m w alo em ae rn t i sa tr st i s at ls t h ob uu gt h a b po au int t ii nm ga sg e bs y of oabvlioluysly n eesdued p abpouto trhits iwvhoele g roaupr tof i msuttus-. O
Volume 13 Number 2 73
This content downloaded from
(cid:0)(cid:0)(cid:0)(cid:0)(cid:0)(cid:0)(cid:0)(cid:0)(cid:0)(cid:0)(cid:0)(cid:0)70.126.145.227 on Sat, 19 Mar 2022 17:44:15 UTC(cid:0)(cid:0)(cid:0)(cid:0)(cid:0)(cid:0)(cid:0)(cid:0)(cid:0)(cid:0)(cid:0)(cid:0)(cid:0)
All use subject to https://about.jstor.org/terms","['0-89587-039-8', '0-89587-038-X', '0-89587-035-5', '0-89587-036-3', '0-517-57335-0', '0-910244-76-6', '0-06-016232-5']"
