PageNumber,Text,ISBNs
44,"Feminist Bookstore News
in particular by reading Feminist Bookstore News. “New Bookstore Package.”
They are not receiving this information from ABA. ° The purpose of the “New Bookstore Package” would
° ABA should take more care to send information to be to introduce new (and soon-to-be) booksellers to the
FBN. FBN should be receiving most press releases that services that ABA offers. It would include samples of
ABA sends out. supplies and a small starter-kit whenever possible. The
° ABA should send convention information to non- cost of the “New Bookseller Kit” would be offset by the
member stores as well as member stores. increased number of membership enrollments from new
bookstores and their annual renewals.
Attitude Ideally it would include: The ABA Book Buyers
° Several booksellers commented that ABA (staff) had Handbook; A Manual on Bookselling; 20-30 STOP forms
been downright rude when they called for information. (enough copies to get the bookseller “addicted” to them.
Some attributed this to “New York Attitude,” others to Cost would be offset by re-orders on STOP forms);
ABA's (apparent) unwillingness to even talk to small sample copies of gift certificates; sample bags with price
stores and/or stores in non-major metropolitan areas. lists and complete ordering information; and samples of
e Do ABA staffers who field questions from new all other forms and supplies that ABA has to offer as well
stores need consciousness raising sessions and/or as descriptions of the ABA courses, etc.
sensitivity training? “If a new small store or a specialty The package should also include a list and de-
store isn't worth ABA's time and attention, then, hey, scription of services that ABA offers, the names
it’s not worth my time and money to join,” was a and/or positions of various ABA staff, a list of ABA
commonly expressed attitude. officers and board members, and a list of committees
and how to contact them.
A “Beginning Bookstore Package” ABA should make it easy for potential members
° It was recommended that ABA take the initiative to see how membership would benefit them. Doing so
and approach new bookstores with a comprehensive would increase ABA's membership.
BOOKS C
FROG-IN-TBIS- 3 Gioe SUTCHINSON
HOUSE KBLSEŠQ F15 RES KITCHEN
Io-
5B ATAI
COURAGE Aaii
VRB ARENS AIN
42
This content downloaded from
(cid:0)(cid:0)(cid:0)(cid:0)(cid:0)(cid:0)(cid:0)(cid:0)(cid:0)(cid:0)(cid:0)(cid:0)70.126.145.227 on Sat, 19 Mar 2022 17:44:15 UTC(cid:0)(cid:0)(cid:0)(cid:0)(cid:0)(cid:0)(cid:0)(cid:0)(cid:0)(cid:0)(cid:0)(cid:0)(cid:0)
All use subject to https://about.jstor.org/terms",[]
45,"Feminist Bookstore News
Booksellers present believed that if ABA would How Does ABA Work?
put The Handbook and STOP forms into the hands of ° A number of booksellers — including long time
new booksellers ABA would 1) be doing new and members — commented that they (still) don’t know
small and specialty booksellers an enormous service; how ABA works. Obviously there is a committee sub-
2) would increase the survival rate of new bookstores; structure below the board. But what committees exist?
3) would expand the size and breadth of its member- What do they do? Who does one contact about specific
ship; 4) would be amply compensated for the cost of topics? This information isn’t readily available to the
the Beginning Bookseller Packages and Handbooks by membership and needs to be.
membership renewals from stores that would not
otherwise join ABA. Program And Other Suggestions
It was estimated that only 40-50% of the feminist ° ABA continue the Black and Read exhibit. It is a
bookstores are currently members of ABA and that an powerful addition to the convention.
additional 40% would be inclined to join and maintain ° Minority scholarships to Booksellers school are
membership with these kinds of programs. strongly supported.
° ABA should include, in its convention guidelines for
Introductory Membership Offer exhibitors, a statement that all exhibits, special offers, etc.
° ABA could supplement the above package with an be non-sexist and non-racist. The Columbia University
“Introductory Membership Offer” that would include Press offer that required purchase of 5 copies of a sexist
all the benefits and services of membership and would book for participation in a drawing was cited as partic-
cost no more than half the price of the current mini- ularly offensive. While ABA cannot be held accountable
mum membership. If ABA couldn't see its way clear for the actions of all the exhibitors, guidelines that are
to include The Booksellers Handbook in the Begin- specifically anti-sexist and anti-racist would be helpful.
ning Bookseller Package, it could be offered as part of ° Hold separate workshops/roundtables for spe-
the Introductory Membership Offer at reduced prices. cialty stores and the general bookstores interested in
stocking a feminist section. Mixing the two groups
Materials dilutes the one program at ABA that is (or should be)
° Theminimum order for STOP forms is too high and specificålly oriented to specialty bookstores (“The
too expensive for small stores. Smaller quantities wave of the 90s”) and the focus is (once again) shifted
should be available at comparable rates. _ to general bookstores’ needs. If ABA wants to set up a
° ABA's seasonal marketing campaigns (and posters tutoring session where specialty stores advise general
in American Bookseller) rarely apply to specialty stores. bookstores on stocking their specialty, ABA should go
One bookseller pointed out that, since the seasonal ahead and do that rather than expecting to get a plum
marketing program began, she'd been able to use of a workshop by mixing apples and oranges.
exactly one poster. e A workshop that lumps all stores doing more than
° ABA could be considerably more conscious of the $250,000 and less than $1.5M into one “Mid-Sized
usefulness (or lack thereof) of its materials to their mem- Store” roundtable is not very useful. Stores that do
bership. The T-shirts about dogs and books being $300,000 and stores that do $1M have very different
“man’s” best friend are particularly directed to men issues. Three to five categories would be much more
(“Outside of a dog, a book is a man’s best friend”). In this useful — and probably better attended.
case, “man” is not a generic term that includes women, It was also noted that the “small” and “mid-
whether feminist booksellers or women customers. sized” store roundtables were recorded and tapes
Cute, but no go. No thanks. Having membership money were available — but that the “large-store” roundtable
go to pay for “general” programs that specifically ex- was not taped and was not available to the rest of us....
clude women is not, to understate, well thought of. ° On the topic of roundtables.... Roundtable lunch
boxes should include (more) vegetarian options.
ABA's Board Of Directors Just offering non-red meat isn't enough. Those
° The ABA Board of Directors should include repre- lunch boxes went immediately, leaving the vegetar-
sentation from specialty bookstores. ians high and dry....
43 August 1990
This content downloaded from
(cid:0)(cid:0)(cid:0)(cid:0)(cid:0)(cid:0)(cid:0)(cid:0)(cid:0)(cid:0)(cid:0)(cid:0)70.126.145.227 on Sat, 19 Mar 2022 17:44:15 UTC(cid:0)(cid:0)(cid:0)(cid:0)(cid:0)(cid:0)(cid:0)(cid:0)(cid:0)(cid:0)(cid:0)(cid:0)(cid:0)
All use subject to https://about.jstor.org/terms",[]
46,"Feminist Bookstore News
e The Small Store Task Force should be reconvened. e The American Bookseller has virtually nothing in it
The recommendations of this task force should be about gay, lesbian, and feminist stores. Our issues and
published (in American Bookseller) with a report as to our stores should be in the ABA magazine. ABA and
which recommendations have been implemented, its publications should reflect its membership —
which are in process, and what comes next. which is to say we should also be visible in the maga-
° ABA could create a referral system to set up men- zine and other ABA publications.
tors or “Big Sister/Big Brother” programs for small ° Regular columns for 8 to 10 different specialty store
and specialty bookstores with a similar, successful, areas should be included in each issue of The American
experienced store. Bookseller. These columns could include bestsellers,
° ABA could also take the initiative to refer appro- announcements of new stores, and news and should
priate (new) bookstores to the specialty store orga- be written by someone knowledgeable about each
nizations and publications, i.e., Feminist Bookstore field. Visibility is essential. Two to four pages per issue
News, The New Age Retailer and the new age retailing should be devoted to these reports. The presentation
association, etc. ABA could collect information on could be parallel to the Regional Booksellers Associa-
all the specialty bookstore organizations and publi- tion reports.
cations and distribute it to all the member book-
stores, possibly via an article in The American Booksellers School
Bookseller. ° Booksellers school costs more than many small
e Small bookstores — including many but not all stores can afford.
specialty stores — tend to be staffed by the owners ° ABA might consider creating scholarships for small
and/or the staff is too small for the owner to leave to and specialty stores.
attend ABA committee meetings. If ABA wants to ° A significant part of the cost of Booksellers School
know about the needs of specialty and small stores, is the requirement that attendees stay in the (expen-
ABA staff and directors could go to the stores and ask sive-to-us) hotels where the schools are held. ABA
what our needs are. should explore and implement alternative locations
° One of the mainstream publishers has a program for the schools that don’t require hotel stays. The
that requires all senior staff to work for 2-3 days a year theory may be that holding the schools in hotels saves
in a bookstore. ABA staff and directors could spend an ABA money because the meeting rooms are included
equal amount of time visiting specialty and small without cost when a block of rooms are reserved. But
stores in the own states. This would address ABA's this “saving” is at the expense of the attendees and
question about the differences between specialty and prohibits many booksellers from attending. Our expe-
general independent bookselling... rience is that many convention-oriented hotels offer
° A newsletter written by someone who knows what it is “free” rooms for the day for the price of a group lunch
like would be useful if there isn't room for this infor- — which would be much cheaper. Networking —
mation in American Bookseller. including staying with friends and co-workers in
other towns — is one of the strengths of specialty and
Ideas For The American Bookseller political bookselling. The current structure for hous-
• Reports from committees —especially special task ing ABA Booksellers School makes it impossible for
forces — should be included in The American Book- specialty bookstores to use our networks to make
seller, i.e., the report from the Small Store Task Force getting the skills affordable. This is extremely counter-
would be of interest to the entire membership. productive.
e The American Bookseller could include articles on ° Have a “specialty bookstore track” at Booksellers
how small and specialty stores can get good deals school, also a parallel track for small stores, as the
(or acknowledge when we can’t), on buying equip- Booksellers schools generally address the issues of
ment and fixtures on a small-store/specialty store general bookstores that do (or expect to do) a mini-
budget, on store design on small store/specialty mum of $500,000/ year. Specialty and small stores op-
store budgets, and on space saving ideas for small erate in a different paradigm than the average general
stores. bookstore and special skills are needed.. ©
44
This content downloaded from
(cid:0)(cid:0)(cid:0)(cid:0)(cid:0)(cid:0)(cid:0)(cid:0)(cid:0)(cid:0)(cid:0)(cid:0)70.126.145.227 on Sat, 19 Mar 2022 17:44:15 UTC(cid:0)(cid:0)(cid:0)(cid:0)(cid:0)(cid:0)(cid:0)(cid:0)(cid:0)(cid:0)(cid:0)(cid:0)(cid:0)
All use subject to https://about.jstor.org/terms",[]
47,"Feminist Bookstore News
Audre Lorde
Audre Lorde was chosen to be the recipient for the Lesbian and Gay Publishing does not exist in a
Second Annual Bill Whitehead Award. The Award is given vacuum, however, and we are not one great vat of
by the Publishing Triangle in honor of the late Bill White- homogenized milk. We are Lesbian and Gay in a
head and honors a writer's general contribution to the world growing increasingly hysterical with denial
development and furthering of gay and lesbian writing. The and contradiction — a world where the increasing
award includes a monetary prize and the winner is invited disparity between the haves and the have-nots threat-
to be the Bill Whitehead Lecturer and address the Lambda ens to detonate in each one of our dooryards. Of
Literary Award Banquet on the state of gay and lesbian course, you say, we all recognize the importance of a
publishing.
unabl eL o tr od e a t w tea ns d i n t h eG e ar wm aa rn dy c f ero er m h onea yl .t h S ht er e a st em nte n hts e r a n spd e ew chas One award will not
care of Jewelle Gomez who delivered it in Audre’s absence. counter-balance a continuing
Lorde took The Triangle to task for tokenism, accepted
the recognition but refused the monetary award, charging invisibility of Lesbian and Gay
The Publishing Triangle to use the money to promote the writers of Color.
work of new Lesbian and Gay writers of color in the coming
year, and to report on what has been done at next year's
award ceremony. world view — we know the ozone layer is disappear-
FBN is very pleased to publish Lorde’s speech at the ing, nuclear proliferation is poisoning our planet. But
1990 Lambda Literary Award Banquet. to an increasing percentage of people upon this earth
watching their children starve to death in Lahore and
What is at stake in Lesbian and Gay Publishing the Sahel, lost to drugs in L.A. and N.Y., stomped to
today basically is what has always been at stake — our death in Leipzig and Berlin and Brooklyn because of
survival, our future: for each one of us, and collec- the color of their skin, nuclear holocaust and ecologi-
tively, the question — how do we define ourselves, cal disaster is of little concern. What does Lesbian and
and how do we put who we are behind what we say Gay publishing have to offer them?
we believe. I am a Black Lesbian Feminist Warrior Poet
We are Lesbians and Gay men helping to shape a Mother, stronger for all my identities, and I am indi-
future for ourselves and for those various communi- visible. Out of the insights and power of those identi-
ties of Which we are a part and within which we must ties have come the work which you honor here
define the meanirig of being Lesbian and Gay. For tonight.
without community, whatever we do can be only a The increase in racist, anti-Semitic, heterosexist
temporary armistice between an individual and his or attacks here in North America is being mirrored
her particular situation. throughout Europe by the rise in neo-fascist activity
45
This content downloaded from
(cid:0)(cid:0)(cid:0)(cid:0)(cid:0)(cid:0)(cid:0)(cid:0)(cid:0)(cid:0)(cid:0)(cid:0)70.126.145.227 on Sat, 19 Mar 2022 17:44:15 UTC(cid:0)(cid:0)(cid:0)(cid:0)(cid:0)(cid:0)(cid:0)(cid:0)(cid:0)(cid:0)(cid:0)(cid:0)(cid:0)
All use subject to https://about.jstor.org/terms",[]
48,"Feminist Bookstore News
against Afro-europeans, Jews, homosexuals, and for- Kitchen Table: Women of Color Press was started,
eign workers. and is maintained, by Lesbians of Color. It is a first in
the annals of Lesbian and Gay publishing, and now
approaching our tenth year. Whereare we represented
If this group wishes to at this gathering?
truly honor my work... One award will not counter-balance a continuing
invisibility of Lesbian and Gay writers of Color.
then I charge you...to include I believe the Bill Whitehead Memorial Award is
and further expose the work being given to me in good faith. Therefore, I accept the
recognition which comes with this award, but I will
of new Lesbian and Gay not accept any money from the Triangle. If this group
writers of Color. wishes to truly honor my work, built upon the creative
use of differences for all our survivals, then I charge
you, as a group, in some way to include and further
There are Lesbian and Gay writers of Color in this expose the work of new Lesbian and Gay writers of
country articulating in their work questions and posi- Color within the coming year, and to report on what
tions which must be heard if we are to survive into the has been done at next year’s award ceremony.
21st century. How many of these Lesbian and Gay That will be a truly bold and meaningful gesture,
writers of Color are included in the Triangle Group, and one reflective of the growing vision and power of
supported or encouraged by its individual members? Lesbian and Gay Publishing in the 1990’s. o
There are Lesbian and Gay writers of Color across
Europe chronicling what the current political changes Progetto Mappa, continued from page 24
on that contingent can mean for people of Color, that way women’s ideas will circulate freely and autono-
is, for the majority of people upon this earth. How mously. Women’s bookshops have always performed
many of these writers are known to you? How do you this function but there aren't many women’s book-
use your power when their manuscripts come across shops in Italy, especially in the south.
your desk, the modest announcements of their books “The Guide” has shown that the relationship be-
appear in your mail? tween the women’s movement and the bookshops can
What is at stake in Lesbian and Gay publishing in work to their mutual advantage. This happened, for
1990, quite simply, is: how will you define yourselves example, in Brescia, where the women’s university
in the twenty-first century in a world where seven- “Simone de Beauvoir” was founded in 1987. The
eighths of that world’s population are people of Rinascita bookstore offered ample space to women’s
Color? And how will you use the power that definition works and increased their sales. This is not an isolated
engenders? case. The bookshops preferred by women can also
I recognize the honor you do me with this award. sustain all small publishers whose works are not re-
But honors are most meaningful when they include viewed by the mainstream press. In these bookshops
peer decisions. How many Lesbians and Gay men of the women’s publications are displayed clearly and
Color are included in your group? How many were separately.
polled for this award? Or even, how many writers of What we expect to gain politically from this work
Color have you published, or encouraged, or helped is that women’s system of thought will circulate better
to give voice in any way? At the National Lesbian and among us, becoming freer and richer.
Gay March on Washington DC, the largest gathering For further information write to Cristiana Fischer,
of Lesbians and Gay men to date, the one book exhibit Libreria delle donne, v. Dogana2, 1-20123 Milano,
at the March ignored the works of gay people of Color. Italy. Tel: 02-874213. O
Lesbian and Gay writers of Color, our work and our
concerns, are consistently invisible within the publish- TI HINH II
ing and literary newsletters circulating in the Lesbian
and Gay communities.
August 1990 46
This content downloaded from
(cid:0)(cid:0)(cid:0)(cid:0)(cid:0)(cid:0)(cid:0)(cid:0)(cid:0)(cid:0)(cid:0)(cid:0)70.126.145.227 on Sat, 19 Mar 2022 17:44:15 UTC(cid:0)(cid:0)(cid:0)(cid:0)(cid:0)(cid:0)(cid:0)(cid:0)(cid:0)(cid:0)(cid:0)(cid:0)(cid:0)
All use subject to https://about.jstor.org/terms",[]
49,"Feminist Bookstore News
Fortnight ‘90
nationwide Feminist Book Fortnight ‘90 events pro-
gramme, can be ordered from the address below.
And leading the promotion, as always, were our
“Selected Twenty” titles chosen by a distinguished
panel of experienced booksellers. These highly expe-
rienced judges are asked to compile a list of twenty
titles which reflect and celebrate the strengths and
concerns of women writers, during the past twelve
months. These books are not considered “the best”
feminist books published; but rather a platform cele-
bration of the many excellent books written and pro-
duced by women during the past year. These titles
LONDON: This major annual promotion of re- feature on all our display material and on the centre
cently published good books by women took place in pages of the Feminist Book Fortnight ‘90 catalogue of
June. This important focus on women’s writing, and title; relied upon widely by bookshop Buyers and
publishing, is generally considered to be one of the Librarians everywhere as the guide to good books by
UK's most popular book trade promotions with book- women published during the past twelve months.
shops and public libraries everywhere mounting spe-
cial displays and hosting author visits. Launched in These books are not considered
this country following the overwhelming success of
the First International Feminist Book Fair staged in “the best” feminist books published;
London in 1984 the promotion this year immediately but rather a platform celebration
p inr e c Be ad re cd e l ot nh ae , I SV p a iI nn t e fr rn oa mti o n 17al t h F e -m i 2n 3i rs dt JBo uo nk e . Fair held of the many excellent books
Feminist Book Fortnight always attracts a great written and produced by women
deal of attention, both from the media and the reading
public. Several well-known and important women writ- during the past year.
ers — including well known Canadian writers Joan
Barfoot and Ely Danica — came to the UK specifically to The “Selected Twenty” judges for Feminist Book
take partin Feminist Book Fortnight. Running alongside Fortnight 1990 are: Anna Barfield, experienced book-
the trade promotion was be as usual a nationwide pro- seller, buyer for the Women’s Section at Compendium
gramme of eventsincluding author readings, talks, sign- Bookshop; Tracey Kivland, bookseller with extensive
ing sessions and writing workshops. Last year this retail experience, manager of Waterstones Bookshop
involved 52 events in 32 towns throughout the country. for past four years; Lorraine Griffiths, journalist and
These events are all organised locally and the official writer of short stories and poetry, previous editor of
August 1990
This content downloaded from
(cid:0)(cid:0)(cid:0)(cid:0)(cid:0)(cid:0)(cid:0)(cid:0)(cid:0)(cid:0)(cid:0)(cid:0)70.126.145.227 on Sat, 19 Mar 2022 17:44:15 UTC(cid:0)(cid:0)(cid:0)(cid:0)(cid:0)(cid:0)(cid:0)(cid:0)(cid:0)(cid:0)(cid:0)(cid:0)(cid:0)
All use subject to https://about.jstor.org/terms",[]
