ISBN,Title,Author,Publisher,Pages,Date Published,Subjects,Binding,Synopsis,Language,Edition,Dimensions,MSRP,Image,Status,PageNumber,Volume & Issue
0-8135-2755-4,Overcoming All Obstacles: The Women of the Academie Julian,"Becker, Jane",Rutgers University Press,146,10/1/1999,"Alumni and alumnaeAcadémie Julian, Art, Modern, Art, Modern--19th century--Exhibitions, Art, Modern--20th century--Exhibitions, Women artists, Women artists--Exhibitions, N6447 .O84 1999, 704/.042/0944361",Hardcover,"<p><i>Overcoming All Obstacles: The Women of the Académie Julian</i> is the first book to examine late nineteenth-century Paris's most famous training ground for the leading women artists of the period. The Académie Julian was founded in Paris in 1868, initially to prepare students for entry to the Ecole des Beaux-Arts, the nineteenth-century's preeminent art school. Because women could not study at the Ecole des Beaux-Arts until 1897, Julian itself became an international equivalent for many of the late nineteenth- and early twentieth-century's most important women artists.</p>
<p>Not only does <i>Overcoming All Obstacles</i> introduce the reader to many works by women artists-both famous and lesser known-but the essays offer a cultural and historical context in which to appreciate their art. Gabriel Weisberg's essay concentrates on the rigorous training methods enforced by Rodolphe Julian and the teachers at the Academy. Jane Becker explores the competitive environment of the Julian Academy as it affected the Ukrainian painter Marie Bashkirtseff and the Swiss painter Louise-Catherine Breslau. Essays by Catherine Fehrer, the leading scholar of the Académie Julian, and Tamar Garb, an art historian who focuses on the training of women artists, give us a richer understanding of the Académie Julian's place in the sphere of art education in late nineteenth-century Paris.</p>
<p>Generously illustrated with both color and black-and-white images, this volume includes documentary photographs and caricatures that have never before been reproduced. The core of the book draws on the large collection of the Académie Julian Del Debbio, the Académie Julian's successor institution in Paris. This publication accompanied an exhibition organized by the Dahesh Museum in New York that opened after its exhibition at the Sterling and Francine Clark Art Institute in Williamstown.&nbsp; The exhibition subsequently continued to the Dixon Gallery and Gardens, Memphis.</p>",en,First Edition,"Height: 10.75 Inches, Length: 8.5 Inches, Weight: 1.9 Pounds, Width: 0.75 Inches",65,https://images.isbndb.com/covers/75/50/9780813527550.jpg,Success,109,22.6
1-85973-386-7,"Contraception across Cultures: Technologies, Choices, Constraints (Cross-Cultural Perspectives on Women)",,Routledge,266,4/1/2000,"Cross-cultural studies, Contraception",Paperback,"Contraception Is An Issue Of Considerable Concern To A Great Many Heterosexually Active People. Yet The Impact Of Contraceptive Technologies In The World Today, In Particular Their Implications For Kinship, Gender Relations, And Other Aspects Of Social Life, Receives Relatively Little Scholarly Attention.this Book Brings A New Perspective To The Study Of Contraception, By Collecting Together In One Volume Leading Experts In The Fields Of Contraception, Family Planning And Reproductive Health. Contributors Look At The Social, Economic, Political And Cultural Contexts In Which Contraceptive Providers And Recipients Make Decisions About Whether And What Forms Of Contraception To Use. User Perspectives (whether Those Of Recipients Or Providers Of Contraceptive Services) Are Taken Seriously, As Are The Perspectives Of Policy-makers And Development Experts. With Its In-depth, Case-study Approach, This Challenging Book Will Appeal To Practitioners And Planners In The Fields Of Family Planning And Reproductive Health, As Well As To Students And Academics Of Applied And Medical Anthropology, Health Studies, Gender And Development Studies, Or Anyone Interested In The Social, Cultural And Ethical Issues Raised By Contraceptive Technologies.",en,1,"Height: 8.50392 Inches, Length: 5.43306 Inches, Weight: 0.9259415004 Pounds, Width: 0.6 Inches",0.37,https://images.isbndb.com/covers/38/68/9781859733868.jpg,Success,49,22.6
0-684-85681-6,A Twist at the End : A Novel of O. Henry,"Saylor, Steven",Simon & Schuster,464,4/5/2000,"Henry, O , 1862-1910, Authors, American, Authors, American--Fiction, Serial murders, Serial murders--Fiction, Authors, Authors--Fiction, PS3569.A96 T85 2000, 813/.54",Hardcover,"A Crime Tale Based On Actual Events From More Than One Hundred Years Ago Follows A Serial Killer Dubbed The Servant Girl Annihilator Who Roamed The Streets Of Austin, Texas. Prologue: Goddess Of Liberty: New York City, 1906 -- Pt. 1. Bloody Work! Austin: December 1884 To January 1885 -- The Journey Back: New York City To Texas, 1906 -- Pt. 2. Among The Business: Austin And Liendo: January To May 1885 -- The Journey Back: New York City To Texas, 1906 -- Pt. 3. Bloodhounds Unleashed: Austin: May To December 1885 -- The Journey Back: New York City To Texas, 1906 -- Pt. 4. To Be Alive, What Is It?: Austin: December 1885 And After -- The Journey Back: Austin -- Formosa -- The View From Mount Bonnell, 1906. Epilogue: Diana Of The Hunt: New York City, 1906. Steven Saylor. Includes Bibliographical References (p. [459]-462).",en,First Edition,"Height: 9.75 Inches, Length: 6.75 Inches, Weight: 1.65 Pounds, Width: 1.25 Inches",25,https://images.isbndb.com/covers/68/10/9780684856810.jpg,Success,69,22.6
0-688-17137-0,My Baseball Book,"Gibbons, Gail",HarperCollins,24,3/1/2000,Baseball,Hardcover,"<p>Baseball is fun - let's play!</p>
<p>Find all the basics in this lively guide.</p>
<ul>
<li>The markings on a baseball diamond</li>
<li>What baseball players wear</li>
<li>The positions, from catcher to left fielder</li>
<li>The excitement of the pitch</li>
<li>The thrill of hitting a home run</li>
</ul>
<p>All these and more are included, with a useful glossary at the end.</p>


                        <p>An introduction to baseball, describing the equipment, playing field, rules, players, and process of the game.
</p>",en,Illustrated,"Height: 7 Inches, Length: 6.5 Inches, Weight: 0.34 Pounds, Width: 0.25 Inches",7.99,https://images.isbndb.com/covers/13/77/9780688171377.jpg,Success,125,22.6
1-853-02711-1,Eating an Artichoke: A Mother's Perspective on Asperger Syndrome,"Fling, Echo R.",Jessica Kingsley,208,2/1/2000,,Paperback,"During a routine parent--teacher conference in November 1991, Echo Fling was told by her son's teacher that his behaviour in class was 'not normal'. After two years at the pre-school, five-year-old Jimmy had failed to make any friends, had recently started to act aggressively towards his classmates, and was beginning to react violently to any changes in his routine. Echo was not taken completely by surprise: she had suspected for some time that her son was different from other children. Over the next five years, she and her husband accompanied Jimmy to doctors, medical specialists, learning consultants and psychologists. Finally, at the age of ten, Jimmy was diagnosed with Asperger Syndrome. This is the book that Echo Fling needed when she first set out to have Jimmy diagnosed, and it will enable parents and teachers to understand and help other children with Asperger Syndrome.

                        <p>The book contains no figures.
</p>",en,1,"Height: 9.25 Inches, Length: 6 Inches, Weight: 0.67020527648 Pounds, Width: 0.47 Inches",24.95,https://images.isbndb.com/covers/71/16/9781853027116.jpg,Success,135,22.6
0-609-60612-3,Great Dames: What I Learned from Older Women,"Brenner, Marie",Crown,256,3/7/2000,"Women, Women--United States--Biography, Women in public life, Women in public life--United States--Biography, Women--Conduct of life, Women--Conduct of life--Case studies, HQ1412 .B734 2000, 305.4/092/273 B",Hardcover,By Marie Brenner.,en,"First Edition, 3rd Printing","Height: 9.75 Inches, Length: 7 Inches, Weight: 1.1 Pounds, Width: 1 Inches",0,https://images.isbndb.com/covers/61/24/9780609606124.jpg,Success,131,22.6
1-55583-479-5,Fabulous Hell: A Novel,"Curtis, Craig",Alyson Books,256,4/1/2000,,Paperback,,en,First Edition,"Height: 8.5 Inches, Length: 5.75 Inches, Weight: 0.47840310854 Pounds, Width: 0.25 Inches",12.95,https://images.isbndb.com/covers/47/91/9781555834791.jpg,Success,69,22.6
1-55583-480-9,"Out & About Campus: Personal Accounts by Lesbian, Gay, Bisexual & Transgender College Students",,Alyson Books,320,4/1/2000,"Gay college students, Gay college students--United States--Biography, Lesbian college students, Lesbian college students--United States--Biography, Bisexual college students, Bisexual college students--United States--Biography, Transsexualism, Transsexualism--United States--Case studies, Homosexuality and education, Homosexuality and education--United States--Case studies, LC2574.6 .O87 2000, 378.1/9826/64",Paperback,"A young man prevails as the first student to create a gay and lesbian studies major at the University of Wisconsin. A self-described ""queer woman of color"" helps to form gay Chicano/a solidarity at Stanford. A basketball player battles homophobia on the Harvey Mudd women’s team. A brave man attends the University of Texas in drag. Students in North Carolina, California, Utah, and North Dakota reconcile their sexuality with their religious beliefs, often in the face of derision and interrogation. 
<p>In spite of tremendous progress over the past 20 years, including the development of LGBT clubs and queer studies curricula, many college students feel so isolated that they are afraid to speak out. In this extraordinary collection--the first of its kind--28 lesbian. gay, bisexual, and transgendered students describe not only how they survived college, but also how they fought, endured, and changed it.</p>
<p>Through the richness of the voices of students, this collection offers poignant and powerful glimpses into the lives of LGBT people on campus. In each story, a young person’s identity crystallizes when the search for self in the eyes of others leads to the discovery of it in his or her own heart.” --Ronni L. Sanlo, editor of Working With Lesbian, Gay, Bisexual, and Transgender College Students</p>",en,1,"Height: 9.25 Inches, Length: 6.25 Inches, Weight: 0.76500404914 Pounds, Width: 0.75 Inches",13.95,https://images.isbndb.com/covers/48/07/9781555834807.jpg,Success,67,22.6
1-55583-480-9,"Out & About Campus: Personal Accounts by Lesbian, Gay, Bisexual & Transgender College Students",,Alyson Books,320,4/1/2000,"Gay college students, Gay college students--United States--Biography, Lesbian college students, Lesbian college students--United States--Biography, Bisexual college students, Bisexual college students--United States--Biography, Transsexualism, Transsexualism--United States--Case studies, Homosexuality and education, Homosexuality and education--United States--Case studies, LC2574.6 .O87 2000, 378.1/9826/64",Paperback,"A young man prevails as the first student to create a gay and lesbian studies major at the University of Wisconsin. A self-described ""queer woman of color"" helps to form gay Chicano/a solidarity at Stanford. A basketball player battles homophobia on the Harvey Mudd women’s team. A brave man attends the University of Texas in drag. Students in North Carolina, California, Utah, and North Dakota reconcile their sexuality with their religious beliefs, often in the face of derision and interrogation. 
<p>In spite of tremendous progress over the past 20 years, including the development of LGBT clubs and queer studies curricula, many college students feel so isolated that they are afraid to speak out. In this extraordinary collection--the first of its kind--28 lesbian. gay, bisexual, and transgendered students describe not only how they survived college, but also how they fought, endured, and changed it.</p>
<p>Through the richness of the voices of students, this collection offers poignant and powerful glimpses into the lives of LGBT people on campus. In each story, a young person’s identity crystallizes when the search for self in the eyes of others leads to the discovery of it in his or her own heart.” --Ronni L. Sanlo, editor of Working With Lesbian, Gay, Bisexual, and Transgender College Students</p>",en,1,"Height: 9.25 Inches, Length: 6.25 Inches, Weight: 0.76500404914 Pounds, Width: 0.75 Inches",13.95,https://images.isbndb.com/covers/48/07/9781555834807.jpg,Success,99,22.6
0-380-81192-8,Out of the Shadows,"Hines, Sue",HarperTeen,160,1/5/2000,,Paperback,,en,,"Height: 7 Inches, Length: 5 Inches, Weight: 0.2 Pounds, Width: 0.5 Inches",6.99,https://images.isbndb.com/covers/19/22/9780380811922.jpg,Success,120,22.6
0-8018-6408-9,The Only Menopause Guide You'll Need,"Moore MD, Michele",The Johns Hopkins University Press,166,5/15/2000,,Paperback,"Offers A Variety Of Ways To Make Informed Decisions About The Treatment And Symptoms Of All Phases Of Menopause By Drawing Upon Traditional, Alternative, And Holistic Medical Practices. Chapter 1 Symptoms You May Have Now: Perimenopause, Menopause, And Postmenopause 1 -- Chapter 2 Health Concerns Now: Cardiovascular Disease, Osteoporosis, And Endometrial And Breast Cancer 17 -- Chapter 3 Overview Of Therapies: Allopathic, Complementary, Herbal, And Homeopathic 36 -- Chapter 4 Therapeutic Approaches In Perimenopause 58 -- Chapter 5 Therapeutic Approaches In Menopause 87 -- Chapter 6 Therapeutic Approaches In Postmenopause 95 -- Chapter 7 Estriol: The Forgotten Estrogen 105 -- Chapter 8 Hormone Replacement Therapy: A Multitude Of Choices 114 -- Conclusion: Vision And Responsibility 126 -- Appendix 1 Diets For Improved Health And Fitness 129 -- Appendix 2 Patient's Record Of Symptoms, Diagnostic Tests, And Therapies 133. Michele Moore. Includes Bibliographical References And Index.",en,1,"Height: 8.4 Inches, Length: 5.5 Inches, Weight: 0.440924524 Pounds, Width: 0.5 Inches",14.95,https://images.isbndb.com/covers/40/87/9780801864087.jpg,Success,112,22.6
0-14-029084-2,Mother,"Olausen, Judy",Penguin USA (P),96,2000-03,,Paperback,,en,First Edition,"Height: 0.1 Inches, Length: 0.1 Inches, Width: 0.1 Inches",15.95,https://images.isbndb.com/covers/08/44/9780140290844.jpg,Success,127,22.6
1-880913-46-1,Raising Up Queens: Loving Our Daughters Loud and Strong,"Davis-Thompson, Esther",Publishing/Editing Network,160,4/1/2000,"Mothers and daughters, Mothers and daughters--United States, African American mothers--Psychology, African American girls--Psychology, African American mothers--Prayers and devotions--English, Child rearing--Religious aspects, African American women--Psychology, HQ755.85 .D39 2000, 306.874/3",Paperback,By Esther Davis-thompson.,en,Illustrated.,"Height: 8.75 Inches, Length: 5.75 Inches, Weight: 0.5 Pounds, Width: 0.5 Inches",12,https://images.isbndb.com/covers/34/68/9781880913468.jpg,Success,58,22.6
0-684-85690-5,She Captains: Heroines and Hellions of the Sea,"Druett, Joan",Simon & Schuster,304,3/7/2000,"Naval history, Women ship captains, Women ship captains--Biography, D27 .D78 2000, 387.5/4044/082",Hardcover,"Tells Us What Life Was Like For The Women Who Dared To Captain Ships Of Their Own, Don Pirates' Garb, And Perform Heroic And Hellacious Deeds On The High Seas. We Meet Irish Raider Grace Grania O'malley And Female Pirates Anne Bonny, Mary Read, Lovelorn Susan, Ann Jane Thornton, Grace Darling And Scotswoman Betsey Miller. -- Jacket. The Warrior-queens -- The Valkyria -- Mistress Cowtie And The Pirates -- Pirate Queens -- Captured By Corsairs -- The Widows -- Bonny And Read -- The Naked Truth -- Ship's Business -- Fatal Shores -- Fatal Impact -- The Deceit Of Dress -- Decently Skirted -- War Bride -- Women Of War -- Nelson's Women -- Voyages Of Discovery -- To The Rescue! -- Northwest Passage -- Ice Queens -- A Woman At The Helm. Joan Druett. Includes Bibliographical References (p. 273-289) And Index.",en,,"Height: 10 Inches, Length: 7 Inches, Weight: 1.3 Pounds, Width: 1.25 Inches",0,https://images.isbndb.com/covers/69/02/9780684856902.jpg,Success,137,22.6
0-345-42261-9,Work Smarts for Women: The Essential Sex Discrimination Survival Guide,"Paniccia, Patti",Ballantine Books,464,1/4/2000,,Paperback,How To : Identify Sex Discrimination -- Lodge A Formal Complaint --fight Back If You've Been Fired -- Conduct Yourself During A Dispute -- Interview An Attorney ...--cover. Pt. 1. Evaluating Your Job. 1. Why Things Are The Way They Are: A Look Backward. 2. Looking For A Job. 3. You're Hired -- Pt. 2. In The Workplace Day To Day. 4. Sexual Harassment. 5. Receiving Less Pay And Fewer Benefits. 6. Less Desirable Assignments And Fewer Promotions. 7. Mommydom. 8. Sweet Young Things 9. You're Not In The Club: Where The Boys Bond. 10. Just Who Is Doing The Discriminating? 11. Invading Your Workplace Privacy -- Pt. 3. Encountering Criticism And Discipline. 12. Performance Reviews. 13. Lodging A Complaint With Your Employer. 14. You're Fired -- Pt. 4. Taking Action. 15. Civil Rights Laws. 16. Complaining To The Eeoc. 17. Understanding The Lawyers. 18. If All Else Fails ... See You In Court. Patti Paniccia. Includes Bibliographical References And Index.,en,1,"Height: 8.5 Inches, Length: 5.75 Inches, Weight: 0.925 Pounds, Width: 1 Inches",14,https://images.isbndb.com/covers/26/13/9780345422613.jpg,Success,122,22.6
0-520-21716-0,"Venus on Wheels: Two Decades of Dialogue on Disability, Biography, and Being Female in America","Frank, Gelya",University of California Press,299,5/30/2000,"Women With Disabilities, Social Conditions, People With Disabilities, Psychology, Sociology Of Disability, Discrimination Against People With Disabilities",Paperback,,en,First Edition,"Height: 9 Inches, Length: 6 Inches, Weight: 1.10010668738 Pounds, Width: 0.8 Inches",31.95,https://images.isbndb.com/covers/71/64/9780520217164.jpg,Success,115,22.6
0-449-91260-4,The First Sex: The Natural Talents of Women and How they are Changing the World,"Fisher, Helen",Ballantine Books,400,2/1/2000,,Paperback,"<p>anthropologist Helen Fisher Provides A Slew Of Scientific Evidence To Argue That Women Are Poised To Infiltrate And Influence All Facets Of Global Society And Become The First Sex. Before You Dismiss This As A Rehashing Of PassÃ© Feminist Ideals, Check Out The Barnesandnoble.com Interview With Fisher, During Which She Discusses How The Female Brain Will Change Work And Family Life In The 21st Century And Beyond.</p> <h3>library Journal</h3> <p>anthropologist Fisher Reviews The Literature On The Biological Differences Between The Sexes And Concludes That The Genetically Based Tendencies Of Women To Think In Webs Of Interrelated Factors, To Operate Best In Nonhierarchical Groups, And To Prefer Long-term Committed Relationships Will Give Them The Edge In Most Areas Of Endeavor In The Future. While Social Scientists Do Seem To Be Reaching A Consensus That There Are Hormonally Driven Differences In The Brain Functioning Of Males And Females, This Book Fails To Warn That We Don't Know How Big These Differences Are Or How Much Variation Exists Between Same-sex Individuals And That We Therefore Have No Basis For Judging Whether These Gender Differences Are Really Important. Nevertheless, Major Trends In Current Social Sciences Research Are Covered, So This Title Is Recommended For Academic And Public Libraries That Haven't Picked Up The Fifth Edition Of Ashley Montagu's The Natural Superiority Of Women (altamira, 1998), Which Covers The Same Material. [previewed In Prepub Alert, Lj 1/99.]--mary Ann Hughes, Neill P.l., Pullman, Wa Copyright 1999 Cahners Business Information.</p>",en,1,"Height: 8.5 Inches, Length: 5.75 Inches, Weight: 0.7 Pounds, Width: 1 Inches",0,https://images.isbndb.com/covers/26/07/9780449912607.jpg,Success,121,22.6
0-7914-4424-4,"Quiet As It's Kept: Shame, Trauma, and Race in the Novels of Toni Morrison (Suny Series in Psychoanalysis and Culture)","Bouson, J. Brooks",State University of New York Press,288,12/2/1999,,Paperback,"Quiet As It's Kept draws on and extends recent psychoanalytic and psychiatric work of shame and trauma theorists to offer an in-depth analysis of Morrison's representation of painful and shameful race matters in her fiction. Providing a frank and sustained look at the troubling, if not distressing, aspects of Morrison's fiction that other critics have studiously avoided or minimized in their commentaries, this book challenges established views of Morrison, showing her to be an author who forces readers into uncomfortable confrontations with matters of race. In Quiet As It's Kept, J. Brooks Bouson explores these issues in Morrison's works The Bluest Eye, Sula, Song of Solomon, Tar Baby, Beloved, Jazz, and Paradise.",en,,"Height: 9.02 Inches, Length: 5.98 Inches, Weight: 0.89948602896 Pounds, Width: 0.65 Inches",33.95,https://images.isbndb.com/covers/42/45/9780791444245.jpg,Success,114,22.6
0-231-11137-1,Let's Get This Straight,"Mallon, Gerald",Columbia University Press,224,3/15/2000,"Social work with gay youth, Social work with lesbian youth, Gay youth--Services for, Lesbian youth--Services for, HV1426 .M35 1999, HV1426 .M35 2000, 362.7/086/640973",Paperback,"<p>The first book to approach child welfare from a gay- and lesbian-affirming perspective, <i>Let's Get This Straight</i> uncovers and challenges the pervasive presence of ""heterocentrism"" within the social work profession. It draws upon case examples and in-depth interviews to illustrate the degree to which myths and stereotypes about gay and lesbian youth detrimentally affect those most in need of assistance.</p>
<p>Gerald P. Mallon uses an ecological perspective to highlight the five areas of child welfare:</p>
<p>(1) family support / preservation;</p>
<p>(2) protection from abuse and neglect;</p>
<p>(3) adoption services;</p>
<p>(4) out-of-home care services; and</p>
<p>(5) the development of foster and adoptive homes.</p>
<p>He discusses the implications of this ecological perspective for service delivery, the impact of laws and legislation, and the role gay and lesbian professionals can play in these areas to provide unbiased care to lesbian, gay, and bisexual clients.</p>
<p> Columbia University Press</p>",en,1999,"Height: 9 Inches, Length: 6 Inches, Weight: 0.66 Pounds, Width: 0.48 Inches",35,https://images.isbndb.com/covers/13/79/9780231111379.jpg,Success,110,22.6
1-875559-79-5,Help!: I'm Living with a (Man) Boy,"McLellan, Betty",Spinifex Press,260,10/28/2006,,Paperback,,en,2nd,"Height: 8 Inches, Length: 5 Inches, Weight: 0.4299014109 Pounds, Width: 0.65 Inches",13.95,https://images.isbndb.com/covers/97/94/9781875559794.jpg,Success,43,22.6
1-875559-79-5,Help!: I'm Living with a (Man) Boy,"McLellan, Betty",Spinifex Press,260,10/28/2006,,Paperback,,en,2nd,"Height: 8 Inches, Length: 5 Inches, Weight: 0.4299014109 Pounds, Width: 0.65 Inches",13.95,https://images.isbndb.com/covers/97/94/9781875559794.jpg,Success,90,22.6
0-380-97430-4,Connecting: The Enduring Power of Female Friendship,"Sheehy, Sandy",William Morrow,416,7/25/2000,"Female friendship, Women--Psychology, BF575.F66 S56 2000",Hardcover,"Drawing On Recent Psychological Research And Her Own Firsthand Interviews With More Than 200 Girls And Women From All Walks Of Life, Journalist Sandy Sheehy Takes An Engaging And Insightful Look At These Questions And More. She Probes The Nature And History Of Female Friendships, Pinpoints The Major Types, And Shows How They Function During The Four Main Stages Of Women's Lives And How They Insure Our Healthy Development. This Book Reads Like An Intimate And Informative Conversation With A Close Girlfriend. It Will Validate And Reassure Women About Their Friendships As Never Before. The Menaing Of Female Friendship -- The Six Seasons Of Female Friendship -- Keeping Friends -- Email Is Female, And Other Thoughts On The Future Of Female Friendship. Sandy Sheehy. Includes Bibliographical References (p. 341-378) And Index.",en,First Edition,"Height: 9.5 Inches, Length: 6.5 Inches, Weight: 1.6 Pounds, Width: 1.5 Inches",25,https://images.isbndb.com/covers/43/06/9780380974306.jpg,Success,120,22.6
0-8070-6224-3,Adultery,"Desalvo, Louise",Beacon Pr,165,1999,"Literary Criticism - General & Miscellaneous, Marriage, Marriage - Adultery & Infidelity",Hardcover,"Louise DeSalvo risks all, in the company of Edith Wharton, Virginia Woolf, Henry Miller, and Madam Recamier. By filtering the story of her own husband's affair through other's stories, she revels in the always exciting fantasy and tells from the usually painful reality of adultery. The conclusions she draws, and the balance she finds in her marriage and in others, make ADULTERY a fun, poignant, and compassionate book.",en,First Edition,"Height: 7.25 Inches, Length: 4.75 Inches, Weight: 0.55 Pounds, Width: 1 Inches",1.99,https://images.isbndb.com/covers/22/41/9780807062241.jpg,Success,123,22.6
