ISBN,Title,Author,Publisher,Pages,Date Published,Subjects,Binding,Synopsis,Language,Edition,Dimensions,MSRP,Image,Status,PageNumber,Volume & Issue
1-56718-688-2,"The Manual (Green Witchcraft, Book 3)",Ann Moura,Llewellyn Publications,264,3/8/2000,,Paperback,"<p><p><strong></strong><p>Green Witchcraft is at the core of earth magic, the Witchcraft of the Natural Witch, the Kitchen Witch, and the Cottage Witch. It is herbal, attuned to nature, and the foundation upon which any Craft tradition may be built. <p>In this manual, hereditary Witch Ann Moura presents the Craft as a course of instruction, with eight magical classes that correspond to the eight Sabbats. This companion handbook to <em>Green Witchcraft</em> and <em>Green Witchcraft II</em> can also be used alone as an exploration of the Green path. Cultivate your knowledge of earth magic with the following lessons&#58; <p>&mdash;Introduction to the craft, basic equipment, altars <br>&mdash;Casting a learning circle, meditation, and technique <br>&mdash;Divination with the Celtic Ogham <br>&mdash;Consecration of a statue, divine couples, holy days <br>&mdash;Divinations&#58; crystal ball scrying, black mirror gazing <br>&mdash;Casting and creating spells, herb craft, candle magic <br>&mdash;Green rules of conduct, circle casting <br>&mdash;Stones and crystals, elixir preparations <p>Return to your roots and grow wise the ways of green magic <em>with Green Witchcraft III, The Manual</em>.<p></p>",en,First Edition,"Height: 9 Inches, Length: 6 Inches, Weight: 0.85098433132 Pounds, Width: 0.56 Inches",16.99,https://images.isbndb.com/covers/68/88/9781567186888.jpg,Success,107,22.6
0-15-202614-2,The Great Kapok Tree: A Tale of the Amazon Rain Forest,"Cherry, Lynne",Clarion Books,40,3/13/2000,"Fiction, Ecology, Jungle animals, Conservation of natural resources, Kapok, Rain forests, Spanish language materials, Juvenile fiction, Comprehension Strategies, Inferring, Children's fiction, Rain forests, fiction, Conservation of natural resources, fiction, Ecology, fiction, Jungle animals, fiction, Spanish language, readers, Amazon river, fiction, Trees, fiction",Paperback,"<p>this Inspired Look At What The Kapok Tree Means To The Creatures That Live In It-and What Rain Forests Mean To The World's Ecology--was At The Forefront Of The Ecological Movement Ten Years Ago And Continues To Resonate Profoundly With Children Everywhere.</p><h3>publishers Weekly</h3><p>in This Breathtakingly Beautiful Picture Book, Cherry Combines Illustrations That Reveal A Naturalist's Reverence For Beauty With A Mythlike Story That Explains The Ecological Importance Of Saving The Rain Forests. The Text Is Not A Didactic Treatise, But A Simply Told Story About A Man Who Falls Asleep While Chopping Down A Kapok Tree. The Forest's Inhabitants--snakes, Butterflies, A Jaguar, And Finally A Child--each Whisper In His Ear About The Terrible Consequences Of Living In ``a World Without Trees'' Or Beauty, About The Interconnectedness Of All Living Things. When The Man Awakens And Sees All The Extraordinary Creatures Around Him, He Leaves His Ax And ``walks Out Of The Rain Forest.'' A Map Showing The Earth's Endangered Forests And The Creatures That Dwell Within Ends The Book Which, Like The Rain Forests Themselves, Is ``wondrous And Rare.'' Ages 4-8. (mar.)</p>",en,First Edition,"Height: 11 Inches, Length: 9 Inches, Weight: 0.43651527876 Pounds, Width: 0.12 Inches",7.99,https://images.isbndb.com/covers/61/41/9780152026141.jpg,Success,124,22.6
0-385-49759-8,In the Garden of Our Dreams: Memoirs of Our Marriage,Shirlee Taylor Haizlip,Anchor,332,2/15/2000,"Marriage, Marriage - Biography, African American General Biography",Paperback,"<p><P>Shirlee Taylor Haizlip, bestselling author of <b>The Sweeter the Juice</b>, and her husband, Harold C. Haizlip describe, with unwavering commitment to each other, their families, and their race, what hard work, good luck, and most important, unshakable love can accomplish. <br><br>Told in their alternating voices, <b>In the Garden of Our Dreams</b> is a portrait of their nearly forty-year love affair. Born into a generation reared in segregation, Harold, the Southerner, and Shirlee, the Northerner, strove not only to marry their individual differences in reaching for common happiness, but also joined the larger struggle of their generation to achieve integration and racial equality. In this intimate and moving memoir, the couple reflects on how they defined themselves as African Americans during some of the most important years in America's struggle with issues of race, class, and equality. Uplifting and romantic, <b>In the Garden of Our Dreams</b> gives all couples hope in this time of increasing cynicism about the value of marriage and the effect each individual can have in the larger struggle against society's ills.</p><h3>The New York Times Book Review - Andrea Higbie</h3><p>...[A] richly detailed memoir....Harold writes, We were not free. No black people we knew were.</p>",en,Reprint,"Height: 8 Inches, Length: 5.2 Inches, Weight: 0.69 Pounds, Width: 0.75 Inches",16.1,https://images.isbndb.com/covers/75/96/9780385497596.jpg,Success,130,22.6
0-571-19983-6,Boy Gets Girl: A Play,"Gilman, Rebecca","Farrar, Straus and Giroux",128,5/29/2000,"Women journalists, Women journalists--Drama, Stalking victims, Stalking victims--Drama, PS3557.I456 B6 2000, 812/.54",Paperback,"<p><b>What is a stalker? And what kind of life can a woman lead when she knows she is being followed, obsessively and perhaps dangerously, by one?</b></p>
<p>This is the dilemma facing Theresa Bedell, a reporter in New York, in Rebecca Gilman's tensely fascinating new play. When Theresa goes on an awkward blind date with a friend of a friend, she sees no reason to continue the relationship—but the man, an attractive fellow named Tony, thinks otherwise. While Theresa is at first annoyed yet flattered by his continuing attention, her attitude gradually changes to one of fear and fury when he starts violently to menace her and those around her.</p>
<p>In brilliantly delineating the kind of terror a woman in full control of her life feels when everything around her suddenly seems to be a threat, Gilman probes the dark side of relationships in the 1990s with the rich insight and compelling characterizations that have distinguished her earlier plays and made her one of the most exciting young playwrights working today.</p>",en,First Edition,"Height: 8.5 Inches, Length: 5.5 Inches, Weight: 0.29982867632 Pounds, Width: 0.3 Inches",15,https://images.isbndb.com/covers/98/39/9780571199839.jpg,Success,123,22.6
0-8142-5043-2,TRAVELS WITH THE WOLF: A STORY OF CHRONIC ILLNESS (WOMEN & HEALTH C&S PERSPECTIVE),"GOLDSTEIN, MELISSA ANNE",Ohio State University Press,264,4/1/2000,"Health, Systemic Lupus Erythematosus, Patients",Paperback,,en,1,"Height: 8.99 Inches, Length: 6.18 Inches, Weight: 0.86 Pounds, Width: 0.64 Inches",4.97,https://images.isbndb.com/covers/04/33/9780814250433.jpg,Success,112,22.6
1-56455-745-6,Emotional Genius: How Your Emotions Can Save Your Life,"McLaren, Karla","Sounds True, Incorporated",,6/1/2000,,Audio Cassette,,en,1st,"Height: 9.76 Inches, Length: 9.22 Inches, Weight: 1.2 Pounds, Width: 0.89 Inches",59.95,https://images.isbndb.com/covers/74/52/9781564557452.jpg,Success,138,22.6
0-684-83808-7,Weird Like Us: My Bohemian America,"Powers, Ann",Simon & Schuster,288,2/23/2000,,Hardcover,"<p>There is a feeling of nostalgia that surrounds the idea of bohemia, that place where art and ideas and alternative thinking become the focal point of life. To most, bohemia is gone—erased by the lifestyle of the 1990s and the too many, too fast influences of modern living.</p>
<p>Ann Powers, an acclaimed pop critic for <i>The New York Times</i> and one of today's most notable authorities on alternative culture, claims in this powerful and personal chronicle that bohemia is alive and well in America—nurturing new lifestyles and defining our tastes in art, politics, sexual mores, and all matters cultural. <i>Weird Like Us</i> sets the record straight on alternative America—a new bohemia whose dynamic citizens are re-creating traditional modes of building families, falling in love, having sex, and making careers, reinventing our shared values from the ground up.</p>
<p>So how different are these bohemians? Through stories from her own life and those of her fellow alternative Americans—artists, writers, entrepreneurs, feminists, cyberoutlaws, punk rockers, politicos, and queers—Powers traces the evolution of this world and where it has gone. The observations and attitudes that fill these pages will touch many who long for this lifestyle, and will shock others. No longer confined to coffee shops in North Beach or Greenwich Village, bohemia is thriving from coast to coast.</p>
<p>In this wonderfully written memoir, Ann Powers writes of an alternatie culture that has never before been fully presented—one that takes into account the real politics, real feelings, and genuine creativity of those who transofrmed the dying counterculture of the sixties into a mode of artistic and spiritual survival in the nineties. In doing so, she has written a vibrant, engrossing take on a culture and its people.</p>",en,First Edition,"Height: 10 Inches, Length: 6.5 Inches, Weight: 1.2 Pounds, Width: 1 Inches",23,https://images.isbndb.com/covers/80/83/9780684838083.jpg,Success,137,22.6
0-7453-1131-8,Lesbian Lives: Identity and Auto/Biography in the Twentieth Century,"Hallet, Nicky",Pluto Press,264,11/1/1999,"Lesbians, Lesbians--Biography, Lesbians--Identity, Lesbians--History, Lesbians--History--20th century, Lesbians in literature, Autobiography--Women authors, Lesbians--Biography--History and criticism, Women and literature--History, Women and literature--History--20th century, HQ75.3 .H35 1999, HQ75.3 .H35 2000, 306.76/63",Paperback,How Far Have Representations Of Lesbianism Actually Moved From The Pathology And Deviancy Of The 1920s And 1930s To The Lesbian Chic Of The 1990s? This Study Examines Cultural Representations Of Lesbianism This Century. Historicised Contexts: Lesbianism In The 1920s And 1930s -- Lesbian Lives In The 1920s And 1930s -- Lesbian Auto/biography In The Early Twentieth Century -- Historicised Contexts: 'the Lesbian' And Late Twentieth-century Discourse -- Lesbian Lives In The Later Twentieth Century -- Lesbian Auto/biography In The Later Twentieth Century -- Visual Auto/biography: (self- ) Portraits And Lesbian Iconography Across The Twentieth Century. Nicky Hallett. Includes Bibliographical References (pages 210-233) And Index.,en,,"Height: 8.75 Inches, Length: 5.5 Inches, Weight: 0.89948602896 Pounds, Width: 0.75 Inches",21,https://images.isbndb.com/covers/13/19/9780745311319.jpg,Success,98,22.6
0-688-17141-9,War Boy,"Hillsbery, Kief",William Morrow,336,4/26/2000,Gay & Lesbian Fiction,Hardcover,"<p>Kief Hillsbery's <b>War Boy</b> is a transcendent literary feat. Told from the perspective of a deaf-mut teenager an charged with the feavered intensity of youth, it is a brilliant evocation of the search for family that will forever alter your perception of what it means to connect.</p><p>Fleeing an abusive father, fourteen-year-old Radboy takes to the road with Jonnyboy, and older friend and mentor who has become the only person he believes he can trust. On the bus headed out of town they hook up with Finn and Critter, a couple of speed-freak boyfriends who take a shine to both of them. They also meet Ula, who is mourning the death of her fiance and taking a trip across the United States in his memory. The five become fast allies, united by persoinal loss and by the allure of intimacy only friends in the throes of conflict can understand. When Jonnyboy drops out of sight, Radboy stays behind in San Francisco, where the underground world he has been introduced to inspires his own burgeoning sexual and emotional desires.</p><p>Radboy's freinds rally around him, putting their restless energy to use in a scheme to destroy a company that is ravaging the redwood forests. But their plans, fueled as much by drugs and paranoia as good intentions, go horribly wrong, and the violent events that ensue bring a powerful awakening for Radboy, one that he never set out to experience.</p><p>As hard-edged as it is emotionally authentic, <b>War Boy</b> is pure literary adrenaline-an utterly engrossing reading experience from a major new voice.</p><p>Fleeing an abusive father, fourteen-year-old Radboy takes to the road with Johnnyboy, an older friend and mentor who has become the only person he believes he can trust. On the bus headed out of town they hook up with Finn and Critter, a couple of speed-freak boyfriends who take a shine to both of them. They also meet Ula, who is mourning the death of her fiance and taking a trip across the United States in his memory. The five become fast allies, united by personal loss and by the allure of intimacy only friends in the throes of conflict can understand. When Jonnyboy drops out of sight, Radboy stays behind in San Francisco, where the underground world he has been introduced to inspires his own burgeoning sexual and emotional desires.</p><p>Radboy's friends rally around him, putting their restless energy to use on a scheme to destroy a company that is ravaging the redwood forests. But their plans, fueled as much by drugs and paranoia as good intentions, go horribly wrong, and the violent events that ensue bring a powerful awakening for Radboy, one that he never set out to experience.</p><p>As hard-edged as it is emotionally authentic, <b>WAR BOY</b> is pure literary adrenaline-an utterly engrossing reading experience from a major new voice.Fleeing an abusive father, fourteen-year-old Radboy takes to the road with Johnnyboy, an older friend and mentor who has become the only person he believes he can trust. On the bus headed out of town they hook up with Finn and Critter, a couple of speed-freak boyfriends who take a shine to both of them. They also meet Ula, who is mourning the death of her fiance and taking a trip across the United States in his memory. The five become fast allies, united by personal loss and by the allure of intimacy only friends in the throes of conflict can understand. When Jonnyboy drops out of sight, Radboy stays behind in San Francisco, where the underground world he has been introduced to inspires his own burgeoning sexual and emotional desires.</p><p>Radboy's friends rally around him, putting their restless energy to use on a scheme to destroy a company that is ravaging the redwood forests. But their plans, fueled as much by drugs and paranoia as good intentions, go horribly wrong, and the violent events that ensue bring a powerful awakening for Radboy, one that he never set out to experience.</p><p>As hard-edged as it is emotionally authentic, <b>WAR BOY</b> is pure literary adrenaline-an utterly engrossing reading experience from a major new voice.</p>",en,First Edition,"Height: 9.25 Inches, Length: 6.25 Inches, Weight: 1.35 Pounds, Width: 1.25 Inches",1.99,https://images.isbndb.com/covers/14/14/9780688171414.jpg,Success,69,22.6
0-679-43597-2,The Battle for God,"Armstrong, Karen",Knopf,464,3/7/2000,"Religion, Comparative Religion",Hardcover,"<p>Arguing that fundamentalism is complex and innovative, and yet a failure in religious terms, Armstrong, a commentator and author on religious affairs, examines fundamentalism among American Protestants, Israeli Jews, and Iranian and Egyptian Muslims. She explains how these movements have sprung up in a response to modernism (beginning as early as the 16th century), and suggests that compassion and understanding may help diffuse the conflicts that rage between fundamentalists and the modernity that surrounds them. Annotation c. Book News, Inc., Portland, OR</p> <h3>Harold Kushner</h3> <p>An impressive achievement. Armstrong has mastered a mountain of material, added somebrilliant insights of her own, and made it accessible.</p>",en,1,"Height: 9.75 Inches, Length: 7 Inches, Weight: 1.8 Pounds, Width: 1.5 Inches",35,https://images.isbndb.com/covers/59/76/9780679435976.jpg,Success,131,22.6
1-55583-552-X,Fadeout (A Dave Brandstetter Mystery),"Hansen, Joseph",Alyson Books,192,5/1/2000,"Fiction, Mystery & Detective",Paperback,,en,First Edition,"Height: 8 Inches, Length: 5.25 Inches, Width: 0.5 Inches",11.95,https://images.isbndb.com/covers/55/21/9781555835521.jpg,Success,68,22.6
0-399-14619-9,"Now This: Radio, Television...and the Real World","Muller, Judy",Putnam Adult,210,4/10/2000,,Hardcover,,en,First Edition,"Height: 8.5 Inches, Length: 5.7 Inches, Weight: 0.86 Pounds, Width: 0.8 Inches",23.95,https://images.isbndb.com/covers/61/90/9780399146190.jpg,Success,129,22.6
0-231-11965-8,why_feminism,lynne-segal,Fisicalbook,240,1999,"Feminism & Feminist Theory, Sex Role - General & Miscellaneous",Paperback,"<p>Three decades after the remarkable resurgence of feminism, gender issues have become ubiquitous in public debate. For some, feminism is the favorite scapegoat for multiple social ills; for others, the greatest success story of the closing century. The Janus face of feminism in the media reflects the competing images of women's lives today. Feminists themselves hold sharply opposing views on the success or failures of three decades of women's activism. <i>Why Feminism?</i> looks at the shifts in feminist thinking from the brash emergence of Women's Liberation at the close of the 1960s to the diverse and discordant feminisms of recent decades. Exploring feminism's troubled relations with psychology and psychoanalysis, the rise of new evolutionary theory, the impact of queer theorizing on gender categories, controversies over memory and trauma, and increasing anxieties about men and masculinity, <i>Why Feminism?</i> illustrates the continuing provocation and significance of feminist inquiry, laying out potentialities and pitfalls for the century ahead.</p><p> Columbia University Press</p>",en,0,"Height: 9 Inches, Length: 6 Inches, Weight: 0.95 Pounds, Width: 1 Inches",26,https://images.isbndb.com/covers/96/58/9780231119658.jpg,Success,110,22.6
0-8263-2233-6,The Stolen Blue: A Claire Reynier Mystery,"Van Gieson, Judith",University of New Mexico Press,208,2/1/2000,"Rare books--Collectors and collecting, Rare books--Collectors and collecting--West (U.S.)--Fiction, Women detectives, Women detectives--West (U.S.)--Fiction, Book thefts, Book thefts--West (U.S.)--Fiction, PS3572.A42224 S76 2000, 813/.54",Hardcover,Judith Van Gieson. Subtitle From Spine.,en,First Edition,"Height: 9 Inches, Length: 5.75 Inches, Weight: 0.80248263368 Pounds, Width: 0.75 Inches",0,https://images.isbndb.com/covers/23/33/9780826322333.jpg,Success,118,22.6
0-8135-2823-2,Feminism and the Biological Body,"Birke, Lynda",Rutgers University Press,224,2/1/2000,"Feminist theory, Women--Physiology, Human body--Social aspects, Human body--Symbolic aspects, HQ1190 .B56 2000, 305.42/01",Paperback,"What is a body? What are our perceptions of our inner body? How are these perceptions influenced? 
<p>Thinking about the body has become highly fashionable, but the renew focus, while certainly welcome, seems to always end at the body's surface. Recent sociological and feminist theory has made important claims about the prowess of cultural inscription on the body, and about the cultural representation of the body, but the body that appears in this new theory seems to be, ironically, disembodied. If this newly theorized body has interioriy, it is one that is explained predominantly through psychoanalysis. The physiological processes inside the body remain a mystery to be explained, if at all, only in the esoteric language of biomedicine.</p>
<p>As a trained biologist, Lynda Birke was frustrated by the gap between feminist cultural analysis and her won scientific background. In this book, she seeks to bridge the this gap by looking ""inside"" the body, using ideas in anatomy and physiology to develop the feminist view that the biological body is socially and culturally constructed. Birke rejects the assumption that the body's functioning is somehow fixed and unchanging, claiming that biological science offers more than just a deterministic narrative of how nature works. <i>Feminism and the Biological Body</i> puts biological science and feminist theory together and suggests that we need a new politics that includes , rather than denies, our bodily flesh.</p>",en,1,"Height: 9 Inches, Length: 6 Inches, Weight: 0.7495716908 Pounds, Width: 0.5 Inches",28.95,https://images.isbndb.com/covers/82/36/9780813528236.jpg,Success,113,22.6
1-55583-522-8,The New York Years: Stories by Felice Picano,"Picano, Felice",Alyson Books,232,5/1/2000,"Gay men, Gay men--New York (State)--New York--Fiction, Social life and customs, PS3566.I25 N49 2000, 813/.54",Paperback,"<p><b>An Excerpt: Slashed To Ribbons in Defense of Love</b></p>
<p>""It's about time you decided to wake up! We have a brunch at one o'clock, as you very well know.""</p>
<p>Gary was up, dressed, sitting across the room sipping coffee and smoking a cigarillo. He'd been out: the Sunday <i>Times</i> sat unopened on a nearby chair.</p>
<p>""It's almost twelve now. A cab will take at least fifteen minutes. If we can find one. Go shower. You know you take forever in there.""</p>
<p>Behind Gary's head, sunlight came in through the skylighted dressing room and pushed through the flecked fibers of the shoji-screen. Spence could see the gold flecking on the rice paper very clearly today. The undulating fields of lacquered flowers were backlighted—bright as persimmons—Gary's face was in shadow.</p>
<p>""I want you to know beforehand that this brunch is extremely important to me. Arnie has invited Seitelman, the Oriental Art expert. I've been trying to get near him for months. I want him to come look at those <i>Monoyamo</i> scrolls I picked up last month.""</p>
<p>Gary exhaled blue smoke. It floated into the sunlight, turned grey then yellow then grey again. He exhaled again and a second cloud rose to meet the first in a billow. It spread thinly, forming a tiny tornado around the head of the smiling Shinto statue precariously perched on a wall shelf. The Shinto idol kept smiling; it never seemed to notice the smoke descend again and form a flat halo directly over Gary's head. Spence noticed though. He laughed.</p>
<p>""I'm not kidding, Spence. Arnie's gone to a lot of trouble to get Seitelman. And it will take a lot of tact to keep him there. So I don't want any interference from you. Is that clear?""</p>
<p>Gary exhaledforcefully and broke the halo. He began picking at the edge of the cup he was drinking from as though it were crusted with something. It was his favorite china—from the Northern Sung—and invaluable. Spence never touched it. He only used china that could be dropped: or thrown. Gary frowned. Spence turned over in bed.</p>
<p>""As soon as you've met him, go to the other end of the room or table or wherever we are. And stay there. And, Spence, do try to keep your pin-sized knowledge of art to yourself. No one is interested, I assure you.""</p>",en,First Edition,"Height: 8.5 Inches, Length: 5.5 Inches, Weight: 0.5070632026 Pounds, Width: 0.5 Inches",12.95,https://images.isbndb.com/covers/52/24/9781555835224.jpg,Success,69,22.6
0-15-202195-7,Mouton's Impossible Dream,"McGrory, Anik Scannell",Gulliver Books,32,4/1/2000,"Children's Fiction, General",Hardcover,,en,,"Height: 11.25 Inches, Length: 9.5 Inches, Weight: 0.92 Pounds, Width: 0.25 Inches",16,https://images.isbndb.com/covers/19/55/9780152021955.jpg,Success,124,22.6
1-879679-14-0,Echo: Scandinavian Stories about Girls,,Women in Translation,320,4/1/2000,"Girls, Girls--Literary collections, Girls--Scandinavia--Literary collections, Women authors, Scandinavian, Women authors, Scandinavian--Biography, PT7092.E5 E24 2000, 839/.4",Paperback,Edited By Ia Dübois And Katherine Hanson.,en,First Edition,"Height: 9 Inches, Length: 6 Inches, Weight: 1.00089866948 Pounds, Width: 0.75 Inches",18.95,https://images.isbndb.com/covers/91/46/9781879679146.jpg,Success,92,22.6
1-899866-21-3,Witch,"Miller, Lorna",Slab O Concrete,72,1999,,Paperback,,en,,"Height: 9.75 Inches, Length: 7.5 Inches, Weight: 0.44974301448 Pounds, Width: 0.25 Inches",9.95,https://images.isbndb.com/covers/62/12/9781899866212.jpg,Success,95,22.6
0-670-88921-0,Dressing Up for the Carnival,"Shields, Carol Diggory",The Viking Press,208,4/24/2000,,Hardcover,,en,First Edition,"Height: 8.75 Inches, Length: 5.75 Inches, Weight: 0.85 Pounds, Width: 1 Inches",23.95,https://images.isbndb.com/covers/92/11/9780670889211.jpg,Success,128,22.6
0-375-50414-1,You Don't Have to Be Thin to Win: The Official Chub Club Coach's Workout Program,"Judy Molnar, Bob Babbitt",Villard,180,1999,"Psychology &amp; Psychiatry, Psychopathology",Hardcover,,en,,"Height: 9.75 Inches, Length: 7.25 Inches, Weight: 1 Pounds, Width: 0.25 inches",19.95,https://images.isbndb.com/covers/41/43/9780375504143.jpg,Success,133,22.6
1-57344-088-4,The Whole Lesbian Sex Book: A Passionate Guide For All Of Us,Felice Newman,Cleis Press,200,1999,,Paperback,,en,1,,24.95,https://images.isbndb.com/covers/08/82/9781573440882.jpg,Success,77,22.6
0-393-04969-8,The Search for the Panchen Lama,"Hilton, Isabel",W W Norton & Co Inc,352,2000-04,"Rgyal-mtshan-nor-bu , 1990-, Bstan-ʾdzin-rgya-mtsho , 1935-, Panchen lamas, Panchen lamas--Biography, Buddhism and politics, Buddhism and politics--China--Tibet Autonomous Region, BQ7945.R597 S47 2000, 294.3/923/092 B",Hardcover,Isabel Hilton. Includes Bibliographical References (p. 319-322) And Index.,en,First Edition,"Height: 9.75 Inches, Length: 5.75 Inches, Weight: 1.55 Pounds, Width: 1 Inches",25.95,https://images.isbndb.com/covers/96/95/9780393049695.jpg,Success,127,22.6
