ISBN,Title,Author,Publisher,Pages,Date Published,Subjects,Binding,Synopsis,Language,Edition,Dimensions,MSRP,Image,Status,PageNumber,Volume & Issue
0-8702-3636-9,Breaking Boundaries: Latina Writing and Critical Readings,,University of Massachusetts Press,288.0,1988-12-21,,Paperback,"At The Threshold Of The Unnamed : Latina Literary Discourse In The Eighties / Eliana Ortega And Nancy Saporta Sternbach -- Heat And Rain (testimonio) / Denise Chávez -- Nopalitos : The Making Of Fiction (testimonio) / Helena Maria Viramontes -- Doña Josefa : Bloodpulse Of Transition And Change / Janice Dewey -- A Deep Racial Memory Of Love : The Chicana Feminism Of Cherríe Moraga / Nancy Saporta Sternbach -- Sandra Cisneros' The House On Mango Street : Community-oriented Introspection And The Demystification Of Patriarchal Violence / Ellen Mccracken -- Deconstructing The Dominant Patriarchal Text : Cecile Pineda's Narratives / Juan Bruce-novoa -- The Ties That Bind : Women And Community In Evangelina Vigil's Thirty An' Seen A Lot / Mary Jane Treacy. The Sardonic Powers Of The Erotic In The Work Of Ana Castillo / Norma Alarcón -- Puerto Rican Writers In The U.s., Puerto Rican Writers In Puerto Rico : A Separation Beyond Language (testimonio) / Nicholasa Mohr -- Open Letter To Eliana (testimonio) / Sandra María Esteves -- Poetic Discourse Of The Puerto Rican Woman In The U.s. : New Voices Of Anacaonian Liberation / Eliana Ortega -- Señores, Don't Leibol Mi, Please!! : Ya Soy Luz María Umpierre / Asunción Horno-delgado, Translated By Janet N. Gold -- A Commentary On The Works Of Three Puerto Rican Women Poets In New York / Yamila Azize Vargas Translated By Sonia Crespo Vega -- Latinas At The Crossroads : An Affirmation Of Life In Rosario Morales And Aurora Levins Morales' Getting Home Alive / Lourdes Rojas. The Show Does Go On (testimonio) / Dolores Prida -- From Immigrants To Ethnics : Cuban Women Writers In The U.s. / Eliana Rivero -- Dolores Prida's Coser Y Cantar : Mapping The Dialectics Of Ethnic Identity And Assimilation / Albert Sandoval -- A Cuban-panamanian-american-lawyer-writer Now In Connecticut (testimonio) / Bessy Reyna -- An Oral History (testimonio) / Sherezada (chiqui) Vicioso -- Marjorie Agosín As Latina Writer / Nina M. Scott. Edited By Asunción Horno-delgado ... [et Al.]. Bibliography: P. 251-263.",en,First Edition,"Height: 9.25 Inches, Length: 6 Inches, Weight: 0.881849048 Pounds, Width: 0.75 Inches",25.95,https://images.isbndb.com/covers/63/65/9780870236365.jpg,Success,84.0,11.6
0-9619059-0-5,Inside Scars: Incest Recovery As Told by a Survivor and Her Therapist,Sheila L. Sisk,Pandora Pr,219.0,1989,,Paperback,,en,,"Height: 9 Inches, Length: 0.6 Inches, Weight: 0.7 Pounds, Width: 6.1 Inches",1.99,https://images.isbndb.com/covers/59/03/9780961905903.jpg,Success,38.0,11.6
0-933216-18-1,Hand-Me-Downs: A Novel,"Barnes, Liz",Spinsters Ink,204.0,1985,,Paperback,,en,First Edition,Weight: 0.55 Pounds,7.95,https://images.isbndb.com/covers/61/81/9780933216181.jpg,Success,28.0,11.6
0-06-440174-X,"Good Night, Mr. Tom","Magorian, Michelle",HarperCollins,336.0,1986-12-03,"Children's Fiction, Family",Paperback,"<p><P>London is poised on the brink of World War 11. Timid, scrawny Willie Beech &#151; the abused child of a single mother &#151; is evacuated to the English countryside. At first, he is terrified of everything, of the country sounds and sights, even of Mr. Tom, the gruff, kindly old man who has taken him in. But gradually Willie forgets the hate and despair of his past. He learns to love a world he never knew existed, a world of friendship and affection in which harsh words and daily beatings have no place. Then a telegram comes. Willie must return to his mother in London. When weeks pass by with no word from Willie, Mr. Tom sets out for London to look for the young boy he has come to love as a son.</p><h3>New Yorker</h3><p>An engrossing and poignant story, with much sunlight tobalance the darkness.</p>",en,English Language,"Height: 7.62 Inches, Length: 5.12 Inches, Weight: 0.48 Pounds, Width: 0.67 Inches",0.0,https://images.isbndb.com/covers/17/46/9780064401746.jpg,Success,29.0,11.6
0-921881-04-5,The Breaking Up Poems,"Donald, Christine",Gynergy Books/Ragweed Pr,,1989,,Paperback,,en,First Edition,,9.95,https://images.isbndb.com/covers/10/49/9780921881049.jpg,Success,27.0,11.6
0-393-04512-9,Selected Poems of May Sarton,"Sarton, May",W. W. Norton & Company,208.0,1978-09-17,,Paperback,,en,First Edition,"Height: 8.3 Inches, Length: 5.4 Inches, Weight: 0.59965735264 Pounds, Width: 0.8 Inches",25.0,https://images.isbndb.com/covers/51/23/9780393045123.jpg,Success,59.0,11.6
0-425-08737-9,Queen of the Swords,"Moorcock, Michael",Berkley,160.0,1986,,Mass Market Paperback,,en,,"Height: 5 Inches, Length: 7 Inches, Width: 1 Inches",2.95,https://images.isbndb.com/covers/73/74/9780425087374.jpg,Success,24.0,11.6
0-941483-38-X,Keep to Me Stranger,Sarah Aldridge,A&M Books,360.0,1989-06-01,"Fiction, General",Paperback,,en,First Edition,"Height: 8.5 Inches, Length: 5.5 Inches, Weight: 0.85 Pounds, Width: 0.75 Inches",9.95,https://images.isbndb.com/covers/33/84/9780941483384.jpg,Success,76.0,11.6
1-55874-018-X,Healing Your Sexual Self,"Woititz, Janet Geringer",Hci,224.0,1989,"Medical, General",Paperback,,en,,"Height: 8.5 Inches, Length: 5.75 Inches, Weight: 0.44974301448 Pounds, Width: 0.5 Inches",0.0,https://images.isbndb.com/covers/01/81/9781558740181.jpg,Success,100.0,11.6
0-06-255498-0,Design for Growth: Twelve Steps for Adult Children (Hazelden Recovery Series),"Ray, Veronica",HarperCollins,112.0,1989,,Paperback,,en,1st Harper & Row ed,Weight: 0.3 Pounds,7.95,https://images.isbndb.com/covers/49/87/9780062554987.jpg,Success,32.0,11.6
0-934411-21-2,Common Sons,"Donaghe, Ronald L.",Banned Books,212.0,1989-09-01,"Gay Men, Fiction",Paperback,,en,First Edition,"Height: 9.25 Inches, Length: 6.25 Inches, Weight: 1 Pounds, Width: 0.75 Inches",8.95,https://images.isbndb.com/covers/12/19/9780934411219.jpg,Success,67.0,11.6
0-914629-94-8,The Very Best Child Care and How to Find It,"Buhler, Danalee",Prima Lifestyles,208.0,1989-03-17,,Paperback,,en,,Weight: 0.81 Pounds,8.95,https://images.isbndb.com/covers/99/48/9780914629948.jpg,Success,94.0,11.6
0-933216-23-8,Leave a Light on for Me,Jean E. Swallow,Spinsters Ink Books,292.0,1986-10-01,,Paperback,,en,First Edition,Weight: 1.01 Pounds,0.0,https://images.isbndb.com/covers/62/35/9780933216235.jpg,Success,23.0,11.6
0-8263-1086-9,"Denizens of the Desert: A Tale in Word and Picture of Life Among the Navaho Indians, the Letters of Elizabeth W. Forster",,Univ of New Mexico Pr,140.0,1988,,Hardcover,,en,First Edition,"Height: 10.38 Inches, Length: 8.23 Inches, Weight: 1.76 Pounds, Width: 0.68 Inches",25.95,https://images.isbndb.com/covers/08/66/9780826310866.jpg,Success,56.0,11.6
0-87542-757-X,Stroking The Python,Diane Stein,Llewellyn Publications,356.0,1988-01-01,"Body, Mind &amp; Spirit, General",Paperback,,en,First Edition,"Height: 9 Inches, Length: 1 Inches, Weight: 1.13317602668 Pounds, Width: 6.25 Inches",0.0,https://images.isbndb.com/covers/75/77/9780875427577.jpg,Success,79.0,11.6
0-914086-77-4,Disciplining the Devil's Country,"Borges, Carole",Alice James Books,72.0,1987-01-01,Literary Collections,Paperback,,en,First Edition,"Height: 8.5 Inches, Length: 5.6 Inches, Weight: 0.2 Pounds, Width: 0.2 Inches",7.95,https://images.isbndb.com/covers/67/72/9780914086772.jpg,Success,57.0,11.6
