ISBN,Title,Author,Publisher,Pages,Date Published,Subjects,Binding,Synopsis,Language,Edition,Dimensions,MSRP,Image,Status,PageNumber,Volume & Issue
0-06-016025-X,Bodylove: Learning to Like Our Looks--And Ourselves,"Freedman, Rita",HarperCollins,256.0,1988,"Medical, General",Hardcover,,en,First Edition,Weight: 1.19 Pounds,0.0,https://images.isbndb.com/covers/02/58/9780060160258.jpg,Success,34.0,11.6
1-55874-016-3,Recovery from Rescuing,"Castine, Jacqueline",Hci,113.0,1989,,Paperback,,en,,"Height: 8 Inches, Length: 5.5 Inches, Weight: 0.39903669422 Pounds, Width: 0.5 Inches",7.95,https://images.isbndb.com/covers/01/67/9781558740167.jpg,Success,100.0,11.6
0-932379-00-1,Jonestown and Other Madness,"Parker, Pat",Firebrand Books,75.0,1985-04-01,"African American lesbians, African American lesbians--Poetry, PS3566.A6847 J6 1985, 811/.54",Paperback,"Love Isn't -- Bar Conversation -- My Brother -- Georgia, Georgia, Georgia On My Mind -- One Thanksgiving Day -- Aftermath -- Breaking Up -- Maybe I Should Have Been A Teacher -- Child's Play -- Jonestown -- Legacy. By Pat Parker.",en,First Edition,"Height: 8.75 Inches, Length: 5.75 Inches, Weight: 0.3125 Pounds, Width: 0.25 Inches",9.95,https://images.isbndb.com/covers/90/09/9780932379009.jpg,Success,58.0,11.6
0-201-07974-7,Dorothy Day: A Radical Devotion (Radcliffe Biography Series),"Coles, Robert",Da Capo Press,206.0,1989-01-22,,Paperback,"Robert Coles first met Dorothy Day over thirty-five years ago when, as a medical student, he worked in one of her Catholic Worker soup kitchens. He remained close to this inspiring and controversial woman until her death in 1980. His book, an intellectual and psychological portrait, confronts candidly the central puzzles of her life: the sophisticated Greenwich Village novelist and reporter who converted to Catholicism; the single mother who raised her child in a most unorthodox ”family”; her struggles with sexuality, loneliness, and pride; her devout religious conservatism coupled with radical politics. This intense portrait is based on many years of conversation and correspondence, as well as tape-recorded interviews.",en,,"Height: 6 Inches, Length: 9 Inches, Weight: 0.64374980504 Pounds, Width: 0.48 Inches",17.4,https://images.isbndb.com/covers/97/46/9780201079746.jpg,Success,89.0,11.6
1-55874-008-2,Eat Like a Lady: Guide for Overcoming Bulimia,"Wills-Brandon, Carla",Hci,250.0,1989,,Paperback,,en,,"Height: 9 inches, Length: 6.25 inches, Weight: 0.50044933474 Pounds, Width: 0.5 inches",1.99,https://images.isbndb.com/covers/00/82/9781558740082.jpg,Success,100.0,11.6
0-689-11825-2,Out of Danger,"Lipsett, Suzanne",Atheneum,244.0,1987,"PS3562.I59 O98 1987, 813/.54",Hardcover,Suzanne Lipsett.,en,First Edition,Weight: 1 Pounds,18.95,https://images.isbndb.com/covers/82/58/9780689118258.jpg,Success,29.0,11.6
0-88978-189-3,Resistance and Renewal: Surviving the Indian Residential School,"Haig-Brown, Celia",Arsenal Pulp Press,172.0,2002-07-01,"Kamloops Indian Residential School., Shuswap Indians--Education, Shuswap Indians--Cultural assimilation, E96.6.K36 H35 1988",Paperback,"The Purpose Of This Book Is Primarily To Present Native Perspectives Of The Kamloops Indian Residential School, And To Provide A Limited Overview Of How Native Education Has Evolved. Interviews Were Conducted With Native People Of Central Interior British Columbia, Former Students Of The School. Two Main Concepts, Cultural Invasion And Resistance, Are Revealed. Celia Haig-brown. Includes Index. Bibliography: P. 152-158.",en,Canadian First,"Height: 6 Inches, Length: 5.5 Inches, Weight: 0.52 Pounds, Width: 0.5 Inches",13.95,https://images.isbndb.com/covers/18/94/9780889781894.jpg,Success,77.0,11.6
0-345-32786-1,Crystal Singer: A Novel (Crystal Singer Trilogy),Anne Mccaffrey,Del Rey,311.0,1982-08-12,,Mass Market Paperback,"<p>Her name was Killashandra Ree. And after ten grueling years of musical training, she was still without prospects. Until she heard of the mysterious Heptite Guild who could provide careers, security, and wealth beyond imagining. The problem was, few people who landed on Ballybran ever left. But to Killashandra the risks were acceptable....<br><br><br><i>From the Paperback edition.</i></p>",en,First Edition,"Height: 6.75 Inches, Length: 4.4 Inches, Weight: 0.36155810968 Pounds, Width: 0.87 Inches",7.99,https://images.isbndb.com/covers/78/64/9780345327864.jpg,Success,30.0,11.6
1-55874-013-9,"Messages from Anna: Lessons in Living...Santa Claus, God and Love","Rankin, Zoe",Hci,128.0,1989,,Paperback,,en,"reading copy, extensive highlighting","Height: 8.5 Inches, Length: 5.5 Inches, Weight: 0.45 Pounds, Width: 0.5 Inches",7.95,https://images.isbndb.com/covers/01/36/9781558740136.jpg,Success,100.0,11.6
0-614728-63-6,,,,,,,,,,,,,,Error,34.0,11.6
0-89659-797-0,UNEXPECTED JOURNEYS: The Art and Life of Remedios Varo,"Kaplan, Janet A.",Abbeville Press,288.0,1988-09-01,,Hardcover,1. The Early Years -- 2. Toward Surrealism : Paris And Barcelona -- 3. Among The Surrealists : Paris And Marseilles -- 4. Artist In Exile : Mexico And Venezuela -- 5. The Artist And Her Public -- 6. Journey As Metaphor -- 7. Transformations -- 8. Remembrance And Remembering. Janet A. Kaplan. Includes Index. Bibliography: P. 268-276.,en,First Edition,"Height: 10.5 Inches, Length: 7.5 Inches, Weight: 2.65 Pounds, Width: 1.25 Inches",24.95,https://images.isbndb.com/covers/79/76/9780896597976.jpg,Success,56.0,11.6
1-55874-006-6,The Flying Boy: Healing the Wounded Man,"Lee, John",Health Communications Inc,111.0,1989-01-01,"Men, Psychology, Case Studies, Interpersonal Relations, Self-actualization (psychology)",Paperback,"<p><b>""Why Men Run From Relationships"", <i>Changes</i> magazine</b></p>
<p><i>The Flying Boy: Healing the Wounded Man</i> is a record of one man's journey to find his ""true masculinity"" and his way out of co-dependent and addictive relationships. It's a book for all men and women who grew up in dysfunctional families and are now ready for some fresh insights into their past and their pain.</p>
<p><i>The Flying Boy</i> is a story about feelings - losing them, finding them and finally expressing them. Here you will find people you know; will discover a way out of the pain and see that it really is OK to express yourself without fear.</p>
<p>The book is about grieving, a very misunderstood process often confused with self-pity. <i>The Flying Boy</i> opens doors to understanding - men will understand themselves and each other, and women will more deeply understand men, learn how to be with wounded men and still take care of themselves.</p>


                        <p>This book is a recodrd of one man's journey to find his ""true masculinity,"" and his way out of co-dependent and addictive relationships.
</p>",en,English Language,"Height: 8.5 Inches, Length: 5.5 Inches, Weight: 0.4299014109 Pounds, Width: 0.3 Inches",12.95,https://images.isbndb.com/covers/00/68/9781558740068.jpg,Success,100.0,11.6
1-55874-003-1,Addictive Relationships: Reclaiming Your Boundaries,"Miller, Joy",Hci,108.0,1989-09-01,,Paperback,"<p><p>dedicated To The Claiming Of Your Own Personal Boundaries, This Book Deals With Our Addictive Or Destructive Relationships Not Only Centered Around Our Spouse Or Lover, But Also Around Our Children, Our Friends Or Our Parents. If We Have Lost Ourselves Along The Way, We Have Probably Given Ourselves Away. This Book Examines Where We Are, Where We Want To Go And How To Get There. We Will Move Addictive Loving Styles To Find The True Love Of Ourselves And Reclaim Our Selfhood.<p>this Is A Positive Step-by-step Process For Recovery Using Affirmations And Exercises For Inner Growth.<p></p>",en,,"Height: 8.5 Inches, Length: 5.5 Inches, Weight: 0.39903669422 Pounds, Width: 0.28 Inches",9.95,https://images.isbndb.com/covers/00/37/9781558740037.jpg,Success,100.0,11.6
0-689-71206-5,Don't Hurt Laurie (Aladdin Fiction),"Roberts, Willo Davis",Aladdin,176.0,1988-03-31,"Children's Fiction, Social Situations",Paperback,"<p>Laurie's been keeping a secret for as long as she can remember, a secret that she's afraid to tell anyone else. The only other person who knows is Annabelle, her mother - because Annabelle is the one who beats her. <p>Then, one day, Annabelle goes too far - and Laurie is finally desperate enough to do something to save herself.</p>",en,Reprint,"Height: 8 Inches, Length: 5 Inches, Weight: 1.543235834 Pounds, Width: 0.6 Inches",9.99,https://images.isbndb.com/covers/20/67/9780689712067.jpg,Success,29.0,11.6
0-89594-211-9,"Hear the Silence: Stories by Women of Myth, Magic and Renewal (Crossing Press Feminist Series)","Moran, Johanna",Crossing Press,194.0,1986-09,,Paperback,"Magic In A World Of Magic / Anne Cameron -- In The Beginning There Was Humming / Deena Metzger -- Baby Town / Becky Birtha -- Why The Sea Is Salty / Kitty Tsui -- Blood, Sweat And Fears / Dale Colleen Hamilton -- Fruit Drink / Bode Noonan -- The Healing / Sandy Boucher -- Sticktalk / Vickie L. Sears -- The Saints And Sinners Run / Becky Birtha -- The Plasting Project / Merlin Stone -- Why The Moon Is Small And Dark When The Sun Is Big And Shiny / Judith Stein -- Ernesta / Judy Grahn -- The Love Chapter / Martha Waters -- The Tree On The Mountain / Deena Metzger -- She Unnames Them / Ursula K. Le Guin. Edited By Irene Zahava. 15 Spiritual Short Stories By: Anne Cameron, Deena Metzger, Becky Birtha, Kitty Tsui, Dale Colleen Hamilton, Bode Noonan, Sandy Boucher, Vickie L. Sears, Merlin Stone, Judith Stein, Judy Grahn, Martha Waters And Ursula K. Le Guin.",en,,Weight: 0.58 Pounds,0.0,https://images.isbndb.com/covers/21/11/9780895942111.jpg,Success,30.0,11.6
0-89608-352-7,"Talking Back: Thinking Feminist, Thinking Black",Bell Hooks,South End Press,186.0,1999-07-01,"African Americans - General & Miscellaneous, Feminism & Feminist Theory",Paperback,"An investigation of feminist theory written in an accessible style and grounded in personal testimony, this volume includes chapters on feminist scholarship, feminism and militarism, homophobia in Black communities, self-recovery, violence in intimate relationships, overcoming white supremacy, and class and education.",en,Wavy Pages But Clean Copy,"Height: 8.5 Inches, Length: 5.5 Inches, Weight: 0.53 Pounds, Width: 0.4 Inches",20.0,https://images.isbndb.com/covers/35/23/9780896083523.jpg,Success,78.0,11.6
0-06-435852-6,"Women, Art, and Power: And Other Essays (Icon Editions)","Nochlin, Linda",Harper & Row,181.0,1988,"Feminism and art, Women artists--Biography--History and criticism, N72.F45 N64 1988, 701/.03",Hardcover,"Women, Art, And Power --seven Landmark Essays On Women Artists And Women In Art History--brings Together The Work Of Almost Twenty Years Of Scholarship And Speculation. Women, Art, And Power (1988) -- Morisot's Wet Nurse: The Construction Of Work And Leisure In Impressionist Painting (1988) -- Lost And Found: Once More The Fallen Woman (1978) -- Some Women Realists (1974) -- Florine Stettheimer: Rococo Subversive (1980) -- Eroticism And Female Imagery In Nineteenth-century Art (1972) -- Why Have There Been No Great Women Artists? (1971). Linda Nochlin. Includes Bibliographies And Index.",en,American First,Weight: 1.2 Pounds,2.67,https://images.isbndb.com/covers/85/21/9780064358521.jpg,Success,56.0,11.6
0-89486-566-8,"Growing Up Again: Parenting Ourselves, Parenting Our Children","Clarke, Jean Illsley, Dawson, Connie",Hazelden,181.0,1996,,Paperback,"As time-tested as it is timely, the expert advice in this book has helped thousands of readers improve on their parenting practices. Now, substantially revised and expanded, <i>Growing Up Again</i> offers further guidance on providing children with the structure and nurturing that are so critical to their healthy development -- and to our own. 
<p>Jean Illsley Clarke and Connie Dawson provide the information every adult caring for children should know -- about ages and stages of development, ways to nurture our children and ourselves, and tools for personal and family growth. This new edition also addresses the special demands of parenting adopted children and the problem of overindulgence; a recognition and exploration of prenatal life and our final days as unique life stages; new examples of nurturing, structuring, and discounting, as well as concise ways to identify them; help for handling parenting conflicts in blended families, and guidelines on supporting children's spiritual growth.</p>
<p><i>About the Authors:</i></p>
<p><b>Jean Illsley Clarke</b> is a parent educator, teacher trainer, the author of <i>Self-Esteem: A Family Affair,</i> and co-author of the <i>Help! for Parents</i> series. She is a popular international lecturer and workshop presenter on the topics of self-esteem, parenting, family dynamics, and adult children of alcoholics. Clarke resides in Plymouth, Minnesota.</p>
<p><b>Connie Dawson</b> is a consultant and lecturer who works with adults who work with kids. A former teacher, she trains youth workers to identify and help young people who are at risk. Dawson lives in Evergreen, Colorado.</p>",en,,"Height: 9.5 Inches, Length: 7.75 Inches, Weight: 0.9 Pounds, Width: 0.5 Inches",12.95,https://images.isbndb.com/covers/56/64/9780894865664.jpg,Success,32.0,11.6
0-932379-29-X,This Is About Incest,"Randall, Margaret",Firebrand Books,72.0,1987-12-01,"Abuse & Violence, Family Abuse & Violence, Victims of Crime - Biography",Paperback,<p>Words and photographic images are the tools the author uses as she works her way through memories of sexual assault.</p>,en,First Edition,"Height: 7 Inches, Length: 7 Inches, Weight: 0.26 Pounds, Width: 0.25 Inches",8.95,https://images.isbndb.com/covers/92/90/9780932379290.jpg,Success,25.0,11.6
0-932379-29-X,This Is About Incest,"Randall, Margaret",Firebrand Books,72.0,1987-12-01,"Abuse & Violence, Family Abuse & Violence, Victims of Crime - Biography",Paperback,<p>Words and photographic images are the tools the author uses as she works her way through memories of sexual assault.</p>,en,First Edition,"Height: 7 Inches, Length: 7 Inches, Weight: 0.26 Pounds, Width: 0.25 Inches",8.95,https://images.isbndb.com/covers/92/90/9780932379290.jpg,Success,28.0,11.6
0-15-642173-9,Horses Make a Landscape Look More Beautiful,Alice Walker,Mariner Books,79.0,1986,,Paperback,,en,1st,"Height: 8.5 Inches, Length: 5.5 Inches, Weight: 0.3 Pounds, Width: 0.26 Inches",10.95,https://images.isbndb.com/covers/17/37/9780156421737.jpg,Success,66.0,11.6
0-89594-332-8,She Lives! The Return of Our Great Mother,"Laura, Judith",Crossing Pr,143.0,1989-04,"Goddesses--Prayers and devotions--English, Feminism--Religious aspects, Goddesses, Goddesses--Prayers and devotions, BL473.5 .L38 1989, 291.2/11",Paperback,By Judith Laura.,en,First Edition,"Height: 8.5 Inches, Length: 5.5 Inches, Weight: 0.4 Pounds, Width: 0.25 Inches",8.95,https://images.isbndb.com/covers/33/23/9780895943323.jpg,Success,80.0,11.6
0-06-055105-4,The Courage to Heal: A Guide for Women Survivors of Child Sexual Abuse,"Bass, Ellen, Davis, Laura",Harpercollins,493.0,1991,"Child sexual abuse, Child sexual abuse--United States, Women--Psychology, Women--United States--Psychology, Adult child abuse victims, Adult child abuse victims--United States, Child Abuse, Sexual, Women--psychology, HQ72.U53 B37 1988, WA 320 B317 1988, 616.85/83",Hardcover,"An Inspiring, Comprehensive Guide That Offers Hope And Encouragement To Every Woman Who Was Sexually Abused As A Child, Proving That Healing Is Possible. Taking Stock -- The Healing Process -- Changing Patterns -- For Supporters Of Survivors -- Courageous Women. Ellen Bass And Laura Davis. Includes Index. Bibliography: P. 466-484.",en,First Edition,"Height: 11.11 Inches, Length: 6.11 Inches, Weight: 2.314853751 Pounds, Width: 1.11 Inches",32.95,https://images.isbndb.com/covers/10/56/9780060551056.jpg,Success,52.0,11.6
0-941300-08-0,"Warning, Dating May Be Hazardous to Your Health!","McShane, Claudette",Mother Courage Pr,190.0,1989,,Paperback,,en,,"Height: 8.5 Inches, Length: 5.75 Inches, Weight: 0.59965735264 Pounds, Width: 0.5 Inches",9.95,https://images.isbndb.com/covers/00/87/9780941300087.jpg,Success,6.0,11.6
0-87477-454-3,A Time To Heal: The Road to Recovery for Adult Children of Alcoholics,"Cermak, Timmen L.",Jeremy P. Tarcher,227.0,1988-01-01,,Hardcover,,en,First Edition,"Height: 5.76 Inches, Length: 8.52 Inches, Weight: 0.9 Pounds, Width: 0.93 Inches",15.95,https://images.isbndb.com/covers/45/42/9780874774542.jpg,Success,32.0,11.6
0-533-26228-9,,,,,,,,,,,,,,Error,24.0,11.6
0-06-096328-X,Making Peace With Food: Freeing Yourself from the Diet/Weight Obsession,"Kano, Susan",William Morrow Paperbacks,272.0,1989-03-01,"Psychological Disorders, Diets - Weight Loss & Weight Control, Eating Disorders, Eating Disorders - Self-Help",Paperback,"<p>For millions of diet-conscious Americans, the scientifically proven, step-by-step guide to overcoming repeated weight loss and gain, binge eating, guilt, and anxieties about food and body image.</p>                        <p>The scientifically proven, step-by-step guide to overcoming repeated weight loss and gain.</p>",en,Revised ed.,"Height: 9.25 Inches, Length: 7.38 Inches, Weight: 1.11 Pounds, Width: 0.63 Inches",14.24,https://images.isbndb.com/covers/32/86/9780060963286.jpg,Success,32.0,11.6
0-06-016028-4,You Don't Have to Suffer: A Handbook for Moving Beyond Life's Crisis,"Tatelbaum, Judy",Harpercollins,205.0,1989,"Suffering, Adjustment (Psychology), Adaptation, Psychological, Life Change Events, BF789.S8 T37 1989, BF 335 T217 1989, 158/.1",Hardcover,Judy Tatelbaum.,en,First Edition,Weight: 0.66 Pounds,15.95,https://images.isbndb.com/covers/02/89/9780060160289.jpg,Success,34.0,11.6
0-312-02544-0,The bar stories: A novel after all,"Donnelly, Nisa",St. Martin's Press,356.0,1989,,Hardcover,Nisa Donnelly.,en,First Edition,Weight: 1.2 Pounds,0.0,https://images.isbndb.com/covers/54/41/9780312025441.jpg,Success,96.0,11.6
0-936077-18-2,Dear Kids of Alcoholics,"Lindsey Hall, Leigh Cohn",Gurze Books,96.0,1993-01-28,,Paperback,"This is an honest, hopeful book for children (ages 8-17) of an alcoholic parent. Its main character, a boy named Jason, explains facts about alcoholism with touching stories about his dad's sensitivity to alcohol, destructive behavior, and recovery process. 
<p>Jason Shows what it's like for children with a parent who drinks too much. Includes simple definitions, illistrations, and a glossary.</p>
<p>A note to parents, educators, and counselors: This book is an excellent too for teaching about alcoholism and how it affects families. It can also be used to encourage readers to talk about their own feelings and experiences as children of alcoholics.</p>


                        <p>A young boy imparts facts about alcoholism by discussing his father's sensitivity to alcohol, his destructive behavior, and his recovery process.
</p>",en,1,"Height: 8.25 Inches, Length: 5.25 Inches, Weight: 0.31305641204 Pounds, Width: 0.5 Inches",8.95,https://images.isbndb.com/covers/71/85/9780936077185.jpg,Success,32.0,11.6
0-931188-50-4,The House with the Blind Glass Windows,Herbjorg Wassmo,The Seal Press,227.0,1987-12,"Child sexual abuse, Child sexual abuse--Fiction, Stepfathers, Stepfathers--Fiction, PT8951.33.A8 H813 1987, 839.8/2374",Paperback,Herbjørg Wassmo ; Translated By Roseann Lloyd And Allen Simpson. Translation Of: Huset Med Den Blinde Glassveranda.,en,First Edition,Weight: 0.7 Pounds,0.0,https://images.isbndb.com/covers/85/03/9780931188503.jpg,Success,28.0,11.6
0-8704-9596-8,"Pauli Murray: The Autobiography of a Black Activist, Feminist, Lawyer, Priest, and Poet","Murray, Pauli",The University of Tennessee Press,464.0,1989-06-23,"African Americans, African American Women Lawyers, Feminists",Paperback,,en,2nd,"Height: 9.5 Inches, Length: 6.25 Inches, Weight: 1.45946017444 Pounds, Width: 1.25 Inches",29.95,https://images.isbndb.com/covers/59/60/9780870495960.jpg,Success,88.0,11.6
0-8147-1098-0,"Women Analyze Women: In France, England, and the United States","Baruch, Elaine H., Serrano, Lucienne J.",New York University Press,320.0,1988-11-01,,Hardcover,"Dominique Guyomard -- Monique David-ménard -- Joyce Mcdougall --catherine Millot -- Françoise Petitot -- Janine Chasseguet-smirgel -- Julia Kristeva -- Luce Irigaray -- Monique Schneider -- Juliet Mitchell -- Enid Balint -- Hanna Segal -- Dinora Pines -- Marianne Eckardt -- Dorothy Dinnerstein -- Jessica Benjamin -- Donna Bassin -- Muriel Dimen -- Diana Trilling. Elaine Hoffman Baruch, Lucienne J. Serrano. Includes Bibliographies And Index.",en,,"Height: 9.25 Inches, Length: 6 Inches, Weight: 1.5873282864 Pounds, Width: 1.25 Inches",40.0,https://images.isbndb.com/covers/09/82/9780814710982.jpg,Success,66.0,11.6
0-7043-4123-9,The Prizegiving (The Women's Press Fiction),"Ozakin, Aysel",The Women's Press,192.0,1988,,Paperback,Aysel Özakin ; Translated From The Turkish By Celia Kerslake.,en,,,0.0,https://images.isbndb.com/covers/12/34/9780704341234.jpg,Success,75.0,11.6
0-06-255488-3,The Addictive Personality: Understanding Compulsion In Our Lives,"Nakken, Craig",HarperOne,116.0,1988-09-07,Literary Collections,Paperback,,en,English Language,"Height: 8.25 Inches, Length: 0.25 Inches, Weight: 0.3 Pounds, Width: 5.25 inches",0.0,https://images.isbndb.com/covers/48/88/9780062554888.jpg,Success,34.0,11.6
0-671-61702-8,The Color Purple,Alice Walker,Pocket Books,295.0,1985,,Paperback,,en,,Weight: 0.35 Pounds,7.5,https://images.isbndb.com/covers/70/28/9780671617028.jpg,Success,27.0,11.6
0-914996-26-6,The Boy Toy,"Shiffman, Lena",Lollipop Power Inc,32.0,1988-06-01,,Paperback,"Having Abandoned His Beloved Doll Dan After Another Boy Tells Him That Dolls Are For Girls, Chad Has A Chance To Change His Mind Later.",en,,"Height: 11 Inches, Length: 8.5 Inches, Weight: 0.3 Pounds, Width: 0.25 Inches",5.95,https://images.isbndb.com/covers/62/62/9780914996262.jpg,Success,72.0,11.6
7 1-800-258-5,,,,,,,,,,,,,,Error,80.0,11.6
0-939821-31-1,The Lesbian in Front of the Classroom: Writings by Lesbian Teachers,"Parmeter, Sarah-Hope, Reti, Irene, Ellen Louise Hart, M. Eugenia Rosa, Caroline Sidaway, Anza Stein",Inland Book Co,58.0,1988,,Paperback,,en,,Weight: 1.01 Pounds,6.5,https://images.isbndb.com/covers/13/10/9780939821310.jpg,Success,73.0,11.6
0-86068-077-0,Both Feet Off the Ground (Virago Upstarts),"Hughes, Barbara",Virago,160.0,1988,,Paperback,,en,,"Height: 0.1 Inches, Length: 0.1 Inches, Width: 0.1 Inches",0.0,https://images.isbndb.com/covers/07/72/9780860680772.jpg,Success,76.0,11.6
0-8147-1105-7,Susan B. Anthony: A Biography,"Barry, Kathleen",NYU Press,1.0,1988-11-01,"Anthony, Susan B. (Susan Brownell) , 1820-1906, Feminists, Feminists--United States--Biography, Biography as a literary form, HQ1413.A55 B36 1988, 305.4/2/0924 B",Hardcover,The Story Of Susan B. Anthony Who Changed The History Of American Women With Her New Vision Of Equality. The Rise Of A Common Woman -- To Marry Or Not To Be A Wife -- Woman Must Take To Her Soul A Purpose -- A Passion For Justice -- The Woman's Enlightenment -- Which Slaves' Emancipation? -- The Male Betrayal -- Reformers Versus Radicals -- The Vagaries Of Love -- Convicted Of Being A Woman -- The Unity Of Women- At What Cost? -- A Grand Old Age -- Failure Is Impossible. Kathleen Barry. Includes Index. Bibliography: P. [408]-418.,en,First Edition,"Height: 9.25 Inches, Length: 6.25 Inches, Weight: 1.7 Pounds, Width: 1 Inches",40.0,https://images.isbndb.com/covers/10/57/9780814711057.jpg,Success,66.0,11.6
0-312-02866-0,The Beloved Prison: Journey into the Unknown Self,"Freeman, Lucy",St Martins Pr,370.0,1989,"Mental healthFreeman, Lucy , 1916-, Psychotherapy patients, Psychotherapy patients--United States--Biography, Psychoanalysis, Psychoanalysis--United States--Biography, RC464.F73 A33 1989, 616.89/19/0924 B",Hardcover,Lucy Freeman.,en,First Edition,Weight: 1.2 Pounds,0.0,https://images.isbndb.com/covers/86/64/9780312028664.jpg,Success,94.0,11.6
0-87477-511-6,The Fine Art of Recuperation,Regina Sara Ryan,Tarcher,213.0,1989-07-01,"Convalescence, Sick--Psychology, Healing, R726.5 .R9 1989, WB 545 R989 1989, 616/.001/9",Paperback,Regina Sara Ryan. Bibliography: P. 207-213.,en,First Edition,"Height: 20 Inches, Length: 20 Inches, Weight: 0.75 Pounds, Width: 20 Inches",0.0,https://images.isbndb.com/covers/51/12/9780874775112.jpg,Success,95.0,11.6
0-87477-517-5,Gay Relationships For Men and Women,Tina Tessina,St. Martin's Press,228.0,1989-05-01,"Gay couples, Interpersonal relations, HQ76.25 .T37 1989, 306.7/66",Hardcover,"1. Gay Relationships : What Are They? -- 2. How (and Where) To Find Relationships -- 3. From Dating To Commitment -- 4. Dynamics Of Gay Relationships -- 5. Gay Relationships And Sexuality -- 6. Living Together -- 7. Commitment Ceremonies, Marriage, And Legal Issues -- 8. Coming Out, In-laws, And Support Systems -- 9. Happily Every After -- Appendix A: Resources For Support And Legal Advice -- Appendix B: Safe-sex Information -- Appendix C: Advice For Dealing With Homophobia. Tina Tessina. Includes Bibliographical References.",en,1,Weight: 1.1 Pounds,17.95,https://images.isbndb.com/covers/51/74/9780874775174.jpg,Success,95.0,11.6
0-7043-4102-6,Both right and left handed: Arab women talk about their lives (Third World women's studies),"Shaaban, Bouthaina",Indiana Univ. Press,242.0,1988,,Paperback,,en,2nd,Weight: 0.42769678828 Pounds,1.99,https://images.isbndb.com/covers/10/29/9780704341029.jpg,Success,76.0,11.6
0-312-02951-9,Run That Sucker at Six: The Second Morgan Calabrese Collection,"Dunlap, N. Leigh",St Martins Pr,115.0,1989,,Paperback,,en,First Edition,"Height: 5.5 Inches, Length: 8.25 Inches, Weight: 0.35 Pounds, Width: 0.5 Inches",5.5,https://images.isbndb.com/covers/95/17/9780312029517.jpg,Success,95.0,11.6
