PageNumber,Text,ISBNs
104,"Feminist Bookstore News
Women Who Kept the Lights: An Illustrated heterosexist assumptions, despite the fact that it
History of Female Lighthouse Keepers by Mary illustrates a very real life situation. A young boy
Louise Clifford and J. Candace Clifford is a unique who has never known a father is disturbed when
collection of personal histories that speak to the fact his friend taunts him for not having a daddy. Kids
that although keeping a lighthouse was generally can be cruel. His mother explains to him that his
regarded as a male occupation, at least 138 women father couldn't handle the responsibility of caring
received official appointments in the lighthouse ser- for a baby so he left. I would have preferred a page
vice. Women Who Kept the Lights reveals the where the mother explains to the kid that there are
career details of “28 of these intrepid women, whose lots of different families — some children have two
service ranged in length from a decade to a half cen- moms, some have two dads, and some have a mom
tury.” Includes 78 illustrations and photographs. and a grandfather, like him. $5.95 pb, 0-930934-44-
$19.95 pb, 0-9636412-0-4. Cypress Communications, X; Spanish edition, 0-930934-82-2. IN.
PO Box 791, Williamsburg VA 23187.
Ego-tripping and Other Poems for Young
People by Nikki Giovanni, illustrated by George
Ford, is a book I'd like to send to all my young rela-
tives. I won't, however, because although the collec-
Morning Glory Press has published English and tion encourages cultural pride, it’s a bit confused on
Spanish editions of the children’s book Do I Have the issue of sexuality. Giovanni writes one poem for
A Daddy?: A Story About A Single-Parent Child Langston Hughes (who is now known to have been
by Jeanne Warren Lindsay, illustrated by Cheryl gay) and in another poem uses the word “faggoty” in
Boeller. I can’t help but be concerned by the book’s a not so complementary manner. $14.95 cl, 1- 55652-
B Wh en Sthe
When the Bough Breaks: A Portrait of American Family Portraits
Pregnancy and the Legacy of Mothers and Daughters in Changing Times
Addiction by Raisa Fastman by Helen Nestor
by Kira Corser Stories and photographs Stories and photographs
and Frances Payne Adler Softcover 0-939165-04-X $22.95 Hardcover 0-939165-16-3 $39.95
Stories, photographs and poetry Softcover 0-939165-15-5 $22.95
H Soa fr td cc oo vv ee rr 00 -- 99 33 99 11 66 55 -- 12 90 -- 81 $$ 23 29 .. 99 55 “ sP omho et o g fr amap oh us o f mm eo t h uner ks oa wn nd d aa cu rg oh sst e r as , Nominated fb oy t Yh oe A L A uas sa 1B 9e 9st Book
s , s o n , wide r u n g A d lt , 4
ethnic, socioeconomic and age range, with “Both the photos and statements are en-
“This is a beautiful, haunting, and commit- comments by some about their relation- lightening. These family portraits illustrate
ted book — a work of art and an effective ship, make a moving,but sentimental state- what is important about families — be-
piece of social criticism.” CALYX ment about this primary bond.” Booklist longing.” Booklist
NEWSAGE PRESS 825 NE 20TH AVE., STE. 150, PORTLAND, OR 97232 (503)232-6794
Now Distributed by Publisher's Group West
March 1994 102 Volume 16 Number 6
This content downloaded from
(cid:0)(cid:0)(cid:0)(cid:0)(cid:0)(cid:0)(cid:0)(cid:0)(cid:0)(cid:0)(cid:0)(cid:0)70.126.145.227 on Sat, 19 Mar 2022 18:04:21 UTC(cid:0)(cid:0)(cid:0)(cid:0)(cid:0)(cid:0)(cid:0)(cid:0)(cid:0)(cid:0)(cid:0)(cid:0)(cid:0)
All use subject to https://about.jstor.org/terms","['0-9636412-0-4', '0-930934-82-2', '0-939165-04-X', '0-939165-16-3', '0-939165-15-5', '00 -- 99 33 9', '11 66 55 -- 1']"
105,"Feminist Bookstore News
188-X; $9.95 pb 1-55652-189-8. Lawrence Hill Books. $17.50 bp, 1- 85649-230-3. Zed Books. Available via
Distributed by Independent Publishers Group. Humanities Press International, 165 First Avenue,
Atlantic Highlands NJ 07716 and Inland.
One of the best things about living in the west is In this age of “post modernism,” “deconstruc-
the tremendous access to Chicana literature, both on tionism,” “post-feminism,” and “psychoanalism,”
the bookshelves and in cafes. Authors like Bernice to say that one may need a companion guide to get
Zamora are helping to broaden this tradition. through the scholarly lingo is an understatement.
Zamora’s Releasing Serpents is a collection of Literature and Feminism: An Introduction by Pam
poems by, in Lorna Dee Cervantes’ words, “one of Morris is a basic and thorough overview of acade-
the most (if not the most) outstanding Chicana poets mic feminism from Freud and Lacan to Gilbert and
today.” I would go even further to say that this Gubar. $16.95 pb, 0-631-18421-X.
long-awaited second book of poetry is simply one of Patriots in Disguise: Women Warriors of the
the best contemporary collections written ($9 pb, 0- Civil War by Richard Hall tells the stories of a “sur-
927534-39-8). Alma Luz Villanueva’s new novel prising” number of women who disguised their gen-
Naked Ladies “takes its name from a wild flower der and fought in regiments for both the Union and
called the ‘naked lady,’ which serves as a metaphor the Confederate armies. $21.95 cl, 1-55778-438-8.
f fo or c uth se .” li v Te hs i o sf wth oe r kfo u r e x w po lm oren e s w h to h ea r e i n t th eis r rb ao cok ia's l and PIarNag on a Hnoudse, 90B FPif.t h TAvenue, New York NY 10011.
interethnic relationships between Chicanas, Anglos,
African Americans, Asian Americans and Native
Americans “at the deepest cultural and sexual lev- A Troubling in My Soul: Womanist
els.” Also by Villanueva are The Ultraviolet Sky and Perspectives on Evil and Suffering edited by
Weeping woman: La Llorona and Other Stories ($14 pb, Emilie M. Townes is definitely on my must-read
0-927534-31-2; $22 cl, 0-927534-30-4). Bilingual Press, list. The introduction begins “This collection of
Hispanic Research Center, Arizona State University essays was born in water and fire. Its final days
Box 872702, Tempe AZ 85287. IN, BP. were shadowed in the inferno and anger of the
Rodney King verdict,” and ends, “This is a hope
Women and War by Jeanne Vickers explores the that demands an active witness. Such a hope can
impact war has on women from Palestine to South only be sustained by the Spirit.” $16.95 pb, 0-88344-
Africa. Women and War is a useful text that 783-5. Orbis Books, Maryknoll NY 10545. IN, BP.
includes many disturbing statistics, like the fact that
“During World War II the Japanese Army forced Janet Geringer Woititz (Adult Children of
Korean women to serve Japanese soldiers as prosti- Alcoholics) has a new book, The Intimacy Struggle,
tutes... among them one [woman who was 16] was which shows readers how to create good relation-
forced to undergo intercourse 10 to 15 times a day, ships with others, to identify myths that cause us to
everyday.” But Vickers goes further than reporting believe we are incapable of having healthy intimate
human rights atrocities; she gives a critical and relationships, to know which questions to ask to
insightful analysis of the very institution of war, find out whether you and your partner have a long-
asking in one chapter, “What Constitutes Security?” term future together, and to be aware of misunder-
The work is reminiscent of Noam Chomsky’s cri- standings that can sabotage relationships. $9.95 pb,
tiques which have unveiled many previously 1-55874-277-8. Health Communications Inc., 3201
unseen truths about imperialism, war, and America. S.W. 15th Street, Deerfield Beach FL 33442. IN.
Volume 16 Number 6 103 March 1994
This content downloaded from
(cid:0)(cid:0)(cid:0)(cid:0)(cid:0)(cid:0)(cid:0)(cid:0)(cid:0)(cid:0)(cid:0)(cid:0)70.126.145.227 on Sat, 19 Mar 2022 18:04:21 UTC(cid:0)(cid:0)(cid:0)(cid:0)(cid:0)(cid:0)(cid:0)(cid:0)(cid:0)(cid:0)(cid:0)(cid:0)(cid:0)
All use subject to https://about.jstor.org/terms","['1-55652-189-8', '0-631-18421-X', '1-55778-438-8', '0-927534-31-2', '0-927534-30-4', '1-55874-277-8']"
106,"Feminist Bookstore News
From the Athene Series, Karen M. Hicks’ Marshall was first published in French in 1966
Surviving the Dalkon Shield IUD: Women v. The ($7.95 pb, 0-8032-8948-0). Four connected stories
Pharmaceutical Industry “chronicles the develop- reveal profound moments during a young girl’s
ment of a contemporary women’s social protest life. Roy has been called the Canadian Willa Cather
movement that arose in response to A.H. Robins because of her adroit use of language. University of
legal efforts to minimize its financial accountability Nebraska Press, 901 N. 17th Street, Lincoln NE
to the women injured by its product.” $17.95 pb, 0- 68588-0520. IN, BP.
8077-6270-9. Teachers College Press, Teachers
College, Columbia University, 1234 Amsterdam
Ave., New York NY 10027.
I'd love to hear Joan Jobe Smith read from her
Two of Canadian writer Gabrielle Roy’s books new book of poems, Jehovah Jukebox. The poems
have recently been translated into English. Street of are strange and captivating, moving and, at times,
Riches translated by Harry Binsse is a collection of magnificently sentimental — a feat difficult to
semi-autobiographical tales ($8.95 pb, 0-8032-8947- accomplish without sounding clichéd. $9.95 pb, 1-
2). The Road Past Altamont translated by Joyce 880391-07-4. Event Horizon Press, PO Box 867,
Desert Hot Springs CA 92240.
POETS & Captivity Tales: Canadians in New York by
WRITERS E abli oz ua tb e t ah C H anay ad iais n a w on mov ae nl ww hri ot t e sen a r i cn h e st h fe o rf i r as nt d person
MAGAZINE finds company in her chaotic new world, New York
City. $14.95 pb, 0-921586-32-9. New Star Books,
...the magazine for 2504 York Avenue, Vancouver BC V6K 1E3. IN.
serious Writers
In response to the increasing numbers of reported
Poets & Writers Magazine cases of sexual abuse and incest, Multiple
readers are literary enthusiasts— Personality and Dissociation: Understanding Incest,
book buyers, writers, editors, reviewers, teachers, and Abuse and MPD by David L. Calof with Mary Leloo
journalists—who rely on us for NEWS about writing. has been published by Parkside Publishing. The
DEADLINES for grants and awards, provocative book, though only 93 small pages, gives very specific
ESSAYS, and HOW-TO articles on getting published. e sx exam uap l l e ts r ao uf m ah . o w 0- 9 t 4o 2 4 2t 1r -e 5a 1t - 5c . li e Pn at rs k s iw dh e,o 2h 0a 5v e W s eu sr tvived
Make Poets & Writers Magazine Touhy Avenue, Park Ridge IL 60068. IN, BP.
one of your top-selling titles! One of the more historic occasions of my life
+ 60% female audience was hearing Margaret Randall read with Audre
Lorde at Trinity College in Connecticut. Walking to
+ A “must-have” magazine for all serious writers the Edge: Essays of Resistance by Margaret
+ Interviews with high-profile writers Randall attests to her vision, her work and, yes, her
+ 88 pages, heavy white stock resistance. In this book she continues to document
+ Bi-monthly, $3.95 cover United States imperialism, the hypocrisy of the
“Poets & Writers Magazine moves very well. We state — and she makes revolution seem palpable.
sell 95% of our copies, and the ser v —ice J c uan d’t i t b he ’s b e a Rt.” oom, NYC $ B1 o2 t o lp pb h, S0 t- .8 , 9 6 B0 o8 s- t3 o9 n7 - 7 M. A S o 0u 2t 1h 1 5 E . n Id N ,P r Be Pss ., 116 Saint
Available through Ingram, DeBoer, Desert Moon, Don Olson, Gossips, Gorgons, & Crones: The Fates of the
Small Changes, Armadillo, Ubiquity, Inland, and Fine Print. Earth by Jane Caputi and introduced by Paula
March 1994 104 Volume 16 Number 6
This content downloaded from
(cid:0)(cid:0)(cid:0)(cid:0)(cid:0)(cid:0)(cid:0)(cid:0)(cid:0)(cid:0)(cid:0)(cid:0)70.126.145.227 on Sat, 19 Mar 2022 18:04:21 UTC(cid:0)(cid:0)(cid:0)(cid:0)(cid:0)(cid:0)(cid:0)(cid:0)(cid:0)(cid:0)(cid:0)(cid:0)(cid:0)
All use subject to https://about.jstor.org/terms","['0-8032-8948-0', '0-921586-32-9']"
107,"Gunn Allen is a feminist investigation into patriar- 89281-494-2. Inner Traditions International, One
chal traditions that have produced nuclear Park Street, Rochester VT 05767. IN, BP.
weapons and the worldwide ecological crisis.
Gossips, Gorgons and Crones are metaphors for the Petra K. Kelly’s Thinking Green! Essays on
earth-centered powers that are resurging and chal- Environmentalism, Feminism, and Nonviolence is
lenging this patriarchal order. Jane Caputi collabo- a posthumous compilation of her speeches and
rated with Mary Daly on Webster's First New writings. A wealth of insight and inspiration, these
Intergalactice Wickedary of the English Dictioary. essays weave together many aspects of Kelly’s
$12.95 pb, 1-879181-05-3. 400 pages, illustrations. vision of Green politics. This book, as well as the
Bear & Company Publishing, PO Box 2860, Santa Fe Green movement in general, is crucial to the com-
NM 87504. IN, BP. ing generations since in many circumstances envi-
romentalism is a spring board for other radical poli-
Women in Brazil by Caipora Women’s Group tics. Thinking Green! will be published on Earth
(Brazilian and German women) is a collaborative Day, April 1994. $18 cl, 0-938077-62-7. Parallax
effort which speaks to the plight of women in con- Praessn, PdO B ox I73N55, B.e rk ele:y, CA 94707. Dist. by BP
temporary Brazil. Chapters include “Rural p
Women,” “Urban Women,” “Women and Racism,”
and “Women and Solidarity.” A decidedly feminist
multi-genred text. Despite the fact that the inside
cover reveals that the book was edited by a man, The African American Review (AAR), a journal
Duncan Green, this looks like a good collection. $10 dedicated to extensive discussion of the cultural
pb, 0-906156- 79-3. Published by Latin American production of African American women, has
Bureau. Dist. by Monthy Review Press, 122 West devoted its Fall 1993 issue exclusively to Black
27th Street, New York NY 10001. IN. women’s culture. It includes an interview with
filmmaker Carmen Coustaut and essays on writers
Reconceiving Women: Separating Motherhood Toni Morrison, Sherley Anne Williams, Toni Cade
From Female Identity by Mardy S. Ireland criticizes Bambara, Gloria Naylor, Harriet Wilson and
the social expectation of motherhood. As Sue Angelina Weld Grimké, as well as poetry by
Halpern in her New York Times’ book review points Monifa Atungaye Love, d. Trinidad hanks, and
out, this expectation “is so pervasive that women Carole Boston Weatherford. AAR is offering a spe-
who do not fulfill this role find themselves having to cial subscription rate of $17.95 for one year.
account for their childlessness to others and to them- Contact: Connie LeComte — Circulations
selves.” Ireland’s text creates a whole new space for Manager, African American Review, Department
thought regarding women who choose not to have of English, Indiana State University, Terre Haute
children. This may well become part of that crucial IN 47809.
selection of books that helps change majority percep-
tion. $16.95 pb. Guilford Publications, 72 Spring The first annual edition of the Directory of
Street, New York NY 10012. IN and BP. ` American Poetry Books has been published. It is
the only reference listing all books of poetry pub-
lished in the United States: almost 900 books from
over 800 poets published by 260 publishers. This
resource is particularly helpful considering that
Virgin, Mother, Crone: Myths & Mysteries of approximately 80% of all books of poetry are pub-
the Triple Coddess by Donna Wilshire contends lished by small publishers; many titles are not listed
that the Goddess is the first deity of humankind. in Books in Print, many don’t have ISBNs, and
This book reconstructs the early pagan religion of many are virtually impossible to find. This directo-
the Earth Mother Goddess. Includes 100 black and ry fills the void. $8.95 pb, 1-55921-099-0. Asphodel
white illustrations and watercolors. $19.95 pb, 0- Press, Kymbolde Way, Wakefield RI 02879. O
105
This content downloaded from
(cid:0)(cid:0)(cid:0)(cid:0)(cid:0)(cid:0)(cid:0)(cid:0)(cid:0)(cid:0)(cid:0)(cid:0)70.126.145.227 on Sat, 19 Mar 2022 18:04:21 UTC(cid:0)(cid:0)(cid:0)(cid:0)(cid:0)(cid:0):56 UTC
All use subject to https://about.jstor.org/terms","['1-879181-05-3', '0-938077-62-7', '1-55921-099-0']"
108,"Two by Katherine Dunham Now in Paperback
A TOUCH OF THE ILLUSION
INNOCENCE OF EQUALITY
A Memoir of Childhood The Rhetoric and Reality
r u. H—“ eA rL an la d n Tga rb s ibts uoo nn erb i Hn ug g hf ea sm , i l Ny e wc h r Yo on ri kcle.” o M Pf a a pD ri ev t ro hr c a e $ 1R A 4ef l .o 9br 5em r t 2s 6o 2n pF ai gn ee sman
Paper $14.95 312 pages
CIVILIZATION FEEDING THE FAMILY
WITHOUT SEXES ISLAND POSSESSED The Social Organization of Caring
R Fe rco an nst cr euc ,t i n 1g 9 G 1e 7n -d 1er 9 2in 7 Postwar A po lop gio yn e oer fi n dg a n w ceo r ak n di n a t h fae s c a inn at th ir no g- Mas a rG joe rn id e e r Le .d D W eVo ar uk lt
M aR boa obr uey tr t L s w o ou e mi xs a ee m n ’i sR n o e rb s oe lr eht sos w in d e pb oa st te -s vd Po ao od pc ou eo. rm e $n 1t 3 . 9o 5n 2H 80ai t i pa an g e spolitics and F i WPlo luar ose mp.w e eo nrr d i n $b y 1 C 2 u C l. ta 9 ut 5 rh ea r i a2n ne 8 d 4 R S . o cpS iet a tim g yeps son
World War I France helped the
s ho oc ri ret oy rs c oo fm e t h t eo G g rr ei ap ts Wwi at rh . the Lives on the Edge
*Paper $18.95 384 pages
Women in Culture and Society sity of postcolonial narrative.”
i i Goodyear. author d
REASON’S MUSE
Sexual Difference and the
Democracy of Exclusion
Geneviève Fraisse
Translated by Jane Marie Todd
F Ino tr re ow do ur cd t i ob ny b C ya t Jha or ai nn e W R . . S S ct oi tm tpson Single Mathe risn atnhse tOhtehira r C hAimlderreinca
rA oln e a il ny sz oi cn ieg ty id ne b liga ht te s o f o tv heer women’s neer full of European fascination Waleria Polskow
claims of the French Revolution, with the mysteries of India. LIVES ON THE EDGE
t i W*nh Pi o s mt ah p es e nt eu hd r iy i n s t o $m Cr u1ya lp 4 t s uo . r9 fa e 5 s m ae n xo 2 dum a 2 le S 2n od ct i i f e po tf yf e a r g ec n er ci ss ei .s AIT RDoOmESan cNeOT DIE S i Vnin a g t ll h ee e r M iO eo t t hh ee Prr os A l aa mn ked r o i wcT aheir Children
Maitreyi Devi “[O]ne of the most remarkable books
NIGHTWORK Tve read in years.”—Rickie Solinger,
Women’s Review of Books
Sexuality, Pleasure, and Corporate Paper $10.95 232 pages
Masculinity in a Tokyo Hostess Club
Anne Allison
Devi read Bengal Nights, the novel
e eD n xcr e aa m w at ii nn a e g h s o s to e hn ss o w cp lu e b ,r s u s Ao clln hisa on l c lw ubo sr k c re ex ap teeri- E l ro el vi sa e pd oe na f sh ef a a d i tr o. f a I Ets lh i ai D do on ee se s d f N ao nou ttt a s D io eif se , t i ah s n e di Dr e avis T CHE H UN II CVE ARSI GTY O OF
*b * APo vn a aipd lae bs r l e a i$ nm 1 co 4 lon . t9 hg 5 w 25h 6i t e p- ac go ell sar men. m Clo ov thin g $ 2 a 2c .5c 0ou n 2t 8 0 o f p a ga e sfirst loye. PRES 5801 South CEhlilciasg o , A Ilvlineonisu e60637
March 1994 106 Volume 16 Number 6
This content downloaded from
(cid:0)(cid:0)(cid:0)(cid:0)(cid:0)(cid:0)(cid:0)(cid:0)(cid:0)(cid:0)(cid:0)(cid:0)70.126.145.227 on Sat, 19 Mar 2022 18:04:21 UTC(cid:0)(cid:0)(cid:0)(cid:0)(cid:0)(cid:0)(cid:0)(cid:0)(cid:0)(cid:0)(cid:0)(cid:0)(cid:0)
All use subject to https://about.jstor.org/terms",[]
109,"FROM
THE
envii ONI
Compiled by Mev Miller though, for those just becoming familiar with the
issues. $16.95 pb, 0-8223-1465-7, June.
Kudos to The Feminist Press (See From Our Own Sex Workers and Sex Work edited by Anne
Presses) at CUNY and Consortium Book Sales and McClintock is a special issue of Social Text. With
Distribution for hearing the concerns about short contributions from clients and commercial sex
discounting from women’s bookstores. As a result, workers, this volume gives an insider's view of the
titles from Feminist Press will no longer be short sex industry and offers some challenging view-
discounted for trade sales (textbook orders will still points to feminism, gender and cultural studies. $8
be short discounted). Trade titles will also be avail- pb, 0-8223-6412-3, April.
able from your favorite wholesalers at trade dis-
counts as well. Be sure to call Consortium or
Feminist Press for a complete list of affected titles A l
and re-order those backlist titles you've let slide
due to short discounts! HARVARD UNIVERSITY PRESS
Engendering China: Women, Culture and the
DUKE UNIVERSITY PRESS State edited by Christina Gilmartin, et al. is the first
Feminism and Postmodernism edited by significant collection of scholarly essays on women
Margaret Ferguson and Jennifer Wicke is yet anoth- in China in more than a decade. For those who do
er collection of essays exploring the agreements and serious studies in Chinese culture; not too appeal-
tensions between contemporary feminist and post- ing to the general reader. $22.95, 40% disc only, pb,
modern theories and practices. It’s a result of a spe- 0-674-25332-9.
cial issue of Boundary 2 which challenges modern For those who have been collecting the series A
feminisms to articulate their inescapable relation to History of Women in the West, there are two new edi-
postmodern societies. (Academic and maybe aggra- tions for the Spring. Volume 1: From Ancient
vating!) $15.95, pb, 0-8223-1488-6. Goddesses to Christian Saints will be available in
paperback ($15.95 pb, 0-674-40369-X) and the
newest volume Volume V: Toward a Cultural
Identity in the Twentieth Century edited by
Those who are committed to revolutionary Francoise Thébaud ($29.95 c], 0-674-40374-6, May).
issues in Latin American nations will want to take a
look at House/Garden/Nation: Space, Gender, and IOWA STATE UNIVERSITY PRESS
Ethnicity in Post-Colonial Latin American Frontierswomen: The Iowa Experience by
Literatures by Women by Ileana Rodriguez, trans- Glenda Riley will be of interest to those in the
lated by Robert Carr. By looking at the works of Midwest or for those who just like to read about the
five Centro-Caribbean women writers, Rodriguez American frontier. By drawing on letters, journals,
explores the issues facing women in highly charged and diaries of Iowa pioneer women, Riley dis-
political and national transitions. Too academic, proves many myths and traditional generalities and
107
This content downloaded from
(cid:0)(cid:0)(cid:0)(cid:0)(cid:0)(cid:0)(cid:0)(cid:0)(cid:0)(cid:0)(cid:0)(cid:0)70.126.145.227 on Sat, 19 Mar 2022 18:04:21 UTC(cid:0)(cid:0)(cid:0)(cid:0)(cid:0)(cid:0)(cid:0)(cid:0)(cid:0)(cid:0)(cid:0)(cid:0)(cid:0)
All use subject to https://about.jstor.org/terms","['0-8223-1465-7', '0-8223-6412-3', '0-674-25332-9', '0-8223-1488-6', '0-674-40369-X', '0-674-40374-6']"
