PageNumber,Text,ISBNs
79,"In April, Ravenmocker by Jean Hager intro- darker and more thoughtful novel than the usual
duces Cherokee Molly Bearpaw, investigator for Kinsey Millhone adventure ($22.95, 0-8050-1936-7,
the Native American Advocacy League. Here she Holt). At the same time, J Is for Judgement will be
looks into the murder of an old man in a nursing issued in paper. In June, Delacorte will publish the
home, with help from a male deputy sheriff. Critics new V.I. Warshawski novel: Tunnel Vision by Sara
agree that this new heroine is “fresh,” “appealing,” Paretsky. In trying to help out a homeless family,
“complex and likeable,” and the New York Times perenially cranky V.I. uncovers a cynical scam at a
said the book was “tightly plotted.” For readers charitable organization for the homeless ($21.95, 0-
who have been looking for a female Tony 385-29932-X). Get your orders in!
Hillerman, this is probably their best bet ($4.99, 0- Also in June we get the paper edition of
446-40107-2, Mysterious Pres/Warner). Mysterious Missing Joseph by Elizabeth George, latest in a
Press will simultaneously publish Hager’s new series of complex and sophisticated British who-
hardcover, second in the series, The Redbird’s Cry. dunits written by an American. They feature the
wonderful team of aristocratic Detective Inspector
Thomas Lynley and working class Sergeant Barbara
Havers. I found this one a little slow (too much
o Lynley, not enough Havers), but it doesn’t matter.
George is right up there with P.D. James and Ruth
Rendell, which makes every one of her books a
The new Jill Smith mystery, Time Expired by boon to booksellers. $5.99, 0-553-56604-0, Bantam.
Susan Dunlap, will be out in paper in April. In this
one Berkeley policewoman Smith investigates a Illustrations by Yani Batteau from the Dyke
wave of crimes against the city’s meter maids. Detector, Paradigm Publishing. O
$4.99, 0-440-21683-4, Dell.
In May, there’s To Live and Die in Dixie by Gay Men's Lit...
Kathy Trocheck, sequel to Every Crooked Nanny, Continued from page 68
which introduced a unique detective: an Atlanta ex- Canada (Bent Books, $9.95 pb, 1-55022-205-8, IN);
cop who now runs a cleaning service. The debut gar- the ISBN for the new edition of the Spartacus
nered some good notice in the mystery world, and I 1994/95 (23rd Edition) International Guide is 3-
can see Why: an intricate, interesting plot; a tart tone, 86187-011-8, due this month at $29.95 (IN); Gay
bordering on bitchy; and funky supporting charac- Men’s Press has new editions also in March of
ters, including the heroine's mother and the racially London Scene 1994 ($10.95 pb, 0-85449-217-8, IN)
mixed crew of cleaners. Also, there was a surprising- and in Apr. of Berlin Scene 1994 ($10.95 pb, 0-
ly serious sub-plot about the heroine’s breast-cancer 85449-217-8, IN).
scare. One assumes we can expect more of the same And a correction: the Gayellow Pages is of
in number two ($4.50, 0-06-109171-5, Harper). course published by Frances Green, who says she is
Number three, Homemade Sin, will be coming in a woman, and can certainly be believed; I had
hardcover from Harper in June. However; for the lumped her thorough guide in with the “published-
real goods on race, class, and domestic work, there’s by-men” category. The new edition, by the way, is
nothing like Blanche on the Lam by Barbara Neely; due at the end of March, and a new edition of the
these look like a sitcom in comparison. New York-area booklet is available in time for the
Sue Grafton’s new Kinsey Millhone mystery trek to Stonewall.
appears as predictably every spring as the first Last issue I slipped in my favorite lesbian title
robin, but we never know when we'll hear from of the bi-month, a humor collection by Garbo; this
Sara Paretsky. This year Grafton and Paretsky will time, I fancy Blue by Denise Ohio, a beautiful,
go head to head (almost)! They have new hardcov- bountiful tale woven from the underclass of
ers coming out only a month apart. In May, Sue America, living the blues and loving each other.
Grafton will unveil K Is for Killer, apparently a McPherson, $12 pb, 0-927901-30-5. O
This content downloaded from
(cid:0)(cid:0)(cid:0)(cid:0)(cid:0)(cid:0)(cid:0)(cid:0)(cid:0)(cid:0)(cid:0)(cid:0)70.126.145.227 on Sat, 19 Mar 2022 18:04:21 UTC(cid:0)(cid:0)(cid:0)(cid:0)(cid:0)(cid:0)(cid:0)(cid:0)(cid:0)(cid:0)(cid:0)(cid:0)(cid:0)
All use subject to https://about.jstor.org/terms","['0-8050-1936-7', '0-553-56604-0', '0-440-21683-4', '1-55022-205-8', '0-85449-217-8', '0-06-109171-5', '0-927901-30-5']"
80,"FARIY
PRING
FLFASES
Staying Home Wednesday Nights
by Elisabeth Nonas by Camarin Grae
The eM mo bll ay r k a en dd o nA l i ax mw ea dn it c a la rb ea gb iy m. e nA l i tx o has Suc cL ey sl sa aB s r a ad s th haw er a pis i s ta , p hr ao s f e ls os ti so n oa fl
Nai Pa .d O. BP oxr e 10s 5s 4, 3 Inc. b u rine dc t io i nlm g e A i l sip x sr u’se e g n e ofa fn f ot . tr ht sM e i ro tl ul y lr i n v ei s si .n s t Tu o hp p et o h r met i o v o re v eer- f w wr a oi r me mn ad n, s g da i en v tid en cg ta , i v w ea co c hn e apd ste ir n hf gu e. rl Wp aa rhr ret enn s te er a d w ah no d's
Talla h (9a 0s 4s )e e , 5 3 F 9-L 5 93 62 5302 ydr ea iv Sr te n an s y intA o gl i x h H a ob v me ec e o t m h tee ais kr, e s t f h o ye r o m um e ro i nr e tli of M e t o hbl el ay ck... q h nu a ige s s h t tti soo n se c hd o e n ’sfa s e s b sa e e t nm h au utr nd foe anr i t hs W fu us ep d l e n c wet s i, d t a hs y h e the
Fa x 1 - ( 89 004 0) - 553 39 3- -9 173 91 73 oh Iwe Sa nr Bt c hNo if ld hp oa or 1den - t a5h no d6o d 2f. a m8It i 0l yw - i l 0ll i f 7ee .v 6ok -e 0 y o ur $10.95 pe Ix i Scc k Bit i Nn hg e r, 1 s oe -ux 5ty 6 o 2J f 8 a d a 0e . - l 0iT n 6h eu 0e pn -. . 4 .t h r $ee 9 .p 9e 5ople
athleen Ual
OY onald NE
Smokey O Kathleen O’Donald Edited Out:
by Celia Cohen by Penny Hayes A Carmen Ramirez Mystery
t coTp l It a pp h ro nu h Slh lr aca ea t ee co k By s yh I kF tf eet i e h N i ne rs'r sn n s tt e gi d osa n r t h e fi rl i a i g eol irc f ol ay trni 1 l oe otn i t e, a a e m -w h.g l d sh at 5e i o .. e nh n p m 6ra o de TTlu be f 2a e . ht h at y n thhh 8c eei t ,T a ie e n 0hg m n h s g gi e h tp -nt ep a r ho ei 0 r qa oc sf er puag ti u 5t ti ldt iae e p as sy 7l e r s l y iie ld r o e t -en i s i. asi nvo .o e 4t vt r.f e g Af a e e l wr d o n o s hfa ft d p f $ o h iow rf ew 9 en et lot t dsh h .o fmh hs s 9.v o e op e . e ee l 5o l Tnl r oL ch wt i r— f e. oe wd. a po wA bw n IK h lr a Se oom haa i s f nt s rt Bs e FC r h eh o igr o o irh f N l e l e o l n ie e a lnc fd he f o ,o a d t sn r wt et . hhie r i r pn 1 c a ee o eI NA m g r y -u r t en eN wT iog 5rs v lln R urh u ,e a ie 6 e nln iw eo o r la 2-s gd af n a t e n M 8n fg oh ,Y d -id Kfa l 0a ao n e h o r d f a r -d ir uy t r gk t s 0S h lo uo t s th lm oel h 7t m iO edC i m r mh e er 0 ' e b yi D e n tt n p a l - h woy td e l n a 1o e p r, r a Ot f y a or ie N e 'sul m D aao t1 dd tt e dmm ro9 $ . u w e i n0 e n u r i 9CE9 a tF s d me t n o. le o .i Y, . dm 9l g pl o oM le o 5htK prafd f rn .e k aa ane dt gt h y, C el , de it ye yn ,... f O mc ay s k IR soc i w Sie nsa ah m la im kl A Bndo sr iN m in st o-i n N e er o l g q si gw dle t m tu d z tts r e a ep oe rib s d k 1a ra s ti e ycsp tt e ii a -b h nowo le s 5 nr e gr a ly u te iry ss m 6hli b . s vc .c a sr i 2. oi e g w a tno d aa r- b 8oL p n rb e yh aro yy e o 0li ao e y u d u s ai -t nt r ca ce f 0a h- o t ld p e o e C oo f 7ai wtp rlt i a h d 7caR k o r d u r e el r m - oa seep . g vn . 9Jna d ea iC d es nt rf ua ,w a lH t lt l . y .r ie e e l $a lm e r ra , o Ss 9m sa yd e b h .wn a i a e d 9a t lt t h tn o hw 5o yoi s oc , h - ok ef ar nd
This content downloaded from
(cid:0)(cid:0)(cid:0)(cid:0)(cid:0)(cid:0)(cid:0)(cid:0)(cid:0)(cid:0)(cid:0)(cid:0)70.126.145.227 on Sat, 19 Mar 2022 18:04:21 UTC(cid:0)(cid:0)(cid:0)(cid:0)(cid:0)(cid:0)(cid:0)(cid:0)(cid:0)(cid:0)(cid:0)(cid:0)(cid:0)
All use subject to https://about.jstor.org/terms",['53 39 3- -9 1']
81,"Compiled by Carol Seajay and a collection of fairytale stories written by a
selection of leading Irish men, called Hairy Tales.
ATTIC PRESS For further information please contact Jo
Attic Press has been at the forefront of Irish pub- O'Donoghue, Acting Editor.
lishing for fifteen years, publishing the best, the Vanessa by Bernadette Leach. The third novel
newest, the most courageous of writing by Irish from the wonderful young adult fiction writer
women and making a strong impact on international Bernadette Leach in our Bright Sparks YA series.
markets. We are particularly proud of this season’s After her summer without mum, Vanessa Carter,
list. Launching Basement Press is one reason, but we heroine of I'm a Vegetarian and Summer Without
are also satisfied that the entire list reflects our com- Mum, faces a damp Cork winter without Damien.
mitment to publishing books which offer entertain- The Kellehers have all moved to Holland. Vanessa
ment, knowledge and fill a gap in the book market. has her female friends, her cats, a troubled elder
Basement Press will publish the brightest and brother, a few ailments and lots and lots of study to
most innovative of Irish writing, fiction and non-fic- cope with in this highly entertaining new install-
tion, by both women and men. Basement books will ment. £4.99, 1- 855940-930.
be fresh, sometimes controversial or radical but
always entertaining, while maintaining the highest
editorial standards. They will appeal to young
book-buyers as well as confirmed readers.
Basement Press is now inviting manuscript sub-
missions and proposals for publication under this
imprint, which will be launched with much
razzmatazz in the late spring of 1994. The first titles
will be a biography of Luke Kelly by Des Geraghty
Bookpeople (BP) and Inland (IN) distribute small press
books to bookstores. “BP” or “IN” at the end of an anno-
tation means that the books are available from that distrib-
utor. Both distributors stock a wide range of titles and
p nu eb wl i s sh te or rs e o of r i dn ot ner 'te s t a l rt eo a d yfe m wi on ri kst wb io to hk s t bo or te hs . d I if st ry ibo uu t oa rr se , a E ag afl N T A Ena asa n.
drop everything and call for catalogs. eah, Swfully Sorry.
Inland Book Company, PO Box 120261, 140 ‘flooded the kkchen and aondry.. still
Commerce St., East Haven CT 06512. Order number: MEPPING UP... can't possibly make dinner Joe.
800-243-0138 (including Canada and Connecticut). Hooked: Young Addiction by Yvonne Ward.
Bookpeople, 7900 Edgewater Dr, Oakland CA 94621. Hooked is an invaluable guide for anyone involved
Phone: 800-999-4650. in the care and education of young adults. The book
79
This content downloaded from
(cid:0)(cid:0)(cid:0)(cid:0)(cid:0)(cid:0)(cid:0)(cid:0)(cid:0)(cid:0)(cid:0)(cid:0)70.126.145.227 on Sat, 19 Mar 2022 18:04:21 UTC(cid:0)(cid:0)(cid:0)(cid:0)(cid:0)(cid:0)(cid:0)(cid:0)(cid:0)(cid:0)(cid:0)(cid:0)(cid:0)
All use subject to https://about.jstor.org/terms",[]
82,"Feminist Bookstore News
looks at young adult addiction, a growing problem died, leaving her a small inheritance and four
in society. Dealing with dependency on solvents, young daughters to raise on her own. Emerging
alcohol, soft drugs and hard drugs, Yvonne Ward, from the Shadow is the story of Sarah Lawrenson
author of the bestseller A Bottle in the Cupboard: and her daughter Lucy, reconstructed by Lucy
Women & Alcohol, examines key issues facing young Kingston's daughter: a story of women indepen-
people and introduces the reader to some young dent and forceful before their time. Sarah bravely
addicts and their stories. The author's clever use of supported her family and herself until her death;
‘real’ young addicts lifts this book from mere refer- Lucy campaigned for the rights of women, justice
ence into a practical guide, completely demystify- and peace from the first decade of the century until
ing young addiction. It examines peer pressures, her death in 1969. She became involved in many
how to interpret the worrying ‘tell-tale’ signs, dif- national and international organizations, from the
ferent types of drug abuse, and treatment and suffrage movement to CND, standing bravely on
counseling. £7.99, 1-855940-825. the world stage against fascism, rearmament and
nuclear weaponry. She also deeply valued her pri-
vate and personal life. Her story, both personal and
political, is full of interest and sadness. Another
Your Good Health: A Woman’s Health piece missing from modern Irish history is added to
Directory by Anne McDevitt. Your Good Health is the jigsaw. This book is a valuable resource for any-
a comprehensive reference book for modern one interested in the contribution of women in his-
women. Easy-to-use and accessible, it presents in tory. £8.99, 1-855940-499, April.
layperson’s language the information you need to From Cabra to New Orleans: The Journey of
stay healthy physically and emotionally. It covers Nora and Alice by Suellen Hoy & Margaret
the symptoms and causes of common areas of ill- MacCurtain. In the autumn of 1889, Nora & Alice,
health among women, the latest forms of successful two eighteen-year-old Kerry women, left the rela-
medical treatment, alternative therapies, social and tive security and familiarity of their Dominican
psychological issues such as alcohol dependency convent boarding school at Cabra in north Dublin.
and depression, and the links between well-being They set off on a journey so far removed from their
and a healthy lifestyle, exercise and care for your daily lives that the resulting diaries recording their
appearance. For women of all ages, everywhere, adventures makes riveting reading. The purpose of
this book is an indispensable companion on the this journey was not to make their fortune, but to
road to a healthier future. £9.99, 1-855940-949. begin a life in religion as Dominican sisters. The
Encore Cuisine by Máirín Uí Chomáin. This is authors are two outstanding historians: Suellen
the second in our bright bilingual cookery book Hoy is an American scholar and Margaret
series, Cuisine le Máirín, from the popular televi- MacCurtain one of Ireland’s leading historians and
sion personality Máirín Uí Chomáin. Encore feminist scholars. She lectures at University College
Cuisine contains more tasty, modern and tradition- Dublin. £8.99, 1-855940-892, April.
al Irish recipes which feature in Máirín’s second TV
series. The dishes, presented by Máirín in an easy-
to-follow manner, make cooking for both everyday
meals and that special occasion a delicious culinary A Dozen LIPs is an exciting and challenging col-
adventure with success guaranteed. £5.99, 1- lection from the provocative LIP Pamphlet series
855940-760, April. from Attic Press. This collection includes:
Emerging from the Shadow: The Lives of Pornography: The New Terrorism; A Kind of Scar:
Sarah Anne Lawrenson and Lucy Olive Kingston The Woman Poet in a National Tradition; Has the
Based on Personal Diaries, 1883-1969 by Daisy Red Flag Fallen? The Fate of Socialism in the 1990s;
Lawrenson Swanton. Sarah Anne Lawrenson was Ancient Wars: Sex and Sexuality; The Politics of
born in County Wicklow in 1855, her daughter Seduction; The Right to Choose: Questions of
Lucy in 1892. At the end of that year her husband Feminist Morality; Ireland Between the First and
This content downloaded from
(cid:0)(cid:0)(cid:0)(cid:0)(cid:0)(cid:0)(cid:0)(cid:0)(cid:0)(cid:0)(cid:0)(cid:0)70.126.145.227 on Sat, 19 Mar 2022 18:04:21 UTC(cid:0)(cid:0)(cid:0)(cid:0)(cid:0)(cid:0)(cid:0)(cid:0)(cid:0)(cid:0)(cid:0)(cid:0)(cid:0)
All use subject to https://about.jstor.org/terms",[]
83,"Feminist Bookstore News
Third World; From Cathleen to Anorexia: The cartoonists Erika Lopez and Joan Hilty, journalists
Breakdown of Irelands; Sex and Nation: Women in Masha Gessen and Achy Obejas, humorist Kris
Irish Culture and Politics; Glass Slippers and Tough Kovick, Nancy Drew wannabe Mabel Maney (The
Bargains: Women, Men and Power; The Missing Case of the Not-So-Nice Nurse, Cleis Prss), and more!
Sex: Putting Women in Irish History; and Repulsing $12.95 pb, 0-939416-80-8; $29.95 cl, 0-939416-79-4.
Racism: Reflections on Racism and the Irish. A Dagger: On Butch Women edited by Lily
Dozen LIPs reflects the very best debates on con- Burana, Roxxie, Linnea Due. Dagger is an anthem
temporary issues and controversies, by Irish women to butch women, a fearless collection of stories and
writers, thinkers and activists. £16.99, 1-855940-604. art, essays and interviews by butches (and the
Attic Press, 4 Upper Mount Street, Dublin 2, women who love them). Says Leslie Feinberg,
Ireland. Distributed in the U.S. by Inland. author of Stone Butch Blues, “Looking for a simple
— Maeve Kneafsey, Attic Press one-dimensional view of butch lives and loves?
SV Keep looking. Dagger is a down and dirty discus-
CALYX s SZ sion of butch diversity.” Dagger is an adventure in
genderbending, a lavishly illustrated book featur-
The first book of poetry by an indigenous ing provocative voices on sexuality: Pat Califia,
Hawaiian to be published on the North American Carol A. Queen, Susie Bright, Jeanne Cordova,
continent, Light in the Crevice Never Seen is a rev- JoAnn Loulan, SDiane Bogus, Donna Minkowitz,
elation about a Native woman's love for her land
and the inconsolable grief and rage that come from
its destruction. Ms. Trask reveals the tender beauty
her ancestral home, Hawai'i, gives back to the peo-
ple of the land, enabling them to continue their oA
f gi rg ah cet f uf lo r p o s eu tr v wiv ha ol . w“I a s a d bm ori nre w t ih ti hs ef yer eso c i ao nu ds han ed art of aCu a (e TN e ylil C P r esss3es!
fire.” — Joy Harjo. Includes: Hawaiian glossary, #27:
pronunciation key, and introduction by Eleanor
Wilner. $9.95 pb, 0-934971-37-4; $19.95 cl, -38-2.
Calyx Books, PO Box B, Corvallis OR 97339.
Distributed by Consortium, IN, and BP. — Calyx Books = A Journal of Ideas
CLEIS PRESS A groundbreaking
Girlfriend Number One: Lesbian Life in the 90s and visually stunning
edited by Robin Stevens. Girlfriend Number One is ocvoerl l e7c0 t Liaotnin a oarft is twsork by (
a generously illustrated, lavishly designed gift book and writers.
for the lesbian of the 90s. Forget Chanel No. 5. Give 812x11
her Girlfriend Number One! Girlfriend Number 116 pa g $e 8s .00
One is a night out at Red Dora's, the San Francsico
c fa of ue n dw h ener te h u l se is ab stia icn aw udri it ee nr cs e s a n od f lh iu km e-o mr ii nst ds e d h a gv ie rl- sei d SeEu bUs.cSr.,i p taido dn s :S L6 $ 2 p7o/s4At a gises/u4e s Ai sisnudeisv).i d uCalalss ,s i c$ 3a b8a/c4k i sisssu ueess Si nalsstoi tE uatviaoinla sb le(o ut-eE
friends raised on feminism, television and bad
music. Novelists Carla Tomaso and Mary Wings,
Volume 16 Number 6 81 March 1994
This content downloaded from
(cid:0)(cid:0)(cid:0)(cid:0)(cid:0)(cid:0)(cid:0)(cid:0)(cid:0)(cid:0)(cid:0)(cid:0)70.126.145.227 on Sat, 19 Mar 2022 18:04:21 UTC(cid:0)(cid:0)(cid:0)(cid:0)(cid:0)(cid:0)(cid:0)(cid:0)(cid:0)(cid:0)(cid:0)(cid:0)(cid:0)
All use subject to https://about.jstor.org/terms","['0-939416-80-8', '0-939416-79-4', '0-934971-37-4']"
84,"Feminist Bookstore News
Cherry Smythe, Achy Obejas, Julie Tolentino, Jenni of in-depth answers to the top 100 qustions about
Olson, Jackie Weltman, Diane DiMassa, Andrea toys and techniques asked by customers at Good
Natalie, Joan Hilty, Trina Robbins, and more. Plus Vibrations. The Good Vibrations Guide to Sex is
gorgeous, hot photographs by Phyllis Christopher, for all readers — gay, straight, young, old, novices,
Della Grace, Morgan Gwenwald and Jill Posener. old-timers, singles, partnered, multi-partnered, the
$14.95 pb, 0-939416-82-4; $29.95 cl, 0-939416-81-6. physically challenged, the transgendered, terminal-
Dirty Weekend: A Novel of Revenge by Helen ly hip and sexually jaded, to name a few... $16.95
Zahavi. Helen Zahavi’s Dirty Weekend is the novel pb, 0-939416-84-0; $29.95 cl, 0-939416-83-2.
Bret Easton Ellis didn’t have the guts to write. Cleis Press, PO Box 8933, Pittsburgh PA 15221.
Unlike American Psycho, Dirty Weekend is the real Inbook, IN, BP, Ingram, Baker & Taylor.
thing — a dark and brilliant novel of revenge by a
new author who “writes rings around longtime
practitioners of the psychological thriller.” N — Cleis Press
(Publishers Weekly). San Francisco's Old Wives Tales
Bookstore has a waiting list for Dirty Weekend. CLOTHESPIN FEVER PRESS
Your customers will line up for Helen Zahavi’s Shitkickers and Other Texas Stories on Audio
“fatally attractive way with murderous words.” read by the author, Carolyn Weathers. “One of the
(Sunday Tibune). $10.95 pb, 0-939416-85-9. best lesbian bar scenes I have ever read,” — Lee
Lynch. But to hear her read it is the real treat. $16.96
included book and two cassettes, 1-878533-19-3.
Lunch: A Lesbian Novel by Randi Shalet.
The Good Vibrations Guide to Sex: How to Sarah's in another bad relationship, this time with
Have Safe, Fun Sex in the 90s... by Cathy Winks her straight artist friend, Jane. Last year it was Sky,
and Anne Semans. Tips and techniques from the the unemployed alcoholic. Finding happiness
folks who run America’s favorite sex toy store! The shouldn't be so difficult. After all, she’s not asking
Good Vibrations Guide to Sex offers advice, for much, just love, a baby, and a little hot sex.
instruction, definitions, illustration, anecdotes, and Sarah’s searching for the perfect relationship.
validation for a variety of sexual interests and activ- Reading Lunch will take you on her path of self-
ities — courtesy of two women who have been discovery. Set in Jamaica Plain, Boston’s lesbian
asked a lot of questions about sex! Think of The stronghold, it’s pertinent, it’s well-written, it’s
Good Vibrations Guide to Sex as a compendium funny. $10.95 pb, 1-878533-15-0, April.
IRAVEL:;
Search For European Goddesses: )
China: U.N. July 16-Aug.2, 1994 (18 Days) RN nN
Aug.21-Sept. 4, 1995 (15 days)
BOOKS:
Readings for Older Woman
Women’s History:
Sappho /Hypatia / Mary Wollstonecraft/
Deborah Sampson/E. Goldman/ Eliz.G. Flynn ..12.95 HOT FLASH PRESS
Goddesses, Witches, and the Paradigm Shift: P.0. Box 21586
Dramatic Readings ....................... 14.95 San Jose, CA.
Memorial Services For Women ............. 8.95 95151
Readings For Women’s Programs ......... 6.95 (488) 292-1172
(add $3. p/h: 8% CA. tax) Meg Bowman
March 1994 82
Volume 16 Number 6
This content downloaded from
(cid:0)(cid:0)(cid:0)(cid:0)(cid:0)(cid:0)(cid:0)(cid:0)(cid:0)(cid:0)(cid:0)(cid:0)70.126.145.227 on Sat, 19 Mar 2022 18:04:21 UTC(cid:0)(cid:0)(cid:0)(cid:0)(cid:0)(cid:0)(cid:0)(cid:0)(cid:0)(cid:0)(cid:0)(cid:0)(cid:0)
All use subject to https://about.jstor.org/terms","['0-939416-82-4', '0-939416-81-6', '0-939416-84-0', '0-939416-83-2', '0-939416-85-9', '1-878533-19-3', '1-878533-15-0']"
