PageNumber,Text,ISBNs
43,"Feminist Bookstore News
A Short List
Several issues ago a feminist bookseller asked for a and interesting for lay audiences as well as acade-
list of books on transgender issues. Genanne Walsh, the mics. $12.95, 0-89789-115-5. Bergin & Garvey
new book reviewer and coordinator at Good Vibrations, Publishers.
reMspondaedn byy sen di ngt uhs tahe n folklowisng! b ib lio—graphCy.S From Female to Male: The Life of Jack Bee
Garland by Louis Sullivan. The true story of a late
19th century female-to-male transsexual, who lived
Compiled by Genanne Walsh as a man for forty years. $8.95, 1-55583-150-8.
As the term “transgender” appears more fre- Alyson Publications.
quently, its specific meaning becomes more cloudy.
Often confusingly clumped along with “transves-
tite” and “transsexual,” “transgenderist” originally
referred to someone who lived the life of the oppo-
site sex, While remaining anatomically in their orig-
inal gender. “Transvestite” is generally used to
refer to cross-dressers, and “transsexual” to people
who have undergone some type of medical proce-
dure (from hormone injections to surgery) in order
to anatomically change to a different gender. Now,
in its loosest form, “transgender” can refer to any-
one who plays with their gender or bends gender
roles, much as the word “queer” has been claimed
by a spectrum to people who don’t fall within tradi-
tional heterosexual or homosexual boundaries.
As with many sexually-related terms, these
words mean different things to different people — Suzo Hickey
it’s best not to assume the meaning until you know
how itis defined by each individual or author! Information for the Female to Male by Lou
The following publications are the most inter- Sullivan. An illustrated handbook for the female to
estiings wse'veu seeen osf w.h at litt:le is available on these male crossdressers or Transsexuals. Includes info
on passing, hormones, and sex-reassignment. 134
pages. $8.95. 25% bookstore discount. Ingersoll
NON-FICTION Gender Center, 1812 E. Madison St. #106, Seattle
In Search of Eve: Transsexual Rites of Passage WA 98122. 206-329-6651.
by Anne Bolin. An anthropological study focusing Transvestites and Transsexuals: Toward a
on sixteen male-to-female transsexuals. Intended Theory of Cross-Gender Behavior by Richard R.
Volume 16 Number 6 41 March 1994
This content downloaded from
(cid:0)(cid:0)(cid:0)(cid:0)(cid:0)(cid:0)(cid:0)(cid:0)(cid:0)(cid:0)(cid:0)(cid:0)70.126.145.227 on Sat, 19 Mar 2022 18:04:21 UTC(cid:0)(cid:0)(cid:0)(cid:0)(cid:0)(cid:0)(cid:0)(cid:0)(cid:0)(cid:0)(cid:0)(cid:0)(cid:0)
All use subject to https://about.jstor.org/terms","['0-89789-115-5', '1-55583-150-8']"
44,"Feminist Bookstore News
Docter. An academic, sociological study. 0-306- FICTION
42878-4. Plenum Press. Stone Butch Blues by Leslie Feinberg is a novel
The Transexual’s Survival Guide: Transition that describes growing up differently gendered in
and Beyond by JoAnn Altman Stringer. A sensitive blue-collar America in the 50s, coming out butch in
handbook written by a transsexual woman, cover- the bars and factories of the prefeminist 60s, and
ing issues from gender identity to legal concerns. deciding to pass as a man for survival when left
Creative Design Services, PO Box 1263, King of without work or community in the early 70s. $10.95
Prussia PA 19406. pb, 1- 56341-029-X. Firebrand Books.
Transformations: Crossdressers and Those Sacred Country, a novel by the widely respect-
Who Love Them by Mariette Pathy Allen. ed British novelist Rose Tremain that begins on the
Photographs of transvestites and transgenderists. day in 1952 that six-year-old Mary Ward realizes
Includes statements by the subjects. $24.95, 0-525- that she is a boy, not a girl, and that it is her destiny
24820-X. Dutton. to be a man. The novel follows Mary/Martin to
Art and Illusion: A Guide to Crossdressing by London, through mastectomies and hysterectomy,
JoAnn Roberts. Listed in Books in Print, not seen. and the decision to live as a man but to not proceed
$10.00, 1-880715-01-5. Creative Design Services. with further surgery. What is troubling about this
Speaking as a Woman by Alison Laing. Listed novel is Mary’s complete (and contrived?) isolation
in Books in Print, not seen. $8.00, 1-880715-03-1. from anything feminist, despite her involvement in
Creative Design Services. the London anti-war networks of the 70s, and the
Uninvited Dilemma: A Question of Gender by very odd portrayal of the sole lesbian she encoun-
Kim E. Stuart. A socially-aware series of interviews ters in that same, movement London. Other than
with transsexuals. $12.95, 1-55552-013-8. Metamor- that, Mrs. Lincoln, it’s an excellent and fascinating
phous Press. novel. $21.00 cl, 0-689-12170-9. Published in the U.S.
Les Espionnes by Bettina Rheims. Erotic black by Atheneum.
and white photos of male-to-female transsexuals. 3-
929078-06-6. Idea Book Distributors, Nieuwe MORE TITLES OF INTEREST:
Herengracht 11, 1011 RK Amsterdam, Netherlands. TranSisters: The Journal of Transsexual Feminism,
$3. 33% bookstore discount for 5+. Order from
‘ZINES AND QUARTERLIES TransSisters, 4004 Troost Ave., Kansas City MO 64110.
TNT: Transsexual News Telegraph. A political- Conundrum, an autobiography by well known
ly left gender publication. 584 Castro St. #288, San and widely read travel writer Jan Morris who is
Francisco CA 94114-2588. also a male to female transsexual. $8.95 pb, 0-8050-
Chrysalis Quarterly. Has a reputation as a 0361-4. Holt.
respectable, reputable publication. AEGIS, PO Box My Story by Carolyn Cossey offers this model’s
33724, Decatur GA 30033. autobiography. $12.95, 0-571-12909-9. Faber & Faber.
Tapestry. A useful listing of world-wide gender Gender Bending: Confronting the Limits of
groups and resources. Includes personals. IFGE, PO Duality by Holly Devor. $12.95, 0-253-20533-6.
Box 367, Wayland MA 01778. Indiana University Press.
Cross-Talk. News and commentary, how-to Transgender Liberation: A Movement Whose
columns, feature articles, events calendar, etc. PO Time Has Come by Leslie Feinberg. $2.50 pam-
Box 944, Woodland Hills CA 91365-0944. phlet, 0-89567-105-0. World View Forum. (Inland.)
Vested Interest: Cross Dressing and Cultural
Once we started working on this list, everyone got Anxiety by Majorie Garber. $17.50, 0-06-097524-5.
into the act and had a few more books to suggest... We HarperCollins.
started with a couple of fiction titles, then a few others Nine Lives: The Autobiography of Erica
that also seemed appropriate... You know how it goes! Rutherford. $12.95, 0-921556-36-5. Ragweed/ gynergy.
Thtanks,i aloso, tno A Dsiffe.ren t L ight—-SF for CfurtheSr sugges- Myths of Gender by Anne Fausto-Sterling. $14,
0-465-04792-0. Basic Books (HarperCollins). O
March 1994
This content downloaded from
(cid:0)(cid:0)(cid:0)(cid:0)(cid:0)(cid:0)(cid:0)(cid:0)(cid:0)(cid:0)(cid:0)(cid:0)70.126.145.227 on Sat, 19 Mar 2022 18:04:21 UTC(cid:0)(cid:0)(cid:0)(cid:0)(cid:0)(cid:0)(cid:0)(cid:0)(cid:0)(cid:0)(cid:0)(cid:0)(cid:0)
All use subject to https://about.jstor.org/terms","['1-880715-01-5', '1-880715-03-1', '1-55552-013-8', '0-689-12170-9', '0-571-12909-9', '0-253-20533-6', '0-89567-105-0', '0-06-097524-5', '0-921556-36-5', '0-465-04792-0']"
45,"Feminist Bookstore News
N
O9 goo G S 000 9 9
By Carol Seajay Supporters, including Lesbian Avengers, have
joined them at the camp.
The exciting story as we go to press is that Reno ordered an FBI investigation last month
Attorney General Janet Reno has decided that it is and is convinced that the threat of violence is real.
the business of the Justice Department to intervene The Justice Department intervention, as we go to
in the harassment of the lesbians at Camp Sister press, takes the form of two mediators from the
Spirit in Ovett, Mississippi. This is the first time Department's Community Relations Service who
that the Justice Department has addressed a lesbian will work to resolve the situation and ease tensions.
or gay harassment situation. How effective they can be remains to be seen. It is
Camp Sister Spirit was started by Wanda and difficult to trust that the FBI, or even a Justice
Brenda Henson, the lesbian couple who started Department under Reno, can be allies to lesbians
Southern Wild Sisters, in Gulfport, Mississippi in committed to overthrowing all forms of patriarchal
the mid-eighties. They and their friends then started violence and injustice.
a regional women’s music festival, Sister Spirit, and Do
eventually raised enough money to buy land to give s 9
the festival a permanent home: Camp Sister Spirit.
And yet the world changes. Sandi Torkildson
someone removed a returned-with-address-correc- (A Room of One's Own/Madison) was just nomi-
tion copy of their newsletter from their mailbox. nated for a seat on ABA’s Board of Directors. (See
Three-hundred and fifty people turned out at a News for more information.) Gilda Bruckman
meeting organized by local Baptist clergy “to get (New Words/Boston) has recently joined the New
rid of the lesbians.” Harassment escalated and England Booksellers Association's Board. Kasha
included leaving a dead dog on the mailbox, threats Songer (The Book Garden /Denver) is the Vice
(including one delivered by mail — a federal crime, President of The Mountains and Plains Booksellers
hence the federal intervention) and more. Association. The ABA Board just approved a PR
0) program to fulfill the education program in the
national media that was mandated by Jennie Boyd
O O ooo Bull’s (Thirtyfirst Street/Baltimore) motion at the
The Hensons refused to leave and refused to ABA membership meeting last year. Look for
compromise the commitments of the feminist camp details at the convention this year. Even in the book
which also includes workshops on sexual harass- industry, the world looks a little different than it
ment, abuse, and women’s legal rights. They went did a year ago.
public with the harassment, put out the word that Part of that responsiveness, unfortunately, is
they needed help, got stories in every major gay due to the effects of the explosion of superstores.
newspaper and in the straight news media, went on While bookstore sales are up nationwide, it’s clear
Donahue and other talk shows, and used it all as a that it’s the chains and the superstores that are get-
way to say “No, we will not be intimidated.” ting that growth and siphoning sales away from
This content downloaded from
(cid:0)(cid:0)(cid:0)(cid:0)(cid:0)(cid:0)(cid:0)(cid:0)(cid:0)(cid:0)(cid:0)(cid:0)70.126.145.227 on Sat, 19 Mar 2022 18:04:21 UTC(cid:0)(cid:0)(cid:0)(cid:0)(cid:0)(cid:0)(cid:0)(cid:0)(cid:0)(cid:0)(cid:0)(cid:0)(cid:0)
All use subject to https://about.jstor.org/terms",[]
46,"every other kind of bookstore already in existence. erate America, an article in a January New York
No one seems to be collecting good statistics but Times indicates that Time Inc. Ventures, the division
what I'm seeing is a lot of 10-20% dips in sales at of Time Inc. (Time Warner) that develops new mag-
both general and specialty stores when the super- azines, is looking into the possibility of starting -a
stores and/or discounters move in. Goodbye hard- publication aimed at gay and lesbian readers. The
cover sales. Goodbye to a fringe of customers who proposal comes from Maer Roshan (recently editor-
let the temptation of discount dictate their politics in-chief of QW) and is one of five or six magazine
and their purchasing. And attracting new cus- proposals currently being considered. Time Inc.
tomers — always one of the most expensive parts of Ventures has provided $25,000 in seed money and
bookselling — is doubly difficult on a playing field management expertise toward developing a proto-
built on a 15% slant... type. Speculation includes visions of a gay New
9) Republic or a gay Rolling Stone with a cross-over
audience and mainstream, corporate advertising. A
O 9 o00 test issue could be on the stands by early fall if
Full marks to ABA's Newswire, though, for their Time decides to go ahead with the project. There's
January 31 coverage of the Women’s National Book another mind-boggling thought: gay identity as
Association Forum on the implications of super- constructed by corporate investment.
stores on the bookselling industry. Quoting forum Meanwhile, back at the real gay magazines, Out
participants, Newswire reported, “Asking attendees has just announced that its circ figures now exceeds
to ‘draw their own conclusions,’ [Jim] Milliot [busi- The Advocate readership by 35%. Out claims a distri-
ness and finance editor for Publishers Weekly] point- bution of 100,662; the Advocate claims 65,007.
ed out that the six major chains showed a combined Turns out that some of the African American
sales gain of 16 percent for the first nine months of booksellers feel the same way about Black History
1993, while the entire retail bookstore segment Month events that many gay and feminist book-
gained six percent.” What a relief after all those sellers feel about National Lesbian and Gay Book
cheery “sales are up” stories that fail to address the Month. I've read “It’s Black History Month here
question of “for whom?” and the financial reports every month” quotes in half a dozen places this
that document the growth of super store sales with- year. I was surprised by the PW reporter who com-
out addressing the question of where those sales mented that gay bookstores and women’s book-
are coming from. What a difference it makes to stores don’t seem to feel that way about Gay and
have these figures in a context that makes sense! Lesbian Book Month and Women’s History Month
More! More! More!
indic I an te sc a tse h a ty o tu h ew e sr ixe mwo an jod re r cin hg ai, n st h —e s Cam roe w nr ,eport o 2 O7 )o 0 AN
Encore, Books-A-Million, Barnes and Noble, respectively. But the fact is that gay (and lesbian
Waldenbooks, and Borders — now have an estimat- and feminist) booksellers often do feel that way
ed 350 stores. Their combined sales were nearly about NG&LBM, but I was hard put to think of
$275 million in 1991, $540 million in 1992, and 1993 feminist booksellers making that comment about
sales are estimated at $1 billion. Women’s History Month. Am I missing something
While we're doing superstore stats, word is that here, or is the difference that no one has tried to
Borders, which currently operates about 45 stores, commodify Women’s History Month? Are women
expects to add 20-25 new stores in 1994. Its parent being neglected here — or should we rejoice that
corporation the Borders-Waldenbooks Group, we're not (yet) being ripped-off? Or both?
which also operates about 1325 Waldenbooks Either my e-mail is unplugged or there hasn't
stores, plans to close 187 “underperforming units” been much (bad) news from the Canada Customs
in 1994. front recently. Maybe they're waiting for our ABA
And for all of us that still can’t believe that the issue to pull the next big stunt? The good news is that
gay/lesbian market is truly of interest to conglom- Diane DiMassa took Hothead to Canada and did a
44
This content downloaded from
(cid:0)(cid:0)(cid:0)(cid:0)(cid:0)(cid:0)(cid:0)(cid:0)(cid:0)(cid:0)(cid:0)(cid:0)70.126.145.227 on Sat, 19 Mar 2022 18:04:21 UTC(cid:0)(cid:0)(cid:0)(cid:0)(cid:0)(cid:0)(cid:0)(cid:0)(cid:0)(cid:0)(cid:0)(cid:0)(cid:0)
All use subject to https://about.jstor.org/terms",[]
47,"Feminist Bookstore News
benefit for the Little Sisters defence fund at “Lost Women Writers” ...
L'Androgyne in November. Wouldn't it be great if Continued from page 31
every author and every publisher whose books have
been detained at Canada Customs would do a bene- stories), and Zora Neale Hurston, among others.
fit somewhere in the U.S. to raise money to help pay We did not even have effective bookstore distribu-
for the legal costs that Canadian bookstores tion until relatively late in the 1970s. In the first few
encounter when Customs decides to detain our years of the 1980s, we also published neglected fic-
books! Now that would raise some consciousness tion by such living authors as Paule Marshall, Sarah
and a lot of money — and could help fund Little E. Wright, and Meridel Le Sueur.
Sisters’ challenge to Canada Customs in a big way! We see our job as different from that of most
feminist presses interested in fine literature: We do
97 A not publish first novels or “new” fiction or poetry
o O ooo or drama. We also do not remainder. Our process
allows us to claim that the fiction we publish is
Speaking of ignoble government acts: the tran- “classic” and thus should remain in print forever.
scripts of the Clarence Thomas hearings are now Just as Jane Austen's and Virginia Woolf's novels
available. Four volumes cover the 11-day hearings are basic texts on literature shelves, so should one,
and include opening statements of committee mem- in the 1990s, be able to find Elizabeth Stuart Phelps,
bers, materials submitted for and against the nomi- Helen Hull, Josephine Johnson, June Arnold, Ilona
nation, conversational exchanges among committee Karmel, Moa Matinson, Elizabeth Robins, Dorothy
members, and testimonies from witnesses, includ- West, Mary Austin, Frances Ellen Watkins Harper,
ing Anita Hill’s testimony. All four volumes are just to name a few in addition to those I've already
titled Nomination of Judge Clarence Thomas to be named.
Associate Justice of the Supreme Court of the United All through the 1980s and into the 1990s, other
States, Hearings: Pt. 1 covers Sept. 10, 11, 12, 13, and presses have also been following the lead of The
16, stock number 052-070-06893-1, $20. Pt. 2 covers Feminist Press and publishing “lost” women writ-
Sept. 17 and 19, stock number 06894-9, $33. Pt. 3 ers, both living and dead. These books, too, are
essential, if our daughters and their daughters are
11, 12, and 13 and contains Anita Hill's testimony, to continue to live in a society that values and
stock number -06896-5, $32. Order the part you esteems women writers. It is not an accident that
want. Prepayment by check, money order or Toni Morrison won the Nobel Prize for literature in
VISA /MasterCard. Order from Superintendent of 1994: Nearly twenty years ago, she was helping us
Documents, PO Box 371954, Pittsburgh PA 15220. raise the $9,000 we needed to publish I Love Myself
Ready for some movie tie-in news? Naiad just When I Am Laughing... And Then Again When I Am
sold Salmonberries to the Book of the Month Club. Looking Mean and Impressive, a Zora Neale Hurston
Naiad has also just signed a novel/video deal with Reader edited by Alice Walker. We need to remem-
Dancing Arrow Productions (Mindy Kaplan and ber that in 1964, literature professors like me and
Arlene Battishill) for a project called Devotion. “A writers like Toni Morrison and Alice Walker had
delightful plot about a standup lesbian comedian never heard of Zora Neale Hurston. We need to
and her long-term partner/lover on the verge of the remember also that almost all of the African
big breakthrough to mainstream when an ex-lover American women writers we know of now were
reappears just in time to throw a monkey wrench either also totally unknown or out-of-print.
into everything. What’s different about this one is The only way to avoid repeating history is not
the assumption of a long-term relationship that sur- only to know it but to teach it to others.
vives. It promises good humor and a well-written
script.” Scheduled release date is February 1995. Florence Howe was one of the founders of The
Nfaiaidl mis stiilnl hgop in g t thhati sNi gh tswouodm Barm wiell rbe.g in © Feominfist Pr ests inh 19e70 an d P is rthe e Pusblisshe.r an d ODirector
Volume 16 Number 6 45 March 1994
This content downloaded from
(cid:0)(cid:0)(cid:0)(cid:0)(cid:0)(cid:0)(cid:0)(cid:0)(cid:0)(cid:0)(cid:0)(cid:0)70.126.145.227 on Sat, 19 Mar 2022 18:04:21 UTC(cid:0)(cid:0)(cid:0)(cid:0)(cid:0)(cid:0)(cid:0)(cid:0)(cid:0)(cid:0)(cid:0)(cid:0)(cid:0)
All use subject to https://about.jstor.org/terms",['2-070-06893-1']
48,"Feminist Bookstore News
Broken Nuptials in
Shakespeare*’s Plays
Carol Thomas Neely
“Demonstrates the central and provocative position
of marriage at the intersection of the affective
and the political. . . . Important not only for the
contribution it makes to our understanding of
Shakespeare but for the work it enables and pro-
vokes."" — Claire McEachern, Shakespeare Studies.
Paper, $14.95
Transformations of Circe
The History of an Enchantress
Judith Yarnall
Circe first appears in Homer's Odyssey, where
she acts as the Hero's lover and guide—and
transforms men into swine. The Circe myth has
since served as a magnet for what writers of
different eras have had to say about the relation-
ship of sexuality, with all of its possibilities for
vulnerability and power, to human nature as a whole.
Illus. Cloth, $39.95; Paper, $14.95
Discrimination by Design
Feminist Perspectives on
Gender and Music A Feminist Critique of the
Man-Made Environment
Edited by Susan C. Cook and Judy S. Tsou
Leslie Kanes Weisman
Foreword by Susan McCleary
In this pathbreaking volume, some of the best- O tu ht es t a Sn tud din yg o B fo o Hk u, m G anus t Rav igu hs t sM y ine r s t h C e e n Ut ne ir t e df o r States
known scholars in the newly emerging field of
feminist musicology explore how gender has “A fast-moving, insightful, politically astute
helped shape genres and works of music and and upfront feminist examination of the power
how music has contributed to prevailing notions struggles involved in building and controlling
of gender. The musical subjects come mainly space."" — Joni Seager, Women's Review of Books
from Europe and North America and include Illus. Cloth, $24.95; Paper, $11.95
both instrumental and vocal concert music and
the vernacular genres of ballads, salon music, Order toll free 800/545-4703
and contemporary African-American rap.
Cloth, $34.95; Paper, $12.95 University of Illinois Press
1325 South Oak Street e Champaign, IL 61820
March 1994 Volume 16 Number 6
This content downloaded from
(cid:0)(cid:0)(cid:0)(cid:0)(cid:0)(cid:0)(cid:0)(cid:0)(cid:0)(cid:0)(cid:0)(cid:0)70.126.145.227 on Sat, 19 Mar 2022 18:04:21 UTC(cid:0)(cid:0)(cid:0)(cid:0)(cid:0)(cid:0)(cid:0)(cid:0)(cid:0)(cid:0)(cid:0)(cid:0)(cid:0)
All use subject to https://about.jstor.org/terms",[]
49,"Feminist Bookstore News
as a ISANE EAE EEEa
Compiled by Dawn L. Martin Scarlet Press of London, England has just
reprinted another 2,000 copies of The Midwife’s Tale:
The Feminist Press has sent two titles back to An Oral History From Handywoman to Professional
press. Daughter of Earth by Agnes Smedley, with an Midwife by Nicky Leap and Billie Hunter.
introduction by Alice Walker is a perennial best- Elaine Mickels’ Just Lucky I Guess will be pub-
seller with over 60,000 copies sold since their first lished in March with an additional 20 pages. This
printing in 1973! It has gone back to press for an “New & Expanded Edition” will be published by
additional 5,000 copies. The Living is Easy by Desert Crone Press and distributed by Bookpeople
Dorothy West has also gone back to press for 4,000 and Inland.
copies, with a total of 8,500 sold. Bookstores and
associations on the East Coast have renewed their Foreign Rights
interest in this important African American writer Seal Press has sold Alma Rose by Edith Forbes to
from the 40s by hosting readings, signings, and Rohwalt in Germany through Mohrbooks. A Killing
honorary celebrations. Cure by Ellen Hart was sold to Frauenoffensive in
Germany through Mohrbooks. She’s A Rebel: The
W History of Women in Rock & Roll was sold to Argument
a in Germany by Mohrbooks and Trouble in Transylvania
by Barbara Wilson went to Virago in England.
New Victoria Publishers sold the German lan-
Magic, third in the Stoner McTavish mystery series guage rights for Hers Was The Sky by ReBecca
by Sarah Dreher back to press in November for its Béguin and Tell Me What You Like by Kate Allen to
third printing. It now has a new cover, and the Argument Verland in Germany.
price has gone up to $9.95.
The Seal Press went back to press with 4,000
copies of You Don't Have To Take It! A Woman's
Guide to Confronting Emotional Abuse at Work (trade
paper) by Ginny NiCarthy, Naomi Gottlieb and
Sandra Coffman, which brings the total number in
print to 12,500. Its first printing sold out`in two
weeks! Seal also sent Trouble in Transylvania (cloth)
by Barbara Wilson back to press. Their first printing
was 6,000 and the second was 2,000.
Two Cleis titles went back to press at the close
of 1993. Daughters of Darkness: Lesbian Vampire Awards & Nominees
Stories edited by Pam Keesey sold its first printing E. Annie Proulx has been awarded the National
of 5,000 copies in 10 weeks, and 5,000 more were Book Award for Fiction for her novel The Shipping News.
printed in December. Hothead Paisan: Homicidal Among those nominated for the National Book
Lesbian Terrorist by Diane DiMassa went back for a Critics Circle's Most Distinguished Books of 1993
second printing of 5,000. Continued on page 52
Volume 16 Number 6 47 March 1994
This content downloaded from
(cid:0)(cid:0)(cid:0)(cid:0)(cid:0)(cid:0)(cid:0)(cid:0)(cid:0)(cid:0)(cid:0)(cid:0)70.126.145.227 on Sat, 19 Mar 2022 18:04:21 UTC(cid:0)(cid:0)(cid:0)(cid:0)(cid:0)(cid:0)(cid:0)(cid:0)(cid:0)(cid:0)(cid:0)(cid:0)(cid:0)
All use subject to https://about.jstor.org/terms",[]
