ISBN,Title,Author,Publisher,Pages,Date Published,Subjects,Binding,Synopsis,Language,Edition,Dimensions,MSRP,Image,Status,PageNumber,Volume & Issue
0-8139-1605-4,"Nineteenth-Century Women Learn to Write (Feminist Issues : Practice, Politics, Theory)","Hobbs, Catherine",Univ of Virginia Pr,343,1995,"Women--Education--History, Women--Education--United States--History--19th century, Literacy--History, Literacy--United States--History--19th century, Feminist theory, Feminist theory--United States, LC1757 .N56 1995, 376/.973",Hardcover,"Introduction : Cultures And Practices Of U.s. Women's Literacy / Catherine Hobbs -- Conduct Books For Women, 1830-1860 : A Rationale For Women's Conduct And Domestic Role In America / Jane E. Rose -- In An Atmosphere Of Peril : College Women And Their Writing / Vickie Ricks -- The Voice, Pen And Influence Of Our Women Are Abroad In The Land : Women And The Illinois State Normal University, 1857-1899 / Sandra D. Harmon -- Let Us Strive Earnestly To Value Education Aright : Cherokee Female Seminarians As Leaders Of A Changing Culture / Devon A. Mihesuah -- His Religion And Hers In Nineteenth-century Hymnody / June Hadden Hobbs -- Writing In Circles : Harriet Beecher Stowe, The Semi-colon Club, And The Construction Of Women's Authorship / Nicole Tonkovich -- Literacy As Tool For Social Action Among Nineteenth-century African American Women / Shirley Wilson Logan -- Mothers, Daughters, Diaries : Literacy, Relationship, And Cultural Context / Judy Nolte Temple And Suzanne L. Bunkers -- Women And The Western Military Frontier : Elizabeth Bacon Custer / Maryan Wherry -- Cultural Models Of Womanhood And Female Education : Practices Of Colonization And Resistance / P. Joy Rouse -- Silks, Congress Gaiters, And Rhetoric : A Butler University Graduate Of 1860 Tells Her Story / Heidemarie Z. Weidner -- Radcliffe Responses To Harvard Rhetoric : An Absurdly Stiff Way Of Thinking / Sue Carter Simmons -- A Toast To Jerusha Jane Jones / [mary Ashmun] -- Is John Smarter Than I? By Jerusha Jane Jones (rockford Seminary Magazine, 1875) / [julia Lathrop?] -- Afterword : Revealing The Ties That Bind? / Joann Campbell. Edited With An Introduction By Catherine Hobbs. Includes Bibliographical References (p. 313-332) And Index.",en,1,"Height: 10 Inches, Length: 7 Inches, Weight: 0.1 Pounds, Width: 1.5 Inches",0,https://images.isbndb.com/covers/60/57/9780813916057.jpg,Success,100,18.5
0-684-82388-8,Allí donde el mar recuerda,"Benitez, Sandra",Touchstone,160,4/3/1996,,Paperback,,es,,"Height: 8 Inches, Length: 5 Inches, Weight: 0.39903669422 Pounds, Width: 0.4 Inches",12.95,https://images.isbndb.com/covers/38/81/9780684823881.jpg,Success,112,18.5
0-918949-84-X,If I Had My Life to Live Over I Would Pick More Daisies (Large Print Edition),"Martz, Sandra",Papier-Mache Press,236,1/1/2010,"Women Authors - Literature Anthologies, American Literature Anthologies",Paperback,"<p>This companion volume to the award-winning anthology, When I Am an Old Woman I Shall Wear Purple, illuminates the experiences of women, young and old, reflecting on the choices they have made. In these stories and poems we see how women's alternatives are both extended and limited by personal belief systems, ethnic and cultural identity, class and economic status, age, and gender. Whether exploring significant public events or small private choices, these word portraits resonate with authenticity and meaning.</p>",en,LRG,"Height: 9.2098241 Inches, Length: 7.4098277 Inches, Weight: 1.2 Pounds, Width: 0.66999866 Inches",1.99,https://images.isbndb.com/covers/98/44/9780918949844.jpg,Success,76,18.5
0-87422-106-4,Iron in Her Soul: Elizabeth Gurley Flynn and the American Left,"Camp, Helen C.",Washington State Univ Pr,396,1995,"Flynn, Elizabeth Gurley, Industrial Workers of the World., Communists, Communists--United States--Biography, Women labor leaders, Women labor leaders--United States--Biography, HX84.F5 C36 1995, 335/.0092 B",Paperback,"In 1906, speaking from a homemade soapbox near Times Square, 16-year-old Elizabeth Gurley Flynn stopped traffic on a Saturday night. Broadway producer David Belasco became so impressed he wanted to put her on stage. But she told him, 'I'm in the labor movement and I speak my own piece.' And for more than 50 years this fiery American radical truly did speak her own piece, crossing and recrossing the United States, crusading for her brand of humane socialism. As the only woman leader of the Industrial Workers of the World she organized immigrant factory workers in the East, iron ore miners on Minnesota's Mesabi Range, and lumberjacks in the Northwest. She became a founding member of the American Civil Liberties Union; joined the American Communist Party and in 1961 became the first woman to chair the party. Arrested more than a dozen times for exercising her right to free speech, she was a natural victim of McCarthyism, serving a three-year prison sentence in the 1950s. After more than a decade of research, Helen C. Camp has produced the first full-length biography of the most notable American radical of the twentieth century.",en,F First Paperback Edition Used,"Height: 9.25 Inches, Length: 6.25 Inches, Weight: 1.54984970186 Pounds, Width: 1.25 Inches",21.21,https://images.isbndb.com/covers/10/60/9780874221060.jpg,Success,100,18.5
0-8195-6286-6,Moving Toward Life: Five Decades of Transformational Dance,"Halprin, Anna",Wesleyan University Press,298,10/15/1995,"Halprin, Anna, Dancers, Dancers--United States--Biography, Modern dance, Dance therapy, GV1785.H267 A3 1995, 792.8/028 B",Paperback,"The Halprin Life/art Process: Theory, History, And Practice -- Introduction / Sally Banes. Three Decades Of Transformative Dance, Interview By Nancy Stark Smith (1989). The Marin County Dance Co-operatives Teaching Dance To Children (1949-1957). Movement Ritual I (1975). Life/art Workshop Processes (1974). My Experience Of Cancer (1993) -- The Work In Community -- Introduction / Janice Ross. Yvonne Rainer Interviews Ann Halprin (1965). What And How I Believe -- Stories And Scores From The '60s (1968). Community Art As Life Process: The Story Of The San Francisco Dancers' Workshop (1973). Mutual Creation (1968). Ceremony Of Us, Interview Erika Munk (1969). Instructions To Performers: Ceremony Of Us (1969). Microcosm In Movement / James T. Burns. A Report On Citydance 1977 (1978) -- Leaning Into Ritual -- Introduction / Rachel Kaplan. After Improv, Interview By Nancy Stark Smith (1987). Moving Toward Life: A Dance Series For People Challenging Life-threatening Illness (1994). Earth Dances: The Body Responds To Nature's Rhythms (1994). Planetary Dance (1990). The Earth Run From Circle The Earth (1978). Circle The Earth: A Philosophy (1986). Anna Halprin: A Life In Ritual, Interview By Richard Schechner (1990) -- Founding And Development: Dancers' Workshop / Tamalpa Institute -- Chronology: Anna Halprin, San Francisco Dancers' Workshop, And Tamalpa Institute. Anna Halprin ; Edited By Rachel Kaplan. Includes Bibliographical References And Index.",en,Illustrated,"Height: 10 Inches, Length: 7 Inches, Weight: 1.39 Pounds, Width: 0.75 Inches",22.92,https://images.isbndb.com/covers/28/69/9780819562869.jpg,Success,100,18.5
0-684-81528-1,The End of Alice: A Novel,"Homes, A.M.",Scribner,272,3/4/1996,"Prisoners--Fiction, Murderers--Fiction, Child molesters--Fiction, PS3558.O448 E53 1996, 813/.54",Hardcover,"A Teenage Vamp Enters Into A Bizarre Correspondence With A Jailed Killer. He Writes Her How He Raped And Murdered A Girl She Knew, She Describes How She Scores, Seducing A Much Younger Boy Along With His Father. A Study Of Perversion. By The Author Of A Country Of Mothers. A.m. Homes.",en,First Edition,"Height: 9.25 Inches, Length: 6 Inches, Weight: 0.95 Pounds, Width: 1.25 Inches",0,https://images.isbndb.com/covers/52/82/9780684815282.jpg,Success,112,18.5
1-55110-375-3,Women of the Klondike,"Backhouse, Frances",Graphic Arts Center Publishing Company,211,10/1/1995,"Women pioneers--History, Women pioneers--Yukon--Klondike River Valley--History, Gold miners--History, Gold miners--Yukon--Klondike River Valley--History, Women gold miners--History, Women gold miners--Yukon--Klondike River Valley--History, Gold discoveries, F1095.K5 .B34 1995, 971.9/1",Paperback,"Here Are The Stories Of Those Fascinatingly Diverse Women -- Entrepreneurs, Domestics, Nuns, Doctors, Nurses, And Journalists -- Who Played A Critical Role In The Klondike Gold Rush At The Turn Of The Century. Foreword / Pierre Berton -- Preface -- Acknowledgments -- First Woman Of The Klondike -- Women On The Gold Rush Trail -- Loyal Wives And Hopeful Spinsters -- Ministering To The Wants Of Helpless Masculinity -- Come And Do A Shuffle With Me, Sam -- Hunting For Souls In The Gold Fields -- New Woman In The North -- With Shovel And Gold Pan -- Doing The Klondike -- Woman Holds The Field -- Notes -- Selected Bibliography -- Photograph Credits -- Index -- About The Author. Frances Backhouse ; [edited By Elaine Jones]. Includes Bibliographical References (p. 194-204) And Index.",en,Later Printing,"Height: 8.99 Inches, Length: 6 Inches, Weight: 0.75 Pounds, Width: 0.7 Inches",0,https://images.isbndb.com/covers/37/54/9781551103754.jpg,Success,65,18.5
0-932727-75-1,Voices from Within,"Gillespie, Patricia, Mathews, Mary",Hope Pub House,136,1994,"Women in Christianity, BV639.W7 G55 1994, 270.8/2/082",Paperback,Patricia Gillespie & Mary Mathews. A Project Of The Institute For Ecumenical And Cultural Research.,en,English Language,"Height: 8.5 Inches, Length: 5.75 Inches, Width: 0.5 Inches",11.95,https://images.isbndb.com/covers/77/56/9780932727756.jpg,Success,89,18.5
0-921368-59-3,"Fashion, Power, Guilt and the Charity of Families","Shields, Carol",Blizzard Pub Ltd,64,1995,"Families--Drama, PR9199.3.S514 F37 1995, 812/.54",Paperback,[carol Shields And Catherine Shields]. Errata Sheet Tipped In.,en,First Edition,"Height: 8.75 Inches, Length: 5.5 Inches, Weight: 0.220462262 pounds, Width: 0.25 Inches",10.95,https://images.isbndb.com/covers/85/95/9780921368595.jpg,Success,64,18.5
0-8144-0305-0,"Straight Talk About Gays in the Workplace: Creating an Inclusive, Productive Environment for Everyone in Your Organization","Winfeld, Liz, Spielman, Susan",AMACOM,208,11/2/1995,,Hardcover,"Straight Talk About Gays In The Workplace Is Also A Very Personal Book, Filled With Stories And Interviews With Real People Working At Real Companies. These Tales Illustrate The Frustrations Of Being Gay At An Indifferent Or Hostile Company And The Energizing Effects Of Working For An Inclusive One. Straight Talk About Gays In The Workplace Provides Insights And Practical Advice For Everyone In Your Company, And It Has Specific Help For Managers And Human Resources Professionals. The Book Shows How To Create A Harassment-free, Inclusive Workplace That Recognizes The Rights And Answers The Concerns Of All Employees; Design And Deliver Sexual-orientation Education For All Employees; Develop An Aids/hiv Educational Program That Can Save Lives; And Implement Domestic Partner Benefits Programs (with Detailed Information On Costs, Tax Issues, How To Overcome Objections, And Why These Benefits Are So Important To Gay Employees). Gays Are A Significant Portion Of Our Diverse Workforce. In Its Powerful Discussion Of Both Human And Organizational Needs, Straight Talk About Gays In The Workplace Will Expand Your Understanding Of This Diversity, And Help Build A Safe, Equitable, And Productive Climate - For Everyone. 1. Issues Of Sexual Orientation At Work: Problem Or Opportunity? -- 2. Homophobia And Heterosexism Facts And Myths -- 3. The Choice Is Yours: Strategies For An Inclusive Workplace -- 4. Hiding And Coming Out: Personal And Workplace Productivity Issues -- 5. Designing And Delivering Sexual Orientation Education -- 6. The Ins And Outs Of Domestic Partner Benefits -- 7. Hiv/aids: Workplace Policies And Education -- 8. There's No Such Thing As A Stupid Question -- 9. True Stories: People And Companies That Have Been There -- Appendix I: Supplementary Information On Domestic Partner Benefits -- Appendix Ii: Aids Testing, Resources, And Policies. Liz Winfeld And Susan Spielman. Includes Bibliographical References (p. 206-208) And Index.",en,English Language,"Height: 9.5 Inches, Length: 6 Inches, Weight: 1.10231131 Pounds, Width: 0.75 Inches",21.95,https://images.isbndb.com/covers/30/51/9780814403051.jpg,Success,70,18.5
1-56280-116-3,The Color of Winter,"Shapiro, Lisa",Oxford Univ Pr,201,1999,,Paperback,"In a world that glorifies the mind but stifles the spirit, two women struggle to live life on their own terms.",en,First Edition,"Height: 9 Inches, Length: 5.75 Inches, Weight: 0.55 Pounds, Width: 0.75 Inches",10.95,https://images.isbndb.com/covers/11/68/9781562801168.jpg,Success,79,18.5
0-89087-769-6,The New Older Woman: A Dialogue for the Coming Century,"Downs, Peggy, Tuttle, Ilene",Celestial Arts,196,8/1/1995,,Paperback,Peggy Downes ... [et Al].,en,,"Height: 9.25 Inches, Length: 6.25 Inches, Weight: 0.75 Pounds, Width: 0.75 Inches",12.95,https://images.isbndb.com/covers/76/92/9780890877692.jpg,Success,84,18.5
0-553-09605-2,Riding Shotgun,"Brown, Rita Mae",Bantam,341,3/1/1996,"Time travel, Time travel--Fiction, Fox hunting, Fox hunting--Fiction, History, PS3552.R698 R53 1996, 813/.54",Hardcover,"In The Course Of A Fox Hunt, Cig Blackwood, A Young Widow In Virginia, Is Informed That Her Husband Had An Affair With Her Sister. So Shocked Is She By The News, She Becomes Disoriented And Loses Her Way. She Emerges Back In 1699 Virginia, Where She Meets Her Colonial Ancestors And Falls In Love. By The Author Of Venus Envy. Rita Mae Brown.",en,,"Height: 9.75 Inches, Length: 6.5 Inches, Weight: 1.34922904344 Pounds, Width: 1.5 Inches",22.95,https://images.isbndb.com/covers/60/57/9780553096057.jpg,Success,102,18.5
0-304-33764-1,Unspoken Rules: Sexual Orientation and Women's Human Rights,International Gay and Lesbian Human Rights Commission,UNKNO,257,1996,"Gay rights, Gay liberation movement, Women's rights, HQ75.5 .U57 1996, 323.3/2643",Paperback,"This Courageous And Groundbreaking Book Documents Human Rights Violations Against Women In 30 Countries Around The World And Discusses The Strategies That Lesbian Activists And Other Human Rights Advocates Have Employed To Challenge Such Oppression. Placing Lesbian Rights Within The Framework Of The Broader Struggle For Women's Human Rights, This Book Demonstrates How Women's Rights And Lesbian Rights Are Linked In Substantive Ways. Both Issues Highlight How Human Rights Distinctions Between The Private And Public, As Well As Reluctance To Address Female Sexuality, Have Perpetuated Violations Of Women And Kept Them Invisible. Furthermore, The Defence Of Lesbian Rights Is Integral To The Defence Of Women's Right To Determine Their Own Sexuality, To Work At The Jobs They Prefer And To Live As They Choose With Women, Men, Children Or Alone. Homophobia, It Is Argued, Is Used As A Tool To Keep Women In Line And Force Them To Accept Their Society's Assigned Gender Roles And Limitations.--book Jacket. Foreword / Charlotte Bunch -- Introduction / Rachel Rosenbloom -- Argentina / Alejandra Sarda -- Austria / Barbara Frohlich -- Brazil / Miriam Martinho -- Britain / Anya Palmer -- Canada / Cynthia Petersen -- Colombia / Elsa Rondon -- Estonia / Lilian Kotter -- Germany / Alexandra Duda And Maren Wuch -- Hong Kong / Anson Mak, Ken Hui, Joanne Poone And Mary Ann King -- India / Cath -- Israel / Haya Shalom -- Japan / Sachiko Ishino And Naeko Wakabayashi -- Jordan / Akhadar Assfar -- Malaysia / Rais Nur -- Mexico / Gloria Careaga Perez And Patria Jimenez -- Netherlands / Astrid Mattijssen, Mirjam Turksma And Ineke De Vries -- Nicaragua / Maria Bolt Gonzalez -- Norway / Gro Lindstad -- Philippines / Malu S. Marin -- Poland / Joanna Garnier -- Romania / Ingrid Baciu, Vera Cimpeanu And Mona Nicoara -- Russia / Masha Gessen -- Serbia / Jelica Todosijevic -- South Africa / Karin Koen And Patricia Terry -- Spain / Mili Hernandez -- Thailand / Kanokwan Tarawan -- Turkey / Deniz Kilic And Gaye Uncu -- United States / Shannon Minter -- Uruguay / Ana Martinez -- Zimbabwe / Bev Clark -- App. A. Petition -- App. B. Asia/pacific Statement -- App. C. Latin America/caribbean Statement -- App. D. Iglhrc, Ilis And Nclr Statement -- App. E. Ilga Statement. Edited By Rachel Rosenbloom ; With A Foreword By Charlotte Bunch. International Gay And Lesbian Human Rights Commission In Partnership With Abigale, South Africa .... Includes Bibliographical References.",en,First Edition,"Height: 8.75 Inches, Length: 5.5 Inches, Weight: 0.96782933018 Pounds, Width: 1 Inches",34.95,https://images.isbndb.com/covers/76/44/9780304337644.jpg,Success,31,18.5
0-253-20992-7,In Other Words,"Cardinal, Marie",Indiana University Press,216,6/1/1995,"InterviewsCardinal, Marie, PQ2663.A7 A9313 1995, 848/.91403",Paperback,"<p>""... the reader can expect an exciting and in-depth insight into the authors life, learning as they go."" — Waterfront</p>
<p>This English translation of Autrement dit presents conversations between writers Marie Cardinal and Annie LeClerc, interspersed with Cardinal's richly descriptive musings on her psychoanalysis. Their conversation is a vivid example of gender-marked writing; it takes up the issues of écriture féminine, rifts within French feminism, rape, and marriage.</p>",en,,"Height: 8.45 Inches, Length: 5.53 Inches, Weight: 0.7054792384 Pounds, Width: 0.73 Inches",12.95,https://images.isbndb.com/covers/99/24/9780253209924.jpg,Success,46,18.5
0-06-251169-6,The Lesbian Pillow Book,,Harper San Francisco,64,1995,,Hardcover,,en,,"Height: 5.75 Inches, Length: 4.5 Inches, Weight: 0.29982867632 Pounds, Width: 0.5 Inches",8,https://images.isbndb.com/covers/16/90/9780062511690.jpg,Success,109,18.5
0-06-092689-9,A Different Kind of Listening: My Psychoanalysis and Its Shadow,"Chernin, Kim",Perennial,256,1996,,Paperback,,en,,"Height: 8 Inches, Length: 5.25 Inches, Weight: 0.45 Pounds, Width: 0.75 Inches",0,https://images.isbndb.com/covers/68/92/9780060926892.jpg,Success,107,18.5
0-06-430983-5,Art Talk: Conversations With 15 Women Artists,"Nemser, Cindy",Routledge,368,1/23/1996,,Paperback,"<p>interviews With 15 Important Women Artists Reveal Insights On Art And Feminism In A Book That Fills An Important Gap In Contemporary Art Critical Scholarship (howard Conant, New York University). This Revised Edition Features 3 New Artists.</p>",en,1,"Height: 9.01573 Inches, Length: 5.98424 Inches, Weight: 1.74 Pounds, Width: 0.8200771 Inches",46.11,https://images.isbndb.com/covers/98/37/9780064309837.jpg,Success,107,18.5
0-86358-179-X,Framing Feminism: Art and the Women's Movement 1970-1985,,Pandora Pr,360,1987,"Social Sciences, Feminism & Feminist Theory",Paperback,,en,,"Height: 9.75 Inches, Length: 7.5 Inches, Weight: 1.433004703 Pounds, Width: 0.75 Inches",21.5,https://images.isbndb.com/covers/17/93/9780863581793.jpg,Success,67,18.5
0-312-85701-2,Thin Moon and Cold Mist (Women of the West),"Gear, Kathleen O'Neal",Forge,380,1995,"Fiction, Romance, Fiction Subjects",Hardcover,"The privileged bride of a Virginia military man, Robin Heatherton is a spy for the Confederacy. Disguised as a young boy, she infiltrates Yankee forces during the Battle of the Wilderness, but when her cover is compromised, she is forced to crawl through mud and gore, past the dead, to reach her own lines with vital intelligence. Her husband dead at the hands of the Yankees, Robin flees into the untamed reaches of the Colorado Territory. There she'll try to work a gold-mining claim - helped only by a gruff, handsome Union veteran with no respect for women. She's going to teach him some.... Unless Major Thomas Corley, a Union officer determined to find her and have her tried for espionage, manages to put a noose around her pretty neck.                        <p>After completing a near fatal spy mission for the Confederacy, Robin Heatherton flees with her five-year-old son into the untamed reaches of Colorado Territory, where she tries to work a gold-mining claim--helped only by Union veteran Garrison Parkerwho has no respect for women. She'll teach him some, unless Corey, a man set on revenge against her, finds her first.</p>",en,First Edition,"Height: 9.5 Inches, Length: 6.25 Inches, Weight: 1.55 Pounds, Width: 1 Inches",1.99,https://images.isbndb.com/covers/70/11/9780312857011.jpg,Success,113,18.5
1-56023-071-1,Lesbian Social Services: Research Issues,"Tully, Carol",Routledge,90,10/3/1995,,Paperback,"This book examines state-of-the-art, methodological issues and ethical dilemmas associated with conducting research with lesbians. Lesbians are often overlooked or under-represented in both academic research and popular literature, as they suffer from the double discrimination of both homophobia and sexism. An extremely valuable addition to the field, Lesbian Social Services is an insightful guide for scholars and researchers, providing pragmatic ideas and support for those wishing to conduct social science research using lesbian samples. It also shows how to identify other areas in which research is needed. 
<p>Lesbian Social Services is conceptualized around major topics of a research study—literature review, methodology, and professional implications. Chapters include:</p>
<ul>
<li>a literature review of research conducted about lesbians and lesbianism from 1950—1990</li>
<li>an examination of single-subject design use for evaluating psychotherapy with lesbians and gay men</li>
<li>an exploration of the feminist participatory model for studying partner abuse in lesbian relationships</li>
<li>methodological issues associated with conducting research with older lesbians</li>
<li>an analysis of ethical dilemmas associated with conducting research in lesbian communities</li>
<li>fusion and conflict resolution in lesbian relationships
<p>Each chapter contains an excellent reference list to help the novice and the experienced scholar continue the development of research that provides valid and reliable data on and about lesbians. Social Services for Lesbians is an ideal resource for professionals and upper-level students in the fields of social work, counseling, psychology, psychiatry, and mental health.</p>
</li>
</ul>",en,1,"Height: 8.75 Inches, Length: 6 Inches, Weight: 0.35053499658 Pounds, Width: 0.25 Inches",24.95,https://images.isbndb.com/covers/07/17/9781560230717.jpg,Success,88,18.5
0-312-14059-2,A Delicate Fire: Quotations on Lesbian Love,,St Martins Pr,86,1996,,Hardcover,Edited And With An Introduction By Liz Tracey. A Stonewall Inn Book.,en,First Edition,"Height: 6.5 Inches, Length: 4.5 Inches, Weight: 0.3527396192 Pounds, Width: 0.5 Inches",11,https://images.isbndb.com/covers/05/95/9780312140595.jpg,Success,109,18.5
0-312-14059-2,A Delicate Fire: Quotations on Lesbian Love,,St Martins Pr,86,1996,,Hardcover,Edited And With An Introduction By Liz Tracey. A Stonewall Inn Book.,en,First Edition,"Height: 6.5 Inches, Length: 4.5 Inches, Weight: 0.3527396192 Pounds, Width: 0.5 Inches",11,https://images.isbndb.com/covers/05/95/9780312140595.jpg,Success,111,18.5
1-56455-327-2,Harriet Lerner on Anger,"Lerner, Harriet G.","Sounds True, Incorporated",,9/1/1995,,Audio Cassette,,en,abridged edition,"Height: 7.15 Inches, Length: 4.5 Inches, Weight: 0.20062065842 Pounds, Width: 0.75 Inches",10.95,https://images.isbndb.com/covers/32/70/9781564553270.jpg,Success,54,18.5
0-465-09833-9,In Defense Of Affirmative Action,"Bergmann, Barbara R.",Basic Books,224,3/21/1996,"Affirmative action programs, Affirmative action programs--United States, Minorities--Employment--Government policy, Minorities--Employment--Government policy--United States, HF5549.5.A34 B47 1996, 331.13/3/0973",Hardcover,Thinking About Affirmative Action -- Is Discrimination A Thing Of The Past -- How Exclusion Occurs -- Goals: Splitting The Pie -- Thinking About Fairness -- Does Affirmative Action Hurt Its Intended Beneficiaries? -- Opinions Pro And Con -- Alternatives To Affirmative Action. Barbara R. Bergmann. A New Republic Book. Includes Bibliographical References (p. 181-197) And Index.,en,First Edition,"Height: 8.75 Inches, Length: 6 Inches, Weight: 3 Pounds, Width: 1 Inches",0,https://images.isbndb.com/covers/83/30/9780465098330.jpg,Success,107,18.5
