ISBN,Title,Author,Publisher,Pages,Date Published,Subjects,Binding,Synopsis,Language,Edition,Dimensions,MSRP,Image,Status,PageNumber,Volume & Issue
0-452-26817-6,Ceremonies : Prose and Poetry,"Hemphill, Essex",Plume,192,6/1/1992,"African American gays--Literary collections, Gay men--Literary collections, PS3558.E47925 C47 1992, 811/.54",Paperback,"Ceremonies Offers Provocative Commentary On Highly Charged Topics Such As Robert Mapplethorpe's Photographs Of African-american Men, Feminism Among Men, And Aids In The Black Community. American Hero -- Heavy Breathing -- Visiting Hours -- Civil Servant -- Voices -- For My Own Protection. When My Brother Fell -- Fixin' Things -- Does Your Mama Know About Me? -- Miss Emily's Grandson Won't Hush His Mouth -- Commitments -- If Freud Had Been A Neurotic Colored Woman : Reading Dr. Frances Cress Welsing -- Loyalty. Rights And Permissions -- Object Lessons -- Invitations All Around -- The Occupied Territories -- Without Comment -- Song For Rapunzel -- The Tomb Of Sorrow. -- So Many Dreams -- Ceremonies. Family Jewels -- If I Simply Wanted Status, I'd Wear Calvin Klein -- To Be Real -- Soft Targets -- Cordon Negro -- In An Afternoon Light -- Black Machismo -- To Some Supposed Brothers -- Gardenias -- I Want To Talk About You. Selections From Earth Life. Pressing Flats -- If His Name Were Mandingo -- Black Beans -- Homocide -- Better Days. Selections From Conditions. Le Salon -- Under Certain Circumstances -- Where Seed Falls -- O Tell Me, Brutus -- Now We Think -- Balloons -- Isn't It Funny -- The Edge -- Between Pathos And Seduction -- Heavy Corners -- Equus -- Romance Is Intrigue -- American Wedding -- In The Life. Essex Hemphill.",en,,"Height: 5 Inches, Length: 7 Inches, Weight: 0.3968320716 Pounds, Width: 1 Inches",10,https://images.isbndb.com/covers/81/73/9780452268173.jpg,Success,73,18.5
0-8156-2668-1,"Faith and Freedom: Women’s Human Rights in the Muslim World (Gender, Culture, and Politics in the Middle East)","Afkhami, Mahnaz",Syracuse University Press,244,7/1/1995,,Paperback,,en,1,"Height: 8.999982 Inches, Length: 5.999988 Inches, Weight: 0.62611282408 Pounds, Width: 0.75999848 Inches",19.95,https://images.isbndb.com/covers/66/88/9780815626688.jpg,Success,96,18.5
0-9641907-0-2,101 Super Uses for Tampon Applicators,"Katz PhD, Dr Lori, Katz",Sourcebooks,128,2/1/1995,"Business &amp; Economics, Management",Paperback,,en,First Edition,"Height: 6 Inches, Length: 6 Inches, Weight: 0.24912235606 Pounds, Width: 0.31 Inches",9.95,https://images.isbndb.com/covers/07/02/9780964190702.jpg,Success,57,18.5
1-56280-133-3,1st Impressions: A Cassidy James Mystery,"Calloway, Kate",Naiad Pr,198,1996,"Fiction, General",Paperback,,en,First Edition,"Height: 8.75 Inches, Length: 5.5 Inches, Weight: 0.53 Pounds, Width: 0.5 Inches",11.95,https://images.isbndb.com/covers/13/35/9781562801335.jpg,Success,75,18.5
0-8144-0217-8,Voices of Diversity: Real People Talk About Problems and Solutions in a Workplace Where Everyone Is Not Alike,"Blank, Renee, Slipp, Sandra",AMACOM,224,8/29/1994,,Hardcover,"<p>""The ideal of a harmonious and diverse workplace has been given much lip service, but the daily realities of working with people who are not like you have proven to be difficult.</p>
<p>Featuring ""voices"" (actual comments from members of diverse groups), this book reveals how individuals feel about their treatment and their relationships on the job. By listening to the ""voices,"" readers will learn to understand what it means to be ""the other"" and so improve communication, morale, and productivity.</p>
<p>The range covered is extraordinary: African-Americans, Asian-Americans, Latinos, recent immigrants, disabled workers, gays and lesbians, young and old workers, women, white males. For each group, the book provides: (1) background on the culture and values of that group (2) honest comments from members of the group and a synthesis of the group's most common problems (3) typical scenarios where supervisors and co-workers from diverse groups often hit communication barriers (4) explanations of what went wrong in each situation and how to correct it</p>
<p>Many people want to communicate with others, but don't know how. Voices will help them understand diversity not as an academic concept, but as a human reality.""</p>",en,1,"Height: 9.5 Inches, Length: 6 Inches, Weight: 1.08908357428 Pounds, Width: 1 Inches",24.95,https://images.isbndb.com/covers/21/77/9780814402177.jpg,Success,71,18.5
0-7011-2679-5,Vera Brittain: A Life,"Berry, Paul;Bostridge, Mark",Chatto & Windus,566,1995,"Brittain, Vera , 1893-1970, Women authors, English, Women authors, English--20th century--Biography, 828.91209",Hardcover,Paul Berry And Mark Bostridge. Includes Index. Bibliography: P. 565-569.,en,First Edition,"Height: 9.75 Inches, Length: 6.5 Inches, Weight: 2.2156457331 Pounds, Width: 1.75 Inches",1.99,https://images.isbndb.com/covers/67/97/9780701126797.jpg,Success,77,18.5
0-312-14054-1,"Tongue Fu!: Deflect, Disarm, & Diffuse Any Verbal Conflict","Horn, Sam",St. Martin's Press,256,1/15/1996,,Hardcover,,en,First Edition,"Height: 8.75 Inches, Length: 5.75 Inches, Weight: 0.89948602896 Pounds, Width: 1 Inches",22.95,https://images.isbndb.com/covers/05/40/9780312140540.jpg,Success,111,18.5
1-895449-38-3,Blow the moon out,"McCrosky, Judy",Thistledown Press,108,1995,,Paperback,,en,First Edition,,0,https://images.isbndb.com/covers/93/89/9781895449389.jpg,Success,65,18.5
0-89793-194-7,"Women, Sex and Desire: Understanding Your Sexuality at Every Stage of Life","Davis, Elizabeth",Hunter House,216,9/1/1995,"Social Sciences, General",Paperback,,en,US ed.,"Height: 8.5 Inches, Length: 5.5 Inches, Weight: 0.70106999316 Pounds, Width: 0.49 Inches",1.99,https://images.isbndb.com/covers/19/46/9780897931946.jpg,Success,86,18.5
0-88727-222-3,The Butcher's Wife and Other Stories,"Li, Ang",Cheng & Tsui Co,245,9/1/1995,,Paperback,,en,First Edition,"Height: 8.75 Inches, Length: 5.75 Inches, Weight: 0.7 Pounds, Width: 0.75 Inches",29.99,https://images.isbndb.com/covers/22/26/9780887272226.jpg,Success,89,18.5
0-684-80221-X,"Surface Tension: Love, Sex and Politics Between Lesbians and Straight Women","Daly, Meg",Touchstone,256,1/18/1996,"Feminism, Relationships, Gay & Lesbian Studies",Paperback,"<p>Representing a fascinating spectrum of feelings and opinions about lesbianism, the friendships women share -- or fear -- and the rich diversity of personal choices women make today, this collection of brash and thoughtful essays, stories, and interviews offers<BR>-- Dorothy Allison on what it means to be a lesbian<BR>-- Carla Trujillo on the impact of sexual betrayal by an ex-lover<BR>-- Elizabeth Wurtzel on the creative freedom experienced only by lesbians<BR>-- Susie Bright on the sexual dance between lesbians and straight women<BR>-- Guinevere Turner on the pain of reconciling one's sexual orientation with past relationships</p> <h3>Publishers Weekly</h3> <p>Addressing seemingly all the permutations of lesbian/straight relationships and identity (the friendship between gay and straight women, straight women who pass as gay women, bisexual women, sexual relations with lesbians who eventually become straight), poet and essayist Daly's collection is certainly wide-ranging, but it's also rather formless. Many of the pieces are confessional, but readers (or readers likely to buy this book) will find that the guilt, the disapproval, not to mention the mechanics, sound familiar. Some writing is jargon-filled (``culturally I am woman-identified''; ``I told Becky it was a little hard for me to be nonreductive'') or just bad (``maybe she's desirous in general currently and I'm receptive to desirousness.''). There is some good writing: notably Lisa Palac's delightful, bemused description of sexual experimentation through the personals and Guinevere Turner's touching account of a chance encounter with a woman who shared her childhood in a commune. Two straight women, perhaps because they are outsiders among outsiders, give very clear readings of social and political complications: Ann Powers discusses the muddled issue of straight women committed to queer politics, while Daphne Merkin is painfully honest in her opinion that male homosexuality has a greater validity than lesbianism: ``When I think of two women together, I think of it as the default position... I have no doubt that somewhere in this assessment floats a sadder, more insidious piece of reality, having to do with the way women continue to be perceived by society at large and how we in turn assess one another.'' (Jan.)</p>",en,First Edition,"Height: 8.5 Inches, Length: 5.5 Inches, Weight: 0.7385485777 Pounds, Width: 0.7 Inches",17.05,https://images.isbndb.com/covers/22/13/9780684802213.jpg,Success,112,18.5
0-89951-091-4,A Poetic Vision: The Photographs of Anne Brigman,"Ehrens, Susan, Brigman, Anne",Santa Barbara Museum of Art,96,1995,,Paperback,"Introduction / Karen Sinsheimer -- Sacred Quest: The Life And Work Of Anne Brigman / Susan Ehrens. Susan Ehrens. Published To Accompany The Exhibition ... Held At Santa Barbara Museum Of Art, Santa Barbara, Ca, September 2-november 5 ... [et Al.]. Includes Bibliographical References (p. 93-96).",en,,"Height: 11.25 Inches, Length: 8.75 Inches, Weight: 1.75 Pounds, Width: 0.5 Inches",19.95,https://images.isbndb.com/covers/09/10/9780899510910.jpg,Success,66,18.5
0-8050-4262-8,Christina Stead: A Biography,"Rowley, Hazel",Henry Holt & Co,,1995,,Paperback,"Christina Stead was a hugely unapproachable person who detested self-revelation and, late in life, destroyed many of her private papers. Would-be biographers were held at arm's length, and any so foolhardy as to persevere found doors slammed and projects aborted. Only Hazel Rowley managed to stay the course, persuading Stead's estate as well as her friends, colleagues, and family members to cooperate, thereby gaining access to private papers and privileged memories. The result is an intellectually rigorous yet dramatically riveting book that brings alive this odd and furious woman who was often her own worst enemy but who stands with very few as one of the truly important literary figures of her age. Born in Australia in 1902, Christina Stead sailed for England at the age of twenty-six, not to return home until she was seventy-two. An intensely private person and an incredibly cantankerous one, Stead lived a life that was stormy, eccentric, and brave. She was highly political and maddeningly contentious - few would call her easy in life or in fiction. And yet, in her lifetime, her work was likened to that of Balzac, Joyce, Ibsen, and Tolstoy. But, in fact, it was uniquely her own.",en,,"Height: 10 Inches, Length: 8 Inches, Weight: 1.85 Pounds, Width: 0.5 Inches",18.95,https://images.isbndb.com/covers/26/27/9780805042627.jpg,Success,109,18.5
0-940979-32-2,"At Century's End: Norwegian Artists and the Figurative Tradition, 1880/1990","Sterling, Susan Fisher, Wichstrom, Anne, Smit, Toril",Northeastern University Press,144,7/3/1996,,Paperback,,en,First Edition,"Height: 11 Inches, Length: 8.75 Inches, Weight: 1.3 Pounds, Width: 0.75 Inches",28.95,https://images.isbndb.com/covers/93/21/9780940979321.jpg,Success,67,18.5
1-55885-145-3,Longing,"Espinosa, Maria",Arte Publico Press,298,1/1/1995,"Married women, Married women--Fiction, Young women, Young women--Fiction, Psychological fiction, PS3555.S545 L6 1995, 813/.54",Paperback,An American Woman Living In Paris Marries Achilean Writer And Finds Herself Trapped In Asado-masochistic Relationship. The Novel Chronicles Hereffort To Break Free And Forge An Independent Life Forherself. By The Author Of Dark Plums. Maria Espinosa.,en,,"Height: 8.48 Inches, Length: 5.48 Inches, Weight: 0.79 Pounds, Width: 0.78 Inches",9.95,https://images.isbndb.com/covers/14/50/9781558851450.jpg,Success,86,18.5
0-06-095159-1,Senora De LA Miel (Spanish and English Edition),"Buitrago, Fanny",Perennial,230,1996,,Paperback,,es,First Edition,"Height: 8 Inches, Length: 5.5 Inches, Weight: 0.48 Pounds, Width: 0.75 Inches",10,https://images.isbndb.com/covers/15/97/9780060951597.jpg,Success,106,18.5
0-06-017379-3,Pawpaw Patch: A Novel,"Daugharty, Janice",Harpercollins,272,1996,,Hardcover,,en,First Edition,"Height: 8 Inches, Length: 5.5 Inches, Weight: 0.35 Pounds, Width: 1.25 Inches",0,https://images.isbndb.com/covers/37/91/9780060173791.jpg,Success,106,18.5
0-451-40634-6,No Night Is Too Long,"Rendell, Ruth, Vine, Barbara",Onyx,352,1/1/1996,,Paperback,,en,,"Height: 7 Inches, Length: 4.5 Inches, Weight: 0.85 Pounds, Width: 0.75 Inches",5.99,https://images.isbndb.com/covers/63/47/9780451406347.jpg,Success,60,18.5
0-944993-99-0,When I Am an Old Woman I Shall Wear Purple,"Sandra Martz, Ellen Burstyn And Cch Pounder",Audio Literature,,1998,,Audio Cassette,"This anthology evokes the beauty, humor and courage of women living in their later years. 2 cassettes.

                        <p>This enchanting collection of writings and photographs evokes the beauty, humor and courage of women living in their later years and tells of the endearing moments of joy--and passion--to be found in the rich and varied world of midlife and beyond. An award-winning anthology that takes a refreshing look at issues of aging in a society that glorifies youth.
</p>",en,Unabridged,"Height: 7.25 Inches, Length: 4.75 Inches, Weight: 0.35053499658 Pounds, Width: 0.75 Inches",16.95,https://images.isbndb.com/covers/39/96/9780944993996.jpg,Success,56,18.5
1-883523-08-7,Common Murder: The Second Lindsay Gordon Mystery,"McDermid, Val",Spinsters Ink,250,1995,,Paperback,By Val Mcdermid.,en,Subsequent,"Height: 8.5 Inches, Length: 5.5 Inches, Weight: 0.7 Pounds, Width: 0.5 Inches",10.95,https://images.isbndb.com/covers/30/84/9781883523084.jpg,Success,60,18.5
0-385-47198-X,House Arrest,"Morris, Mary",Nan A. Talese,271,4/1/1996,"Comics &amp; Graphic Novels, Graphic Novels",Hardcover,,en,First Edition,"Height: 9 Inches, Length: 6 Inches, Weight: 0.9 Pounds, Width: 1 Inches",0,https://images.isbndb.com/covers/19/85/9780385471985.jpg,Success,103,18.5
0-812-53438-7,Speak Daggers to Her: A Bast Mystery,"Edghill, Rosemary",Tom Doherty Assoc Llc,222,1/1/1995,,Paperback,,en,First Edition,"Height: 6.75 Inches, Length: 4.25 Inches, Weight: 0.25 Pounds, Width: 0.75 Inches",5.99,https://images.isbndb.com/covers/43/82/9780812534382.jpg,Success,61,18.5
0-812-53438-7,Speak Daggers to Her: A Bast Mystery,"Edghill, Rosemary",Tom Doherty Assoc Llc,222,1/1/1995,,Paperback,,en,First Edition,"Height: 6.75 Inches, Length: 4.25 Inches, Weight: 0.25 Pounds, Width: 0.75 Inches",5.99,https://images.isbndb.com/covers/43/82/9780812534382.jpg,Success,65,18.5
0-8122-1379-3,Enterprising Women: Television Fandom and the Creation of Popular Myth (Contemporary Ethnography),"Bacon-Smith, Camille",University of Pennsylvania Press,352,12/1/1991,,Paperback,"<p>A study of the worldwide community of fans of <i>Star Trek</i> and other genre television series who create and distribute fiction and art based on their favorite series. This community includes people from all walks of life—housewives, librarians, secretaries, and professors of medieval literature. Ninety percent of its members are women.</p>",en,New Edition,"Height: 9 Inches, Length: 6 Inches, Weight: 1.24 Pounds, Width: 0.79 Inches",28.95,https://images.isbndb.com/covers/37/99/9780812213799.jpg,Success,63,18.5
1-56478-088-0,Making of Americans (American Literature (Dalkey Archive)),"Stein, Ms Gertrude",Dalkey Archive Press,926,12/1/1995,,Paperback,"<p><strong>""Essential for all literature collections . . . Several of Stein's titles returned to print in 1995, but none more important than <em>The Making of Americans</em>.""—<em>Library Journal</em></strong></p>
<p>In <em>The Making of Americans</em>, Gertrude Stein sets out to tell ""a history of a family's progress,"" radically reworking the traditional family saga novel to encompass her vision of personality and psychological relationships. As the history progresses over three generations, Stein also meditates on her own writing, on the making of <em>The Making of Americans</em>, and on America.</p>",en,3rd ed.,"Height: 8.98 Inches, Length: 6.88 Inches, Weight: 2.82853082146 Pounds, Width: 2.04 Inches",19.95,https://images.isbndb.com/covers/08/81/9781564780881.jpg,Success,90,18.5
0-385-47791-0,A Woman Scorned,"Sanday, Peggy",Doubleday,338,2/1/1996,,Hardcover,"Beginning With A Harrowing Account Of The St. John's Rape Case, Sanday Reaches Back Through British And American Landmark Rape Cases To Explain How, With The Exception Of Earliest Colonial Times, Rape Has Been A Crime Notable For Placing The Woman On Trial. Whether She Is Charged As A False Accuser, Gold Digger, Loose Or Scorned Woman, Stereotypes Prevail. American Jurisprudence And The Public At Large Remain Divided On Acquaintance Rape. And Now, As The Violence Against Women Actthe Most Important Legislation For Women In Twenty Years - Has Been Passed, A New Breed Of Antifeminists Has Stepped Up To The Plate To Subordinate Women's Bid For Sexual Autonomy And Freedom. A Groundbreaking Work Of Scholarship That Coherently Challenges The Anti-rape Backlash And Its Rhetoric, A Woman Scorned Brings A Broader Perspective To Our Understanding Of Acquaintance Rape And Envisions, Finally, A New Paradigm For Female Sexual Equality. Prologue: Hooking Up At The Trump -- 1. The St. John's Case Goes To Trial -- 2. Birth Of The False Accuser: The Case Of Margery Evans -- 3. The Enigma Of Puritan Sexuality: Rape In Early New England -- 4. The No-means-yes Defense: Rape At The Birth Of The Nation -- 5. Rape And Sexual Politics In The Nineteenth Century -- 6. Construction Of Modern Sexual Stereotypes -- 7. The Great American Sex Business -- 8. Feminism In The Sixties And The Anti-rape Movement -- 9. Naming And Studying Acquaintance Rape -- 10. The Continuing Power Of Stereotypes -- 11. The Crusade Against Anti-rape Activism -- 12. Affirmative Consent -- 13. Conclusion. Peggy Reeves Sanday. Includes Bibliographical References (p. 315-327) And Index.",en,First Edition,"Height: 9.75 Inches, Length: 6.5 Inches, Weight: 1.35 Pounds, Width: 1 Inches",23.95,https://images.isbndb.com/covers/79/18/9780385477918.jpg,Success,103,18.5
0-89281-550-7,Celebrating the Great Mother: A Handbook of Earth-Honoring Activities for Parents and Children,"Johnson, Cait, Shaw, Maura D.",Destiny Books,248,6/1/1995,,Paperback,"<p>Adults have a wide array of books to help explore earth-based spirituality. But what if they want to include their children? Here is a handbook to help parents, caregivers, teachers, and counselors create meaningful spiritual experiences that will inspire children of all ages. The ideas, suggestions, and activities collected here show how to bring children into rituals that celebrate seasonal cycles and help reclaim the spiritual roots of today's modern holidays. With surprisingly little effort, earth-centered activities and rituals can be incorporated into simple daily routines.</p>
<p>Part 1, “Handbook for Earth-Connected Parenting,” gives techniques for developing a child's inner wisdom and sense of the sacred: dream journals, visualization, Tarot play, talismans, and interactions with the natural world</p>
<p>Part 2 is a guide to the specific seasonal festivals, and offers a comprehensive collection of practical and enjoyable ways to celebrate the sacred days of our ancestors. Make a bean rune divination system, gather smudge sticks, grow grass pots, assemble a “dream pillow,” create altars the authors offer easy-to-follow suggestions.</p>
<p>Includes suggested reading and resource sections for locating additional information and materials for creative projects.</p>",en,Original ed.,"Height: 8 Inches, Length: 8 Inches, Weight: 0.00220462262 Pounds, Width: 0.8 Inches",10.86,https://images.isbndb.com/covers/55/00/9780892815500.jpg,Success,82,18.5
0-684-82352-7,"New Our Bodies, Ourselves: A Book by and for Women","Boston womens health book collective, Boston",Touchstone,752,3/7/1996,,Paperback,"Our Bodies, Ourselves for the New Century is the first major revision of this classic since 1984 and reflects the major changes that have occurred in every area of women's health. It is still the definitive consumer health reference of all women.
<p>This new focus encompasses such controversial issues as:<br>
-- Managing ""managed care"" and the insurance industry<br>
-- Questioning breast cancer treatment options<br>
-- Recent scientific developments in contraception and reproductive technology, including drug-induced abortions<br>
-- Violence as a women's public health issue<br>
-- Preventing and living with HIV/AIDS<br>
-- The impact of racism on sexuality<br>
-- Chiropractic, herbal, and other alternative/complementary therapies, including natural approaches to menopause<br>
-- Poverty and racism as major determinants of women's health.</p>


                        <p>The most comprehensive overview of what women need to know about their bodies and about the medical establishment, The New Our Bodies, Ourselves has been completely updated and expanded for the 1990s, with a new joint Preface by Gloria Steinem, Byllye Avery, and Helen Rodrigues-Trias. A leader in its field, this book is a reference for women of all generations to use, to rely on, and to share with others. Photos. Index.
</p>",en,First Edition,"Height: 11.5 Inches, Length: 1.75 Inches, Weight: 3.70156137898 Pounds, Width: 9 Inches",21,https://images.isbndb.com/covers/35/22/9780684823522.jpg,Success,113,18.5
0-7190-4230-5,Male Bias in the Development Process,,Manchester Univ Pr,288,1995,,Paperback,"Updated with two new chapters for this paperback edition, this book argues that the development process is marked by male bias - ill-founded and unjustified asymmetries that operate in favour of men and against women. The contributors include some of the leading writers in the gender and development field. Together they analyse the variety of forms taken by male bias, its foundations and the way it changes over time, and the possibilities for overcoming it. The cases considered cover both urban and rural settings: agriculture, industry and services; self-employment and wage-employment in Africa, Asia and Latin America.",en,Subsequent,"Height: 8.75 Inches, Length: 5.75 Inches, Weight: 1 Pounds, Width: 1 Inches",27.95,https://images.isbndb.com/covers/23/00/9780719042300.jpg,Success,95,18.5
0-06-096404-9,"Tales of the City (Tales of the City Series, V. 1)","Maupin, Armistead",HarpPeren,384,1/1/1900,,Paperback,,en,Reprint,"Height: 8.25 Inches, Length: 5.5 Inches, Weight: 0.93 Pounds, Width: 1 Inches",0,https://images.isbndb.com/covers/40/47/9780060964047.jpg,Success,72,18.5
0-89594-766-8,From Wedded Wife to Lesbian Life: Stories of Transformation,"Abbott, Deborah",Crossing Press,290,9/1/1995,"Self-Help & Psychology - Gay & Lesbian Studies, Coming Out & Family Life",Paperback,"FROM WEDDED WIFE TO LESBIAN LIFE presents personal stories of discovery and change by women who got married, defied tradition, and came out as lesbians. Drawing from a broad range of cultures and classes, this revealing collection of first-person essays, interviews, and poems offers a glimpse into the lives of such well-known lesbian authors as JoAnn Loulan, Margaret Randall, Margarethe Cammermeyer, Joanna Kadi, Ellen Bass, Joan Larkin, and Minnie Bruce Pratt, as well as emerging writers.",en,"1st Edition, 4th Printing","Height: 9 Inches, Length: 6 Inches, Weight: 0.9 Pounds, Width: 0.75 Inches",1.99,https://images.isbndb.com/covers/76/66/9780895947666.jpg,Success,85,18.5
0-7167-2916-4,Strong Shadows: Scenes from an Inner City AIDS Clinic,"Zuger, Abigail, M.D.",W H Freeman & Co,243,1995,"Urban Population, Poverty, Physicians, Acquired Immunodeficiency Syndrome, AIDS (Disease)--Case studies, Poor--Medical care--Case studies, Inner cities, Acquired Immunodeficiency Syndrome--New York (State)--New York--Personal Narratives, Physicians--New York (State)--New York--Personal Narratives, Poverty--New York (State)--New York--Personal Narratives, Urban Population--New York (State)--New York--Personal Narratives, RC607.A26 Z84 1995, 1995 K-043, WC 503 Z94s 1995, 362.1/969792",Hardcover,Zuger Works At A New York City Aids Clinic. Abigail Zuger.,en,1,"Height: 8 Inches, Length: 5.5 Inches, Weight: 0.7605948039 Pounds, Width: 1 Inches",22.95,https://images.isbndb.com/covers/91/67/9780716729167.jpg,Success,105,18.5
0-446-67127-4,Cyteen,"Cherryh, C.J.",Aspect,680,9/1/1995,,Paperback,"<p>The Hugo Award-winning SF saga is now available in one complete trade paperback edition, containing Cyteen: The Betrayal, The Rebirth and The Vindication. ""A psychological novel, a murder mystery and an examination of power on a grand scale, encompassing light years and outsize lifetimes"".—Locus.</p>


                        <p>The Hugo Award-winning SF saga is now available in one complete trade paperback edition, containing Cyteen: The Betrayal, The Rebirth and The Vindication. ""A psychological novel, a murder mystery and an examination of power on a grand scale, encompassing light years and outsize lifetimes.""--Locus.
</p>",en,Reprint,"Height: 9 Inches, Length: 6 Inches, Weight: 1.60055602212 Pounds, Width: 1.74 Inches",16.99,https://images.isbndb.com/covers/12/79/9780446671279.jpg,Success,65,18.5
