ISBN,Title,Author,Publisher,Pages,Date Published,Subjects,Binding,Synopsis,Language,Edition,Dimensions,MSRP,Image,Status,PageNumber,Volume & Issue
0-465-03965-0,Life After Johnnie Cochran,"Berry, Barbara C.",Basic Books,224,8/25/1995,,Hardcover,"Life After Johnnie Cochran is the story of the woman who put up with philandering, physical abuse, mind games, put-downs, and even a long-term white mistress before she grabbed her two young daughters and her dignity and walked away from her eighteen-year marriage to L.A.'s most successful black lawyer. The future captain of the dream team, according to Cochran Berry, was a ""nightmare to live with,"" able to come up with a dozen good answers to the simplest of questions, like: ""Where did you spend the night?"" The author explains why she chose to ignore the received wisdom of those days among black middle-class women that said, ""No matter what, you don't leave a man who can pay the bills.""",en,First Edition,"Height: 8.5 Inches, Length: 5.5 Inches, Weight: 0.9 Pounds, Width: 0.75 Inches",1.99,https://images.isbndb.com/covers/96/54/9780465039654.jpg,Success,106,18.5
1-880656-16-7,Other Side River: Free Verse (Rock Spring Collection of Japanese Literature),,Stone Bridge Press,244,6/1/1995,"Japanese poetry--Women authors--Translations into English, Japanese poetry--Translations into English, Japanese poetry--20th century--Translations into English, PL782.E3 O85 1995, 895.6/150809287",Paperback,"Japanese poets have been writing tanka and haiku for hundreds of years. Japanese free verse, however, is barely a century old, and women's free verse in Japan is younger still. This collection, the second volume in the Stone Bridge anthology of contemporary Japanese women's poetry, introduces the work of some three dozen of Japan's finest women poets who specialize in free verse. Remarkable for their diversity and passion, these poems provide a vivid contrast to the more traditional verse forms featured in Volume One, A Long Rainy Season.
<p>Author Biography: Leza Lowitz is an award-winning poet and fiction writer whose awards include the PEN Syndicated Fiction Award and an NEH grant. She is also a co-editor of A Long Rainy Season, the companion volume in this set.; Miyuki Aoyama is a poet and literary critic. She is the Japanese translator of Erica Jong and H.D. and a co-editor of A Long Rainy Season, the companion volume in this set.</p>
<p> Stone Bridge Press is a leading English-language publisher of Japanese literature in translation. Our ROCK SPRING COLLECTION OF JAPANESE LITERATURE features absorbing and important translations of classical and contemporary Japanese fiction and poetry. We believe that literature is a window into culture and society, and an expression of what is most peculiarly, and universally, human</p>",en,First Edition,"Height: 7.3 Inches, Length: 5.5 Inches, Weight: 0.5952481074 Pounds, Width: 0.7 Inches",14,https://images.isbndb.com/covers/61/67/9781880656167.jpg,Success,85,18.5
0-88922-355-6,Cartouches,Lola Lemire Tostevin,Talonbooks,80,1/1/1995,Canadian Poetry,Paperback,"<p>The terminal illness and death of the authorâs father and a recent trip to Egypt led Lola Lemire Tostevin to explore what she perceives to be the essential relation between language and death. In the hieroglyphs and carvings of ancient Egyptian temples she experienced how the bleakness of death and the desert were transformed into something that continues to live.</p><p>Of the writing of this book Tostevin writes, ''The journal entries of <i>Cartouches</i> were not written in the usual traditional diary form in which a dayâs events are recorded. They were, like the poems, âfashionedâ as a process of writing through which the writer gives meaning to events that may (or may not) have happened. These events become hieroglyphs-iconic moments, if you will-framed within the pages of a book. They are small cartouches and amulets that help the writer define who she is.</p>",en,0,"Height: 9 Inches, Length: 5.9842519624 Inches, Weight: 0.27998707274 Pounds, Width: 0.31 Inches",10,https://images.isbndb.com/covers/35/54/9780889223554.jpg,Success,64,18.5
0-312-14061-4,Unveiled: One Woman's Nightmare in Iran,"Mosteshar, Cherry",St Martins Pr,352,1996,,Hardcover,"This Harrowing True Story Of Life In Modern Iran Is Told From The Unique Perspective Of A Foreign Journalist And Islamic Bride. Born In Iran But Schooled In The West At Oxford, Cherry Mosteshar Returns To Her Homeland With The Aim Of Explaining Her Country To The World. As A Member Of The Wealthy Elite, She Observes Firsthand The Prevalence Of Western Influence Prior To The Overthrow Of The Shah In 1979. However, The Religious Revolution Transforms The Country Into An Extremely Conservative Islamic State Overnight, And The Societal Ramifications - Especially For Women - Are Shocking. A Woman Now Has A Price, That Of Half A Man. Her Children Belong To Her For Only The First Seven Years Of Their Lives. If She Refuses To Wear The Full-length Chador, She Is Branded A Whore. Mosteshar Describes This Demeaning Treatment Of Women Through Her Own Struggle With A Very Traditional Husband Who Is Domineering, Unyielding, And Cruel. Soon After They Wed, Mosteshar Discovers That He Never Divorced His First Wife. We Watch A Bright, Articulate, Spirited Woman Try To Maintain Her Personal And Professional Identity As Her Husband Physically And Emotionally Abuses Her. Mosteshar Finds Herself Trapped In A Nightmarish Life She Had Previously Only Witnessed From Afar. She Eventually Escapes - But At The Price Of Having To Leave Her Country. Prelude: In Search Of Paradise -- A Memory Of Spring -- End Of The Old Order -- Husbands And Lovers -- The Next Generation -- Under The Veil -- The Doctor As God -- Hating Robert Fisk -- Nice Girls Don't Laugh -- Factions Within Factions -- Bonfires Of Futility -- Sex, Drugs And Friday Prayers -- On The Road To Ruin -- Till Death Us Do Part -- Mr. Bean Goes To Tehran -- Falling Out With Rafsanjani -- Waking Up -- Money Rears Its Ugly Head -- Farewell, My Darling -- Beyond The Republic. Cherry Mosteshar.",en,1,"Height: 9.5 Inches, Length: 6.25 Inches, Weight: 1.5 Pounds, Width: 1 Inches",23.95,https://images.isbndb.com/covers/06/18/9780312140618.jpg,Success,111,18.5
0-446-51772-0,Devil's Food,"Weber, Janice",Grand Central Pub,470,1996,,Hardcover,Janice Weber.,en,First Edition,"Height: 9.75 Inches, Length: 6.25 Inches, Weight: 1.63 Pounds, Width: 1.75 Inches",22.95,https://images.isbndb.com/covers/77/20/9780446517720.jpg,Success,114,18.5
0-440-50756-1,Live the Life You Love: In Ten Easy Step-By Step Lessons,"Sher, Barbara",Dell,256,2/10/1997,,Paperback,"<p><P>No matter how long it's been since you've dreamed it...<br>No matter how &quot;unrealistic&quot; it seems...<br>Your impossible dream may not be impossible anymore.<P>If you've been waiting for a job that rewards you with more than a&#160;&#160;paycheck...or for the perfect moment to take that &quot;long-lost&quot; dream off&#160;&#160;hold...it's time to stop waiting and start creating a life you can truly&#160;&#160;love!<P>In this life altering follow-up to the sensational New York Times Bestseller&#160;&#160;<i>I Could Do Anything If I Only Knew What It Was,</i> Barbara Sher shows you how&#160;&#160;to break free from a career that doesn't cut it...tailor-make a meaningful,&#160;&#160;rewarding life to your personal specifications...and create a foundation for&#160;&#160;a success that's strong enough to support your heart's desire.&#160;&#160;With wisdom and warm reassurance, this step-by-step guide to personal and professional&#160;&#160;fulfillment teaches you the practical strategies you need to make your&#160;&#160;&quot;impossible&quot; dreams possible, reachable, and real.<P>Discover&#58;<P>How to use &quot;outcome thinking&quot; to plot a positive path to your lifelong goal What your favorite childhood pastimes tell you about what it takes to be a happy adult How to use your natural curiosity, talents, and resources to turn your thinking&#151;and your luck&#151;around Why one-size careers do NOT fit all Foolproof techniques for leaping over the hurdles between you and your dream How to do what you love and love what you do for the rest of your life!1997).</p>",en,NO-VALUE,"Height: 9.2 Inches, Length: 6.1 Inches, Weight: 0.62390820146 Pounds, Width: 0.54 Inches",10.44,https://images.isbndb.com/covers/75/67/9780440507567.jpg,Success,102,18.5
0-292-79067-8,The Waiting List: An Iraqi Woman's Tales of Alienation (CMES Modern Middle East Literatures in Translation),"Al-Amir, Daisy",Ctr for Middle Eastern Studies UT-Austin,95,1/1/1995,,Paperback,"Daisy Al-Amir is one of the more visible figures in women's fiction in the Arab world today. This collection of stories, originally published in Lebanon as <i>Ala La'ihat al-Intizar</i>, is the most recent of her five publications. Her stories intimately reflect women's experiences in the chaotic worlds of the Lebanese civil war and the rise of Saadam Hussain as Iraq's leader. Set in Iraq, Cyprus, and Lebanon, the stories shed light on an unusual Middle East refugee experience—that of a cultural refugee, a divorced woman who is educated, affluent, and alone.
<p>Al-Amir is also a poet and novelist, whose sensual prose grows out of a long tradition of Iraqi poetry. But one also finds existential themes in her works, as Al-Amir tries to balance what seems fated and what seems arbitrary in the turbulent world she inhabits. She deals with time and space in a minimalist, surreal style, while studying the disappointments of life through the subjective lens of memory. Honestly facing the absence of family and the instability of place, Al-Amir gives lifelike qualities to the inanimate objects of her rapidly changing world.</p>
<p>In addition to the stories, two examples of the author's experimental poems are included. In her introduction, Mona Mikhail places these stories and poems in the context of contemporary Islamic literature and gender studies.</p>",en,First Edition,"Height: 8.5 Inches, Length: 5.5 Inches, Weight: 0.28880556322 Pounds, Width: 0.2 Inches",19.95,https://images.isbndb.com/covers/06/74/9780292790674.jpg,Success,45,18.5
0-571-19873-2,Unspeakable: The Rise of the Gay and Lesbian Press in America,"Streitmatter, Rodger",Faber & Faber,424,1995,"Gay press publications--History, Gay press publications--United States--History, Gay press--History, Gay press--United States--History, HQ76.95.U5 S77 1995, 305.9/0664/0973",Hardcover,Rodger Streitmatter. Includes Bibliographical References And Index.,en,First Edition,"Height: 9.5 Inches, Length: 6.25 Inches, Weight: 1.95 Pounds, Width: 1.75 Inches",27.95,https://images.isbndb.com/covers/87/33/9780571198733.jpg,Success,105,18.5
0-87322-610-0,Basketball for Women,"Lieberman, Nancy, Roberts, Robin",Human Kinetics,283,10/10/1995,,Paperback,"<p>While thousands of women basketball players have the talent to compete at a high level, they don't always have the opportunity, instruction, or training to do so. <i>Basketball for Women</i> was designed to help these players achieve their fullest potential.</p>
<p>Written by Nancy Lieberman-Cline and Robin Roberts, two women who know the game and how to excel at it, this practical guide challenges women from high school through college to develop their talent and skill to the highest level.</p>
<p><i>Basketball for Women</i> provides 111 drills for improving and refining offensive and defensive skills. The authors explain the importance of each skill, identify the keys to proper technique, show how to correct common errors, and apply these skills in game situations. The drills are great tools for improving every practice and workout.</p>
<p>Unlike most basketball books for women, this unique resource goes beyond the basics to address topics for the serious-minded player, including:</p>
<p>- an overview of the history of women's basketball;<br>
- identifying priorities, establishing goals, and seizing opportunities;<br>
- 10 steps for handling success;<br>
- getting the most out of practice and games;<br>
- dealing with special game situations and matchups;<br>
- where to play during the off-season;<br>
- teamwork, coachability, and attitude; and<br>
- recruitment.</p>
<p>Filled with proven principles, innovative drills, and conditioning guidelines designed especially for women, <i>Basketball for Women</i> will help players eliminate their weaknesses and sharpen their strengths to succeed at any level.</p>",en,First Edition,"Height: 9 Inches, Length: 6 Inches, Weight: 1.04940036712 Pounds, Width: 1 Inches",20.95,https://images.isbndb.com/covers/61/03/9780873226103.jpg,Success,90,18.5
0-553-37513-X,Banana Rose,"Goldberg, Natalie",Bantam,384,3/1/1997,"General & Miscellaneous Jewish Biography, Jewish Fiction & Literature, Phases of Life - Fiction, Love & Relationships - Fiction, Arts & Entertainment - Fiction",Paperback,"<p><P>The bestselling novel from the beloved author of <i>Writing Down the Bones, Wild Mind,</i> and <i>Long Quiet Highway</i> is now available in paperback for the first time.&#160;&#160;With a half-million copies in print of her three remarkable books of nonfiction, Natalie Goldberg has inspired a generation of writers with her insight, humor, and empathy.&#160;&#160;Subtly hilarious and achingly raw, her first novel <i>Banana Rose</i> has rewarded her devoted fans while attracting a whole new readership to her work.<P><i>Banana Rose</i> is the story of Nell Schwartz, a Brooklyn-born Jewish girl who moves to the Taos of communes and sweet cedar smoke, transforms herself into Banana Rose (because she's &quot;bananas&quot;), falls in love with a horn player named Gauguin, and believes they can stop time if they just love hard enough.&#160;&#160;It's also about Nell and Anna, a strange-eyed writer as lonely as the Nebraska farm where she grew up, whose kisses taste like raspberries and who teaches Nell what it means to be an artist.&#160;&#160;But most of all, <i>Banana Rose</i> is about Nell's struggle with her own wild heart, with the demands of canvas and paint, with her family and faith, and with her irrepressible longing for home.</p><h3>Publishers Weekly</h3><p>That the art of writing has many facets, some slippery, is demonstrated by this first novel from writing guru Goldberg (Writing Down the Bones), which turns out to be a rambling, rather indulgent memoir of marriage and friendship in an age of post-hippie adjustment. ``I thought the hippie years would last forever,'' reflects Nell Schwartz from Brooklyn, aka ``Banana Rose,'' who's living in a Taos commune, painting the awesome New Mexico landscape, when a sexy red-haired musician known as ``Gauguin'' blows into Taos with his brass saxophone. Soon ardent lovers, Nell and Gauguin depart for life in cities (including New York and its Jewish deli delights). But passion cools with marriage, ridiculous in-laws and the prospect of daily reality in ``Minneapolis, for good.'' Gauguin turns unconvincingly bossy and square, annoyed by Nell's caf art show, her carefree ``women's libber'' ways and her Jewishness, which she fiercely protects amid the alien Midwestern corn. For solace, Nell turns to Anna Gates, whose mountaintop funeral opens and closes the novel as a frame and comment on the Gauguin/Nell relationship. In life, Anna was willowy and fair, a writer of guileless little sketches and ``a six-foot-one-inch lesbian'' whom Nell had tenderly loved but slept with only once. Finally, Nell's painful losses spur her to redemptive literary activity. Sentence by sentence, Goldberg's writing is, not surprisingly, sensitive and quick, but her plot meanders like a sleepy bee, settling down now and then for a scene as sweet as nectar but too often simply buzzing around in the air. Major ad/promo; author tour. (Mar.)</p>",en,Reprint,"Height: 8.24 Inches, Length: 5.4 Inches, Weight: 0.69 Pounds, Width: 0.8 Inches",16,https://images.isbndb.com/covers/51/38/9780553375138.jpg,Success,104,18.5
1-85242-413-3,House Rules (High Risk Books),"Lewis, Heather, Lewis, Heather",Serpent's Tail,321,1995,"Teenage Girls, Fiction",Paperback,,en,,"Height: 1.16 Inches, Length: 7.98 Inches, Weight: 2.1 Pounds, Width: 4.89 Inches",12.99,https://images.isbndb.com/covers/41/38/9781852424138.jpg,Success,91,18.5
0-8143-2563-7,Odyssey of Exile: Jewish Women Flee the Nazis for Brazil,,Wayne State University Press,264,6/1/1996,,Paperback,"<p>odyssey Of Exile Paints A Sensitive And Compelling Portrait Of German-jewish Women Who Fled Nazi Germany In The 1930s And 1940s. The Frank And Moving Stories Offer A Rare Glimpse Into Personal Histories.</p> <h3>booknews</h3> <p>this Group Of Nine Autobiographical Portraits Written By German-jewish Women Who Fled Nazi Germany In The 1930s And 1940s To Arrive In Brazil's Tropical Climate And Culture Shares A Frank And Frightening Personal History That Transcends Editor Morris's Careful Contextualization. These Well Educated, Middle Class Women Write Movingly Of Their Journeys, Sometimes From The Voices Of Mature Women And Sometimes From The Hopes And Fears Of Themselves As Young Girls. The Memoirs Describe The Horror Of The Death Camps, The Uprooting Of Family And Friends, And The Heady Sights And Sounds Of A Strange Rio De Janeiro In The Early 1940s While Underscoring The Common Themes Of How Jewish Women Reacted To Nazi Persecution, How They Adapted, And How Important These Stories Are To Keeping The History Of Their Families Alive. Paper Edition (unseen), $18.95. Annotation C. Book News, Inc., Portland, Or (booknews.com)</p>",en,Illustrated,"Height: 9 Inches, Length: 6 Inches, Weight: 0.89 Pounds, Width: 0.75 Inches",24.99,https://images.isbndb.com/covers/56/36/9780814325636.jpg,Success,100,18.5
0-8118-1124-7,The Letters of Frida Kahlo: Cartas apasionadas,"Zamora, Martha",Chronicle Books,160,1995,"CorrespondenceKahlo, Frida, Painters--Correspondence, Painters--Mexico--Correspondence, ND259.K33 A3 1995, 759.972 B",Hardcover,"The Only Volume Of Its Kind, The Letters Of Frida Kahlo Reveals Fascinating Details About Kahlo's Romances, Friendships, And Business Affairs In A Selection Of Letters To Friends, Collectors, Doctors, Family, Politicians, Lovers, And, Of Course, Diego Rivera. In Over 80 Pieces, Kahlo Discusses Her Art, Politics, And Tragedies With A Passionate Energy That No Biographer Of This Important Artist Could Ever Capture. The Letters Of Frida Kahlo, Full Of Ardent Desires, Seething Fury, And Outrageous Humor, Will Delight The Many Fans Of Her Art With A Glimpse Into An Exuberant And Troubled Existence. Compiled By Martha Zamora. Her Letters Contain A Combination Of Spanish, English, Spanglish (where She Combines An English Verb With A Spanish Enting)...--pref.",en,,"Height: 7.5 Inches, Length: 6.8 Inches, Weight: 0.85539357656 Pounds, Width: 0.7 Inches",19.95,https://images.isbndb.com/covers/12/48/9780811811248.jpg,Success,104,18.5
1-85381-885-2,The Diaries of Sylvia Townsend Wa (Virago Classic Non-Fiction),"Warner, Sylvia Townsend; Harman, Claire",Virago Pr,384,1996,,Paperback,,en,New Ed,"Height: 8 Inches, Length: 5 Inches, Weight: 0.6944561253 pounds, Width: 1.25 Inches",15.95,https://images.isbndb.com/covers/88/51/9781853818851.jpg,Success,76,18.5
0-553-56921-X,"The Strange Files of Fremont Jones (Fremont Jones Mystery Ser., Vol. 1)","Day, Dianne",Bantam Books,272,1996,"Fiction, Mystery & Crime, Teen Fiction, Fiction Subjects",Paperback,"<p>Brave, resourceful, adventurous Fremont (n&#233;e Caroline) Jones is a woman ahead of her time. Hungry for independence, she's traded in her conventional life in Boston for a career as a &quot;type-writer&quot; in turn-of-the-century San Francisco. But Fremont soon discovers that her clients aren't always what they appear to be, and that in doing her job she's transcribing her way into a wealth of mystery--and mortal danger....<br><br>Dashing lawyer Justin Cameron well-nigh sweeps Fremont Jones off her feet--and into a situation ripe with perilous intrigue. A client meets an untimely death that Fremant suspects is linked to the paper she typed for him, of which she can recall but one small fragment. And her attempts to disentangle reality and imagination in the gothic tales penned by Edgar Allan Partridge--whose demeanor is one of terror under the barest restraint--send her up the rocky California coast on a mission of discovery from which she may not return....<br><br>A riveting, atmospheric mix of intrigue and humor introduces a new investigator as cultivated as Sherlock Holmes and as spunky as Kinsey Millhone.</p><h3>Over My Dead Body.com - J. Ashley</h3><p>...The first in the Fremont Jones series and won the Macavity Award for best first novel....Strangely, I found this book to be a mixture of the refreshingly original and the annoyingly cliche. Why, oh why, when sleuths are handed A Vital Clue, in the form of a letter, diary, computer disk, what-have-you, does their insatiable curiosity suddenly disappear, and they refuse to read said letter and/or carelessly lose it? The Vital Clue that would have explained all had they but taken the time...</p>",en,First Edition,"Height: 6.09 Inches, Length: 4.13 Inches, Weight: 0.34392112872 Pounds, Width: 0.96 Inches",7.19,https://images.isbndb.com/covers/92/16/9780553569216.jpg,Success,61,18.5
0-671-86881-0,From Potter's Field,"Cornwell, Patricia",Simon & Schuster Audio,,9/1/1995,,Audio Cassette,,en,Abridged,"Height: 7 Inches, Length: 4 Inches, Weight: 0.3653125 Pounds, Width: 1.125 Inches",0,https://images.isbndb.com/covers/88/19/9780671868819.jpg,Success,55,18.5
962-7255-14-9,Selected Poems (Renditions paperbacks),"Ting, Shu",Cheng & Tsui Co,136,12/6/1994,"Translations into EnglishShu, Ting , 1952-, PL2901.T56 A24 1994",Paperback,"By Shu Ting ; [translators, Eva Hung ... Et Al.].",en,,"Height: 8.5 Inches, Length: 5.75 Inches, Width: 0.25 Inches",85,https://images.isbndb.com/covers/51/47/9789627255147.jpg,Success,84,18.5
0-15-621250-1,The Complete Shorter Fiction of Virginia Woolf: Second Edition,"Woolf, Virginia",Mariner Books,364,6/1/1989,,Paperback,"<p><P>Woolf continually used stories and sketches to experiment with narrative models and themes for her novels. This collection of nearly fifty pieces brings together the contents of two published volumes, A Haunted House and Mrs. Dalloway&#8217;s Party; a number of uncollected stories; and several previously unpublished pieces. Edited and with an Introduction by Susan Dick.</p><h3>Booknews</h3><p>**** The first edition (1985) is cited in BCL3. A collection of stories and sketches, annotated and arranged chronologically. This edition includes a substantial amount of new material. Annotation c. Book News, Inc., Portland, OR (booknews.com)</p>",en,First Edition,"Height: 8 Inches, Length: 5.31 Inches, Weight: 0.76 Pounds, Width: 0.81 Inches",15.99,https://images.isbndb.com/covers/25/02/9780156212502.jpg,Success,73,18.5
0-8118-1113-1,Voices of the Dream,"Johnson, Venice ed.",Chronicle Books,108,12/1/1995,"African American women--Quotations--Juvenile literature, African American art--Juvenile literature, PN6081.3 .V35 1995, 081/.08996",Hardcover,"Quotations By Notable African American Women Are Accompanied By Reproductions Of Paintings, Drawings, And Mixed-media Art Works By Contemporary African American Women Artists. Edited By Venice Johnson. Includes Bibliographical References (p. 106-108).",en,,"Height: 7.32 Inches, Length: 6.4 Inches, Weight: 0.80689187892 Pounds, Width: 1.01 Inches",12.95,https://images.isbndb.com/covers/11/32/9780811811132.jpg,Success,104,18.5
0-345-39005-9,An Imperfect Spy,"Cross, Amanda",Ballantine Books,224,11/29/1995,,Paperback,,en,,"Height: 6.75 Inches, Length: 4.25 Inches, Weight: 0.25 Pounds, Width: 0.75 Inches",6.99,https://images.isbndb.com/covers/00/59/9780345390059.jpg,Success,61,18.5
0-8032-8952-9,Rose Mellie Rose (European Women Writers),"Redonnet, Marie",Bison Books,123,9/1/1994,,Paperback,,en,Reprint,"Height: 8 Inches, Length: 5 Inches, Weight: 0.31305641204 Pounds, Width: 0.31 Inches",12.95,https://images.isbndb.com/covers/95/29/9780803289529.jpg,Success,46,18.5
1-56639-267-5,"Bridging The Americas: The Literature of Paule Marshall, Toni Morrison, and Gayl Jones","Coser, Stelamaris",Temple University Press,227,12/30/1994,,Paperback,Stelamaris Coser. Includes Bibliographical References (p. 175-215) And Index.,en,,"Height: 8.5 Inches, Length: 5.75 Inches, Weight: 0.65 Pounds, Width: 0.75 Inches",27.95,https://images.isbndb.com/covers/26/79/9781566392679.jpg,Success,96,18.5
