PageNumber,Text,ISBNs
45,"Feminist Bookstore News
with two other women. I always dreamt of having a called, The Hidden Sex of Money by Clara Coria (El sexo
bookstore because I always loved to read. We weren't oculto del dinero, GEL, Buenos Aires, Argentina, 1986).
really friends, we knew each other from participating It was written by a woman psychologist, a feminist.
in several activities but we weren’t friends yet. So she It’s about women and money. It includes some things
told me about her idea... about her experience about women and money. Now
I said, “Oh, that’s a wonderful idea. If you should she’s going to publish a second book that includes the
need another, call me!” Time passed and then one day men and women and looks at, for example, those that
she called me and asked if I was still interested. So we have businesses to see how women and men react in
began to talk about opening the store and we worked different situations, and their different relationships.
together and we made this partnership. It’s worked Because the relationship of money between men and
through this whole year, and now we are friends. But women, money’s different, you know? And so she’s
we weren't initially, and maybe it was good that we making a second book.
weren't, so that nothing invaded this new relation-
ship, you know? So it happened like that. Both of us
r we oa mlly en l o tv he a t b o ao rk e s i nan ted r e sli tk ee d t io n r we oad m. e nA ’sn d s u w bje e c ta sr e s ob o t ith O tuhr e b ibgogeoskt s tporroeb le mis its o oth astm Na l lE.|
was just the only thing we could do! (Laughing!)
But that just shows our
And it was no problem that nobody in Argentina had progress!
ever done a woman's bookstore before.
No. There was a women’s bookstore some years Another book that we're selling a lot is Around the
ago. I had heard about it and when I decided to go, it Feminine Subjectivity (Estudios sobre la subjectividad fem-
didn’t exist anymore. inina, GEL, Buenos Aires, 1987). It was written and
I am a biologist. I was teaching before we started edited by Mabel Burin, with a group of women psy-
the store. I'm working on the new reproductive tech- chologists working on women and mental health, and
nologies.... That’s how I am in contact with (New it has a feminist approach to the theme that’s quite
Words collective member) Rita Arditti. I am interested different. And so this is a book that we sell a lot. And
in that subject and also that’s what I'm doing on my we recommend it a lot.
own, but I cannot do biology and the bookstore. It is Now there is a series from Argentina that in-
too much! So... Well, it was a decision that I was cludes a book by a woman who is an essayist and a
willing to make. painter, about the feminine and masculine roles.
There are also books on the anthropology of
You said that you stocked Rubyfruit Jungle. Are there women...
any other books for lesbians? Do you sell lesbian books? Then we have also lots of novels and there are
Is that a subject there? many novels that are really from a woman’s point
Realistically, no. It came from the people that of view. We often recommend these. For example,
import paperbacks; they bring everything, whatever we have Canon de alcéba by Tununa Mercado that’s
it is. I knew of the book and the author, so I bought it. erotic short stories with some political writings
It came with the other books, it didn’t come special. (Ada Korn editora, Buenos Aires, 1988). That’s quite
There is a group for lesbians, it’s small, and a newslet- unusual to have such a book from a women’s point
ter or very small magazine. There isn't much. You see, of view. It’s a very good book and it’s on the best-
I don't think it’s the time yet. I don’t think it’s very seller list everywhere.
easy to appear publicly in Argentina as a lesbian. I There's another book that I haven't seen here. I
think it’s very hard. don’t know if it’s been translated. It’s by a Japanese
woman who is living in Germany. She told this story
What types of books sell at Saga? What subjects are most of a Japanese woman who got a scholarship and came
popular? to study in the United States. She actually told, for
One of our bestsellers is a book about money example, how the Japanese view this United States
January/February 1990
This content downloaded from
(cid:0)(cid:0)(cid:0)(cid:0)(cid:0)(cid:0)(cid:0)(cid:0)(cid:0)(cid:0)(cid:0)(cid:0)70.126.145.227 on Sat, 19 Mar 2022 17:44:05 UTC(cid:0)(cid:0)(cid:0)(cid:0)(cid:0)(cid:0)(cid:0)(cid:0)(cid:0)(cid:0)(cid:0)(cid:0)(cid:0)
All use subject to https://about.jstor.org/terms",[]
46,"Feminist Bookstore News
from Japan and how the United States view them she confronts the whole real situation instead of
inside the United States. She tells what her experience that mythical, mystical situation — that wonderful
is at the university and when she meets Japanese state of being pregnant — and she doesn’t feel well,
people that are here and what happens. This girl had and she feels herself ugly... It’s fantastically written
been in Hiroshima as a small girl and her mother has from the woman’s point of view.
died. So there are lots of ideas in this book because it
has the war and the nuclear war and discrimination, I like it very much when books have humor. And
not only sexual discrimination, but racial discrimina- many women’s books have, in one sense or another,
tion as well. But it’s not a didactic book at all. It’s a this view of women.
wonderful novel. There are descriptions of some things in books
The distributor offered it to us and I began to and in films that only a woman could have told in
read it and I found it to be fantastic. And I said to that way. A woman writer that sells her books —
Nene, “Why don’t you read this, I think it’s she’s a very well known writer in Argentina, Angél-
wonderful."" So the book sold a lot. This book came ica Gorodischer. She was at the Montreal Fair. The |
from one of our biggest distributors. One day we other day she was at the bookstore and she said,
met because of another thing and he said, “What “You know, I am not impressed by what men write.
happened to that Japanese novel you are selling all I think what men write, it’s already known. I think
the time?” I said, “It’s a nice book — you should it’s much more rigid."" And on the other hand, a man
read it!” So we promoted the book that way. And it who is a publisher of poetry, said just the same
was fantastic. thing. He said that when he looks at what the men
poets are writing and when he looks at what the
women poets are writing, he thinks that the new
> There are descriptions of things come from women. From mern, it’s all more
some things in books that or less the same, always.
only a woman could have Another book we sell a lot is called Collective
told in that way. Diary. It was written by four women. One of them is
my partner. When they were together, they were going
Then there is another Mexican book that’s called to study, oh, I don’t recall what texts, but they saw that
Arrancame la vida by Angeles Mastretta (Alfaguara, whenever they began to study texts they always came
Mexico, 1986). It’s fantastic because it tells the story of to the personal situation. So they began to work on the
a young woman. She's fifteen years and she gets to personal situations and finally they decided to publish
know a man who is a Mexican General. So imagine this collective diary. It’s collective because you never
the situation: She gets to marry him and when they know whoʻitis bringing up a subject in the book. Every
were to the place where you get married the judge subject from buying clothes to your first menstrual
says to her in Spanish you have to put your name period, menstruation, sexuality, whatever... I always
“fulana de tal,” that’s from so-and-so (his sur- think it’s a good book because it’s written by Argen-
name). You maintain your own name but you're tine women, it’s published in Argentina, and so
property: you're owned by somebody else. And people don’t feel strange about it because it has to do
she puts it as she is told. Then, when he writes his with the everyday life of everyone. It’s also very
name she says, “You should put, ‘from me.’ ” moving. And it moves the reader’s thinking around.
That’s the ideology pervading the whole book. It makes one question if things are really what they
Well], finally, she’s very young and he’s big and always thought or if they should think something
with lots of experience and he becomes a gover- different.
nor in Mexico. It’s a view of power from the other
side. It’s very interesting. I liked it also very much And there's the book by Clara Coria that’s
because she also has humor. For example, she called El sexo oculto del dinero, that's The Healing Sex
takes up when she is pregnant the first time and of Money, that I mentioned earlier. That’s a best
January/February 1990 Volume 12 Number 5
This content downloaded from
(cid:0)(cid:0)(cid:0)(cid:0)(cid:0)(cid:0)(cid:0)(cid:0)(cid:0)(cid:0)(cid:0)(cid:0)70.126.145.227 on Sat, 19 Mar 2022 17:44:05 UTC(cid:0)(cid:0)(cid:0)(cid:0)(cid:0)(cid:0)(cid:0)(cid:0)(cid:0)(cid:0)(cid:0)(cid:0)(cid:0)
All use subject to https://about.jstor.org/terms",[]
47,"Feminist Bookstore News
seller and it’s a very good book. It’s in its fourth The daughter wants to do things that girls “shouldn't”
edition already. do. And she goes through things; it’s very funny.
I think that literature is very important. There are
phases in the lives of people when that person would
adventure of starting a want to read only precise and solid things, and there
women’s publishing are phases when you want to read a good book. But
you want to read a good book that doesn't go against
company, Croquiñol your own beliefs.
ediciones
And now we are in a new adventure of starting a
women’s publishing company. We are looking at the
Another thing that’s happening is that we have is idea of a women’s press because there are women in
non-sexist children’s books. There are some Argentine Argentina who are writing, who are thinking. We think
women writers, feminists, that are writing these there are women who could publish with a women’s
books. They have another perspective and another publishing company. There isa group working in mental
feeling about this. I think it’s very important. Luckily health who havea book written already. Thereisa feeling
the books come from a publishing house that is quite already that women’s things would be interesting to do.
economical so we can sell them easily. It will be called Croquiñol ediciones. Isabel Miranda,
There is one called Mrs. Small Iron. Mrs. Small Iron is Ana Sampaelesi, Nene and I are working on this ven-
just what a woman “should” be. But her daughter — no! ture. We'll have more news about it soon. o
Isabel Allende and many more!
NAME
(J Institutions $40, 1 year subscription ADDRESS
[J Datebook $10 LJ 10th Anniversary Issue $3
Send check to Barricada USA, P.O. Box 410150, San Francisco, CA 94141
Please contact us for subscription rates outside the United States.
Volume 12 Number 5 45 January/February 1990
This content downloaded from
(cid:0)(cid:0)(cid:0)(cid:0)(cid:0)(cid:0)(cid:0)(cid:0)(cid:0)(cid:0)(cid:0)(cid:0)70.126.145.227 on Sat, 19 Mar 2022 17:44:05 UTC(cid:0)(cid:0)(cid:0)(cid:0)(cid:0)(cid:0)(cid:0)(cid:0)(cid:0)(cid:0)(cid:0)(cid:0)(cid:0)
All use subject to https://about.jstor.org/terms",[]
48,"Feminist Bookstore News
Emily Faithful & The Victoria Press
Emily Faithful founded the Victoria Press in On lecture tours to the United States Emily was |
March 1860, employing 16 female compositors and a well received by the leaders of the women’s emanci-
few men to do the heavy lifting work. She en- pation movement, and reported on their activities in
countered violent opposition from men’s printing un- The Lady's Pictorial, whose staff she had joined. Her
ions, who claimed that a mixed workshop would lectures in England included dramatic readings and
encourage immorality. Nonetheless, the press quickly her own verse, and she wrote a novel, Change Upon
became a commercial success and provided exem- Change — A Love Story (1868), the message of which is
plary working conditions. a plea for the education of women and the creation of
career opportunities that would give them economic
and political independence.
Somewhat more unusually, Emily was cited in
the Coddrington divorce case in 1864 for alienating
the wife's affections, but such was the strength of her
character and so great was the esteem in which she
was held that she suffered no lasting damage to her
reputation. Read more about it in The Pink Plaque
Guide to London (Michael Elliman, Frederick Roll.
GMP, 1986). In 1854-6 Emily lived with the Coddring-
tons at 82 Eccleston Square, SW1. The Victoria Press
was located in Harp Alley, between Farringdon and
St. Bride Streets, EC4, and Emily lived at 9 Coram
Street, WC1, about 1861.
More about this estimable heroine of publishing
i E AVANS d É a Lca ibn r ab re y , f o Ju un nd e i 1n 9 7 4W . i l (l Ii sa m t h eF rr ee e d nm o a n f’ us l l -a lr et ni gcl te h in bi o T gh rae phy?)
In 1863 she started The Victoria Magazine, and later Thanks to David Doughan of Fawcett Library for
the West London Express. Queen Victoria was so im- bringing Emily Faithful to our attention.
pressed by the quality of work that she appointed Reprinted with permission from Wiplash, the monthly
Emily “Publisher and Printer-in-Ordinary to the newsletter of Women In Publishing — London (“Promoting
Queen.” Later in life Emily teamed up with Emma the status of women in publishing.”) Membership is £10/year.
Paterson to form the Women’s Printing Society. Nor Subscription to the newsletter is £5. $20 for US/Canadian
was this the only society she founded — she was a membership. Send your check/PO/Sterling International
prolific campaigner and pioneer in the promotion of Money Order made out to Women In Publishing, and post to
e nm izp edlo y wm ite hn t f o Cr iw o Lm ise tn , ea nn sd nh e r s e £r 5v 0ic e is w 1e 8r 8e recog- SLallyo nMacdEaochenrn , MNemb1er5sh ip 6SecQretLary,, 4 8UA S.tK. J.o hn sO Rd,
a i v l p i o o f n 9 .
46
This content downloaded from
(cid:0)(cid:0)(cid:0)(cid:0)(cid:0)(cid:0)(cid:0)(cid:0)(cid:0)(cid:0)(cid:0)(cid:0)70.126.145.227 on Sat, 19 Mar 2022 17:44:05 UTC(cid:0)(cid:0)(cid:0)(cid:0)(cid:0)(cid:0)(cid:0)(cid:0)(cid:0)(cid:0)(cid:0)(cid:0)(cid:0)
All use subject to https://about.jstor.org/terms",[]
49,"Feminist Bookstore News
Print
By Neil Woodward Renting Time
Category Six Books There are four ways to connect with the Books in
Print database on-line. The current Bowker catalog
There are basically two ways to get into Books in mentions two of these ways; that is, by signing on with
Print if you have a computer: via CD-ROM or via an one of the encyclopedic data bases such a Dialog or
on-line search. This article will give you a brief de- BRS (Bibliographic Retrieval Services) which any
scription of each possibility along with the approxi- former librarians out there will instantly recognize.
mate cost and the hardware you'll need. These services are widely used in college and univer-
Mega-Bucks ; sity libraries for doing bibliographic searches for cita-
tions in every conceivable academic field that has an
To run a CD-ROM (which stands for ‘compact indexed literature. Books in Print is also available
disk, read-only memory’) you will require a CD here. This service is more current than CD-ROM in
player that is compatible with your computer. You that it is updated monthly. It also indexes far more
load the CD into the player and access the disk from than the CD-ROM database, including over 1,000,000
your terminal. You can choose from several combina- titles with complete records for each indicating those
tions of information that Bowker offers on CD: the that are in print, as well as those out-of-print or out-
basic listing of books that are in print, or that along of-stock for the last 8 years. This information is retriev-
with books which are out-of-print, or the above with able by various search criteria or combinations of criteria.
Ulrich’s serials and annuals database. The annual sub- The cost is $65.00 per hour of search time for Dialog and
scription rate for Books in Print alone is $995.00 for $40.00 per hour for BRS. There are also fees involved for
disks that are updated quarterly. This provides access subscriptions to these services, and there are telecom-
to over 770,000 titles which you can browse through munications charges as well that you do not incur with
by Sears or Library of Congress subject heading, by CD-ROM. For these databases you need a computer, a
title, by author, or by other search criteria as well. modem, and a communications software package. We
There is an additional shipping fee of $15.00 per year. use Procomm, a very good ‘shareware’ program that we
Check the current Bowker catalog for more informa- acquired through PC-SIG in California.
tion. If you need constant, up-to-date access to Books
in Print all the time in your shop, this option is worth Ultra-Budget
looking at. It is very fast, and you can print, edit and The two other (unmentioned in the Bowker cata-
save citations from the database. log) ways to connect to the one and only Books in Print
47 January/February 1990
This content downloaded from
(cid:0)(cid:0)(cid:0)(cid:0)(cid:0)(cid:0)(cid:0)(cid:0)(cid:0)(cid:0)(cid:0)(cid:0)70.126.145.227 on Sat, 19 Mar 2022 17:44:05 UTC(cid:0)(cid:0)(cid:0)(cid:0)(cid:0)(cid:0)(cid:0)(cid:0)(cid:0)(cid:0)(cid:0)(cid:0)(cid:0)
All use subject to https://about.jstor.org/terms",[]
50,"Feminist Bookstore News
database are through a subsidiary of either of the databases you use. This price includes any database
above two services. Dialog has Knowledge Index (KI) royalties and the connect rate of $6.00 per hour. Both
and BRS has BRS/ AfterDark. This is the poor person's Knowledge Index and AfterDark provide complete
entree to the vast arenas of information indicated user's manuals with their packages.
above. The one limitation is that they are available After looking into alternate access to Books in
Print we chose the microfiche system for its compact
size, its price and currency to use out front by the desk,
and Knowledge Index for use in the computer room
on a non-demand basis. This combination works well
for us, but there are other combinations available to
you based on your needs. Look at the current Bowker
catalog for the basic information, then check into
only after business hours on weekdays. For sacrificing Alfred Glossbrenner’s indispensable book The
the capability of weekday access to Books in Print, you Complete Handbook of Personal Computer Communica- |
tions: Everything You Need to Go Online With the World
days, and after 2:00 p.m. on Sundays for a cut-rate where you will find the whole amazing panorama of
price. At Category Six Books we collect all the titles or telecomputing explained to you in terms that you will
subjects we want to check on the computer and then easily understand.
wait for a time in the evening or weekend to look into Toll-free phone numbers for further information:
it via Knowledge Index. At this point we don’t have to Dialog and Knowledge Index, 800-334-2564 or 800-227-
have instant access to Books in Print on-line all day 1927; BRS and BRS/AfterDark, 800-345-4277; Bowker,
long. It works for us to batch it. The cost for KI is $35.00 800-521-8110.
per year, but with a start up credit of 2 hours of free Postscriptum: Compuserve has just added access to BIP
searching and, thereafter, $24.00 per hour including all recently. However, it is very expensive and very slow search-
communications costs, it’s a good deal. BRS/After- ing. The charges are in addition to Compuserve’s normal
Dark costs $144.00 per year plus access fees ranging on-line charges and the telecommunications charges, so be
from $6 to $24 per hour depending on which careful. Compuserve’s number is 800-848-8990. O
*
*
[D Owned and operated by woren
D Co-owned and run by women
Name
Business Name D D L Wib rr ita er rian I D/ W Fe e m a ir ne i s te s p fe icc tia il ol ny interested in:
Address D Bookseller D Lesbian fiction
City/State/Zip D Publisher [D Lesbian non-fiction
Phone: DD CP rer afio td swica ol men D D F We om min enis ’t s t sh tue dor iey s a tn itd le spolitics
D Other D History
D Health
[I One Year - $55. Bill us. Bookstores, Publishers, and Periodicals — D Women and work
[D Special Trial Offer Is your focus primarily: D Gay men’s literature
D Feminist D Peace and anti-nuke boks
D Gay D Children’s books
D Alternative/political D Other
[I + $6 for Canadian postage. D General independent bookstore
January/February 1990 48 Volume 12 Number 5
This content downloaded from
(cid:0)(cid:0)(cid:0)(cid:0)(cid:0)(cid:0)(cid:0)(cid:0)(cid:0)(cid:0)(cid:0)(cid:0)70.126.145.227 on Sat, 19 Mar 2022 17:44:05 UTC(cid:0)(cid:0)(cid:0)(cid:0)(cid:0)(cid:0)(cid:0)(cid:0)(cid:0)(cid:0)(cid:0)(cid:0)(cid:0)
All use subject to https://about.jstor.org/terms",[]
51,"Oops! Shades of Lavender is alive and well and And in Las Vegas! Penny Kubla and Judy Brandt are
open in a new location, not closed, as we speculated opening a book-service/bookstore on a five-year plan.
in the last issue. Their new address is 1502 Hen- They'll start with selling books at Olivia Record/ -
dricks Ave., Jacksonville FL 32207. Their new phone Tupperware-type parties while being open weekends
number is 904-346-3182. We couldn't find them, the and eveningsin order to build a clientele before setting up
post-office claimed to have tried and failed (despite shop in a storefront. Send them information at 533 Holick
a forwarding order on file) but the grapevine Ave., Henderson NV 89015 and look for them at ABA!
worked. Someone who knew they weren't closed Karen Ray is opening a bookstore/cafe/deli in
read in FBN that they seemed to have disappeared, Aiken, South Carolina. She's moving to the town of
called Shades, and they called us... Our apologies
all around to everyone who was inconvenienced by
the misinformation.
But speaking of “missing” organizations, we've
had mail returned from Metis’ PO Box 25187. If any-
one has a current address or knows that this one is
good again, will you drop us a line?
New Stores:
Honolulu has a feminist bookstore now! Laugh-
ing Goddess Wymyn’s Bookstore is open and stocking
books, records, tapes, cards, periodicals and more.
Opened by Karen Gates (Aunt Edna's Reading List),
1020 Keeaumoku St. #303A (at Young St., above Cafe
Seoul), Honolulu HI 96814. 808-523-0906.
Out of the Dark has recently opened in what I'm
told is a far-flung Washington suburb, specializing in
lesbian and gay books. Send information to Out of the
Dark at 530 Randolph Rd, Newport News VA 23601.
804-596-6220.
Carolyn Peck will be opening a women’s book-
store in the Oklahoma City area this spring. Send her
information at 9609 Berkley Court, Oklahoma City OK
73162.
Heather Thorp and Susan Bennett are opening a
feminist, gay & lesbian store in Cleveland this spring.
Send them information and catalogs at 3964 Monticello
Blvd., Cleveland Heights OH 44121. See page 51 for ordering information!
49 January/February 1990
This content downloaded from
(cid:0)(cid:0)(cid:0)(cid:0)(cid:0)(cid:0)(cid:0)(cid:0)(cid:0)(cid:0)(cid:0)(cid:0)70.126.145.227 on Sat, 19 Mar 2022 17:44:05 UTC(cid:0)(cid:0)(cid:0)(cid:0)(cid:0)(cid:0)(cid:0)(cid:0)(cid:0)(cid:0)(cid:0)(cid:0)(cid:0)
All use subject to https://about.jstor.org/terms",[]
