PageNumber,Text,ISBNs
70,"Feminist Bookstore News
o anf d g a ey m o m tioa nle a l s o cc ri ie st iy s. before and during its great health Fh lo ew m i ng gay 's m Abe on u tf e Clt o u i rn a g et h (e H oa lg loe w o ayf A HI oD uS s. e , M $i 2c .k 9e 5y , C.
POETRY 0-87067-352-1, dist. by All America Distributors, 8431
Melrose PI., Los Angeles CA 90069, 213-651-2650, 40%
Paul Monette’s Love Alone: Eighteen Elegies for prepay for less than 50 copies) is a simple but affecting
Rog (St. Martin’s, $7.95, 0-312-02602-1), surely the account of growing up poor, Black and gay. It’s one of
most important book of new poems we've had in a very few books about Black gay men. The paperback
years; Gay and Lesbian Poetry in Our Time, the of Taking a Chance on God: Liberating Theology for
massive anthology, is due in paperback in December Gays, Lesbians, and Their Lover, Families, and
1989 (St. Martin's, $14.95, 0-312-03836-4). Friends by John J. McNeill (Beacon, $9.95, 0-8070-
7903-0) is out and should be carried by any store
interested in homosexuality and religion. Larry
Kramer's Reports from the Holocaust: The Making |
SELF-HELP of an AIDS Activist (St. Martin’s, $9.95, 0-312-03921-
2) isa pointed autobiography by the author of the play
We're very happy to have the revised Now That The Normal Heart and a founder of ACT-UP. Columbia
You Know: What Every Parent Should Know about will announce the paperback of Gays/ Justice, by R.
Homosexuality, by Betty Fairchild and Nancy Hay- Mohr ($13, 0-231-06735-6) for February or March, but
ward (Harcourt Brace Jovanovich, $8.95, 0- 15-667601- the scuttlebutt has it that it will be available in Decem-
x). It was hard doing without it between editions, even ber 1989. It’s the best overview of constitutional ques-
with Don Clark's The New Loving Someone Gay tions touching lesbians and gay men.
(Celestial Arts, $7.95, 0-89087-505-7) and Are You Still
My Mother?, by Gloria Guss Back (Warner, $7.95, ART
0-446-38195-0). It will be wonderful to have in January I was going to recommend the photo book
Betty Berzon’s Permanent Partners: Building Gay Bruce Weber, but after a couple of weeks in print,
and Lesbian Relationships That Last (NAL, $9.95, it’s OSI, and apparently won't be reprinted; so, if
0-452-26308-5) in paperback, to join The Male Couple, you can carry any gay men’s art books the new one
by David McWhirter and Andrew Mattison (Prentice- to carry is Ken Haak’s Sleeping Beauties (St. Mar-
Hall, $8.95, 0-13-547563-5) and Eric Marcus’ The Male tin’s, $29.95, 0-312-01090-7). It continues the con-
Couple's Guide to Living Together (Harper & Row, temporary expansion of the possibilities of the male
$10.95, 0-06-096143-0). Everybody has her favorite nude, the subject that has gotten Robert Mapple-
basic AIDS book. If you can bear to consider our thorpe such sensational attention.
choice, please look at the newly revised The Essential
AIDS Fact Book, by Paul Douglas and Laura Pinsky HUMOR
(Simon & Schuster, $3.95, 0-671-67852-1). Coming in I hope Leigh Rutledge’s Gay Fireside Compan-
February is the paperback of Victims No Longer: Men ion (Alyson, $7.95, 1-5583-164-8) is out by the time you
Recovering From Incest and Other Childhood get this (it was due in October, but we haven't seen it
Sexual Abuse by Mike Lew (Harper & Row, $14.95, in December now) to follow the great success of his
0-06-097300-5), a rare and good book on the subject. two earlier compilations, Unnatural Quotations and
NON-FICTION CT rh ue s eG ’sa y W eB no do ek l o of n L ti hs et s , R eb bo ot uh n da l s (o S t .f r Mom ar t iA nl ’y s s o $n 9. . 9 5H ,oward
Harvard has just reprinted G.K. Dover’s Greek 0-312-03002-9) is a new collection of the best-loved gay
Homosexuality ($12.95, 0-674-36270-5), the most men’s comic strips. Matt Groening’s cartoon book,
thorough examination of this perennially favorite Akbar & Jeff’s Guide to Life (Pantheon, $6.95, 0-679-
topic. It includes a chapter about lesbianism in ancient 72680-2) is quite cute.
Greece. Andrew Holleran’s Ground Zero (NAL, That's it folks! Feedback is very welcome. I'll be
$7.95, 0-452-26236-4) is the collection of essays that particularly interested to know if you would like to
people will read next century when they want to know know more about hardcovers. O
January/February 1990 Volume 12 Number 5
This content downloaded from
(cid:0)(cid:0)(cid:0)(cid:0)(cid:0)(cid:0)(cid:0)(cid:0)(cid:0)(cid:0)(cid:0)(cid:0)70.126.145.227 on Sat, 19 Mar 2022 17:44:05 UTC(cid:0)(cid:0)(cid:0)(cid:0)(cid:0)(cid:0)(cid:0)(cid:0)(cid:0)(cid:0)(cid:0)(cid:0)(cid:0)
All use subject to https://about.jstor.org/terms","['0-87067-352-1', '0-312-02602-1', '0-312-03836-4', '0-231-06735-6', '0-89087-505-7', '0-446-38195-0', '0-452-26308-5', '0-13-547563-5', '0-312-01090-7', '0-06-096143-0', '0-671-67852-1', '0-06-097300-5', '0-312-03002-9', '0-674-36270-5', '0-452-26236-4']"
71,"Feminist Bookstore News
in Feminist
Bookstores
By Betsy Nuse My request for a review copy of Helen Dun-
more’s The Sea Skater (Bloodaxe, 1-85224-006-7, US$
My favourite in this issue's pile of new books is 10.95 pb, in the U.S. from Dufour) brought two newer
Green the Witch-Hazel Wood by Emily Hiestand titles from the same publisher as well. Dunmore’s
(Graywolf, 1-55597-120-2, US$ 9.00 pb, dist. Baker & book is my favourite: woman-centred, intelligently-
Taylor, Ingram, BP and IN). Hiestand’s voice is new to written. But any apiarists among your clientele will
me; her writing is meticulous and understated. The swoon at the bee-related metaphors in The Honey-
poems are not sensuous; sometimes they seem even a bit comb by Pauline Stainer (Bloodaxe, 1-85224-073-3,
too contemplative or intellectual. But, for the tradition of US$ 12.95 pb).
well-schooled poets, this is a fine first book, and I hope
we will hear more from this author whose luscious
rainforest painting fills the book's attractive cover.
If you have customers with serious interest in
Russian literature, draw their attention to Shadow of
a Soul, collected poems of Bella Dizhur, translated by
Sarah W. Bliumis (Moyer Bell, 0-918825-63-6, US$
12.95 pb, dist. Baker and Taylor, Ingram). Not only is
this bilingual collection the first appearance of Diz-
hur’s work in English, but the publisher describes it
as the first complete collection of her poems in any
language. Though she was a successful writer of
books for children, Dizhur was denounced for her
poetry and lived for many years as a rufusnik, until From ManRoot come two intriguing titles. The
she was permitted to emigrate to New York City in newest is Clitoris Lost: A Woman’s Version of the
1987 at the age of 84. I thought the English poems Creation Myth, a take-off on John Milton’s ordering
rather high-toned and inanimate, but the Russian, of a heaven, earth, and hell by Lynn Lonidier (Man-
which I can't read, may well be better. Root, no ISBN, US$ 11.95 pb, dist. BP, Small Press and
If you stock mixed (female/male) anthologies, I Bookslinger). Definitely for the daring, this large-
urge you to enrich your Native section with Seventh format book, printed on a pastel rainbow of paper
Generation, a new collection of contemporary Native stock, simmers dreams, word play, Pre-Columbian
writing edited by Heather Hodgson (Theytus Books, artifacts and in-jokes in a strong stock of stream of
0-919441-30-0, C$ 11.95 pb. Terms: 40%, no minimum, consciousness, ancient Cretan goddess religion, lesbi-
returns in 60 days, P.O. Box 218, Penticton, B.C., anism and San Francisco Bay ocean water that took
Canada V2A 6K3). I was delighted to find finally in me on a trip I did not entirely understand, but oc-
print some poems by Jeannette C. Armstrong, a mar- casionally laughed at and enjoyed. The older title, but
velous Okanagan poet whom I hear read whenever I one new to me, was Her Magnificent Body: New and
can, but also discovered — as one often does through Selected Poems (ManRoot, no ISBN. US$ 8.50 pb) by
an anthology — wonderful moon poems by Annharte, Janine Canan (whose recent anthology for Crossing,
from Manitoba. She Rises Like the Sun, was mentioned several columns
69 January/February 1990
This content downloaded from
(cid:0)(cid:0)(cid:0)(cid:0)(cid:0)(cid:0)(cid:0)(cid:0)(cid:0)(cid:0)(cid:0)(cid:0)70.126.145.227 on Sat, 19 Mar 2022 17:44:05 UTC(cid:0)(cid:0)(cid:0)(cid:0)(cid:0)(cid:0)(cid:0)(cid:0)(cid:0)(cid:0)(cid:0)(cid:0)(cid:0)
All use subject to https://about.jstor.org/terms","['1-85224-006-7', '1-55597-120-2', '1-85224-073-3', '0-918825-63-6', '0-919441-30-0']"
72,"Feminist Bookstore News
Another review copy I requested was When I
Kept Silence by Naomi Clark (Cleveland State Uni-
versity Poetry Center, 0-914946-69-2, US$ 6.00 pb.
Terms: 40%, no minimum, returns with permission,
CSU Poetry Centre, Dept. of English, Rhodes Tower,
Room 1815, Cleveland, Ohio 44115). This is a plain but
wonderful collection about “long loves, human and
animal” which begins with recollections of childhood
on a farm in Texas. Crows appear in many of the
poems, the truest use of this emblem by a non-Native
“...a fine affirmation of lesbian writer that I have encountered. The same publisher
also sent Returning the Question by Trish Reeves (0-
identity and sexuality.” 914946-66-8, US$ 6.00 pb). It’s not really a feminist
—carol anne douglas, book, but it includes some haunting poems on marital '
off our backs disillusionment and madness.
ISBN 0-961-74060-4 Mary Crow was the editor and translator of Latin
Paper, $3.95 American Review Press’ Women Who Have Sprouted
Available to bookstores from Inland Wings: Poems of Contemporary Latin American Women
Poets. The poems of her own book, Borders (BOA
Side w P.O. a Bol x k 906 2 e R Pitte sbu w r(g4h,1o P2Al ) u 1 523t 246r 1o -8n 92 7 Preu E B Ld ao toi it k nio s ln i Ans, mg e e0 r r- i9 co1 ar8 , 5 2 S s6 m e- n7 a s1 l il t- iX vP, er l e yU s sS )$ c o d n8 e t. s0 rc0 ar si tbp ie nb g, h d e dri es st ct. rr iaB pvP te i, l o s n I N si n, of
unusual places with anguish over political repression.
ago). I especially enjoyed Canan’s prose poems and Corners by Grace and Bea Nettles (Inky Press,
the emotional, descriptive writing in this substantial 0-930810-03-1, US$ 14.95 pb, dist. University of
collection. Illinois) is a book, to me, more interesting for its con-
More traditional but pleasant is One Road Down cept and format than actual content. It is a collabora-
From the Wilderness, a first book of poems by 80- tion between mother and daughter: mother Grace
year-old music teacher Julia Bates (Fithian Press, PO wrote the poems, and daughter Bea used her photo-
Box 1525, Santa Barbara CA 93102, 0-931832-30-6, US$ graphs and photo collages to design “an emblem
7.50 pb, dist. BP, or direct 1-4 copies at 20%, 5+ at 40%). book,” which Grace describes as “a modern variation
As well as a marvelous array of female characters from of a tradition that has long been recognized as literary,
her own family, these poems describe other women — but which is actually a tradition of two arts working
even things — with a female eye: the mother of Jesus, the side by side.” Draw the attention of any writing teach-
maker of a Shaker chair, even a Kashmiri box asa womb. ers or Writing groups among your clientele to this
Another fine book of “traditional” contemporary appealing idea.
poems is The Word for Sand by Heather Spears (Wol- Barbara Carey's second book, The Year in Pic-
sak and Wynn, 0-919897- 10-X, C$ 8.00 pb. Terms: 40%, tures (Quarry, 0- 919627-53-6, C$ 10.95 pb, dist. in
no minimum, returns OK, 43 Eglinton Avenue East, Canada by University of Toronto, in U.S. by
Suite 802, Toronto, Ontario, Canada M4P 1A2). Spears’ Bookslinger) is situated in the city, with its imper-
writing nicely balances compassion and distance. I sonality, distractions and poverty. By honestly ac-
suspect from some of the poems and the simple yet knowledging feelings of relationship, Barbara’s
artful drawings which illustrate the book that the poems dissolve in a profoundly female way — even if
author works for pay as an artist. I was most moved momentarily — urban angst so that we can “remem-
by part three of the book about babies — including ber the divisions/are thin, there are/other lives
drawings of them — and part six, centred around the below.” Her open compassion in the heart of the city
captive dolphin in Canada’s landlocked super-plaza, is not announced with fanfare, but makes her versions
the West Edmonton Mall. of this familiar poetic genre uniquely interesting. O
January/February 1990 70 Volume 12 Number 5
This content downloaded from
(cid:0)(cid:0)(cid:0)(cid:0)(cid:0)(cid:0)(cid:0)(cid:0)(cid:0)(cid:0)(cid:0)(cid:0)70.126.145.227 on Sat, 19 Mar 2022 17:44:05 UTC(cid:0)(cid:0)(cid:0)(cid:0)(cid:0)(cid:0)(cid:0)(cid:0)(cid:0)(cid:0)(cid:0)(cid:0)(cid:0)
All use subject to https://about.jstor.org/terms","['0-914946-69-2', '0-961-74060-4', '0-930810-03-1', '0-931832-30-6']"
73,"Feminist Bookstore News
Since this issue of FBN focuses on periodicals, I And finally, thanks to Kate Fearnley of West and
wish I could commend to you a women’s or feminist- Wilde in Edinburgh, who answered my query of two
oriented f/sf magazine. Unfortunately, I can’t, for all issues back; my long-sought copy of Rachel Pollack’s
the f/sf “fanzine” scene is flourishing and various. Unquenchable Fire crossed the water without inci-
The “matriarchal fanzine” Windhaven disintegrated dent. The use of a credit card made the currency
years ago in a splatter of controversy about the trans- switch painless.
sexuality of founding editor Jessica Amanda Salmon-
son, and Aurora's publication schedule has stretched
from sporadic to nonexistent.
Your f/sf/horror writing staff and customers
should however know about Scavenger's Newsletter, a ACE
wonderful monthly digest/newsletter of who’s look- Weirdness reigns in Sheri S. Tepper’s Marianne,
ing for what kind of writing and much commentary the Matchbox, and the Malachite Mouse ($3.50), in
by writers, editors, and publishers. The editor is Janet this newest of the acclaimed Marianne series; this also
Fox, and you can reach her at 519 Ellinwood, Osage reflects Tepper’s fascination with board games come
City, KS 66523. A sub is $10/year, a real deal. to life. The Luck of the Wheels ($3.50) by Megan
Another resource is the Small Press Writers and Lindholm picks up the adventures of the Gypsy trader
Artists Organization, which publishes a bimonthly Ki and her companion Vandien, begun years ago in
newsletter. When I joined SPWAO, I received a Harpy'’s Flight, The Limbeth Gate, and a third whose title
friendly and personal welcoming letter from the “First I forget.
Contact” committee. That was a first. You can reach Hurray for Hollywood by Esther M. Friesner and
the newsletter at 1705 Seigle Ave., Charlotte, NC Dancing Vac by S.N. (Shariann) Lewitt are both due
28205. First year sub is $17.50, thereafter $15/year. in February, and look for Sara Stamey’s Double Blind
For the librarians and reference folks among you, in May.
the 1989 edition of Science Fiction and Fantasy Book
Review Annual is available from Meckler, 11 Ferry AVON
Lane West, Westport, CT 06880. It reviews about 500 The Shining Falcon, by Josepha Sherman, $3.95.
English-language titles published during the preced- A well-reviewed fantasy adventure-romance with
ing year and costs $65. Slavic roots, a female protagonist named Maria, and
You'll notice a slight change in the following pub- forests full of wild and quirky magics.
lisher listings: Titles about which I know virtually
nothing and those of marginal interest to feminist BAEN BOOKS
bookstores are combined in paragraph form. Apocalypse, by Nancy Springer, $3.95. The
When you think about it, please drop me a line to archetypal Four Horsemen are here translated into
let me know what you're looking for in f/sf. Would women (Hunger is the anorexic wife of the local
you like to see more horror titles, or more YA? Any- undertaker) in a depressed, mined-out Pennsylvania
thing else? town. The result is involving, often macabre, but
71 January/February 1990
This content downloaded from
(cid:0)(cid:0)(cid:0)(cid:0)(cid:0)(cid:0)(cid:0)(cid:0)(cid:0)(cid:0)(cid:0)(cid:0)70.126.145.227 on Sat, 19 Mar 2022 17:44:05 UTC(cid:0)(cid:0)(cid:0)(cid:0)(cid:0)(cid:0)(cid:0)(cid:0)(cid:0)(cid:0)(cid:0)(cid:0)(cid:0)
All use subject to https://about.jstor.org/terms",[]
74,"Feminist Bookstore News
ultimately unsatisfying — I think because Springer The story charts their rival attempts to reclaim their
keeps backing off from the rich and deep political birthplace and carry on the feud that caused its fall.
implications of her story. Definitely worth carrying, MZB exerts firmer than customary control over her
however. material here, and the result is likable enough but
Shaman, by Sandra Miesel, $3.50. Based on the devoid of passion. In hardcover, this is for Darkover
author's 1980 novel Dreamrider, this is a well above- fanatics only.
average story of an apparently ordinary young Magic's Promise, by Mercedes Lackey, $4.50.
woman in a relentlessly conformist alternate-U.S. who Jackie Cooper's review in the Lambda Rising Book Re-
is pulled into a parallel future to be trained in port tipped me off that the “Last Herald-Mage” series,
shamanic skills by a wise elder woman and her ap- of which this is book two, has a definite gay male
prentice, a humanoid otter. I believed it, liked it, and angle. Book one is Magic’s Pawn ($3.95).
wasn't tempted to put it down. Shadowplay, by Jo Clayton, $4.50. The protago-
nist of this one is Shadith, long the captive of the |,
Diadem in Clayton's multi-volume Diadem saga.
+ Here she is prisoner again, of a nasty producer of
galactic level snuff films who wants her to play a
demigod in his next production. April.
Also from Baen, Mary Brown’s well-reviewed The Moonbane Mage, by Laurie J. Marks, $3.95.
The Unlikely Ones is now out in paper. In May, Follows Delan the Mislaid ($3.95) in “The Children of
Melissa Scott's Mighty Good Road is accompanied by Triad,” in which several races struggle to share a
the rerelease of several of her previous titles. June world in some kind of harmony. April.
brings The Fall of Atlantis, published some years ago Also from DAW, Jackie Hyman’s Shadowlight
in two volumes as Web of Light and Web of Dark- ($3.50) features a female protagonist in a tale of psionic
ness; I found them tedious, but other Bradley fans skills, magic, and ancient evil. In February, Sun-
may disagree. runner's Fire ($4.95) continues Melanie Rawn’s
Elizabeth Moon’s name is appearing frequently “Dragon Prince” epic, and FreeMaster ($3.95), a first
these days. Her Sassinak ($4.95), a collaboration with novel by Kris Jensen, pits Terran emissary Sarah
dragonlady Anne McCaffrey, is due in March. In it, a Anders against greedy mercenaries in a battle for the
girl kidnapped at 12 eventually escapes and becomes mineral-rich planet of Ardel.
a pirate-chasing Fleet captain. Doesn't sound earth-
shattering, but neither co-author should be ignored.
Moon's collection Lunar Activity ($4.50) is due in RAs
April and Surrender None: The Legacy of Gird in
June, along with several of her earlier works, includ-
ing Sheepfarmer’s Daughter. DEL REY (BALLANTINE)
The Changling Sea, by Patricia A. McKillip,
DAW BOOKS $3.95. New fantasy about a young woman and her
Sword-Maker, by Jennifer Roberson, $4.95. hatred of the sea; McKillip writes magical prose and is
Though I enjoyed its predecessors, Sword-Dancer and always worth a look.
Sword-Singer, I gave this one short shrift because the
advance publicity indicated a focus on the male half DELACORTE
of its protagonist duo. But a f/sf-loving crony tells me High Wizardry, by Diane Duane, $14.95 cl. Third
it’s the best in the series. Give it a try. YA fantasy about junior wizards Nita and Kit and,
The Heirs of Hammerfell, by Marion Zimmer especially, Nita’s younger sister Dairine, who finds
Bradley, $18.95 cl. In the first Darkover novel in five her own magic manual on a portable computer. Alla’
years, set in the Hundred Kingdoms period, male that’s all right, but I wish Duane would get on with
twins are separated in infancy and raised one in the the wonderful series she started in Door into Fire and
sophisticated city, the other in his rustic homeland. Door into Shadow. April.
January/February 1990 72
This content downloaded from
(cid:0)(cid:0)(cid:0)(cid:0)(cid:0)(cid:0)(cid:0)(cid:0)(cid:0)(cid:0)(cid:0)(cid:0)70.126.145.227 on Sat, 19 Mar 2022 17:44:05 UTC(cid:0)(cid:0)(cid:0)(cid:0)(cid:0)(cid:0)(cid:0)(cid:0)(cid:0)(cid:0)(cid:0)(cid:0)(cid:0)
All use subject to https://about.jstor.org/terms",[]
75,"Feminist Bookstore News
DOUBLEDAY/FOUNDATION NAL/ROC
Alamut, by Judith Tarr, $8.95 pb. An epic-length New American Library in April launches its new
fantasy romance-adventure set in the time of Saladin f/sf imprint, Roc, which seems to incorporate the f/sf
and the Christian crusaders which, according to titles previously published under the Signet imprint.
Locus’s Faren Miller, “is what used to be called a Of particular interest are the paperback reprint of
‘woman's book’ — for better and for worse. Conflict Mary Gentle’s Ancient Light, due in June, and in
erupts between husbands and wives, both Christian October the reprint of Ursula K. Le Guin’s collection
and Moslem, and the oppressors of women generally Buffalo Gals and Other Animal Presences and a new
receive their just desserts.” Tarr is also a very good novel by one of my favorite authors, R.M. (Rebecca)
writer, though in her plots the female characters tend Meluch, Chicago Red.
to take second place to the men.
HUNTER HOUSE ARAA
On the Road to Bagdad, by Guneli Gun, $19.95
cl. A young Turkish girl, left behind when her
parents go on pilgrimage, sets off to find them in a SPINSTERS/AUNT LUTE
journey that crosses time as well as space. She visits Coz, by Mary Pjerrou, $9.95 tp. Just arrived and
the age of the Thousand and One Nights, among looks great; a “metaphysical thriller” that would be at
others, and in the present meets up with Shahrazad, home in any collection of women’s f/sf. More next
author of those tales. Carolyn Cushman’s com- issue, I hope.
ments in Locus are tantalizing: ”...a somewhat re-
visionist, feminist viewpoint...in which women TOR
often play a more powerful role than shown in later Crusader’s Torch, by Chelsea Quinn Yarbro,
versions. Occasionally bawdy, with sex scenes $4.95. After about 100 pages, I set aside this epic tale
couched in the quaint language of Victorian porn, the of Atta Olivia Clemens, a vampire and Roman lady
novel even has Huru marry another woman at one trying to get out of Tyre on the brink of the Third
point.” Probably too much of a risk in hardcover, but Crusade. The writing is fine, the characters and set-
I thought I'd let you know. Hunter House is at P.O. tings vivid, but with books and manuscripts piling up
Box 847, Claremont, CA 91711. all around my house I just can’t do long unless it’s
utterly compelling — and this wasn’t, not enough. A
MORROW Candle for D'Artagnan ($22.95, cl) concludes Olivia’s
Brain Rose, by Nancy Kress, $17.95 cl. A “trendy saga and is set in the time of Louis XIII, also (surprise)
sf thriller” from a very good writer, incorporating the time of the Three Musketeers.
“fears of AIDS, anti-homosexual movements, eco- Inferno, by Louise Cooper, $3.95. The second
logical balance, gestalt theory, and past lives.” book of Indigo, the saga of a princess who released
evils into the world then was given the chance to
MORROW JUNIOR undo her deed, continues the promise of Nemesis,
Seal Child, by Sylvia Peck, $12.95 c]. A juvenile that though some tension is lost as the protagonist ven-
focuses on the friendship between Molly and Meara, the tures farther in time from the world she destroyed.
seal child of the title. Carolyn Cushman says it conveys The evocations of fire and fanaticism here are
“a sense of magical mystery and childhood passion memorable indeed.
seldom found in genre fantasy,” and that it is moving as People of the Sky, by Clare Bell, $18.95 cl. Wish I
well as predictable and not very deep. knew how they decide what's cloth and what's paper.
This sounds good: A female star-pilot of Hopi ancestry
NAIAD becomes involved with a lost colony of Pueblo Indians
Virago by Karen Marie Christa Minns, which on a distant planet. Carolyn Cushman calls it fascinat-
Locus lists as horror, is scheduled for February, and ing and erotic.
Priorities by Linda Lyons for April. See Science Fiction, page 87
January/February 1990
This content downloaded from
(cid:0)(cid:0)(cid:0)(cid:0)(cid:0)(cid:0)(cid:0)(cid:0)(cid:0)(cid:0)(cid:0)(cid:0)70.126.145.227 on Sat, 19 Mar 2022 17:44:05 UTC(cid:0)(cid:0)(cid:0)(cid:0)(cid:0)(cid:0)(cid:0)(cid:0)(cid:0)(cid:0)(cid:0)(cid:0)(cid:0)
All use subject to https://about.jstor.org/terms",[]
