PageNumber,Text,ISBNs
24,"Feminist Bookstore News
Off Our Backs, 50 monthly; Fireweed, a quarterly of Canadian women’s writ-
Woman’s Review of Books, 40 monthly; ing, poetry, and commentary. Special issues focus on
On Our Backs, 70 bimonthly; women of color, lesbians, class, and Asian women.
Women of Power, 80 quarterly; Sistervision Press reprinted the 1983 Women of Color
Outlook, 60 quarterly; issue in book form as The Subject Is Ism.
Bad Attitude, 80 tri-annually; Black/Out, the magazine of the National Coali-
HotWire, 70 copies 3 times yearly; tion for Black Lesbians and Gays, includes news, es-
For Crying Outloud, 50 quarterly newsletter; says, poetry, fiction, and reviews by new and
Sinister Wisdom, 40 quarterly; established writers. Summer ‘89 issue features a
Common Lives, Lesbian Lives, 40 quarterly; and tribute to Joe Beam including work by Audre Lorde,
Lilith, 40 quarterly. Angela Bower, and Becky Birtha.
Third World Resources, a quarterly newsletter
A Few Favorites packed with critical reviews, comprehensive lists,
Though we'd definitely include among our per- and other educational resources from and about the
sonal favorites many of the bestsellers (we're espe- Third World.
cially attached to and involved with local periodicals Literary reviews like Lambda Rising, covering
like Soj, GCN, Women’s Review, and Women of lesbian and gay writing, Belles Lettres, often featur-
Power) we want to spread the word about a few of our ing themes on ethnicity and class, and Hurricane
other much-loved, less well-known periodicals. Alice from Minneapolis comprise, with Women’s Re-
Women and the Environments, a one-of-a-kind view of Books, a substantial subsection dear to our
journal out of Toronto that focuses on women in rela- booksellers’ hearts.
tion to the built and natural environment. Journals comprise 6% of sales this year (a higher
Heresies, the “radical journal of women’s culture percentage than either mass market or hardcover
and art” that just celebrated its 12th year with an books). We sell, roughly, 35 journals daily. The high
anniversary issue sure to become a classic along with sales volume of popular journals “subsidizes” the
its special issues on racism, the goddess, film, food, ones that are less in demand but equally crucial to
architecture, and music. keep in stock.
I never order a magazine sight unseen. Book-
sellers should feel free to write for sample copies of
magazines they are seriously considering stocking.
New stores with limited space or capital might begin
with periodicals of proven appeal (Sojourner, Women
of Power, and HotWire) and journals dealing with
specific subject matter — health, spirituality, lesbian
culture — matched to book section sales. Gradually
customers’ journal-buying might become as habit-
forming, and healthy, as book-buying.
It’s helped us to keep a careful eye on sales to
minimize under- or over-ordering. Though this is ini-
tially time-consuming, it eventually becomes quick
and automatic. One of the biggest appeals of the jour-
nal section, from a sellers’ view, is the fact that it is
manageable: unlike books, journals exist in a finite
number. They don’t require a computer to keep
track of them. After a few hours of fussing with the
shelf display and plowing through the notebook,
I'vce o acmtuallyp klnoewtn ithne ugnc om maon botokastosrek jo.y o fO
January/February 1990 Volume 12 Number 5
This content downloaded from
(cid:0)(cid:0)(cid:0)(cid:0)(cid:0)(cid:0)(cid:0)(cid:0)(cid:0)(cid:0)(cid:0)(cid:0)70.126.145.227 on Sat, 19 Mar 2022 17:44:05 UTC(cid:0)(cid:0)(cid:0)(cid:0)(cid:0)(cid:0)(cid:0)(cid:0)(cid:0)(cid:0)(cid:0)(cid:0)(cid:0)
All use subject to https://about.jstor.org/terms",[]
25,"Feminist Bookstore News
Canadian Content
By Donna Murray keep me busy for a few winter nights, and food for
thought for a long time to come. Keeping close to
I'm writing this just a few days after two striking deadline for FBN (squeezing in under the wire) my
events have taken place in Canada: in chronological survey may be limited in that I did not contact other
order, on December 1st, the election of Audrey feminist stores for their own selections, and I fear that
McLaughlin as federal leader of the New Democrat I will have missed more feminist periodicals out there
Party, the first woman to lead one of the top three in the Canadian market. Future articles could look to
political parties in Canada; and on December 6th, in those and in the meantime I list for your interest and
Montreal, the massacre of 14 women, by a gunman ordering information thirteen Canadian periodicals.
who separated the victims by gender and murdered
the women. Both events, seemingly at the opposite
ends of the scale of hope for the future, have roused
the consciousness of Canadians, but for me the Mon-
treal massacre has far out-shadowed the forward step
of McLaughlin’s success. It feels like we are still in the
maze of “one step forward, [many] steps back,” and it First, honourable mention is essential to Broad-
is my hope that from the devastating murders of side, Canada’s oldest feminist newspaper, which
fourteen women — killed because they were women — folded this year because of a failure to obtain renewal
comes finally, for those persistent non-believers and of their publishing grant. Broadside kept many of us
skeptics, the realization that the presence of violence informed in the early years when it was the only
against women is very pervasive, very real, and very feminist paper in Canada, and provided inspiration to
much a part of our day-to-day existence. many of us in outlying regions to “get it in writing.”
Without them, we may not have had the wherewithal
A Canadian Core List to move into the following areas of publication.
As for the regular substance of Canadian Con- Room of One’s Own: Growing Room Collective,
tent, I offer a selection of periodicals from among a $7/issue, ISSN 0316-1609, 150pp. Ordering info: PO
variety of available feminist publications. In re- Box 46160, Station G, Vancouver, BC, V6R 4GS5. This
searching this article, I simply collected one of each quarterly journal features Canadian women writers,
magazine from my local feminist bookstore and sat on a regular basis, often devoting a single issue to a
down to browse. Surfacing many hours later I was specific individual (i.e., Anne Cameron, Marion
impressed with the content, the variety, the lay-out Engle, Audrey Thomas, Carol Shields, etc.) from a
and design and even the cost! Ranging in price from variety of angles — interviews, critiques, writings by
$2.00 to $7.00 for monthlies, quarterlies and bi-month- the featured author. Contributions encompass the
lies, the selection gave enough reading material to range of writing from theatre, poetry and prose, to
23 January/February 1990
This content downloaded from
(cid:0)(cid:0)(cid:0)(cid:0)(cid:0)(cid:0)(cid:0)(cid:0)(cid:0)(cid:0)(cid:0)(cid:0)70.126.145.227 on Sat, 19 Mar 2022 17:44:05 UTC(cid:0)(cid:0)(cid:0)(cid:0)(cid:0)(cid:0)(cid:0)(cid:0)(cid:0)(cid:0)(cid:0)(cid:0)(cid:0)
All use subject to https://about.jstor.org/terms",[]
26,"Feminist Bookstore News
discussions on feminist literary criticism. Back issues Common Ground: The News and Views of PEI
available. Women: Woman's Network $2/issue, ISSN 0715-
Fireweed: Fireweed Collective, $4/issue, ISSN 478X, 30pp. Ordering info: PO Box 233, Charlotte-
0706-3857, 140pp. Ordering info: PO Box 279, Station town, Prince Edward Island, Canada, C1A 7K4. This
B, Toronto, Canada, M5T 2W2. This feminist quarterly bi-monthly magazine covers a broad range of topics
presents a collection of fiction, poetry, essays, and concerning all women, with particular attention paid
reviews from an eclectic group of Canadian women. to issues relating directly to the women of that island
The operating collective intersperses open issues con- province. Interviews, poetry, and articles on afford-
taining content as mentioned above with special is- able housing, menopause, a teen-helpline and topics
sues featuring Asian Women or Experimental Writing. relevant to native Innu of the eastern provinces, make
Back issues available. up the content of Common Ground. Department sub-
Diva: A Quarterly Journal of South Asian headings include families, education, environment,
Women: Published by Diva, 253 College Street, Unit health and women’s groups. The magazine “strives to
194, Toronto, Canada, M5T 1R5; ISSN 0842-4330, present positive and varied images of women and to
60pp. C $5/issue (15 rupees in South Asia). Dist. by support the network of islanders promoting women’s
CPPA* in Canada, Inland in US and Europe. Diva equality.”
presents a variety of articles, research, columns, LesbiaNews: Victoria's Monthly Lesbian Femi-
poetry and illustrations from Canada, Pakistan, India nist Newsletter: Published by Debby Gregory
and Denmark. In the “On Children” issue of June- $2/issue 12pp. Ordering info: PO Box 5339, Station B,
August 1989, were contributions from women and Victoria BC, V8R 6S4. From the island at the opposite
children covering domestic violence, children at work, end of Canada from PEI comes this recent publication.
racism, prostitution and kids & drugs. The repre- A collection of letters, stories, poems, news items,
sentation of South Asian women provides a strong and cartoons aims, as Gregory’s first editorial
voice describing the problems women face from these states, to “provide [the Victoria community] with a
contributors’ personal perspectives. public sense of ourselves, as well as to function as a
safe forum for communication and exploration.”
Specific to the Victoria community, this newsletter
provides thoughtful and thought-provoking copy
for its readers.
Resources For Feminist Research/ Documen-
tation sur la Recherche Feministe: Ontario Institute
Healthsharing: A Canadian Women’s Health for Studies in Education (OISE), 252 Bloor Street West,
Quarterly: Women Healthsharing, Inc. $3/issue, ISSN Toronto, Canada, M5S 1V6, $6.50/issue, ISSN 0707-
0226-1510, 34pp. Ordering info: Healthsharing, 14 8412, 100pp. This scholarly journal is useful as a refer-
Skey Lane, Toronto, Canada, M6] 3S4. Covering perti- ence tool for keeping informed of current feminist
nent issues related to women and health, this quar- research. Providing articles in both official languages,
terly magazine includes in-depth reporting on RFR/DRF covers everything from women and AIDS
abortion legislation, medical insurance coverage for to anthologies of 17th Century British women’s verse.
lesbian/gay couples, bereavement and women and It also has an historical and international scope in its
the medical industry. Departments include collective presentation of scholarly works.
notes, letters, updates (this month — Dalkon shield, The Womanist: My copy of their latest issue had
midwives, infertility, and pharmaceutical issues), already been recycled by the time I sat down to write
and a back cover page of resources and events. this column, but this new publication distributed
Jennifer Cooper, executive director of the Winnipeg nationally from the country’s capitol offers in-depth
Women’s Health Centre is quoted in the Fall 89 news reviews and discussion articles on issues of in-
issue stating “Healthsharing provides a perspec- terest to feminists. Their last issue covered regional
tive on Canadian Women’s health not available in discussions of abortion — a hot topic which at this
any other Journal.” writing is the subject of impending federal legislation,
January/February 1990 24 Volume 12 Number 5
This content downloaded from
(cid:0)(cid:0)(cid:0)(cid:0)(cid:0)(cid:0)(cid:0)(cid:0)(cid:0)(cid:0)(cid:0)(cid:0)70.126.145.227 on Sat, 19 Mar 2022 17:44:05 UTC(cid:0)(cid:0)(cid:0)(cid:0)(cid:0)(cid:0)(cid:0)(cid:0)(cid:0)(cid:0)(cid:0)(cid:0)(cid:0)
All use subject to https://about.jstor.org/terms",[]
27,"Feminist Bookstore News
north of the 49th parallel — and a synopsis of the sity, a “rag by, for and about lesbians” aims to cele-
many September “Take Back The Night Events” with brate lesbian diversity. Book reviews, letters, poetry,
a nation-wide perspective. It is reflective and repre- short stories, cartoons and announcements make up
sents the more radical wing of the National Action the major portion of this magazine. In its second year
Committee on the Status of Women in Canada. It of publication, the collective has built up a readership
makes interesting reading and although subscriptions and authorship of a wide variety of west-coast
are sought The Womanist is currently distributed free Canadian women.
at many outlets. Ordering info: PO Box 76, Station B,
Ottawa, Canada K1P 6C3.
Kinesis: News for Women That’s Not in the
Dailies: The Vancouver Status of Women,$2.25/issue
ISSN 0317-9095, 28pp. Ordering info: 301 - 1720 Grant
Street, Vancouver BC Canada V5L 2Y6. As they say,
“Kinesis means movement,” and Vancouver’s Tiger Lily: Magazine by Women of Colour: Pub:
monthly (published 10 times a year) feminist news- Earthtone Women’s Magazine (Ontario) Inc. PO Box
paper offers lots to get us going. This month’s con- 756, Stratford, Ontario, Canada N5A 4A0, $2.95 /issue,
tributions cover women’s court challenges to the ISSN 0-832-9199-05, 40pp. Appearing quarterly, Tiger
Canadian Charter of Rights and Freedoms, discrimi- Lily in its Issue #5, is devoted entirely to Latin Amer-
nation under the BC tenancy law, news from across ican women. Contained within are articles on women
Canada (as they say “not in the dailies”), domestic insurgents in Peru, Nicaraguan women before and
workers, feminism in the classroom, systemic racism, after the revolution, and the women’s movement in
censorship, coverage of the In Visible Colours Festival the Philippines. A selection of articles on related issues
(production and distribution of films throughout the rounded out this stimulating magazine.
world from Third World women, First Nations (f.)Lip: A Newsletter of Feminist Innovative
women and women of colour), arts reviews, and Writing: $4/issue, 22pp. Available from PO Box 1058,
everything else one would want to find if a daily were Station A, Vancouver, BC V6C 2P1. The desire of the
writt en C a f no ar d iw ao nm e n W. oman Studies/les cahiers de la e ind nit oo vr as t i vat e ( (f ex.) pL eip r i mis e n t to a l “ &p r o vv ii sd ioe n ap ru yb ,l i c la at ni go un a g s ep a &ce cf oo nr -
femme: York University, $6/issue, no min. ISSN 0713- tent) work [in English Canada], and to exchange ideas
3235,150pp. Ordering info: 212 Founders College, and information.” Each issue features the work of four
York University, 4700 Keele Street, Downsview, On- writers and contains announcements of pertinent
tario M3J 1P3. Dist. CPPA.* For nine years this femi- workshops, conferences, publications and readings.
nist quarterly has put out articles aiming to “make
current writing and research available to the largest That about covers what's sitting on my desk but
possible community possible” in French and English. more periodicals exist. Further inquiries could be
Often focusing on a main issue and extrapolating to directed to me at (note new address) 1883 Neil Street,
the relevant issues affecting women, CWS/CF has Victoria, BC V8R 3C6. I'll try to check them out. O
given a voice to many women from across Canada
and around the world. For example, the Spring 1989 *CPPA: For a more complete listing (212 publications to
issue (Vol. 10, No. 1) concentrates on refugee women choose from) of Canadian magazines of a general nature,
including grassroots organizing, dislocation/ although not guaranteed to include local feminist and
resettlement, non-government organizations, govern- lesbian publications, a catalogue is available from the 88/89
ment initiatives, and personal experiences with an Canadian Periodical Publishers’ Association, 2 Stewart
extensive bibliography rounding out this scholarly Street, Toronto, Ontario, M5V 1H6, for $2. At least some
work. Back issues are available upon inquiry. of the above mentioned periodicals are obtained directly
Diversity: The Lesbian Rag: $1/issue, 24pp. through the CPPA, and others through Inland. Terms may
O Car nd ae dr ain , g V 5in Nf o 5: L APO . PB uo bx l i s6 h6 e1 d0 6 s, i x S t ta it mio en s F a, yV ea an r c o Du iv ve er r, - BC vuaryp foronm p ubdliciatrione ctot p ub liicnatioqn u anidr wyill . b e aOvailable
January/February 1990
This content downloaded from
(cid:0)(cid:0)(cid:0)(cid:0)(cid:0)(cid:0)(cid:0)(cid:0)(cid:0)(cid:0)(cid:0)(cid:0)70.126.145.227 on Sat, 19 Mar 2022 17:44:05 UTC(cid:0)(cid:0)(cid:0)(cid:0)(cid:0)(cid:0)(cid:0)(cid:0)(cid:0)(cid:0)(cid:0)(cid:0)(cid:0)
All use subject to https://about.jstor.org/terms",[]
28,"Feminist Bookstore News
Women's Periodicals at Bookpeople — the Story So Far:
Our current list of 13 Women’s magazines represents the best and most durable
of the titles we've found over the last several years. We have a generous
standing order program for periodicals that offers a full 40% off the cover price
when you order the bare minimum of three copies of one magazine
(along with a pleasing diversity of shipping options).
CALYX
COMMON LIVES/LESBIAN LIVES
GALLERIE
HERESIES
IKON
IRIS: JOURNAL ABOUT WOMEN
ON THE ISSUES
SAGE WOMAN
SNAKE POWER
BOOKPEOPLE SINISTER WISDOM
2 B9 E R= K H EF LH E Y S ,T CR AEE T 94710 TRIVIA
(415) 549-3030 WOMEN & PERFORMANCE
FAX: 415-848-6322 WOMAN OF POWER
If you would like to find out
more about Bookpeople, or if If you have a favorite magazine that we
you would like to receive an don't seem to know about, or that you
account application and cata-
logs (including our updated just wish more people knew about, we
Women’s Checklist), please encourage you to contact Pat Bough in
contact the Order depart- the Order department at (800) 999-
ment at 800-999-4650. 4650.
IBID and WordStock users:
Bookpeople can now accept your electronically
transmitted purchase orders! Call the Order
department for more information or to request
a startup packet.
Toll Free Ordering & Customer Service: (800) 999-4650 Monday - Friday, 8am - 5pm
January/February 1990 26 Volume 12 Number 5
This content downloaded from
(cid:0)(cid:0)(cid:0)(cid:0)(cid:0)(cid:0)(cid:0)(cid:0)(cid:0)(cid:0)(cid:0)(cid:0)70.126.145.227 on Sat, 19 Mar 2022 17:44:05 UTC(cid:0)(cid:0)(cid:0)(cid:0)(cid:0)(cid:0)(cid:0)(cid:0)(cid:0)(cid:0)(cid:0)(cid:0)(cid:0)
All use subject to https://about.jstor.org/terms",[]
29,"Feminist Bookstore News
Compiled by Laura Zimmerman American Voice
A feminist literary journal featuring culturally
Two indispensable resources for information diverse writers. $4. Heyburn Building, Suite 1215,
about feminist periodicals are Words to the Wise Broadway at Fourth Ave., Louisville KY 40202.
(Firebrand, $3.95) and Directory of Women’s
Media (Women’s Institute for Freedom of the Press, Bad Attitude
3306 Ross Place NW, Washington DC 20008, $15). A magazine of lesbian erotica. $4. PO Box 110,
These books pull together most of the information Cambridge MA 02139.
we need as booksellers (addresses, phone numbers,
annotations, etc.) and also sell well to customers. Bay Windows
Words to the Wise, which annotates feminist and A weekly lesbian and gay paper focussed on the
lesbian publishers and presses as well as peri- Boston and NE community. 1523 Washington St., Bos-
odicals, provided much of the info in the following ton MA 02118.
list; the Directory includes listings of media organi-
zations, music, film, and radio resources, book- Belles Lettres
stores, and more. A bimonthly literary review often focussed on
themes like Jewish women, Asian American writ-
Amalgam ers, mothers. $3.75. PO Box 987, Arlington VA
Newsletter for the Massachusetts Asian lesbian 22216. IN.
and gay community. $3.
Black/Out
*Thanks to the following booksellers for reviewing and A magazine by, for, and about Black Lesbians
adding to this list: and Gay men including poetry, fiction, news cover-
1 „Dana Fox, Amazon Bookstore, Minneapolis, MN; age... $6 National Coalition for Black Lesbians and
; Ê D Mel ao rr ye s M L oi rst eo lln , & C h Aa nr nis e B Fo ro ok sts ,, FA ut ll la n Cta ir, c lG e A B; ooks, G BPay /Is N, . c/o PO Box 19248, Washington DC 20036.
Albuquerque, NM;
^ Pam Sheldrick & Vivian Scheinmann, Pandora Bridges
Book Peddlers, Englewood, NJ; A new journal for Jewish feminists and their
> Ó R Mac oh thel e r P e Kp ap lie sr ,, EW ugo em ne en , O& R .Children First, Chicago, IL; f Ser ai te tn ld es W to A b 9e 8 1p 1u 8b . l i Is Nh .ed twice a year. PO Box 18437,
27. January/February 1990
This content downloaded from
(cid:0)(cid:0)(cid:0)(cid:0)(cid:0)(cid:0)(cid:0)(cid:0)(cid:0)(cid:0)(cid:0)(cid:0)70.126.145.227 on Sat, 19 Mar 2022 17:44:05 UTC(cid:0)(cid:0)(cid:0)(cid:0)(cid:0)(cid:0)(cid:0)(cid:0)(cid:0)(cid:0)(cid:0)(cid:0)(cid:0)
All use subject to https://about.jstor.org/terms",[]
30,"Feminist Bookstore News
Broomstick Challenging Media Images of Women
A magazine by, for, and about women over 40 A newsletter of the Boston organization of the
including essays, poetry, reviews... $3.50. 3543 18th St., same name. $1.60. PO Box 59, Cambridge MA 02238.
San Francisco CA 94110.
Changing Men
Calyx A tri-annual magazine by men writing about
A feminist journal of art and literature that has gender issues. $4.50. 306 N. Brooks, Madison WI
produced classic theme issues like Women and Aging. 53715. IN.
$8. PO Box B, Corvallis OR 97330. BP/IN.
Common Lives/Lesbian Lives
Camera Obscura A lesbian quarterly of prose, poetry, humor,
Johns Hopkins University, Journals Division, 701 graphics and photos. $4. PO Box 1553, Iowa City IA
West 40 St. Suite 275, Baltimore MD 21218. 52244. BP/IN.
Canadian Woman Studies/Les cahiers Connexions
de la femme A quarterly of thematic issues with material
Bilingual feminist journal “making current translated or reprinted from the international femi-
writing and research available to the largest com- nist press. $4. 4228 Telegraph Ave., Oakland CA
munity possible.” C$6. 212 Founders College, York 94609
University, 4700 Keele St. Downsview ONT M3J
1P3, Canada. Conditions
A feminist magazine with an emphasis on writing
by lesbians. The current issue (#16) features many of
the best articles from the last 12 years (Broumas, Klep-
fisz, Anzaldua, Harjo, Pat Parker). $8.95. PO Box 56,
Van Brunt Station, Brooklyn NY 11215. IN.
The Creative Women
A tri-annual publication of fiction, poetry, and
reviews... on themes about creative women. Gover-
nors State University, University Park IL 60466.
Daughters of Sara’
Christian Feminist, 6 issues/yr, $3/$1.75, 5 copy
min. 3801 N. Keeler, Chicago IL 60641.
Differences
A Journal of Feminist Cultural Studies. $13.00.
Indiana University Press, Journals Division, 10th and
Morton St., Bloomington IN 47405.
Disability Rag
50% bimonthly. Box 145, Louisville KY 40201.
Diva
A quarterly journal of South Asian women featur-
ing articles, poetry, art... $5. 585 Middlefield Road
#27-28, Scrob ONT M1V 4Y5, Canada. IN.
This content downloaded from
(cid:0)(cid:0)(cid:0)(cid:0)(cid:0)(cid:0)(cid:0)(cid:0)(cid:0)(cid:0)(cid:0)(cid:0)70.126.145.227 on Sat, 19 Mar 2022 17:44:05 UTC(cid:0)(cid:0)(cid:0)(cid:0)(cid:0)(cid:0)(cid:0)(cid:0)(cid:0)(cid:0)(cid:0)(cid:0)(cid:0)
All use subject to https://about.jstor.org/terms",[]
