PageNumber,Text,ISBNs
59,"The Feminist Bookstore News
fe SUINIVERSIT Y PRESSES
e
= =e=i""r | tan RIRAN
by Kris Hoover about class, race and lesbians, and on timely
Amazon Bookstore/Minneapolis subjects. Pergamon's minimum is low (5) and the
number to choose from is large (19 so far).
PERGAMON PUBLISHERS
Made to Order: The Myth of Reproductive and ROWMAN & ALLENHELD
Genetic Progress, Pat Spallone & Deborah Stein- Female Revolt: Women's Movements in World
berg eds., 254p, $16.50 pb, ready. These papers and Historical Perspective, Janet S. Chafetz &
relate technological developments (such as test- Anthony Dworkin, 260p, $13.50, ready. Though the
tube fertilization) to women's reproductive first hundred pages are clogged with dependent
choice and our social and political autonomy in and independent variables only a dedicated so-
Third world and Western countries. They also cial scientist could love, later chapters com-
assess the different impacts these technologies prise a very handy global survey of feminist
may have on women within each nation, depending | activism in the 20th century. Includes good
on race, class and region, and discuss the ways suggestions for further reading and an index.
in which doctors promoting reproductive and
genetic engineering have begun to respond to
feminist critiques of biotechnology. Pricey, but AN
very informative.
Love and Politics: Radical Feminist The- | | =
ories, Carole Anne Douglas, 340p, $12.50, Jan. ml!
It's always good to have a current overview of
radical/lesbian feminist thought in the store,
particularly when a discussion of ideas is inte- NEW YORK UNIVERSITY PRESS
grated with the practical work of radical acti- The Lust to Kill, Deborah Cameron & Eliza-
vists. I haven't seen Douglas' book yet, but I'd beth Fraser, 207p, $35. cl, ready. Western cul-
recommend trying it based on the credibility of ture and academia have understood serial killers
the rest of Pergamon's Athene series. (Carol in two ways, Cameron and Fraser show: as lit-
CAnnoe l i s al eloncg t tiimve e m)e.m b erc oaf l t/hes Ooffc iOour l Boacgks i ecraaryl/ ph idlosoephviciala hnerotess .an d Iasg pnsycohorlogii-ng the fact
If you have a market for education books, that these murderers are all male pre-empts
you might stock Teaching Technology from a Femi- questions about the patriarchal political con-
nist Perspective, a Practical Guide, Jan tent of their crimes. Cameron and Fraser also
Rothschild, 200p, $15., ready. Pergamon also has compare serial killings of women and those of
feminist books on teaching peace studies and boys and men and explore such topics as why
science. women do not commit sexual ‚murder; evidence that
The Athene Series books are relatively serial murder is a recent, Western phenomenon;
expensive and look academic in their light blue and the sexualization of violence in Western
or lavender covers, but their content is read- society in general and within feminist and les-
able and radical. Thanks in part to series ed- bian communities.
itors Gloria Bowles, Renate Klein, Jan Raymond Ordinarily, I! wouldn't mention a book this
and Dale Spender, these books are sophisticated costly, but like Cameron's first book Feminism
Volume 10 Number 5 57 February 1988
This content downloaded from
(cid:0)(cid:0)(cid:0)(cid:0)(cid:0)(cid:0)(cid:0)(cid:0)(cid:0)(cid:0)(cid:0)(cid:0)70.126.145.227 on Sat, 19 Mar 2022 17:39:54 UTC(cid:0)(cid:0)(cid:0)(cid:0)(cid:0)(cid:0)(cid:0)(cid:0)(cid:0)(cid:0)(cid:0)(cid:0)(cid:0)
All use subject to https://about.jstor.org/terms",[]
60,"ThesFeminist Bookstore: News
and Linguistic Theory (St. Martin's Scholarly,
about $25 -- | wish it would come out in paper-
back!), this is a model of brilliant, readable,
activist-oriented feminist scholarship.
Feminism and Equality, Anne Phillips ed,
202p, $15., ready. These essays -- by Bell Hooks
Women’s Studies on feminism as a movement to end sexist oppres-
in the Tradition of Excellence Jsi eo ann , B eE thl kle e n E l sD htu aB ino i os n o ann d r o1 g9 yt nh y , c Me in cht eu ler y B ar -feminism,
rett on Marxist feminism and five others =-
Genia Pauli Haddon have been around a few years, but collecting
BODY METAPHORS them in one volume to heat up discussion of
Releasing the God-Feminine in Us All feminism as a political theory is a fine idea.
A groundbreaking study of the personal, cultural and spiri- Natura! Women, Cultured Men: A Feminist
tual meanings of male-female body differences which leads Perspective on Sociological Theory, R.A. Sydie,
readers “to where we've never been before—and perhaps 268p, $30. cl, ready. Understanding sociology as
S 1 8t.9o5 an encounter with God-Herself.’ 288 pp. Illus. a ""discourse among men"", Sydie explains the as-
AMERICAN WOMEN WRITERS sumptions about gender and human nature of such
tA o t hC e r Pi rt ei sc ena tl Reference Guide from Colonial Times f Fo ru en udi dn ,g f aa st h e wrs e la ls aW se b e ir n, f lD uu erk nh te ii am l , dEn isg se els n tan ed rs like
Abridged Edition Karen Horney and Simone de Beauvoir. She also
Edited by Langdon Lynne Faust ably summarizes feminist reconstructions of
“The editors and publisher are to be commended for mak- sociology and academic women's critiques Of
ing a good portion of a fine reference set more widely avail- scientific '""objectivism."" An enlightening book
a L 5ibrary Bulletin 944 pp. Large format. by a sociological insider.
Lucy Freeman and Herbert S. Strean
FREUD AND WOMEN From Equal Suffrage to Equal Rights: Alice
i“ nA g f ca hs ac rin aca tt ein rg s., ” j —ar Lg io bn r- af rr ye e J n ouar rr na at li v 2e 5 0p e pop pl .e d p b w k it $h 1 0 f .9a 5scinat- CPa hu rl i s ta in nd e t Lh ue n a rN da it nio i,n a 2l 3 0W p,o m $e 1n 2' .s 5 0 ,p a r Jt ay n . 1 M91 i0 li- t1 a9 n2 t8,
PE A eli r s s a pLb ee A ct th N i v D eM s o l oFt nm L a O Fn eWn m-W iI nNe isn G td e T ll W heoI lT ogH y MILK AND HONEY a v d pn i e og td o a l ir i lp ta sto i el cti d at h i l ec t ia rhl sl ey t h r w ua anos tt gmu eeat r gne i, e s ts sP ru .a if u k fl e Sr s a h,a g n ee dd i rm ah e lcoe stvr oe m ap c a e t ar n i sot t sny . es sLr su ae ennin sda- r d tin hi e
pd“ boK ko e r $e 8sn .9 5 tp oe r as p e fc at si cv ines a. t i n. g . t h po asu tg .”h t - —pr Po av sto ok ri an lg L a ifs e i t 2 2 o 4p e pn ps . alleged w fin i at if h ll o iu u nte g n ssc h , e r i en sko pif n e g c P if aa r lu o lyml's t h hl ee e ra d b re rir l als i cah n isi t mp t .a ca tn icd ia n 'p sersonality
sA sn rn oo au dn /c Ti Cn heg — ci& rH coe odl ne W n to oC om una se l l nn a w sa a n y d , 2 ssP e4o 6 ml i p et , osi sc aa e$ yl 1 s5 C a, ro gn nr oef al wi d c y ot tm., eTR nnh o sos e u am g sh soa r y nt h eRidd
Cro o n tinuum n a lt u sc c i i t e o s t hh a e r j o n h a ' p p il oi t i ,-
Women’s Studies Award the studies themselves are written with empathy
A $5,000 cash advance to and enlivened by the sharp and poignant observa-
encourage and reward outstanding tions of women in eight of the world's areas of
scholarship and other writing political crisis. This diverse collection covers
in Women’s Studies. Northern Ireland, Palestinian refugee camps, an
For information, Israeli kibbutz, Iran, the French region of
write to the pubiłisher. Brittany, England's mining areas, Greek women in
Cyprus and Turkish workers in Germany.
C RAt O y Sou Sr R bo Ook Asto Dre, / o Cr Ocal Nl 1 T-80 I0 N-63 U8-3 U030 M $m 27en .9, 5 , E Y l Jao i anu n e . m iB ni ag r h u wt c hh ia cl hs ao n d pc r o oLn mus ci id i nee enr nn t eW FSo rem er ne rn can h o ,A , n E a 3 nl 2 gy 0 lz p ie s, h Wo-
370 Lexington Avenue, New York, NY 10017 and U.S. women psychoanalysts give their views
February 1988 Volume 10 Number 5
This content downloaded from
(cid:0)(cid:0)(cid:0)(cid:0)(cid:0)(cid:0)(cid:0)(cid:0)(cid:0)(cid:0)(cid:0)(cid:0)70.126.145.227 on Sat, 19 Mar 2022 17:39:54 UTC(cid:0)(cid:0)(cid:0)(cid:0)(cid:0)(cid:0)(cid:0)(cid:0)(cid:0)(cid:0)(cid:0)(cid:0)(cid:0)
All use subject to https://about.jstor.org/terms",[]
61,"The Feminist Bookstore News
mi
(HA
on gender differences, sexuality, feminism and UNIVERSITY OF TENNESSEE PRESS =
personal issues as analysts. Black Women in the Fiction of James Bald-
NYU's long and diverse list this season win, Trudier Harris, 229p, $12.95, ready. Harris
combines for discount as usual with Columbia shows that Baldwin's problematic treatment of
University Press books. If you don't have a rep, women characters reveals his critique of the
you can order NYU through the Columbia sales Black community and church as well as his ideas
depar tment. about gender. Harris's straightforward writing
style opens her book to general readers of this
influential Black gay writer's fiction, while
UNIVERSITY PRESS OF MISSISSIPPI her model of analyzing female characters in
American Women Since 1945, Rochelle Gatlin, writing by Black men should appeal to the aca-
298p, $14.95, ready. This ambitious, lively, demi cal ly-oriented.
concise overview, inclusive of the experience of
many kinds of women, is the book to recommend on a
the subject. While it looks mainstream (and 1
British since it's copublished with Macmillan |
U 6K 0) ', s i t cs o utr nea tt em re cn ut l t o uf r esu b oje rct s t l hik ee w ido em ae sn oin f t h Be lack les- COLUMBIA UNIVERSITY PRESS i
b t df d f rhi a e u eia osn c m mu rc t g a u if ah bn e s i icm n s i lte i s i shi or tmn en yi t s e a t o ns i v i n o oe t s rp ft f h ar y l uo p l j s she a p pc irt i at ii eh cts sr t ri ta ui c aa it t r u cr eu w l c a ao ho il ar sun i y b lsd r y omt e r u i af xl tnvu e ei vl dne d , e tr l m is hs gg oa u ei t h v ps t a e e t pr nr t e re - s r no eo t af hi sc n- h n sei siai g os fl .t i n oso r,t Ar m y n G a. d a t , t iI vlt i es n c e f s ais uv brm ga oo, l ugm u teM a R st a te r e a wa sy sd r i hn iqJ rg te ua e ic a e ncoW v sb e gi to u n l )m is y o, t e n Jn 3 s: p1 f a "" 6 cse m E p oym fs ,s b ec o a i t u$ hy rn1 as s o2 ""i ' . as 5 fi ntn 0 u wl , a e rl F ol vr y te i re ehm t ta kled eii r n cy r i a. ( s it r t sv hJ ry a i aC e c e qtsr o w ui eb ct au ir pi i t- s ri so et c ,i i hn c w. wti s im r F da io etn r -id ng
power of US feminism. ranging B a rn ed a k r ie nad gab le t. he Chain: Women, Theory and
French Realist Fiction, Naomi Schor, 203p, $13.,
ready. Shor's studies of women and gender in the
BOWLING GREEN STATE UNIVERSITY PRESS fiction of Flaubert, Balzac and others illu-
The Age of Sex Crime, Jane Caputi, 246p, strate her contention that ""deconstructionist""
$24.94 cl, ready. Caputi, coauthor with Mary methods of literary criticism liberate women to
Daly of Wickedary (Beacon, 1987) has written a study gender in literature. Schor's work íis
study of serial murder as an extreme form of easier reading than much French psychoanalytic
patriarcha! terrorism peculiar to our times. She feminist thought (Irigaray, Kristeva, et al.),
explains the cultural processes through which and she is suspicious of covert sexism by even
killers like Jack the Ripper become mythic fig- the fashionable theorists she draws from, but
ures, terrorize women and obscure the fundamen- Breaking the Chain is not written for general
tal political motivation for sex crimes. Though readers.
not as wide-ranging as Lust to Kill (see NYU Fair Science, Jonathan Cole (male author),
below), and taking a few unfounded literary 336p, $16. pb, ready. Cole's isa well docu-
leaps typical of semiotic-influenced research mented, liberal study of the discrimination
(semiotics, recently popular in academia, is a faced by women scientists. Readers will find
kind of interpretation that emphasizes ""signs,"" this to be a very careful organizational analy-
symbols, ritual & meanings), Caputi's book is sis with useful comments on affirmative action,
thought-provoking, well-documented and quotable. not a broad critique of patriarchal science.
Volume 10 Number 5 February 1988
This content downloaded from
(cid:0)(cid:0)(cid:0)(cid:0)(cid:0)(cid:0)(cid:0)(cid:0)(cid:0)(cid:0)(cid:0)(cid:0)70.126.145.227 on Sat, 19 Mar 2022 17:39:54 UTC(cid:0)(cid:0)(cid:0)(cid:0)(cid:0)(cid:0)(cid:0)(cid:0)(cid:0)(cid:0)(cid:0)(cid:0)(cid:0)
All use subject to https://about.jstor.org/terms",[]
62,"The Feminist Bookstore News
CAMBRIDGE UNIVERSITY PRESS RUTGERS UNIVERSITY PRESS ,
Language, Gender & Sex in Comparative Per- Landscape for a Good Woman, Carolyn Day
spective, Susan U. Philips, Susan Steele & Steedman, 168p, $10., ready. In one of the most
innovative university press books of the year,
papers make an important contribution toward un- Steedman confronts theories used to explain
derstanding the ways in which women and men in lives, specifically theories of child develop-
several cultures use language differently. Chil- ment, psychoanalysis and class analysis, with
dren's language is also discussed from a socio- real lives, specifically hers and her mother's.
linguistic perspective. A final While her explanations of theory aren't always
brain research, coming to the appealing conclu- clear enough, her biography is honest to the
sion that biology hasn't much to say about bone and beautifully written. Like the ramblings
gender differences in language use. Typical of of a well-educated, worldly and insightful
Cambridge books, the standard of scholarship in friend, this is an immensely thought-provoking
this volume is very high and the writing is book about working-class childhood, privilege
lively but intended for the specialist. and aspirations.
Cambridge has a half dozen paperback titles Alternative Alcott, Elaine Showalter ed.,
a feminist bookstore might carry regularly, but 400p, $9., Jan. Given the popularity of recent
they don't make it easy for us. 30% is the best collections of thrillers Alcott wrote under
discount available for most, so at Amazon we add other names and the durability of her children's
a couple dollars to the price of these already stories, this thick collection representing the
expensive books. You might see if a sales rep range of her work should find a trade audience.
comes to your town, but if you have the experi- Included along with feminist and sensational
ence | had (""I never dreamed a store like yours fiction are journalistic pieces on women and
would carry [university press books]"") you can work and other topics and irreverent reflections
always use their 800 number. on Thoreau and the other Transcendentalists
she'd grown up around.
Also new is a revised edition of the pop-
ular study of Alcott as both a woman of her
times and a progressive social thinker, A Hunger
for Home: Louisa May Alcott's Place in American
Culture, Sarah Elbert, 310p illus, $12., Jan.
Uneasy Careers and Intimate Lives: Women in
Science, 1789-1979, Pnina Abir-Am & Dorinda
Outram eds, 365p illus, $12., ready. Exploring
A practical, powerful and the relationship between women scientists' pro-
inspiring book for women. fessional and personal lives, some chapters are
biographies of well-known women such as astrono-
It offers the basic principles of mer Maria Mitchell, while others concern whole
feminine leadership and groups of field workers, such as 19th-century
assumes the fundamental B ar nit dis h s ob co it aan l is t ls i. f eT h o hu egh r e t h ae r ean na 'l ty s e gs e o nf e rf aam lli yly searching
dignity of femininity in all (for example, we read of ""educated classes;"" ar-
circumstances. r ca on mge mme on nts l y o t h ce ar l lt eh da n "" h fe it ce tro itse ix ou ua sl "" m a fr ar miag ie l y a ;r e and the
$8.95 ISBN 0-943715-00-8 preface suggests salaciously that some of the
women's lives had ""a hint of homosexuality""),
the competent gathering of facts and lively
Aldebaran Press prose makes this an advance in the literature on
Distributed by: women and science.
Slawson Communications Words on Fire: The Life and Writing of Eli-
(800) 367-8420 z $a 1b 5e , t h r e aG du yr . le Fy l y F nl ny n in s, bR eo sts a l ry en m eF m. bB ea rx ea dn d aa sl l , a 3 l0 if2 ep -,
long radical organizer, leader of IWW strikes,
February 1988 Volume 10 Number 5
This content downloaded from
(cid:0)(cid:0)(cid:0)(cid:0)(cid:0)(cid:0)(cid:0)(cid:0)(cid:0)(cid:0)(cid:0)(cid:0)70.126.145.227 on Sat, 19 Mar 2022 17:39:54 UTC(cid:0)(cid:0)(cid:0)(cid:0)(cid:0)(cid:0)(cid:0)(cid:0)(cid:0)(cid:0)(cid:0)(cid:0)(cid:0)
All use subject to https://about.jstor.org/terms",['0-943715-00-8']
63,"The Feminist Bookstore News
Lay M
1m ny FREI \
one of the finest public speakers of her genera- most closely related to middle class experience.
tion, the subject of Joe Hill's song ""Rebel She wisely cautions feminists not to abandon
Girl, "" and chair of the US Communist Party. She domestic living or let commercial manipulation
was also a prolific writer on women's issues, a rule our homes, but she seems quite unaware of
single mother who had many affairs with men and the range of our efforts to create lesbian and
a decade-long relationship with an outspoken feminist homes and families.
lesbian physician, and always a colorful, com-
plex woman who struggled to make her life as INDIANA UNIVERSITY PRESS
well as.. _her ; work. .a...form .of radical. activism. Feminism & Methodology, Sandra Harding,
Baxandall's affectionate yet clearheaded biogra- 193p, $10.95, ready. My first reaction to this
phy brackets a well-chosen selection of Flynn's collection of classic papers in feminism and
feminist writings. social science method was disappointment. These
Also on Rutgers' extensive women's studies are good papers, by Bonnie Thornton Dill, Joan
list for fall '87 are: Women, Household & the Kelly, Catherine MacKinnon and others, but many
Economy, Lourdes Beneria & Catherine Stimpson have been reprinted before. Next, I noticed that
eds., 272p, $12., Jan., an excellent reader it's copublished with an English university. Ah,
relating changes in the economy to changes in I thought, it'll sell in Britain, at least. Then
women's lives; Clovernook Sketches, Alice Cary, I noticed that it sells in Minneapolis, too. The
314p, $10., ready, introducing the work of an customers outsmarted me on this one.
early realist writer whose handling of emotional
S Wli cf h ae ri z r oh ep na hs , r e 3b n 0e i 0e cn p , W c $o o 3m m 0.p e na cr le ,id n r w et ai h dt e yh . 1P 9o 5e 0's 's; , a Cn ad r o M l a Ad .w Bi .ves: a As m a e r is c o aD u no r n c Ie't n d oo if av n e rr el wo go oik o mn e au nl n : i bv oe or ks sit y a/ ns dc h o bl oa or kly s ap br oe us tses
Southern stores, in particular, might be
able to sell University of Alabama Press' Rivet-
Updates & Additions ing and Rationing in Dixie, Mary Martha Thomas,
OXFORD UNIVERSITY PRESS 184p, $16.95 cl, ready, on black and white,
Journeys Among Women, Judith A. Hellman, urban, rural and migrant women during WWII, or
275p, $13.95, ready. Oxford brought to my atten- The Freedom Quilting Bee, Nancy Callahan, 304p,
tion that I! had omitted this detailed study of $26.95, ready, on a black women's civil rights
feminist organizations in five Italian cities. and economic development project ongoing since
Though this is a rather formal work of political 1965.
science, well chosen quotes and the author's own The Minnesota Historical Society Press,
honestly stated sympathies connect readers with which Carol Seajay wrote about in the Dec. '87
concerns and visions of a significant cross sec- issue, features two wonderful books based on the
tion of Italian feminists. knowledge Buffalo Bird Woman, a Hidatsa Indian,
Just a Housewife, Glenna Matthews, 281p, shared with early anthropologist Gilbert Wilson.
$19.95 cl, ready. In order to clear up doubts | The Way to Independence, Carolyn Gilman & Mary
expressed in the Oct. '87 issue, the press sent Jane Schneider, 352p, 16 color and 500 b&w
me two copies. Yes, the book does deal nearly illus, $24.95 pb, ready, is a fabulous catalog
exclusively with middle class women, and the of crafts, photos and stories that illustrate
author plainly says so. In addition to document- life on the Northern Plains before and during
ing the changing nature of middle class women's colonization. Among the revealing anecdotes here
work in the home, she traces changing mainstream is Buffalo Bird Woman's explanation of her peo-
ideas about domesticity, which are, in fact, CONTINUED ON PAGE 71
Volume 10 Number 5 61 February 1988
This content downloaded from
(cid:0)(cid:0)(cid:0)(cid:0)(cid:0)(cid:0)(cid:0)(cid:0)(cid:0)(cid:0)(cid:0)(cid:0)70.126.145.227 on Sat, 19 Mar 2022 17:39:54 UTC(cid:0)(cid:0)(cid:0)(cid:0)(cid:0)(cid:0)(cid:0)(cid:0)(cid:0)(cid:0)(cid:0)(cid:0)(cid:0)
All use subject to https://about.jstor.org/terms",[]
64,"The Feminist Bookstore News
The sleeper of the season has to be come- pires and vicious? Or don't bother. Just treat
dienne Fannie Flagg's Fried Green Tomatoes at yourself to a copy of Fried Green Tomatoes at
the Whistle Stop Cafe. It ranks right up there the Whistle Stop Cafe. Take a ride with Towanda
with Charleyhorse for well-kept secrets and a in the pink Mary Kay Cosmetics Cadallic and
catalog blurb that doesn't give a feminist book- settle down to Idgie. Mention it to a few women
seller any reason to believe she could sell this who like such things as good literature, good
$17.95 cloth in quantity.... humor, and fine women. (Or better yet, read it
I grant you that Whistle Stop is fresh and in front of a few potential customers -- a book
endearing and affectionate, filled with humor that can make a bookseller laugh out loud always
and drama, per the publisher promo. And yes, it intrigues the readers.) It's one of those rare
also tells the story of two women in the 1980's novels that will have a committed feminist book-
-- Evelyn, in the sad slump of middle age, and store readership even before it comes out in
Mrs. Threadgoode, nursing home resident who is paper. $17.95 cl. 0-394-56152-X. Random House. O
recalling to Evelyn some of the tales of her
youth -- especially of Idgie and Ruth who ran
the Whistle-Stop Cafe. But ""...all kinds of love RADIO, Cont.
and laughter, good barbecue and good coffee, first book Night Lights, a romantic novel with
even an occasional murder...."" doesn't exactly such memorable characters...and it's really
convey that the central story is about Idgie funny, too! The reading is at 5 o'clock and it's
(short for Imogene) who fell madly in love with free.
sR uu pt ph o r ta et d t h he e r t e pn ad sse ir o n a g te h ro of u g 1 h7 , R uth that 's h be rr i e ff a m (""Iily 2 1 N Yo e k ai hd .d i n Tg? hen tomorrow at 5 o'clock, Alison
only did it for Idgie's own good"") marriage, Owings will read from her book, The Wander Wom-
that Ruth and Idgie then lived together til an's Phrasebook.
Ruth's death raising ""their"" son Stump.... Nor 2 The Wander Woman's Phrasebook?
that in addition to being hilariously funny, 1 Yeah, it's a kind of travel guide about how
Whistle Stop deals with lesbianism ín a his- to meet or avoid people in three romance lan-
torical context, with disability issues, with guages.
racism, and goes for a complexity of under- 2 Readings. That sounds like fun. ClaireLight's
standing of all of the above rather than the full of surprises, isn't it? Hey, how come you
quick slap-stick humor one might expect from the know so much about what's going on there?
novel's short-takes and flash-back style. | read 1 I'm on their mailing list. Haven't you signed
it the first time for sheer-pleasure -- then up yet?
went back again to see how Flagg has presented 2 No, but I guess I'd better. A local writer,
so much material, so intricately, keeping the huh? You know, I! dabble in writing.
emotions in high gear and the anticipation high, 1 Yeah, I've read your dabble. Let's just go to
while creating such a complex portrayal of fami- ClaireLight.
lies in both the white and Black sides of town 3 ClaireLight Women's Books. Not just a book-
as well as the conditions and history that store. At 1110 Petaluma Hill Rd. at the corner
helped to shape all of them. I wanted an index of Frazier, just south of Highway 12. Open seven
to find all the mentions and foreshadowings! days a week.
So explain to me please why New York can Customers come in wanting to know if Gertie
publish such daring and positive novels about and Alice are related to or supposed to be
l te hsb eia n ts a l(n eo t i st o sm eten t iio nn l ae s b hia in s t m orot ih ce ar ls ) , c ow nh ten ext -- but G Cle ar iartr eLu id ge dh tS t se tin saf fa n .id s n .'A t l i .c tee l l iB n. g .T o Wkl iOa lls . .. m. ob ru et b t ehe
that novels set in contemporary times still seem revealed??? Listen to KVRE for more ClaireLight
to need to portray lesbians as villains, vam-
February 1988 :
This content downloaded from
(cid:0)(cid:0)(cid:0)(cid:0)(cid:0)(cid:0)(cid:0)(cid:0)(cid:0)(cid:0)(cid:0)(cid:0)70.126.145.227 on Sat, 19 Mar 2022 17:39:54 UTC(cid:0)(cid:0)(cid:0)(cid:0)(cid:0)(cid:0)(cid:0)(cid:0)(cid:0)(cid:0)(cid:0)(cid:0)(cid:0)
All use subject to https://about.jstor.org/terms",['0-394-56152-X']
