PageNumber,Text,ISBNs
40,"The Feminist Bookstore News
Women Artists, an Illustrated History by image of Vita Sackville-West smoking in a gar-
Nancy G. Heller is a grand new survey book of den, her hair blazing in the sunlight. Distrib-
125 women painters and sculptors from the ren- uted by Thames & Hudson, large paper: 0-500-
aissance to the present. | mentioned this book 27204-2, $12.95.
in my last column but have had an examination Alice's World, the Life and Photography of
copy now for a few days and | want to rave about an American Original by Ann Novotny is, happily,
it. The pictures are excellent and the text still available. Photographer Alice Austen
readable and informative. Abbeville Press (1866-1952) lived on Staten Island, never mar-
(Abrams), large cloth: 0-89659-748-2, $39.95. ried and had an ""intimate companion"" with whom
Lotte Jacobi, Theater & Dance Photographs she shared her upper-middle class life and her
is a book of beautiful, warm, honest, elegant struggles after the stock market crash wiped out
images of personalities from Berlin in the her savings. She photographed friends, neigh-
1920's and 1930's. Jacobi (b. 1896) was born bors, emigrants, her daily views and her tra-
into a family of four generations of German vels. There are some delightful images of Alice
Jewish photographers. She fled to N.Y.C. in the smoking with a friend, cross-dressing and women
1930's, then moved to New Hampshire in the embracing. Order direct from the Chatham Press,
1950's, always photographing creative, dynamic (6 North Water Street, Greenwich, CT, 06830),
people. This volume is a gem. I| would love to large cloth: 0-85699-128-7, $22.50, 40% for two
see more. Countryman Press, POB 175, Woodstock, or more, 20% for one, add $1.00 each for ship-
VT 05091, paper: 0-914378-93-7, $10.95. ping and handling.
The Gentle Eye, photographs by Jane Bown is Some really sad news for art lovers: Rosa
a lovely, warm, funny collection of famous and Bonheur, a Life and a Legend by Ashton and Hare
unknown people in Great Britain, taken by a is permanently out of print according to Viking.
newspaper woman. Of special interest íis a 1958 I think it never reached its strongest audience
and wish someone would bring it out in a trade
paper edition emphasizing Bonheur's lesbianism
on the cover and targeting women's bookstores.
The Harriet Hosmer bio announced last
column has been cancelled by Academy Chicago but
I hear that the book has been completed and ís
now looking for another publisher.
Nancy Glenn of Clicking Stones Bookstore in
Monte Rio, CA asked me for a list of books about
lesbian artists so here is a first installment.
Let me know what I've left out.
There are, of course, the Rosa Bonheur and
Arlene Raven books mentioned above. Also Romaine
Brooks, Breeskin, Smithsonian Inst. Press, O0-
87474-287-0, $16.95; Neon Lovers Glow in the
Dark by Lili Lakich, Gibbs M. Smith, 0-87905-
419-0, $15.95; Lily Briscoe: A Self-Portrait by
Mary Meigs, Talon Books, 0-88922-195-2, $11.95;
JEB's two books from Glad Hag: Eye to Eye:
Portraits of Lesbians 0-96031-76-0-0, $8.95, and
Making a Way, Lesbians Out Front, 0-9603176-1-9,
$11.95; Cathy Cade's A Lesbian Photo Aibum, the
Lives of Seven Lesbian Feminists, Waterwomen
Books, 0-9618452-2-5, $14.95;, Still Sane by
: Persimmon Blackbridge & Sheila Gilhooly. Press
CONTINUED ON PAGE 22
February 1988
This content downloaded from
(cid:0)(cid:0)(cid:0)(cid:0)(cid:0)(cid:0)(cid:0)(cid:0)(cid:0)(cid:0)(cid:0)(cid:0)70.126.145.227 on Sat, 19 Mar 2022 17:39:54 UTC(cid:0)(cid:0)(cid:0)(cid:0)(cid:0)(cid:0)(cid:0)(cid:0)(cid:0)(cid:0)(cid:0)(cid:0)(cid:0)
All use subject to https://about.jstor.org/terms","['0-89659-748-2', '0-85699-128-7', '0-914378-93-7', '0-88922-195-2', '0-9603176-1-9', '0-9618452-2-5']"
41,"The Feminist Bookstore News
Since sendiny off my last column, | got ACE
hold of Marion Zimmer Bradley's The Firebrand Soulstring, by Midori Snyder, $2.95. Tradi-
(Simon & Schuster), thanks to the West Tisbury tional fantasy scenario lifted above the ordi-
library. Though at times the characters seemed a nary by convincing characters, including a
bit too contemporary, I loved it; it has in- first-person narrator/heroine (Locus).
sidiously rearranged my understanding of the Web of Wind, by J. F. Rivkin, $2.95. Sequel
Trojan War period. Shortly thereafter, | read to the good sword-and-sorcery novel Silverglass,
Judy Grahn's The Queen of Swords (Beacon Press), not the least of whose merits is the nonplatonic
in which Helen also plays a major part. They relationship of the swordswoman and the sorcer-
make intriguing complements, to which one might ess. More, more!!
add (for instance) Evangeline Walton's The Sword In the Caves of Exile, by Ru Emerson,
Is Forged (is it still in print?), about the $2.95, 1/88. The second ""tale of Nedao"" (after
Amazon Queen Antiope, and June Brindel's To the Haunted Mountains), featuring a female
Ariadne, feline narrator and an exiled young queen.
the subjugation of female/goddess power in clas- Sorcery and Cecelia, by Patricia C. Wrede
sical antiquity. and Caroline Stevermer, $2.95, 5/88. Fantasy
the Caves of Exile, see below) has sold a ""new cousins, each privy to a different half of a
perspective on the Cinderella legend"" to Ace; s oo nr ec e cr oo uu ss i n p .lot. Each co-author wrote the part of
Chelsea Quinn Yarbro has completed the second
(after A Flame in Byzantium) novel of Olivia, ARBOR HOUSE
st T o oh o f le r d ; f V Bae n um a rd l na dl ie M ne gm ev r a c a Wm e rd ap ""e ti s er re t ,, L ra c aw ik l h oe hi y gc o,h ry r a ow u rt ( i shl l neo or eb v e e o lb f ,p e u tltb oohl i we s T h , o""e rHd . e a r gb ay l ad is n), has s( tc welo lt olh i rg). d eS snIw m! t o w e r na fsd - a s fntp h oto o rari -son hyut g i., rh l e y Ab ty Rc a iu c cgE e hhl ntl a e t r n u e dp r K i Sn s tu t . s a th h g Vin es i e e ir n a r, r- e a $ n 1 t d5 o . p9 h5 is
Once again, thanks to the f/sf publishers enigmatic and moody lover, Alec. Female char-
who keep me on their review lists and to Locus, acters are well drawn but secondary. An asset to
""the newspaper of the science fiction field,"" gay hardcover fiction collections, fantasy or
for filling in the gaps. You buyers and staffers not.
who have the time and inclination to keep up The Motion of Light in Water, by Samuel R.
with f/sf news and reviews should seriously Delany, $17.95 (cloth), 3/88. A memoir of major
consider a sub to this monthly magazine, a deal interest to gay bookstores; says a recent Locus
at $24 for 12 issues. The address is PO Box review, ""the sexual adventures of an unabashed
13305, Oakland, CA 94611. promiscuous gay male Only [lesbian-feminist
poet] Marilyn Hacker, Delany's wife for a turbu-
And finally, before I| get on with the lent 13 years, appears here in anything like
books: the romance noted in my last column con- full emotional complexity [the book] admits
tilnauets e d.e li gh:tfully apace, and I'm still running u ns a r yin t mo a nth .""e extraordinary world of an extraordi-
February 1988
This content downloaded from
(cid:0)(cid:0)(cid:0)(cid:0)(cid:0)(cid:0)(cid:0)(cid:0)(cid:0)(cid:0)(cid:0)(cid:0)70.126.145.227 on Sat, 19 Mar 2022 17:39:54 UTC(cid:0)(cid:0)(cid:0)(cid:0)(cid:0)(cid:0)(cid:0)(cid:0)(cid:0)(cid:0)(cid:0)(cid:0)(cid:0)
All use subject to https://about.jstor.org/terms",[]
42,"The Feminist Bookstore News
BAEN BOOKS skills against both palace intrigue and ""an
The Hex Witch of Seldom, by Nancy Springer, ancient and evil sorcery.""
$15.95, (cloth), 3/88. From a good fantasy wri- The Best of Marion Zimmer Bradley, edited
ter with infrequent female protagonists, a novel by Martin H. Greenberg, $3.95, 4/88. Mass market
of a girl who encounters the Circle of Twelve, reprint of the Academy Chicago anthology, com-
archetypal characters like the King, the Sorcer- prising 13 short stories and 2 novelettes.
ess, the Virgin, the Trickster, and the Dark
Rider. HARPE R T h e& WRO arW riors of Taan, by Louise Lawrence,
BANTA M A f ( tSP eE rC T LRA on) g Silence, by Sheri S. Tepper, $ E1 a2 r. t9 h5 , c o(c ll oo nt yh ) , w 3 h/ o8 se8 . nA at ivY eA s n ado hve el r e s e tt o o sn t r ia cn t
$3.95. A novel of space colonization and big- gender roles, violent warrior men and nurturing
b a s u y s w min ome pss a a n t e h x e ep x tl po ili o ct ra et ri ro /n op lr eob .ty a g Aoan n c i cs i t om r pa dg lai iyn na s gt i av e t k oew yr i t t a he nr ed; publisher, S mti is eot se n sr a""s g. e S b oa u fid t p P eW a"" cw e, o i trt h k ri oss u g "" hwsp a e tr l hs l ee a min s e d c ifh a aa r b aa nlc det e r hi .z o..a w - I st os - worthy
T Te hp ep e Gr a th e a s t o j u Wst o mco em n'p s le Cte od u n a t r yn .e w In tn ro iv ge ul i n e gn , t i nt ole ?d c da el sl ee rd v ef se m toin i bn ee hw ei al re ds ."" can be positive attributes
3/88. AT h ce u rB er e fe od rs o Af I D SM a hn a, s b ty h e F . s i dM e-. e fB fu es cb ty , o f$3.95, POCKET BOOKS
causing the birth of ""cyclical hermaphrodites, Reindeer Moon, by Elizabeth Marshall Tho-
bt inr y gi g g e pxe rr p ee o md su i r si een ; t o t I o l ' ma a f ne mm oe ta n l se ft ar mc uy a it lc iil ane r g e wi ft ieh tme hr a l (e mb .""y a l eIt n ) i tm e Bre ue s s -o tr - ptm h ra oes t, a h g a$ or4 nd. i5 c s0 to, v e i3 sr / 8 ap8 u . yb l oN i uce naa t gr i- o u n wn o a on mfim a nto hu ois s f p n 2r o 0a v ,i 0s ee l 0, 0 g w r yhe ee o at rse e sd
by's work. ago.
POPULAR LIBRARY/QUESTAR
Dawn, by Octavia Butler, price n/a, 6/88.
Mass market (presumably) reprint of Butler's
well-received newest.
RANDOM HOUSE (KNOPF)
Second Sight, by Mary Tannen, $16.95
BANTAM (STARFIRE) (cloth), 1/88. This ""splendid example of a rare
The Silver Glove, by Suzy McKee Charnas, breed, iìN\orth American Magical Realism,"" is set
$13.95, (cloth), 3/88. PW raves about this se- in Wallingford, N.J., and features an ""eccentric
quel to The Bronze King: ""Valentine Marsh finds young palm reader Delia Bird.""
herself willy-nilly cutting school, disobeying
her mother and trying to save the world again.
The threat: sinister Dr. Brightner, who is in- The Hidden Side of the Moon, by Joanna
stalled as the new school psychologist the same Russ, $15.95 (cloth), 1/88. A collection of 26
day Val's magic Gran runs away from her nursing stories dated from 1959 to 1984, by an sf writer
home."" Sounds good to me! whose intelligence, feminism, lesbianism, and
wicked sense of humor inform nearly everything
DAW BOOKS she writes. Though expressing some reservations,
Arrow's Fall, by Mercedes Lackey, $3.50, PW says, ""It is still a privilege to observe the
1/88. Last in the fine ""heralds of Valdemar"" author's mind at work"" and adds that ""the out-
trilogy (which began with Arrows of the Queen standing pieces are nongenre tales from the '70s
and Arrow's Flight), in which Talia matches her that probe sexual roles.""
February 1988
This content downloaded from
(cid:0)(cid:0)(cid:0)(cid:0)(cid:0)(cid:0)(cid:0)(cid:0)(cid:0)(cid:0)(cid:0)(cid:0)70.126.145.227 on Sat, 19 Mar 2022 17:39:54 UTC(cid:0)(cid:0)(cid:0)(cid:0)(cid:0)(cid:0)(cid:0)(cid:0)(cid:0)(cid:0)(cid:0)(cid:0)(cid:0)
All use subject to https://about.jstor.org/terms",[]
43,"The"" Feminist oBookstore News
£E!
by Karen Axness Crocodile on the Sandbank, Elizabeth Pe-
Two new mysteries from our own presses have ters, Mysterious Press/Popular Library, $3.95: is
appeared. | didn't get any information in ad- a re-issue of the first of Peter's popular
vance: of ‘their “publication, so they've been Amelia Peabody series. The author is an ar-
available awhile and probably already selling cheologist and her sleuth, a resourceful Victor-
briskly for most of you. They are Gray Magic by ian lady, has a passion for Egyptology.
Sarah Dreher from New Victoria ($8.95) and The
Monarchs are Flying by Marion Foster from Fire-
brand Books (8.95). Gray Magic is the long- FEBRUARY
awaited third Stoner McTavish mystery. It's set Design for Murder, Carolyn G. Hart, Bantam,
in Arizona where Gwen and Stoner are vacationing $3.50. Murder during a tour of an historic house
aa rn cd h s i n -c io sr p ao r ca ot ues r t rH oo op mi- i n ds rp ai mre ad w m hy ics ht i c his am s . a M lo en sb- ian tin erv yes t big oa ot ke sd t o rb ey . Annie Laurance, owner of a mys-
lawyer defending a lesbian accused of murdering The Curse of the Pharaohs, Elizabeth
her ex-lover. Peters, Mysterious Press/Popular Library, $3.95
A number of potentially interesting titles is a re-issue of the second Amelia Peabody
will be appearing this winter: story.
JANUARY MARCH
Murder Unrenovated, P.M. Carison, Bantam, A Radical Departure, Lia Matera, Bantam,
$3.50. A ""Maggie Ryan"" mystery by Pat Carlson in $3.50. Willa Jansson, a young lawyer, is a sus-
which Maggie and her husband iick, an actor, in- pect in the murder of the chief partner of her
vestigate the death of the elderly tenant of firm. Willa has reason to suspect her own moth-
their brownstone. er. Is there any connection between the poisoned
But He was Already Dead When I Got There, mousse and the death of a leading Sixties radi-
Barbara Paul, Bantam, $3.50. Eight suspects cal?
visited the room in which Vincent Farwell was Eye of the Storm, Marcia Muller, Mysterious
murdered and each utters the eponymous phrase. Press, $15.95. cl. P.I. Sharon McCone takes a
The Recycled Citizen, Charlotte Macleod, ""vacation"" to visit her sister Patsy. Vandalism
Mysterious Press, $15.95 cl. A new Sarah Kelling escalates to violence. at the site of `a Victorian
story in which the Kellings find themselves mansion being converted to a bed-and-breakfast
defending the family name while trying to dis- inn. A major hurricane further complicates mat-
cover who's sabotaging their pet charity. A ters. l| like the Sharon McCone series and hope
""whimsical whodunit."" Mysterious will stop dragging their heels and
The Corpse in Oozak's Pond, Charlotte Mac- issue the earlier ones in paper soon.
leod, Mysterious Press/Popular Library, $3.95. The Black House, Patricia Highsmith, Mys-
The first paperback appearance of Macleod's terious Press, $15.95 cl. A new collection of
latest ""Peter Shandy"" mystery. While birdwatch- short stories by this master of psychological
ing, the professor discovers a one hundred-year- susphense. e Shea's brrillian t b ut t not e ford the . fa int- o
old corpse.
41 February 1988
This content downloaded from
(cid:0)(cid:0)(cid:0)(cid:0)(cid:0)(cid:0)(cid:0)(cid:0)(cid:0)(cid:0)(cid:0)(cid:0)70.126.145.227 on Sat, 19 Mar 2022 17:39:54 UTC(cid:0)(cid:0)(cid:0)(cid:0)(cid:0)(cid:0)(cid:0)(cid:0)(cid:0)(cid:0)(cid:0)(cid:0)(cid:0)
All use subject to https://about.jstor.org/terms",[]
44,"Food for Thought Women and Children First
Fargo, North Dakota Chicago
September 1987 November 1987
Between Ourselves, Letters Between Mothers
and Daughters ed. by Karen Payne.
Dakota Diaspora, Memoirs of a Jewish Home- T Restricted Country Joan Nestle; $8.95, Fire-
steader by Sophie Trupin. brand Books.
Living With Joy, Keys to Personal Power and 2. Webster's First New Intergalactic Wickedary
Spiritual Transformation by Sanaya Roman. of the English Language, Mary Daly; $14.95,
Codependent No More, How to Stop Controlling Beacon Press.
Others and Start Caring for Yourself by 3. Going Out of Our Minds, Sonia Johnson;
Melody Beattie. $10.95, Crossing Press.
Daily Affirmation by Rokelle Lerner. 4. Passion for Friends, Janice Raymond; $10.95.
Dance of Anger by Harriet Lerner, Ph.D.
A Feminist Dictionary by Cheris Kramaree and FICTION
Paula A. Treichler. d. Dreams and Swords, Katherine Forrest; $8.95,
Women Who Love Too Much by Robin Norwood. Naiad Press.
Celebration of Breath by Sondra Ray. 2. Dusty's Queen of Hearts Diner, Lee Lynch;
$8.95, Naiad Press.
3. Gray Magic, Sarah Dreher; $8.95, New Vic-
toria Press.
4. Lover's Choice, Becky Birtha; $8.95, Seal
ClaireLight Press.
Santa Rosa, California 5. Memory Board, Jane Rule; $8.95, Naiad Press.
December 1987
Lesbian Passion, J. Loulan, Spinsters/Aunt
Lute Book Co., $10.95.
Night Lights, B. S. Arthur, Mother Courage
Press, $8.95.
Going Out of Our Minds: The Metaphysics of A Novel Thought
Liberation, S. Johnson, Crossing Press, Tampa, Florida
$10.95. December 1988
Dreams of the Woman Who Loved Sex, T.
Corinne, Banned Books, $7.95. 1. Dreams and Swords by Katherine Forrest.
Memory Board, J. Rule, Naiad Press, $8.95. 2. Dreams of the Women Who Loved Sex by Tee
Daily Affirmations, Health Communications, Corinne.
$6.95. 3. The Men with the Pink Triangle by Heinz
Dreams & Swords, K. Forrest, Naiad Press, Heger .
$8.95. And the Band Played On by Randy Shilts.
Each Day a New Beginning, Hazeldon/Harper & 9 Cass and the Stone Butch by Antoinette
Row, $6.95. Azolakov.
1988 Sylvia Book of Days, Nicole Hollander, Womonseed by Sunlight.
St: Martin's. Press, $7.95. Hot Living by John Preston.
Wingwomen of Hera, Sandi Hall, Spinsters/ The Needle on Full by Caroline Forbes.
Aunt Lute, $8.95. OSN Murder at the Nightwood Bar by Katherine
Queen of Swords, J. Grahn, Beacon Press, Forrest.
$14.95. O
42
This content downloaded from
(cid:0)(cid:0)(cid:0)(cid:0)(cid:0)(cid:0)(cid:0)(cid:0)(cid:0)(cid:0)(cid:0)(cid:0)70.126.145.227 on Sat, 19 Mar 2022 17:39:54 UTC(cid:0)(cid:0)(cid:0)(cid:0)(cid:0)(cid:0)(cid:0)(cid:0)(cid:0)(cid:0)(cid:0)(cid:0)(cid:0)
All use subject to https://about.jstor.org/terms",[]
45,"The Feminist Bookstore News
by Donna Szeker relies heavily on input from gay ànd lesbian
teens from London city schools. Also, from this
The good news this month is that Dell has group is Talking About Young Lesbians ed. by
re-issued James Baldwin's books in time for Lorraine Trenchard, 46 pp., $3.50 pb. written
Black History Month. All but one had, sadly, primarily for young women who are questioning
gone out-of-print, but with his death I| guess their sexuality but family, friends, and people
the publisher's decided to cash in. So, here's working with youth will find this of interest.
some new stuff Young lesbians talk about their parents ex-
periences at schools, coming out, men, feminism,
NEW GAY MEN'S BOOKS AND MORE ... etc. These books are British imports and are
Forty Ways to Sunday, by Robert Moore available wholesale from Giovanni's Room at 25%.
(Knights Press), 1987, 255 pp., $8.50 pb. A de- Beyond Patriarchy: Essays by Men on Plea-
licious romp by a new author, from a gay press sure, Power, and Change, ed. by Michael Kaufman
that is growing by leaps and bounds. (Oxford U.), 1987, 322 pp., $13.95 pb. Wide-
In Tall Cotton, by Charles G. Huise (Lyle ranging, critical, perceptive and hopeful con-
Stuart), 1987, 312 pp., $15.95 cl. Totsy Woods tributions by 18 men from the U.S., Canada,
is destined to live his adolescence during the England and Australia. A look at men's domina-
Great Depression. Bright and curious, he and his tion/women's oppression from a variety of view-
older brother Junior, their father and mother, points emphasizing the social structures that
trek westward in the family Ford, much like nurture his domination.
their literary counterparts in The Grapes of Gay and Lesbian Parents, ed. by Frederick
Wrath. Here, however, the focus stays with the W. Bozett (Praeger), 1987, 247 pp., $14.95 pb.
two boys, illuminating their special friendship (short discount). This is the first book of
and the growing awareness of sex. A wise and collected papers that provide coverage of the
moving story. Charles Hulse, now retired from a professional literature on the topics of gay men
stage career, is an associate of the popular and lesbians as adoptive parents, in hetero-
writer Gordon Merrick, to whom this first novel sexual marriages, the counseling needs of gay
is dedicated. fathers and lesbian mothers, and the legal as-
Shimoni's Lover, by Jennifer Levin (HBJ), pects of gay and lesbian parenting.
1 a9 c8 c7 l, a i3 m78 e dp p ., S n $ o18 w.9 5 a c nl. d A u Wth ao tr e rof Dth ae n cw ei rd ,e ly Ms. Levin's The Last Closet: A Gay Parent's Guide For
latest novel chronicles the turbulent closely Coming Out To Your Children, by Andre ""Rip""
k lyn .i t O fli v te hs e o f f o uth r e b K roo tl hs, e r a sn , aI ls lr a del e s tk ii nb eb du t fz o rf a m thi e- C po ar nle oy ( BEx ep ao cs hit ,io n F LPr . e ss 3, 3 017 60 91 ) , B lo 1u 9n 8t 7 ,R d . 1, 2 P 9a m p- p., $12.50
om ni ll yit a or fy , a ny o u en scg a p eR a f tof i A is m et rh ice a . r e Hb ee l i sw h ao n t oh ui tn ck ass t c pl a. r eN no tw s , c oa mt e l o on ug t l ta ost , t hh ee ir re 's k i da s . b o Ro ek a l -t lio f e h e sl ip t u ag -ay
a i enn x d e t rhh tee Ai ps r oa g b wa y ew. r a frN ua ad ln av d i n a Sn fhd i lm u eM on ni ic c,h e a w sel h, o o b no dt ih e d e aw a co h u hn e d r oe od t, her and at c pi ho pn ris l o d p a r'sr ia e t eqc u o tm e os b ti tn i hoe ed n dsw e v it c eh la o n p e m x a ebm ne tp a l l e as a n nt s dh w a t ce h r rs eh ondow o l o i gh n io - w l aa nguage
those who love them. A literary tour de force! cal age A o IDf S : t h Te h ec h Uil ld t. imate Challenge, by Elizabeth
School, by Hugh Warren (London Gay Teenage Kubler-Ross (Macmillam), 1987, 330 pp., $17.95
Group), 1984, 48 pp., $4.75 pb. A collection of cl. Kubler-Ross has turped her attention to what
ideas and recommendations about dealing with for gay men may be the ultimate challenge. With
homophobia in schools. This short treatise the compassion and insight that characterized
February 1988
This content downloaded from
(cid:0)(cid:0)(cid:0)(cid:0)(cid:0)(cid:0)(cid:0)(cid:0)(cid:0)(cid:0)(cid:0)(cid:0)70.126.145.227 on Sat, 19 Mar 2022 17:39:54 UTC(cid:0)(cid:0)(cid:0)(cid:0)(cid:0)(cid:0)(cid:0)(cid:0)(cid:0)(cid:0)(cid:0)(cid:0)(cid:0)
All use subject to https://about.jstor.org/terms",[]
