PageNumber,Text,ISBNs
99,"Feminist Bookstore News
1-85649-036-X); and Mukkuvar Women: Gender, He-
gemony and Capitalist Transformation in a South
Indian Fishing Village by Kalpana Ram ($57.95 cl,
1-85649-031-9). Zed Books, 57 Caledonian Road, Lon-
don N1 9BU England. Distributed by Humanities
Press International, BP and IN.
The essays in Women and the Environment: A
Reader — Crisis and Development in the Third
World examine women’s use and management of
land, forest and water, and present the success stories
of women who have organized to improve their lives
and the lives of their communities through environ-
mental protection or repair. Edited by Sally Sonthei-
mer. $13 pb, 0-85345-835-9. Monthly Review Press,
122 West 27th St., New York NY 10001. BP, IN.
Hilary Tham’s third collection of poetry,
Tigerbone Wine, includes 69 poems expressing her : Ow
broad personal and cultural perspectives: Malaysian, Margo Adair & Sharon H ell
Chinese, American and Jewish. “She makes the bi- have written two pamphlets on
a E T n a m t HEALING THE SCHISMS ACROSS THE LINES
and universal.” $10 pb, 0- -728-3. Backlist titles
from Three Continents include Laurence Deonna’s OF RACE, CLASS, GENDER, AND ...
The War with Two Voices, interviews with women on ° ° ° °:
both sides of the Egyptian-Israeli conflict ($12 pb, The Subj ectwe Side of P olitics
0-89410-639-2) and a study, in words and photo- &
graphs, of Yemen ($16 pb, 0-89410-711-9). Three Con-
tinents Press, 1901 Pennsylvania Ave. NW, Suite 407, °
Washington DC 20006. 20% for 2+ non-prepaid, 30% B reaking Old P atterns
for 2+ prepaid. Phone, 202-223-2554. We aving New Ti es
H For those of us who prefer to move forward rather than run
Maga | z arouind n in cirecles sunti l we faCll exha uste d! —N Holly Near
Amethyst, a semi-annual literary magazine, is
one of the outreach projects of SAME (Southeastern
Arts, Media and Education), the only multi-disciplin-
ary lesbian and gay arts organization in the Southeast.
We very much enjoyed the copy we saw — the Win-
ter/Spring 1992 Lesbian Focus Issue, which included
lots of art, poetry, short plays and fiction (including an
excerpt from Garbo’s wonderful novel Rusty). It also
f Mea ytu sr ee ld f a C 2 h5- ap nag ge i n s gpe ”c ia l f es aec tt uio rn i n c gal le d w o“ rA ks I b S yee lesbian artists , g
over 35 years of age. $5/issue. SAME, PO Box 54719, D Bookpeople & Inland
Atlanta GA 30308. IN, EPSCO. 40%. O
Volume 15 Number 1 97 May/June 1992
This content downloaded from
(cid:0)(cid:0)(cid:0)(cid:0)(cid:0)(cid:0)(cid:0)(cid:0)(cid:0)(cid:0)(cid:0)(cid:0)70.126.145.227 on Sat, 19 Mar 2022 18:00:56 UTC(cid:0)(cid:0)(cid:0)(cid:0)(cid:0)(cid:0)(cid:0)(cid:0)(cid:0)(cid:0)(cid:0)(cid:0)(cid:0)
All use subject to https://about.jstor.org/terms","['1-85649-036-X', '1-85649-031-9', '0-85345-835-9', '0-89410-639-2', '0-89410-711-9']"
100,"Feminist Bookstore News
Discrimination by Design
A Feminist Critique of the Man-Made Environment
Leslie Kanes Weisman
A fascinating account of the complex processes and power struggles involved in
building and controlling space. Weisman traces the social and architectural histories
S of the skyscraper, maternity hospital, department store, shopping mall, nuclear-
family dream house and public housing highrise, documenting how these and
SA IA a I = A S= o p int rh tiv ee rir l e e sgs tee est d t i an in ng d s , h p oi e wn nc al lu tt hd iei en s g bo u fp i lu tgb e l ei nc nd v ep ir ra , or nk c ms la esa s nn , t d a s n hs dt a r p e r ee sat cs e, d. a ie S lm yh ob uo lild vdy e s b . a e n Il d lr ue sat .dr a $ n b 2s 4ym . 9 i 5et v et rh ye one
Resurgent
New Writing by Wc:nen
In Her Prime Edited by Lou Robinson and Camille Norton
New Views of “An exciting, impressive collection. lt will serve as a reference
point for discussions of women writers and postmodernism, and
Middle-Aged Women may even help us revise our understanding of women’s experi-
Second Edition mental writing. Robinson and Norton offer a stunning array of
Edited by Virginia Kerns and work by writers from divergent traditions and cultures. I recommend
Judith K. Brown it heartily.” — Elizabeth Meese, author of Crossing the Double-
With a foreword by Beatrice Blyth Cross and (Ex) Tensions: Re-Figuring Feminist Criticism.
Whiting and a new introduction by Paper, $12.95; also in cloth, $34.95.
Karen Brodkin Sacks
Natural Allies
A unique collection of essays about
middle-aged women in different cultural Womens Associations in American History
s idet et ai sn g as b, o ut th is w ob moo enk ac th a l mle in dg lie fs e . p r Oe fv fa ei rli sng Anne Firor Scott
new insights into important questions A pathbreaking study of the part women’s voluntary associations
about the female life course, age and have played in shaping American society over 200 years, and how
gender relations, female sexuality, women have used them to change themselves. “Gracefully written
and women’s powers in middle age. and clearly argued, Natural Allies charts the contested and shifting
“Fascinating and heartening.” — terrain on which women—black and white, working-class and
Women's Review of Books. “The middle-class—struggled to achieve their particular visions of
first book of its kind.” — American social order and public good. This is a grand achievement.”
Anthropologist. Illus. Cloth, $34.95; — Nancy A. Hewitt; author of Women’s Activism and Social
also in paper, $15.95 Change. Illus. $32.50
Order toll free 800/545-4703 from
98 Volume 15 Number 1
This content downloaded from
(cid:0)(cid:0)(cid:0)(cid:0)(cid:0)(cid:0)(cid:0)(cid:0)(cid:0)(cid:0)(cid:0)(cid:0)70.126.145.227 on Sat, 19 Mar 2022 18:00:56 UTC(cid:0)(cid:0)(cid:0)(cid:0)(cid:0)(cid:0)(cid:0)(cid:0)(cid:0)(cid:0)(cid:0)(cid:0)(cid:0)
All use subject to https://about.jstor.org/terms",[]
101,"Feminist Bookstore News
FROM
THE
er
By Ann Christopherson FBN and is, of course, available from Inland.) I am
Women & Children First, Chicago IL pleased to see this, but the scene is not as idyllic as I
imagined when I first looked at it. In the first place,
Before looking at the best titles coming out in Inland is not carrying short discount titles, which
May/June/July, I thought it would be appropriate, means that while you can get In a Different Voice, you
this being the ABA issue of FBN, to say a few words can't get Sexual Orientation and the Law (the latter of
about using the convention to set up accounts with which you can get, and at full discount, ordered
the presses you want to order from. First, it is an through a Harvard rep). In the second place, Inland
ideal time to meet people at the press and establish has been out of stock on some of the trade titles I
a procedure for ordering from them, whether it be have ordered lately. My point is simply that having
with a rep who will call on you regularly or on a university press titles available from a good distrib-
telephone sales schedule. Second, it will give you an utor like Inland is great — but it does not alleviate
opportunity to get informed help on what the key the need to order directly.
backlist titles are so you can make a qualifying order
for becoming an agency account, if that’s an option,
or just fill in the titles you would sell as steady
backlist if you only knew about them. Third, you can
get the details that are sometimes lacking in cata- I want to begin this time with what are, in my
logues and the Book Buyers Handbook regarding opinion, the four lead titles coming out in the next
the exact terms and policies for each publisher. And, three months. The first, timed nicely to correspond
finally, you can place the order — sometimes with a with the release of her new novel, Jazz, is Toni
free freight or higher discount offer — that will get Morrison’s collection of essays in which she exam-
you off and running. For suggestions on which pub- ines the fiction of several white American writers in
lishers to focus on, I refer you to the February “ From terms of their response to an “Africanist presence.”
the University Presses” column in FBN; also, a re- A provocative and important work of literary criti-
view of any of the columns forecasting titles will cism, Playing in the Dark: Whiteness and the Liter-
give you a good idea of who is publishing the kind ary Imagination (Harvard, 0674673778, $14.95 cl)
of titles (as well as the particular ones) you want in should be stacked next to copies of Jazz. The second
Your store. is The Women Outside: Meanings and Myths of
Homelessness (California, 0520071581, $25 cl). The
author, journalist Stephanie Golden, worked as a
| volunteer in a shelter for four years. Drawing on that
' personal experience, as well as broad-based re-
One last word about ordering books. Inland is search, she has constructed a cultural analysis that
now carrying selected titles from a number of uni- places homeless women in the context of “deviant”
versity presses, Harvard, Yale, California and Indi- women-hoboes, tramps, witches, prostitutes — and
ana, to name a few. (A complete list is in the February comes up with a markedly feminist interpretation.
Volume 15 Number 1 99 May/June 1992
This content downloaded from
(cid:0)(cid:0)(cid:0)(cid:0)(cid:0)(cid:0)(cid:0)(cid:0)(cid:0)(cid:0)(cid:0)(cid:0)70.126.145.227 on Sat, 19 Mar 2022 18:00:56 UTC(cid:0)(cid:0)(cid:0)(cid:0)(cid:0)(cid:0)(cid:0)(cid:0)(cid:0)(cid:0)(cid:0)(cid:0)(cid:0)
All use subject to https://about.jstor.org/terms","['', '']"
102,"Feminist Bookstore News
Third, Sadomasochism in Everyday Life: The Dy-
namics of Power and Powerlessness, by Lynn S.
CARYL RIVERS Chancer (Rutgers, 0813518083, $14.95 pb), is a book
More Joy Than Rage I have been looking for for a number of years. Taking
Crossing Generations with the New Feminism the subject beyond the protected realm of freely cho-
pd“ oR o swi ev n de -r ts io d- eh e oaa lrs ot g h yf ,o ll iao nuw tt ooe bd i co ogt mh rae mp h of nie c m a l si en nhi ss u et m . m o Ir fo v t ae h nm a yte o n n t h e a sw c ai tt nrh a n a s- s se tn ag es e ox fu a l d ad ilr ya m la if ea ,n d s h ep l a ac ri gn ug e si t t ho an t t oh ue r c co um ltm uro en p il sace
teach a new generation where they come from and steeped in experiences of dominance and subordina-
what remains to be done, she can”—Boston Globe. tion and explores how that dynamic relates to gen-
$22.95 cloth der and race. I haven’t read it yet so I don’t know
how insightful or cogent it is, but the subject is an
ELLEN WILLIS important one. The fourth probably needs no men-
Beginning to See the Light tion since it has been heralded for months already,
Sex, Hope, and Rock-and-Roll— Second Edition but one more notice certainly won't hurt. The Cutt-
ing Edge: Lesbian Life and Literature is a series
iOnbfsoerrmvaetdio nbsy o pna s sfieomn i nainsmd , g rpooulintdicesd, iann d r icguolrtouurse,, clear- from NYU Press of reissued classics and never pub-
headed thinking, by “a writer of genuine intellectual lished diaries, letters, memoirs and novels. The first
power”—New York Times Book Review. six volumes are coming out individually in June and
Wesleyan University Press. $15.95 cloth July and as a set in July. I won't list them all here, but
they are, obviously, books we will all want to carry,
SYLVIA BARAK FISHMAN, editor so get in touch with NYU. (See FBN Vol.14 No.5 for
Follow My Footprints complete list.)
Changing Images of Women
in American Jewish Fiction
Brandeis Series in American Jewish History, Culture, N
and Life. $45.00 tloth / $24.95 paper
Moving on to subject categories, there are a num-
FRANCESCA MILLER ber of interesting international books. Death Without
Latin American Women Weeping: The Violence of Everyday Life in Brazil, by
Nancy Schieper-Hughes (California, 0520075366, $29
and the Search for Social Justice cl) is a big book — 550 pages — with 65 black-and-
$45.00 cloth / $19.95 paper white photographs focusing on the effects of hunger,
sickness, and scarcity on women and children in a
MICHÈLE LONGINO FARRELL town in Brazil. Sara Ruddick calls it “An astonishing
Performing Motherhood brilliant, moving, vast, and compassionate book.” It is
The Sévigné Correspondence one to carry in conservative numbers, but certainly
$45.00 cloth / $22.95 paper sounds like one to have. For those of us committed to
the idea of a drama section (perhaps there are those of
ROSELLEN BROWN y Do iu v iw dh eo d a l Hso o msel el / b Lo ao nks d :o u Ct o o nf t eth mat p ose rc at rio yn) , GTh ee rman
A Rosellen Brown Reader Women’s Plays (Sue-Ellen Case, ed., Michigan,
A Bread Loaf Contemporary. $19.95 cloth 0472064061, $15.95 pb) is a book to represent. New
Chicana/Chicano Writing I (Charles M. Tatum, ed.,
Arizona, 0816513074, $14.95 pb) includes enough en-
New England tries by writers like Gloria Anzaldua, Norma Cantu,
Sandra Cisneros, and Bernice Zamora for many of us
University Press of New England ° Hanover, NH 03755-2159 to want to carry it. Rutgers is publishing a collection
of short stories by Indian-born and -educated writer
May/June 1992 100
This content downloaded from
(cid:0)(cid:0)(cid:0)(cid:0)(cid:0)(cid:0)(cid:0)(cid:0)(cid:0)(cid:0)(cid:0)(cid:0)70.126.145.227 on Sat, 19 Mar 2022 18:00:56 UTC(cid:0)(cid:0)(cid:0)(cid:0)(cid:0)(cid:0)(cid:0)(cid:0)(cid:0)(cid:0)(cid:0)(cid:0)(cid:0)
All use subject to https://about.jstor.org/terms","['', '', '', '']"
103,"E
= lin RAAI I A
Anjana Appachana. Although she came to the U.S. in structure of the theory, it must be redefined accord-
1984 and continued her studies at Penn State, her ing to a specific feminist perspective. A crossover
stories, “Incantations” and Other Stories between theory and herstory, Gendered Domains:
(081351827X, $11.95 pb) are mostly set in urban India. Rethinking Public and Private in Women’s History
As is often the case with feminist literary criticism, (Dorothy O. Heally and Susan M. Reverby, eds.,
Veils and Words: The Emerging Voices of Iranian Cornell, 0801497027, $13.95 pb) is a collection of
essays from the Seventh Berkshire Conference on the
History of Women that considers a range of interest-
| ing issues pertaining to the concept and reality of the
1 public/private dichotomy and its significance for
Women’s Writers (Farzanek Milani, Syracuse, women. From contemporary herstory, Nuclear
0815602669, $16.95 pb), creates a bridge between crit- Summer: The Clash of Communities at the Seneca
icism and politics, uncovering a link between Iranian Women’s Peace Encampment (Louise Krasniewicz,
women’s literature and the social practice of veiling. Cornell, 0801499380, $13.95 pb) sounds like a fasci-
A collection of stories to put next to Secret Weavers nating ethnography and social history of the effects
(White Pine Press), stories by women of Argentina of the women’s community on the local communi-
and Chile, is editor and translator Darlene J. Sadlier’s ties in Seneca County. A Woman’s Civil War, by
One Hundred Years After Tomorrow: Brazilian Cornelia Peake McDonald (Wisconsin, 0299132641,
Women’s Fiction in the Twentieth Century (Indiana, $14.95 pb) is a diary of a woman in Virginia describ-
0253206995, $12.95 pb). Concluding this section is an- ing the war, and emphasizes the perspective that
other book from Indiana, Binding Cultures: Black history is as much a domestic subject as an account
Women Writers in Africa and the Diaspora (Gay of public affairs. Unruly Women: The Politics of
Wilentz, 0253207142, $9.95 pb), which examines the Social and Sexual Control in the Old South (Victo-
cultural bonds between African and African-Ameri- ria E. Bynum, North Carolina, 080784361X, $12.95
can women as illustrated in the writings of contempo- pb) looks at atypical women (e.g., those who pro-
rary authors of the United States and West Africa. tested domestic abuse in courts; those who engaged
On the theoretical side of women’s studies, in deviant or illegal sexual relationships) and argues
there are three titles I want to highlight. In Gender that Western women did, thought, and felt in and
and Knowledge: Elements of a Postmodern Femi- about the colonies in Africa and India, juxtaposing
nism (Northeastern, 1555531296, $12.95 pb), Susan feminists and social reformers with pro-imperialist
J. Hekman argues that rather than being divergent, women and looking at the workings of race and class
feminism and postmodernism can complement each ideologies within imperialism.
o tit vh ee r V oin ic e i sm : p To hr et a n Pt o s sw iba iy lis t. ie M s ic oh f e l Fle e m F ii nn ie s, t i Rn e sD eais rr cu hp- |E
(Michigan, 0472064657, $11.95 pb), identifies new |
research methods that have the potential to disrupt !
and transform conventional practices. Rethinking Turning to spirituality, the first book is one that
Obligation: A Feminist Method for Political The- didn't sell in hardcover but I think will in paperback:
ory (Nancy J. Hirschmann, Cornell, 0801495679, Mama Lola: A Vodou Priestess in Brooklyn (Karen
$15.95 pb) reexamines liberal theory and concludes McCarthy Brown, California, 0520077806, $13 pb)
that because gender bias is reflected in the very looks at Vodou in everyday life. Ilana Pardes offers
Volume 15 Number 1 101 May/June 1992
This content downloaded from
(cid:0)(cid:0)(cid:0)(cid:0)(cid:0)(cid:0)(cid:0)(cid:0)(cid:0)(cid:0)(cid:0)(cid:0)70.126.145.227 on Sat, 19 Mar 2022 18:00:56 UTC(cid:0)(cid:0)(cid:0)(cid:0)(cid:0)(cid:0)(cid:0)(cid:0)(cid:0)(cid:0)(cid:0)(cid:0)(cid:0)
All use subject to https://about.jstor.org/terms","['', '', '', '', '', '', '', '', '', '', '', '']"
104,"Feminist Bookstore News
new feminist insight into the Bible in her book from
Harvard, Countertraditions in the Bible (0674175425,
NEW FROM $29.95 cl). One of the few contributions I have seen
from Notre Dame that feminist stores might even
consider carrying is A Legend of Holy Women
(0268012954, $14.95 pb), the first all-female hagiog-
raphy available in modern English. We have had
interest over the years in Hildegard of Bingen and
Julia of Norwich, so I suspect Maps of Flesh and
SETSUKO MIGISHI Light: The Religious Experience of Medieval
A Retrospective Women Mystics (Ulrike Wiethaus, ed., Syracuse,
081562560X) would be good to carry if it weren't for
As Japan’s foremost woman painter its $34.95 price tag. Most interesting of all is Nancy
in the Western style, Migishi has Jay’s Throughout Your Generations Forever: Sacri- |
dedicated her life to her art and has fice, Religion, and Paternity (Chicago, 0226395723,
been an inspiration to large numbers $24.95 cl) which gets high praise from Nancy
of Japanese women. Early in her Chodorow: “In this extraordinary work, Nancy Jay
career, critics described her as “a flaw- e gst ia ob nli .s .h ..e s Tth he i s t e r cr aa pin a c o iof u a s , f e em rin ui dst i t eso ,c i o wlog idy e -o rf a nre gli i- ng
less gem” with which no man’s painting book...will stand as one of the great sociologies of
ic no fu lul ed n c e c o ofm Fp ra er ne ch. H are tir st s o fi rls o m r Hef enle rict the religio In n a tn hd e g fr iee la dt of fe m li en si bs it a n t h se to ur di ie es s. ,” a book that sold
Matisse to Georges Braque. well in cloth and will do even better in paper is Eve
Distributed for The National Museum Kosofsky Sedgwick’s Epistemology of the Closet
of Women in the Arts (California, 0520078748, $13 pb). With a pub date of
$29.95 paper M ilia ey s Wbu et Ca hlr oe oa sd ey : Lo eu st b i ai nn s , M Gar ac yh s, is K i nK sa ht ih p W (Ce os lt uo mn -’s Fam-
bia, 0231072899, $13.95 pb), covering an important
AYAKO MIYAWAKI and little-written on subject. Southern Illinois is bring-
ing out an updated version of the ACLU guide, The
The Art of Japanese Appliqué Rights of Lesbians and Gay Men (Hunter, Michael-
son, Stoddard, 080931634X, $7.95 pb).
In the midst of the devastation left
behind after World War II, Miyawaki
took up the ancient art of appliqué by |
using old clothes and rags. Her innova- '
tive “rag art” epitomizes a fundamental The only contributions to drama (besides the Ger-
aesthetic inherent in Japanese culture: man plays referred to earlier) are The Alexander
appreciation of beauty in nature, in Plays (Minnesota, 0816620770, $15.95 cl), a new collec-
the home, and in life itself. tion of one-act plays by Adreinne Kennedy, and a
Distributed for The National Museum collection of criticism on Kennedy’s work, Intersect-
of Women in the Arts i Mn og r eB o Ou vn ed ra br ei ce ks , ( P ea du sl . , K M. i nB nr ey sa on tt a- ,J a 0c 8k 1s 6o 6n 2 0 1a 6n 4d , L $o 1i 6s .95
$29.95 paper b).
An interesting contribution to literature is a col-
lection of stories edited by Nina Auerbach and U.C.
Knoepflmacher, Forbidden Journeys: Fairy Tales and
BOSTON Fantasies by Victorian Women Writers (Chicago,
May/June 1992 102 Volume 15 Number 1
This content downloaded from
(cid:0)(cid:0)(cid:0)(cid:0)(cid:0)(cid:0)(cid:0)(cid:0)(cid:0)(cid:0)(cid:0)(cid:0)70.126.145.227 on Sat, 19 Mar 2022 18:00:56 UTC(cid:0)(cid:0)(cid:0)(cid:0)(cid:0)(cid:0)(cid:0)(cid:0)(cid:0)(cid:0)(cid:0)(cid:0)(cid:0)
All use subject to https://about.jstor.org/terms","['', '', '', '', '', '', '', '']"
