PageNumber,Text,ISBNs
34,"Εεπαϊηΐθί Βοοκθίουςε ΝεΕυν5
ῬΟΒΟΤΗΥ ΑΠΙΘΟΝ ΓΊ ΗΕ ΕΥ ΑΝΡΕΒΘΟΝ ΓΊ ΑΙΠΘΟΝ ΒΕΟΗΡΕΙ. ΓΙ ΠΙΟΝΝΕ ΒΒΑΝΌ ΓῚ ΒΕΤΗ ΒΒΑΝΤ ΓῚ ΕἸ Ὺ ΒΌΙΚΙΝ ΓΙ ΒΑΒΒΑΒΑ ΒΌΒΡΟΒΌ ΓΊ ΑΝΡΒΕΑ Εἰ ΕΟΚ ΟΙ ΑΒΌΥ ΓΊ ΟΗΕΒΥΙ. ΟΙ ΑΒΚΕ
ΠΠ ΜΙΟΗΕΙΊΕ ΟΙΕΕ ΠῚ ΘΕΟΒΟΙΑ ΟΟΙΒΕΙ |. ΓΙ ΒΑΟΗΕΙ. ΘυΙΡΩΡΕΝΒΙΕΣ ΓΙ ΒΙΤᾺ ΓΑΙ ΒΕΙ ΓΊ ΜΑΒΙΟΝ ΕΟΘΤΕΒ. ΑΒΟΙΑ ΕΒΕΕΌΜΑΝ ΓΙ Εἰ 1 ΕΝ ΕΒΥΕ ΓΙ ΕΙΞΕΝ ΘΑ ΕΟΒΌ ΓΊ ΜΑΒΙΥΝ ΘΑΥΙ Ε ΠῚ ΕΥΝΕΗΕ
ΑΝΡΒΕΑ ΕΒΕΟΟ ΙΟΥΝΕ Ἰ η Μ Ν ΝΕΘΤΙ ΕΙ ΚΕΒ ΓΙ ΘΕΥΕΒΝΑ ΡΑΒΚ
ΟΠΟῚΜ ΕΟΖ Ι ΝΠ Ό ΗΥΑ Ι͂Τ ΡΙΕΑ ΟΤ5Τ' Ο ἸΝΑΝ ΣΓΕ Ὶ τ 5Π,Ὶ ΕΒΙΑΟΙ 5 ΕΡ ιΝ ΟΗΕΙΑ ΙεΥ ἶ Ε Ιτ οΝ Ε ἡ Η, ΗπΑ)Ν Ι ὧ ΩχΟεΙΤ Η 1 1Κ Α ῚΟ Β|5Θ ΟΚΕΝΙ Ί«Β)Ε Ν .- Ε ΡΠΕ Ι ΙΙΕΟΑΑΝΝ Ν || Ε Ὁ ν ΓΑΙ ΌΑΘυΌΗΒΝΕ ΙΟΒΕ []
ΓῚ ΑΝΝΑ {ΕΕ ΝΝΆΙΤΕΒΣ ΓΊ ΙΑΝΑ ΥΜΈΠΑΜΣ ΓΊ ἐΗαΥ ΥΟΌΝΟΒΙΟΟΡ ΓΙ ΥΨΟΝΝΕ ΖΙΡΤΕΒ ΓΊ ΒΟΒΟΤΗΥ ΑΙΠΊΘΟΝ ΓῚ ΘΗΕΙ ΕΥ ΑΝΡΕΝΘΟΝ Γ] ΑΠΒΟΝ ΒΕΟΗΡΕΙ. ΓΙ ΓΙΟΝΝΕ ΒΒΑΝΌ ΓῚ ΒΕΤΗ
ΒΒΑΝΤ ΓῚ Εἰ 1Υ ΒΌΙ ΚΙΝ ΓΊ ΒΑΒΒΑΒΑ ΒΌΒΕΟΒΌ ΓΊ ΑΝΌΒΕΑ Εἰ ΕΟΚ Οἱ ΑΒΌΥ ΓῚ ΟΗΕΒΥΕ. Οι ΑΒΚΕ ΓΙ ΜΙΟΗΕΙ ΕΕ ΠΕΡ ΓΊ ΘΕΟΒΟΙΑ ΟΟΤΒΕΙ . ΓΊ ΒΑΟΗΕΙ. ΘΌΙΡΟ ὈΕΨΒΙΕΘ ΓΊ ΒΙΤᾺ ΓΑΙ ΒΕΙ. Γ] ΜΑΒΙΟΝ
ΕΟΣΤΕΒ ΓΊ ΜΑΒΟΙΑ ΕΒΕΕΡΜΑΝ ΓῚ Εἰ ἐΕΝ ΕΒΥΕ ΓΊ ΕἰΙΕΝ ΘΑΓΕΟΒΌ ΓΙ ΜΑΒΙΥΝ ΘΑΥΊ Ε ΓῚΊ |ΕΥνΕΙῚ Ε ΟΜΕΖ ΓΙ ΗΑΤΤΙΕ ΘΟΣΘΕΤΤ ΠῚ ΙΑΝΙΟΕ σΟυιΡ ΓῚ ΕἸΟΙξΕ ΚΙ ΕΙΝ ΗΕΑΙΥ ΓΙ ΘΕΒΑΙΡΙΝΕ ΗΑΤΟΗ
ΗΑΝΟΝ ΓΙ |ΟΡΙΤΗ ΚΑΤΖ ΓΙ ΙΑΝΙΞ ΚΕΙ Υ ΓΤ ΊΒΕΝΑ ΚΕ ΕΡΕΙΕΖ ΓΙ |ΟΑΝ ΗΠ ΝΡΑΗ ΓΙ ΑΟΌΒΕ ΙΟΒΠΕ ΓΙ ΑΝΌΒΕΑ ΕΒΕΏΌ ΑΟΥΈΝΘΤΕΙΝ ΓΊ |υΟΙΤΗ ΜΟΡΑΝΙΕΙ. ΠΠ ΑΌΒΟΒΑ ΙΕΨΙΝ9 ΑΝΌ ΒΟΘΑΒΙΟ ΜΟΒΑΙ Ε5
ΓΠΙΟΑΝ ΝΕΖΤΙΕ ΓΙ ΡΟΝΝΑ ΝΕΥΕΙ ΠΠ ΕΙ ΕΑ ΝΕΥΥΜΑΝ ΓΙ ΡΑΤ ΡΑΒΚΕΒ ΓΊ ΘΕΥΕΒΝΑ ΡΑΒΚ ΓῚ ΟΙΝΌΥ ΡΑΤΤΟΝ ΓΊ ϑΑΝΌΒΑ ΡΟΗ ΑΟΚ ΠΠΜΙΝΝΙΕ ΒΒΌΕ ΡΒΑΤΤ ΓΙ ΜΑΒΟΑΒΕΤ ΒΑΝΌΑΙΙ. ΓΙ ΒΌΤΗΑΝΝ
ἸΒΟΒΣΟΝ ΓΙ ΨΙΟΚΙΕ ἐΕΑΒΣ ΓΊ ΜΑΒ ΘΕΟΒΕΖΤ ΓΊ ΒΑΒΒΑΒΑ ἐΜΙΤΗ ΠΠ ΙΕΑΝΝΕ ΨΑΌΘΗΝ ΓΙ ΑΝΝΑ {ΕΕ ὑΝΆΙΤΕΒΘ ΓΙ ΙΑΝΑ ΜΕΑΜΘ ΓΙ ΘΗΑΥ ΥΟΌΝΘΟΒΙΟΟΌ ΓΊ ΥΨΌΝΝΕ ΖΙΡΤΕΗ͂ ΓΙ ΒΟΒΟΤΗΥ ΑΠΠΙΒΟΝ
ΓΙ θΗΕΙ ΕΥ ΑΝΡΕΒΘΟΝ ΓῚ ΑΠΘΟΝ ΒΕΟΗΡΕΙ. ΓΙ ΠΙΟΝΝΕ ΒΒΑΝΡ ΓΙ ΒΕΤΗ ΒΒΑΝΤ ΓΙ ΕἸ ΠΥ ΒΌΙΚΙΝ ΓΊ ΒΑΒΒΑΒΑ ΒΌΒΡΟΒΟΌ ΓΊ ΑΝΌΒΕΑ Εἰ ΕΟΚ Οι ΑΒΌΥ ΓῚ ΟΗΕΒΥΙ. ΟΙ ΑΒΚΕ ΓῚ ΜΙΟΗΕΙ ΕΕ ΟΠΕΡ ΠῚ
ἸΕΟΒΩΙΑ ΟΟΤΒΕΙ | ΓΊ ΒΑσΗΕι. ΖΌΙΡΟ ὈΕνΒΙΕΣ ΓῚ ΒΙΤᾺ ΓΑΙ ΒΕΙ. ΓΙ ΜΑΒΙΟΝ ΕΟΘΤΕΒ ΓῚ ΜΑΒΟΙΑ ΕΒΕΕΌΜΑΝ ΓΙ ΕΠ ΕΝ ΕΒΥΕ ΠῚ ΕΠΙ ΕΝ ΑΙ ΕΟΒΟ ΓΊ ΜΑΒΙΗΥ͂Ν ΘΑΥΊΕ ΓῚ |ΕΥΝΕΗΕ ΟΟΜΕΖ ΓΙ ΗΑΤΤΙΕ
ΟΟΖΘΕΤΤ ΓΙ ΙΑΝΙΟΕ σΟυιΡ ΓΙ ΕἰΟΙδΕ. ΕΑΙΥ ΓΙ ΦΕΒΑΙΠΙΝΕ ΗΑΙ͂Η ΗΔΝΟΝ ΓΠΒΟΌΙΤΗ ΚΑΤΖ ΓῚ ΙΑΝΙδ ΚΕΦ ΓΊΙΒΕΝΑ ΚΙ ΕΡ ΠΠ ΑυΡΒΕ ΙΟΒΕ Γ] ΑΝΌΒΕΑ ΕβΕΟΌ
Κ ΓΟΥ ΙΝ Έ Ν ϑΘ ΑΤΕΙ ΝΝ ΌΓῚ Β ΙΟ ΑΡΙΤ Η ΡΜΟ ΟΡΑ ΙΝ ΑΙΕ ΟΙ. ΚΠῚ ΠῚ ΜΙΝΝΙΕ ΒΕ Ρ ἌδΑΙ Αδ Α1Ι α' ν 5 - Π Ν ΜΕΜᾺΙΒ͂Μ ,ὅ τΡ Α5Φ) Κ ΑΕΝΕ Ν ΓΕῚ ΨθΑΕΨΌΘΕΒΗΝΝΑ Π ΡῚΑ ΒΑΚΝ Ν ΓΑῚ ἐΟ Ι ΝΕξΌ Υ Ψ ΑΡΑΙΤΙΕ͂ΤΒΟΣΝ.
ΓΙΒ ΙΑΑΝΑΒ ΥΗΒΙΑΑΜΣ Β ΓῚΑ ΘΗ Α Υ Β ΥΟΟυΝΘΒΒΙΟΕΩΡΟ ΓΒΊ ΥΗΨΏΙΝΓΝΕΙ ΖΙΡ ΤΥΕ Ο Β ΟΩΤΗΥΙ ΑΑΙΗΙΕΩ Ν ΕΓΙ Ο θΗΒΕΙΛἰΕΥ Α ΝὈΡΕΒΕΘΟΥΝ ΑΓΙ ΙΑΠ Θ ΟἸΝΕΦΒΕΟΑΗΙ ΒᾧΌΝΟΝΕΙ Αδὶ ΕΒΕΕΌΜΑΝ ΒΕΤΗ ΒΒΑΝΤ ΠῚ ΕΙΥ ΒΌΙΚΙΝ ΠῚ
ΓΙ ΕΙΝ ΕΒΥΕ ο «Ἐξ γο]ς Ἄγ ΗΕ ὙΠᾺ ΤΗ ΚΑΤΖ Γ] |ΑΝΙ5
ΚΕΙ 1Υ ΓΊ ΙΒΕΝΑ ΚΙΕΡΕΙΕΖ ΓΊ |ΟΑΝ ΗΝΌΑΌ ΓΊ ΑὔΌΒΕ ΟΒΡΕ ΓΙ ΑΝΌΒΕΑ ΕΒΕΌΌ ΑΟΥΝΈΝΖΤΕΙΝ ΓΙ ΙΟΡΙΤΗ ΜΟΡΑΝΙΕΙ. ΓΙ ΑΟΒΟΒΑ ἸΕΨΙΝ ΑΝ ΒΟΦΑΒΙΟ ΜΟΒΑΙ ΕΣ ΓΊ ΙΟΑΝ ΝΕΖΤΙΕ ΓΙ ΡΟΝΝΑ
ΝΓΕΙ Υ ΕΜΙ ΑΠῚΒ Ε ΕϑδΙΕ ΘΕΑΒ Ε ΝΖΕΤΗ Μ ΓΑῚΝ ΤΒΑΑΙ Β τΙὸ ςΙ δὉ Κ Τ ΕΩΠΟΙ ΤυΡ ὮΣ' ""ΑΑΕΙΕ 5Κ6Α ΕΙΑΔΆΜΑΙΙ ΒγΟίΒ Ζ ΟπΝ ἡΓΙλ ιΜ Ι ΟΠΚΠΙΕ ΘἐΕΗΑΕΒΣΙΊΕΥ ΑΝΡΕΒΘΟΝ
ΓσΒΙοΑ υ ΟΑ! Η ΙΙΓΕΒΙΙ Ο. ΝΕΘΙ ΟΌ ΒΙΙδΡΕΕΟΟ Ή ΚΠΡΙΕ Ε ΨΙΕ. ΙΒ ΝΓΙΕ Ί Θ Η ΠΕ ΓΑΙΟΙΙ ΝΥ Α Ν ΙΓΕΤΊ Α Β Θ ΒΓΕΑΑΒΝΙΑ Ρ ΙΒ ΕΓΓΙῚΙ Ν ΓΕΒΊ Ε ΗΤΜΗΑΑ Τ ΒΌΒΙΒΗΟΑ Ν ΝΗ ΤΑΓ ΟΝ ΠΖΟῚΤΝ Ε ΒΕ ΓἸ Ι Γ ΠΙΙ ΟΥ Μ Ρ ΙΒΑΤΌΒΗΟΙ Κ ΙΚΑΙΝΑ Τ ΕΓΖΒΙ Ε ΓΕ-ΙΌ- [ ΜῬΙΑοΑΝθΙι Ι ΣΘ Π ΘΚΠΈ Ε ΡΙΑ Υ Ν'Υ Ο Ο ΌΓΑΙΒ ΙΕΕ ΙΟΑΒΒ Ε ΡΝΕ ἰΑ ΓΙ ΙΕ Ο ΕΜΡΚΕΑ ΙΒσΕΖιΙΥ ΝΑΓ ΊΒ ΘΌ ΑΙΥΟΥ Α ΕΓΝΕΙ σΗΠΗῚΝ ΕΌ ΒΙΑΕΥΥΌιν. Ε ΓΟΗΙΙΕ Α ΑΘΌΒΟΡΚΜΒΕΕΕ ΖΓ ἸῚ Ο Γ ΒΙΜ Ό ΙΗΕΟΑ Η ΙΓΕΤΙΙΙ Ε Α Ε ΕΝΘ ΟΌ ΠΘΒΕΘΕΡΑΕ Τ Γ ΤΕΙ Β [ΕΟ1ΌΕ ΟΌΙΑΒ ΝΟΤΙΙΟΑΟΥ Ε ΝΟΕΟΝΤΘΒΤΕΕΙΙΙ.Ν Π ΓῚ1 |υΟΙΤΗ
ΜΟΡΑΝΙΕΙ. ΓΊ ΑὔΒΟΒΑ ἰΕνινὸ ΑΝΌ ΙΟ ΜΟΒΑΙ ΦΑΝ, ΝΕΖΤΙ ΚΈῚ ΠΟΝΝΑ ΔΈΥΕΙ. ΓΊ μξϑι ΕΑ ΝΕΥΨΉΑΝ ΓῚ ΡΑΤΊΡΑΒΚΕΒ ΕΒΝΑ ΡΑΒΚ ΓῚ ΟΙΝΌΥ ΡΑΤΤΟΝ ΓΊ ϑΑΝΌΒΑ ΡΟΙΕ ΑΟΚ ΠῚ
ΜΙΝΝΙΕ ΒΒΌΕ ΡΒΑΤΤ ΓῚ λβνηετ αλ Βι ο δ Θ ΚΙΘς.. στ ΛΝ. ση Οχι. (ΕΕ ΨΝΑΙΤΕΒΣ ΓΊ ΙΑΝΑ ΥΛΙΊΑΜΣ
ΓΓΕΙ ΙΠΘ ΗΠ ΑΑΥΕ ΥΝΝΟΌΌ Ν ΟΒΟΒΙΕΟΑΟΑΡΙ Ε Γ ΙΟ ΕΎΒἰΥΌΟ Ν Ν ΕΕ ΟΓ ΖΙῚΚΡΤ Ε Β ε Ο ΓίΙἱ Β ΟΊ ΒΑξΟΤηΒΗΥςΙ εΑ Π-ἂΉ Β ςΟΕΝ ς Γἵ]Ία π ηἙ υΑΑΝΙΡΠ Ε ΒΙΘπΑΟεΝΞ "" ΓΥ Ι ΑΠ ἰόΕ Ν Ι αΒΝΕρΌ Η] Ρ ΤΕ Ι,ΑΞ ᾗαΠς: υ Β ΒυἹΑ ΝΚ ΟΪ Ύ ΓΊ Ε Η τΣ᾽ ΕΕ ἰἼςΌ σΠΜῚτ ΕΑιΥσ ΝΒπΟ Ή) ΙΝΓ ΠῚΓΊ Α ΒΕΝΑΒΠΒΙΑ Β ΑΚΕ ΒΝΕΌΙΒ ΥΡ ΟΕ ΒΌ ΒΠΎΠΕ Ί ΠΒῚΕΝΑ
ΚΙΕΡΕΙΕΖ ΓΊ ΙΟΑΝ ΗΝΌΑΌ ΓΙ ΑΌΡΒΕ ΊΟΒΡΕ ΓΊ ΑΝΌΒΕΑ ΕΒΕ ἰΟννΕΝΖΤΕΙΝ,Ὶ ΙΌΡΙΤΗ ΜΟΌΑΝΕΙ. ΓΙ ΑἨΒΟΒΑ ἰΕνίνο ΑΝΌ ΒΙΟ ΜΟΒΑΙ ΕΣ ΠΠ ΙΟΑΝ ΝΕΖΤΙΕ ΓΊ ΒΟΝΝΑ ΝΕΥΕΙ. ΓΊ ΕΕ5Ι ΕΑ
ΙΓΝΙ Ε ΥΒΑΨΒΜΒΑΑΝΒ Α Γ Ιἐ ΜΡΑΤΉΤ ΡΓΑῚ Β ΚΙΕΕΑΒΝ ΝΓΕΙ ΕΨΨΑΕΌΗΟ͂ΝῊΑΝ Ρ ΑΠΒῚ Κ Μ ΓΆῚΝ Α'Θ {τΤτΕοΕ ""ΥγΝηςΑ. ΙΤ γΕεΒ Θ ἠΖπΤα η|ΑεπΝοΑ ή Υ Νς[Ιδ αΑπΜ]α ] ""Γ Ι Β θΟΉΒΑΖΟΥΝ Μ ΓΌῚΌ ΝΨΟΙΟΒΚΙΟΙΕΟ Ό ἐ Ε ΓΑΊΒ ΘΥ Ψ ΓΟῚΝ ΝΜΕΑ Β Ζ ΙΡΘΤΕΕΩΒΒ Ε ΖΓΤ] ΡΟΒΟΤΗΥ ΑΠΊΘΟΝ ΓῚ ΗΕ! ὶ ΕΥ̓ ΑΝΡΕΗ͂ΘΟΝ ΓῚ ΑΠΘῸΝ
ἸὈΒΕΕΥΟΝΗΙΕΡΘΕΙ . Γ ΓΙ Ι Β ΠΙΤΙΟᾺΝ ΝΓΑΕ Ι Β ΒΒΕΑΙ.Ν ΌΓ Ί Γ ῚΜ ΑΒΒΕΙΤΟΗΝ ΒΕΒΟΑΤΝΕΒΤ ΓΓῚῚ ΜΕἸΑ ΒῚΟΥΙ Α Β ΌΕΙΒ ΕΚΕΙΌΝΜ ΑΠῚΝ πΓρΙ ΑΙΑιΝξ ’ «""αΕςἸ (ΣΕΩΘ Ν Ί μ Ο Γ1Α9Β) Κ ΠΕΠ Γ ΕΙ Ε νΜνΙΕΟΙΗΙΕΕ Ι σ ΚΟΕΜἸΕ ΖΕ Ε Γ ΙΓ ΊΗ ΑΦΤΕΤΟΙΕΒ Ο ΘΙΑΟ Θ ΟΘΟΕΤΤΒΤΕ ΙΠ Π|. ΙΓΑΊΝ ΙΒΕΑΕσ ΗσΕοιυ ! Θ ΠΌ Ι ΡΕΟΙΟΙΕ
ΚΙΕΙΝ ΗΕΑΙΥ ΓΊ ΦΕΒΑΙ ΓΙΝΕ ΗΑΤΌΗ ΗΑΝΟΝ ΓῚ ΙΟΡΙΤΗ ΚΑΤΖ ΓῚ ΙΑΝΙΣ ΚΕΙΊΥ ΠῚ ΙΒΕΝΑ ΚΙΕΡΕΙΕΖ ΓΊ ΙΟΑΝ ΠΝΡΑΟ ΓΙ ΑΨΌΒΕ (ΟΒΡΕ ΓΙ ΑΝΌΒΕΑ ΕΒΕΌΌ (ΟΥΝΈΝΘΤΕΙΝ ΓῚ ΙΟΡΙΤΗ ΜΟΡΑΝΙΕΙ. ΓῚ
ΡΒΑΤ Τ"" ν ΓοΙ Β ΜεΑδΒεΡίΑίΙ ο Ὀηῆ,κ , ΈΒισ εδαγγε/-9 ι 8Α0ι . 9Ἔ9ΤΙ Ι]Τ-Η ὂΝχΕ .Ψ αΜυι ι πἘΕη ῖΚςΕ ΑΒΜγ ηὈςΝαΘΒ Ι ΟτΟαΌις.
ΓΙ ΥΨΟΝΝΕ ΖΙΡΤΕΒ ΓΊ ΒΟΒΟΤΗΥ ΑΙΊΘΟΝ ΓῚ ΗΕ {ΕΥ ΑΝΠΕΒΟΜΙΚΙ ΑΠΠΘΟΙΣ ΒΕΗΌΕΙ. ΓΊ Ε ΒΒΑΝ ΕΤΕΡΒΒΑΝΤ (Ύ Εἰ ΑΥ ΒΌΙΚΙΝ ΓῚ ΒΑΒΒΑΒΑ ΒΌΒΕΟΒΌ ΓΊ ΑΝΌΒΕΑ Εἰ ΕΟΚ ΟΙ ΑΒΌΥ
ΓἸΞΙ Α ΟΥΗΙΕΕ Β ΥΠΙῚ. ΕΟΥΙ ν ΕΑΙΒΙΕΚ Ε σ ΟΓΜΙ ΕΜΖ Ι ΟΓΗΙ Ε ΙΗΊΑΕ Τ ΤΟΙΊΕ ΕΘΕΟ ΘΓΘῚΕ ΤΘΤΕ Ο ΠΒῚΟ Ι ΑΙΑ ΝΟΙσΕτ β σεοιυ ιΠῦ. Ο Γ ΙΡ ΙΔΕἸΗΟ. Ι Ξ«ΕΝ Ο Κ ΕΠΕΠΙΝΟ ΙΘ ΗΗΕ Α ..Ι,Υ ΕΓΒΙΕ ΕΘΌΕΜΒΑΑΙΝΡ Ι ΝΓΕΙ ΕΗΠΑΙΤ ΌΕΗΝ ΗΕΒΑΥΝΕΟ Ν Γ Ί Π ΠΕΠΊΟΕΡ ΙΕΤΝΗ ΟΚΑΑΙΤΕΖΟ Β ΓΌῚ ΓΙΑΙ Ν ΜΙΒΑ Β ΚΙΥΕΝΙΊΥ ΓῚ ΙΒΕΝΑ ΚΕΕΡΕΙΒΖ ΓῚ ΙΌΑΝ ΠΝΌΑΟ
[Π ΑΟΡΒΕ ἸΟΒΡΕ ΓΊ ΑΝΌΒΕΑ ΕΒΕΌΡ ἸΟΝΝΈΝΘΤΕΙΝ ΓῚ ΟΠΙΤῊ ΜΟΡΑΝΙΕΙ. ΓΙ ΑΌΒΟΒΑ ΤΕΥΙΝδ ΑΝΩ ΒΟΒΑΒΙΟ ΜΟΒΑΙΕΒ ΓΊ |ΘᾺΝ ΝΕΤΙ Ε ΓΙ ΒΌΝΝΑ ΝΕΥΕΙ. ΓΊ ΠΕ5ιΕΑ ΝΕΥΥΜΑΝ ΠΠ ΡΑΤ ΡΑΒΚΕΒ
ΓΙΕΙ Α ΝΘΕΝΨΕ Ε ΗνΝΑΑΌ Θ ΡΗΑΝΒ ΚΠ Ὶ Γ ΙΑ ΝΟΝΙΝΑΌ Υ{Ε ΕΡ Α ΨΤΤΝΟΑΝΙΤ Ε[ΒΠ5Ὶ ΓΘΙΑ Ν|ΑΌΝΒΑΑ νΓνοΙυΗΑΑήΜχΣις Ε ἡἸγ ε5:) ΡΟ Ι "" Ὅμισ ο Ἰ ΕΠΕχῪ; ΠΑῚΝ ΠΨΕΙΒΟΘΚΟΙΕΝ ΘΓΕΙ Α ΑΒΖΠ Θ ΓΟΙΝ] ΜΒΕΑΟΒΗ ΡΕΕΩΙΒ. Ε ΓΣΙΤ Π ΓΙΟ] Ν ΒΝΑΕΒ Β ΒΑΒΒΑΑΝ ΌϑΜΙΤΗ [1]
ΓΙ ΒΕΤΗ ΒΒΑΝΤ ΠῚ ΕΝΥ ΒΌΙΚΙΝ Γ] ΒΑΒΒΑΒΑ ΕΟΒΌ Π] ΑΝΡΙ ΕΙ ΕΟΚ ΟΙ ΑΒΟΥ ΓΙ ΟΗΕΒΥΙ, Οι ΑΒΚΕ ΠῚ ΜΙ Ε ΟΙΙΕΡ ΓΙ ΟΕΟΒΩΙΑ ΟΟΤΕΕΙ. ΒΑσΗΕΝ ΟΌΙΏΟ ὈΕΥΒΙΕΘ Γ] ΒΙΤᾺ ΡΑΕ ΒΕΙ.
Βηβαι πΑΕΠΘΓΙΑΙ. Βοοἰκδαίαγδ- Αββοςίδίίοη» ΦΠνΒει Πα (ΑιΠΙΒΏΘΙΠΑ νο σπιονς
ΜΟΒΑΙΕ5 Π ΟΑΝ. ι Ν ΞΖ κ Πε Ρ ΠΠ ΓΑ ΤσΊσεσο ΟΑΒΕΤ ΒΑΝΌΑΙΙ.
ΓΗΙ ΒΑΌΤΙΗΌΑΝΗΝ Β ΟΗΒΘΑΟΝΝ ΓΟΙ ΨΝΊΟ Κ ΙΕΟ ΘΥΕΑ Β ΣΚ ΓΑΊ ΜΤΑΖΒ ϑ ΕΠΟΒ Ε ΣΤἸ ΑΓῚ Ν ΒΑΙΒΣΆ ΒΑ Κ ἐΜΕΙΤΙΗΥ ΓΙ ΠΙΕΑΊΝΒΝΕΕ ΨΝΑΑΌΘΗ Ν Κ ΓΊΙ Ε ΑΡΝΝΕΑ Ι ΖἐΕΕ ΥΓΝΙΑ ΙΤ ΕΟΒΣ Α ΠΠΝ Ι Α ΝΗΑ ΝὑνΙΟΠΊΑΑΜΟΣ ΓῚ Π ΗΑῚ Υ ΟΑΌΝΨΟΒΙΌΟΟΌΒ ΕΓΙ Υ ΨἸΟΟΝΝΒΕ Ό ΖΊΕΡΤ ΕΒ ή Γ Ὶ ΒΓΟΒΒΟΕΤΗΟΥΟ πεΘτήδαῃι ΜςΡΑΝΙΕΙ. Π] ΑΟΒΟΒΑ ΙΕ Π ὙΙΝΘ ΑΝΌ ΒΟΖΑΒΙΟ
ΑΟΉΙΗΙΟΡΝΕ ΠΓῚΙ θΘΗΕΕΟΙΒ ΟΕΙΥΑ ΑΟΕΟΕΤ Β ΤΕΗΙ Ε 1 Π ΓΑΙΦ ΘσΙ Η ΙΙ Α ἐΙ ΜΓΕΑΑΙΜ ΕΠΟΙΕΧΣ Έ""ΒΚΟΕΕ Ε ἘΑΠΠΤΡΟΕΝΟΑ ΤἘΑκΕυΣεΊΕ εΡὔΩτΣε) ΘτηΑ,Υ ΙΟΕ Ι ΠΑΠΒ ΚΕΕΝ Ν ΓΕΊΙ Ι ΕΜ ΙΘΗΟΕΜΙ ΕΕΖ
ΠΠ ΗΑ μοΙῖΤ ΙΝΕΙΘ ΏΘΘΩΟΑΞΙ ΑΨΚΝΌ Ν ΕΕΙΥΣ Π Ια ί ςΟ ΑΕε λ οΑζ Ν ΑΠΙ Ο Τ ΟΙΘ Α ΙΚΕ Ε ( Ε ΠμΕΣ Ε ,Β ΟΌΝΕΟ Β ΗΠΩΣῚ ο Α οοΝο,ΌΒΕΑ.
ΡΑΤΤΟΝ ΓῚ ϑΑΝΌΒΑ ΡΟΙΙ ΑΟΚ ΓΊ ΜΙΝΝΙΕ ΒΒΌσΕ ΡΒΑΤΤ ΓΊ ΜΑΒΘΑΒΕΤ ΒΑΝΡΑΙΙ. ΓΊ ΒΟΤΗΑΝΝ ΒΟΒΘΟΝ ΓῚ νΙΟΚΙΕ ἐΕΑΒδ ΓΊ ΜΑΒ 5ΕΘΒΕΣΤ ΓΊ ΒΑΒΒΑΒΑ ἐΜΙΤΗ ΓῚ ΙΕΑΝΝΕ ΨΑΌΘΗΝ ΓΙ ΑΝΝΑ
ΚΕΕ ΥΝΑΙΤΕΒΣ ΓΊ ΙΑΝΑ Λάμ ΑΜΣ ΓῚ τῳψὰχ ΥΟΌβΙ ΒΙΟ ΓΙ ΥΨΟΝΝΕ ΖΙΡΤΕΒ ΑΠ] ΠΟΒΟΤΗΥ ΑΙΠΊΞΟΝ ΓΙ ϑεΕιΕ ΕΥ̓ ΑΝΒΕΒΘΟΝ ΓΊ ΑΠΒΟΝ ΒΗαΉΡΕΙ. ἐὐΩΙΌΝΝΕ ΒΒΑΔΌ ΓῚ ΒΕΤΗ ΒΒΑΝΤ ΓῚ Εἰ ΠΥ
ΕΒΒΕΌΕΌΜΙΚΑΝΙ Ν ΓΠ ΕΠΓΊΕΊΝ ΕΒΑΥΑΕ ΒΓΙ Β ἘΠΑΙΕΝΒ ΑΟΑ ΓΕ ΟἊΒΌἊ ΓῚν Μ Α ΒμΙῪ Ν ΊΟΑεΥ Ί Ε Π ΓῚ ΙξΕΥοΝΕ Ι ΓΕε ςΟΟ Μ Ε{Ζγ ΓαΙ Η ΑΕΙΤΙΙΕ ΘΓΌΛΟΘΕΙΤΤΤ Ι ΓοΤ Ι ΑΌΝΙΟ Ε ΟΔοΝυ[ Γ Ί Γ ΕΟἸΟΙΖΡΕΤ ΚΕΙ Β ΕΙ Ν ΓἨΕΊΑ ΙΎ Μ [1 ΑΟΕΒΒΑΟΓΓΙΙΝΑΕ ΠΆΪΕΗ ΗΑΝΟΝ ΓΙ ΙΟΡΙΤΗ
ΠΚ Α ΡΤΟΖΝ ΝΓΠΑΙ Α ΝΝΕΙΣΥ Ε ΚΙ Ε ΠΙΙῚΥ ΕΓδΠι ΙΕΒΑΕ Ν ΝΑΕ ΥΚΥΙΜΕΡΑΕΝΙΕ Ζ Γ ῚΓ Ί Ρ ΑΟΤΑ Ν Ρ Α ΠΒΝΚΌΕΒΑ Ό Γ ΊΓ Ι ϑ ΕΑΨυΡΕΒΒΕΝ Α Ἀ ΙΡΑΑΌῚ υδ ΕΘΙΗ Ὄ ΓΑΕΝΩΙΝΕΈΙ. Ν ΓΕΊΝ ΑΒΟΒΒΌΟΟΒΕΑ Ρ {ΒΕΑΥΤΙΝΤ5 Γ ΑΙ Ν Μ ΑΒΒΟΟΣΑΑΒΒΕΙΟΤ ΜΒΑΟΝΒΑΡΑΙ Ι ΙΕ. Σ Γ ΙΠ Π Β Τ ΙΗΟΑΑΝΝΝ Ν ΒΕΟΖΤΒΙΘΕΟΝ ΓῚ
ΑΝ Ρ""ΕΕΒΝΘΟΕΝΡ Γ [Αδα ΒΤΟη Ζ βΚεῖΣηΡ Ἐ ΤβαΆνΣτ ἡΟ ΘΚΠι Π ΗΝδΊθυΘιΗ! ΣΗΣδ η Κ ἈΝΚΑ, ΕὈΞ Ε ΦΟ Ν ΎΕΘ Ε Ὑ μΘισΕΗΣε ι ""Α ΘΟΕ Ο ΟΒΟ ΙοΑρ,
Α Ϊ
ΟΠΠστ βΙεΑιΝι Ι ΟΓΕΙ ΒσΑΟυΟιΗ Ε ΟΙ. ΠΘ υ ΙΕΡΙΟΟ Ι ΕΡ Ε ΚΥΙΑ ΙΕΕΙΣΝ Γ ΗΊ Ε ΑΒΙΙΥΤ Ὰ Π ῚΡ Α ΦΙ Ε ΒΒΕΑΙΙ Ρ ΓΙΝΊ Ε Μ ΗΑΑΒΤΙΟΌΝΗ ΕΗΟΑΛΝΤΟΕΝΒ 5(Ε 0β7ε7[ Τ Υ2 ""ΡΥΕΩΙΞ ΖΕ Ν Π ΠΟ Α|ΟΙΕΑΟΝΒ Ό Η ΝΓΡΊ Α ΌΜ Α ΠΒῚΙΙ Υ Α͂Νυ ΓΟΒΑΕΥ Ί(ΟΕ Β ΌΠῚΕ |ΓΕΙΥ ΕΑΙΕΝΕΌ ΒΘΕΟΑΜ ΕΕΖΒ Ε ΓΟῚΟ ΗΙΑΟΥΙ͂ΤνΙΈΕ Ν ΔΘΟΤΕΘΙΘΝΕΤΤ
ΠῚ ΟΡΙΤῊ ΜΟΠΑΝΙΕΙ. ΓΙ ΑυΒΟΒΑ 1ΕΨΙΝδ ΑΝΌ ΒΟΘΑΒΙΟ ΜΟΒΑΙ Εὅ ΓΙ |ΟΑΝ ΝΕΖΤΙΕ ΓΙ ΔΟΝΝΑ ΝΕΥΕΙ. ΓΙ (Ε5ι ΕΑ ΝΕΥΥΜΑΝ ΓΙ ΡΑΤ ΡΑΒΚΕΒ ΓΊ ΘΕΨΕΒΝΑ ΡΑΒΚ Γ] ΟΙΝΌΥ ΡΑΤΤΟΝ ΓΊ ΞΑΝΏΒΑ.
Μαγ/]ιπο 1992 32 νοίαπις 15 Ν πάρος 1
This content downloaded from
(cid:0)(cid:0)(cid:0)(cid:0)(cid:0)(cid:0)(cid:0)(cid:0)(cid:0)(cid:0)(cid:0)(cid:0)70.126.145.227 on Sat, 19 Mar 2022 18:00:56 UTC(cid:0)(cid:0)(cid:0)(cid:0)(cid:0)(cid:0)(cid:0)(cid:0)(cid:0)(cid:0)(cid:0)(cid:0)(cid:0)
All use subject to https://about.jstor.org/terms",[]
35,"Feminist Bookstore News
See last issue (page 21) for details about Feminist Readings & Book Signings
Bookstores Days (Thursday, May 21 and Friday May Seal Press author Barbara Kingsolver (Another
22), the Women’s Presses Conference (Thursday, May American/Otra América) will be reading at ABA along
21), The Feminist Bookstore/Feminist Publisher Din- with Firebrand author Janice Gould (Beneath My
ner (Saturday, 8 pm, $20 — Call FBN, 415-626-1556 by Heart), Judith Freeman and Eduardo Galeano at the
May 15 to reserve tickets), the Publishers’ Triangle Booksellers for Social Responsibility/PEN Center
“Town Meeting” on Lesbian & Gay Book Month (Sat- West Reading Room on Sunday from 2:30-4 pm.
urday, 5:30-7 pm), Feminist/Gay/Lesbian Row (the Naiad Press authors Nikki Baker and Jenny Ful-
entire 4500 block), and the “Friends of Femi- ton will be signing books at ABA. Diane Salvatore will
nist/Gay/Lesbian Aisle” (Booths 4411-4415) and the also be in attendance. Check Naiad Booth (#4500-
Multicultural Exhibit. 4502) for times.
Check the ABA schedule for additional work-
shops. This year’s line-up looks particularly solid. JE E WZ. A.. P PH EE NY TP oA V KE N, O D Wo OYA U R E W A E L iL NO..
Motels: BOOTH NUMBER?
The block of rooms FBN booked at the Conven-
tion Center Inn in Anaheim is filled and they are (as
we go to press) turning people away. Word is that they
expect a number of cancellations in May from other
groups who booked blocks of rooms but haven't filled
them, so you may want to call the Convention Center
Inn and ask to be put on a waiting list for rooms. But,
in the meantime, be sure to book a room elsewhere to
insure that you do end up with a place to stay.
Feminist/Gay/Lesbian Row:
Eighth Mountain Press will be giving away a trip From “Life at Inland” cartoons by Diane DiMassa
for two to Costa Rica, including air fare from any U.S.
city that American Airlines flies from, and four nights Alyson Press Film
hotel accommodation to a lucky bookseller. All this to Alyson Publications will premiere an advance
promote their lead Fall title A Journey of One's Own: edition of an hour-long film about Forman Brown, the
Uncommon Advice for the Independent Woman Traveler now 91-year-old author of Better Angel, one of the
by Thalia Zepatos. Look for Eighth Mountain in (the?!) first positive gay men’s novels, originally pub-
Booths 4504 and 4506. lished in 1933 and currently published by Alyson.
Third Side Press has announced that its ABA offer Brown, a long-time puppeteer, has also published a
will become an “ABA Season Discount.” Effective book in Alyson’s series for children with gay parents,
May 15 - June 1, any bookstore that orders 20 or more The Generous Jefferson Bartleby Jones. Check with Aly-
books will receive the special ABA Season Discount, son. It may be shown on the eve of ABA.
whether or not the bookseller attends ABA. The terms
are free freight and 50% discount on prepaid orders Lammies Banquet
and free freight and 45% discount on net 30 orders. The Fourth Annual Lambda Literary Awards
(Discount reverts to 40% after 30 days.) Look for Third Banquet will be Friday, May 22 at the Anaheim Hilton.
Side in booth 4509. Kate Clinton will emcee. Adrienne Rich will present
33 May/June 1992
This content downloaded from
(cid:0)(cid:0)(cid:0)(cid:0)(cid:0)(cid:0)(cid:0)(cid:0)(cid:0)(cid:0)(cid:0)(cid:0)70.126.145.227 on Sat, 19 Mar 2022 18:00:56 UTC(cid:0)(cid:0)(cid:0)(cid:0)(cid:0)(cid:0)(cid:0)(cid:0)(cid:0)(cid:0)(cid:0)(cid:0)(cid:0)
All use subject to https://about.jstor.org/terms",[]
36,"Feminist Bookstore News
the Fourth Annual Bill Whitehead Lecture. Tickets are More Association & Trade Meetings
$60. Vegetarian meals are available on request. Finan- The Women’s National Book Association Meeting
cial assistance will be available to ensure accessibility. for Women In Publishing reception will be Friday, May
Those for whom a $60 ticket is not a financial issue are 22, from 5-7 pm. Check ABA program for location.
encouraged to contribute to the “scholarship” fund so The Association of Booksellers for Children
that everyone who wishes to participate may do so. (ABC) will sponsor a day of workshops for children’s
Cocktail hour begins at 6 pm with the Awards dinner booksellers all day Friday, May 22. Contact Caron
and program starting at 7 pm. Black tie optional (men Chapman at 800-421-1665 for reservations. The meet-
or women). To order tickets phone the Lammies Line ings are open to anyone interested in children’s books.
at 202- 462-7924 or send your check to Lambda Liter- ABC's annual “Evening with Children’s Booksellers”
ary Awards, c/o Lambda Rising Bookstore, 1625 Con- Dinner will be a tribute to Dr. Seuss. Tickets are $56 by
necticut Ave. NW, Washington DC 20009. May 15 to ABC National Office, 175 Ash St., St. Paul
MN 55126.
ABA Specialty Bookstore Roundtables
ANAHEIM The Feminist Bookstore Roundtable will meet
Sunday from noon to 2 pm. It will be facilitated by
Theresa Corrigan, Lioness Books, Sacramento. Also in
NMA Y 23-26. VSE the same time slot will be the African-American Book-
store Roundtable, The Recovery Bookstore Round-
AMER CIC OA NN V E NBO TIO OK NS E L &L E TR RS A DA ES S O EXCI HA IT BI IO TN t Ra ob ule n, d ta as b l ew s.ell as the Mystery and Cookbook Bookstore
Inland Sponsors Fund-Raiser The Gay/Lesbian Bookstore Roundtable will
Get ready for a change of pace. Rather than con- meet Monday from noon to 2 pm. Facilitators will be
tinuing to co-sponsor the annual small press party, Carrie Barnett and Brett Shingledecker, co-owners of
Inland is underwriting a fund-raising drive that will People Like Us Books in Chicago. New Age, Science
honor the values that small presses have been promot- Fiction, Technical/Scientific, and Travel Bookstore
ing all along. The goal is to raise $25,000 dollars that Roundtables will also meet in the same time slot.
will be distributed among five organizations that ad-
dress the issues of literacy, environmental issues, ABA's Annual Meeting
homelessness and poverty, AIDS care, and a literary ABA's Annual Membership Meeting will be Sun-
organization. The funds will go to small local organi- day from 4-5:30 pm. Don’t miss it!
zations, some of which focus on women’s and third
world issues, where $5,000 will make a big difference. ABFFE Benefit
The fundraiser, The Small Press Action Fund, will be The American Booksellers Foundation for Free Ex-
repeated annually as a way for small press people to pression benefit will be held on Monday night this year.
contribute to the political life of the communities The ABBY Awards will be presented, emcee will be
where ABA is held, rather than breezing in and out Garrison Keillor, with other guest performers to be an-
like tourists. nounced. Tickets range from $25-$100. Order from ABA.
Inland will underwrite all expenses so that 100% Later that night (11:30 pm to 1 am) ABA's wildest
of the money donated will go to the recipient organi- “literary” event, The Rock Bottom Remainders, fea-
zations. Make checks out to Liberty Hill Foundation turing Amy Tan, Barbara Kingsolver, Louise Erdrich,
and mail to David Wilk c/o Inland Books, Box 120261, Stephen King, Roy Blount, Robert Fulghum and other
East Haven CT 06512, or bring your donation to the writers (who will have actually practiced together by
-Inland Booth at ABA. then) will perform rock oldies at the Cowboy Boogie
The presentation ceremony is tentatively sched- Club. You need your ABA badge to get in. Cover
uled for Monday at show closing. Check at the Inland chfaroger w il l m beneofirt elit er aciyn grfouops.. C al—l 41C5-6S64- 3 33O3
booth for time and place.
May/June 1992 34 Volume 15 Number 1
This content downloaded from
(cid:0)(cid:0)(cid:0)(cid:0)(cid:0)(cid:0)(cid:0)(cid:0)(cid:0)(cid:0)(cid:0)(cid:0)70.126.145.227 on Sat, 19 Mar 2022 18:00:56 UTC(cid:0)(cid:0)(cid:0)(cid:0)(cid:0)(cid:0)(cid:0)(cid:0)(cid:0)(cid:0)(cid:0)(cid:0)(cid:0)
All use subject to https://about.jstor.org/terms",[]
37,"Feminist Bookstore News
Audrey, Vicky, and Ellie, the bookstore cat. Photo by Alan Howell.
By Kathleen Dombhart Bark After spending the weekend “drawing pictures
in the sand of an imaginary bookstore,” the two
While Labor Day trips to the beach usually are women then spent the next year doing research and
filled with sunning, relaxing and water sports, a holi- making further plans for the opening of the Meristem
day trip for Audrey May and Vickie Scarborough bookstore in the Cooper-Young neighborhood.
several years ago also proved to be an opportunity to “We spent the year talking to the owners of other
plan a business venture. women’s bookstores, ” May says. “We went to these
“We had thought about opening a business and stores and talked to the owners and got a lot of feed-
what kind of business would be good,” Scarborough back and information.”
says. “We both have a long history of activism in the Part of that research involved deciding on a lo-
feminist community and we both have strong feelings cation for the bookstore, and the two women very
about that. “While we were on vacation we visited a deliberately picked the Cooper-Young neighborhood
feminist bookstore in Gulfport, Mississippi, and were for their business.
impressed with what they had going. “We knew it had to be in Midtown,” May says,
“We thought, ‘Hell, if they can do it in Gulfport, “and we liked the Cooper-Young neighborhood. We
Miss., we can certainly do it in Memphis, Tennessee,” could see it was in the midst of a revitalization.
she says. “It’s a neighborhood with a distinct sense of itself,
Volume 15 Number 1 May/June 1992
This content downloaded from
(cid:0)(cid:0)(cid:0)(cid:0)(cid:0)(cid:0)(cid:0)(cid:0)(cid:0)(cid:0)(cid:0)(cid:0)70.126.145.227 on Sat, 19 Mar 2022 18:00:56 UTC(cid:0)(cid:0)(cid:0)(cid:0)(cid:0)(cid:0)(cid:0)(cid:0)(cid:0)(cid:0)(cid:0)(cid:0)(cid:0)
All use subject to https://about.jstor.org/terms",[]
