PageNumber,Text,ISBNs
103,"From the Women in Culture THE AUTOBIOGRAPHY OF MAUD GONNE
and Society series
A Servant of the Queen
Edited by Norman Jeffares and Anna MacBride White
“Maud Gonne wasn’t simply ‘Yeats’s beloved’—she wasn’t simply anything—but a
remarkable person in her own right. . . . She was also a fiery orator, a fierce patriot,
a noteworthy actress, a good writer and, let it be said, an adventuress who entered
realms where few if any women had trod before her. . . . The book is a wonderful
read.”—Frank Kinahan, author of Yeats, Folklore & Occultism
*Paper $14.95 460 pages illus.
Now in Paper
WOMEN AND WAR
JEAN BETHKE ELSHTAIN
MANLINESS AND
With a new Epilogue
CIVILIZATION
“Bold and courageous, Women and War rethinks history in order to reimagine
RA Gac Ae C I i Lnu l tt Bhu e E r DUa nl E i Rt eH d M i Ss Att a No ter s,y 1 8 8o 0f -1 9 1G 7ender and Pp — ao pli et r i c C s $ a 1 f t 4o .h 9r 5 a r t 3h i 2e n 1 e p po as gt R e-a s.t o i m llS ui tc s .i mage p. sT oh ne , v o i Rce u o tf g eJ rea sn E Uls nht ia vin e r is s i tve yry special.”
‘This unique account of the assertion
of and resistance to white male power ART OF DARKNESS
ic nla tr ei rf pi le as y t h bee t wco eem np l rex ac, e o af nte dn g c eo nn dt er ra r iy n, A Poetics of Gothic
American history. ANNE WILLIAMS
e —ste N d“ T a ih nni s c A ya m m er Fu ic .s a t n Cr ce ouad l tt tu f r ,o e r . ” Y a any leon e U in nt ie vr- ersity A“ eA rx i z p oc no lm aospe il oli nng , o r fev e a flin eg m, ia nnd i s thi g h sl ty u r de iad ea sb l e o b no ok t, h o ene Gof o t th he i cb .e ”st — in J et rhe r or le dce n t E. Hogle, University of
Cloth $27.50 312 pages illus. *Paper $14.95 328 pages illus.
EQUIVOCAL BEINGS
RETHINKING THE POLITICAL
Politics, Gender, and Sentimentality
in the 17905— Wollstonecraft, Edited by JOHANNA BRENNER, YESIM ARAT, and
Radcliffe, Burney, Austen BARBARA LASLETT
CLAUDIA L. JOHNSON Centered around issues of collectivity and citizenship, political resistance, and the
“What a splendid book Equivocal state, this collection demonstrates how conceptions of political processes and
Beings is! Johnson enters a debate structures are expanded and revised when viewed through the lens of gender.
that had become tedious, enlivens it, ‘These essays originally appeared in Signs: Journal of Women in Culture and Society.
and resolves it with energy and ease. *Paper $14.95 300 pages
Her position carries great authority;
her elucidation sounds like self-evi- *Cloth edition available
dent truth.”—Patricia Meyer Spacks,
author of Boredom: The Literary
History of a State of Mind La Se) e n [o7 Vele N
*Paper $14.95 240 pages
5801 SOUTH ELLIS AVENUE, CHICAGO, ILLINOIS 60637
This content downloaded from
(cid:0)(cid:0)(cid:0)(cid:0)(cid:0)(cid:0)(cid:0)(cid:0)(cid:0)(cid:0)(cid:0)(cid:0)74.108.41.47 on Thu, 28 Mar 2024 01:30:49 +00:00(cid:0)(cid:0)(cid:0)(cid:0)(cid:0)(cid:0)(cid:0)(cid:0)(cid:0)(cid:0)(cid:0)(cid:0)
All use subject to https://about.jstor.org/terms",[]
104,"FROM
THE
nA I A
(t
by Mev Miller Out in Culture: Gay, Lesbian, and Queer
Essays on Popular Culture edited by Corey
As you can guess, there’s lots of pubs and lots Creekmur and Alexander Doty is an eclectic anthol-
' of new titles for the Spring season. I have tried to Ogy Of essays appealing to those interested in popu-
get as much as I can into this column — the remain- lar culture images — especially as presented in TV
der will be covered in the next issue. At some point and film — and the ways in which gays, lesbians
in the future, I hope to do a column on university and queers have experienced, appropriated and
discount schedules and how they work. I'd be resisted these images. $22.95 short discount pb, 0-
grateful to hear any personal experiences stores
have in this regard and I'd like to hear from indi- 8223-1541-6, May. fF
vidual university press sales managers as well! For A
the purposes of this column, though, any time I ¿Entiendes?: Queer Readings, Hispanic
indicate a title as short or text discount, it is because Writing edited by Emilie Bergmann and Paul Julian
the catalogue indicates it that way. However, stores Smith is a groundbreaking anthology in which the
should be sure to contact the individual presses to issues of gay and lesbian identity are explored —for
see what type of agency plans they may have to the first time in Spanish and Hispanic literature —
alleviate these discounts! Happy browsing! by the question ¿Entiendos?: Do you get it? $18.95
short discount pb, 0-8223-1615-3, June.
Ê l INDIANA UNIVERSITY PRESS
DUKE UNIVERSITY reali zT eh de i nA s s 1o 9c 8i 8at io thn a to f s c hA om lae rr li yc a n p r eU sn seiv s e r os nit y t h P e r e cs us te -s
Series Q, the Gay and Lesbian Studies series ting edge of scholarship should also be at the fore-
from Duke, has three new titles this season that will front of using bias-free and non-sexist language. A
most likely only appeal to those stores with a large task force was formed to establish guidelines for
queer clientele: university presses on appropriate language relating
I've never liked Barbie, so I'm out of the loop, to gender, race, ethnicity, citizenship and nationali-
but apparently the doll is being culturally reappro- ty, religion, disabilities, sexual orientation and age.
priated by artists and collectors as a form of social The result is Guidelines for Bias-Free Writing by
and political activism. In Barbie’s Queer Marilyn Schwartz and the Task Force on Bias-Free
Accessories Erica Rand contrasts the skinny, blond, Language of the Association of American
white Barbie and the values Mattel seeks to University Presses. $5.95 pb, 0-253-20941-2.
embody against the naked, dyked-out, transgen- For stores located near universities with strong
dered, and trashed versions favored by many juve- interests in film and cinema, you may want to con-
nile owners and adult collectors of the doll. But I sider Feminisms in the Cinema edited by Laura
still have to ask, did I miss something? $15.95 pb, 0- Pietropaola and Ada Tetaferri. This collection of
8223-1620-X, May. theoretical essays juxtaposes the work of feminist
Volume 17 Number 6 101
This content downloaded from
(cid:0)(cid:0)(cid:0)(cid:0)(cid:0)(cid:0)(cid:0)(cid:0)(cid:0)(cid:0)(cid:0)(cid:0)74.108.41.47 on Thu, 28 Mar 2024 01:30:49 +00:00(cid:0)(cid:0)(cid:0)(cid:0)(cid:0)(cid:0)(cid:0)(cid:0)(cid:0)(cid:0)(cid:0)(cid:0)
All use subject to https://about.jstor.org/terms","['0-8223-1615-3', '0-253-20941-2']"
105,"researchers with that of women filmmakers.
NI Contributors include Kay Armatage, Trinh T. Minh-
ha, Monika Treut and others. $12.95 text discount pb,
0-253-20928-5, May.
There is little in the field of anthropology that
contributes to feminist debates. A Passion for
N D y
IA S Difference: Essays in Anthropology and Gender
CONTRIBUTORS by Henrietta Moore considers this lack of contribu-
tion and demonstrates how anthropology can con-
Joyce Antler tribute to feminist theory, especially in discussions
of sex, gender and sexuality. $14.95 text discount pb,
William H. Chafe 0-253-20951-X.
An addition to the growing list of literary criti-
Nancy F. Cott cism on Black women’s writings is “The Changing
Jane Sherron De Hart Same”: Black Women’s Literature, Criticism, and
Theory by Deborah McDowell. She examines defin-
Thomas Dublin ing moments in African American women’s fiction as
well as how they have been interpreted and received.
Estelle B. Freedman $12.95 text discount pb, 0-253-20926-9, April.
linda Gordon A i
Darlene Clark Hine US. HISTORY AS | èl
NEW YORK UNIVERSITY PRESS
linda K. Kerber
WOMEN'S HISTORY Inspired by the need to expand understanding
Alice Kessler-Harris of what constitutes Black women’s writing and to
recognize its diversity, Moving Beyond Boundaries
Judith Walzer Leavitt New Feminist Éssays edited by Carole Boyce-Davies and Molrara
Ogundipe-Leslie offers creative and critical work by
Nell Irvin Painter Edited by Linda K. Kerber, Alice Kessler-Harris, Black women from around the globe. Volume 1,
International Dimensions of Black Women’s
Ruth Rosen & Kathryn Kish Sklar Writing ($18.95 pb, 0-8147-1238-X, April), focuses
Barbara Sicherman o“ fA en ss ay e s.v Eo vc ea ryt i v sce h o laa rn ad n d s at cti ir vr isting collection o rn ef lec cr te ia ot niv s,e cp oi mec mes e ns tu ac rh ie sa s a nn da r r pa ot ei tv re y . s t Vor oi le us m, e p e 2r ,sonal
Kathryn Kish Sklar sc oo cn ic ae l r n ched a n gab e,o u ft e mpu inb il si tc cli of ne s c a ion ud sness B 1,l a c Ak p rW il)o ,m ce on m’s p lD emias ep no tr sa s v o($ lu1 m8.9 e 5 1 p b w, it 0 h- 8 a1 4 7 c- o1 ll2 e4 c0 t- ion
Amy Swerdlow and empowerment, civil rights, of critical commentaries and discussions.
human rights, and dignity for all This season's additions to “The Cutting Edge:
people, will want to read and ponder Lesbian Life and Literature Series” include Lesbian
this book.”—Blanche Wiesen Cook, Erotics edited by Karla Jay. Contributing to the
author of Eleanor Roosevelt ongoing discussion of lesbian sex — what is it? —
488 pp., 10 illus., $37.50 cloth, $15.95 paper and related issues — lesbian erotica or just plain
Gender and American Culture porn? — this collection of essays includes such writ-
ers as Marny Hall, Elizabeth Meese, and Kitty Tsui,
among others. This anthology investigates the cul-
tural production of sexually charged images of les-
bians in film, law, literature and popular culture in
general. $17.95 pb, 0-8147-4225-4, April.
102 Volume 17 Number 6
This content downloaded from
(cid:0)(cid:0)(cid:0)(cid:0)(cid:0)(cid:0)(cid:0)(cid:0)(cid:0)(cid:0)(cid:0)(cid:0)74.108.41.47 on Thu, 28 Mar 2024 01:30:49 +00:00(cid:0)(cid:0)(cid:0)(cid:0)(cid:0)(cid:0)(cid:0)(cid:0)(cid:0)(cid:0)(cid:0)(cid:0)
All use subject to https://about.jstor.org/terms","['0-253-20928-5', '0-253-20951-X', '0-253-20926-9', '0-8147-1238-X', '0-8147-4225-4']"
106,"rani I A
For those who are fans of the old Daughters
Press novels, NYU is re-issuing The Cook and the
Carpenter: A Novel by the Carpenter by June Problem of the Passions: Feminism,
Arnold. It’s exciting to have one of the classics of Psychoanalysis, and Social Theory by Cynthia
the early lesbian and feminist movements back in Burack ($14.95, 0-8147-1252-5).
print. $14.95 pb, 0-8147-0631-2, June.
Bisexuality and the Challenge to Lesbian OHIO UNIVERSITY PRESS
Politics: Sex, Loyalty, and Revolution by Paula It seems sometimes that the most promising
Rust uses interviews, a survey of political and jour- volumes are the ones that are expensive cloth!
nalistic writing, and a look at the rise in the political Womanist and Feminist Aesthetics: A
bisexual movement to address a range of questions Comparative Review by Tuzyline Jita Allan is the
pertaining to the political and social relationship first in-depth study to examine issues of identity
between lesbian and bisexual women. $16.95 pb, 0- and difference within feminism by drawing on
8147-7445-8, August. Alice Walker's notion of an essential Black feminist
Finally, Diana: A Strange Autobiography by (womanist) consciousness. It may be a bit academic
Diana Frederics appears to be the life story of a young but could potentially offer yet another challenge to
woman in the early 1900s and her journey to self-dis- white liberal feminism while creating a new place
covery as a lesbian. However, the introduction written of cooperation in the struggle against domination.
by Julie Abraham reveals the book to be a synthesis of $34.95 short discount cl, 0-8214-1109-8, May.
confessional genre novels, but supportive of early les- New edition — back in print: Under a Glass
bian relationships. $14.95 pb, 0-8147-2635-6, June. Bel], a collection of stories by Anaïs Nin. $8.95 pb,
Female Fetishism by Lorraine Gamman and
Merja Makinen engagingly documents women’s
involvement in this form of sexuality. They include
critiques of the obsessional behavior of pop fans, OXFORD UNIVERSITY PRESS
women’s involvement in fetish magazines, eating As usual, Oxford has a large number of titles. I
disorders as a form of fetishism, and feminist treat- will do the most critical ones this issue and get to
ment of the political and cultural significance of the rest in the next issue.
female fetishism. $16.95 pb, 0-8147-3072-8. The Oxford Book of Women’s Writing in the
There seems to be a slowly growing number of United States edited by Linda Wagner-Martin and
titles about women who have chosen not to or who Cathy N. Davidson contributes to the growing num-
are unable to have children. Will You Be Mother?: ber of volumes published by Oxford collecting the
Women Who Choose to Say No by Jane Bartlett con- writings of women. This volume includes short sto-
tributes to this list. Bartlett interviews fifty women — ries, essays, plays, speeches, performance pieces,
who for various reasons have not had children — erotica, diaries, correspondence and even a few
and through their stories explores what the personal recipes, from nearly one hundred women writers.
and public implications are for them in a society that The introduction exploring the history of women’s
constantly pressures women into motherhood as a writing in the U.S. helps to put these writings in con-
natural state. $15.95 pb, 0-8147-1245-2. text so as to better understand the use of language in
Now in paperback: Sojourner Truth: Slave, exploring women’s lives. $30 cl, 0-19-508706-2, May.
103
This content downloaded from
(cid:0)(cid:0)(cid:0)(cid:0)(cid:0)(cid:0)(cid:0)(cid:0)(cid:0)(cid:0)(cid:0)(cid:0)74.108.41.47 on Thu, 28 Mar 2024 01:30:49 +00:00(cid:0)(cid:0)(cid:0)(cid:0)(cid:0)(cid:0)(cid:0)(cid:0)(cid:0)(cid:0)(cid:0)(cid:0)
All use subject to https://about.jstor.org/terms","['0-8147-1252-5', '0-8147-0631-2', '0-8214-1109-8', '0-8147-2635-6', '0-8147-3072-8', '0-8147-1245-2', '0-19-508706-2']"
107,"Race, Gender, and Power in America edited by Feminism and Bioethics: Beyond Reproduction
Anita Hill and Emma Coleman Jordan contains a edited by Susan Wolf contains original essays that
collection of essays which explore the volatile poli- look from a feminist standpoint at bioethical prob-
tics of race and gender, and the unique challenges lems concerning euthanasia, AIDS, the definition of
faced by African American women. It includes the health, research, health care reform, and more.
first published essay on the Hill-Thomas episode by $19.95 pb, 0-19-509556-1.
Hill herself. Lawyers, judges, sex discrimination For stores with a strong business section look-
experts and others challenge the legacy of the Hill- ing for information on the equality of women in
Thomas hearings and offer suggestions for ending management, America’s Competitive Secret:
sexual harassment and the underlying system of Women Managers by Judy Rosener will be a wel-
sexism. $25 cl, 0-19-508774-7, May. come addition. An expert on workforce diversity,
With so many women of the baby-boomer gen- Rosener explores the difference in styles between
eration now approaching menopause, it’s no won- men and women managers, explains why the
der that there has been an increase in the number of “glass ceiling” still prevents women from reaching
books published on this important health issue. the upper echelons of management and discusses
Turning Point: The Myths and Realities of how business success and economic strength in the
Menopause by Sue Furman is a welcome addition U.S. has been limited and compromised by not rec-
to this literature. Furman, a biologist, explains the ognizing the valuable resource women could be to
biological aspects of menopause, providing useful management. $25 cl, 0-19-508079-3, May.
information so that women can ask better questions For those looking for international contributions
of their physicians and, with better understanding, to your gay and lesbian shelves, consider
take a more active role in their own treatment or Australian Gay and Lesbian Writing: An
health choices. It’s easy-to-grasp information. Anthology edited by Robert Dessaix. It reflects the
$19.95 cl, 0-19-508773-9, April. diversity, nonconformity and ambiguity of
RE HFU etS eI rN oG se x T uO al B WE o mA e nW ’sIFE! Edited by Sue Wilkinson,
University of Hull, UK,
Strategies for Liberation and Celia Kitzinger,
Jo Van Every, Loughborough University, UK
Keele University, UK
1995 • 208 pages
1995 • 224 pages CL 0-7484-0148-2 • $75.00
CL 0-7484-0283-7 • $75.00 PB 0-7484-0149-0 $24.95
PB 0-7484-0284-5 • $24.95
THE ILLUSIONS OF Also Available This Spring...
‘POST-FEMINISM’ CHANGING THE SUBJECT
New Women, Old Myths Women in Higher Education
Vicki Coppock, Deena Haydon, Edited by Jocey Quinn,
and Ingrid Richter, Sue Davies, and Cathy Lubelska,
all of Edge Hill College, . all of the University of
Ormskirk, Lancashire, UK Taylor & Francis Central Lancastershire, UK
1995 • 224 pages msa 1995 • 240 pages
CL 0-7484-0237-3 • $75.00 CL 0-7484-0281-0 • $85.00
PB 0-7484-0238-1 • $24.95 PB 0-7484-0282-9 • $24.95
March/April 1995
This content downloaded from
(cid:0)(cid:0)(cid:0)(cid:0)(cid:0)(cid:0)(cid:0)(cid:0)(cid:0)(cid:0)(cid:0)(cid:0)74.108.41.47 on Thu, 28 Mar 2024 01:30:49 +00:00(cid:0)(cid:0)(cid:0)(cid:0)(cid:0)(cid:0)(cid:0)(cid:0)(cid:0)(cid:0)(cid:0)(cid:0)
All use subject to https://about.jstor.org/terms","['0-19-509556-1', '0-19-508774-7', '0-19-508079-3', '0-19-508773-9', '0-7484-0148-2', '0-7484-0283-7', '0-7484-0149-0', '0-7484-0284-5', '0-7484-0237-3', '0-7484-0281-0', '0-7484-0238-1', '0-7484-0282-9']"
108,"sn RIAC h
Australian society and features more than forty sonal life and private pain of a remarkable African
writers in the genres of fiction, poetry and drama. American woman. $16.95 pb, 1-56639-308-6, May.
$16.95 pb, 0-19-553686-X.
Now in paperback: Women in the Classical TEXAS A&M UNIVERSITY
World edited by Elaine Fatham, Helene Peet Foley, As there has been a growing concern for ecolog-
et al. — reviewed in FBN 17#4, Nov/Dec 1994. ical issues, so has there been renewed interest in
$19.95 pb short discount, 0-19-509862-5. nature writings by women. American Women
Afield: Writings by Pioneering Women
Naturalists edited by Marcia Myers Bonta includes
A l the most appealing writings by 25 women natural-
TEMPLE UNIVERSITY PRESS ists from the late nineteenth and early twentieth
centuries, such as Susan Fenimore Cooper, Rachel
We are now at a stage in the second wave of Carson, and Mary Treat. Their writings are supple-
feminism were we can begin to study ourselves in mented with biographical profiles. $15.95 pb, 0-
history — and there are a growing number of titles 89096-634-6.
that do just that! One such title is Feminist There has been little written about the French
Generations: The Persistence of the Radical Resistance to German Occupation during WWII —
Feminist Movement by Nancy Whittier. This book especially from a woman’s perspective, which is
is unique, though, in that it explores both conflict what makes Code Name Christiane Clouet: A
and cooperation between generations of radical Woman in the French Resistance by Claire
feminists. Drawing on interviews and documents Chevrillon so interesting. This memoir examines
from women and organizations in Midwest mid- ħer wartime experience as head of deGaulle’s Code
sized cities in Ohio, Whittier illustrates how radical Service in Paris, the arrest and deportation of her
feminism is still very much alive, and contrasts it to Jewish relatives, her role in the underground resis-
feminist activities in larger cities. $18.95 pb, 1- tance network, and her own imprisonment. $14.95
56639-282-9. pb, 0-89096-629-X, May.
Degrees of Equality: The American Private Voices, Public Lives: Women Speak on
Association of University Women and the the Literary Life edited by Nancy Own Nelson
Challenge of Twentieth-Century Feminism by includes many essays addressing the desire by
Susan Levine places the AAUW within the context many women within the academic community to
of women’s organizations, feminism, and struggles break free of what has been called the “masculine”
for equality. This history of the AAUW explores or “adversary” mode of literary criticism.
how its goals for equality for women in higher edu- Contributors include Adrienne Rich, Amy Tan,
cation sometimes created problems and internal Virginia Woolf, Willa Cather, and many others.
struggle especially when confronted by feminism $16.95 pb, 0-929398-88-2, May.
and racial integration. $29.95 cl], 1-56639-326-4, May.
All Is Never Said: The Narrative of Odette UNIVERSITY OF CHICAGO
Harper Hines by Judith Rollins is the spirited oral For those interested in women’s role in Irish his-
history of Odette Harper Hines — NAACP publicity tory, don't pass up The Autobiography of Maud
director, Red Cross Volunteer, Civil Rights activist Gonne: A Servant of the Queen edited by A.
and mother — and passionately explores the per- Norman Jeffares and Anna MacBride White.
105
This content downloaded from
(cid:0)(cid:0)(cid:0)(cid:0)(cid:0)(cid:0)(cid:0)(cid:0)(cid:0)(cid:0)(cid:0)(cid:0)74.108.41.47 on Thu, 28 Mar 2024 01:30:49 +00:00(cid:0)(cid:0)(cid:0)(cid:0)(cid:0)(cid:0)(cid:0)(cid:0)(cid:0)(cid:0)(cid:0)(cid:0)
All use subject to https://about.jstor.org/terms","['1-56639-308-6', '0-19-553686-X', '0-19-509862-5', '0-89096-629-X', '0-929398-88-2', '1-56639-326-4']"
109,"E,
imma
Founder of the Daughters of Ireland in 1900, Gonne
was also a fierce patriot, a noteworthy actress, a
writer, an orator, and one who did much to open
women’s participation in Irish politics. $14.95 pb, 0-
226-30252-0.
Equivocal Beings: Politics, Gender, and
Sentimentality in the 1700s — Wollstonecraft, UNIVERSITY OF GEORGIA PRESS
Radcliffe, Burney, Austen by Claudia Johnson Important re-issues of long out-of-print titles:
demonstrates the interrelationships among politics, The Girl Sleuth by Bobbie Ann Mason remi-
gender, and feeling in fiction of the period in the nisces about childhood and popular culture
wake of the French Revolution. The promotional through girl detectives such as Nancy Drew, Judy
quote calls it a splendid book that enlivens the dis- Bolton, Cherry Ames and others ($10.95 pb, 0-8203-
cussion on what has become a tedious debate. I 1739-X, May); Prisons That Could Not Hold by
only wish the catalogue copy convinced me! $14.95 Barbara Deming is edited by Sky Vanderlinde and
text discount pb, 0-226-40184-7. includes an introduction by Grace Paley with a bio-
4. graphical essay by Judith McDaniel. These are
|
BA important protest writings by a key lesbian activist
for civil rights, feminist causes, and peace ($14.95
I realize now that when looking in catalogues, pb, 0-8203-1737-3, June).
it’s no longer enough to check the women’s studies Due to the popularity of Little Women as a result
section — also look for a gender studies section! of the movie, there also seems to be a rising interest
Initially, I passed this title because it had no imme- in the life and work of Louisa May Alcott. One
diately recognizable flag. A closer look reveals that important autobiographical contribution will be the
it’s probably one you'll want to have. Rethinking understanding of Alcott’s life through her own
the Political edited by Johanna Brenner, Yesim words in correspondence written to family, friends
Arat, and Barbara Laslett is a collection of eighteen and her publishers. All this is contained in a collec-
articles which shows how conceptions of the politi- tion of letters spanning 45 years, The Selected
cal are expanded and revised when viewed through Letters of Louisa May Alcott edited by Joel
the lens of gender. Citizenship, political resistance, Myerson and Daniel Shealy with an introduction by
collectivity and cultural relativism are looked at in M1ade7lein4e S0ter-, 3Ass,oc iat e JEdituor. n $19e.95. pb, 0-8203-
relation to feminism, the lesbian community, inter-
national women’s collective action, sexual violence,
patriarchy and capitalism, and more. $14.95 pb, 0- UNIVERSITY OF ILLINOIS PRESS
226-07399-8, June. Babe: The Life and Legend of Babe Didrikson
This may be more pricey and scholarly than Zaharias by Susan Cayleff contributes to the grow-
most general stores will want, but could be impor- ing amount of literature on women and sports. A
tant for those with a big interest in women and eco- gifted athlete, Babe won two Olympic gold medals
nomic development. Investment in Women’s in track and field, competed in baseball, bowling,
Capital, edited by T. Paul Schwartz and including basketball and tennis, and co-founded the Ladies
both women and men as contributors, analyzes Professional Golf Association (LPGA). This will
how human capital distribution affects (or doesn’t) also be of interest to those in lesbian studies for her
106
This content downloaded from
(cid:0)(cid:0)(cid:0)(cid:0)(cid:0)(cid:0)(cid:0)(cid:0)(cid:0)(cid:0)(cid:0)(cid:0)74.108.41.47 on Thu, 28 Mar 2024 01:30:49 +00:00(cid:0)(cid:0)(cid:0)(cid:0)(cid:0)(cid:0)(cid:0)(cid:0)(cid:0)(cid:0)(cid:0)(cid:0)
All use subject to https://about.jstor.org/terms","['0-226-40184-7', '0-8203-1737-3']"
