ISBN,Title,Author,Publisher,Pages,Date Published,Subjects,Binding,Synopsis,Language,Edition,Dimensions,MSRP,Image,Status,PageNumber,Volume & Issue
0-679-75164-5,Same-Sex Unions in Premodern Europe,"Boswell, John",Vintage,464.0,1995-05-30,,Paperback,"<p>Both highly praised and intensely controversial, this brilliant book produces dramatic evidence that at one time the Catholic and Eastern Orthodox churches not only sanctioned unions between partners of the same sex, but sanctified them—in ceremonies strikingly similar to heterosexual marriage ceremonies.</p>


                        <p>Both highly praised and intensely controversial, this brilliant book produces dramatic evidence that at one time the Catholic and Eastern Orthodox churches not only sanctioned unions between partners of the same sex, but sanctified them--in ceremonies strikingly similar to heterosexual marriage ceremonies.
</p>",en,1,"Height: 8 Inches, Length: 5.25 Inches, Weight: 0.82452885988 Pounds, Width: 1 Inches",18.95,https://images.isbndb.com/covers/16/49/9780679751649.jpg,Success,73.0,17.6
1-56280-102-3,Open House: A Helen Black Mystery,"Welch, Pat",Naiad Pr,224.0,1995,,Paperback,"A Helen Black mystery, HelenÆs Great Aunt has passed on and has left Helen her house; so Helen travels back to Mississippi from her town of Berkeley, leaving behind friend Freida, only to find murder, secerets and mysteries that she must solve.",en,First Edition,"Height: 8.5 Inches, Length: 5.5 Inches, Weight: 0.55 Pounds, Width: 0.25 Inches",10.95,https://images.isbndb.com/covers/10/21/9781562801021.jpg,Success,136.0,17.6
1-895159-34-2,,,,,,,,,,,,,,Error,102.0,17.6
0-15-600202-7,Last Watch of the Night: Essays Too Personal and Otherwise,"Monette, Paul",Harper Perennial,320.0,1995-04-15,,Paperback,"<p>With Borrowed Time and Becoming a Man-the 1992 National Book Award winner for nonfiction-this collection completes Paul Monette’s autobiographical writing. Brimming with outrage yet tender, this is a “remarkable book” (Philadelphia Inquirer).</p>


                        <p>This collection of essays constitutes the third volume of National Book Award winner Paul Monette's autobiographical writings. Among the pieces featured are Monette's portrait of his dog as they endure loss together, an atheist's appreciation of the saintliness of a priest, and a rumination on what it's like to be gay and lesbian today.
</p>",en,First Edition,"Height: 9 Inches, Length: 6 Inches, Weight: 1.01 Pounds, Width: 0.81 Inches",23.95,https://images.isbndb.com/covers/20/28/9780156002028.jpg,Success,73.0,17.6
0-934971-45-5,The Country of Women,"Kohler, Sandra",Calyx Books,112.0,1995-01-01,,Paperback,By Sandra Kohler.,en,,"Height: 9 Inches, Length: 5.1 Inches, Weight: 0.35053499658 Pounds, Width: 0.3 Inches",11.95,https://images.isbndb.com/covers/14/54/9780934971454.jpg,Success,9.0,17.6
0-934971-45-5,The Country of Women,"Kohler, Sandra",Calyx Books,112.0,1995-01-01,,Paperback,By Sandra Kohler.,en,,"Height: 9 Inches, Length: 5.1 Inches, Weight: 0.35053499658 Pounds, Width: 0.3 Inches",11.95,https://images.isbndb.com/covers/14/54/9780934971454.jpg,Success,76.0,17.6
1-878448-63-3,Change of Circumstance,"Lawrence, Candida",Macadam Cage Pub,222.0,1995,,Paperback,Candida Lawrence.,en,,"Height: 8.5 Inches, Length: 5.5 Inches, Weight: 0.7 Pounds, Width: 0.75 Inches",16.95,https://images.isbndb.com/covers/86/37/9781878448637.jpg,Success,20.0,17.6
1-85242-357-9,Skyhook in the Midnight Sun (Masks),"Cooper, Fiona",Serpent's Tail,432.0,2000-04-01,,Paperback,,en,Main,"Height: 7.75 Inches, Length: 5 Inches, Width: 1.25 Inches",14.99,https://images.isbndb.com/covers/35/75/9781852423575.jpg,Success,95.0,17.6
0-934678-63-4,If Looks Could Kill,Frances Lucas,New Victoria Publishers,248.0,1995-03-01,"Detective Fiction, Gay & Lesbian Fiction, Multicultural Detectives - Fiction, Arts & Entertainment - Fiction",Paperback,"Lawyer, screenwriter Diana Mendoza is on the set for her new detective show Milipitas Knows. At a party she meets blond actress Lauren Lynch. When Lauren is accused of murder, Diana rushes to her defense.",en,First Edition,"Height: 8.5 Inches, Length: 5.5 Inches, Weight: 0.59965735264 Pounds, Width: 0.5 Inches",1.99,https://images.isbndb.com/covers/86/36/9780934678636.jpg,Success,79.0,17.6
0-934678-63-4,If Looks Could Kill,Frances Lucas,New Victoria Publishers,248.0,1995-03-01,"Detective Fiction, Gay & Lesbian Fiction, Multicultural Detectives - Fiction, Arts & Entertainment - Fiction",Paperback,"Lawyer, screenwriter Diana Mendoza is on the set for her new detective show Milipitas Knows. At a party she meets blond actress Lauren Lynch. When Lauren is accused of murder, Diana rushes to her defense.",en,First Edition,"Height: 8.5 Inches, Length: 5.5 Inches, Weight: 0.59965735264 Pounds, Width: 0.5 Inches",1.99,https://images.isbndb.com/covers/86/36/9780934678636.jpg,Success,84.0,17.6
1-55583-603-8,The President's Son,"Kraus, Krandall",Alyson Books,320.0,1995-03-01,"Fiction, Mystery & Crime, Fiction Subjects",Paperback,"When popular U.S. President Dan Marshall seeks re-election, his advisors agree that his son's homosexuality must be kept secret at any cost. D.J. Marshall finds himself cut off from his father by ambitious advisers who are determined that no scandal should threaten their power.",en,1,"Height: 7 Inches, Length: 4.5 Inches, Weight: 0.5291094288 Pounds, Width: 1 Inches",1.99,https://images.isbndb.com/covers/60/30/9781555836030.jpg,Success,73.0,17.6
0-89594-744-7,The Wiccan Path: A Guide for the Solitary Practitioner,"Beth, Rae",Crossing Pr,190.0,1995,"Beth, Rae, Witchcraft, Ritual, Goddess religion, Magic, Witches--Correspondence, BF1566 .R44 1995, 133.4/3",Paperback,Rae Beth.,en,1,"Height: 8.75 Inches, Length: 5.75 Inches, Weight: 0.5 Pounds, Width: 0.5 Inches",1.99,https://images.isbndb.com/covers/74/44/9780895947444.jpg,Success,33.0,17.6
1-55583-606-2,Chrome,"Nadar, George",Alyson Books,253.0,1995,,Paperback,"Enter the world of Chrome, where nothing is as it seems. In the 22nd century, a forbidden love between a man and a machine spins the Earth toward one final war.",en,,"Height: 8.75 Inches, Length: 5.5 Inches, Weight: 0.6834330122 Pounds, Width: 0.75 Inches",9.95,https://images.isbndb.com/covers/60/61/9781555836061.jpg,Success,73.0,17.6
0-452-27375-7,Bodies of Water,"Cliff, Michelle",Plume,160.0,1995-01-01,,Paperback,,en,First Edition,"Height: 8 Inches, Length: 5.5 Inches, Weight: 0.3 Pounds, Width: 0.5 Inches",1.99,https://images.isbndb.com/covers/37/57/9780452273757.jpg,Success,127.0,17.6
0-671-87539-6,Perpetual Motion: The Public and Private Lives of Rudolf Nureyev,"Stuart, Otis",Simon & Schuster,320.0,1995-02-21,,Hardcover,,en,First Edition,"Height: 9.75 Inches, Length: 6.5 Inches, Weight: 1.45 Pounds, Width: 1.5 Inches",24.0,https://images.isbndb.com/covers/53/98/9780671875398.jpg,Success,130.0,17.6
1-85727-032-0,Lesbians Talk Violent Relationships,"Taylor, Joelle, Chandler, Tracey",Scarlet Pr,64.0,1995,"Abused lesbians, Abused lesbians--Great Britain, Lesbian couples, Lesbian couples--Great Britain, Victims of family violence, Victims of family violence--Great Britain, Lesbianism, Great Britain, HQ75.6.G7 T39 1995, 306.76630941",Paperback,"That Lesbian Relationships Can Be Violent And Abusive, Rather Than The Woman-to-woman Utopias Of Feminist Myth-making, Is A Well-kept Secret. But How Prevalent Is Violence And Coercion In Lesbian Experience? How Do The Different Kinds Of Abuse - Physical, Psychological And Sexual - Manifest Themselves And What Are The Consequences? Are Alcohol And Drug Misuse, Internalised Homophobia And Childhood Abuse Causes Or Symptoms? How Can We Challenge The Myth That Violence Appears Only In S/m Or Butch-femme Relationships? And What Should You Do If You Find Yourself In A Relationship Which Is Becoming Violent Or Coercive?--book Jacket. Lesbians Talk Violent Relationships Is The First Book On Abusive Lesbian Relationships To Be Published In The Uk. Basing Their Research On An Extensive Survey Of Survivors' Own Experiences, The Authors Draw Up A Picture Of How Abuse Happens And How We Might Deal With It. Essential Reading For Professionals Working With Violence And Abuse, Lesbians Who Have For Too Long Ignored The Problem - And, Of Course, For Anyone Who Has Survived Or Is Undergoing An Abusive Relationship.--book Jacket. Joelle Taylor And Tracey Chandler. Includes Bibliographical References (p. 64)",en,,"Height: 8.25 Inches, Length: 6 Inches, Weight: 0.2314853751 Pounds, Width: 0.25 Inches",8.5,https://images.isbndb.com/covers/03/27/9781857270327.jpg,Success,86.0,17.6
0-933216-91-2,No Matter What: A Novel (Coming of Age Series),"Saracino, Mary",Spinsters Ink,306.0,1993,,Paperback,,en,First Edition,"Height: 8.5 Inches, Length: 5.5 Inches, Weight: 0.85098433132 Pounds, Width: 0.75 Inches",9.95,https://images.isbndb.com/covers/69/14/9780933216914.jpg,Success,137.0,17.6
0-8077-3405-5,"Sex, Death, and the Education of Children: Our Passion for Ignorance in the Age of AIDS","Silin, Jonathan G.",Teachers College Press,264.0,1995-06-15,"Schools, Health Education, Gender Identity, Child Development, Child, Acquired Immunodeficiency Syndrome--psychology, HIV Infections--psychology, AIDS (Disease)--Study and teaching (Early childhood), AIDS (Disease)--Study and teaching (Early childhood)--United States, AIDS (Disease)--Social aspects, AIDS (Disease)--Social aspects--United States, Children and adults, Children and adults--United States, Gender identity, Gender identity--United States, Feminist theory, Feminist theory--United States, Educational sociology, Educational sociology--United States, LB3418.A35 S55 1995, WC 503.7 S583 1995, 372.3/7",Paperback,Compelling Argument For Changing Thinking About Teaching & Learning In The Age Of Aids. Foreword / Madeleine R. Grumet -- 1. Hiv/aids: The Politics Of An Epidemic -- 2. Responding To Children In Time -- 3. Hiv/aids Education: Toward A Collaborative Curriculum -- 4. Developmentalism And The Aims Of Education -- 5. Contours Of Ignorance -- 6. Curricular Languages: Queerying Feminist Perspectives -- 7. How Do We Know? And Other Questions Of The Closet -- 8. The Politics Of Identity And The Differences Inside Me. Jonathan G. Silin ; Foreword By Madeleine R. Grumet. Includes Bibliographical References.,en,1,"Height: 9 Inches, Length: 6.25 Inches, Weight: 0.8 Pounds, Width: 0.75 Inches",1.99,https://images.isbndb.com/covers/40/56/9780807734056.jpg,Success,98.0,17.6
0-88974-043-7,Where the Rivers Join: A Personal Account of Healing from Ritual Abuse,Beckylane,Press Gang Pub,248.0,1995,,Paperback,"Where the Rivers Join powerfully evokes how pain and torture had destroyed Beckylane's ability to speak and how committing her memories to paper helped her to unravel the violence of her past. This courageous, non-sensational record of a woman's healing from ritual abuse does not pander to skeptics and does not apologize. It is written from the inside out, painfully reflecting the world as many survivors of trauma experience it and tracing how language and life can be reclaimed.",en,First Edition,"Height: 8 Inches, Length: 6 Inches, Width: 0.75 Inches",14.95,https://images.isbndb.com/covers/04/33/9780889740433.jpg,Success,85.0,17.6
0-89862-016-3,Reconceiving Women: Separating Motherhood from Female Identity,"Ireland, Mardy S.",The Guilford Press,195.0,1993-06-01,,Paperback,"According to recent surveys, approximately 40% of American women between the ages of 18 and 44 do not have children. Yet these women are virtually missing from accounts of women's lives. In this important new work, Mardy Ireland defines a place for women outside the parameters of motherhood and gives voice to the significant number of women who are not mothers. She draws extensively from interviews with over 100 childless women from various ethnic and educational backgrounds, demonstrating the myriad ways they came to view themselves as complete adults without recourse to the traditional defining criteria of motherhood. Her work offers all women--mothers and nonmothers alike--a vision of self-defined adulthood and a recognition that every woman is the subject of her own life.",en,1,"Height: 9 Inches, Length: 6 Inches, Weight: 1.6314207388 Pounds, Width: 0.52 Inches",19.95,https://images.isbndb.com/covers/01/60/9780898620160.jpg,Success,55.0,17.6
0-06-251186-6,The Goddess in the Bedroom: A Passionate Woman's Guide to Celebrating Sexuality Every Night of the Week,"Budapest, Zsuzsanna Emese",Harper San Francisco,176.0,1995,,Paperback,"Sensual secrets and empowering spells help women focus their energy, increase their passion, and get just what (or who) they want every night of the week.",en,First Edition,"Height: 6.5 Inches, Length: 5.75 Inches, Weight: 0.2866009406 Pounds, Width: 0.75 Inches",13.0,https://images.isbndb.com/covers/18/67/9780062511867.jpg,Success,125.0,17.6
0-921881-31-2,Ghost Motel,"Manthorne, Jackie",Gynergy Books/Ragweed Pr,176.0,1994,,Paperback,Jackie Manthorne. Harriet Hubbley Mystery.,en,First Edition,"Height: 8.5 Inches, Length: 5.75 Inches, Weight: 0.52 Pounds, Width: 0.75 Inches",9.95,https://images.isbndb.com/covers/13/15/9780921881315.jpg,Success,3.0,17.6
0-252-06463-1,The Woman Detective: GENDER AND GENRE,"Klein, Kathleen",University of Illinois Press,296.0,1995-02-01,,Paperback,"Kathleen Gregory Klein Traces Female Paid, Professional Private Investigators In British, Canadian, And American Novels, Revealing That The Detective Novel Is Both A Reflection Of And Potential Barrier To Social Change For Women. This Edition Adds Sixty New Female Private Eyes To The Roster And Includes An Afterword That Assesses The Current State Of The Genre's New And Old Novels. A Comprehensive Bibliography And A Character List Update The Field Through Mid-1994. British Policewo/men: 1864 -- Women Detectives In The American Dime Novel: 1880-1904 -- Britain's Turn-of-the-century Lady Detective: 1891-1910 -- The Lady Detective's Yankee Cousins: 1906-15 -- How Golden Was The Golden Age? British And American Sleuths Between The Wars -- The Hard-boiled Private Eye And Her Classical Competition: 1928-84 -- Modern Detectives: 1972-84 -- The Moderns Continue: Variations On A Theme -- Female-male Partnerships: 1924-78 -- An Unsuitable Job For A Feminist? -- Appendix: Women Private Eyes 1987-94. Kathleen Gregory Klein. Includes Bibliographical References (p. [246]-272) And Indexes.",en,2nd ed.,"Height: 9 Inches, Length: 6 Inches, Weight: 1 Pounds, Width: 1 Inches",33.0,https://images.isbndb.com/covers/46/30/9780252064630.jpg,Success,111.0,17.6
1-844244-03-3,,,,,,,,,,,,,,Error,90.0,17.6
1-880913-13-5,Nobody Owns Me: A Celibate Woman Discovers Her Sexual Power,"Rothluebber, Francis B.",Innisfree Pr,125.0,1994,,Paperback,,en,Advance Reading Copy,"Height: 9.25 Inches, Length: 6.25 Inches, Weight: 0.5 Pounds, Width: 0.5 Inches",1.99,https://images.isbndb.com/covers/31/30/9781880913130.jpg,Success,91.0,17.6
0-19-509862-5,Women in the Classical World: Image and Text,"Fantham, Elaine, Foley, Helene Peet, Kampen, Natalie Boymel, Pomeroy, Sarah B., Shapiro, H. A.",Oxford University Press,430.0,1995-03-30,"Women--History--Sources, Women--History--To 500--Sources, Women--Greece--History--Sources, Women--Rome--History--Sources, Women--history, HQ1127 .W652 1994, 305.4/09",Paperback,"Information About Women Is Scattered Throughout The Fragmented Mosaic Of Ancient History. The Vivid Poetry Of Sappho Survived Antiquity On Remnants Of Damaged Papyrus, Riddled With Gaps. The Inscription On A Beautiful Fourth Century B.c.e. Grave Praises The Virtues Of Mnesarete, An Athenian Woman Who Died Young, But We Do Not Know If The Grave's Marble Stele Shows Mnesarete, Or Simply A Ready-made Design Chosen By Her Family. We Read That On One Occasion In The Fourth Century A Great Number Of Roman Wives Were Given A Collective Public Trial And Found Guilty Of Poisoning Their Husbands, But We Can Only Guess Whether These Poisonings Were Invented, Or Were Linked To A High Occurrence Of Accidental Food Poisoning, Or To Something More Sinister.^ Apart From The Legends Of Cleopatra, Dido, And Lucretia, And Images Of Graceful Maidens Dancing On Urns, The Evidence About The Lives Of Women Of The Classical World - Visual, Archaeological, And Written - Has Remained Little Known And Little Understood. Now, The Lavishly Illustrated And Meticulously Researched Women In The Classical World Lifts The Curtain On The Women Of Ancient Greece And Rome, From Slaves And Prostitutes, To Athenian Housewives, To Rome's Imperial Family. The First Book On Classical Women To Give Equal Weight To Written Texts And Artistic Representations, It Brings Together A Great Wealth Of Materials - Poetry, Vase Painting, Legislation, Medical Treatises, Architecture, Religion And Funerary Art, Women's Ornaments, Historical Epics, Political Speeches, Even Ancient Coins - To Present Women In The Historical And Cultural Context Of Their Time.^ Written By Leading Experts In The Fields Of Ancient History And Art History, Women's Studies, And Greek And Roman Literature, The Book's Chronological Arrangement Allows The Changing Roles Of Women To Unfold Over A Thousand Year Period, Beginning In The Eighth Century B.c.e. The Authors Seek Out And Present Ancient Literature That Preserves Women's Own Voices. Both The Art And The Literature Highlight Women's Creativity, Sexuality And Coming Of Age, Marriage And Child Rearing, Religious And Public Roles, And Other Themes. Fascinating Chapters Probe Revealing Aspects Of The Classical World: The Ubiquitous Reports Of Wild Behavior On The Part Of Spartan And Etruscan Women And The Mythical Amazons; The Changing Views Of The Female Body Presented In Male-authored Gynecological Treatises; The Political And Financial Activities Of Women From All Over Rome's Empire; And The Traces Of Upper And Lower-class Life In Pompeii, Miraculously Preserved By The Eruption Of Mount Vesuvius In 79 C.e.^ Provocative, Surprising, Filled With Examples Of The Rich Legacy Of Classical Art, Women In The Classical World Is A Masterly Foray Into The Past, And An Important Statement On The Lives Of Women In Ancient Greece And Rome. Women In Archaic Greece : Talk In Praise And Blame -- Spartan Women : Women In A Warrior Society -- Women In Classical Athens : Heroines And Housewives -- Amazons : Women In Control -- The Hellenistic Period : Women In A Cosmopolitan World -- Medicine : The Proof Of Anatomy / Lesley Dean-jones -- Republican Rome I : From Marriage By Capture To Partnership In War, The Proud Women Of Early Rome -- Etruscan Women / Larissa Bonfante -- Republican Rome Ii : Women In A Wealthy Society, Aristocratic And Working Women From The Second Century B.c.e. -- The New Women : Representation And Reality -- Women, Family, And Sexuality In The Age Of Augustus And The Julio-claudians -- The Women Of Pompeii -- Women Of The High And Later Empire : Conformity And Diversity. Elaine Fantham ... [et Al.]. Includes Bibliographical References And Index.",en,CA res. please inc. 7.25% tax,"Height: 7 Inches, Length: 10 Inches, Weight: 1.8298367746 Pounds, Width: 0.8 Inches",95.95,https://images.isbndb.com/covers/86/24/9780195098624.jpg,Success,108.0,17.6
0-385-42364-0,The Web of Inclusion,"Helgesen, Sally",Doubleday Business,320.0,1995-04-01,,Hardcover,,en,Stated First Edition,"Height: 9.5 Inches, Length: 6.5 Inches, Weight: 1.25002102554 Pounds, Width: 1.25 Inches",27.5,https://images.isbndb.com/covers/36/49/9780385423649.jpg,Success,116.0,17.6
0-812-53005-5,A College of Magics,"Stevermer, Caroline",Tor Books,,1995,,Paperback,,en,Reprint,"Height: 7 Inches, Length: 4 Inches, Weight: 0.39903669422 Pounds, Width: 1.25 Inches",4.99,https://images.isbndb.com/covers/00/56/9780812530056.jpg,Success,66.0,17.6
0-929398-88-2,"Private Voices, Public Lives: Women Speak on the Literary Life",,University of North Texas Press,319.0,1995-06-01,,Paperback,"I. The Work/love Paradigm. Tangled Together Like A Badly Cast Fishing Line: The Reader And The Text In Katherine Anne Porter's Pale Horse, Pale Rider / Ann L. Putnam -- Love, Work, And Willa Cather / Ann Fisher-wirth -- The Voices From The Little House / Ann Romines -- Rewriting The Love Plot Our Way: Women And Work / Susan J. Rosowski. Ii. The Text As Mirror. Nancy Drew, The Perfect Solution / Carol S. Chadwick -- Wrestling With The Mother And The Father: His And Her In Adrienne Rich / Betty S. Flowers -- In Search Of The Androgynous Self / Nancy Owen Nelson -- From Robot To Roarer / Jo C. Searles -- A White Bird Flying Straight Down / Catherine E. Lamb -- Being An I-witness: My Life As A Lesbian Teacher / Barbara Dibernard -- Mother/daughter Dialog(ic)s In, Around And About Amy Tan's The Joy Luck Club / Bonnie Braendlin -- Offshore Women: A Personal Log / Nancy Pagh -- Metamorphosis: Mutations Of A Hungarian Continental Drifter Into An American Woman / Olga Klekner -- Trapped, The Release, By A Gift From The Sea / Lois Hassan -- Speaking Across Boundries And Sharing The Loss Of A Child / Melody Graulich -- Trailing West / Susan Naramore Maher -- Dakota: A Spiritual Geography, Revisited / Michele Potter -- Iii. Teaching And Writing The Self. Growing Up With Doctor Spock: An Auto-biography / Lynn Z. Bloom -- From Impersonators To Persons: Breaking Patterns, Finding Voices / Charlotte S. Mcclure -- Search And Rescue / Beverly Conner -- Diversity And The American Dream / Grace Stewart -- Women's Literature As Individuation For College Students / Julie Houston -- Finding My Voice: Caught Between A Woolf And A Crane / Sandra Parker -- Literary Criticism With A Human Face: Virginia Woolfe And The Common Reader / Elsie F. Mayer. Edited By Nancy Owen Nelson ; Foreword By Jane Tompkins. Includes Bibliographical References And Index.",en,,"Height: 9 Inches, Length: 6.04 Inches, Weight: 1.28 Pounds, Width: 0.93 Inches",18.95,https://images.isbndb.com/covers/88/84/9780929398884.jpg,Success,108.0,17.6
0-7484-0283-7,"Heterosexual Women Changing The Family: Refusing To Be A ""Wife""! (Feminist Perspectives on the Past and Present)","Every, Jo Van",Taylor & Francis,165.0,1995-05-01,,Hardcover,"<p>refusing To Be A 'wife'! Explores How Women Can Transform Their Relationships In Order To Minimize The Inequality Found In Traditional Families. Drawing On Interviews With Women And Men In Explicitly Anti-sexist Living Arrangements, The Book Provides A New Perspective On The Division Of Domestic Labour, Mothering, Marriage And Financial Allocation In The Home. The Author Examines The Relationship Between Home And Work, And The Construction Of Gender Equality, And Discusses The Key Roles Of Women In The Sphere Of The Home: Wife, Mother, Worker, Showing How The Role/identity Of 'wife' Dominates And Affects The Other Two Roles. The Author Offers A Feminist Sociological Answer To The Question 'what Is An Anti-sexist Living Arrangement?', And Provides Insights Into How Women Can Balance Commitments To Work And Home Whilst Retaining Some Form Of Individual Identity. The Discussions Highlight The Importance Of Men's Commitment To Anti-sexist Living. Written In A Clear And Engaging Style, This Book Will Be Of Interest And Relevance Not Only To Feminists But To Anyone Interested In The 'potential' Impact Of Feminism On Family Life.</p>",en,1,"Height: 9.21 Inches, Length: 6.14 Inches, Weight: 0.99869404686 Pounds, Width: 0.44 Inches",210.0,https://images.isbndb.com/covers/28/30/9780748402830.jpg,Success,107.0,17.6
0-253-20951-X,A Passion for Difference: Essays in Anthropology and Gender,"Moore, Henrietta L",Indiana University Press,186.0,1995-01-01,Literary Collections,Paperback,"<p><P>This courageous book brings recent feminist theory into dialogue with current issues in social and cultural anthropology. &#151; Emily Martin<P>Henrietta Moore, author of Feminism and Anthropology, examines the limitations of how anthropologists and others write about sex, gender, and sexuality, and she considers anthropologists' few contributions to feminist debates on the body and the non-universal human subject.</p>",en,,"Height: 8.99 Inches, Length: 6 Inches, Weight: 0.7 Pounds, Width: 0.6 Inches",14.95,https://images.isbndb.com/covers/95/11/9780253209511.jpg,Success,105.0,17.6
0-812-51094-1,The Tavera Legacy,"Lynn, Mary Elizabeth",Tor Books,480.0,1995-02-15,,Mass Market Paperback,,en,Reprint,"Height: 7 Inches, Length: 4.25 Inches, Width: 1.25 Inches",5.99,https://images.isbndb.com/covers/09/42/9780812510942.jpg,Success,66.0,17.6
0-06-251041-X,Gay Soul,"Thompson, Mark",HarperOne,272.0,1995-05-12,,Paperback,"Gay spirituality and sensibility come to light in these pages of striking portraits and trenchant interviews. Thompson brings out the unique contributions of the esteemed gay men  including Will Roscoe, Joseph Kramer, Harry Hay, James Broughton, Andrew Harvey, Paul Monette, Malcolm Boyd, and Ram Dass  who lead the spiritual life.Thompson elicits vivid musings on such provocative issues as the third gender, S&amp;M, ritual as 'holy fire,, and spirituality in the age of Aids. His interviews call out the deepest emotions of each of these vibrant leaders who reveal, as never before, the spirit and the soul of the gay life.",en,Second Printing,"Height: 8 Inches, Length: 6 Inches, Weight: 0.57981574906 Pounds, Width: 0.75 Inches",1.99,https://images.isbndb.com/covers/04/19/9780062510419.jpg,Success,73.0,17.6
0-8065-1591-0,"The Gay 100: A Ranking of the Most Influential Gay Men and Lesbians, Past and Present","Russell, Paul",Birch Lane Pr,386.0,1995,,Hardcover,,en,,"Height: 10.5 Inches, Length: 7.25 Inches, Weight: 2.45 Pounds, Width: 1.25 Inches",24.95,https://images.isbndb.com/covers/59/15/9780806515915.jpg,Success,97.0,17.6
0-89594-752-8,A Loving Testimony: Remembering Loved Ones Lost to AIDS,,Crossing Pr,406.0,1995,,Paperback,,en,,"Height: 9.25 Inches, Length: 6.25 Inches, Weight: 1.25 Pounds, Width: 1 Inches",1.99,https://images.isbndb.com/covers/75/29/9780895947529.jpg,Success,33.0,17.6
