ISBN,Title,Author,Publisher,Pages,Date Published,Subjects,Binding,Synopsis,Language,Edition,Dimensions,MSRP,Image,Status,PageNumber,Volume & Issue
0-8214-1109-8,Womanist & Feminist Aesthetics: A Comparative Review,"Allan, Tuzyline Jita",Ohio University Press,175.0,1995-07-01,"English Fiction & Prose Literature - General & Miscellaneous - Literary Criticism, Literary Criticism - General & Miscellaneous, Modern Philosophy - 20th Century, 20th Century American Literature - Post WWII - Literary Criticism, Feminist Literary Critici",Hardcover,"Alice Walker's womanist theory about black feminist identity and practice also contains a critique of white liberal feminism. This is the first in-depth study to examine issues of identity and difference within feminism by drawing on Walker's notion of an essential black feminist consciousness. Allan defines womanism as a (r)evolutionary aesthetic that seeks to fully realize the feminist goal of resistance to patriarchal domination, demonstrated most powerfully in The Color Purple. She also recognizes the complexities and ambiguities embedded in the concept, particularly the notion of a fixed and unitary black feminist identity, separate and distinct from its white counterpart. Woolf's Mrs. Dalloway and Drabble's The Middle Ground, she argues, do not allay Walker's concerns about white liberal feminist practice, but they reveal signs of struggle that complicate the womanist/feminist dichotomy. Emecheta's The Joys of Motherhood, an ostensibly womanist text, fails to fit the race-restrictive womanist paradigm, and Walker's own aesthetic trajectory - before The Color Purple - places her outside womanist boundaries. Finally, Allan's intertextual reading reveals significant commonalities and differences. In the current debate among competing feminisms, this critical appraisal of womanist theory underscores the need for new thinking about essentialism, identity, and difference, and also for creative cooperation in the struggle against domination.",en,1,"Height: 8.73 Inches, Length: 5.72 Inches, Weight: 0.87 Pounds, Width: 0.63 Inches",10.73,https://images.isbndb.com/covers/10/94/9780821411094.jpg,Success,106.0,17.6
0-06-097645-4,In the Spirit: The Inspirational Writings,"Taylor, Susan L.",HarperPerennial,144.0,1994-10-20,,Paperback,"<p><p>twenty-two Lifelines To Personal Growth And Fulfillment From The Editor In Chief Of <i>essence</i> Magazine. <p> When Susan L. Taylor Rose To Editor In Chief Of <i>essence</i> Magazine More Than A Decade Ago, She Began Writing An Editorial Column In Which She Shares Her Thoughts And Feelings About How Developing One&#39;s Inner Awareness Ensures The Wisdom And Clarity Needed To Create A Deeply Satisfying And Fulfilling Life. <p> The Monthly Column Called In The Spirit Is One Of The Most Popular In The Magazine. <p> Susan L. Taylor Connects With The Reader In A Personal And Meaningful Way, In A Voice That Is Sisterly, Informed, And Motivating. She Challenges Her Readers To Transcend Their Fears, To Face Inevitable Challenges In Their Lives Courageously, And To Use Change As An Opportunity To Grow. We Limit Ourselves Because Change May Well Mean Dealing With The Disapproval Of The Very People We Rely On For Support. Often Words Of Inspiration And Motivation, But She Also Suggests Specific Methods For Working Through Problems And Improving Our Emotional And Spiritual Health. <p> We Are Not Powerless Spectators Of Life. We Are Co-creators With God, And All Around Is Are The Gifts, The Clay, That We Can Use To Shape Our World, She Says.<p> Susan L. Taylor Writes Passionately About What She Has Seen And Learned In The Course Of Her Travels Throughout The United States, Caribbean, And Africa. Her Essays Have Helped Many To Balance The Demanding World Of Work And Business With The Personal World Of Family And Friendship. She Shares Bits Of Her Own Life&#151;her Loves, Her Trails, And Triumphs&#151;and The Lessons She&#39;s Learned. <p> Many Of Susan L. Taylor&#39;s Readers Already Collect Her Editorials And Find In Them A Source Of Encouragement, Self-affirmation, Empowerment, And Peace Of Mind. Now They Can Have New Essays And A Few Previously Published Favorites Elegantly Bound In A Gift-sized Paperback Edition To Keep For Themselves Or To Give As A Gift Of Love To Those Who Are Special To Them.</p> <h3>publishers Weekly</h3> <p>taylor, The Editor-in-chief Of Essence , Mixes Personal Anecdotes, Black Pride And An Upbeat Spirituality In These Brief Essays, Many Of Them Reprinted From Her Magazine. Though The Wisdom She Dispenses Is Hardly Original, Her Direct Style And Warmth Should Reach Her Target Audience Of African American Women. ``we'll Never Feel Content If Our Happiness Depends On Someone Else's Behavior,'' Taylor Writes, Noting That She Has Learned To Measure Success Not By Wealth But Through ``happiness, Personal Satisfaction And Being Of Service To Others.'' Her Most Powerful Essays Are The Most Self-revealing: In One Clearly Painful Recollection, She Concludes That Her Father's Furious Reaction To Her Surreptitious Meeting With A Young Man Humiliated Her But May Ultimately Have Saved Her. ``what I Felt Was A Shameful Experience That Put A Damper On My Sexuality Actually Prevented Me From Becoming Pregnant As A Teenager.'' Although Taylor Regularly Invokes A Christian God, That God Is Nondenominational And Her Exhortations Are Not To Doctrine But To A More Personal Faith. First Serial To Essence; Author Tour. (nov.)</p>",en,First Edition,"Height: 0.42 Inches, Length: 7.18 Inches, Weight: 0.38 Pounds, Width: 6.12 Inches",11.99,https://images.isbndb.com/covers/64/53/9780060976453.jpg,Success,125.0,17.6
0-941920-29-1,But Is It Art?: The Spirit of Art as Activism,,Bay Press,416.0,1994-11-01,,Paperback,"The Invisible Town Square : Artists' Collaborations And Media Dramas In America's Biggest Border Town / Robert L. Pincus -- This Is To Enrage You : Gran Fury And The Graphics Of Aids Activism / Richard Meyer -- Group Material Timeline : Activism As A Work Of Art / Jan Avgikos -- The American Festival Project : Performing Difference, Discovering Common Ground / Jan Cohen-cruz -- Ecopolitics/ecopoetry : Helen And Newton Harrison's Environmental Talking Cure / Eleanor Heartney -- Maintenance Activity : Creating A Climate For Change / Patricia C. Phillips -- Is It Still Privileged Art? The Politics Of Class And Collaboration In The Art Practice Of Carole Condé And Karl Beveridge / Dot Tuer -- The Body Politics Of Suzanne Lacy / Jeff Kelley -- Making Art, Reclaiming Lives : The Artist And Homeless Collaborative / Andrea Wolper -- Peggy Diggs : Private Acts And Public Art / Patricia C. Phillips -- Guerrilla Girl Power : Why The Art World Needs A Conscience / Elizabeth Hess -- Louder Than Words : A Wac Chronicle / Tracy Ann Essoglou. Edited By Nina Felshin. Includes Bibliographical References (p. 373-404).",en,,"Height: 9.25 Inches, Length: 6.25 Inches, Weight: 1.75 Pounds, Width: 1.25 Inches",24.95,https://images.isbndb.com/covers/02/92/9780941920292.jpg,Success,62.0,17.6
1-57344-008-6,Dyke Strippers: Lesbian Cartoonists from A to Z,,Cleis Pr,207.0,1995,"Homosexuality--Comic books, strips, etc, Lesbians--Comic books, strips, etc, Lesbian cartoonists, Lesbian cartoonists--United States--Biography, Lesbian cartoonists--United States--Interviews, PN6726 .D95 1995, 741.5/9/086643",Paperback,Alison Bechdel -- Katie Brown Interviews Alison Bechdel -- Angela Bocage -- Paige Braddock -- Jane Caminos -- Jennifer Camper -- Roz Warren Interviews Jennifer Camper -- Rona Chadwick -- Kate Debold -- Rhonda Dicksion -- Diane Dimassa -- Elana Bouvier Interviews Diane Dimassa -- Wendy Eastwood -- Leslie Ewing -- Karen Favreau -- Nicole Ferentz -- Fish -- Fish Interviews Hothead And Chicken -- Ellen Forney -- Leanne Franson -- Nikki Gosch -- Roberta Gregory -- Robin Bernstein Interviews Roberta Gregory -- Joan Hilty -- Cath Jackson -- Kris Kovick -- Emily Greenberg Interviews Kris Kovick -- Erica Lopez -- Beck Main -- Andrea Natalie -- Robin Bernstein Interviews Andrea Natalie -- Jo Nesbitt -- Barbary O'brien -- Michelle Rau. Edited By Roz Warren. Includes Bibliographical References (p. 205-206).,en,First Edition,"Height: 11 Inches, Length: 8.75 Inches, Weight: 1.3 Pounds, Width: 0.75 Inches",16.95,https://images.isbndb.com/covers/00/80/9781573440080.jpg,Success,78.0,17.6
0-275-94688-6,Living Witchcraft,"Campbell, Nancy R., Scarboro, Allen, Stave, Shirley A.",Holtzbrinck,232.0,1994-09-30,,Hardcover,,en,,"Height: 9.21 Inches, Length: 6.1401452 Inches, Weight: 0.9369646135 Pounds, Width: 0.5618099 Inches",86.0,https://images.isbndb.com/covers/68/83/9780275946883.jpg,Success,119.0,17.6
0-8050-2716-5,"The Gay and Lesbian Literary Heritage: A Readers Companion to the Writers and Their Works, from Antiquity to the Present",,Henry Holt & Co,786.0,1995,"Gays' writings--History and criticism, Literature--History and criticism, Homosexuality and literature, Homosexuality in literature, PN56.H57 G365 1995, 809/.8920664",Hardcover,"The Gay And Lesbian Literary Heritage Is A Reader's Companion To A Remarkable Range Of Literature And Authors. It Provides Overviews Of The Gay And Lesbian Presence In A Variety Of Literatures And Historical Periods, In-depth Critical Essays On Major Gay And Lesbian Writers In World Literature, And Briefer Treatments Of Other Topics And Figures Important In Appreciating The Rich And Varied Gay And Lesbian Literary Traditions.--introduction. Edited By Claude J. Summers. Includes Bibliographical References And Index.",en,First Edition,"Height: 9.75 Inches, Length: 8 Inches, Weight: 0.97 Pounds, Width: 2.25 Inches",45.0,https://images.isbndb.com/covers/71/67/9780805027167.jpg,Success,127.0,17.6
0-06-066860-1,"Putting Away Childish Things: The Virgin Birth, the Empty Tomb, and Other Fairy Tales You Dont't Need to Believe to Have a Living Faith","Ranke-Heinemann, Uta",HarperCollins,306.0,1994,"Rationalistic interpretationsJesus Christ, Criticism, interpretation, etc, Legends, BS2370 .R3613 1994, 225.6",Hardcover,"The Author Examines All The Fundamentals Of Christian Belief : Christmas, The Miracles, Good Friday, Easter, The Ascension, And More. 1. Luke's Christmas Fairy Tale -- 2. Matthew's Fairy Tale Of Jesus' Childhood -- 3. The Virgin Mother -- 4. The Angels -- 5. Jesus' Genealogies -- 6. Miraculous Fairy Tales -- 7. Good Friday -- 8. The Fairy Tale Of Judas The Traitor -- 9. Easter -- 10. The Ascension -- 11. Pentecost -- 12. The Fairy Tale Of Acts -- 13. Peter In Rome? -- 14. The Apocrypha -- 15. Forgeries And False Authors -- 16. Hell -- 17. Jesus And The Dead Sea Scrolls -- 18. Redemption By Execution. Uta Ranke-heinemann ; Translated By Peter Heinegg. Includes Index.",en,First Edition,"Height: 9.5 Inches, Length: 6.75 Inches, Weight: 1.35 Pounds, Width: 1.25 Inches",0.0,https://images.isbndb.com/covers/86/00/9780060668600.jpg,Success,125.0,17.6
0-679-75527-6,Loose Woman: Poems,"Cisneros, Sandra",Vintage,115.0,1995-03-14,,Paperback,"<p><P>A candid, sexy and wonderfully mood-strewn collection of poetry that celebrates the female aspects of love, from the reflective to the overtly erotic. &quot;Poignant, sexy. . . lyrical, passionate. . . cool and delicate. . . hot as a chili pepper.&quot;&#151;Boston Globe.</p><h3>Publishers Weekly</h3><p>The three parts of this spirited collection address the heart, ``spangled again and lopsided.'' In her second book of poems, Cisneros ( My Wicked Wicked Ways ) presents a street-smart, fearlessly liberated persona who raves, sometimes haphazardly, always with abandon, about the real thing: ``I am . . . / The lust goddess without guilt. / The delicious debauchery. You bring out / the primordial exquisiteness in me.'' As if breaking all the rules (``Because someone once / said Don't / do that! / you like to do it''), she delves with urgency into things carnal--sequins, cigars, black lace bras and menstrual blood. Readers of Cisneros's coming-of-age novel The House on Mango Street (which Knopf is reissuing in hardcover) will recognize the almost mythic undertow of her voice; it never weakens. We meet again a powerful, fiercely independent woman of Mexican heritage, though this time innocence has long been lost. For her the worlds of language and life are one and the same: ``Lorenzo, I forget what's real. / I mix up the details of what happened / with what I witnessed inside my / universe.'' These poems--short-lined, chantlike, biting--insistently rework the same themes to tap them. In the end, however, despite the accessible boldness of the writing, the poems lack the depth, the complexity and the lyrical magic of the author's fiction. QPB alternate; first serial to the New Yorker. (May)</p>",en,Reprint,"Height: 7.97 Inches, Length: 5.23 Inches, Weight: 0.2866009406 Pounds, Width: 0.39 Inches",14.95,https://images.isbndb.com/covers/52/72/9780679755272.jpg,Success,129.0,17.6
0-8052-1036-9,On Being a Jewish Feminist,"Heschel, Susannah",Schocken,288.0,1995-03-14,"Women in Judaism, Feminism--Religious aspects--Judaism, Judaism, Judaism--20th century, BM729.W6 O6 1995, 296/.082",Paperback,On Being a Jewish Feminist is indispensable for anyone who wishes to understand contemporary Judaism or contemporary Jewish thought.,en,First Edition,"Height: 8 Inches, Length: 5.25 Inches, Weight: 0.7 Pounds, Width: 1 Inches",1.99,https://images.isbndb.com/covers/03/61/9780805210361.jpg,Success,129.0,17.6
0-465-05370-X,Other People's Children,"Wrigley, Julia",Basic Books,192.0,1995-03-23,"Child Care, Parenting - General & Miscellaneous",Hardcover,"When parents hire nannies, housekeepers, or au pairs, most think they are getting the best child care money can buy. But are they? When parents become employers, what does it mean for them, their children, and the nannies themselves? While parents may dream of Mary Poppins, seldom do they hire professional British nannies. Instead, most hire untrained women who have few other career options. Coming from different worlds, middle-class parents and their children's caregivers may not share a language - either literally or figuratively. Most parents do not know what their caregivers truly think about them, their young charges, or American child-rearing practices. Based on more than 150 interviews with caregivers and parents, this book explores the hidden side of caregiving relationships. Julia Wrigley asks how parents learn to be employers and why some fail at the task. The book is an unsparing examination of the poignant situations and conflicts that can arise when parents and caregivers share child rearing but little else. In their own words, caregivers tell of working long hours in aching isolation and boredom, asked to invest emotionally in children yet lacking any real authority over their charges. Parents tell of caregivers who disappear without warning or who define their jobs as watching children but not playing with them or helping them learn. The book examines parents' strategies to ensure that their children are raised according to their own values, even in their daily absence from the home. No strategy, however, can overcome all the problems created by unequal relationships within households. The book makes a compelling argument that professionally run child care centers better meet the needs of children and parents alike.",en,First Edition,"Height: 8.5 Inches, Length: 5.75 Inches, Weight: 0.80027801106 Pounds, Width: 0.75 Inches",0.0,https://images.isbndb.com/covers/37/04/9780465053704.jpg,Success,113.0,17.6
0-435-90680-1,The Heinemann Book of African Women's Poetry,,Heinemann,230.0,1995-02-08,"African poetry--Women authors--Translations into English, African poetry (English)--Women authors, African poetry--Translations into English, African poetry--20th century--Translations into English, African poetry (English), African poetry (English)--20th century, PL8013.E5 H45, 808.81/0082",Paperback,"This Anthology Offers An Extensive Selection Of Poetry By Women All Over The African Continent. The Poems Address Wide-ranging Human Concerns Such As Love, Motherhood, Death, Colonial Domination And Human Dignity. They Employ A Variety Of Styles From The Conversational To The Didactic. You Called To Me, Prison Windows / Daniele Amrane -- For My Torturer, Lieutenant D . . . / Leila Djabali -- Before Your Waking ; 'the Future Is For Tomorrow' / Anna Greki -- It Took One Hundred Years ; The Dead Erect Malika O'lahsen ; Obelisk Inscriptions / Queen Hatshepsut -- The Future And The Ancestor ; What Are We Playing At? ; Man-today ; Movement ; Imagine ; Who Remains Standing? ; The Naked Face ; For Survival ; Stepping Aside / Andree Chedid -- We Asked ; The Fall / Malak'abd Al-aziz -- Embrace The Blade ; Auditory Hallucinations ; The Sun Is In Capricorn ; Seated On Her Bed . . . ; Last Night I Saw Your Corpse ; Of Sweet Rest ; I Saw The Red Electric ; A Woman Kneeling In The Sorry Jelly ; Desire As Light As A Shuttle / Joyce Mansour -- Here I Am Once More . . . / Rachida Madani -- On The Tattered Edges . . . ; The Bird Is Mediation ; My Woman's Transparence ; And We Were Born ; The Africa Of The Statue ; On The Fringe ; The Vultures Grow Impatient / Amina Said --^ Sister, You Cannot Think A Baby Out / Irene Assiba D'almeida -- Gynae One ; Issues ; For Kinna Ii ; Totems / Ama Ata Aidoo -- Liberation ; Mawu Of The Waters / Abena P. A. Busia -- Shadow Of Darkness ; Rainy Season Love Song / Gladys May Casely Hayford -- Going Home ; The Spring's Last Drop ; The Dissidents ; Harvest Of War ; Other Forms Of Slaughter ; Water Woman / Cathering Obianuju Acholonu -- Nok Lady In Terracotta ; The Union ; Mistress Of My Own Being ; Bloody Masculinity ; Bitter ; We Have Even Lost Our Tongues! ; Creation ; Be Brothers / Ifi Amadiume -- Bajji ; Solange ; Lagos ; Queue ; Yet Still / Rashidah Ismaili -- Nigeria Of The Seventies ; Tendril Love Of Africa ; Yoruba Love ; Rain At Noon-time / Molara Ogundipe-leslie -- You Who Occupy Our Land ; Socope ; Landscape ; Roca / Maria Manuela Margarido -- The Same Side Of The Canoe ; Where Are The Men Chased Away By That Mad Wind? ; Far From The Beach ; Grandma Mariana / Alda Do Espirito Santo --^ Requiem ; Labane ; Kassacks / Annette M'baye D'erneville -- The Village / Marina Gashe -- For Miriam ; A Freedom Song ; Letter To A Friend ; A Muffled Cry / Marjorie Oludhe Macgoye -- From Poem To Her Daughter / Mwana Kupona Binti Msham -- Look How Rich We Are Together ; I Want You To Know ; Wife Of The Husband ; Where Are Those Songs? / Micere Githae Mugo -- Your Name Is Gift ; I'm My Own Mother, Now / Stella P. Chipasula -- To Be A Woman ; The Woman ; You ; Destruction ; You Have Touched My Skin ; You Must Help Me Gather ; I Am Not Just A Body For You ; Beyond Poetry ; It Is Not Just ; To My Little Girl ; I Have Gone Into My Prison Cell / Shakuntala Hawoldar -- Arise To The Days Toil ; An Agony A Resurrection / Assumpta Acam-oturu -- Nights / Alda Lara -- Shoeshine Boy ; Marketwoman Of Luanda ; Madalena / Maria Eugenia Lima -- Angola ; Wind Of Liberty / Amelia Veiga -- We Are Equals ; In The Fist Of Your Hatred / Gwendoline C. Konie --^ Poem Of A Distant Childhood ; Call ; Our Voice ; Let My People Go / Noemia De Sousa -- Morning ; Spell For Jealousy ; Spell To Protect Our Love ; Spell To Cure Barrenness ; Spell For Birth ; The Mystery ; Heartsong ; Transformation ; The Pain ; The Way Out ; Creation / Jeni Couzyn -- Small Passing ; Al Wat Kind Is ; Our Sharpeville / Ingrid De Kok -- Mr White Discoverer ; I Will Still Sing ; Burials ; Towards Abraham's Bosom ; Deliverance / Amelia Blossom Pegram -- The Child Who Was Shot Dead By Soldiers At Nyanga ; I Don't Want Any More Visitors ; I Drift In The Wind ; The Face Of Love ; I Am With Those ; Pregnant Woman ; Dog / Ingrid Jonker -- A Love Song ; Dream Cloud ; Death To The Gold Mine! ; Tired Lizi Tired / Lindiwe Mabuza -- I Have Tried Hard ; I Waited For You Last Night ; Saviour ; Lock The Place In Your Heart / Zindzi Mandela -- Sometimes When It Rains / Gcina Mhlophe -- You Are Mad And I Mean It! / Phumzile Zulu --^ Labour ; Mother ; The Woman ; This Morning ; After The Rain / Kristina Rungano. Edited By Stella And Frank Chipasula.",en,3rd Print,"Height: 8 Inches, Length: 5.25 Inches, Weight: 0.440924524 Pounds, Width: 0.75 Inches",1.99,https://images.isbndb.com/covers/68/01/9780435906801.jpg,Success,116.0,17.6
1-55583-275-X,Not The Only One,,Alyson Books,237.0,1995,"Short Story Anthologies, Gay & Lesbian Fiction, Teen Fiction - Sexuality, Phases of Life - Fiction",Paperback,"As gay and lesbian teenagers come out, they may face joy and confusion, excitement and isolation, all at the same time. These stories reflect their full spectrum of experiences.                        <p>A collection of short stories portraying gay and lesbian teenagers at different moments in their lives.</p>",en,First Edition,"Height: 8.75 Inches, Length: 5.75 Inches, Weight: 0.771617917 Pounds, Width: 0.75 Inches",1.99,https://images.isbndb.com/covers/27/59/9781555832759.jpg,Success,93.0,17.6
0-8075-5507-X,My Two Uncles,"Vigna, Judith",Concept Books,30.0,1995,"Children's Fiction, Family",Hardcover,,en,First Ed First Printing,"Height: 8.75 Inches, Length: 9.5 Inches, Weight: 0.7 Pounds, Width: 0.5 Inches",14.95,https://images.isbndb.com/covers/50/71/9780807555071.jpg,Success,73.0,17.6
0-89594-742-0,Revolutionary Laughter: The World of Women Comics,,Crossing Pr,299.0,1995,"Women comedians, Women comedians--United States--Biography, Women comedians--Interviews, Women comedians--United States--Interviews, PN2285 .R46 1995, 792.7/028/082 B",Paperback,Edited By Roz Warren.,en,,"Height: 9.25 Inches, Length: 7.25 Inches, Weight: 1.25002102554 Pounds, Width: 0.75 Inches",1.99,https://images.isbndb.com/covers/74/20/9780895947420.jpg,Success,33.0,17.6
0-380-76742-2,Larque on the Wing,"Springer, Nancy",Avon Books,288.0,1995-02-01,,Paperback,"Guitar-shaped, forty-year-old wife, mother and successful crafter of home decoration products Larque Harootunian is going through a very messy mid-life crisis. Larque's loved ones accept her uncanny, unconscious, often embarrassing habit of producing temporary doubles - ""doppelgangers"" - of people and their inner aspects from out of thin air. But now her latest creation, herself at age ten, refuses to fade away quietly - leaving Larque no choice but to bear the taunts and accusations of the scabby-kneed golliwog girl she once was. For the child, Sky, will not accept the compromises Larque has made in her life - and, ultimately, leads her older self out into the vast, adult and mysterious night in search of lost dreams. Larque's nocturnal wanderings take her farther from home and hearth than she ever imagined possible - to the neon pinks and Day-Glo yellows of Popular Street, where life is exciting and gay. Here in this secret place, she meets the beautiful, tormented cowboy Shadow - and Argent, the handsome stud-lover Shadow has molded from the pliable clay of middle-aged angst. And it is here, beneath Shadow's talented fingers, that Larque herself is remade - becoming a new ""Lark,"" younger, stronger, more courageous...and male. But freedom is a pricey commodity - and there are those who would gladly clip Larque's newly formed wings. Her loving, gentle, bearlike husband Hoot desperately wants her back - steadfastly refusing to accept his wife as a muscular, teenaged boy. And her disapproving mother is especially dangerous - since she has the power to ""blink"" her errant daughter into some maternally approved, no-warts ideal. But the most fearsome adversary of all lurks deep within an already splintered Larque/Lark - a doppelganger in sensible shoes who, if released, could swallow up the Harootunian family whole and leave Popular Street in ruins: the dreaded Virtuous Woman. A moving, outrageously funny, thought-provoking, truly unique and more-than-just-average-w

                        <p>Larque Harootunian, 40-year-old mother and crafter of home decoration products, is going through a messy mid-life crisis. Her loved ones casually accept her unconscious habit of creating temporary doppelgangers of people out of thin air, but when she achieves a complete makeover which transforms her into a strong, courageous gay man, things may have gone too far.
</p>",en,Reprint,"Height: 7 Inches, Length: 4.25 Inches, Weight: 0.3 Pounds, Width: 1 Inches",4.99,https://images.isbndb.com/covers/74/27/9780380767427.jpg,Success,64.0,17.6
1-56458-901-3,David McCaulay: The Way Things Work (CD-ROM Version 1.0--WIN),David McCaulay,DK MULTIMEDIA,,1994,"Technology--Popular works, 600",CD-ROM,"Based On David Macaulay's Book, This Interactive Cd-rom Explains The Workings Of Everything From The Very Simplest To The Most Complex Of Machines. Includes A Series Of Animated Home Movies That Illustrate Inventors' Scientific Breakthroughs And Explains The Scientific Principles And Workings Of Hundreds Of Machines In Great Detail. David Macaulay. Title From Title Screen. Includes Sampler Disc Of Dorling Kindersly Multimedia. 5-70833--container. Production Editorial Lead, David Game ; Design Lead, Tony Foo ; Voices, Bob Clayton ... [et Al.] ; Music, Alex Boysen, Mat Nelmes. System Requirements: Multimedia Pc With 386sx Or Higher Microprocessor; 4 Mb Ram; Mpc Compatible Cd-rom Drive; Sound Card; Mouse; Svga 256-color Display; Loudspeakers Or Headphones; Microsoft Windows 3.1 Or Later.",en,Version 1,"Height: 10.12 Inches, Length: 6.76 Inches, Width: 1.52 Inches",39.95,https://images.isbndb.com/covers/90/19/9781564589019.jpg,Success,61.0,17.6
0-345-38101-7,Bride of the Rat God,"Hambly, Barbara",Del Rey Books,336.0,1994-10-31,,Paperback,,en,First Edition,"Height: 7 Inches, Length: 4.25 Inches, Weight: 0.4 Pounds, Width: 1 Inches",5.99,https://images.isbndb.com/covers/10/19/9780345381019.jpg,Success,65.0,17.6
