PageNumber,Text,ISBNs
77,"Feminist Bookstore News
DL
PUT E rCI
$10.95 1-879427-20-6
Trd Side Press
3C21h22i -c52a 7g01o -, 3 W0I 2L 9 . 6 0 6F2a5rragut £
the Black Panthers and the GOP. Candid, campy, by Russian Women. Translator Masha Gessen has
sexy Susie Bright — recently featured in Vanity Fair collected fascinating, beautifully crafted stories
— takes the world by storm in this collection of which reveal — with much black humor and sharp
essays Which originally appeared in The East Bay irony — a world in the process of reinventing itself.
Express, The San Francisco Review of Books, The Village Both Kirkus and Ms. have said they will review Half a
Voice, New York Times Book Review, Esquire, Future Sex, Revolution, which will insure serious attention and
Playboy, San Francisco Examiner, Realist, and Out!. strong sales among women’s studies folk and
$10.95 pb, 1-57344-002-7, May. libraries. $12.95 pb, 1-57344-006-X, April.
Finally, fans of Mo and the gang from Dykes to
Watch Out For, Hothead and Chicken from Hothead
Paisan, Bitchy Bitch, Liliane and a host of other pen-
Cleis Press reissues Good Sex: Real Stories from and-ink lesbian icons will be thrilled with Dyke
Real People by Julia Hutton this season. The first edi- Strippers: Lesbian Cartoonists A to Z. Featuring a
tion of Good Sex came out in June 1992 and sold 9,000 Diane DiMassa original cover drawing (of two lesbians
copies. The second edition includes a new introduc- in a ridiculously un-sexy strip act), Dyke Strippers is
tion by Isadora Alman, whose popular advice column an action-packed omnibus of the wild imaginations of
“Ask Isadora” appears in The Village Voice, The San lesbian cartoonists — Alison Bechdel, Jennifer Camper,
Francisco Bay Guardian and other newspapers. Watch Diane DiMassa, Nicole Ferenz, Fish, Leanne Franson,
for the new sexy cover featuring a beautiful photo- Roberta Gregory, Joan Hilty, Kris Kovick, Andrea
graph by Phyllis Christopher, whose work appears Natalie, Zora and many, many more. Edited by Roz
on many Cleis covers. $14.95 pb, 1-57344-000-0. Warren, whose popular humor anthologies (Women’s
Cleis is pleased to publish the first collection of Glib series, The Crossing Press) have combined sales of
post-Soviet Russian women’s fiction to appear in over 50,000 copies. Back cover blurb by Mo, who has
English, Half a Revolution: Contemporary Fiction much to say about the complicated politics of lesbian
March/April 1995 74 Volume 17 Number 6
This content downloaded from
(cid:0)(cid:0)(cid:0)(cid:0)(cid:0)(cid:0)(cid:0)(cid:0)(cid:0)(cid:0)(cid:0)(cid:0)74.108.41.47 on Thu, 28 Mar 2024 01:30:49 +00:00(cid:0)(cid:0)(cid:0)(cid:0)(cid:0)(cid:0)(cid:0)(cid:0)(cid:0)(cid:0)(cid:0)(cid:0)
All use subject to https://about.jstor.org/terms","['95 1-879427-2', '1-57344-002-7', '1-57344-006-X', '1-57344-000-0']"
78,"anthologies! $16.95 pb, 1-57344-008-6, July. perspective of one of history's most energetic
Cleis Press, PO Box 8933, Pittsburgh PA 15221; activists. The book provides an insider’s view of the
412-937-1555. Distributed by Publishers Group dynamics of the early NAACP, including Ovington’s
West (best discounts); also available from BP, IN, travels throughout the U.S. to establish local NAACP
Ingram, Baker & Taylor. —Cleis chapters, and her long-time friendship and working
relationship with W.E.B. Dubois. $19.95 cl, 1-55861-
DOWN THERE PRESS 099-5, May. A
Exploring self-image issues, inner sensuality,
and communication with partners, Exhibitionism E Q
for the Shy: Show Off, Dress Up and Talk Hot by
Carol Queen takes the reader beyond bashfulness to Solution Three by Naomi Mitchison is at once
erotic comfort and pleasure. The author offers a pre- positive in its vision of science as a realm in which
scription for developing a more assertive and erotic women can indeed make a difference and cautionary
persona, enhancing self-confidence in other aspects in its exploration of the ethics involved in tampering
of life. As a formerly shy sex worker /educator, Carol with gender and genetics. Through a future society's
Queen writes extensively about sexual enhancement “solution three,” overpopulation and aggression
and erotic diversity. $12.50 pb, 0-940208-16-4, June. have been minimized as homosexuality and repro-
Down There Press, 938 Howard St. #101, San duction by cloning have become the international
Francisco CA 94103; 415-974-8985 ext. 105. norm. Though this gives both men and women equal
Distributed by BP, IN, Alamo Square. rights and status and eliminates racial tension, it cre-
—Down There Press ates problems of its own that may call for an even
more evolved solution — a “solution four.” This
FEMINIST PRESS
Just in time for the 1995 U.N. Conference on the Herland in that it “imagines a society in which women
, Status of Women in Beijing, China for Women fills have used reproductive control to shape a more equi-
the void in Chinese travel literature for women. As table life for all.” $10.95 pb, 1-55861-096-0, April.
Australia for Women did for “the land down under,” An international anthology, Changing Lives
this volume makes visible women’s political, social, contains the diverse life stories of thirteen different
and cultural history and offers the voices of Chinese women from eleven Asian countries. These women
women today. A rich culture and beautiful land- describe their individual passages into feminist con-
scape are brought to life through vivid personal sciousness and the monumental effect of women’s
essays and literature from such authors as Ding Ling studies on their private and professional lives. Like
and Agnes Smedley. In addition, the volume also the feminist pioneers of the U.S. and other parts of
proves practical with a list of do’s and don'ts for the the world, these contemporary Asian pioneers see
new traveler to China. $17.95 pb, 1-55861-112-6, April. women’s studies as a way to change lives as well as
Black and White Sat Down Together, the mem- education, and to mobilize other women to join
oirs of “Fighting Saint” and NAACP founder Mary them. $10.95 pb, 1-55861-109-6, June.
White Ovington, is the candid story of a courageous At at time when health care is front-page news,
woman who defied her race, class and gender to Always a Sister by Doris Groshen Daniels offers the
become a civil rights leader. This volume makes visi- inspiring story of Lilian D. Wald, a pioneer in the ear-
ble the horrors of racism and the triumphs of civil ly public health movement. This marks the first paper
rights work in the early twentieth century from the edition of the critically acclaimed biography of a
This content downloaded from
(cid:0)(cid:0)(cid:0)(cid:0)(cid:0)(cid:0)(cid:0)(cid:0)(cid:0)(cid:0)(cid:0)(cid:0)74.108.41.47 on Thu, 28 Mar 2024 01:30:49 +00:00(cid:0)(cid:0)(cid:0)(cid:0)(cid:0)(cid:0)(cid:0)(cid:0)(cid:0)(cid:0)(cid:0)(cid:0)
All use subject to https://about.jstor.org/terms","['1-57344-008-6', '0-940208-16-4', '1-55861-096-0', '1-55861-112-6', '1-55861-109-6']"
79,"Feminist Bookstore News
woman whose lifelong concern with providing free
and accessible health care made her a major player in
the shaping of health care policies during the
A N yE WPR E SVEINCTTSORIA PUBLISHERS Progressive period. $12.95 pb, 1-55861-113-4, May.
N Edited by Ann Leonard, Seeds 2, the succeeding
volume to the classic Seeds, documents viable eco-
nomic and development projects around the world
borne from women’s own initiatives. From Ecuador
to Ethiopia to the United States, contributors docu-
ment both the potential and the difficulties of trans-
lating economic rhetoric into specific action projects
for women around the globe. Unlike the previous
volume, the projects in Seeds 2 focus on strategies
ongoing drama of Lauren's life. aimed to increase women’s access to land, labor, and
When Lauren is accused of murder- credit markets, and to organize women for collective
ing her husband, Diana finds herself action. $12.95 pb, 1-55861-106-1, August.
in the middle of a plot she didn't cre- The Feminist Press at the City University of New
ate. Diana rushes to her defense, York, 311 East 94th Street, New York NY 10128; 212-
despite protestations from her friend 360-5790. Distributed by Consortium.
to, “Stay away from that Anglo.” —Feminist Press
An entertaining mystery.
$9.95 ISBN 0-934678-63-4 FIREBRAND BOOKS
Eight Bullets: One Woman’s Story of Surviving
Anti-Gay Violence by Claudia Brenner with
GIVE MY SECRETS BACK Hannah Ashley is a book that is very close to home
By Kate Allen — literally. Claudia Brenner has been part of the
A well-known author of steamy lesbian Ithaca lesbian community for many years. When she
romances is found dead in her bathtub. Suspecting was severely wounded and her lover killed while
foul play, cop Alison Kaine begins an off-duty they were hiking on the Appalachian Trail, all of our
investigation to find the chapters of the murder vic- lives were changed. Eight Bullets is Claudia telling
tim’s next book which are inexplicably missing, and her story; it is riveting, unsentimental, politically
may I nc o n thta ii sn b c ol ou ke s . author Kate Allen doesn't shrink and emotionally instructive. $12.95 pb, 1-56341-055-
from the heavy issues of s/m and the leather scene, 9, April; $26.95 cl, -056-7, May.
but writes with a light touch. Post-Diagnosis by Sandra Steingraber. I know
that “poetry doesn’t sell,” but let's try this anyway.
Praise for the f i Tr es lt l A Ml eis o Wn h K ata i n Ye o u m Ly is kt ee —ry, bN eo it n g o n al y c a i ns c et rh e s u p ro ve ivt o rf i r (is nt c hl ea rss -, tb wu et n ts ih ese )’ s a nd dea l i tn hg e with
W S aBF S EAro 1dC B A “NfP ra efssaetsn - t-spp aaicsecsdue—edsa — fgarc:ie na tg Í rte hare, eleasdbi.a”n com- e cn anv cir ero n m ace tn ivt ia sl t c won hn oe c kti no on ws. s S hh oe w’s ta o b mio alo kg ei s t h e ran d h e aa rt,
A t v > S Er N g N Ak> lK le a niM n aeu Sn i st ely do m w si e t e $nh 9 .i n 9a 5 b o h o Ik Su s B m t Noo d r a y 0. ” -a 9n 3d 4 6 7h 8u -m 64a -n 2ity h $9e .r 9 5 I i nn p t be hl ,l ee rc 1 t - 5 n 6 ea 3n w4d 1 - b 0t o5h o7e k- 5 w ; S /r $i h2t et 0 ,e . 9n 5 M w ic nlo n,r i d e- 0 B5co 8 rm - u3 ce . e t Po rg ae tt th e hr. as once
again written a book that will open up doors for many
Available from: of us. S/he is gender theory, grounded in the author's
InBook, 140 Commerce St, East Haven, CT 06512 feminism, written in lyrical autobiography. The writing
1-800-243-0138 —And other distributors is finely honed (the woman is a world class poet), the
content challenging, the tone both sexy and reflective.
$10.95 pb, 1-56341-059-1, March; $22.95 cl, 060-5, April.
March/April 1995
This content downloaded from
(cid:0)(cid:0)(cid:0)(cid:0)(cid:0)(cid:0)(cid:0)(cid:0)(cid:0)(cid:0)(cid:0)(cid:0)74.108.41.47 on Thu, 28 Mar 2024 01:30:49 +00:00(cid:0)(cid:0)(cid:0)(cid:0)(cid:0)(cid:0)(cid:0)(cid:0)(cid:0)(cid:0)(cid:0)(cid:0)
All use subject to https://about.jstor.org/terms","['1-55861-113-4', '1-55861-106-1', '0-934678-63-4', '1-56341-059-1']"
80,"Firebrand Books, 141 The Commons, Ithaca NY 50-0 [not available in the U.S.]; $10.95 cl, 0-921556-51-
14850; 607-272-0000. Distributed by InBook and all 9). And in another book in the Rosalie Series,
leading distributors/wholesalers. —Firebrand Rosalie’s Big Dream (same author and illustrator),
Rosalie has a big dream: to be the best tapdancer in
GYNERGY BOOKS North America. When she reveals her ambition to
It began with Ghost Motel in the Fall of 1994 ..… her best friend Julie Morin, her troubles begin. In this
The Harriet Hubbley series by Jackie Manthorne was third thrilling adventure, Rosalie once again tangles
born, featuring gripping mysteries with a lesbian with trouble and discovers a few things about friendship
twist and a dash of sly humor. Now, in Deadly and the value of dreams ($5.95 pb, 0-921556-52-7 [not
Reunion Harry gets caught in the investigations of a available in the U S.]; $10.95 cl, 0-921556-53-5, April).
murder during her high school reunion. An attempt gynergy books, PO Box 2023, Charlottetown PEI,
on her life only muddies the already far-from-pris- Canada C1A 7N7; 902-566-4472. Distributed in the
tine waters, even as clues pile up and point in a sur- U.S. through InBook and in Canada through General
prising direction. $9.95 pb, 0-921881-32-0, April. Distribution Services. —gynergy
Lesbian Parenting: Living with Pride and Se
Prejudice edited by Katherine Arnup is the perfect
primer for lesbian parents, and a helpful resource for
their families and friends. This indispensable collec- HERBOOKS
tion of articles offers up-to-date information and This Spring HerBooks is publishing our first oral
inspiration to lesbians considering parenthood, to history title, A Transported Life: Memories of
women involved with lesbian mothers, and to les- Kindertransport, An Oral History of Thea Eden.
bians with children. Topics covered range from While numerous oral histories of Holocaust sur-
alternative insemination to raising boys, from “com- vivors have been collected, few have been the stories
ing out” to legal questions. Contributors are lesbian of those who were children at the time. The popular
women and their children from the U.S. and Canada. misconception is that child survivors were “too
$16.95 pb, 0-921881-33-9, May. young to remember.” The stunning detail of this
What is a “real” sister, anyway? In Real Sisters manuscript is testament to the fallacy of that
by Susan Wright, illustrated by Bo-Kim Louie, this is assumption. Thea Eden was born in Cologne,
the question seven-year-old Claire must answer for Germany in 1926 to Polish/Galician immigrant par-
herself when classmates in the schoolyard taunt her. ents. In October, 1938 she, her mother and brothers
Because Claire is adopted and she looks different, were expelled from Germany and incarcerated at
they say that her older sister Jenny is not her real sis- Zbaszyn prison camp in Poland. In 1939, Thea was
ter. Here is a heartwarming and realistic look at what rescued as one of the 10,000 German-Jewish children
it means to be a sister. $5.95 pb, 0-92155642-X. saved by the Kindertransport program, and brought
Rosalie’s Battles by Ginette Anfousse, illustrat- to England as a refugee. Today there are millions of
ed by Marisol Sarrazin, is the second book in the refugees, many of them children, leading “transport-
Rosalie Series. It begins with a schoolyard fight that ed lives.” Here in California, as elsewhere, racism
turns sour and becomes “war.” While Rosalie learns and anti-Semitism are intensifying; the politics of
some truths about real war from Vietnamese immi- fear and scapegoating are once again being promot-
grant Piam Lov, her new kitten goes missing and her ed as an antidote to hard economic times. In this cli-
friend Pierre-Yves is hospitalized with pneumonia. mate, the insights and experiences described in this
Will Rosalie’s battles never end? ($5.95 pb, 0-921556- oral history seem all too relevant. 96 pages; illustrat-
77
This content downloaded from
(cid:0)(cid:0)(cid:0)(cid:0)(cid:0)(cid:0)(cid:0)(cid:0)(cid:0)(cid:0)(cid:0)(cid:0)74.108.41.47 on Thu, 28 Mar 2024 01:30:49 +00:00(cid:0)(cid:0)(cid:0)(cid:0)(cid:0)(cid:0)(cid:0)(cid:0)(cid:0)(cid:0)(cid:0)(cid:0)
All use subject to https://about.jstor.org/terms","['0-921556-52-7', '0-921556-53-5', '0-921881-32-0', '0-921881-33-9']"
81,"ed. $9 pb, 0-939821-07-9, April. HerBooks, PO Box Clark Pearson. This hardcover, 8.5xll illustrated ver-
7467, Santa Cruz CA 95061; 408-425-7493. sion will sport a new ISBN, a new price and a new
Distributed by IN, BP. —HerBooks cover, taken from the beautiful, original line draw-
ings executed by the author. The sly tale of a woman
KNOWLEDGE, IDEAS & TRENDS drawing limitations to how much she is willing to
Early Promise, Late Reward: A Biography of change herself in order to “keep her man” is both point-
Helen Hooven Santmeyer, Author of “... And ed and entertaining. A gem! $12.95 c], 1-879198-16-9.
Ladies of the Club” by Joyce C. Quay will be avail- Knowledge, Ideas & Trends, 400 Prospect Street,
able in June. Although she had published three other Glen Rock NJ 07452. Distributed by BP, IN.
titles early in her life, Helen Santmyer’s fame came —Sandra Brown & Rita McCullough
with the publication of “... And Ladies of the Club”
when she was 88 years old. Helen had decided at age LGB ENTERPRISES
ten that she would one day become a famous writer. Sista’: Women in the Tapestry of Life by Lorene
From the neighborhood newspaper she published Garrett-Browder is a book that celebrates grassroots
then, to the triumph of her best-selling novel, she women — those we hear little about but who are the
never wavered in that ambition. Her journey backbone of our existence. The author profiles sev-
through Wellesley, New York’s publishing world, enteen women ”...you will not read about in your
her scholarship years at Oxford, England and her local paper or see on a movie screen, but [who] are
tedious labors during the Great Depression, make a changing and touching the lives of all who meet
fascinating story. An inveterate letter writer, Helen them in their own quiet, gentle ways.” Each woman
comments — over all the years — about the social profiled tells her own story, and each entry is accom-
mores of style, menus, prices, attitudes and politics panied by a full-page b&w photograph. $14.95 pb, 0-
of every walk of life. The social history captured here 9642617-2-3. Order from LGB Enterprises, PO Box
is a valuable contribution in itself. $14.95 pb, 1- 794, Boulder Creek CA 95006; 408-338-0843.
879198-15-0, June. —LGB Enterprises
LAVENDER CRYSTAL PRESS
Tickle your funnybone with Lesbian Stew:
Shadow On My Soul: Overcoming Addiction to Cartoon Creations by Dawn D. Manna. Manna has
Suicide by Dr. Paula Quinn is a fascinating look at put together 72 pages of cartoons that show the
an inner world of childhood sexual and psychologi- lighter side of lesbian life. Includes coming out jokes,
cal abuse. Dr. Quinn gives us a beautiful literary “Facts Historians Forgot,” and Jazz, the bittersweet
account of her struggle to deny the edict from with- episodes of a lesbian youth coming of age. $7.50 pb,
in, the voice that repeated, “I'll just kill myself.” As 0-9636909-65.
we follow her through this labyrinth of abusive rela- Making Friends with Nature by Sue McConnell-
tionships, guilt, disorientation and stultifying Celi is a rhymed children’s story (ages 3-8) with pho-
depression into true healing and forgiveness, we tos depicting playtime, sharing, respecting others
cannot help but admire and be inspired. Many read- and the environment, making an AIDS quilt panel, a
ers will find help and hope here. $14.95 pb, 1-879198- girl in a wheelchair recycling cans, and taking quiet
13-4, June. time. Leaf motif throughout. This book will be on
Qur third offering this Spring is a re-presentation display at the 1995 International Children’s Bookfair
of The Yellow Slicker: A Fable for Women by Pegi in Bologna, Italy. $7.95 pb, 0-9636909-1-4.
78
This content downloaded from
(cid:0)(cid:0)(cid:0)(cid:0)(cid:0)(cid:0)(cid:0)(cid:0)(cid:0)(cid:0)(cid:0)(cid:0)74.108.41.47 on Thu, 28 Mar 2024 01:30:49 +00:00(cid:0)(cid:0)(cid:0)(cid:0)(cid:0)(cid:0)(cid:0)(cid:0)(cid:0)(cid:0)(cid:0)(cid:0)
All use subject to https://about.jstor.org/terms","['0-939821-07-9', '1-879198-16-9', '0-9636909-1-4']"
82,"Feminist Bookstore News
Lavender Crystal Press, PO Box 8932, Red Bank Exhibitionism
NJ 07701. Distributed by IN, BP. —Lavender Crystal
MADWOMAN PRESS for the Shy
Becky Bohan (Sinister Paradise) is back! In her Carol Queen
new book Fertile Betrayal, Veterinarian Nedra Wells Show off, dress up and
is sure she can have it all — the career, the lover, and talk hot to find one’s
life in a small town. It’s what she’s always wanted. It sensuous inner self. The
s th eao cu hld er b Ae n npe ier f e Cc at l. l a hB au nt , i ft e’s e l sn o it s. o l aN te ed dr , a ’ as n dlo v Ner ed, r as ’c shool a seu xt h o wr o, r ka e rf /o er dm uce ar tl oy r , shy
practice is threatened by a mysterious and deadly presents techniques and
h 00e -a 1lt . h M c ar di wsi os m i an n a P rl eo sc sa ,l Pc Oat t Ble o x h e 6r 9d 0. , $ N9. o9 r5 t h p bb o, r o 1 - M88 A6231- hre es lpo u r tc he os s e f r oo fm a lh l e r se xp uo ap l u l pa er r s w uao sr iok nsh s o p ms o vt eo
01532-0690; 508-393-3447. Available from publisher beyond bashfulness to erotic confidence.
and distributed by IN, BP, Alamo Square.
—Madwoman $12.50, paper, 200p, biblio, ISBN 0-940208-16-4
MINERVA Down There Press/Yes Press
An Uncommon Soldier: The Civil War Letters 938 Howard, San Francisco CA 94103
of Sarah Rosetta Wakeman, Alias Private Lyons (415) 974-8985 x 105
Wakeman, 153rd Regiment, New York State Also available through Bookpeople, Inland, Alamo
Volunteers edited by Lauren Cook Burgess is an Square, Pacific Pipeline, the distributors, Baker &
annotated, illustrated edition of a unique, newly-dis- Taylor and others.
covered Civil War document: a complete collection
of letters home written by a woman who passed as a
man and served in the Union army as a regular sol- SIMPLICITY
dier. $25 cl, 0-9634895-1-8. Order from The Minerva
Center, 20 Granada Road, Pasadena MD 21122-2708;
410-437-5379. —Minerva
RUTES TON E-
„ NAIAD PRESS
Jennifer Fulton's Greener than Grass is right at “Ruth Stone's seeing eye is clear,
the top of the list. It gives readers another chance to her voice as simple and complex
enjoy the biting wit of one of the sharpest romance as life is. Like the woman in her
writers in the lineup! Put yourself in Fulton’s hands poem ‘Isolation,’ she has gone
and learn what happens when film-maker Blair deep and brought back a message.
Carroll comes home to a borrowed apartment and Listen.” — LUCILLE CLIFTON
finds a stranger — a young and attractive woman — “She is one of poetry's wise
a sesl le lie np g i n T r uh ee r L ob ve ed . . $A 1 0 .h 95o t p f bo , l lo 1w -5- 6u 2p 8 0 -t 0o 9 2l -a 2s ,t Mye aa yr .’s best- w f pi oo e em r tc se e .”n s t , — a n p d u S r Aeo Nsn t De , R o m Af o s Go tu I L r o B r Ea i Rgg i Te n's al
Jaye Maiman is back with Someone to Watch,
number four in her hot-selling series about Robin $ IS1 B2. N9 5 , 0 -p 9a 6p 3e 8r 1, 8 3 1 -13 -6 7 pages
Miller. On the trail of a sultry con artist, Robin is side- At bookstores or from
tracked by girlfriend K.T. Bellflower’s pleas for help for a INBOOK, 800-253-3605
friend accused of murdering her boyfriend. Then Robin
is blind-sided by the disappearance of K.T. and the DARING AND BEAUTIFUL FEMINIST BOOKS
friend, and thrown into an investigation that veers into
scary political intrigue. $10.95 pb, 1-56280-095-7, May. P.0. BOX 267, NORTHAMPTON, MA 01061-0267
Volume 17 Number 6 79 March/April 1995
This content downloaded from
(cid:0)(cid:0)(cid:0)(cid:0)(cid:0)(cid:0)(cid:0)(cid:0)(cid:0)(cid:0)(cid:0)(cid:0)74.108.41.47 on Thu, 28 Mar 2024 01:30:49 +00:00(cid:0)(cid:0)(cid:0)(cid:0)(cid:0)(cid:0)(cid:0)(cid:0)(cid:0)(cid:0)(cid:0)(cid:0)
All use subject to https://about.jstor.org/terms","['0-940208-16-4', '0-9634895-1-8', '1-56280-095-7']"
