ISBN,Title,Author,Publisher,Pages,Date Published,Subjects,Binding,Synopsis,Language,Edition,Dimensions,MSRP,Image,Status,PageNumber,Volume & Issue
0-679-74008-2,Living a Political Life: One of America's First Woman Governors Tells Her Story,"Kunin, Madeleine May",Vintage,416.0,1995-03-14,,Paperback,"<p>The first time Madeleine M. Kunin ran for office it was because she thought there ought to be more women in politics. In time she fulfilled that belief by becoming the first woman governor of Vermont. Throughout her career, Kunin found that the rules for women politicians were different: she would not be forgiven (nor would she forgive herself) for neglecting her family. She could not afford to display emotion at the wrong times lest she be thought ""weak."" And she would have to learn to play political hardball with the best of them while keeping her integrity.</p>
<p>In Living a Political Life, Kunin-who is now Deputy Secretary of the U.S. Department of Education-takes a frank look at the challenges that confronted her as she tried not just to succeed in politics but to set a precedent for other women. In doing so, she illuminates both what it means to be a woman and what it means to be a public servant and gives us a memoir as thoughtful and revealing as any to emerge from the corridors of power.</p>


                        <p>One of America's first woman governors shows that women can succeed and make a difference in politics without sacrificing their values. Kunin's memoir ranges from her apprenticeship as a small-town newspaper reporter, wife, and mother, to her decision to leave state politics after almost two decades of service and achievement.
</p>",en,Reprint,"Height: 1.03543306981 Inches, Length: 8.5039369992 Inches, Weight: 0.0440924524 Pounds, Width: 5.511811018 Inches",19.0,https://images.isbndb.com/covers/00/87/9780679740087.jpg,Success,129.0,17.6
0-679-75572-1,United States: Essays 1952-1992,"Vidal, Gore",Random House,1298.0,1995-10-10,,Paperback,"From the age of Eisenhower to the dawning of the Clinton era, Gore Vidal’s <i>United States</i> offers an incomparably rich tapestry of American intellectual and political life in a tumultuous period. It also provides the best, most sustained exposure possible to the most wide-ranging, acute, and original literary intelligence of the post<i>—</i>World War II years. <i>United States</i> is an essential book in the canon of twentieth-century American literature and an endlessly fascinating work.

                        <p>Comprising more than 100 of Vidal's inimitable pieces, this National Book Award winner features the author's choice of the essays that he has written over a period of 40 years--a definitive guide to post-war America. Index.
</p>",en,,"Height: 9.25 Inches, Length: 6 Inches, Weight: 2.95 Pounds, Width: 2.25 Inches",1.99,https://images.isbndb.com/covers/57/22/9780679755722.jpg,Success,73.0,17.6
0-939643-56-1,Unspoken Hunger,Terry Tempest Williams,Northsound Music Group Inc,,1994,,Audio Cassette,,en,,,16.95,https://images.isbndb.com/covers/35/61/9780939643561.jpg,Success,54.0,17.6
0-06-105425-9,Summer Light,"Guttenberg, Elyse",HarperCollins,481.0,1995,,Paperback,,en,January,"Height: 7 Inches, Length: 4.5 Inches, Weight: 0.55 Pounds, Width: 1.5 Inches",1.99,https://images.isbndb.com/covers/42/59/9780061054259.jpg,Success,66.0,17.6
1-882587-07-3,Storm Front: A Delta Stevens Mystery,"Silva, Linda Kay",Inland Womensource,243.0,1995,,Paperback,Officer Delta Stevens has her hands full. An assassin is after District Attorney Alexandria Pendelton and an international jewel thief is plaguing Delta's beat.,en,First Edition,"Height: 8.5 Inches, Length: 5.5 Inches, Weight: 1.6 Pounds, Width: 0.5 Inches",10.95,https://images.isbndb.com/covers/70/70/9781882587070.jpg,Success,75.0,17.6
1-882587-07-3,Storm Front: A Delta Stevens Mystery,"Silva, Linda Kay",Inland Womensource,243.0,1995,,Paperback,Officer Delta Stevens has her hands full. An assassin is after District Attorney Alexandria Pendelton and an international jewel thief is plaguing Delta's beat.,en,First Edition,"Height: 8.5 Inches, Length: 5.5 Inches, Weight: 1.6 Pounds, Width: 0.5 Inches",10.95,https://images.isbndb.com/covers/70/70/9781882587070.jpg,Success,85.0,17.6
0-934971-43-9,The Adventures of Mona Pinsky,"Ziskin, Harriet",Calyx Books,168.0,1995-01-01,"Middle-aged women, Middle-aged women--Fiction, Mysticism, Mysticism--Fiction, PS3576.I5758 A65 1995, 813/.54",Paperback,"On The Eve Of Her Sixty-fifth Birthday, Mona Pinsky, A Restaurant Hostess, Overhears Men In A Booth Planning A Series Of Robberies. She Tries To Alert The Community And Is Dismissed As A Meddlesome Old Woman, So She Tackles The Matter On Her Own. By Harriet Ziskin.",en,,"Height: 9.25 Inches, Length: 6.25 Inches, Weight: 0.6 Pounds, Width: 0.5 Inches",12.95,https://images.isbndb.com/covers/14/30/9780934971430.jpg,Success,9.0,17.6
0-921833-37-7,The Tragedy Queen,"Leith, Linda",Signature Editions,204.0,1995-05-01,,Paperback,,en,1,"Height: 9.01 Inches, Length: 6.02 Inches, Weight: 0.68 Pounds, Width: 0.5 Inches",14.95,https://images.isbndb.com/covers/33/76/9780921833376.jpg,Success,61.0,17.6
0-671-50009-0,SMASHING THE GLASS CEILING,"Heim, Pat",Fireside,160.0,1995-06-01,"Businesswomen, Career development, Corporate culture, Interpersonal communication, HD6053 .H388 1995, 650.14/082",Paperback,"The Ground Rules -- Competition And Conflict: The Rules Of Engagement -- Do What The Coach Says -- How To Be A Team Player -- How To Be A Leader -- Power Talk -- Power Moves -- Making The Most Of Critism And Praise -- Getting To The Goal Line -- Winning The Game -- Your Game Plan. Pat Heim, Susan K. Golant. A Fireside Book. Previous Ed. Published Under Title: The Hardball For Women Playbook. Los Angeles : Lowell House. C1993",en,1,"Height: 8.5 Inches, Length: 5.5 Inches, Weight: 0.35 Pounds, Width: 0.5 Inches",10.0,https://images.isbndb.com/covers/00/92/9780671500092.jpg,Success,130.0,17.6
0- -9 91 18 8,,,,,,,,,,,,,,Error,5.0,17.6
0-940208-16-4,EXHIBITIONISM FOR THE SHY,"Queen, Carol",Down There Press,100.0,2015-02-25,,Paperback,"Writing for women and men of all sexual persuasions who want to enhance their sexual experience, Carol Queen offers encouragement, exercises, and resources for the reader to develop erotic confidence.",en,,"Height: 9 Inches, Length: 6 Inches, Weight: 0.85 Pounds, Width: 1 Inches",12.5,https://images.isbndb.com/covers/81/62/9780940208162.jpg,Success,78.0,17.6
0-940208-16-4,EXHIBITIONISM FOR THE SHY,"Queen, Carol",Down There Press,100.0,2015-02-25,,Paperback,"Writing for women and men of all sexual persuasions who want to enhance their sexual experience, Carol Queen offers encouragement, exercises, and resources for the reader to develop erotic confidence.",en,,"Height: 9 Inches, Length: 6 Inches, Weight: 0.85 Pounds, Width: 1 Inches",12.5,https://images.isbndb.com/covers/81/62/9780940208162.jpg,Success,82.0,17.6
0-00-647958-8,"Wedding Cakes, Rats and Rodeo Queens","Cameron, Anne",Harpercollins Canada,,1998,,Paperback,,en,First Edition,"Height: 8.25 Inches, Length: 5.5 Inches, Weight: 0.55 Pounds, Width: 0.75 Inches",16.0,https://images.isbndb.com/covers/95/81/9780006479581.jpg,Success,121.0,17.6
1-56639-308-6,All Is Never Said: The Story of Odette Harper Hines,"Rollins, Judith",Temple University Press,445.0,1995-05-23,,Paperback,"With Intelligence, Insight, And Humor, Odette Harper Hines Describes Her Life—a Life That Reversed The Pattern Of The Great Migration By Beginning In Prosperity In The Urban North And Moving Into The Small-town South. Recorded By Judith Rollins Over Eight Years, This Intimate Narrative Is An Unusual Collaboration Between Two African American Women Who Represent Two Generations Of Civil Rights Activists. Born In New York Into A Comfortable Family, Hines' Activism Began I The Abyssinian Baptist Church In Her Teens And Continued Throughout Her Life As She Witnessed The Great Depression In Harlem, Worked On The Wpa Writers Project, Became Publicity Director Of The Naacp, And Volunteered For The Red Cross In Europe During Wwii. When She Moved To Louisiana In 1946, She Continued To Challenge Racial Injustice And Risked Her Life To House Civil Rights Workers In The Early 1960s (rollins, Among Them). She Later Started And Directed The Headstart Program In Her Parish. Throughout This Narrative, Hines Describes Her Relationships With Such Figures As Mary Mcleod Bethune, Adam Clayton Powell, Walter White, Thurgood Marshall, Ella Baker, Marcus Garvey, Claude Mckay, Ralph Ellison, And Many Others. Yet Hines' Memoir Is Not Only About Her Public Life. She Courageously Reveals Her Personal Life And Private Pain. Twenty-eight Photographs— Mostly From Hines' Family Album—accuentuate This Oral History That Is, As Rollins States In Her Introduction, A Complex And Textured Portrait Of An Extraordinary Twentieth Century American Woman. Author Note:judith Rollinsis Associate Professor Of Africana Studies And Sociology At Wellesley College, And The Author Ofbetween Women: Domestics And Their Employers(temple).",en,,"Height: 9.258 Inches, Length: 6.25 Inches, Weight: 1.1 Pounds, Width: 0.75 Inches",27.95,https://images.isbndb.com/covers/30/89/9781566393089.jpg,Success,108.0,17.6
1-878967-63-X,,,,,,,,,,,,,,Error,87.0,17.6
0-06-067078-9,"Is the Homosexual My Neighbor? Revised and Updated: Positive Christian Response, A","Scanzoni, Letha Dawson, Mollenkott, Virginia Ramey",HarperOne,256.0,1994-03-24,"Homosexuality--Religious aspects--Christianity, Christianity, Homosexuality, BR115.H6 S3 1994, BR 115.H6 S283i 1994, 261.8/35766",Paperback,"<p>A classic work of gay spirituality—newly revised to reflect today's issues, including gays in the military, the AIDS crisis, and genetic research on homosexuality.</p>",en,Revised ed.,"Height: 0.65 Inches, Length: 8.1 Inches, Weight: 0.52470018356 Pounds, Width: 5.3 Inches",12.76,https://images.isbndb.com/covers/07/88/9780060670788.jpg,Success,125.0,17.6
0-04-440900-1,"Women, Sex and Rock 'n' Roll: In Their Own Words (A Pandora Book)","Evans, Liz",Pandora Press,276.0,1994-01-01,"Women Rock Musicians, Interviews, Musicparticipation Ofwomen",Paperback,,en,2nd,"Height: 8.5 Inches, Length: 5.5 Inches, Weight: 1.00089866948 Pounds, Width: 0.75 Inches",14.0,https://images.isbndb.com/covers/90/07/9780044409007.jpg,Success,122.0,17.6
0-679-44181-6,Art and Lies: A Piece for Three Voices and a Bawd,"Winterson, Jeanette",Alfred A Knopf Inc,206.0,1995-03-14,"Fiction, Espionage",Hardcover,,en,First Edition,"Height: 8.75 Inches, Length: 6.25 Inches, Weight: 1.0875 Pounds, Width: 1.25 Inches",0.0,https://images.isbndb.com/covers/18/16/9780679441816.jpg,Success,128.0,17.6
0-684-80073-X,Failing At Fairness: How Our Schools Cheat Girls,"Sadker, Myra, Sadker, David",Scribner,368.0,1995-03-01,Education - General & Miscellaneous,Paperback,"<p><i>Failing at Fairness,</i> the result of two decades of research, shows how gender bias makes it impossible for girls to receive an education equal to that given to boys.</p><ul><li>Girls' learning problems are not identified as often as boys' are</li><li>Boys receive more of their teachers' attention</li><li>Girls start school testing higher in every academic subject, yet graduate from high school scoring 50 points lower than boys on the SAT</li></ul><p> Hard-hitting and eye-opening, <i>Failing at Fairness</i> should be read by every parent, especially those with daughters.</p>",en,"1st Touchstone Edition, 1995","Height: 9.2 Inches, Length: 6.1429 Inches, Weight: 0.80027801106 Pounds, Width: 1.1 Inches",16.75,https://images.isbndb.com/covers/07/38/9780684800738.jpg,Success,131.0,17.6
0-297-81369-2,Writing on the Wall: Women Writers on Women Artists,"Collins, Judith",Weidenfeld & Nicolson Ltd,146.0,1993,,Paperback,"Edited By Judith Collins And Elsbeth Lindner. ... Twenty Women Writers ... Write About Their Favourite Work Of Art By A Female Artist In The Tate Gallery -- Pref., P. Vii. Issued In Conjunction With The Exhibition Writing On The Wall Held At The Tate Gallery. Includes Bibliographical References.",en,First Edition,"Height: 9.75 Inches, Length: 7.5 Inches, Weight: 1.09349281952 Pounds, Width: 0.5 Inches",24.95,https://images.isbndb.com/covers/36/99/9780297813699.jpg,Success,63.0,17.6
0-14-017567-9,The Courage to Raise Good Men: You Don't Have to Sever the Bond with Your Son to Help Him Become a Man,"Silverstein, Olga, Rashbaum, Beth",Penguin Books,288.0,1995-03-01,,Paperback,"<p>""Challenging and readable...will help mothers understand the implications of pushing boys out of the family before they're ready to go.""—<i>The Los Angeles Times Book Review</i>.</p>


                        <p>Silverstein, one of the founding members of the Ackerman Institute for Family Therapy, calls for mothers and fathers alike to refuse to sanction the emotional shutdown we traditionally demand of boys, thus enabling sons to grow up to be not only strong men but whole people.
</p>",en,Reprint,"Height: 7.7 Inches, Length: 5.1 Inches, Weight: 0.50044933474 Pounds, Width: 0.6 Inches",16.0,https://images.isbndb.com/covers/56/77/9780140175677.jpg,Success,127.0,17.6
0-312-85800-0,Shadow Man,"Scott, Melissa",Tor Books,320.0,1995,"Gender identity, Gender identity--Fiction, PS3569.C672 S48 1995, 813/.54",Hardcover,"The Struggle For Sexual Liberation In Space Where There Are Five Genders: Men, Women, Herms, Fems And Mems. It's A Side-effect Of Medicine People Take To Control Space Sickness. But One Conservative Planet Only Recognizes The First Two And A Revolt Begins. Melissa Scott. A Tom Doherty Associates Book.",en,First Edition,"Height: 8.75 Inches, Length: 5.75 Inches, Weight: 1 Pounds, Width: 1.25 Inches",0.0,https://images.isbndb.com/covers/80/01/9780312858001.jpg,Success,66.0,17.6
0-06-017151-0,A Feather on the Breath of God: A Novel,"Nunez, Sigrid",HarperCollins,180.0,1995,"Fiction, General",Hardcover,,en,First Edition,"Height: 7.75 Inches, Length: 5.25 Inches, Weight: 0.65 Pounds, Width: 0.75 Inches",0.0,https://images.isbndb.com/covers/15/13/9780060171513.jpg,Success,120.0,17.6
962-7255-14-9,Selected Poems (Renditions paperbacks),"Ting, Shu",Cheng & Tsui Co,136.0,1994-12-06,"Translations into EnglishShu, Ting , 1952-, PL2901.T56 A24 1994",Paperback,"By Shu Ting ; [translators, Eva Hung ... Et Al.].",en,,"Height: 8.5 Inches, Length: 5.75 Inches, Width: 0.25 Inches",85.0,https://images.isbndb.com/covers/51/47/9789627255147.jpg,Success,100.0,17.6
0-679-42023-1,Moo,"Smiley, Jane",Alfred A. Knopf,414.0,1995-03-21,"College stories, Universities and colleges, Universities and colleges--United States--Fiction, PS3569.M39 M66 1995, 813/.54",Hardcover,"A Satire On University Life, Describing The Rackets And The Intellectual Dishonesty That Goes On. The Setting Is The U Of Moo Where Research Into The Destruction Of Rain Forests Is Tailored To Suit The Corporation Funding The Project. By The Author Of A Thousand Acres. Jane Smiley.",en,First Edition,"Height: 10 Inches, Length: 6.75 Inches, Weight: 1.7688 Pounds, Width: 1.25 Inches",0.0,https://images.isbndb.com/covers/02/31/9780679420231.jpg,Success,128.0,17.6
0-88496-392-6,The House Spirit: And Other Stories,"Okamoto, Kanoko",Capra Pr,156.0,1995,"Translations into EnglishOkamoto, Kanoko , 1889-1939, Okamoto, Kanoko , 1889-1939, Authors, Japanese, Authors, Japanese--20th century--Biography, PL835.K3 A27 1995, 895.6/344",Paperback,"Kanoko Okamoto Was One Of The Most Prominent Writers Of Pre-war Japan. The Elegant And Impressionistic Stories Were Written And Published During The Last Three Years Of Her Life, And Have Recently Been Re-issued In Her Homeland. As A Young Woman Okamoto Dedicated Herself To The Pursuit Of Literature. Her Metier Was The Poetic Form, Tanka, Which She Used To Express Passionate Feelings Of Love Or Hate, Joy Or Sorrow. By The Time Of Her European Travels In The Early '30s Her Reputation As A Poet Was Well Established. Upon Her Return To Japan, Okamoto Began Writing Stories And Novellas. Choosing The Theme Of Conflict Between Tradition And The Individual, She Used Simple Description To Prepare The Reader For The Inner Emotional Drama Which Stirred At The Core Of Her Writing. The Translator's Biographical Essay Offers Special Insight Into The Passionate And Complicated Life Which Generated Okamoto's Stories. Sushi -- The Old Geisha (rogi Sho) -- North Country (michinoku) -- The House Spirit -- The River. Kanoko Okamoto ; Translated And With A Biographical Sketch By Kazuko Sugisaki.",en,,"Height: 7.5 Inches, Length: 5.5 Inches, Weight: 0.45 Pounds, Width: 0.5 Inches",10.95,https://images.isbndb.com/covers/39/29/9780884963929.jpg,Success,11.0,17.6
0-931055-99-7,Rattling Those Dry Bones,"Hagen, June Steffensen",Publishing/Editing Network,221.0,1995,"Christian biography, Christian biography--United States, Women in Christianity, Women in Christianity--United States, BR1713 .R37 1995, 277.3/0825/0922 B",Paperback,"Bones / Madeleine L'engle. -- Prospecting / Shirley Nelson. -- The Communion Of Saints And Sinners / Nancy A. Hardesty. -- The Fire Of Holiness / Rosemary Haughton. -- Muffins On Tuesdays / Pamela W. Darling. -- The Wind Shifts / S. Sue Horner. -- Homecoming / Joyce Quiring Erickson. -- Under The Mantle Of Mercy / Janet Ruffing. -- The Rhythm Of Renewal / Marjory Zoet Bankson. -- For Me, God Is / Laura E. Wright. -- In The Middle / Mary E. (polly) Wheat. -- Gardening For Survival / Ellen Kirby. -- Have Some More, Darlings! There's Plenty! / Margaret Guenther. -- Why Would A Self- Respecting Feminist Be A Christian? / Patricia Wilson-kastner. -- From Crisis To Creative Energy / Susan Cole. -- Spirituality Is About Survival / Marie M. Fortune. -- On The Verge Of Giving Birth / Carmen Guerrero. -- Radical Trust / Anne Clarke Brown. -- Surviving The Second Great Reformation /virginia Ramey Mollenkott. -- Taking The Incarnate God Seriously / Elisabeth Moltmann-wendel. -- Lead Us Not Into Temptation / Mary E. Hunt. -- Spirit Of God, You Can Make Us Live! / Toinette M. Eugene. Edited By June Steffensen Hagen. Includes Bibliographical References (p. 218-221).",en,,"Height: 9 Inches, Length: 6 Inches, Weight: 0.79 Pounds, Width: 0.75 Inches",16.95,https://images.isbndb.com/covers/59/97/9780931055997.jpg,Success,100.0,17.6
0-8070-0934-2,My Soul Is a Witness: African-American Women's Spirituality,,Beacon Pr,370.0,1995,"African Americans--Religion, Women--Religious life, Spiritual life, African American women--Religious life, BL625.2 .M8 1995, 277.3/082/08996073",Hardcover,"My Soul Is A Witness Is A Powerful Testament To The Importance Of Religion And Spirituality In Die Lives Of African-american Women. Through Essays, Poetry, Prayer, And Song, Women Of The African-american Community Celebrate The Power Of The Spirit And Their Connections Through It. We Learn Of Mothers Who Bequeath Their Daughters The Strength For Living That Comes From Deep Faith; Daughters From Whose Love For The Spirit Emerges A Love For Themselves And Their Worth As Human Beings; Women Whose Prayers To The Spirit Release Them From The Pain And Weight Of Past Betrayals. From The Church Of Aretha To Marie Laveau, Voudou Queen, The Spirit Is Present In All Forms Of Worship, Working Among All Women.--jacket. 1. Boarding The Old Ship Of Zion; Witnessing Our Mother's Faith -- 2. Testifying: The Spiritual Anchor In African-american Culture -- 3. Challenging Traditions: A New Baptism In The Spirit -- 4. Praying At Different Altars, Singing Different Songs: African-american Women Across Denominations And Faiths -- 5. Invoking The Spirit: The Healing Power Of Affirmations And Rituals. Edited By Gloria Wade-gayles. Includes Bibliographical References And Index.",en,,"Height: 9.25 Inches, Length: 6.75 Inches, Weight: 1.55 Pounds, Width: 1.5 Inches",1.99,https://images.isbndb.com/covers/93/45/9780807009345.jpg,Success,117.0,17.6
0-88677-639-2,Northlight,"Wheeler, Deborah",DAW,352.0,1995-02-01,"Fiction, Science Fiction",Paperback,,en,First Mass Market Paperback,"Height: 5 Inches, Length: 7 Inches, Weight: 0.45 Pounds, Width: 1 Inches",4.99,https://images.isbndb.com/covers/63/98/9780886776398.jpg,Success,65.0,17.6
0-920953-87-5,A Very Large Soul: Selected Letters of Margaret Laurence,,Cormorant Books,1.0,1995-11-01,"CorrespondenceLaurence, Margaret, Novelists, Canadian--Correspondence, Novelists, Canadian--20th century--Correspondence, PR9199.3.L33 Z48 1995, 813/.54 B",Paperback,Edited With A Preface And Introduction By J.a. Wainwright. Includes Bibliographical References: P. 249-264.,en,First Edition,"Height: 8.46 Inches, Length: 5.52 Inches, Width: 0.5 Inches",1.99,https://images.isbndb.com/covers/38/77/9780920953877.jpg,Success,60.0,17.6
0-7484-0281-0,Changing The Subject: Women In Higher Education,"Davies, Sue, Lubelska, Cathy., Quinn, Jocey.",Taylor & Francis,224.0,1994,"Women, Education (higher), Feminism And Education",Hardcover,,en,1,,145.0,https://images.isbndb.com/covers/28/16/9780748402816.jpg,Success,107.0,17.6
1-56455-263-2,The Good Life Of Helen Nearing,Helen Nearing,"Sounds True, Incorporated",,1994,,Audio Cassette,,en,,,10.95,https://images.isbndb.com/covers/26/31/9781564552631.jpg,Success,54.0,17.6
1-56023-868-1,,,,,,,,,,,,,,Error,126.0,17.6
0-571-19866-X,His: Brilliant New Fiction by Gay Writers,,Faber & Faber,254.0,1995,"Short Story Anthologies, Peoples & Cultures - American Anthologies, Gay & Lesbian Literature Anthologies, Gay & Lesbian Fiction",Paperback,,en,,"Height: 9.25 Inches, Length: 6.25 Inches, Weight: 0.83555197298 Pounds, Width: 0.75 Inches",0.0,https://images.isbndb.com/covers/86/65/9780571198665.jpg,Success,72.0,17.6
0-571-19866-X,His: Brilliant New Fiction by Gay Writers,,Faber & Faber,254.0,1995,"Short Story Anthologies, Peoples & Cultures - American Anthologies, Gay & Lesbian Literature Anthologies, Gay & Lesbian Fiction",Paperback,,en,,"Height: 9.25 Inches, Length: 6.25 Inches, Weight: 0.83555197298 Pounds, Width: 0.75 Inches",0.0,https://images.isbndb.com/covers/86/65/9780571198665.jpg,Success,117.0,17.6
0-679-75661-2,"Breath, Eyes, Memory","Danticat, Edwidge",Vintage,234.0,1995-03-28,"Haitian Americans, Haitian Americans--New York (State)--New York--Fiction, Haitian Americans--Travel, Haitian Americans--Travel--Haiti--Fiction, Women, Women--New York (State)--New York--Fiction, Americans, Americans--Haiti--Fiction, Women travelers, Women travelers--Fiction, PS3554.A5815 B74 1995, 813/.54",Paperback,"At The Age Of Twelve, Sophie Caco Is Sent From The Impoverished Village Of Croix-des-rosets To New York To Be Reunited With Her Mother, Where She Gains A Legacy Of Shame That Only Be Healed When She Returns To Haiti, To The Woman Who First Reared Her. Edwidge Danticat.",en,First Edition,"Height: 8 Inches, Length: 0.5 Inches, Weight: 0.2 Pounds, Width: 5 Inches",0.0,https://images.isbndb.com/covers/66/13/9780679756613.jpg,Success,129.0,17.6
0-931055-80-6,"I Asked for Intimacy: Stories of Blessings, Betrayals, and Birthings","Weems, Renita J.",Publishing/Editing Network,128.0,1993,,Paperback,Renita J. Weems. Includes Bibliographical References.,en,,"Height: 7 Inches, Length: 5.75 Inches, Weight: 0.45 Pounds, Width: 0.25 Inches",12.95,https://images.isbndb.com/covers/58/05/9780931055805.jpg,Success,91.0,17.6
1-878448-57-9,Changing Woman Changing Work,"Krebs, Nina Boyd",Macmurray & Beck Communication,,1995,,Paperback,,en,,"Height: 9 Inches, Length: 6.5 Inches, Width: 1.25 Inches",16.95,https://images.isbndb.com/covers/85/76/9781878448576.jpg,Success,20.0,17.6
0-553-09600-1,What It's Like to Live Now,"Maran, Meredith",Bantam,338.0,1995-03-01,"Maran, Meredith, Lesbians, Lesbians--California--San Francisco--Biography, Lesbian mothers, Lesbian mothers--California--San Francisco--Biography, Divorced mothers, Divorced mothers--California--San Francisco--Biography, Radicals, Radicals--California--San Francisco--Biography, HQ75.4.M327 A3 1995, 306.874/3/092",Hardcover,What It's Like To Love Now. First Date With Ann. -what It's Like To Stay Alive Now. Biopsy. -what It's Like To Pursue Happiness Now. Jewish To Buddhist And Back. Therapy Dreams. -what It's Like To Change The World Now. Election. Will Work For Food. Bring The War Home. Meredith Maran.,en,First Edition,"Height: 9.25 Inches, Length: 6.5 Inches, Weight: 1.3007273458 Pounds, Width: 1.5 Inches",0.0,https://images.isbndb.com/covers/60/02/9780553096002.jpg,Success,115.0,17.6
