ISBN,Title,Author,Publisher,Pages,Date Published,Subjects,Binding,Synopsis,Language,Edition,Dimensions,MSRP,Image,Status,PageNumber,Volume & Issue
,,,,,,,,,,,,,,Error,,21.2
0-553-37961-5,Into the Forest,Jean Hegland,Dial Press,241.0,1998,,Paperback,"<p>in The Tradition Of Margaret Atwood's <i>the Handmaid's Tale</i> And Doris Lessing's <i>the Golden Notebook</i>, Jean Hegland's Fiction Debut Is A Tale Of Two Young Women Coping In The Aftermath Of The Apocalypse. As Anarchy And Disease Ravage The Country, Eva And Nell, Orphaned Sisters Living In The Remote Redwood Forests Of Northern California, Must Learn To Survive In An Age Of Fear, Superstition, And Hunger, And To Lay The Foundations For The Rebirth Of Civilization.</p><h3>publishers Weekly</h3><p>hegland's Powerfully Imagined First Novel Will Make Readers Thankful For Telephones And Cd Players While It Underscores The Vulnerability Of Lives Dependent On Technology. The Tale Is Set In The Near Future: Electricity Has Failed, Mail Delivery Has Stopped And Looting And Violence Have Destroyed Civil Order. In Northern California, 32 Miles From The Closest Town, Two Orphaned Teenage Sisters Ration A Dwindling Supply Of Tea Bags And Infested Cornmeal. They Remember Their Mother's Warnings About The Nearby Forest, But As The Crisis Deepens, Bears And Wild Pigs Start To Seem Less Dangerous Than Humans. From The First Page, The Sense Of Crisis And The Lucid, Honest Voice Of The 17-year-old Narrator Pull The Reader In, And The Fight For Survival Adds An Urgent Edge To Her Coming-of-age Story. Flashbacks Smartly Create A Portrait Of The Lost Family: An Iconoclastic Father, Artistic Mother And Two Independent Daughters. The Plot Draws Readers Along At The Same Time That The Details And Vivid Writing Encourage Rereading. Eating A Hot Dog Starts With The Pillowy Give Of The Bun, And The Winter Rains Are Great Silver Needles Stitching The Dull Sky To The Sodden Earth. If Sometimes The Lyricism Goes A Little Too Far, This Is Still A Truly Admirable Addition To A Genre Defined By The Very High Standards Of George Orwell's <i>1984<i> And Russell Hoban's <i>ridley Walker</i>. (july)</p>",en,Reprint,"Height: 8.25 Inches, Length: 5.2 Inches, Weight: 0.43 Pounds, Width: 0.55 Inches",17.0,https://images.isbndb.com/covers/96/17/9780553379617.jpg,Success,134.0,21.2
1-57601-036-8,I Shall Wear Purple,,Papier Mache Pr,64.0,1998,,Hardcover,,en,Gift,"Height: 5 Inches, Length: 3.75 Inches, Weight: 0.18077905484 Pounds, Width: 0.75 Inches",6.95,https://images.isbndb.com/covers/03/65/9781576010365.jpg,Success,49.0,21.2
1-57601-036-8,I Shall Wear Purple,,Papier Mache Pr,64.0,1998,,Hardcover,,en,Gift,"Height: 5 Inches, Length: 3.75 Inches, Weight: 0.18077905484 Pounds, Width: 0.75 Inches",6.95,https://images.isbndb.com/covers/03/65/9781576010365.jpg,Success,112.0,21.2
1-56656-265-1,Forced to Grow,"Magona, Sindiwe",Interlink,232.0,1998-11,"Magona, Sindiwe , Biography, Women authors, South African, Women authors, South African--20th century--Biography, Women teachers, Women teachers--South Africa--Biography, Single-parent families, Single-parent families--South Africa, PR9369.3.M335 Z466 1998, PR9369.3.M335 Z466 1997, 823 B",Paperback,Sindiwe Magona.,en,First American Edition,"Height: 7.99 Inches, Length: 5.23 Inches, Weight: 0.62 Pounds, Width: 0.72 Inches",12.43,https://images.isbndb.com/covers/26/52/9781566562652.jpg,Success,120.0,21.2
0-7649-0478-7,Cal 99 Women Who Dare Calendar,Library of Congress,Pomegranate,,1998,,Calendar,,en,,"Height: 12.75 Inches, Length: 13.25 Inches, Weight: 0.65 Pounds, Width: 0.25 Inches",12.95,https://images.isbndb.com/covers/47/83/9780764904783.jpg,Success,66.0,21.2
0-385-49180-8,Crooked Little Heart: A Novel,"Lamott, Anne",Anchor,326.0,1998-05-18,,Paperback,"<p>With the same winning combination of humor and honesty that marked her recent nonfiction bestsellers, Operating Instructions and Bird by Bird, Anne Lamott's new novel gives us an exuberant, richly absorbing portrait of a family for whom the joys and sorrows of everyday life are magnified under the glare of the unexpected.<p>Rosie Ferguson, in the first bloom of young womanhood, is obsessed with tournament tennis. Her mother is a recovering alcoholic still grieving the death of her first husband; her stepfather, a struggling writer, is wrestling with his own demons. And now Rosie finds that her athletic gifts, once a source of triumph and escape, place her in peril, as a shadowy man who stalks her from the bleachers seems to be developing an obsession of his own...</p><h3>Publishers Weekly</h3><p>Before she won deserved acclaim for her two recent nonfiction books, Operating Instructions and Bird by Bird, Lamott wrote Rosie, an enchanting novel whose eponymous protagonist is a nine-year-old girl whose father dies suddenly and whose mother becomes an alcoholic. In revisiting the characters and idyllic Northern California setting of that book, Lamott again demonstrates her irrepressible, edgy humor and a new, deeper understanding of psychological nuance. Rosie Ferguson is now 13 and a rising star in the teenage tennis circuit, playing doubles with her best friend, Simone. Her mother, Elizabeth, who loves Rosie fiercely but who often can't cope, has married writer James. and a warm extended family of friends-Rae and Lank and the elderly Adderlys-cherish Rosie. But wrapped up in their own problems, the adults in her life unwittingly fail Rosie at a critical time in her adolescence. Remote and neurotic Elizabeth, takes to her bed in depression; Jack is absorbed in his new book; Charles Adderly is dying. Skinny, undeveloped Rosie has the familiar self-conscious adolescent insecurities and yearnings to be part of the in-crowd. Her tensions mount when Simone is seduced and becomes pregnant, with Rosie her sole confidante. Suddenly, the only constant person in Rosie's life is Luther, a menacing drifter who follows her from tournament to tournament. Thus, he is the only one who knows Rosie's most dreadful secret: that she has become a compulsive cheater on the tennis court. With a sureness of narrative control and a maturity of vision, Lamott underplays the drama here by maintaining a leisurely pace with numerous scenes of domestic minutiae. But her restraint pays off in credibility: she writes with integrity and tenderness of the failure of parental love to protect children, and of the resilience that helps children step over the threshold to maturity.Simultaneous audio; author tour. (Apr.)</p>",en,Reprint,"Height: 7.93 Inches, Length: 5.16 Inches, Weight: 0.62390820146 Pounds, Width: 0.73 Inches",11.12,https://images.isbndb.com/covers/18/08/9780385491808.jpg,Success,134.0,21.2
0-679-78103-X,Southern Selves: From Mark Twain and Eudora Welty to Maya Angelou and Kaye Gibbons A Collection of Autobiographical Writing,"Watkins, James",Vintage,377.0,1998-07-28,"U.S. Authors - General & Miscellaneous - Literary Biography, U.S. Authors - 20th Century - Literary Biography",Paperback,"<p>&nbsp; The memoirist seek to capture not just a self but an entire world, and in this marvelous anthology thirty-one of the South's finest writers-writers like Kaye Gibbons and Reynolds Price, Eudora Welty and Harry Crews, Richard Wright and Dorothy Allison-make their intensely personal contributions to a vibrant collective picture of southern life.</p><p>In the hands of these superb artists, the South's rich tradition of storytelling is brilliantly revealed. Whether slave or master, intellectual or redneck, each voice in this moving and unforgettable collection is proof that southern literature richly deserves its reputation for irreverent humor, exquisite language, a feeling for place, and an undying, often heartbreaking sense of the past.</p>",en,First Edition,"Height: 0.99606299111 Inches, Length: 7.9921259761 Inches, Weight: 0.0220462262 Pounds, Width: 4.9999999949 Inches",0.0,https://images.isbndb.com/covers/10/35/9780679781035.jpg,Success,142.0,21.2
0-9659873-0-2,Birthing from Within: An Extra-Ordinary Guide to Childbirth Preparation,"England, Pam, Horowitz, Rob",Partera Press,331.0,1998-07-01,,Paperback,"<p><P>Here is a holistic approach to childbirth that examines this profound rite-of-passage not as a medical event but as an act of self-discovery. Exercises and activities such as journal writing, meditation, and painting will help mothers analyze their thoughts and face their fears during pregnancy. For use during birth, the book offers proven techniques for coping with labor pain without drugs, a discussion of the doctor or midwife&#8217;s role, and a look at the father&#8217;s responsibilities. Childbirth education should also include what to expect after the baby is born. Here are baby basics, such as how to bathe a newborn, how to get the little one to sleep, and tips for getting nursing off to a good start. Pregnancy, birth, and postpartum is a process of continuous learning and adjustment; <i>Birthing From Within</i> provides the necessary support and education to make each phase of birthing a rewarding experience.</p> <h3>Library Journal</h3> <p>England, a registered nurse and certified nurse midwife, developed the ""birthing from within"" approach in a series of birthing classes to help mothers reclaim and celebrate the spiritual, emotional, and psychological aspects of birth as a rite of passage. Her book is a collection of methods that have been used for class participants. England is quick to point out that this ""is not a script or a rigid method,"" and she encourages parents and professionals to use those portions that are helpful. There are numerous exercises and activities to help parents, especially mothers, be in contact with their bodies and feelings. The author recommends throughout that the mother and her healthcare professional work together, giving numerous suggestions for making this a successful partnership. England has done a fair amount of research and does include numerous references; at the same time, she makes it a very personal book. It will appeal especially to patrons interested in alternative birthing methods. For large consumer health/patient education collections. [For another title recommending a more spiritual approach to childbirth, see Ronald L. Cole's The Gentle Greeting, LJ 6/1/98.--Ed.]--Mary J. Jarvis, Methodist Hosp. Medical Lib., Lubbock, TX</p>",en,First Edition,"Height: 10 Inches, Length: 7 Inches, Weight: 1.5652820602 Pounds, Width: 0.6 Inches",19.95,https://images.isbndb.com/covers/73/01/9780965987301.jpg,Success,124.0,21.2
0-9660258-8-1,I Was Seven in '75,"Forney, Ellen",Fantagraphics,64.0,2001-08-01,,Paperback,,en,,"Height: 5.5 Inches, Length: 5.5 Inches, Weight: 0.25 Pounds, Width: 0.3 Inches",8.74,https://images.isbndb.com/covers/58/80/9780966025880.jpg,Success,107.0,21.2
1-56455-589-5,Piercing the Veil: Crossing into the Mystical Realm,"Burnham, Sophy","Sounds True, Incorporated",,1998-01-01,,Audio Cassette,,en,,"Height: 7.25 inches, Length: 4.5 Inches, Weight: 0.50044933474 Pounds, Width: 1.5 inches",24.95,https://images.isbndb.com/covers/58/92/9781564555892.jpg,Success,72.0,21.2
0-345-41773-9,Passing Remarks,"Hodgman, Helen",Ballantine Books,215.0,1998-05-12,"Lesbians, Fiction",Paperback,,en,Reprint,"Height: 8.5 Inches, Length: 5.5 Inches, Weight: 0.45 Pounds, Width: 0.75 Inches",11.0,https://images.isbndb.com/covers/77/32/9780345417732.jpg,Success,133.0,21.2
0-312-86578-3,Black Wine,"Dorsey, Candas Jane",Tor Books,288.0,1997-11-15,,Paperback,"Why is there an old woman, in a hanging cage for punishment, keeping a journal written in blood? Candas Jane Dorsey has written an ambitious, feminist novel about women coming to terms with their identity in a barbarous fantasy world. Dorsey's women travel across the world, from the slave dens to the merchant cities, across seas by ship and by dirigible, to isolated mountain villages and back again. ""But there remains provocative ambiguity as the story progresses. There is a woman exiled from her family, a mother who has abandoned her daughter, an old woman in a cage, a young women slave on a lord's estate who does not remember her past. How many of them are the same woman?",en,First Edition,"Height: 8.22 Inches, Length: 5.52 Inches, Weight: 0.70106999316 Pounds, Width: 0.755 Inches",13.95,https://images.isbndb.com/covers/57/88/9780312865788.jpg,Success,46.0,21.2
0-316-24625-5,Don't Tell the Grown-Ups: The Subversive Power of Children's Literature,"Lurie, Alison",Back Bay Books,256.0,1998-07-20,,Paperback,"This Collection Of Essays Probes The Ways In Which Classic Children's Literature Tends To Undermine, Rather Than Support, Respectable Adult Values. Subversive Children's Literature -- Folktale Liberation -- Fairy Tale Fiction : Fitzgerald To Updike -- Braking For Elves: Fashionable Folklore For Adults -- Child Who Followed The Piper: Kate Greenaway -- Tales Of Terror : Mrs. Clifford -- Ford Madox Ford's Fairy Tales -- Animal Liberation : Beatrix Potter -- Modern Magic : E. Nesbit -- Boy Who Couldn't Grow Up : James Barrie -- Happy Endings : Frances Hodgson Burnett -- Back To Pooh Corner : A.a. Milne -- Heroes For Our Time : J.r.r. Tolkien And T.h. White -- Power Of Smokey : Richard Adams -- Games Of Dark : William Mayne -- Folklore Of Childhood. Alison Lurie. Originally Published: Boston : Little, Brown And Company, 1990 With The Subtitle Subversive Children's Literature. Includes Bibliographical References (p. 217-222) And Index.",en,Reprint,"Height: 8.5 Inches, Length: 6 Inches, Weight: 0.6 Pounds, Width: 0.75 Inches",18.99,https://images.isbndb.com/covers/62/55/9780316246255.jpg,Success,137.0,21.2
0-943219-15-9,Living Chicana Theory,"Trujillo, Carla",Third Women Pr,448.0,1997,,Paperback,"Power And Knowledge : Colonialism In The Academy / Teresa Córdova -- Speaking Secrets : Living Chicana Theory / Deena J. González -- Woman Of No Consequence Una Mujer Cualquiera / Sandra Cisneros -- Irigaray's Female Symbolic In The Making Of Chicana Lesbian Sitios Y Lenguas (sites And Discourse) / Emma Pérez -- Voices From The Couch : The Co-creation Of A Chicana Psychology / Yvette G. Flores-ortiz -- Chingon Politics Die Hard : Reflections On The First Chicano Activist Reunion / Elizabeth Martínez -- Politics Of Location Of The Tenth Muse Of America : An Interview With Sor Juan Ines De La Cruz / Alicia Gaspar De Alba -- Free At Last / Cherríe Moraga -- Esperitus Siguen Hablando : Chicana Spiritualities / Lara Medina -- Virgen De Guadalupe And Her Recontruction In Chicana Lesbian Desire / Carla Trujillo -- Border Perspectives Desde Las Fronteras : A Reading On Rosario Sanmiguel's El Reflejo De La Luna / María Socorro Tabuenca C. -- To(o) Queer The Writer, Loca, Escritora Y Chicana / Gloria Anzaldúa -- Laying It Bare : The Queer/colored Body In Photography By Laura Aguilar / Yvonne Yarbro-bejarano -- Tomboy / Monica Palacios -- History And The Politics Of Violence Against Women / Antonia I. Castaẽda -- Silence Of The Obejas : Evolution Of Voice In Alma Villanueva's Mother, May I And Sandara Cisnero's Woman Hollering Creek / Verńica A. Guerra -- Mestizaje As Method : Feminists-of-color Challenge The Canon / Chéla Sandoval -- Chicana Feminism : In The Tracks Of The Native Woman / Norma Alarcón -- Politics Of Sexuality In The Gender Subordination Of Chicanas / Aída Hurtado -- Listening To The Silences In Latina/chicana Lesbian History / Yolanda Chávez Leyva -- Mother's Day / Barbara Renaud González. Edited By Carla Trujillo. Includes Bibliographical References.",en,1,"Height: 8.75 Inches, Length: 5.75 Inches, Weight: 1.85 Pounds, Width: 1 Inches",24.95,https://images.isbndb.com/covers/91/58/9780943219158.jpg,Success,113.0,21.2
0-943219-15-9,Living Chicana Theory,"Trujillo, Carla",Third Women Pr,448.0,1997,,Paperback,"Power And Knowledge : Colonialism In The Academy / Teresa Córdova -- Speaking Secrets : Living Chicana Theory / Deena J. González -- Woman Of No Consequence Una Mujer Cualquiera / Sandra Cisneros -- Irigaray's Female Symbolic In The Making Of Chicana Lesbian Sitios Y Lenguas (sites And Discourse) / Emma Pérez -- Voices From The Couch : The Co-creation Of A Chicana Psychology / Yvette G. Flores-ortiz -- Chingon Politics Die Hard : Reflections On The First Chicano Activist Reunion / Elizabeth Martínez -- Politics Of Location Of The Tenth Muse Of America : An Interview With Sor Juan Ines De La Cruz / Alicia Gaspar De Alba -- Free At Last / Cherríe Moraga -- Esperitus Siguen Hablando : Chicana Spiritualities / Lara Medina -- Virgen De Guadalupe And Her Recontruction In Chicana Lesbian Desire / Carla Trujillo -- Border Perspectives Desde Las Fronteras : A Reading On Rosario Sanmiguel's El Reflejo De La Luna / María Socorro Tabuenca C. -- To(o) Queer The Writer, Loca, Escritora Y Chicana / Gloria Anzaldúa -- Laying It Bare : The Queer/colored Body In Photography By Laura Aguilar / Yvonne Yarbro-bejarano -- Tomboy / Monica Palacios -- History And The Politics Of Violence Against Women / Antonia I. Castaẽda -- Silence Of The Obejas : Evolution Of Voice In Alma Villanueva's Mother, May I And Sandara Cisnero's Woman Hollering Creek / Verńica A. Guerra -- Mestizaje As Method : Feminists-of-color Challenge The Canon / Chéla Sandoval -- Chicana Feminism : In The Tracks Of The Native Woman / Norma Alarcón -- Politics Of Sexuality In The Gender Subordination Of Chicanas / Aída Hurtado -- Listening To The Silences In Latina/chicana Lesbian History / Yolanda Chávez Leyva -- Mother's Day / Barbara Renaud González. Edited By Carla Trujillo. Includes Bibliographical References.",en,1,"Height: 8.75 Inches, Length: 5.75 Inches, Weight: 1.85 Pounds, Width: 1 Inches",24.95,https://images.isbndb.com/covers/91/58/9780943219158.jpg,Success,115.0,21.2
0-312-18642-8,Only Flesh and Bones (Em Hansen Mysteries),"Andrews, Sarah",Minotaur Books,336.0,1998-05-15,,Hardcover,,en,First Edition,"Height: 8.56 Inches, Length: 5.76 Inches, Weight: 1.15 Pounds, Width: 1.145 Inches",23.95,https://images.isbndb.com/covers/64/25/9780312186425.jpg,Success,106.0,21.2
0-15-100350-5,Like: A Novel,"Smith, Ali",Harcourt,344.0,1998-08-15,"Female Friendship, Adolescence",Hardcover,"<p>When we meet Amy Shone, she is a young parent struggling to raise Kate, a precocious eight-year-old. Amy is an enigma-a brilliant scholar who has forgotten how to read. She is estranged from her wealthy English parents and lives a nomadic life in Scotland, dragging Kate from one school to the next, barely scraping by. And then there is Ash, a fiery Scottish actresss who cannot shake her demons-chief among them an unrequited passion for Amy that has obsessed her ever since they met as teenagers. Like is the story of two parallel lives that intersect briefly, then diverge. It is also a timeless evocation of adolescence and its agonizing anticipations, its contradictory yearnings for freedom and safety, its blind quest for mastery over pleasure and pain. Deftly constructed, passionately imagined, Like is a remarkably mature debut for a powerful young talent.</p>",en,First Edition,"Height: 8.5 Inches, Length: 6 Inches, Weight: 1 Pounds, Width: 1.25 Inches",24.0,https://images.isbndb.com/covers/35/01/9780151003501.jpg,Success,136.0,21.2
1-56740-189-9,"Dead to Rights (Joanna Brady Mysteries, Book 4)","Jance, J. A.",Paperback Nova Audio Books,,1997-09-01,,Audio Cassette,,en,Abridged,"Height: 7 Inches, Length: 4.5 Inches, Weight: 0.3 Pounds, Width: 0.75 Inches",7.99,https://images.isbndb.com/covers/18/99/9781567401899.jpg,Success,71.0,21.2
0-253-21163-8,Strange Fruit: Plays on Lynching by American Women,,Indiana University Press,440.0,1998-01-22,,Paperback,"<p>""These lynching dramas may not present the picture that America wants to see of itself, but these visions cannot be ignored because they are grounded—not only in the truth of white racism's toxic effect on our national existence but also in the truth that there exists a contesting, collective response that is part of an on-going and continually building momentum."" —Theaatre Journal</p>
<p>""A unique, powerful collection worthy of high school and college classroom assignment and discussion."" —Bookwatch</p>
<p>This anthology is the first to address the impact of lynching on U.S. theater and culture. By focusing on women’s unique view of lynching, this collection of plays reveals a social history of interracial cooperation between black and white women and an artistic tradition that continues to evolve through the work of African American women artists. Included are plays spanning the period 1916 to 1994 from playwrights such as Angelina Weld Grimke, Georgia Douglas Johnson, Lillian Smith, and Michon Boston.</p>",en,,"Height: 9.21 Inches, Length: 6.14 Inches, Weight: 1.43961857086 Pounds, Width: 0.89 Inches",28.0,https://images.isbndb.com/covers/16/37/9780253211637.jpg,Success,128.0,21.2
0-252-06637-5,Jump at the Sun,"Lowe, John",University of Illinois Press,392.0,1996-12-01,,Paperback,"<p>for The Writer/anthropologist Zora Neale Hurston, Humor Offered A Way Out Of No Way, Helping African American Culture Survive The Harsh Realities Of Life. The Humor In Hurston's Writing Was A Vehicle For Subversive Observations On Intolerable Conditions, Yet It Also Provided A Joyous Commentary On The Paradoxically Creative And Exuberant Folk Culture Of An Oppressed People. John Lowe Explores The Comic Elements Of Hurston's Fiction In The First Book-length Critical Study To Draw On Her Entire Body Of Work. Tracing Connections Between Hurston's Life And The Cultural, Historical, And Literary Events That Affected Her, Lowe Reveals The Sources Of Her Humor And Its Serious Purposes By Using Social Science Humor Theory, American Studies, Feminist Theory, Bakhtin, And Close Readings Of Hurston's Fiction, Nonfiction, Manuscripts, And Letters. Lowe Also Shows How Hurston Balanced Her Levity With A Resonant Cosmic Language Drawn Largely From African And African American Religious Imagery.</p>",en,,"Height: 9 Inches, Length: 6 Inches, Weight: 1.1 Pounds, Width: 0.9 Inches",25.0,https://images.isbndb.com/covers/63/75/9780252066375.jpg,Success,130.0,21.2
0-937404-54-3,Walk Tall! an Exercise Program for the Prevention and Treatment of Osteoporosis,"Meeks, Sara",Triad Pub Co,94.0,1999-06-15,"Posture Disorders, Exercise Therapy, Backache, Osteoporosis, Osteopenia",Paperback,,en,First Edition,"Height: 5.25 Inches, Length: 8.25 Inches, Weight: 0.3 Pounds, Width: 0.25 Inches",16.95,https://images.isbndb.com/covers/45/46/9780937404546.jpg,Success,11.0,21.2
0-896764-03-7,,,,,,,,,,,,,,Error,64.0,21.2
0-252-06601-4,"The Female Economy: The Millinery and Dressmaking Trades, 1860-1930 (Women in American History)","Gamber, Wendy",University of Illinois Press,320.0,1997-04-01,,Paperback,"Hemmed In By Women's Work Much Less Than Has Been Thought, Women In The Late 1800s And Early 1900s Were The Primary Entrepreneurs In The Millinery And Dressmaking Trades. The Female Economy Explores That Lost World Of Women's Dominance, Showing How Independent, Often Ambitious Businesswomen And The Sometimes Imperious Consumers They Served Gradually Vanished From The Scene As Custom Production Gave Way To A Largely Unskilled Modern Garment Industry Controlled By Men. Wendy Gamber Helps Overturn The Portrait Of Wage-earning Women As Docile Souls Who Would Find Fulfillment Only In Marriage And Motherhood. She Combines Labor History, Women's History, Business History, And The History Of Technology While Exploring Topics As Wide-ranging As The History Of Pattern-making And The Relationship Between Entrepreneurship And Marriage.--jacket. 1. Fashion And Independence: Dressmakers And Milliners In The Antebellum City -- Pt. 1. The Female Economy: Proprietors, Workers, And Consumers, Ca. 1860-1910. 2. A Precarious Independence: Female Proprietors In Gilded Age Boston. 3. The Female Aristocracy Of Labor: Workers In The Trades, 1860-1917. 4. The Social Relations Of Consumption: Producers And Consumers In The Era Of Custom Production -- Pt. 2. Gendered Transformations: Toward Mass Production, 1860-1930. 5. A Feminine Skill: Work, Technology, And The Sexual Division Of Labor In The Dressmaking Trade, 1860-1920. 6. Commerce Over Craft: Wholesalers And Retailers In The Millinery Trade, 1860-1930. 7. Engendering Change: The Department Store And The Factory, 1890-1930. Wendy Gamber. Includes Bibliographical References (p. [275]-291) And Index.",en,First Edition,"Height: 9 Inches, Length: 6 Inches, Weight: 1.05 Pounds, Width: 1 Inches",33.0,https://images.isbndb.com/covers/60/16/9780252066016.jpg,Success,130.0,21.2
3 4- 62 047 4,,,,,,,,,,,,,,Error,74.0,21.2
0-500-20218-4,Barbara Hepworth (World of Art) (English and Dutch Edition),"Hammacher, Abraham Marie",Thames & Hudson,216.0,1987-09-14,,Paperback,"Barbara Hepworth died in 1975, after a long illness which had not prevented her from completing the work which many consider to be her masterpiece: The Family of Man. Born in Yorkshire in 1903, of the heroic generation in twentieth-century British art which included Henry Moore (with whom she studied in Leeds) and Ben Nicholson (whom she married), she explored in her sculpture the forms of life - especially human life - as well as those of mathematics. Professor Hammacher has added new material to his study to bring the story up to the time of her death, and has included several new illustrations.",en,Revised,"Height: 8.25 Inches, Length: 6 Inches, Weight: 0.95 Pounds, Width: 0.5 Inches",16.95,https://images.isbndb.com/covers/21/80/9780500202180.jpg,Success,43.0,21.2
0-676-54078-3,Midwives Reading Group Guide,,Vintage Contemporaries,,,,Paperback,,en,,,0.0,https://images.isbndb.com/covers/07/89/9780676540789.jpg,Success,142.0,21.2
