ISBN,Title,Author,Publisher,Pages,Date Published,Subjects,Binding,Synopsis,Language,Edition,Dimensions,MSRP,Image,Status,PageNumber,Volume & Issue
0-933377-47-9,Steering the Craft: Exercises and Discussions on Story Writing for the Lone Navigator or the Mutinous Crew,"Le Guin, Ursula K.",The Eighth Mountain Press,180.0,1998,"Authorship--Problems, exercises, etc, Creative writing--Problems, exercises, etc, Narration (Rhetoric)--Problems, exercises, etc, PN212 .L44 1998, 808/.02",Hardcover,"One Of The Great Writers Of The Twentieth Century Offers An Exhilarating Workout For Writers Of Narrative Fiction Or Nonfiction. With Her Sharp Mind And Wit And A Delightful Sense Of Playfulness, Le Guin Has Turned A Successful Workshop Into A Self-guided Voyage Of Discovery For A Writer Working Alone, A Writing Group, Or A Class. Steering The Craft Is Concerned With The Basic Elements Of Narrative: How A Story Is Told, What Moves It And What Clogs It. This Book Does Not Plod Through Plot, Character, Beginning-middle-and-end. Nor Does It Discuss Writing As Self-expression, As Therapy, Or As Spiritual Adventure. Each Topic Includes Examples That Clarify And Exercises That Intensify Awareness Of The Techniques Of Storytelling. The Sound Of Your Writing -- Punctuation -- Sentence Length And Complex Syntax -- Repetition --adjective And Adverb --subject Pronoun And Verb -- Point Of View And Voice -- Changing Point Of View -- Indirect Narration, Or What Tells -- Crowding And Leaping. Ursula K. Le Guin.",en,,"Height: 8.5 Inches, Length: 5.75 Inches, Weight: 0.85 Pounds, Width: 0.75 Inches",0.0,https://images.isbndb.com/covers/74/79/9780933377479.jpg,Success,44.0,21.2
1-56504-836-9,Bending the Landscape: Fantasy,"Mark Shepherd, Ellen Kushner, Lisa S. Sliverthorne, Simon Sheppard, Robin Wayne Bailey, Jessica Amanda Salmonson, Don Bassingthwaite, Tanya Huff",White Wolf Publishing,384.0,1997-03,,Hardcover,,en,1st White Wolf Omnibus Ed,"Height: 8.5 Inches, Length: 5.5 Inches, Weight: 1.23 Pounds, Width: 1.2 Inches",19.99,https://images.isbndb.com/covers/83/62/9781565048362.jpg,Success,46.0,21.2
1-56906-107-6,The Tree-free,Ronnie Sellers Productions,Ronnie Sellers Productions,,1998,,,,en,,,0.0,https://images.isbndb.com/covers/10/77/9781569061077.jpg,Success,66.0,21.2
0-380-78884-5,To the Summit,"Margo Chisholm, Ray Bruce",Harper Perennial,327.0,1998-04-01,,Paperback,"Margo Chisholm was well past her fortieth birthday when she decided to do something truly extraordinary. Raised in a privileged and protected world of private schools and posh clubs, Margo was a seriously overweight alcoholic with a $1,000 a week cocaine habit when she turned her life around and got clean, sober, and fit. Early in her addictions, she became friends with Jonathan Wright, an accomplished professional photographer and dedicated adventurer and climber who invited Margo to join him on a trek into his beloved Himalayas - a feat Margo knew she was both physically and emotionally incapable of performing. Years later, Jonathan's memory would help sustain her on her quest for a seemingly impossible dream that his life had inspired: to become the first woman in history to scale the highest peak on each of the Earth's seven continents. In 1988, Margo climbed her first two mountains - summiting Mt. Kenya and the awesome, intimidating Mt. Kilimanjaro. An ""ordinary"" middle-aged woman with no formal mountaineering training and no previous experience, she had met and triumphed over the toughest demands and conditions that Nature could provide. But that was just the beginning. Spurred on by her newborn love affair with the world's loftiest peaks and most beautiful and inaccessible places, she pushed herself even further, taking on increasingly greater climbing challenges as she pursued more difficult and dangerous goals under the most harrowing of circumstances. And somewhere along the way - amid magnificent wildernesses of towering pinnacles and breathtaking, ice-covered vistas - Margo Chisholm realized she had reached a summit deep within herself; a place in the heart and soul where she discovered the pride, fulfillment and inner peace she had always longed for.

                        <p>In a story of vast determination, passion, and self-discovery, a woman whose dream is to climb the highest peak on each of the seven continents tells her story through the prism of her own spiritual voyage. 8-page color photo insert. 336 pp. National media publicity. Print ads. 4-city media tour. Web site promo. 56,000 print.
</p>",en,First Soft Cover Edition,"Height: 9.25 Inches, Length: 6 Inches, Weight: 0.85 Pounds, Width: 1 Inches",12.5,https://images.isbndb.com/covers/88/42/9780380788842.jpg,Success,133.0,21.2
1-891257-00-5,,,,,,,,,,,,,,Error,126.0,21.2
0-943219-14-0,Mascaras (Series in Chicana/Latina Studies),,Third Woman Press,200.0,1997-01-01,"American Literature, Hispanic American Authors, History And Criticism, Theory, Etc, Women Authors, Women And Literature, History, Authors, American, Biography, Hispanic American Women, Intellectual Life, Women Authors, American, Hispanic Americans In Literature, Authorship",Paperback,"Mascaras (masks) Brings Together Some Of The Most Talented Contemporary Latina Writers In The United States. These Essays Illuminate The Ways Life And Craft Are Entwined. They Are A Courageous Testament To The Odds Latina Writers Must Overcome To Clear The Space And Achieve A Voice In Our Society. Honest And Open, These Writers Discuss The Historical, Linguistic, Political, Economic, And Cultural Realities That Have Shaped Them As Women And Writers Of Color In The United States. Their Lucid Prose Gives Insight Into The Discipline And Hard Work Necessary To Reclaim, As Michelle Cliff Might Say, An Identity They Taught Us To Despise.--book Jacket. And Are You A Latina Writer? / Judith Ortiz Cofer -- Silence At Bay / Bernice Zamora -- Abundance / Alma Luz Villanueva -- Deracinated : The Writer Re-invents Her Sources / Cecile Pineda -- Depicting Women's Culture In Intaglio : A Novel In Six Stories / Roberta Fernández -- A Dream Of Shadows : Writing, Speaking, Becoming / Marjorie Agosín -- On Language / Mary Helen Ponce -- Only Daughter / Sandra Cisneros -- The Writes Ofrenda / Helena María Viramontes -- A Stain Upon Silence / Gloria Vando -- Yes, Dear Critic, There Really Is An Alicia / Ana Castillo -- The Natural Imperfections Of The Cloth / Angela De Hoyos -- Molcajete Mamas And The Feathered Pens / Naomi Quiñónez -- En Busca De La Fuerza Femenina / Cherríe Moraga -- An Unlikely Beginning For A Writer / Julia Alvarez. Edited By Lucha Corpi. Includes Bibliographical References.",en,,"Height: 8.75 Inches, Length: 5.5 Inches, Weight: 0.65 Pounds, Width: 0.5 Inches",16.95,https://images.isbndb.com/covers/91/41/9780943219141.jpg,Success,115.0,21.2
0-517-70812-4,Slaying the Mermaid: Women and the Culture of Sacrifice,"Golden, Stephanie",Harmony,323.0,1998-06-01,"Women--Psychology, Women--Religious life, Self-sacrifice, HQ1206 .G666 1998, 155.6/33",Hardcover,"Slaying The Mermaid Addresses The Great Numbers Of Women, Of All Ages, Who Find Themselves Constantly Disregarding Their Own Well-being To Put The Needs Of Others First - Even Against Their Will And Contrary To Their Principles - Because They Cannot Face The Guilt They Would Feel If They Didn't. Drawing On Conversations With Experts And A Diverse Array Of Women, Stephanie Golden Examines The Dichotomy Between Selfhood And Sacrifice. Using The Image Of Hans Christian Andersen's Little Mermaid, The Ultimate Ideal Of The Self-sacrificing Woman Who Gave Up Her Voice And Her Life For An Unrequited Love, Golden Offers A New Paradigm For Women: In Order To Run With The Wolves, You Must First Slay The Mermaid. 1. Sacrifice And The Feminine Ideal -- 2. Queen For A Day: The Rewards Of Virtue -- 3. Global Responsibilities -- 4. A Good Woman Is A Sacrificing One -- 5. The Mermaid's Tail -- 6. Disappearing Acts -- 7. Victimhood And Identity -- 8. Pain: False Transcendence -- 9. Sacrifice And Power -- 10. The Lost Side Of Sacrifice: Connection. Stephanie Golden. Includes Bibliographical References (p. [285]-312) And Index.",en,1,"Height: 9.5 Inches, Length: 6.5 Inches, Weight: 1.5 Pounds, Width: 1.25 Inches",25.0,https://images.isbndb.com/covers/81/25/9780517708125.jpg,Success,10.0,21.2
0-380-73147-9,The Kiss,"Harrison, Kathryn",Harper Perennial,224.0,1998-06-01,,Paperback,"<p>We meet at airport. We meet in cities where we've never been before. We meet where no one will recognize us.A ""man of God"" is how someone described my father to me. I don 't remember who. Not my mother. I'm young enough that I take the words to mean he has magical properties and that he is good, better than other people.With his hand under my chin, my father draws my face toward his own. He touches his lips to mine. I stiffen.I am frightened by the kiss. I know it wrong, and its wrongness is what lets me know, too, that it is a secret.</p><h3>Publishers Weekly</h3><p>Few memoirs receive the amount of prepublication hype that surrounds this slim and powerful autobiography by a writer whose lurid, psychologically vivid novels (Exposure, etc.) have portrayed sexual abuse, cruel power games and extreme, self-destructive behavior. Harrison here turns an unflinching eye on the episode in her life that has most influenced those books: a secret, sexual affair with her father that began when she was 20. Not surprisingly, the book is unremittingly novelistic: it unfolds in an impressionistic series of flashbacks and is told in the present tense in prose that is brutally spare and so emotionally numb as to suggest that recounting the affair is for Harrison is the psychological equivalent of reliving it. Abandoned by her father as a child, neglected by an emotionally remote and impetuous mother, Harrison is raised by her grandparents. She retreats at a young age into a complex interior life marked by religious fixations, bouts of anorexia and self-injury, rage at her callous mother and obsession with her absent father. A minister and amateur cameraman, her father visits Harrison after an absence of 10 years, when she is home from college on spring break. The boundary between flirtation and paternal affection is soon blurred, as her father lavishly dotes on her and, in parting, kisses her sexually on the mouth. A relationship of passionate promises, obsessive long-distance phone calls and letters then flourishes, as her father, presented here as ghoulishly predatory, relentlessly draws her into his web. Gradually consenting to his demands for sex, Harrison drops out of college and moves in with her father's new family, extricating herself from the affair only when her mother is stricken with metastatic breast cancer. Throughout the book, Harrison omits names, dates and locations, shrewdly fashioning these dark events into a kind of Old Testament nightmare in which incest is just one of a host of physical trials, from pneumonia to shingles, self-cutting and bulimia. If Harrison sacrifices objectivity in places for a mode of storytelling engineered for maximum shock value, most readers still will find this book remarkable for both the startling events it portrays and the unbridled force of the writing. (Apr.)</p>",en,Reprint,"Height: 8 Inches, Length: 5.25 Inches, Weight: 0.45 Pounds, Width: 0.56 Inches",0.0,https://images.isbndb.com/covers/14/73/9780380731473.jpg,Success,133.0,21.2
0-393-02741-4,Cutting: Understanding and Overcoming Self-Mutilation,"Levenkron, Steven",W W Norton & Co Inc,269.0,1998,,Hardcover,,en,1,"Height: 8.75 Inches, Length: 6 Inches, Weight: 1.01633102782 Pounds, Width: 1 Inches",25.0,https://images.isbndb.com/covers/74/19/9780393027419.jpg,Success,138.0,21.2
0-7043-4437-8,Women & Alcohol: A Private Pleasure or a Public Problem?,"Ettorre, Elizabeth",Womens Pr Ltd,148.0,1998,"Women--Alcohol use, Women alcoholics, Women, Alcoholism, Alcohol Drinking, Women's Health, HV5137 .E88 1997, 362.292082",Paperback,"Women And Alcohol Is A Helpful Book For Women, Their Families And Concerned Friends Who Think They Have An Alcohol Problem. The Book Looks At What Constitutes Problem Drinking And Explores The Possiblities For Recovery And Healing. Elizabeth Ettorre. Includes Index. Bibliography: P. 184-189.",en,,"Height: 8.3 inches, Length: 5.25 inches, Weight: 0.330693393 Pounds, Width: 0.5 inches",20.0,https://images.isbndb.com/covers/43/72/9780704344372.jpg,Success,115.0,21.2
0-04440-986-9,Franklin on Fashion: TV Fashion Expert's A-Z of Fashion,"Franklin, Caryn",Pandora Pr,175.0,1996,,Paperback,,en,,"Height: 9.5 Inches, Length: 6.25 Inches, Weight: 0.96 Pounds, Width: 0.5 Inches",17.95,https://images.isbndb.com/covers/98/61/9780044409861.jpg,Success,127.0,21.2
1-55949-325-9,Sara Steele Book Of Days,Sara Steele,Tide-mark Pr Ltd,60.0,1999,,Hardcover,,en,,,12.95,https://images.isbndb.com/covers/32/53/9781559493253.jpg,Success,63.0,21.2
0-04440-932-X,Making Out: The Book of Lesbian Sex and Sexuality,"Jaugey-Paget, Laurence, Schramm-Evans, Zoe",Pandora Pr,160.0,1995,"Social Sciences, Gender Studies",Paperback,,en,Reissue,"Height: 11.25 Inches, Length: 8.75 Inches, Weight: 1.55 Pounds, Width: 0.75 Inches",24.0,https://images.isbndb.com/covers/93/28/9780044409328.jpg,Success,127.0,21.2
0-679-60303-4,"Pale Horse, Pale Rider (Modern Library)",Katherine Anne Porter,Modern Library,205.0,1998-06-30,,Hardcover,"Pale Horse, Pale Rider comprises three of the Pulitzer Prize-winning author's short novels or long stories, as Porter - who didn't hold with the term ""novella"" - called her pieces. In the masterly ""Noon Wine,"" set on a Texas farm circa 1900, she offers an unforgettable study of evil. According to Reynolds Price the tale ""can stand shoulder to shoulder with anything in Tolstoy or Chekhov."" Both ""Old Mortality"" and the title story center on Porter's fictional counterpart, Miranda: a resilient Southern heroine who, as Mary Gordon observed, is in ""the precarious position of a woman who must earn her way with no one behind her to break fall.""",en,,"Height: 7.75 Inches, Length: 5.25 Inches, Weight: 0.65 Pounds, Width: 0.75 Inches",18.95,https://images.isbndb.com/covers/30/30/9780679603030.jpg,Success,140.0,21.2
0-88974-082-8,Love Ruins Everything,"Tulchinsky, Karen X.","Raincoast Books, Press Gang Publishers",267.0,2002-05-13,"Jewish lesbians, Jewish lesbians--California--San Francisco--Fiction, Gay men, Gay men--British Columbia--Vancouver--Fiction, AIDS (Disease)--Patients, AIDS (Disease)--Patients--British Columbia--Vancouver--Fiction, Jewish lesbians--Fiction, Gay men--Fiction, PR9199.3.T76 L68 1998, 813/.54",Paperback,"[a Story] About Love And Heartbreak, Family Relations, Aids, And So Much More. Romance, Humour And Melodrama Get Caught In The Crossfire, While A Delghtful Cast Of Characters Faces Life, Each In Her Or His Own Way, Ultimately Finding 'the Laugh In Every Tear'.--cover Page 4. By Karen X. Tulchinsky.",en,First Edition,"Height: 8.75 Inches, Length: 5.75 Inches, Weight: 0.7 Pounds, Width: 0.75 Inches",14.95,https://images.isbndb.com/covers/08/22/9780889740822.jpg,Success,113.0,21.2
0-393-04611-7,Mrs. Einstein: A Novel,"McGrail, Anna",W. W. Norton & Company,336.0,1998-06-17,"Einstein, Lieserl , 1902-, Women physicists, Women physicists--Fiction, PR6063.C478 M7 1998, 823/.914",Hardcover,"Out Of Revenge For Being Given Away For Adoption, Einstein's Daughter Works With The Nazis To Outdo Her Father In Physics And Create An Atom Bomb. A Death-bed Confrontation Between Father And Daughter Follows In America. Anna Mcgrail.",en,First Edition,"Height: 8.6 Inches, Length: 5.8 Inches, Weight: 1.15 Pounds, Width: 1.1 Inches",24.95,https://images.isbndb.com/covers/61/13/9780393046113.jpg,Success,138.0,21.2
0-553-47854-0,Do They Hear You When You Cry,"Fauziya Kassindja, Layli Miller Bashir",Random House Audio,,1998,,Audio Cassette,"Fauziya Kassindja's harrowing story begins in Togo, Africa, where she enjoyed a sheltered childhood, shielded by her progressive father from the tribal practice of polygamy and genital mutilation. But when her father died in 1993, Fauziya's life changed dramatically. At age seventeen Fauziya was forced to marry a man she barely knew who already had three wives, and prepare for the tribal ritual of female genital mutilation—a practice that is performed without painkillers or antibiotics. But hours before the ritual was to take place, Fauziya's sister helped her escape to Germany, and from there she traveled to the United States seeking asylum—and freedom. Instead, she was stripped, shackled, and locked up in various INS detention facilities for sixteen months.<br>
<br>
Enter Layli Miller Bashir, a driven twenty-three-year-old law student who took on Fauziya's case. When the two women met, Layli found an emotionally broken, emaciated girl with whom she forged an extraordinary friendship. Putting her heart and soul into Fauziya's case, Layli enlisted help from the American University International Human Rights Clinic. The clinic's acting director, Karen Musalo, an expert in refugee law, assembled a team to fight on Fauziya's behalf. Ultimately, in a landmark decision that has given hope to many seeking asylum on the grounds of gender-based persecution, Fauziya was granted asylum on June 13, 1996.<br>
<br>
Here, for the first time, is Fauziya's dramatic personal story, told in her own words, vividly detailing her life as a young woman in Togo and her nightmarish day-to-day existence in U.S. prisons. It is a story of faith and freedom, courage and inspiration—onethat <br>
you will not soon forget.",en,,4.22 (w) x 7.08 (h) x 1.16 (d),24.95,https://images.isbndb.com/covers/85/49/9780553478549.jpg,Success,71.0,21.2
1-85649-454-3,Promoting Gender Equality At Work: Turning Vision Into Reality for the Twenty-First Century,,Zed Books,288.0,1997-10-15,,Paperback,"Offering a thorough examination of the developments and elements which impact on womens equal participation in the workplace, this book is an invaluable guide to policy and action for the international community, policy-makers, researchers, lobbyists and scholars interested in gender issues. Twelve experienced gender specialists explore the impact of recession, globalization, structural adjustment programmes and economic transition in Eastern Europe on women workers. They also look at a wide variety of micro factors, including legal frameworks and the role of trade unions in promoting equality, sexual harassment at work, AIDS, and wage differentials.<br>",en,,"Height: 8.75 Inches, Length: 5.25 Inches, Weight: 0.65 Pounds, Width: 0.75 Inches",34.0,https://images.isbndb.com/covers/45/40/9781856494540.jpg,Success,122.0,21.2
0-06-101109-6,Do Not Go Gently (Starletta Duvall Mysteries),"Smith-Levin, Judith",HarperCollins,285.0,1996,"Serial Murderers, Policewomen",Paperback,"Tough, black, and beautiful, Starletta Duvall is the best police lieutenant the force has seen in years. But when a serial killer goes haywire and begins mutilating and murdering women who fit Starletta's own profile--successful black professionals--she takes it very personally.",en,First Edition,"Height: 7 Inches, Length: 4.25 Inches, Weight: 0.35 Pounds, Width: 0.75 Inches",5.99,https://images.isbndb.com/covers/10/92/9780061011092.jpg,Success,145.0,21.2
0-571-19922-4,Offseason: A Novel,"Holoch, Naomi",Faber & Faber,231.0,1997,,Hardcover,"A Week Of Erotica In Paris Between Two Lesbians, One Of Whom Is Married. The Married One Is A Writer Who Lives In Paris, The Other Is Her Translator In New York. The Action Begins When The Translator Flies To Paris To Consummate Their Love And To Convince The Other To Leave Her Husband. By Naomi Holoch.",en,,"Height: 8.5 Inches, Length: 6.25 Inches, Width: 1 Inches",23.95,https://images.isbndb.com/covers/92/28/9780571199228.jpg,Success,136.0,21.2
1-891257-02-1,,,,,,,,,,,,,,Error,126.0,21.2
0-688-16067-0,"Proud Spirit: Lessons, Insights & Healing From 'the Voice Of The Spirit World'","Altea, Rosemary",William Morrow Paperbacks,288.0,1998-04-22,,Paperback,"<p><p>rosemary Altea, The Internationally Renowned Medium And Healer Known To Millions Worldwide As The Voice Of The Spirit World, Offered Proof Of Life After Death In <i>the Eagle And The Rose.</i><p><i>proud Spirit</i> (tm) Takes Readers Further Along The Path, Exploring Opportunities For Spiritual Growth In Everyday Life. Rosemary's Storytelling Skills Inspire Us As She Recounts The Time Christ Laid His Hands Atop Her Own As She Gave Healing. Her Spine-tingling Tales Of Being Visited By A Group Of Spirit-world Children And Invited To A Midnight Picnic In A Haunted House Add Awe, Mystery, And Magic To Her Work. Profound Spiritual Truths Emerge&#58; The Need To Know, Value, And Be Gentle With Ourselves, To Be Proud Spirits Who Always Quest For Self-worth And That Which Lies Within.</p> <h3>library Journal</h3> <p>a Tabloid Clairvoyant Regales Us With Tales Of Empowerment From Beyond The Grave.</p>",en,First Edition,"Height: 9.25 Inches, Length: 6.12 Inches, Weight: 0.92 Pounds, Width: 0.65 Inches",11.65,https://images.isbndb.com/covers/06/78/9780688160678.jpg,Success,138.0,21.2
0-87451-857-1,Dear Anne Frank: Poems,"Agosín, Marjorie",Brandeis University Press,154.0,1998-01-15,"Latin American & Caribbean Poetry, Jewish Poetry",Paperback,"Bilingual Edition.<p>In these lyrical tributes to Anne Frank's courage and individualism, Chilean poet Marjorie Agosin captures the wrenching paradox of the young diarist's unshakable love of life, a love which endured unspeakable horrors. In this bilingual collection, first published in 1994, Agosin makes the girl's humanity palpable even as it damns the inhumanity of those who perpetrated the destruction around her.</p>",en,1,"Height: 8.75 Inches, Length: 5.75 Inches, Weight: 0.45 Pounds, Width: 0.5 Inches",17.23,https://images.isbndb.com/covers/85/73/9780874518573.jpg,Success,145.0,21.2
1-57344-034-5,Marianne Faithfull's Cigarette,Gerry Gomez Pearlberg,Cleis Pr,127.0,1998,"Lesbianism, Lesbianism--Poetry, PS3566.E2183 M37 1998, 811/.54",Paperback,"Lesbian kings, movie queens, astronaut boys, poodles to die for, the furious dead and their furious survivors -- all armed and extremely dangerous -- join forces in these smoldering pages where film noir meets Dr. Seuss to set the wor(l)d aflame. In poem after poem, <i>Marianne Faithfull's Cigarette</i> delivers smooth, unfiltered adventure without unnecessary additives...just try and read it without getting hooked.",en,First Edition,"Height: 6.75 Inches, Length: 5.25 Inches, Weight: 0.41005980732 Pounds, Width: 0.5 Inches",1.99,https://images.isbndb.com/covers/03/49/9781573440349.jpg,Success,110.0,21.2
1-880913-23-2,Family Puzzles: A Private Life Made Public,"Weltner, Linda",Publishing/Editing Network,192.0,2000-04-01,,Paperback,"For 15 years, award-winning columnist Linda Weltner has invited readers into her private life through her ""Boston Globe"" column, ""Ever So Humble"". Now for the first time in book form, these weekly first-hand personal accounts, revealing the struggles and joys of Weltner's family relationships as they unfold, are offered in an intimate collection. 6 photos. 176 pp. 10,000 print.",en,First Edition,"Height: 9 Inches, Length: 6.25 Inches, Weight: 0.69 Pounds, Width: 0.5 Inches",13.95,https://images.isbndb.com/covers/32/39/9781880913239.jpg,Success,121.0,21.2
0-8040-1001-3,Ancient Sisterhood: The Lost Traditions of Hagar and Sarah,"Teubal, Savina J.",Swallow Press,270.0,1997-11-30,"Hagar, Sarah, Feminist criticism, BS580.H24 T48 1997, 222/.11092",Paperback,"Savina J. Teubal. Originally Published: Hagar The Egyptian. 1st Ed. San Francisco : Harper & Row, C1990. Includes Bibliographical References (p. 215-220) And Index.",en,Reprint,"Height: 7.99211 Inches, Length: 5.23621 Inches, Weight: 0.73 Pounds, Width: 0.5712587 Inches",26.95,https://images.isbndb.com/covers/00/16/9780804010016.jpg,Success,129.0,21.2
0-7649-0488-4,Cal 99 Mary Cassatt: Modern Women,Pomegranate Publishers,Pomegranate,,1998,,Calendar,,en,,,12.95,https://images.isbndb.com/covers/48/82/9780764904882.jpg,Success,66.0,21.2
0-86358-401-2,Man-Made Language,"Spender, Dale",Pandora Pr,250.0,1990,"Sexism in language, Language and languages--Sex differences, P120.S48 S57 1998, 408",Paperback,"One of the great classics of the women's movement, Man-Made Language opened our eyes to the myriad ways in which the rules and uses of language promote a male, and so inherently partial, view of the world. Often imitated, never replaced, Man-Made Language has become a cornerstone of modern feminist thought.",en,2,"Height: 8.5 Inches, Length: 5.5 Inches, Weight: 0.75 Pounds, Width: 1 Inches",4.56,https://images.isbndb.com/covers/40/15/9780863584015.jpg,Success,127.0,21.2
0-06-098501-1,Black Feathers,"Tan, Cecilia",HarpPeren,295.0,1998-05-06,"Short Story Anthologies, Erotica",Paperback,"In this collection Cecilia Tan blurs the very definition of sexuality and redefines the future of erotic fiction. She delves deep into the world of dark fantasy in a powerful collection of stories that interweave the supernatural and science fiction with the fantasy of daydream; she combines noir erotica at its most potent with startling sensuality to shatter the physical and emotional boundaries of sex. From the critically acclaimed, otherworldly Pearl Diver to The Game, all of Tan's stories celebrate the body and sex, revealing the positive emotions behind even the darkest desires.",en,First Edition,"Height: 8.25 Inches, Length: 5.5 Inches, Weight: 0.5 Pounds, Width: 0.75 Inches",1.99,https://images.isbndb.com/covers/50/11/9780060985011.jpg,Success,137.0,21.2
