ISBN,Title,Author,Publisher,Pages,Date Published,Subjects,Binding,Synopsis,Language,Edition,Dimensions,MSRP,Image,Status,PageNumber,Volume & Issue
0-375-50119-3,Here but Not Here: My Life with William Shawn and the New Yorker,"ROSS, Lillian",Random,240.0,1998,"Ross, Lillian , 1918-2017, Shawn, William, Women journalists, Women journalists--United States--Biography, Periodical editors, Periodical editors--United States--Biography, PN4874.R62 A3 1998, 070/.92 B",Hardcover,"New Yorker writer Lillian Ross tells a love story of the passionate life she shared for forty years with William Shawn, The New Yorker's famous editor. Shawn was married, yet Ross and Shawn created a home together a dozen blocks south of the Shawns' apartment, raised a child, and lived with discretion. Their lives intertwined from the 1950s until Shawn's death, in 1992. Ross describes now they met and the intense connection between them; how Shawn worked with some of the best writers of the period; how, to escape their developing liaison, Ross moved to Hollywood, and there wrote the famous pieces that became Picture, the classic story of the making of a movie - John Huston's The Red Badge of Courdge - only to return to New York and to the relationship.",en,First Edition,Weight: 1 Pounds,1.99,https://images.isbndb.com/covers/11/97/9780375501197.jpg,Success,140.0,21.2
1-85973-916-4,"S/he: Changing Sex and Changing Clothes (Dress, Body, Culture)","Griggs, Claudine",Berg Publishers,184.0,2003-10-01,"Sex change, Transsexuals, Clothing and dress--Psychological aspects, Clothing and dress--Sociological aspects, Transsexuals--Clothing, Costume--Symbolic aspects, Costume--Psychological aspects, Costume--Social aspects, HQ77.9 .G75 1998",Paperback,"1. Mind, Body, And Attributed Gender -- 2. Reframing Self -- 3. Social Recognition Of Gender -- 4. Sexualities And Genders -- 5. Shifting Identities -- 6. Trans-psychosocial Experiences -- 7. Post-transitional Concepts. Claudine Griggs. Includes Bibliographical References (p. 152-153) And Index.",en,First Edition,"Height: 9.21 Inches, Length: 6.1401452 Inches, Weight: 0.55997414548 Pounds, Width: 0.37 Inches",36.95,https://images.isbndb.com/covers/91/67/9781859739167.jpg,Success,123.0,21.2
0-553-10854-9,You Have to Stand for Something or You'll Fall for Anything,"Jones, Star",Bantam,256.0,1998-09-01,,Hardcover,,en,First Edition,"Height: 9.75 Inches, Length: 6.25 Inches, Weight: 1.1 Pounds, Width: 1 Inches",22.95,https://images.isbndb.com/covers/85/45/9780553108545.jpg,Success,134.0,21.2
0-684-84231-9,Our Bodies Ourselves For The New Century,Boston Women's Health Book Collective,Touchstone,784.0,1998-05-04,"Women's Health, Women--psychology, Sexual Behavior, Self Concept, Gynecology, Women--Health and hygiene, Women--Diseases, Women--Psychology, RA778 .N49 1998, RA778 .N67 1998, 1998 H-904, WP 120 B747o 1998, 613/.04244",Paperback,"A Guide To Women's Health, Including Information On Breast Cancer, Aids, Pregnancy And Childbirth, And Medical Practices And Procedures. The Essential Resource On Women's Health And Sexuality Comes Of Age In This Newly Revised And Updated Edition Of A Long Loved Classic. Our Bodies, Ourselves For The New Century Reflects The Vital Health Concerns Of Women Of Diverse Ages, Ethnic And Racial Backgrounds, And Sexual Orientations. In These Pages, Women Will Find New Information, Resources, Including Web Sites, And Personal Support For The Decisions That Will Shape Their Health And Their Lives, From Living A Healthy Life, To Relationships And Sexuality, To Child Bearing, Growing Older, Dealing With The Medical System, And Organizing For Change. This Is A Book For Women Of All Generations To Use, To Rely On, And To Share With Others. The Definitive Consumer Health Reference For Women Of All Ages And Ethnic Groups, This Book Encompasses Such Controversial Issues As Managed Care And The Insurance Industry; Breast Cancer Treatment Options; Recent Developments In Contraception; And Much More. Taking Care Of Ourselves -- Relationships And Sexuality -- Sexual Health And Controlling Our Fertility -- Child-bearing -- Knowledge Is Power. The Boston Women's Health Book Collective. Rev. Ed. Of : Our Bodies, Ourselves, 1984. Includes Bibliographical References And Index.",en,1,"Height: 10.78 Inches, Length: 8.46 Inches, Weight: 3.90659128264 Pounds, Width: 1.57 Inches",24.0,https://images.isbndb.com/covers/23/18/9780684842318.jpg,Success,144.0,21.2
0-684-84613-6,Li'l Mama's Rules: A Novel,"Jackson, Sheneska",Scribner,269.0,1998-05-06,,Paperback,"<p><br>Meet Madison Maguire -- a modern-day heroine to embrace and admire. She's feisty, gorgeous, smart, and savvy; on the surface, she appears to have it all. She's single and loving it, playing the field and sticking to the rules of dating she's learned through life's tough breaks. Madison holds her own as she fends off advances from two-bit actors, old flames, and a secret admirer who is determined to bring love into her life.<P>The rules of the game change, however, when Mr. Right appears on the scene. But just as Madison is ready to follow the proddings of her heart, her life turns upside-down, forcing her to learn a whole new set of rules about love, loss, and trust.</p><h3>Publishers Weekly</h3><p>Thirty-year-old Madison McGuire thinks she knows how to survive the dating game in L.A.'s upper-middle-class African American community. Determined not to be hurt, she scribbles rules in a little pink book. She has dumped her college love, med student Christopher Anzel, for cheating on her and devotes herself to teaching at an all-black private school, insuring a good education for her 14-year-old sister, Serena, afflicted with Tourette's Syndrome. When the jilted Christopher comes to L.A. to open a clinic in Watts, he again declares his love for Madison, and the couple resume a stormy courtship. Then Madison stumbles across the obit of an ex-football celebrity with whom she shared a single night five years ago and discovers that he died of AIDS. Ever responsible, Madison gets herself tested, and the result comes back HIV-positive the same day she accepts Charles's marriage proposal. Now this self-protective ""Lil Mama"" must question how much control any of us really have over our fates. With the honesty and perception she displayed in her first novel, Caught Up in the Rapture, Jackson explores the paradoxical way the shadow of death inspires one woman to open up and trust. It's a solid, unsentimental but uplifting tale with good characterization of fallible people caught in a terrible dilemma. (June)</p>",en,1st Scribner Paperback Fiction Ed,"Height: 8 Inches, Length: 5.25 Inches, Weight: 0.5732018812 Pounds, Width: 0.8 Inches",17.99,https://images.isbndb.com/covers/61/32/9780684846132.jpg,Success,144.0,21.2
0-14-086786-4,Selected Stories of Grace Paley: A Selection,"Paley, Grace",Penguin Audio,,1998-04-01,,Audio Cassette,,en,,"Height: 4.46 Inches, Length: 7.16 Inches, Width: 1.39 Inches",23.95,https://images.isbndb.com/covers/78/62/9780140867862.jpg,Success,72.0,21.2
0-87951-812-X,Dora Holzhandler,"Vann, Philip",Overlook Books,128.0,1997-12-01,"Themes, motivesHolzhandler, Dora , 1928-, Primitivism in art, Primitivism in art--England, ND497.H822 V36 1997, 759.2",Hardcover,Philip Vann. Includes Bibliographical References (p. 123-124) And Index.,en,First Edition,"Height: 11.5 Inches, Length: 9.5 Inches, Weight: 2.15 Pounds, Width: 0.75 Inches",0.0,https://images.isbndb.com/covers/81/27/9780879518127.jpg,Success,47.0,21.2
0-04440-968-0,Stripping in Time: A History of Erotic Dancing,"Jarrett, Lucinda",Rivers Oram Pr,256.0,1997,,Paperback,,en,,"Height: 8.50392 Inches, Length: 5.31495 Inches, Weight: 0.6724098991 Pounds, Width: 0.62992 Inches",17.95,https://images.isbndb.com/covers/96/87/9780044409687.jpg,Success,127.0,21.2
0-316-45808-2,The Estrogen Answer Book: 150 Most-Asked Questions about Hormone Replacement Therapy,"Jacobowitz, Ruth S.","Little, Brown and Company",272.0,1999-01,,Paperback,"The biggest dilemma menopausal women face today is whether to begin hormone replacement therapy. Ruth Jacobowitz, an expert on the physical changes in women's bodies as they grow older, answers 150 questions that women ask most frequently about estrogen. A straightforward, easy-to-read overview of what women need to make a decision about hormone replacement therapy.

                        <p>""...an expert on the physical changes in women's bodies as they grow older answers questions such as ""Does every woman need to take estrogen?"" ""What happens when you stop?"" ...addresses new studies, concerns &amp; benefits.""
</p>",en,1,"Height: 8.5 Inches, Length: 6 Inches, Weight: 0.000625 Pounds, Width: 0.75 Inches",12.0,https://images.isbndb.com/covers/80/85/9780316458085.jpg,Success,137.0,21.2
0-415-16400-1,Feminist Critique of Language: second edition (World and Word),"Cameron, Deborah",Routledge,388.0,1998-03-12,"Language and languages--Sex differences, Sexism in language, Women--Language, P120.S48 F46 1998, 408/.2",Paperback,"<p><em>The Feminist Critique of Language</em> provides a wide-ranging selection of writings on language, gender, and feminist thought. It serves both as a guide to the current debates and directions and as a digest of the history of twentieth-century feminist ideas about language.</p>
<p>This edition includes extracts from Felly Nkweto Simmonds, Trinh T. Minh-ha, Luce Irigaray, Sara Mills, Margaret Doyle, Debbie Cameron, Susan Ehrlich, Ruth King, Kate Clark, Sally McConnell-Ginet, Deborah Tannen, Aki Uchida, Jennifer Coates and Kira Hall.</p>",en,1,"Height: 9.69 Inches, Length: 6.85 Inches, Weight: 1.5983513995 Pounds, Width: 0.88 Inches",63.95,https://images.isbndb.com/covers/40/09/9780415164009.jpg,Success,142.0,21.2
1-55949-321-6,Sara Steele Address Book,Sara Steele,Tide-mark Pr Ltd,,1999,,Hardcover,,en,,,14.95,https://images.isbndb.com/covers/32/15/9781559493215.jpg,Success,63.0,21.2
1-57601-031-7,If I Had My Life to Live Over - Petite,"Martz, Sandra",Papier-Mache Press,64.0,2007-07-01,,Hardcover,,en,First Edition,"Height: 5 Inches, Length: 6.5 Inches, Weight: 0.18077905484 Pounds, Width: 0.5 Inches",6.95,https://images.isbndb.com/covers/03/10/9781576010310.jpg,Success,49.0,21.2
1-57601-031-7,If I Had My Life to Live Over - Petite,"Martz, Sandra",Papier-Mache Press,64.0,2007-07-01,,Hardcover,,en,First Edition,"Height: 5 Inches, Length: 6.5 Inches, Weight: 0.18077905484 Pounds, Width: 0.5 Inches",6.95,https://images.isbndb.com/covers/03/10/9781576010310.jpg,Success,112.0,21.2
1-891257-01-3,,,,,,,,,,,,,,Error,126.0,21.2
0-520-20955-9,Sex Seen: The Emergence of Modern Sexuality in America,"Ullman, Sharon R.",University of California Press,200.0,1998-04-30,"Sex customs--History, Sex customs--United States--History--20th century, Sexual ethics--History, Sexual ethics--United States--History--20th century, Sex--history, Sexuality--history, Morals--history, HQ18.U5 U44 1997, 306.7/0973",Paperback,"<p><i>Sex Seen</i> provides a complex and intriguing account of the changes that have taken place in the social construction of sexuality during the past century. Focusing on Sacramento, California, at the dawn of the twentieth century, Sharon Ullman juxtaposes early cinema, vaudeville performances, and popular newspapers and magazines with insights drawn from close interpretations of transcripts from Sacramento court cases. She demonstrates how attitudes that emerged in the popular discourse—ideas about gender roles, female desire, prostitution, divorce, and homosexuality—often found complex and contradictory expression in the courts. As judges, prosecutors, defense attorneys, and juries all weighed in with differing opinions, the courtroom itself became a site of multiple discourses that attempted to make sense of a growing sexual chaos.<br>
In tracing the birth of modern sexuality, Ullman chronicles the dynamics of social change during a unique cultural moment and explains the shifts in the sexual ethos of turn-of-the-century America.<br>
<br>
Instead of telling the familiar story of steadily increasing liberation of sexual urges, Ullman chronicles the complex confusions and negotiations of an increasingly public sexual discourse. She relates how laws against cross-dressing gained force at the same time that female impersonation became popular in vaudeville acts, how images of prostitutes were changed by the commercialization of the female body in advertising and film, and how visible expression of female desire was submerged in rape and divorce proceedings.<br>
 Ullman blends social history, textual analysis, and film and performance criticism to explain how sexuality and desire became an essential part of personal identity in this century. Her keen, accessible account of a community on the brink of the modern era offers a provocative interpretation of the seeds of our sexual present.</p>",en,First Edition,"Height: 9 Inches, Length: 6 Inches, Weight: 0.70106999316 Pounds, Width: 0.6 Inches",25.87,https://images.isbndb.com/covers/95/58/9780520209558.jpg,Success,130.0,21.2
0-7649-0552-X,Cal 99 Women Who Dare Engagement Calendar,Library of Congress,Pomegranate,,1998,Comics & Graphic Novels,Calendar,,en,,,13.95,https://images.isbndb.com/covers/55/20/9780764905520.jpg,Success,66.0,21.2
0-8133-1827-0,Without Apology: Andrea Dworkin's Art And Politics,"Jenefsky, Cindy",Routledge,176.0,1999-01-01,,Paperback,,en,1,,39.95,https://images.isbndb.com/covers/82/71/9780813318271.jpg,Success,137.0,21.2
0-8021-1633-7,Cereus Blooms at Night,"Mootoo, Shani",Grove Pr,249.0,1998,,Hardcover,,en,First Edition,"Height: 8.75 Inches, Length: 6 Inches, Weight: 0.7 Pounds, Width: 1 Inches",23.0,https://images.isbndb.com/covers/63/38/9780802116338.jpg,Success,136.0,21.2
0-14-058893-0,Floricanto Si!: A Collection of Latina Poetry,,Penguin Books,304.0,1998-04-01,"American poetry--Hispanic American authors, Hispanic American women, Hispanic American women--Poetry, American poetry, American poetry--20th century, Hispanic Americans, Hispanic Americans--Poetry, PS591.H58 F58 1998, 811/.54080868",Mass Market Paperback,"Floricanto Si! Combines The Poetry Of Such Major Literary Figures As Sandra Cisneros, Julia Alvarez, And Ana Castillo, With The Work Of A Second Generation Of Post-chicano Movement Poets Whose Startlingly Original Voices Are Just Being Discovered. The 47 Contributors Hail From The U.s., From New York To North Dakota. This Is A Stunning Collections That Interprets America To Itself In New Ways. Introduction / Bryce Milligan -- Teresa Palomo Acosta -- Marjorie Agosin -- Julia Alvarez -- Gloria Anzaldua -- Miriam Bornstein -- Giannina Braschi, Translation By Tesso'dwyer -- Norma E. Cantu -- Ana Castillo -- Rosemary Catacalos -- Lorna Dee Cervantes - Lisa Chavez -- Sandra Cisneros -- Judith Ortiz Coffer -- Lucha Corpi, Translation By Catherine Rodriguez-nieto -- Silvia Curbelo -- Angela De Hoyas -- Rosario Ferre -- Alicia Galvan -- Victoria Garcia-galaviz -- Alicia Gaspar De Alba -- Celeste Guzman -- Sheila Sanchez Hatch -- Maya Islas -- Maria Limon -- Rita Magdeleno -- Demetria Martinez -- Pat Mora -- Elvia Padilla -- Anabella Paiz -- Deborah Paredez -- Teresinka Pereira -- Ceceile Pineda -- Pina Pipino -- Nicole Pollentier -- Beatriz Rivera -- Eliana Suarez Rivero -- Carmen Gimenez Rosello -- Beverly Sanchez-padilla -- Raquel Valle Senties -- Carmen Tafolla -- Sheila Ortiz Taylor -- Gina Valdes -- Gloria Vando -- Enedina Casarez Vasquez -- Evangelina Vigil-pinon -- Alma Luz Villaneuva -- Bernice Zamora. Edited By Bryce Milligan, Mary Guerrero Milligan, Angela De Hoyos. Includes Bibliographical References.",en,,"Height: 7.74 Inches, Length: 5 Inches, Weight: 0.55 Pounds, Width: 0.66 Inches",16.0,https://images.isbndb.com/covers/89/34/9780140588934.jpg,Success,139.0,21.2
0-8153-2734-X,"Writings on Black Women of the Diaspora: History, Language, and Identity (Crosscurrents in African American History)","Bracks, Lean'tin",Routledge,152.0,1997,"United States History - African American History, African American History, African Diaspora History, Social Sciences - General & Miscellaneous, African American Arts & Entertainment, American & Canadian Literature, Latinos & Latin Americans, United State",Hardcover,"Toni Morrison, Alice Walker, Paule Marshall, and Mary Prince represent the best of African American women writers who draw on the tortuous legacy of their people as a source for their art, revealing and defining themselves as they create compelling narratives that illuminate their roots, their heritage, and their unique culture. The themes that suffuse their writing are family, community, strong women, cultural memory, oral history, and slavery. By analyzing the works of these four remarkable writers, the study shows how today's black woman can take control of her destiny by coming to grips with an obscured and distorted past. These original essays articulate the way in which historical awareness, sensitivity to language, and an understanding of stereotypes can empower enduring artistic visions in a world that is largely indifferent to marginal voices.",en,1,"Height: 8.71 Inches, Length: 5.64 Inches, Weight: 24.55067749632 Pounds, Width: 0.62 Inches",224.5,https://images.isbndb.com/covers/73/49/9780815327349.jpg,Success,122.0,21.2
1-55583-427-2,Beginnings: Lesbians Talk About the First Time They Met Their Long-Term Partner,,Alyson Books,200.0,1997-01-01,"Lesbian couples, Lesbian couples--United States, Mate selection, Mate selection--United States, HQ75.6.U5 B44 1998, 306.76/63",Paperback,"Lesbians describe the first time they met their long-term partner, detailing initial adventures that range from the wild to the mundane, from hilarious comedy-of-errors encounters to near-spiritual minglings of the soul. Whether meeting for the first time in a Laundromat or on a blind date, in a bar or at a parent-teacher conference, the women who tell their stories in this collection point up several important life lessons: that first impressions are not necessarily accurate, that romance can often come quite unexpectedly, and that a beginning frequently marks the end of a long, long search.",en,First Edition,"Height: 8.5 Inches, Length: 5.75 Inches, Weight: 0.4850169764 Pounds, Width: 0.5 Inches",1.99,https://images.isbndb.com/covers/42/72/9781555834272.jpg,Success,118.0,21.2
0-04440-938-9,Lives Worth Living: Women's Experiences of Chronic Illness,"Marris, Veronica",Pandora Pr,231.0,1996,"Chronic diseases--Psychological aspects, Chronic diseases--Social aspects, Quality of life, Women--Health and hygiene, RA644.5 .M376 1996, 616/.044/082",Paperback,"In this challenging and informative book, Veronica Marris, who was diagnosed as diabetic in her twenties, has interviewed many women with a range of illnesses and medical conditions–including arthritis, asthma, cancer, diabetes, epilepsy, heart disease, HIV/AIDS, lupus, ME, multiple sclerosis, sickle cell anemia, and thyroid disease.
<p>Marris uncovers many concerns and problems common to these different women, who struggle with disabling illnesses as well as with a society and a medical profession often unwilling or unable to recognize their needs of their worth. Many speak of the naiveté or ignorance of friends and family, of the pressure of being seen to be coping, of being blamed for their illness, and of being thought pushy or bitter when they fight for what they deserve.</p>
<p> This account of the humor, intelligence, and courage women bring to bear on the obstacles in their way offers others the comfort and strength of knowing they are not alone.</p>",en,2nd edition,"Height: 8.75 Inches, Length: 6 Inches, Weight: 0.57540650382 Pounds, Width: 0.75 Inches",14.0,https://images.isbndb.com/covers/93/80/9780044409380.jpg,Success,127.0,21.2
0-937404-38-1,Stand Tall! Every Woman's Guide to Preventing and Treating Osteoporosis,Morris Notelovitz,Triad Pub Co,238.0,1998-07-15,,Hardcover,,en,2,"Height: 9.5 Inches, Length: 6.75 Inches, Weight: 1.10010668738 Pounds, Width: 1.25 Inches",24.95,https://images.isbndb.com/covers/43/86/9780937404386.jpg,Success,11.0,21.2
0 90 5-8 42 4,,,,,,,,,,,,,,Error,86.0,21.2
1-55811-598-6,Cal 99 On Our Own Terms,Unknown,Golden Turtle,,1998,,Calendar,,en,,,11.99,https://images.isbndb.com/covers/59/89/9781558115989.jpg,Success,65.0,21.2
0-452-15576-2,Le Divorce Reading Group Guide,Diane Johnson,Plume Books,,1998,,Paperback,,en,,,0.0,https://images.isbndb.com/covers/57/63/9780452155763.jpg,Success,139.0,21.2
0-87417-313-2,The House On Breakaheart Road: Poems (Western Literature and Fiction Series),"Pahmeier, Gailmarie",University of Nevada Press,72.0,1998-03-01,"Poetry, American",Paperback,,en,1,"Height: 8.5 Inches, Length: 5.5 Inches, Weight: 0.73413933246 Pounds, Width: 0.4 Inches",12.0,https://images.isbndb.com/covers/31/30/9780874173130.jpg,Success,131.0,21.2
1-57886-001-6,Queen of the Negro Leagues : Effa Manley and the Newark Eagles (American Sports History Series),"Overmyer, James",Scarecrow Press,298.0,1998-01-26,,Paperback,"<p>The first woman inducted into the Baseball Hall of Fame, there was no one like Effa Manley in the sports world of the 1930s and 1940s. She was a sophisticated woman who owned a baseball team. She never shrank from going head to head with men, who dominated the ranks of sports executives and considered sports their exclusive domain. That her life story has remained unchronicled can only be attributed to one thing: her team, the Newark Eagles, belonged to the Negro Baseball League. This book furthers a growing awareness of black baseball before integration and profiles many of the other highly-competitive owners in the Negro league. It also describes a thriving black community in Newark that took the Newark Eagles into their hearts, creating a fascinating relationship between a community and their sports team. This book was the first to draw extensively on Eagle team records, left behind by Mrs. Manley when she left Newark in the 1950s, and rediscovered nearly intact thirty-five years later. The files are the most comprehensive source of information about the Newark Eagles. They reconstruct the relationship between the baseball team and the community to an extent never thought to be possible. Also included is material from Mrs. Manley's scrapbook chronicling her days as a baseball owner and an active home front volunteer during World War II. Her scrapbook is now part of the collection of the National Baseball Hall of Fame. This important work shines the spotlight on a previously unsung segment of baseball history. Originally published in cloth as Effa Manley and the Newark Eagles, No. 1 in the American Sports History Series. Reviews of the Original Edition: ""...a book that speaks volumes about the history of all of us who grew up in Newark at a time when the city stood for something very different. It's a dandy read."" —NEWARK STAR-LEDGER ""...the story of a dynamic woman who, with her husband, owned the New Jersey team in the Negro National League.... Recommended."" —LIB</p>",en,New Edition,"Height: 8.46 Inches, Length: 5.4 Inches, Weight: 0.89066753848 Pounds, Width: 0.71 Inches",40.0,https://images.isbndb.com/covers/00/12/9781578860012.jpg,Success,121.0,21.2
1-58005-003-4,Exit to Reality: A Novel,"Forbes, Edith",Seal Press,320.0,1998-04-10,,Paperback,,en,,"Height: 8.75 Inches, Length: 5.75 Inches, Weight: 0.75 Pounds, Width: 1 Inches",12.0,https://images.isbndb.com/covers/00/36/9781580050036.jpg,Success,46.0,21.2
